number,value,datetime_start,datetime_complete,duration,params_algorithm,params_filter_criteria,params_filter_threshold,params_k,state
4578,0.28749765072543176,2025-03-03 19:50:01.122527,2025-03-03 19:50:01.436285,0 days 00:00:00.313758,kmeans,abundance,2.5,2,COMPLETE
4579,0.39620841726074546,2025-03-03 19:50:01.438281,2025-03-03 19:50:01.769594,0 days 00:00:00.331313,gaussian_mixture,abundance,2.4000000000000004,2,COMPLETE
4580,0.46148363394002595,2025-03-03 19:50:01.771632,2025-03-03 19:50:02.109181,0 days 00:00:00.337549,gaussian_mixture,abundance,2.4000000000000004,2,COMPLETE
4581,0.6991662380781591,2025-03-03 19:50:02.110690,2025-03-03 19:50:02.473719,0 days 00:00:00.363029,gaussian_mixture,abundance,2.3000000000000003,2,COMPLETE
4582,0.6595412340406492,2025-03-03 19:50:02.476716,2025-03-03 19:50:02.872647,0 days 00:00:00.395931,gaussian_mixture,abundance,2.35,2,COMPLETE
4583,0.4689051983639301,2025-03-03 19:50:02.876636,2025-03-03 19:50:03.239005,0 days 00:00:00.362369,gaussian_mixture,abundance,2.3000000000000003,2,COMPLETE
4584,0.5563327775105513,2025-03-03 19:50:03.242516,2025-03-03 19:50:03.598884,0 days 00:00:00.356368,gaussian_mixture,abundance,2.4000000000000004,2,COMPLETE
4585,0.6526839901994146,2025-03-03 19:50:03.601660,2025-03-03 19:50:04.002327,0 days 00:00:00.400667,gaussian_mixture,abundance,2.35,2,COMPLETE
4586,0.46333090117618303,2025-03-03 19:50:04.004334,2025-03-03 19:50:04.344039,0 days 00:00:00.339705,gaussian_mixture,abundance,2.3000000000000003,2,COMPLETE
4587,0.6584188256982936,2025-03-03 19:50:04.346042,2025-03-03 19:50:04.669491,0 days 00:00:00.323449,gaussian_mixture,abundance,2.5500000000000003,2,COMPLETE
4588,0.6595412340406492,2025-03-03 19:50:04.672522,2025-03-03 19:50:05.001234,0 days 00:00:00.328712,gaussian_mixture,abundance,2.4000000000000004,2,COMPLETE
4589,0.4540028441591021,2025-03-03 19:50:05.003748,2025-03-03 19:50:05.367452,0 days 00:00:00.363704,gaussian_mixture,abundance,2.5,2,COMPLETE
4590,0.4457279778396691,2025-03-03 19:50:05.369447,2025-03-03 19:50:05.705549,0 days 00:00:00.336102,gaussian_mixture,abundance,2.35,2,COMPLETE
4591,-0.005029132086863436,2025-03-03 19:50:05.707558,2025-03-03 19:50:07.303050,0 days 00:00:01.595492,gaussian_mixture,presence,10.0,2,COMPLETE
4592,0.5477894489394328,2025-03-03 19:50:07.306058,2025-03-03 19:50:07.627892,0 days 00:00:00.321834,gaussian_mixture,abundance,2.3000000000000003,2,COMPLETE
4593,0.4425366690065375,2025-03-03 19:50:07.629906,2025-03-03 19:50:07.947079,0 days 00:00:00.317173,gaussian_mixture,abundance,2.45,2,COMPLETE
4594,0.36288555082789065,2025-03-03 19:50:07.950080,2025-03-03 19:50:08.277572,0 days 00:00:00.327492,gaussian_mixture,abundance,2.3000000000000003,2,COMPLETE
4595,0.4975247399831524,2025-03-03 19:50:08.280575,2025-03-03 19:50:08.667655,0 days 00:00:00.387080,gaussian_mixture,abundance,0.5,2,COMPLETE
4596,0.3237085708235997,2025-03-03 19:50:08.669651,2025-03-03 19:50:09.001433,0 days 00:00:00.331782,gaussian_mixture,abundance,2.45,5,COMPLETE
4597,0.47136455455012555,2025-03-03 19:50:09.002945,2025-03-03 19:50:09.316017,0 days 00:00:00.313072,kmeans,abundance,2.5,2,COMPLETE
4598,0.518361976373298,2025-03-03 19:50:09.317015,2025-03-03 19:50:09.642171,0 days 00:00:00.325156,gaussian_mixture,abundance,2.35,4,COMPLETE
4599,0.5134216412232634,2025-03-03 19:50:09.644182,2025-03-03 19:50:09.964602,0 days 00:00:00.320420,gaussian_mixture,abundance,2.3000000000000003,2,COMPLETE
4600,0.4724893973939109,2025-03-03 19:50:09.967606,2025-03-03 19:50:10.294780,0 days 00:00:00.327174,gaussian_mixture,abundance,2.4000000000000004,2,COMPLETE
4601,0.3723005193844776,2025-03-03 19:50:10.298068,2025-03-03 19:50:10.616442,0 days 00:00:00.318374,gaussian_mixture,abundance,2.3000000000000003,2,COMPLETE
4602,0.5336397563540654,2025-03-03 19:50:10.618445,2025-03-03 19:50:10.942977,0 days 00:00:00.324532,gaussian_mixture,abundance,2.35,2,COMPLETE
4603,0.5296597712096573,2025-03-03 19:50:10.944986,2025-03-03 19:50:11.263960,0 days 00:00:00.318974,gaussian_mixture,abundance,2.4000000000000004,2,COMPLETE
4604,0.27190512455266724,2025-03-03 19:50:11.266971,2025-03-03 19:50:11.586315,0 days 00:00:00.319344,gaussian_mixture,abundance,2.25,2,COMPLETE
4605,0.5396575737691245,2025-03-03 19:50:11.588320,2025-03-03 19:50:11.907366,0 days 00:00:00.319046,gaussian_mixture,abundance,2.45,2,COMPLETE
4606,0.47064774134266774,2025-03-03 19:50:11.909373,2025-03-03 19:50:12.225167,0 days 00:00:00.315794,gaussian_mixture,abundance,2.35,2,COMPLETE
4607,0.13611285135609458,2025-03-03 19:50:12.227188,2025-03-03 19:50:12.549547,0 days 00:00:00.322359,gaussian_mixture,abundance,2.4000000000000004,2,COMPLETE
4608,0.5045552904461232,2025-03-03 19:50:12.551641,2025-03-03 19:50:12.867513,0 days 00:00:00.315872,gaussian_mixture,abundance,2.5500000000000003,2,COMPLETE
4609,0.015109037859426504,2025-03-03 19:50:12.869522,2025-03-03 19:50:14.359567,0 days 00:00:01.490045,gaussian_mixture,presence,10.0,2,COMPLETE
4610,0.5576892947115988,2025-03-03 19:50:14.362812,2025-03-03 19:50:14.715545,0 days 00:00:00.352733,gaussian_mixture,abundance,2.3000000000000003,2,COMPLETE
4611,0.43663936884676674,2025-03-03 19:50:14.719074,2025-03-03 19:50:15.049054,0 days 00:00:00.329980,gaussian_mixture,abundance,2.3000000000000003,2,COMPLETE
4612,0.6229400435366252,2025-03-03 19:50:15.051583,2025-03-03 19:50:15.396192,0 days 00:00:00.344609,gaussian_mixture,abundance,2.25,3,COMPLETE
4613,0.5767385668903693,2025-03-03 19:50:15.399208,2025-03-03 19:50:15.739374,0 days 00:00:00.340166,gaussian_mixture,abundance,2.35,2,COMPLETE
4614,0.4631532921698276,2025-03-03 19:50:15.741890,2025-03-03 19:50:16.082622,0 days 00:00:00.340732,gaussian_mixture,abundance,1.7000000000000002,2,COMPLETE
4615,0.34300047644913684,2025-03-03 19:50:16.084628,2025-03-03 19:50:16.393055,0 days 00:00:00.308427,kmeans,abundance,2.45,2,COMPLETE
4616,0.46114539127261445,2025-03-03 19:50:16.395074,2025-03-03 19:50:16.728288,0 days 00:00:00.333214,gaussian_mixture,abundance,2.4000000000000004,2,COMPLETE
4617,0.5171740049356446,2025-03-03 19:50:16.731483,2025-03-03 19:50:17.088558,0 days 00:00:00.357075,gaussian_mixture,abundance,2.3000000000000003,2,COMPLETE
4618,0.3792559594272903,2025-03-03 19:50:17.089555,2025-03-03 19:50:17.466536,0 days 00:00:00.376981,gaussian_mixture,abundance,0.30000000000000004,2,COMPLETE
4619,0.3587060526630546,2025-03-03 19:50:17.469535,2025-03-03 19:50:17.792618,0 days 00:00:00.323083,gaussian_mixture,abundance,2.25,2,COMPLETE
4620,0.5220426377982679,2025-03-03 19:50:17.794638,2025-03-03 19:50:18.109817,0 days 00:00:00.315179,gaussian_mixture,abundance,2.35,2,COMPLETE
4621,0.43081068582018833,2025-03-03 19:50:18.111849,2025-03-03 19:50:18.432672,0 days 00:00:00.320823,gaussian_mixture,abundance,2.45,2,COMPLETE
4622,0.45313500051060984,2025-03-03 19:50:18.434670,2025-03-03 19:50:18.756067,0 days 00:00:00.321397,gaussian_mixture,abundance,1.85,2,COMPLETE
4623,0.39180723482359725,2025-03-03 19:50:18.758068,2025-03-03 19:50:19.101678,0 days 00:00:00.343610,gaussian_mixture,abundance,2.25,2,COMPLETE
4624,0.580390997927891,2025-03-03 19:50:19.103188,2025-03-03 19:50:19.431908,0 days 00:00:00.328720,gaussian_mixture,abundance,2.5,2,COMPLETE
4625,0.6119453133354623,2025-03-03 19:50:19.434012,2025-03-03 19:50:19.771607,0 days 00:00:00.337595,gaussian_mixture,abundance,2.25,2,COMPLETE
4626,0.4173179229463012,2025-03-03 19:50:19.772614,2025-03-03 19:50:20.107684,0 days 00:00:00.335070,gaussian_mixture,abundance,2.35,2,COMPLETE
4627,0.4697369441643923,2025-03-03 19:50:20.109684,2025-03-03 19:50:20.457480,0 days 00:00:00.347796,gaussian_mixture,abundance,1.1,2,COMPLETE
4628,0.06793771192728698,2025-03-03 19:50:20.459478,2025-03-03 19:50:21.932517,0 days 00:00:01.473039,gaussian_mixture,presence,65.0,2,COMPLETE
4629,0.31239377861470996,2025-03-03 19:50:21.934518,2025-03-03 19:50:22.278578,0 days 00:00:00.344060,gaussian_mixture,abundance,2.4000000000000004,2,COMPLETE
4630,0.43663936884676674,2025-03-03 19:50:22.281600,2025-03-03 19:50:22.650844,0 days 00:00:00.369244,gaussian_mixture,abundance,2.25,2,COMPLETE
4631,0.7065810548214945,2025-03-03 19:50:22.651858,2025-03-03 19:50:22.974837,0 days 00:00:00.322979,gaussian_mixture,abundance,1.85,2,COMPLETE
4632,0.6154219408143303,2025-03-03 19:50:22.976843,2025-03-03 19:50:23.323005,0 days 00:00:00.346162,gaussian_mixture,abundance,2.3000000000000003,2,COMPLETE
4633,0.6555877495959652,2025-03-03 19:50:23.325013,2025-03-03 19:50:23.645381,0 days 00:00:00.320368,gaussian_mixture,abundance,2.45,2,COMPLETE
4634,0.41323782216863075,2025-03-03 19:50:23.648384,2025-03-03 19:50:23.968623,0 days 00:00:00.320239,gaussian_mixture,abundance,2.3000000000000003,2,COMPLETE
4635,0.5557408607018414,2025-03-03 19:50:23.970631,2025-03-03 19:50:24.283011,0 days 00:00:00.312380,kmeans,abundance,2.35,2,COMPLETE
4636,0.3646052733696587,2025-03-03 19:50:24.286032,2025-03-03 19:50:24.638914,0 days 00:00:00.352882,gaussian_mixture,abundance,2.5,2,COMPLETE
4637,0.557342409792011,2025-03-03 19:50:24.640934,2025-03-03 19:50:25.014606,0 days 00:00:00.373672,gaussian_mixture,abundance,1.9500000000000002,2,COMPLETE
4638,0.4065724973718239,2025-03-03 19:50:25.018599,2025-03-03 19:50:25.415574,0 days 00:00:00.396975,gaussian_mixture,abundance,2.6,2,COMPLETE
4639,0.5691169393529935,2025-03-03 19:50:25.417576,2025-03-03 19:50:25.765604,0 days 00:00:00.348028,gaussian_mixture,abundance,2.25,2,COMPLETE
4640,0.35863111095344524,2025-03-03 19:50:25.768600,2025-03-03 19:50:26.109918,0 days 00:00:00.341318,gaussian_mixture,abundance,2.35,2,COMPLETE
4641,0.6102723858787025,2025-03-03 19:50:26.112943,2025-03-03 19:50:26.453256,0 days 00:00:00.340313,gaussian_mixture,abundance,2.4000000000000004,2,COMPLETE
4642,0.5883002885292854,2025-03-03 19:50:26.455265,2025-03-03 19:50:26.801386,0 days 00:00:00.346121,gaussian_mixture,abundance,2.25,2,COMPLETE
4643,0.28465640235070744,2025-03-03 19:50:26.803045,2025-03-03 19:50:27.139165,0 days 00:00:00.336120,gaussian_mixture,abundance,2.3000000000000003,2,COMPLETE
4644,0.5171740049356446,2025-03-03 19:50:27.142214,2025-03-03 19:50:27.496387,0 days 00:00:00.354173,gaussian_mixture,abundance,2.4000000000000004,2,COMPLETE
4645,0.6997070428222841,2025-03-03 19:50:27.499374,2025-03-03 19:50:27.840953,0 days 00:00:00.341579,gaussian_mixture,abundance,2.45,2,COMPLETE
4646,0.5727914334314612,2025-03-03 19:50:27.842743,2025-03-03 19:50:28.182578,0 days 00:00:00.339835,gaussian_mixture,abundance,1.9500000000000002,2,COMPLETE
4647,0.018812470919744327,2025-03-03 19:50:28.185956,2025-03-03 19:50:29.698609,0 days 00:00:01.512653,gaussian_mixture,presence,10.0,2,COMPLETE
4648,0.5410874158510521,2025-03-03 19:50:29.701099,2025-03-03 19:50:30.025611,0 days 00:00:00.324512,gaussian_mixture,abundance,2.3000000000000003,2,COMPLETE
4649,0.5828722741285535,2025-03-03 19:50:30.027611,2025-03-03 19:50:30.352815,0 days 00:00:00.325204,gaussian_mixture,abundance,2.35,3,COMPLETE
4650,0.7500141934178032,2025-03-03 19:50:30.354814,2025-03-03 19:50:30.704588,0 days 00:00:00.349774,gaussian_mixture,abundance,1.75,2,COMPLETE
4651,0.6936484830170256,2025-03-03 19:50:30.706583,2025-03-03 19:50:31.239761,0 days 00:00:00.533178,gaussian_mixture,abundance,1.7000000000000002,2,COMPLETE
4652,0.3768306353155547,2025-03-03 19:50:31.242909,2025-03-03 19:50:31.651533,0 days 00:00:00.408624,gaussian_mixture,abundance,1.85,2,COMPLETE
4653,0.297522875719875,2025-03-03 19:50:31.654547,2025-03-03 19:50:32.065802,0 days 00:00:00.411255,kmeans,abundance,1.8,2,COMPLETE
4654,0.4657134416880182,2025-03-03 19:50:32.068797,2025-03-03 19:50:32.478552,0 days 00:00:00.409755,gaussian_mixture,abundance,1.9500000000000002,2,COMPLETE
4655,0.6326765768711547,2025-03-03 19:50:32.481583,2025-03-03 19:50:32.875489,0 days 00:00:00.393906,gaussian_mixture,abundance,1.9500000000000002,2,COMPLETE
4656,0.5366597279496125,2025-03-03 19:50:32.878488,2025-03-03 19:50:33.326767,0 days 00:00:00.448279,gaussian_mixture,abundance,1.8,2,COMPLETE
4657,0.45524716893031447,2025-03-03 19:50:33.332840,2025-03-03 19:50:33.749477,0 days 00:00:00.416637,gaussian_mixture,abundance,1.9000000000000001,2,COMPLETE
4658,0.45614317045298164,2025-03-03 19:50:33.751545,2025-03-03 19:50:34.173974,0 days 00:00:00.422429,gaussian_mixture,abundance,2.0,2,COMPLETE
4659,0.5512216719201627,2025-03-03 19:50:34.175976,2025-03-03 19:50:34.541903,0 days 00:00:00.365927,gaussian_mixture,abundance,1.75,2,COMPLETE
4660,0.42998680068759054,2025-03-03 19:50:34.543423,2025-03-03 19:50:34.925441,0 days 00:00:00.382018,gaussian_mixture,abundance,1.75,2,COMPLETE
4661,0.3890763556291518,2025-03-03 19:50:34.927425,2025-03-03 19:50:35.281717,0 days 00:00:00.354292,gaussian_mixture,abundance,1.8,2,COMPLETE
4662,0.566998954031531,2025-03-03 19:50:35.283675,2025-03-03 19:50:35.631573,0 days 00:00:00.347898,gaussian_mixture,abundance,1.7000000000000002,2,COMPLETE
4663,0.4827213756500857,2025-03-03 19:50:35.634583,2025-03-03 19:50:35.978467,0 days 00:00:00.343884,gaussian_mixture,abundance,1.6,2,COMPLETE
4664,0.4690194979560882,2025-03-03 19:50:35.981571,2025-03-03 19:50:36.341668,0 days 00:00:00.360097,gaussian_mixture,abundance,2.5,2,COMPLETE
4665,0.47236464299991,2025-03-03 19:50:36.343900,2025-03-03 19:50:36.690911,0 days 00:00:00.347011,gaussian_mixture,abundance,1.8,2,COMPLETE
4666,0.017365038828484173,2025-03-03 19:50:36.693589,2025-03-03 19:50:38.354567,0 days 00:00:01.660978,gaussian_mixture,presence,10.0,4,COMPLETE
4667,0.31339505731398626,2025-03-03 19:50:38.357558,2025-03-03 19:50:38.728271,0 days 00:00:00.370713,gaussian_mixture,abundance,1.7000000000000002,2,COMPLETE
4668,0.5391906578239483,2025-03-03 19:50:38.732532,2025-03-03 19:50:39.189262,0 days 00:00:00.456730,gaussian_mixture,abundance,1.8,2,COMPLETE
4669,0.6139767106249041,2025-03-03 19:50:39.191786,2025-03-03 19:50:39.534478,0 days 00:00:00.342692,gaussian_mixture,abundance,1.75,2,COMPLETE
4670,0.6353749482218015,2025-03-03 19:50:39.536481,2025-03-03 19:50:39.902965,0 days 00:00:00.366484,gaussian_mixture,abundance,1.9000000000000001,2,COMPLETE
4671,0.4672995026184713,2025-03-03 19:50:39.905979,2025-03-03 19:50:40.323554,0 days 00:00:00.417575,gaussian_mixture,abundance,1.8,2,COMPLETE
4672,0.35764617834649476,2025-03-03 19:50:40.326813,2025-03-03 19:50:40.663406,0 days 00:00:00.336593,kmeans,abundance,1.9500000000000002,2,COMPLETE
4673,0.46580091714338423,2025-03-03 19:50:40.667401,2025-03-03 19:50:41.013078,0 days 00:00:00.345677,gaussian_mixture,abundance,1.8,2,COMPLETE
4674,0.27461281051917225,2025-03-03 19:50:41.018095,2025-03-03 19:50:41.372689,0 days 00:00:00.354594,gaussian_mixture,abundance,1.6500000000000001,2,COMPLETE
4675,0.45265934843952216,2025-03-03 19:50:41.374698,2025-03-03 19:50:41.825484,0 days 00:00:00.450786,gaussian_mixture,abundance,1.75,6,COMPLETE
4676,0.24483297470140641,2025-03-03 19:50:41.828474,2025-03-03 19:50:42.323690,0 days 00:00:00.495216,gaussian_mixture,abundance,1.75,2,COMPLETE
4677,0.4092953167250129,2025-03-03 19:50:42.326687,2025-03-03 19:50:42.769675,0 days 00:00:00.442988,gaussian_mixture,abundance,1.6,2,COMPLETE
4678,0.5009732323996152,2025-03-03 19:50:42.772701,2025-03-03 19:50:43.275170,0 days 00:00:00.502469,gaussian_mixture,abundance,1.9000000000000001,2,COMPLETE
4679,0.42105046324710854,2025-03-03 19:50:43.282209,2025-03-03 19:50:43.641668,0 days 00:00:00.359459,gaussian_mixture,abundance,1.9500000000000002,2,COMPLETE
4680,0.4442486143654632,2025-03-03 19:50:43.644180,2025-03-03 19:50:43.995787,0 days 00:00:00.351607,gaussian_mixture,abundance,1.7000000000000002,2,COMPLETE
4681,0.4727511406944552,2025-03-03 19:50:43.998779,2025-03-03 19:50:44.332030,0 days 00:00:00.333251,gaussian_mixture,abundance,2.45,2,COMPLETE
4682,0.37746522678923466,2025-03-03 19:50:44.335041,2025-03-03 19:50:44.674659,0 days 00:00:00.339618,gaussian_mixture,abundance,1.8,2,COMPLETE
4683,0.4559381966904379,2025-03-03 19:50:44.676653,2025-03-03 19:50:44.995227,0 days 00:00:00.318574,gaussian_mixture,abundance,1.9500000000000002,2,COMPLETE
4684,0.37434118737246413,2025-03-03 19:50:44.998226,2025-03-03 19:50:45.313080,0 days 00:00:00.314854,gaussian_mixture,abundance,1.7000000000000002,2,COMPLETE
4685,0.07515161412282702,2025-03-03 19:50:45.315082,2025-03-03 19:50:46.695235,0 days 00:00:01.380153,gaussian_mixture,presence,110.0,2,COMPLETE
4686,0.47908219157723614,2025-03-03 19:50:46.698234,2025-03-03 19:50:47.055918,0 days 00:00:00.357684,gaussian_mixture,abundance,1.8,2,COMPLETE
4687,0.4402295708003052,2025-03-03 19:50:47.057915,2025-03-03 19:50:47.375768,0 days 00:00:00.317853,gaussian_mixture,abundance,1.85,2,COMPLETE
4688,0.47155165587960257,2025-03-03 19:50:47.377755,2025-03-03 19:50:47.695768,0 days 00:00:00.318013,gaussian_mixture,abundance,1.75,2,COMPLETE
4689,0.5160797731612711,2025-03-03 19:50:47.698757,2025-03-03 19:50:48.045096,0 days 00:00:00.346339,gaussian_mixture,abundance,1.6500000000000001,2,COMPLETE
4690,0.43769746445051644,2025-03-03 19:50:48.048106,2025-03-03 19:50:48.402474,0 days 00:00:00.354368,gaussian_mixture,abundance,1.7000000000000002,2,COMPLETE
4691,0.12067326834306709,2025-03-03 19:50:48.404475,2025-03-03 19:50:48.742151,0 days 00:00:00.337676,kmeans,abundance,1.75,2,COMPLETE
4692,0.5258722835607703,2025-03-03 19:50:48.744148,2025-03-03 19:50:49.097967,0 days 00:00:00.353819,gaussian_mixture,abundance,1.85,2,COMPLETE
4693,0.41185009260785704,2025-03-03 19:50:49.100966,2025-03-03 19:50:49.423586,0 days 00:00:00.322620,gaussian_mixture,abundance,1.75,3,COMPLETE
4694,0.5446242740079551,2025-03-03 19:50:49.425584,2025-03-03 19:50:49.749958,0 days 00:00:00.324374,gaussian_mixture,abundance,1.8,5,COMPLETE
4695,0.3062336047119082,2025-03-03 19:50:49.751958,2025-03-03 19:50:50.074298,0 days 00:00:00.322340,gaussian_mixture,abundance,1.75,2,COMPLETE
4696,0.4526839901994146,2025-03-03 19:50:50.076309,2025-03-03 19:50:50.402363,0 days 00:00:00.326054,gaussian_mixture,abundance,1.8,2,COMPLETE
4697,0.680982819400034,2025-03-03 19:50:50.404362,2025-03-03 19:50:50.735083,0 days 00:00:00.330721,gaussian_mixture,abundance,1.9000000000000001,2,COMPLETE
4698,0.35542646005182366,2025-03-03 19:50:50.737071,2025-03-03 19:50:51.090776,0 days 00:00:00.353705,gaussian_mixture,abundance,1.6500000000000001,2,COMPLETE
4699,0.3995784802795863,2025-03-03 19:50:51.093583,2025-03-03 19:50:51.425755,0 days 00:00:00.332172,gaussian_mixture,abundance,1.9500000000000002,2,COMPLETE
4700,0.398772986964466,2025-03-03 19:50:51.427738,2025-03-03 19:50:51.793809,0 days 00:00:00.366071,gaussian_mixture,abundance,1.9000000000000001,2,COMPLETE
4701,0.24680259286319628,2025-03-03 19:50:51.795811,2025-03-03 19:50:52.127605,0 days 00:00:00.331794,gaussian_mixture,abundance,1.7000000000000002,2,COMPLETE
4702,0.5406470725191386,2025-03-03 19:50:52.129607,2025-03-03 19:50:52.485531,0 days 00:00:00.355924,gaussian_mixture,abundance,1.6500000000000001,2,COMPLETE
4703,0.14359522058626953,2025-03-03 19:50:52.487530,2025-03-03 19:50:52.849051,0 days 00:00:00.361521,gaussian_mixture,abundance,1.75,2,COMPLETE
4704,0.017170677594502987,2025-03-03 19:50:52.852049,2025-03-03 19:50:54.363499,0 days 00:00:01.511450,gaussian_mixture,presence,10.0,2,COMPLETE
4705,0.47255621090792754,2025-03-03 19:50:54.365494,2025-03-03 19:50:54.699289,0 days 00:00:00.333795,gaussian_mixture,abundance,1.85,2,COMPLETE
4706,0.08981731151888839,2025-03-03 19:50:54.701291,2025-03-03 19:50:55.038870,0 days 00:00:00.337579,gaussian_mixture,abundance,1.8,2,COMPLETE
4707,0.5113454503639663,2025-03-03 19:50:55.040873,2025-03-03 19:50:55.401364,0 days 00:00:00.360491,gaussian_mixture,abundance,1.75,2,COMPLETE
4708,0.614724810531226,2025-03-03 19:50:55.403369,2025-03-03 19:50:55.776278,0 days 00:00:00.372909,gaussian_mixture,abundance,1.85,2,COMPLETE
4709,0.491054914780959,2025-03-03 19:50:55.778275,2025-03-03 19:50:56.141065,0 days 00:00:00.362790,gaussian_mixture,abundance,1.75,2,COMPLETE
4710,0.46328804225102793,2025-03-03 19:50:56.143061,2025-03-03 19:50:56.450816,0 days 00:00:00.307755,kmeans,abundance,1.85,2,COMPLETE
4711,0.3220209217393631,2025-03-03 19:50:56.452812,2025-03-03 19:50:56.768423,0 days 00:00:00.315611,gaussian_mixture,abundance,1.8,2,COMPLETE
4712,0.5171255327807989,2025-03-03 19:50:56.770426,2025-03-03 19:50:57.092456,0 days 00:00:00.322030,gaussian_mixture,abundance,1.85,2,COMPLETE
4713,0.5147670345689865,2025-03-03 19:50:57.094456,2025-03-03 19:50:57.404058,0 days 00:00:00.309602,gaussian_mixture,abundance,2.5500000000000003,2,COMPLETE
4714,0.3509682525364197,2025-03-03 19:50:57.406059,2025-03-03 19:50:57.735059,0 days 00:00:00.329000,gaussian_mixture,abundance,1.75,2,COMPLETE
4715,0.4481378228944841,2025-03-03 19:50:57.737053,2025-03-03 19:50:58.050664,0 days 00:00:00.313611,gaussian_mixture,abundance,1.8,2,COMPLETE
4716,0.592319629850309,2025-03-03 19:50:58.053656,2025-03-03 19:50:58.375702,0 days 00:00:00.322046,gaussian_mixture,abundance,1.9000000000000001,2,COMPLETE
4717,0.6192824691145307,2025-03-03 19:50:58.378695,2025-03-03 19:50:58.696495,0 days 00:00:00.317800,gaussian_mixture,abundance,1.7000000000000002,2,COMPLETE
4718,0.4464534200550075,2025-03-03 19:50:58.698496,2025-03-03 19:50:59.010644,0 days 00:00:00.312148,gaussian_mixture,abundance,1.85,2,COMPLETE
4719,0.5328869054116229,2025-03-03 19:50:59.013642,2025-03-03 19:50:59.336537,0 days 00:00:00.322895,gaussian_mixture,abundance,1.6,2,COMPLETE
4720,0.5136751509279758,2025-03-03 19:50:59.338531,2025-03-03 19:50:59.678587,0 days 00:00:00.340056,gaussian_mixture,abundance,1.85,2,COMPLETE
4721,0.4698159459397811,2025-03-03 19:50:59.684158,2025-03-03 19:51:00.046210,0 days 00:00:00.362052,gaussian_mixture,abundance,1.85,2,COMPLETE
4722,0.339954136810977,2025-03-03 19:51:00.048199,2025-03-03 19:51:00.401004,0 days 00:00:00.352805,gaussian_mixture,abundance,1.85,2,COMPLETE
4723,0.04689950232562,2025-03-03 19:51:00.402801,2025-03-03 19:51:01.760939,0 days 00:00:01.358138,gaussian_mixture,presence,60.0,2,COMPLETE
