number,value,datetime_start,datetime_complete,duration,params_algorithm,params_filter_criteria,params_filter_threshold,params_k,state
1776,0.43783576871203433,2025-03-03 19:33:58.079253,2025-03-03 19:33:58.313545,0 days 00:00:00.234292,gaussian_mixture,abundance,2.0,6,COMPLETE
1777,0.7078160016195246,2025-03-03 19:33:58.315545,2025-03-03 19:33:58.536955,0 days 00:00:00.221410,gaussian_mixture,abundance,2.1,2,COMPLETE
1778,0.6526839901994146,2025-03-03 19:33:58.537955,2025-03-03 19:33:58.764276,0 days 00:00:00.226321,gaussian_mixture,abundance,2.0,2,COMPLETE
1779,0.5633527701398364,2025-03-03 19:33:58.766025,2025-03-03 19:33:58.981095,0 days 00:00:00.215070,kmeans,abundance,1.9500000000000002,2,COMPLETE
1780,0.6075778629372672,2025-03-03 19:33:58.982095,2025-03-03 19:33:59.210911,0 days 00:00:00.228816,gaussian_mixture,abundance,2.0500000000000003,2,COMPLETE
1781,0.4687209996122868,2025-03-03 19:33:59.211912,2025-03-03 19:33:59.440017,0 days 00:00:00.228105,gaussian_mixture,abundance,2.0,2,COMPLETE
1782,0.41434538145981514,2025-03-03 19:33:59.442010,2025-03-03 19:33:59.658835,0 days 00:00:00.216825,gaussian_mixture,abundance,2.0500000000000003,2,COMPLETE
1783,0.6043767251046898,2025-03-03 19:33:59.661852,2025-03-03 19:33:59.885106,0 days 00:00:00.223254,gaussian_mixture,abundance,2.0500000000000003,2,COMPLETE
1784,0.3691169393529935,2025-03-03 19:33:59.886106,2025-03-03 19:34:00.115863,0 days 00:00:00.229757,gaussian_mixture,abundance,2.1,2,COMPLETE
1785,0.5329328224405173,2025-03-03 19:34:00.117436,2025-03-03 19:34:00.345686,0 days 00:00:00.228250,gaussian_mixture,abundance,2.1,2,COMPLETE
1786,0.32505749703447745,2025-03-03 19:34:00.347689,2025-03-03 19:34:00.613898,0 days 00:00:00.266209,gaussian_mixture,abundance,2.1,2,COMPLETE
1787,0.32091035886093033,2025-03-03 19:34:00.614898,2025-03-03 19:34:00.838202,0 days 00:00:00.223304,gaussian_mixture,abundance,1.9500000000000002,2,COMPLETE
1788,0.4305375475431218,2025-03-03 19:34:00.839996,2025-03-03 19:34:01.062639,0 days 00:00:00.222643,gaussian_mixture,abundance,2.0500000000000003,2,COMPLETE
1789,0.5823377820300791,2025-03-03 19:34:01.064634,2025-03-03 19:34:01.283108,0 days 00:00:00.218474,gaussian_mixture,abundance,2.1,2,COMPLETE
1790,0.33254632474597207,2025-03-03 19:34:01.285106,2025-03-03 19:34:01.504791,0 days 00:00:00.219685,gaussian_mixture,abundance,2.0,2,COMPLETE
1791,0.46119924799319734,2025-03-03 19:34:01.505797,2025-03-03 19:34:01.730125,0 days 00:00:00.224328,gaussian_mixture,abundance,1.85,2,COMPLETE
1792,0.01261512261434011,2025-03-03 19:34:01.732125,2025-03-03 19:34:03.102753,0 days 00:00:01.370628,gaussian_mixture,presence,10.0,2,COMPLETE
1793,0.3557726005175162,2025-03-03 19:34:03.104754,2025-03-03 19:34:03.321669,0 days 00:00:00.216915,gaussian_mixture,abundance,2.15,2,COMPLETE
1794,0.2620291583805777,2025-03-03 19:34:03.322669,2025-03-03 19:34:03.544598,0 days 00:00:00.221929,gaussian_mixture,abundance,2.0500000000000003,2,COMPLETE
1795,0.4494489477878365,2025-03-03 19:34:03.546598,2025-03-03 19:34:03.774588,0 days 00:00:00.227990,gaussian_mixture,abundance,1.9500000000000002,4,COMPLETE
1796,0.5368546577361399,2025-03-03 19:34:03.775594,2025-03-03 19:34:04.000859,0 days 00:00:00.225265,gaussian_mixture,abundance,2.1,2,COMPLETE
1797,0.5534297321957924,2025-03-03 19:34:04.001859,2025-03-03 19:34:04.222155,0 days 00:00:00.220296,gaussian_mixture,abundance,2.15,2,COMPLETE
1798,0.3748478396225183,2025-03-03 19:34:04.224155,2025-03-03 19:34:04.452629,0 days 00:00:00.228474,kmeans,abundance,2.1,2,COMPLETE
1799,0.3236842389479195,2025-03-03 19:34:04.454629,2025-03-03 19:34:04.678851,0 days 00:00:00.224222,gaussian_mixture,abundance,1.85,2,COMPLETE
1800,0.4255732815810801,2025-03-03 19:34:04.680874,2025-03-03 19:34:04.908733,0 days 00:00:00.227859,gaussian_mixture,abundance,2.15,2,COMPLETE
1801,0.47099385241067016,2025-03-03 19:34:04.909733,2025-03-03 19:34:05.133284,0 days 00:00:00.223551,gaussian_mixture,abundance,2.15,2,COMPLETE
1802,0.5335575114872793,2025-03-03 19:34:05.135274,2025-03-03 19:34:05.357389,0 days 00:00:00.222115,gaussian_mixture,abundance,2.0500000000000003,2,COMPLETE
1803,0.6116924599309886,2025-03-03 19:34:05.359386,2025-03-03 19:34:05.583458,0 days 00:00:00.224072,gaussian_mixture,abundance,1.9000000000000001,2,COMPLETE
1804,0.5119013330709697,2025-03-03 19:34:05.584459,2025-03-03 19:34:05.819774,0 days 00:00:00.235315,gaussian_mixture,abundance,1.05,2,COMPLETE
1805,0.48554047798333855,2025-03-03 19:34:05.821774,2025-03-03 19:34:06.047543,0 days 00:00:00.225769,gaussian_mixture,abundance,2.1,2,COMPLETE
1806,0.48318312504136995,2025-03-03 19:34:06.049349,2025-03-03 19:34:06.269501,0 days 00:00:00.220152,gaussian_mixture,abundance,2.15,2,COMPLETE
1807,0.4068424203987531,2025-03-03 19:34:06.271501,2025-03-03 19:34:06.503955,0 days 00:00:00.232454,gaussian_mixture,abundance,2.0,2,COMPLETE
1808,0.47980034513387204,2025-03-03 19:34:06.505507,2025-03-03 19:34:06.731216,0 days 00:00:00.225709,gaussian_mixture,abundance,2.15,2,COMPLETE
1809,0.6587361167484012,2025-03-03 19:34:06.733215,2025-03-03 19:34:06.959596,0 days 00:00:00.226381,gaussian_mixture,abundance,2.1,2,COMPLETE
1810,0.4696585766768039,2025-03-03 19:34:06.960596,2025-03-03 19:34:07.179216,0 days 00:00:00.218620,gaussian_mixture,abundance,2.45,2,COMPLETE
1811,0.017583209849380072,2025-03-03 19:34:07.180222,2025-03-03 19:34:08.531883,0 days 00:00:01.351661,gaussian_mixture,presence,10.0,2,COMPLETE
1812,0.2673648752316792,2025-03-03 19:34:08.533883,2025-03-03 19:34:08.782363,0 days 00:00:00.248480,gaussian_mixture,abundance,2.15,2,COMPLETE
1813,0.5083095226621132,2025-03-03 19:34:08.784387,2025-03-03 19:34:09.065328,0 days 00:00:00.280941,gaussian_mixture,abundance,2.0,2,COMPLETE
1814,0.6855404779833385,2025-03-03 19:34:09.067332,2025-03-03 19:34:09.289215,0 days 00:00:00.221883,gaussian_mixture,abundance,2.0500000000000003,2,COMPLETE
1815,0.6510266579553021,2025-03-03 19:34:09.291026,2025-03-03 19:34:09.519002,0 days 00:00:00.227976,gaussian_mixture,abundance,2.2,3,COMPLETE
1816,0.5600732578173109,2025-03-03 19:34:09.520002,2025-03-03 19:34:09.746827,0 days 00:00:00.226825,gaussian_mixture,abundance,2.15,2,COMPLETE
1817,0.20209122504934127,2025-03-03 19:34:09.748826,2025-03-03 19:34:09.988079,0 days 00:00:00.239253,gaussian_mixture,abundance,2.1,2,COMPLETE
1818,0.6921677693823374,2025-03-03 19:34:09.990082,2025-03-03 19:34:10.224010,0 days 00:00:00.233928,gaussian_mixture,abundance,1.9500000000000002,2,COMPLETE
1819,0.5936670676615192,2025-03-03 19:34:10.226010,2025-03-03 19:34:10.447346,0 days 00:00:00.221336,gaussian_mixture,abundance,2.2,2,COMPLETE
1820,0.6705841879083381,2025-03-03 19:34:10.449346,2025-03-03 19:34:10.673271,0 days 00:00:00.223925,gaussian_mixture,abundance,2.0500000000000003,2,COMPLETE
1821,0.45640420862936876,2025-03-03 19:34:10.675053,2025-03-03 19:34:10.911805,0 days 00:00:00.236752,gaussian_mixture,abundance,1.75,2,COMPLETE
1822,0.44562490039577024,2025-03-03 19:34:10.913329,2025-03-03 19:34:11.131673,0 days 00:00:00.218344,kmeans,abundance,2.4000000000000004,2,COMPLETE
1823,0.578927191313295,2025-03-03 19:34:11.133673,2025-03-03 19:34:11.353998,0 days 00:00:00.220325,gaussian_mixture,abundance,2.45,2,COMPLETE
1824,0.6353749482218015,2025-03-03 19:34:11.355796,2025-03-03 19:34:11.579013,0 days 00:00:00.223217,gaussian_mixture,abundance,2.2,2,COMPLETE
1825,0.43537494822180156,2025-03-03 19:34:11.581025,2025-03-03 19:34:11.803256,0 days 00:00:00.222231,gaussian_mixture,abundance,2.15,2,COMPLETE
1826,0.5545672022891301,2025-03-03 19:34:11.804256,2025-03-03 19:34:12.025624,0 days 00:00:00.221368,gaussian_mixture,abundance,2.2,2,COMPLETE
1827,0.6407477641854399,2025-03-03 19:34:12.026619,2025-03-03 19:34:12.251907,0 days 00:00:00.225288,gaussian_mixture,abundance,2.35,2,COMPLETE
1828,0.3573112743639346,2025-03-03 19:34:12.252907,2025-03-03 19:34:12.478431,0 days 00:00:00.225524,gaussian_mixture,abundance,2.0,3,COMPLETE
1829,0.08517357831001407,2025-03-03 19:34:12.479431,2025-03-03 19:34:13.755606,0 days 00:00:01.276175,gaussian_mixture,presence,25.0,2,COMPLETE
1830,0.706706999562239,2025-03-03 19:34:13.757606,2025-03-03 19:34:13.989811,0 days 00:00:00.232205,gaussian_mixture,abundance,2.1,2,COMPLETE
1831,0.3492462041236504,2025-03-03 19:34:13.991605,2025-03-03 19:34:14.211728,0 days 00:00:00.220123,gaussian_mixture,abundance,2.15,2,COMPLETE
1832,0.7370462256441576,2025-03-03 19:34:14.212726,2025-03-03 19:34:14.435860,0 days 00:00:00.223134,gaussian_mixture,abundance,2.1,2,COMPLETE
1833,0.4126197107346557,2025-03-03 19:34:14.436860,2025-03-03 19:34:14.661487,0 days 00:00:00.224627,gaussian_mixture,abundance,2.1,2,COMPLETE
1834,0.4192824691145306,2025-03-03 19:34:14.662487,2025-03-03 19:34:14.885623,0 days 00:00:00.223136,gaussian_mixture,abundance,2.1,2,COMPLETE
1835,0.4765230386008339,2025-03-03 19:34:14.887622,2025-03-03 19:34:15.129855,0 days 00:00:00.242233,gaussian_mixture,abundance,2.1,2,COMPLETE
1836,0.4324866720541897,2025-03-03 19:34:15.131980,2025-03-03 19:34:15.359079,0 days 00:00:00.227099,gaussian_mixture,abundance,2.1,2,COMPLETE
1837,0.2879217625215766,2025-03-03 19:34:15.361082,2025-03-03 19:34:15.571688,0 days 00:00:00.210606,kmeans,abundance,2.1,2,COMPLETE
1838,0.4372962346867985,2025-03-03 19:34:15.573441,2025-03-03 19:34:15.801114,0 days 00:00:00.227673,gaussian_mixture,abundance,1.4000000000000001,2,COMPLETE
1839,0.6055036167317025,2025-03-03 19:34:15.802902,2025-03-03 19:34:16.027229,0 days 00:00:00.224327,gaussian_mixture,abundance,2.15,2,COMPLETE
1840,0.44053618626107643,2025-03-03 19:34:16.029222,2025-03-03 19:34:16.251543,0 days 00:00:00.222321,gaussian_mixture,abundance,2.0500000000000003,2,COMPLETE
1841,0.2681215843499811,2025-03-03 19:34:16.252543,2025-03-03 19:34:16.478975,0 days 00:00:00.226432,gaussian_mixture,abundance,2.0500000000000003,2,COMPLETE
1842,0.48554047798333855,2025-03-03 19:34:16.480970,2025-03-03 19:34:16.707628,0 days 00:00:00.226658,gaussian_mixture,abundance,2.15,2,COMPLETE
1843,0.6960384751202662,2025-03-03 19:34:16.709613,2025-03-03 19:34:16.938075,0 days 00:00:00.228462,gaussian_mixture,abundance,2.1,2,COMPLETE
1844,0.5652732833063714,2025-03-03 19:34:16.939080,2025-03-03 19:34:17.161905,0 days 00:00:00.222825,gaussian_mixture,abundance,2.15,2,COMPLETE
1845,0.6075778629372672,2025-03-03 19:34:17.163914,2025-03-03 19:34:17.404781,0 days 00:00:00.240867,gaussian_mixture,abundance,2.0500000000000003,2,COMPLETE
1846,0.3158863853253274,2025-03-03 19:34:17.406780,2025-03-03 19:34:17.635315,0 days 00:00:00.228535,gaussian_mixture,abundance,2.15,2,COMPLETE
1847,0.4416697979014105,2025-03-03 19:34:17.636311,2025-03-03 19:34:17.870946,0 days 00:00:00.234635,gaussian_mixture,abundance,2.1,5,COMPLETE
1848,0.6420810769859067,2025-03-03 19:34:17.871946,2025-03-03 19:34:18.102663,0 days 00:00:00.230717,gaussian_mixture,abundance,2.0500000000000003,2,COMPLETE
1849,0.4167093890431411,2025-03-03 19:34:18.103663,2025-03-03 19:34:18.324287,0 days 00:00:00.220624,gaussian_mixture,abundance,2.15,2,COMPLETE
1850,0.00019984299262773287,2025-03-03 19:34:18.325281,2025-03-03 19:34:19.679358,0 days 00:00:01.354077,gaussian_mixture,presence,10.0,2,COMPLETE
1851,0.5031118053876256,2025-03-03 19:34:19.680355,2025-03-03 19:34:19.901320,0 days 00:00:00.220965,gaussian_mixture,abundance,2.2,2,COMPLETE
1852,0.42246951851149694,2025-03-03 19:34:19.903121,2025-03-03 19:34:20.130696,0 days 00:00:00.227575,gaussian_mixture,abundance,2.1,2,COMPLETE
1853,0.42064910589884563,2025-03-03 19:34:20.131691,2025-03-03 19:34:20.353424,0 days 00:00:00.221733,gaussian_mixture,abundance,2.15,2,COMPLETE
1854,0.6595412340406492,2025-03-03 19:34:20.355424,2025-03-03 19:34:20.578043,0 days 00:00:00.222619,gaussian_mixture,abundance,2.2,2,COMPLETE
1855,0.5191351598912893,2025-03-03 19:34:20.579051,2025-03-03 19:34:20.805576,0 days 00:00:00.226525,gaussian_mixture,abundance,2.0500000000000003,2,COMPLETE
1856,0.5423124331069753,2025-03-03 19:34:20.806577,2025-03-03 19:34:21.041539,0 days 00:00:00.234962,gaussian_mixture,abundance,2.2,4,COMPLETE
1857,0.5708849334855716,2025-03-03 19:34:21.043534,2025-03-03 19:34:21.263132,0 days 00:00:00.219598,gaussian_mixture,abundance,2.1,2,COMPLETE
1858,0.41232825080508045,2025-03-03 19:34:21.265132,2025-03-03 19:34:21.511170,0 days 00:00:00.246038,kmeans,abundance,2.15,2,COMPLETE
1859,0.4887481395898051,2025-03-03 19:34:21.512810,2025-03-03 19:34:21.773926,0 days 00:00:00.261116,gaussian_mixture,abundance,2.15,2,COMPLETE
1860,0.5689564971782028,2025-03-03 19:34:21.775916,2025-03-03 19:34:22.005369,0 days 00:00:00.229453,gaussian_mixture,abundance,2.2,2,COMPLETE
1861,0.5271526688647145,2025-03-03 19:34:22.007368,2025-03-03 19:34:22.252898,0 days 00:00:00.245530,gaussian_mixture,abundance,2.0500000000000003,6,COMPLETE
1862,0.27569705900037744,2025-03-03 19:34:22.254898,2025-03-03 19:34:22.476430,0 days 00:00:00.221532,gaussian_mixture,abundance,2.1,2,COMPLETE
1863,0.5804804312556021,2025-03-03 19:34:22.478456,2025-03-03 19:34:22.703385,0 days 00:00:00.224929,gaussian_mixture,abundance,2.2,2,COMPLETE
1864,0.646172284701113,2025-03-03 19:34:22.705386,2025-03-03 19:34:22.936224,0 days 00:00:00.230838,gaussian_mixture,abundance,2.2,2,COMPLETE
1865,0.5171740049356446,2025-03-03 19:34:22.937223,2025-03-03 19:34:23.166868,0 days 00:00:00.229645,gaussian_mixture,abundance,2.15,2,COMPLETE
1866,0.5368546577361399,2025-03-03 19:34:23.167873,2025-03-03 19:34:23.394055,0 days 00:00:00.226182,gaussian_mixture,abundance,2.1,2,COMPLETE
1867,0.5282227112898423,2025-03-03 19:34:23.395596,2025-03-03 19:34:23.625453,0 days 00:00:00.229857,gaussian_mixture,abundance,2.0500000000000003,2,COMPLETE
1868,0.07147251384439612,2025-03-03 19:34:23.627452,2025-03-03 19:34:24.902727,0 days 00:00:01.275275,gaussian_mixture,presence,50.0,2,COMPLETE
1869,0.4721284255359356,2025-03-03 19:34:24.904722,2025-03-03 19:34:25.126464,0 days 00:00:00.221742,gaussian_mixture,abundance,2.0,2,COMPLETE
1870,0.48755066063675,2025-03-03 19:34:25.128462,2025-03-03 19:34:25.362375,0 days 00:00:00.233913,gaussian_mixture,abundance,2.25,4,COMPLETE
1871,0.4010878841606713,2025-03-03 19:34:25.363047,2025-03-03 19:34:25.585976,0 days 00:00:00.222929,gaussian_mixture,abundance,2.15,2,COMPLETE
1872,0.33222104390961665,2025-03-03 19:34:25.587784,2025-03-03 19:34:25.817529,0 days 00:00:00.229745,gaussian_mixture,abundance,2.2,2,COMPLETE
1873,0.5527591261201359,2025-03-03 19:34:25.818534,2025-03-03 19:34:26.043098,0 days 00:00:00.224564,gaussian_mixture,abundance,2.1,2,COMPLETE
1874,0.589048073679731,2025-03-03 19:34:26.045103,2025-03-03 19:34:26.272132,0 days 00:00:00.227029,gaussian_mixture,abundance,2.25,2,COMPLETE
1875,0.503715611382448,2025-03-03 19:34:26.274132,2025-03-03 19:34:26.496042,0 days 00:00:00.221910,gaussian_mixture,abundance,2.0500000000000003,2,COMPLETE
1876,0.47140000782482544,2025-03-03 19:34:26.497065,2025-03-03 19:34:26.713632,0 days 00:00:00.216567,kmeans,abundance,2.2,2,COMPLETE
1877,0.3241390735652102,2025-03-03 19:34:26.715628,2025-03-03 19:34:26.937042,0 days 00:00:00.221414,gaussian_mixture,abundance,2.15,2,COMPLETE
1878,0.5660572075958697,2025-03-03 19:34:26.938039,2025-03-03 19:34:27.167363,0 days 00:00:00.229324,gaussian_mixture,abundance,2.25,2,COMPLETE
1879,0.47229446760738314,2025-03-03 19:34:27.168363,2025-03-03 19:34:27.397650,0 days 00:00:00.229287,gaussian_mixture,abundance,2.1,2,COMPLETE
1880,0.456738027133361,2025-03-03 19:34:27.398674,2025-03-03 19:34:27.618996,0 days 00:00:00.220322,gaussian_mixture,abundance,2.15,2,COMPLETE
1881,0.7008573203596798,2025-03-03 19:34:27.620803,2025-03-03 19:34:27.846157,0 days 00:00:00.225354,gaussian_mixture,abundance,2.2,2,COMPLETE
1882,0.458970773259475,2025-03-03 19:34:27.847923,2025-03-03 19:34:28.106657,0 days 00:00:00.258734,gaussian_mixture,abundance,0.6000000000000001,2,COMPLETE
1883,0.5708849334855716,2025-03-03 19:34:28.108284,2025-03-03 19:34:28.334619,0 days 00:00:00.226335,gaussian_mixture,abundance,2.0,2,COMPLETE
1884,0.5130606017320043,2025-03-03 19:34:28.336426,2025-03-03 19:34:28.558551,0 days 00:00:00.222125,gaussian_mixture,abundance,2.0500000000000003,2,COMPLETE
1885,0.4594837947798466,2025-03-03 19:34:28.560551,2025-03-03 19:34:28.782676,0 days 00:00:00.222125,gaussian_mixture,abundance,2.25,2,COMPLETE
1886,0.29041129927440934,2025-03-03 19:34:28.784697,2025-03-03 19:34:29.013424,0 days 00:00:00.228727,gaussian_mixture,abundance,2.2,2,COMPLETE
1887,0.013947285277444852,2025-03-03 19:34:29.015424,2025-03-03 19:34:30.370033,0 days 00:00:01.354609,gaussian_mixture,presence,10.0,2,COMPLETE
1888,0.36676099634052256,2025-03-03 19:34:30.372033,2025-03-03 19:34:30.597292,0 days 00:00:00.225259,gaussian_mixture,abundance,2.1,2,COMPLETE
1889,0.4883565596880589,2025-03-03 19:34:30.598293,2025-03-03 19:34:30.827207,0 days 00:00:00.228914,gaussian_mixture,abundance,2.15,2,COMPLETE
1890,0.541896391688432,2025-03-03 19:34:30.830199,2025-03-03 19:34:31.054597,0 days 00:00:00.224398,gaussian_mixture,abundance,2.25,2,COMPLETE
1891,0.28545736516755643,2025-03-03 19:34:31.055581,2025-03-03 19:34:31.284719,0 days 00:00:00.229138,gaussian_mixture,abundance,1.3,2,COMPLETE
1892,0.44162652780444,2025-03-03 19:34:31.286731,2025-03-03 19:34:31.511285,0 days 00:00:00.224554,gaussian_mixture,abundance,2.1,2,COMPLETE
1893,0.5275107032996115,2025-03-03 19:34:31.513089,2025-03-03 19:34:31.729223,0 days 00:00:00.216134,kmeans,abundance,2.25,2,COMPLETE
1894,0.5301419727092902,2025-03-03 19:34:31.731222,2025-03-03 19:34:31.961314,0 days 00:00:00.230092,gaussian_mixture,abundance,1.5,2,COMPLETE
1895,0.297652296954389,2025-03-03 19:34:31.963312,2025-03-03 19:34:32.192786,0 days 00:00:00.229474,gaussian_mixture,abundance,2.0,2,COMPLETE
1896,0.4683492339181493,2025-03-03 19:34:32.193778,2025-03-03 19:34:32.429978,0 days 00:00:00.236200,gaussian_mixture,abundance,2.15,2,COMPLETE
1897,0.3010231907539528,2025-03-03 19:34:32.430968,2025-03-03 19:34:32.655120,0 days 00:00:00.224152,gaussian_mixture,abundance,2.2,2,COMPLETE
1898,0.552010676931404,2025-03-03 19:34:32.656122,2025-03-03 19:34:32.884085,0 days 00:00:00.227963,gaussian_mixture,abundance,2.0500000000000003,2,COMPLETE
1899,0.6696968528561783,2025-03-03 19:34:32.886084,2025-03-03 19:34:33.113413,0 days 00:00:00.227329,gaussian_mixture,abundance,2.25,2,COMPLETE
1900,0.6072412071535626,2025-03-03 19:34:33.115219,2025-03-03 19:34:33.344794,0 days 00:00:00.229575,gaussian_mixture,abundance,2.15,3,COMPLETE
1901,0.24295893681657427,2025-03-03 19:34:33.346794,2025-03-03 19:34:33.575730,0 days 00:00:00.228936,gaussian_mixture,abundance,2.3000000000000003,2,COMPLETE
1902,0.23709338913309264,2025-03-03 19:34:33.576725,2025-03-03 19:34:33.802823,0 days 00:00:00.226098,gaussian_mixture,abundance,2.1,2,COMPLETE
1903,0.5490727922625804,2025-03-03 19:34:33.805355,2025-03-03 19:34:34.032294,0 days 00:00:00.226939,gaussian_mixture,abundance,2.2,2,COMPLETE
1904,0.5561881203641736,2025-03-03 19:34:34.033298,2025-03-03 19:34:34.298464,0 days 00:00:00.265166,gaussian_mixture,abundance,1.7000000000000002,2,COMPLETE
1905,0.5211353371858246,2025-03-03 19:34:34.300467,2025-03-03 19:34:34.570212,0 days 00:00:00.269745,gaussian_mixture,abundance,2.2,2,COMPLETE
1906,0.06114978641791556,2025-03-03 19:34:34.572208,2025-03-03 19:34:35.821020,0 days 00:00:01.248812,gaussian_mixture,presence,75.0,2,COMPLETE
1907,0.6970883340120159,2025-03-03 19:34:35.823020,2025-03-03 19:34:36.051276,0 days 00:00:00.228256,gaussian_mixture,abundance,2.0500000000000003,2,COMPLETE
1908,0.6192824691145307,2025-03-03 19:34:36.052274,2025-03-03 19:34:36.280121,0 days 00:00:00.227847,gaussian_mixture,abundance,2.3000000000000003,2,COMPLETE
1909,0.4286400838410424,2025-03-03 19:34:36.281114,2025-03-03 19:34:36.516777,0 days 00:00:00.235663,gaussian_mixture,abundance,2.15,2,COMPLETE
1910,0.5235485304925109,2025-03-03 19:34:36.518423,2025-03-03 19:34:36.753735,0 days 00:00:00.235312,gaussian_mixture,abundance,2.2,2,COMPLETE
1911,0.49826242349512084,2025-03-03 19:34:36.754744,2025-03-03 19:34:36.987281,0 days 00:00:00.232537,gaussian_mixture,abundance,2.1,2,COMPLETE
1912,0.4662110352465709,2025-03-03 19:34:36.989280,2025-03-03 19:34:37.208859,0 days 00:00:00.219579,kmeans,abundance,2.0,2,COMPLETE
1913,0.5130606017320043,2025-03-03 19:34:37.209874,2025-03-03 19:34:37.438948,0 days 00:00:00.229074,gaussian_mixture,abundance,2.25,2,COMPLETE
1914,0.6192824691145307,2025-03-03 19:34:37.439942,2025-03-03 19:34:37.668024,0 days 00:00:00.228082,gaussian_mixture,abundance,2.15,2,COMPLETE
1915,0.5387771687907721,2025-03-03 19:34:37.669022,2025-03-03 19:34:37.896617,0 days 00:00:00.227595,gaussian_mixture,abundance,2.3000000000000003,2,COMPLETE
1916,0.5989117476046195,2025-03-03 19:34:37.898613,2025-03-03 19:34:38.122265,0 days 00:00:00.223652,gaussian_mixture,abundance,2.2,2,COMPLETE
1917,0.3624418605543149,2025-03-03 19:34:38.124256,2025-03-03 19:34:38.350822,0 days 00:00:00.226566,gaussian_mixture,abundance,2.1,2,COMPLETE
1918,0.21367675657782753,2025-03-03 19:34:38.351816,2025-03-03 19:34:38.573912,0 days 00:00:00.222096,gaussian_mixture,abundance,2.25,2,COMPLETE
1919,0.47236464299991,2025-03-03 19:34:38.575902,2025-03-03 19:34:38.818583,0 days 00:00:00.242681,gaussian_mixture,abundance,2.0,2,COMPLETE
1920,0.5376547160050652,2025-03-03 19:34:38.820581,2025-03-03 19:34:39.047656,0 days 00:00:00.227075,gaussian_mixture,abundance,2.0500000000000003,2,COMPLETE
1921,0.23751655748546896,2025-03-03 19:34:39.049653,2025-03-03 19:34:39.308570,0 days 00:00:00.258917,gaussian_mixture,abundance,1.55,2,COMPLETE
1922,0.566998954031531,2025-03-03 19:34:39.310843,2025-03-03 19:34:39.545972,0 days 00:00:00.235129,gaussian_mixture,abundance,2.15,2,COMPLETE
1923,0.42920711457008254,2025-03-03 19:34:39.547755,2025-03-03 19:34:39.784081,0 days 00:00:00.236326,gaussian_mixture,abundance,2.3000000000000003,5,COMPLETE
1924,0.35410921161564585,2025-03-03 19:34:39.785078,2025-03-03 19:34:40.013683,0 days 00:00:00.228605,gaussian_mixture,abundance,1.6500000000000001,2,COMPLETE
