number,value,datetime_start,datetime_complete,duration,params_algorithm,params_filter_criteria,params_filter_threshold,params_k,state
3842,0.6509159960668365,2025-03-03 19:45:14.540617,2025-03-03 19:45:14.829966,0 days 00:00:00.289349,gaussian_mixture,abundance,2.2,2,COMPLETE
3843,0.4846257682205136,2025-03-03 19:45:14.831963,2025-03-03 19:45:15.116340,0 days 00:00:00.284377,gaussian_mixture,abundance,2.4000000000000004,2,COMPLETE
3844,0.5182063436283842,2025-03-03 19:45:15.118338,2025-03-03 19:45:15.416000,0 days 00:00:00.297662,gaussian_mixture,abundance,2.25,2,COMPLETE
3845,0.7078160016195246,2025-03-03 19:45:15.417998,2025-03-03 19:45:15.714559,0 days 00:00:00.296561,gaussian_mixture,abundance,2.1,2,COMPLETE
3846,0.396334499926376,2025-03-03 19:45:15.716542,2025-03-03 19:45:16.020928,0 days 00:00:00.304386,kmeans,abundance,2.35,2,COMPLETE
3847,0.4591734818030397,2025-03-03 19:45:16.022926,2025-03-03 19:45:16.323390,0 days 00:00:00.300464,gaussian_mixture,abundance,2.45,2,COMPLETE
3848,0.6855404779833385,2025-03-03 19:45:16.326381,2025-03-03 19:45:16.635330,0 days 00:00:00.308949,gaussian_mixture,abundance,2.15,2,COMPLETE
3849,0.6797217905443015,2025-03-03 19:45:16.637321,2025-03-03 19:45:16.976386,0 days 00:00:00.339065,gaussian_mixture,abundance,2.3000000000000003,2,COMPLETE
3850,0.4522488440215879,2025-03-03 19:45:16.978379,2025-03-03 19:45:17.306060,0 days 00:00:00.327681,gaussian_mixture,abundance,2.5,2,COMPLETE
3851,0.46946387835094183,2025-03-03 19:45:17.307852,2025-03-03 19:45:17.606192,0 days 00:00:00.298340,gaussian_mixture,abundance,2.2,2,COMPLETE
3852,0.686834778853726,2025-03-03 19:45:17.608178,2025-03-03 19:45:17.921384,0 days 00:00:00.313206,gaussian_mixture,abundance,2.1,2,COMPLETE
3853,0.37003016509450365,2025-03-03 19:45:17.923620,2025-03-03 19:45:18.239460,0 days 00:00:00.315840,gaussian_mixture,abundance,1.9500000000000002,4,COMPLETE
3854,0.44234173922000986,2025-03-03 19:45:18.240462,2025-03-03 19:45:18.536880,0 days 00:00:00.296418,gaussian_mixture,abundance,2.35,2,COMPLETE
3855,0.36040489517317487,2025-03-03 19:45:18.538877,2025-03-03 19:45:18.884022,0 days 00:00:00.345145,gaussian_mixture,abundance,2.2,2,COMPLETE
3856,0.3384669458829951,2025-03-03 19:45:18.886013,2025-03-03 19:45:19.183185,0 days 00:00:00.297172,gaussian_mixture,abundance,2.45,2,COMPLETE
3857,0.5093939458094991,2025-03-03 19:45:19.185560,2025-03-03 19:45:19.493108,0 days 00:00:00.307548,gaussian_mixture,abundance,2.25,2,COMPLETE
3858,0.03887544064375903,2025-03-03 19:45:19.495530,2025-03-03 19:45:21.029038,0 days 00:00:01.533508,gaussian_mixture,presence,10.0,2,COMPLETE
3859,0.5766919521538816,2025-03-03 19:45:21.031054,2025-03-03 19:45:21.331941,0 days 00:00:00.300887,gaussian_mixture,abundance,1.35,2,COMPLETE
3860,0.5476708088484689,2025-03-03 19:45:21.333931,2025-03-03 19:45:21.642693,0 days 00:00:00.308762,gaussian_mixture,abundance,0.7000000000000001,2,COMPLETE
3861,0.379274340082522,2025-03-03 19:45:21.645687,2025-03-03 19:45:21.933560,0 days 00:00:00.287873,gaussian_mixture,abundance,2.3000000000000003,2,COMPLETE
3862,0.21462515225207265,2025-03-03 19:45:21.935558,2025-03-03 19:45:22.225338,0 days 00:00:00.289780,gaussian_mixture,abundance,2.4000000000000004,2,COMPLETE
3863,0.4718676490892639,2025-03-03 19:45:22.226913,2025-03-03 19:45:22.518487,0 days 00:00:00.291574,gaussian_mixture,abundance,1.9500000000000002,2,COMPLETE
3864,0.39221314666636004,2025-03-03 19:45:22.520472,2025-03-03 19:45:22.798993,0 days 00:00:00.278521,kmeans,abundance,1.8,2,COMPLETE
3865,0.6890753428303198,2025-03-03 19:45:22.800986,2025-03-03 19:45:23.093574,0 days 00:00:00.292588,gaussian_mixture,abundance,2.15,2,COMPLETE
3866,0.561146994577839,2025-03-03 19:45:23.095569,2025-03-03 19:45:23.383735,0 days 00:00:00.288166,gaussian_mixture,abundance,2.35,2,COMPLETE
3867,0.5909530777133574,2025-03-03 19:45:23.386051,2025-03-03 19:45:23.671769,0 days 00:00:00.285718,gaussian_mixture,abundance,2.25,2,COMPLETE
3868,0.7171740049356445,2025-03-03 19:45:23.673760,2025-03-03 19:45:23.962351,0 days 00:00:00.288591,gaussian_mixture,abundance,2.1,2,COMPLETE
3869,0.5214933763021079,2025-03-03 19:45:23.965349,2025-03-03 19:45:24.264560,0 days 00:00:00.299211,gaussian_mixture,abundance,2.0,2,COMPLETE
3870,0.5764858225763871,2025-03-03 19:45:24.266551,2025-03-03 19:45:24.580962,0 days 00:00:00.314411,gaussian_mixture,abundance,1.2000000000000002,2,COMPLETE
3871,0.464906094752448,2025-03-03 19:45:24.582966,2025-03-03 19:45:24.886483,0 days 00:00:00.303517,gaussian_mixture,abundance,2.4000000000000004,2,COMPLETE
3872,0.589048073679731,2025-03-03 19:45:24.887488,2025-03-03 19:45:25.202255,0 days 00:00:00.314767,gaussian_mixture,abundance,2.2,2,COMPLETE
3873,0.10135802528833074,2025-03-03 19:45:25.203260,2025-03-03 19:45:25.500394,0 days 00:00:00.297134,gaussian_mixture,abundance,2.5500000000000003,2,COMPLETE
3874,0.5195349319822754,2025-03-03 19:45:25.502390,2025-03-03 19:45:25.809921,0 days 00:00:00.307531,gaussian_mixture,abundance,2.0500000000000003,2,COMPLETE
3875,0.4277789284627983,2025-03-03 19:45:25.811923,2025-03-03 19:45:26.123549,0 days 00:00:00.311626,gaussian_mixture,abundance,2.3000000000000003,2,COMPLETE
3876,0.7171740049356445,2025-03-03 19:45:26.124604,2025-03-03 19:45:26.426801,0 days 00:00:00.302197,gaussian_mixture,abundance,2.15,2,COMPLETE
3877,0.023672686783647038,2025-03-03 19:45:26.430696,2025-03-03 19:45:27.962199,0 days 00:00:01.531503,gaussian_mixture,presence,15.0,2,COMPLETE
3878,0.6579647936384249,2025-03-03 19:45:27.964370,2025-03-03 19:45:28.256489,0 days 00:00:00.292119,gaussian_mixture,abundance,2.25,2,COMPLETE
3879,0.49972857409853677,2025-03-03 19:45:28.258483,2025-03-03 19:45:28.637819,0 days 00:00:00.379336,gaussian_mixture,abundance,2.4000000000000004,2,COMPLETE
3880,0.6376974644505164,2025-03-03 19:45:28.641147,2025-03-03 19:45:28.973029,0 days 00:00:00.331882,gaussian_mixture,abundance,2.35,2,COMPLETE
3881,0.4216279673543858,2025-03-03 19:45:28.975026,2025-03-03 19:45:29.269335,0 days 00:00:00.294309,gaussian_mixture,abundance,2.45,2,COMPLETE
3882,0.5054126986918515,2025-03-03 19:45:29.271333,2025-03-03 19:45:29.616810,0 days 00:00:00.345477,gaussian_mixture,abundance,2.2,2,COMPLETE
3883,0.5460583540026802,2025-03-03 19:45:29.619828,2025-03-03 19:45:29.932019,0 days 00:00:00.312191,gaussian_mixture,abundance,2.3000000000000003,2,COMPLETE
3884,0.28719858885963545,2025-03-03 19:45:29.934016,2025-03-03 19:45:30.235248,0 days 00:00:00.301232,kmeans,abundance,2.1,5,COMPLETE
3885,0.5059476514216298,2025-03-03 19:45:30.237226,2025-03-03 19:45:30.538063,0 days 00:00:00.300837,gaussian_mixture,abundance,2.3000000000000003,2,COMPLETE
3886,0.40550361673170243,2025-03-03 19:45:30.540081,2025-03-03 19:45:30.850439,0 days 00:00:00.310358,gaussian_mixture,abundance,2.2,2,COMPLETE
3887,0.45175845477343624,2025-03-03 19:45:30.852432,2025-03-03 19:45:31.141583,0 days 00:00:00.289151,gaussian_mixture,abundance,2.35,2,COMPLETE
3888,0.26911391986734073,2025-03-03 19:45:31.143727,2025-03-03 19:45:31.428853,0 days 00:00:00.285126,gaussian_mixture,abundance,1.9000000000000001,2,COMPLETE
3889,0.4780869470073135,2025-03-03 19:45:31.430863,2025-03-03 19:45:31.728910,0 days 00:00:00.298047,gaussian_mixture,abundance,2.0500000000000003,2,COMPLETE
3890,0.5161056256153067,2025-03-03 19:45:31.731904,2025-03-03 19:45:32.016926,0 days 00:00:00.285022,gaussian_mixture,abundance,2.45,2,COMPLETE
3891,0.57784463450703,2025-03-03 19:45:32.019719,2025-03-03 19:45:32.306401,0 days 00:00:00.286682,gaussian_mixture,abundance,2.25,2,COMPLETE
3892,0.30330029556482535,2025-03-03 19:45:32.309393,2025-03-03 19:45:32.599249,0 days 00:00:00.289856,gaussian_mixture,abundance,2.15,2,COMPLETE
3893,0.5184334176956427,2025-03-03 19:45:32.601246,2025-03-03 19:45:32.890925,0 days 00:00:00.289679,gaussian_mixture,abundance,2.35,2,COMPLETE
3894,0.5790523736231581,2025-03-03 19:45:32.893048,2025-03-03 19:45:33.257003,0 days 00:00:00.363955,gaussian_mixture,abundance,2.25,2,COMPLETE
3895,0.5255776776057306,2025-03-03 19:45:33.259507,2025-03-03 19:45:33.591397,0 days 00:00:00.331890,gaussian_mixture,abundance,2.5,3,COMPLETE
3896,0.009866871829041918,2025-03-03 19:45:33.593515,2025-03-03 19:45:35.095229,0 days 00:00:01.501714,gaussian_mixture,presence,10.0,2,COMPLETE
3897,0.6190559833947039,2025-03-03 19:45:35.097982,2025-03-03 19:45:35.409874,0 days 00:00:00.311892,gaussian_mixture,abundance,2.0,2,COMPLETE
3898,0.34713531949731513,2025-03-03 19:45:35.411870,2025-03-03 19:45:35.706362,0 days 00:00:00.294492,gaussian_mixture,abundance,2.1,2,COMPLETE
3899,0.5940126392643001,2025-03-03 19:45:35.708353,2025-03-03 19:45:36.013959,0 days 00:00:00.305606,gaussian_mixture,abundance,2.2,2,COMPLETE
3900,0.5579200237215052,2025-03-03 19:45:36.015958,2025-03-03 19:45:36.324977,0 days 00:00:00.309019,gaussian_mixture,abundance,1.85,2,COMPLETE
3901,0.5515172066413514,2025-03-03 19:45:36.326729,2025-03-03 19:45:36.628831,0 days 00:00:00.302102,gaussian_mixture,abundance,2.3000000000000003,2,COMPLETE
3902,0.39223048211294176,2025-03-03 19:45:36.631828,2025-03-03 19:45:36.924673,0 days 00:00:00.292845,kmeans,abundance,2.4000000000000004,2,COMPLETE
3903,0.6071264680960488,2025-03-03 19:45:36.926681,2025-03-03 19:45:37.271991,0 days 00:00:00.345310,gaussian_mixture,abundance,2.15,2,COMPLETE
3904,0.38098594907502814,2025-03-03 19:45:37.274619,2025-03-03 19:45:37.577294,0 days 00:00:00.302675,gaussian_mixture,abundance,2.0500000000000003,2,COMPLETE
3905,0.5807974588978283,2025-03-03 19:45:37.580275,2025-03-03 19:45:37.882802,0 days 00:00:00.302527,gaussian_mixture,abundance,2.3000000000000003,2,COMPLETE
3906,0.6189039945953072,2025-03-03 19:45:37.884797,2025-03-03 19:45:38.216104,0 days 00:00:00.331307,gaussian_mixture,abundance,2.45,2,COMPLETE
3907,0.5923716831605897,2025-03-03 19:45:38.219103,2025-03-03 19:45:38.538632,0 days 00:00:00.319529,gaussian_mixture,abundance,2.15,2,COMPLETE
3908,0.4192824691145306,2025-03-03 19:45:38.540630,2025-03-03 19:45:38.843783,0 days 00:00:00.303153,gaussian_mixture,abundance,2.35,2,COMPLETE
3909,0.5972649170409998,2025-03-03 19:45:38.846774,2025-03-03 19:45:39.160548,0 days 00:00:00.313774,gaussian_mixture,abundance,2.25,2,COMPLETE
3910,0.5830983522020544,2025-03-03 19:45:39.162533,2025-03-03 19:45:39.476840,0 days 00:00:00.314307,gaussian_mixture,abundance,2.4000000000000004,2,COMPLETE
3911,0.5948596584458474,2025-03-03 19:45:39.478840,2025-03-03 19:45:39.802168,0 days 00:00:00.323328,gaussian_mixture,abundance,2.2,2,COMPLETE
3912,0.36894501297109344,2025-03-03 19:45:39.804171,2025-03-03 19:45:40.100054,0 days 00:00:00.295883,gaussian_mixture,abundance,2.5,2,COMPLETE
3913,0.27068396467203415,2025-03-03 19:45:40.102049,2025-03-03 19:45:40.392830,0 days 00:00:00.290781,gaussian_mixture,abundance,2.0,2,COMPLETE
3914,0.013305558518790783,2025-03-03 19:45:40.394827,2025-03-03 19:45:42.041084,0 days 00:00:01.646257,gaussian_mixture,presence,10.0,2,COMPLETE
3915,0.355189905250313,2025-03-03 19:45:42.043086,2025-03-03 19:45:42.332279,0 days 00:00:00.289193,gaussian_mixture,abundance,2.5500000000000003,2,COMPLETE
3916,0.48963096684566504,2025-03-03 19:45:42.334652,2025-03-03 19:45:42.632984,0 days 00:00:00.298332,gaussian_mixture,abundance,2.25,2,COMPLETE
3917,0.5126286470977028,2025-03-03 19:45:42.635183,2025-03-03 19:45:42.963141,0 days 00:00:00.327958,gaussian_mixture,abundance,2.1,4,COMPLETE
3918,0.4433990696333427,2025-03-03 19:45:42.966139,2025-03-03 19:45:43.273772,0 days 00:00:00.307633,gaussian_mixture,abundance,2.35,6,COMPLETE
3919,0.4448795373282614,2025-03-03 19:45:43.275766,2025-03-03 19:45:43.579866,0 days 00:00:00.304100,gaussian_mixture,abundance,2.3000000000000003,2,COMPLETE
3920,0.488371554085667,2025-03-03 19:45:43.582852,2025-03-03 19:45:43.900335,0 days 00:00:00.317483,gaussian_mixture,abundance,2.25,2,COMPLETE
3921,0.4290229625739269,2025-03-03 19:45:43.903344,2025-03-03 19:45:44.205239,0 days 00:00:00.301895,kmeans,abundance,2.15,2,COMPLETE
3922,0.7296597712096574,2025-03-03 19:45:44.207214,2025-03-03 19:45:44.517455,0 days 00:00:00.310241,gaussian_mixture,abundance,2.4000000000000004,2,COMPLETE
3923,0.5286016495770394,2025-03-03 19:45:44.519451,2025-03-03 19:45:44.820014,0 days 00:00:00.300563,gaussian_mixture,abundance,2.45,2,COMPLETE
3924,0.38860211788665844,2025-03-03 19:45:44.822012,2025-03-03 19:45:45.129021,0 days 00:00:00.307009,gaussian_mixture,abundance,2.4000000000000004,2,COMPLETE
3925,0.4097761109381327,2025-03-03 19:45:45.131010,2025-03-03 19:45:45.421721,0 days 00:00:00.290711,gaussian_mixture,abundance,2.5,2,COMPLETE
3926,0.5816144611775135,2025-03-03 19:45:45.424737,2025-03-03 19:45:45.796896,0 days 00:00:00.372159,gaussian_mixture,abundance,2.5500000000000003,2,COMPLETE
3927,0.36224693076778725,2025-03-03 19:45:45.800278,2025-03-03 19:45:46.103280,0 days 00:00:00.303002,gaussian_mixture,abundance,2.5,2,COMPLETE
3928,0.37633488288599914,2025-03-03 19:45:46.105299,2025-03-03 19:45:46.415923,0 days 00:00:00.310624,gaussian_mixture,abundance,2.45,2,COMPLETE
3929,0.6277270451816488,2025-03-03 19:45:46.417927,2025-03-03 19:45:46.711066,0 days 00:00:00.293139,gaussian_mixture,abundance,2.45,2,COMPLETE
3930,0.5631057237368076,2025-03-03 19:45:46.713064,2025-03-03 19:45:47.006754,0 days 00:00:00.293690,gaussian_mixture,abundance,2.45,3,COMPLETE
3931,0.5255101415971508,2025-03-03 19:45:47.009757,2025-03-03 19:45:47.301236,0 days 00:00:00.291479,gaussian_mixture,abundance,2.4000000000000004,2,COMPLETE
3932,0.6066481497252063,2025-03-03 19:45:47.304235,2025-03-03 19:45:47.591023,0 days 00:00:00.286788,gaussian_mixture,abundance,2.45,2,COMPLETE
3933,0.6525668662446016,2025-03-03 19:45:47.593017,2025-03-03 19:45:47.884643,0 days 00:00:00.291626,gaussian_mixture,abundance,2.45,2,COMPLETE
3934,0.40889503454563875,2025-03-03 19:45:47.885645,2025-03-03 19:45:48.194199,0 days 00:00:00.308554,gaussian_mixture,abundance,2.5,2,COMPLETE
3935,0.019751192409053587,2025-03-03 19:45:48.197201,2025-03-03 19:45:49.678629,0 days 00:00:01.481428,gaussian_mixture,presence,10.0,2,COMPLETE
3936,0.617907986108441,2025-03-03 19:45:49.680618,2025-03-03 19:45:49.976535,0 days 00:00:00.295917,gaussian_mixture,abundance,2.5,2,COMPLETE
3937,0.2613452887466822,2025-03-03 19:45:49.978050,2025-03-03 19:45:50.286651,0 days 00:00:00.308601,gaussian_mixture,abundance,2.4000000000000004,2,COMPLETE
3938,0.4131115151953769,2025-03-03 19:45:50.288654,2025-03-03 19:45:50.579812,0 days 00:00:00.291158,gaussian_mixture,abundance,2.4000000000000004,2,COMPLETE
3939,0.4889397174595624,2025-03-03 19:45:50.580813,2025-03-03 19:45:50.882248,0 days 00:00:00.301435,gaussian_mixture,abundance,2.5,2,COMPLETE
3940,0.529866686621969,2025-03-03 19:45:50.884238,2025-03-03 19:45:51.171205,0 days 00:00:00.286967,kmeans,abundance,2.4000000000000004,2,COMPLETE
3941,0.6202741080750604,2025-03-03 19:45:51.172205,2025-03-03 19:45:51.470052,0 days 00:00:00.297847,gaussian_mixture,abundance,2.35,2,COMPLETE
3942,0.43401361509826053,2025-03-03 19:45:51.471057,2025-03-03 19:45:51.767700,0 days 00:00:00.296643,gaussian_mixture,abundance,2.5500000000000003,2,COMPLETE
3943,0.5167524230789177,2025-03-03 19:45:51.769704,2025-03-03 19:45:52.071531,0 days 00:00:00.301827,gaussian_mixture,abundance,2.4000000000000004,2,COMPLETE
3944,0.5920203413968037,2025-03-03 19:45:52.073740,2025-03-03 19:45:52.387925,0 days 00:00:00.314185,gaussian_mixture,abundance,2.6,2,COMPLETE
3945,0.7171740049356445,2025-03-03 19:45:52.389930,2025-03-03 19:45:52.689157,0 days 00:00:00.299227,gaussian_mixture,abundance,2.4000000000000004,2,COMPLETE
3946,0.534701634953791,2025-03-03 19:45:52.691163,2025-03-03 19:45:52.986984,0 days 00:00:00.295821,gaussian_mixture,abundance,2.45,2,COMPLETE
3947,0.7054126986918515,2025-03-03 19:45:52.988974,2025-03-03 19:45:53.293068,0 days 00:00:00.304094,gaussian_mixture,abundance,2.4000000000000004,2,COMPLETE
3948,0.28746176444833554,2025-03-03 19:45:53.294070,2025-03-03 19:45:53.598802,0 days 00:00:00.304732,gaussian_mixture,abundance,2.5,2,COMPLETE
3949,0.6329362759455287,2025-03-03 19:45:53.600792,2025-03-03 19:45:53.929050,0 days 00:00:00.328258,gaussian_mixture,abundance,2.35,2,COMPLETE
3950,0.5285913918893197,2025-03-03 19:45:53.931052,2025-03-03 19:45:54.242381,0 days 00:00:00.311329,gaussian_mixture,abundance,2.45,2,COMPLETE
3951,0.36102179574781135,2025-03-03 19:45:54.244835,2025-03-03 19:45:54.555487,0 days 00:00:00.310652,gaussian_mixture,abundance,2.5500000000000003,2,COMPLETE
3952,0.09499611732822963,2025-03-03 19:45:54.557494,2025-03-03 19:45:55.991439,0 days 00:00:01.433945,gaussian_mixture,presence,45.0,2,COMPLETE
3953,0.5966284709591211,2025-03-03 19:45:55.993443,2025-03-03 19:45:56.330994,0 days 00:00:00.337551,gaussian_mixture,abundance,2.4000000000000004,2,COMPLETE
3954,0.5979410800332114,2025-03-03 19:45:56.333984,2025-03-03 19:45:56.694512,0 days 00:00:00.360528,gaussian_mixture,abundance,2.35,5,COMPLETE
3955,0.40100144713263886,2025-03-03 19:45:56.697510,2025-03-03 19:45:57.073364,0 days 00:00:00.375854,gaussian_mixture,abundance,2.45,2,COMPLETE
3956,0.2183561153078566,2025-03-03 19:45:57.076364,2025-03-03 19:45:57.432046,0 days 00:00:00.355682,gaussian_mixture,abundance,2.35,2,COMPLETE
3957,0.5000956919679378,2025-03-03 19:45:57.434047,2025-03-03 19:45:57.775708,0 days 00:00:00.341661,gaussian_mixture,abundance,2.4000000000000004,2,COMPLETE
3958,0.45222988162100614,2025-03-03 19:45:57.778712,2025-03-03 19:45:58.118823,0 days 00:00:00.340111,gaussian_mixture,abundance,2.4000000000000004,2,COMPLETE
3959,0.6295229887681095,2025-03-03 19:45:58.121817,2025-03-03 19:45:58.438142,0 days 00:00:00.316325,gaussian_mixture,abundance,2.35,2,COMPLETE
3960,0.1514114484924541,2025-03-03 19:45:58.439127,2025-03-03 19:45:58.789090,0 days 00:00:00.349963,kmeans,abundance,2.35,2,COMPLETE
3961,0.6632689917425679,2025-03-03 19:45:58.792109,2025-03-03 19:45:59.141705,0 days 00:00:00.349596,gaussian_mixture,abundance,2.35,2,COMPLETE
3962,0.5737850254431371,2025-03-03 19:45:59.143701,2025-03-03 19:45:59.464378,0 days 00:00:00.320677,gaussian_mixture,abundance,2.4000000000000004,2,COMPLETE
3963,0.5335575114872793,2025-03-03 19:45:59.466368,2025-03-03 19:45:59.764031,0 days 00:00:00.297663,gaussian_mixture,abundance,2.5,2,COMPLETE
3964,0.51719946336352,2025-03-03 19:45:59.766031,2025-03-03 19:46:00.137015,0 days 00:00:00.370984,gaussian_mixture,abundance,2.45,2,COMPLETE
3965,0.3747075825740784,2025-03-03 19:46:00.141007,2025-03-03 19:46:00.503028,0 days 00:00:00.362021,gaussian_mixture,abundance,2.6,2,COMPLETE
3966,0.49785634550448676,2025-03-03 19:46:00.505034,2025-03-03 19:46:00.840049,0 days 00:00:00.335015,gaussian_mixture,abundance,2.5,4,COMPLETE
3967,0.4907971687055797,2025-03-03 19:46:00.841046,2025-03-03 19:46:01.149709,0 days 00:00:00.308663,gaussian_mixture,abundance,2.35,2,COMPLETE
3968,0.49445869273536686,2025-03-03 19:46:01.150711,2025-03-03 19:46:01.446433,0 days 00:00:00.295722,gaussian_mixture,abundance,2.45,2,COMPLETE
3969,0.5059476514216298,2025-03-03 19:46:01.448437,2025-03-03 19:46:01.847289,0 days 00:00:00.398852,gaussian_mixture,abundance,2.4000000000000004,2,COMPLETE
3970,0.5773612913416375,2025-03-03 19:46:01.849283,2025-03-03 19:46:02.202077,0 days 00:00:00.352794,gaussian_mixture,abundance,2.35,2,COMPLETE
3971,0.018222990295913236,2025-03-03 19:46:02.204076,2025-03-03 19:46:03.654717,0 days 00:00:01.450641,gaussian_mixture,presence,10.0,2,COMPLETE
3972,0.4436869465439332,2025-03-03 19:46:03.657708,2025-03-03 19:46:04.012645,0 days 00:00:00.354937,gaussian_mixture,abundance,2.35,2,COMPLETE
3973,0.33678837163160574,2025-03-03 19:46:04.016617,2025-03-03 19:46:04.326601,0 days 00:00:00.309984,gaussian_mixture,abundance,2.35,2,COMPLETE
3974,0.4470467464975142,2025-03-03 19:46:04.328600,2025-03-03 19:46:04.619498,0 days 00:00:00.290898,gaussian_mixture,abundance,2.45,2,COMPLETE
3975,0.44785386263333765,2025-03-03 19:46:04.622491,2025-03-03 19:46:04.929793,0 days 00:00:00.307302,gaussian_mixture,abundance,2.3000000000000003,2,COMPLETE
3976,0.5653832668553063,2025-03-03 19:46:04.932787,2025-03-03 19:46:05.333439,0 days 00:00:00.400652,gaussian_mixture,abundance,2.5500000000000003,2,COMPLETE
3977,0.34855290039007075,2025-03-03 19:46:05.335441,2025-03-03 19:46:05.618337,0 days 00:00:00.282896,kmeans,abundance,2.4000000000000004,2,COMPLETE
3978,0.4691492052570633,2025-03-03 19:46:05.621330,2025-03-03 19:46:05.918038,0 days 00:00:00.296708,gaussian_mixture,abundance,2.3000000000000003,2,COMPLETE
3979,0.5883002885292854,2025-03-03 19:46:05.919824,2025-03-03 19:46:06.212656,0 days 00:00:00.292832,gaussian_mixture,abundance,2.45,2,COMPLETE
3980,0.6634017623408495,2025-03-03 19:46:06.214647,2025-03-03 19:46:06.510711,0 days 00:00:00.296064,gaussian_mixture,abundance,2.3000000000000003,2,COMPLETE
3981,0.5010170474184281,2025-03-03 19:46:06.512691,2025-03-03 19:46:06.816613,0 days 00:00:00.303922,gaussian_mixture,abundance,1.6,3,COMPLETE
3982,0.3724661507333918,2025-03-03 19:46:06.818611,2025-03-03 19:46:07.119071,0 days 00:00:00.300460,gaussian_mixture,abundance,2.4000000000000004,2,COMPLETE
3983,0.48094685652879104,2025-03-03 19:46:07.121059,2025-03-03 19:46:07.461525,0 days 00:00:00.340466,gaussian_mixture,abundance,0.8500000000000001,2,COMPLETE
3984,0.6078958533502034,2025-03-03 19:46:07.463526,2025-03-03 19:46:07.776159,0 days 00:00:00.312633,gaussian_mixture,abundance,2.3000000000000003,2,COMPLETE
3985,0.5296657322168183,2025-03-03 19:46:07.778144,2025-03-03 19:46:08.100276,0 days 00:00:00.322132,gaussian_mixture,abundance,2.35,2,COMPLETE
3986,0.35317000916595237,2025-03-03 19:46:08.102810,2025-03-03 19:46:08.417121,0 days 00:00:00.314311,gaussian_mixture,abundance,2.5,2,COMPLETE
3987,0.6282619979114271,2025-03-03 19:46:08.419124,2025-03-03 19:46:08.736553,0 days 00:00:00.317429,gaussian_mixture,abundance,2.35,2,COMPLETE
3988,0.5413383723340571,2025-03-03 19:46:08.737557,2025-03-03 19:46:09.055437,0 days 00:00:00.317880,gaussian_mixture,abundance,2.45,2,COMPLETE
