number,value,datetime_start,datetime_complete,duration,params_algorithm,params_filter_criteria,params_filter_threshold,params_k,state
2221,0.5169475673575634,2025-03-03 19:36:08.531910,2025-03-03 19:36:08.783581,0 days 00:00:00.251671,gaussian_mixture,abundance,2.35,2,COMPLETE
2222,0.4827213756500857,2025-03-03 19:36:08.785265,2025-03-03 19:36:09.036195,0 days 00:00:00.250930,gaussian_mixture,abundance,2.1,2,COMPLETE
2223,0.6258134337237374,2025-03-03 19:36:09.037189,2025-03-03 19:36:09.270423,0 days 00:00:00.233234,gaussian_mixture,abundance,2.2,2,COMPLETE
2224,0.566998954031531,2025-03-03 19:36:09.272415,2025-03-03 19:36:09.510061,0 days 00:00:00.237646,gaussian_mixture,abundance,2.3000000000000003,2,COMPLETE
2225,0.38089990093329795,2025-03-03 19:36:09.512610,2025-03-03 19:36:09.795752,0 days 00:00:00.283142,gaussian_mixture,abundance,1.1,3,COMPLETE
2226,0.6282619979114271,2025-03-03 19:36:09.797775,2025-03-03 19:36:10.071436,0 days 00:00:00.273661,gaussian_mixture,abundance,2.15,2,COMPLETE
2227,0.03103653681995691,2025-03-03 19:36:10.073431,2025-03-03 19:36:11.346525,0 days 00:00:01.273094,gaussian_mixture,presence,40.0,2,COMPLETE
2228,0.4876332956059314,2025-03-03 19:36:11.347526,2025-03-03 19:36:11.581659,0 days 00:00:00.234133,gaussian_mixture,abundance,2.25,2,COMPLETE
2229,0.28334728815735416,2025-03-03 19:36:11.582650,2025-03-03 19:36:11.819257,0 days 00:00:00.236607,gaussian_mixture,abundance,2.1,2,COMPLETE
2230,0.3609942737076211,2025-03-03 19:36:11.820260,2025-03-03 19:36:12.058365,0 days 00:00:00.238105,gaussian_mixture,abundance,2.0500000000000003,2,COMPLETE
2231,0.42414859470778676,2025-03-03 19:36:12.060346,2025-03-03 19:36:12.316941,0 days 00:00:00.256595,gaussian_mixture,abundance,2.2,2,COMPLETE
2232,0.26067281190509517,2025-03-03 19:36:12.319940,2025-03-03 19:36:12.600106,0 days 00:00:00.280166,kmeans,abundance,2.4000000000000004,2,COMPLETE
2233,0.4900369928264306,2025-03-03 19:36:12.601096,2025-03-03 19:36:12.844348,0 days 00:00:00.243252,gaussian_mixture,abundance,2.15,2,COMPLETE
2234,0.5684846035851152,2025-03-03 19:36:12.845335,2025-03-03 19:36:13.083681,0 days 00:00:00.238346,gaussian_mixture,abundance,2.3000000000000003,2,COMPLETE
2235,0.2338971631528916,2025-03-03 19:36:13.085683,2025-03-03 19:36:13.345320,0 days 00:00:00.259637,gaussian_mixture,abundance,2.0,2,COMPLETE
2236,0.6073454247198603,2025-03-03 19:36:13.347303,2025-03-03 19:36:13.590743,0 days 00:00:00.243440,gaussian_mixture,abundance,2.35,2,COMPLETE
2237,0.6364625176524863,2025-03-03 19:36:13.591738,2025-03-03 19:36:13.832035,0 days 00:00:00.240297,gaussian_mixture,abundance,2.1,2,COMPLETE
2238,0.31694756735756335,2025-03-03 19:36:13.834027,2025-03-03 19:36:14.070190,0 days 00:00:00.236163,gaussian_mixture,abundance,2.25,2,COMPLETE
2239,0.09786853120950652,2025-03-03 19:36:14.072180,2025-03-03 19:36:14.354647,0 days 00:00:00.282467,gaussian_mixture,abundance,0.30000000000000004,2,COMPLETE
2240,0.4860929724736806,2025-03-03 19:36:14.355637,2025-03-03 19:36:14.591377,0 days 00:00:00.235740,gaussian_mixture,abundance,2.2,2,COMPLETE
2241,0.38767460727306524,2025-03-03 19:36:14.593379,2025-03-03 19:36:14.830291,0 days 00:00:00.236912,gaussian_mixture,abundance,2.45,2,COMPLETE
2242,0.5270966478003779,2025-03-03 19:36:14.832278,2025-03-03 19:36:15.079443,0 days 00:00:00.247165,gaussian_mixture,abundance,2.25,2,COMPLETE
2243,0.467542216662825,2025-03-03 19:36:15.081446,2025-03-03 19:36:15.336342,0 days 00:00:00.254896,gaussian_mixture,abundance,2.15,2,COMPLETE
2244,0.5480281844655771,2025-03-03 19:36:15.337341,2025-03-03 19:36:15.572476,0 days 00:00:00.235135,gaussian_mixture,abundance,2.25,2,COMPLETE
2245,0.015109037859426504,2025-03-03 19:36:15.574470,2025-03-03 19:36:16.923811,0 days 00:00:01.349341,gaussian_mixture,presence,10.0,2,COMPLETE
2246,0.36699895403153093,2025-03-03 19:36:16.925803,2025-03-03 19:36:17.161632,0 days 00:00:00.235829,gaussian_mixture,abundance,2.35,2,COMPLETE
2247,0.25798828872071916,2025-03-03 19:36:17.163621,2025-03-03 19:36:17.415895,0 days 00:00:00.252274,gaussian_mixture,abundance,2.15,2,COMPLETE
2248,0.5485902454825092,2025-03-03 19:36:17.417505,2025-03-03 19:36:17.657420,0 days 00:00:00.239915,gaussian_mixture,abundance,2.5500000000000003,2,COMPLETE
2249,0.5352679790921301,2025-03-03 19:36:17.659422,2025-03-03 19:36:17.897213,0 days 00:00:00.237791,gaussian_mixture,abundance,2.0500000000000003,2,COMPLETE
2250,0.4292065538382518,2025-03-03 19:36:17.899215,2025-03-03 19:36:18.134282,0 days 00:00:00.235067,gaussian_mixture,abundance,2.3000000000000003,2,COMPLETE
2251,0.3041079133907616,2025-03-03 19:36:18.135263,2025-03-03 19:36:18.368420,0 days 00:00:00.233157,kmeans,abundance,2.1,2,COMPLETE
2252,0.6150538466470389,2025-03-03 19:36:18.369424,2025-03-03 19:36:18.609540,0 days 00:00:00.240116,gaussian_mixture,abundance,2.0,2,COMPLETE
2253,0.43238904037407355,2025-03-03 19:36:18.610526,2025-03-03 19:36:18.852381,0 days 00:00:00.241855,gaussian_mixture,abundance,2.2,5,COMPLETE
2254,0.6209058061007309,2025-03-03 19:36:18.854187,2025-03-03 19:36:19.093461,0 days 00:00:00.239274,gaussian_mixture,abundance,2.2,2,COMPLETE
2255,0.4970753466490504,2025-03-03 19:36:19.095460,2025-03-03 19:36:19.333153,0 days 00:00:00.237693,gaussian_mixture,abundance,2.45,2,COMPLETE
2256,0.32908993845960877,2025-03-03 19:36:19.334151,2025-03-03 19:36:19.575891,0 days 00:00:00.241740,gaussian_mixture,abundance,2.3000000000000003,2,COMPLETE
2257,0.31916773737203286,2025-03-03 19:36:19.577851,2025-03-03 19:36:19.817175,0 days 00:00:00.239324,gaussian_mixture,abundance,2.1,2,COMPLETE
2258,0.5058689328539063,2025-03-03 19:36:19.818927,2025-03-03 19:36:20.056649,0 days 00:00:00.237722,gaussian_mixture,abundance,2.25,2,COMPLETE
2259,0.7296597712096574,2025-03-03 19:36:20.057655,2025-03-03 19:36:20.293017,0 days 00:00:00.235362,gaussian_mixture,abundance,2.4000000000000004,2,COMPLETE
2260,0.37854297386988256,2025-03-03 19:36:20.295009,2025-03-03 19:36:20.525572,0 days 00:00:00.230563,gaussian_mixture,abundance,2.5500000000000003,2,COMPLETE
2261,0.6114394133177579,2025-03-03 19:36:20.527571,2025-03-03 19:36:20.765788,0 days 00:00:00.238217,gaussian_mixture,abundance,2.5,2,COMPLETE
2262,0.3757099793471191,2025-03-03 19:36:20.767784,2025-03-03 19:36:21.000443,0 days 00:00:00.232659,gaussian_mixture,abundance,2.45,2,COMPLETE
2263,0.5575411593603177,2025-03-03 19:36:21.002229,2025-03-03 19:36:21.235162,0 days 00:00:00.232933,gaussian_mixture,abundance,2.45,2,COMPLETE
2264,0.04924819340767998,2025-03-03 19:36:21.236161,2025-03-03 19:36:22.456106,0 days 00:00:01.219945,gaussian_mixture,presence,65.0,2,COMPLETE
2265,0.5161056256153067,2025-03-03 19:36:22.458104,2025-03-03 19:36:22.697665,0 days 00:00:00.239561,gaussian_mixture,abundance,2.5,2,COMPLETE
2266,0.18997879780558055,2025-03-03 19:36:22.699350,2025-03-03 19:36:22.931301,0 days 00:00:00.231951,gaussian_mixture,abundance,2.45,2,COMPLETE
2267,0.398549757424118,2025-03-03 19:36:22.933300,2025-03-03 19:36:23.167978,0 days 00:00:00.234678,gaussian_mixture,abundance,2.4000000000000004,2,COMPLETE
2268,0.42551282002615665,2025-03-03 19:36:23.169977,2025-03-03 19:36:23.404310,0 days 00:00:00.234333,gaussian_mixture,abundance,2.4000000000000004,2,COMPLETE
2269,0.37088398279632917,2025-03-03 19:36:23.406117,2025-03-03 19:36:23.636885,0 days 00:00:00.230768,gaussian_mixture,abundance,2.5,2,COMPLETE
2270,0.29094256283803555,2025-03-03 19:36:23.637887,2025-03-03 19:36:23.892403,0 days 00:00:00.254516,gaussian_mixture,abundance,2.5500000000000003,2,COMPLETE
2271,0.5011692928734188,2025-03-03 19:36:23.894328,2025-03-03 19:36:24.131395,0 days 00:00:00.237067,kmeans,abundance,2.45,2,COMPLETE
2272,0.562003989042619,2025-03-03 19:36:24.133390,2025-03-03 19:36:24.400553,0 days 00:00:00.267163,gaussian_mixture,abundance,2.4000000000000004,2,COMPLETE
2273,0.11802200664285319,2025-03-03 19:36:24.402552,2025-03-03 19:36:24.636896,0 days 00:00:00.234344,gaussian_mixture,abundance,2.45,2,COMPLETE
2274,0.5273950685231222,2025-03-03 19:36:24.637895,2025-03-03 19:36:24.871107,0 days 00:00:00.233212,gaussian_mixture,abundance,2.4000000000000004,2,COMPLETE
2275,0.6172538566663234,2025-03-03 19:36:24.873111,2025-03-03 19:36:25.105595,0 days 00:00:00.232484,gaussian_mixture,abundance,2.4000000000000004,2,COMPLETE
2276,0.46817434849541417,2025-03-03 19:36:25.106598,2025-03-03 19:36:25.341560,0 days 00:00:00.234962,gaussian_mixture,abundance,2.5,2,COMPLETE
2277,0.33442368064356376,2025-03-03 19:36:25.343554,2025-03-03 19:36:25.577703,0 days 00:00:00.234149,gaussian_mixture,abundance,2.4000000000000004,2,COMPLETE
2278,0.5932471079018676,2025-03-03 19:36:25.579696,2025-03-03 19:36:25.813046,0 days 00:00:00.233350,gaussian_mixture,abundance,2.45,2,COMPLETE
2279,0.43663436098179964,2025-03-03 19:36:25.815068,2025-03-03 19:36:26.063813,0 days 00:00:00.248745,gaussian_mixture,abundance,2.35,2,COMPLETE
2280,0.35320508409293727,2025-03-03 19:36:26.065818,2025-03-03 19:36:26.302229,0 days 00:00:00.236411,gaussian_mixture,abundance,2.35,2,COMPLETE
2281,0.4352430775708703,2025-03-03 19:36:26.303231,2025-03-03 19:36:26.548290,0 days 00:00:00.245059,gaussian_mixture,abundance,2.5,6,COMPLETE
2282,0.42188101918300963,2025-03-03 19:36:26.550089,2025-03-03 19:36:26.798589,0 days 00:00:00.248500,gaussian_mixture,abundance,2.35,4,COMPLETE
2283,0.034500130669220135,2025-03-03 19:36:26.800395,2025-03-03 19:36:28.161647,0 days 00:00:01.361252,gaussian_mixture,presence,10.0,2,COMPLETE
2284,0.7159106958287792,2025-03-03 19:36:28.163871,2025-03-03 19:36:28.404388,0 days 00:00:00.240517,gaussian_mixture,abundance,2.35,2,COMPLETE
2285,0.6997070428222841,2025-03-03 19:36:28.406385,2025-03-03 19:36:28.645460,0 days 00:00:00.239075,gaussian_mixture,abundance,2.4000000000000004,2,COMPLETE
2286,0.6871638149695389,2025-03-03 19:36:28.646460,2025-03-03 19:36:28.890018,0 days 00:00:00.243558,gaussian_mixture,abundance,2.4000000000000004,2,COMPLETE
2287,0.5223982529551152,2025-03-03 19:36:28.891815,2025-03-03 19:36:29.129290,0 days 00:00:00.237475,gaussian_mixture,abundance,2.45,2,COMPLETE
2288,0.6224100384577351,2025-03-03 19:36:29.131289,2025-03-03 19:36:29.367948,0 days 00:00:00.236659,gaussian_mixture,abundance,2.35,2,COMPLETE
2289,0.5420913214749595,2025-03-03 19:36:29.368934,2025-03-03 19:36:29.604971,0 days 00:00:00.236037,gaussian_mixture,abundance,2.4000000000000004,2,COMPLETE
2290,0.5251994342072187,2025-03-03 19:36:29.605968,2025-03-03 19:36:29.833610,0 days 00:00:00.227642,kmeans,abundance,2.45,2,COMPLETE
2291,0.6113896893201171,2025-03-03 19:36:29.834611,2025-03-03 19:36:30.070489,0 days 00:00:00.235878,gaussian_mixture,abundance,2.35,2,COMPLETE
2292,0.5522915012887267,2025-03-03 19:36:30.071490,2025-03-03 19:36:30.328645,0 days 00:00:00.257155,gaussian_mixture,abundance,2.4000000000000004,2,COMPLETE
2293,0.28795803938890524,2025-03-03 19:36:30.329937,2025-03-03 19:36:30.568330,0 days 00:00:00.238393,gaussian_mixture,abundance,2.35,2,COMPLETE
2294,0.401477512273061,2025-03-03 19:36:30.570325,2025-03-03 19:36:30.805564,0 days 00:00:00.235239,gaussian_mixture,abundance,2.35,2,COMPLETE
2295,0.36800326653543225,2025-03-03 19:36:30.806558,2025-03-03 19:36:31.042474,0 days 00:00:00.235916,gaussian_mixture,abundance,2.5500000000000003,2,COMPLETE
2296,0.37081999635619656,2025-03-03 19:36:31.044483,2025-03-03 19:36:31.289865,0 days 00:00:00.245382,gaussian_mixture,abundance,2.45,2,COMPLETE
2297,0.3833824605831657,2025-03-03 19:36:31.291619,2025-03-03 19:36:31.527997,0 days 00:00:00.236378,gaussian_mixture,abundance,2.4000000000000004,2,COMPLETE
2298,0.36326497989930145,2025-03-03 19:36:31.529992,2025-03-03 19:36:31.764595,0 days 00:00:00.234603,gaussian_mixture,abundance,2.35,2,COMPLETE
2299,0.2610681140933685,2025-03-03 19:36:31.766589,2025-03-03 19:36:31.998939,0 days 00:00:00.232350,gaussian_mixture,abundance,2.5,2,COMPLETE
2300,0.617102739379263,2025-03-03 19:36:32.001382,2025-03-03 19:36:32.244027,0 days 00:00:00.242645,gaussian_mixture,abundance,2.45,2,COMPLETE
2301,0.3791969318077032,2025-03-03 19:36:32.245026,2025-03-03 19:36:32.490483,0 days 00:00:00.245457,gaussian_mixture,abundance,2.35,2,COMPLETE
2302,0.014509026378668997,2025-03-03 19:36:32.492483,2025-03-03 19:36:33.862369,0 days 00:00:01.369886,gaussian_mixture,presence,10.0,2,COMPLETE
2303,0.5908508965703757,2025-03-03 19:36:33.864369,2025-03-03 19:36:34.102668,0 days 00:00:00.238299,gaussian_mixture,abundance,2.35,2,COMPLETE
2304,0.6468320307457226,2025-03-03 19:36:34.104654,2025-03-03 19:36:34.345255,0 days 00:00:00.240601,gaussian_mixture,abundance,2.4000000000000004,2,COMPLETE
2305,0.5235485304925109,2025-03-03 19:36:34.347254,2025-03-03 19:36:34.593050,0 days 00:00:00.245796,gaussian_mixture,abundance,2.3000000000000003,2,COMPLETE
2306,0.5882075851104556,2025-03-03 19:36:34.594904,2025-03-03 19:36:34.841929,0 days 00:00:00.247025,gaussian_mixture,abundance,2.5,2,COMPLETE
2307,0.48114810708137484,2025-03-03 19:36:34.843931,2025-03-03 19:36:35.084062,0 days 00:00:00.240131,gaussian_mixture,abundance,2.45,4,COMPLETE
2308,0.47358592311759995,2025-03-03 19:36:35.085061,2025-03-03 19:36:35.319199,0 days 00:00:00.234138,gaussian_mixture,abundance,2.35,2,COMPLETE
2309,0.42805508423866306,2025-03-03 19:36:35.320199,2025-03-03 19:36:35.552834,0 days 00:00:00.232635,kmeans,abundance,2.4000000000000004,2,COMPLETE
2310,0.4064258827997948,2025-03-03 19:36:35.553833,2025-03-03 19:36:35.791973,0 days 00:00:00.238140,gaussian_mixture,abundance,2.3000000000000003,2,COMPLETE
2311,0.6376974644505164,2025-03-03 19:36:35.793980,2025-03-03 19:36:36.036804,0 days 00:00:00.242824,gaussian_mixture,abundance,2.3000000000000003,2,COMPLETE
2312,0.33098186304645244,2025-03-03 19:36:36.037805,2025-03-03 19:36:36.276465,0 days 00:00:00.238660,gaussian_mixture,abundance,2.5500000000000003,3,COMPLETE
2313,0.541896391688432,2025-03-03 19:36:36.278469,2025-03-03 19:36:36.514195,0 days 00:00:00.235726,gaussian_mixture,abundance,2.35,2,COMPLETE
2314,0.3523011471773877,2025-03-03 19:36:36.515998,2025-03-03 19:36:36.769624,0 days 00:00:00.253626,gaussian_mixture,abundance,2.4000000000000004,2,COMPLETE
2315,0.2612630438798961,2025-03-03 19:36:36.771622,2025-03-03 19:36:37.010527,0 days 00:00:00.238905,gaussian_mixture,abundance,2.35,2,COMPLETE
2316,0.4195820451986346,2025-03-03 19:36:37.012518,2025-03-03 19:36:37.249456,0 days 00:00:00.236938,gaussian_mixture,abundance,2.3000000000000003,2,COMPLETE
2317,0.4514266303111964,2025-03-03 19:36:37.251101,2025-03-03 19:36:37.485939,0 days 00:00:00.234838,gaussian_mixture,abundance,2.45,2,COMPLETE
2318,0.44768290913713793,2025-03-03 19:36:37.487806,2025-03-03 19:36:37.727133,0 days 00:00:00.239327,gaussian_mixture,abundance,2.3000000000000003,2,COMPLETE
2319,0.48699483897019,2025-03-03 19:36:37.729150,2025-03-03 19:36:37.963200,0 days 00:00:00.234050,gaussian_mixture,abundance,2.5,2,COMPLETE
2320,0.41202386792503304,2025-03-03 19:36:37.965200,2025-03-03 19:36:38.212817,0 days 00:00:00.247617,gaussian_mixture,abundance,2.4000000000000004,2,COMPLETE
2321,0.069008558911917,2025-03-03 19:36:38.214965,2025-03-03 19:36:39.523192,0 days 00:00:01.308227,gaussian_mixture,presence,55.0,2,COMPLETE
2322,0.5932832251718411,2025-03-03 19:36:39.526193,2025-03-03 19:36:39.792197,0 days 00:00:00.266004,gaussian_mixture,abundance,2.3000000000000003,2,COMPLETE
2323,0.4651426322455798,2025-03-03 19:36:39.794202,2025-03-03 19:36:40.035964,0 days 00:00:00.241762,gaussian_mixture,abundance,2.3000000000000003,2,COMPLETE
2324,0.379863119033154,2025-03-03 19:36:40.036965,2025-03-03 19:36:40.273879,0 days 00:00:00.236914,gaussian_mixture,abundance,2.35,2,COMPLETE
2325,0.5377362873041276,2025-03-03 19:36:40.275874,2025-03-03 19:36:40.515808,0 days 00:00:00.239934,gaussian_mixture,abundance,2.45,2,COMPLETE
2326,0.5113220454819526,2025-03-03 19:36:40.517803,2025-03-03 19:36:40.773387,0 days 00:00:00.255584,gaussian_mixture,abundance,2.4000000000000004,2,COMPLETE
2327,0.4700336762113467,2025-03-03 19:36:40.775386,2025-03-03 19:36:41.052721,0 days 00:00:00.277335,kmeans,abundance,1.4000000000000001,2,COMPLETE
2328,0.5607381562082837,2025-03-03 19:36:41.054336,2025-03-03 19:36:41.293440,0 days 00:00:00.239104,gaussian_mixture,abundance,2.3000000000000003,2,COMPLETE
2329,0.47919495583955596,2025-03-03 19:36:41.294425,2025-03-03 19:36:41.538745,0 days 00:00:00.244320,gaussian_mixture,abundance,2.35,5,COMPLETE
2330,0.4590241090161741,2025-03-03 19:36:41.540743,2025-03-03 19:36:41.777385,0 days 00:00:00.236642,gaussian_mixture,abundance,2.3000000000000003,2,COMPLETE
2331,0.4290722525055721,2025-03-03 19:36:41.779376,2025-03-03 19:36:42.016443,0 days 00:00:00.237067,gaussian_mixture,abundance,2.25,2,COMPLETE
2332,0.38790949454597534,2025-03-03 19:36:42.018442,2025-03-03 19:36:42.249517,0 days 00:00:00.231075,gaussian_mixture,abundance,2.5500000000000003,2,COMPLETE
2333,0.38680418307749664,2025-03-03 19:36:42.251516,2025-03-03 19:36:42.501945,0 days 00:00:00.250429,gaussian_mixture,abundance,2.4000000000000004,2,COMPLETE
2334,0.37863076224641,2025-03-03 19:36:42.503947,2025-03-03 19:36:42.754517,0 days 00:00:00.250570,gaussian_mixture,abundance,2.45,2,COMPLETE
2335,0.5351227547552725,2025-03-03 19:36:42.756517,2025-03-03 19:36:42.992884,0 days 00:00:00.236367,gaussian_mixture,abundance,2.25,2,COMPLETE
2336,0.4526839901994146,2025-03-03 19:36:42.994872,2025-03-03 19:36:43.242967,0 days 00:00:00.248095,gaussian_mixture,abundance,2.5,2,COMPLETE
2337,0.3734940452396118,2025-03-03 19:36:43.243962,2025-03-03 19:36:43.483610,0 days 00:00:00.239648,gaussian_mixture,abundance,2.3000000000000003,3,COMPLETE
2338,0.34644918772369576,2025-03-03 19:36:43.484607,2025-03-03 19:36:43.722877,0 days 00:00:00.238270,gaussian_mixture,abundance,2.35,2,COMPLETE
2339,0.5491639319455223,2025-03-03 19:36:43.724442,2025-03-03 19:36:43.963240,0 days 00:00:00.238798,gaussian_mixture,abundance,2.25,2,COMPLETE
2340,0.6555877495959652,2025-03-03 19:36:43.965236,2025-03-03 19:36:44.202588,0 days 00:00:00.237352,gaussian_mixture,abundance,2.35,2,COMPLETE
2341,0.008415279899227074,2025-03-03 19:36:44.204351,2025-03-03 19:36:45.624439,0 days 00:00:01.420088,gaussian_mixture,presence,10.0,2,COMPLETE
2342,0.6595412340406492,2025-03-03 19:36:45.626429,2025-03-03 19:36:45.862316,0 days 00:00:00.235887,gaussian_mixture,abundance,2.4000000000000004,2,COMPLETE
2343,0.5304718613299875,2025-03-03 19:36:45.864124,2025-03-03 19:36:46.099319,0 days 00:00:00.235195,gaussian_mixture,abundance,2.25,2,COMPLETE
2344,0.5581434607424189,2025-03-03 19:36:46.100319,2025-03-03 19:36:46.344360,0 days 00:00:00.244041,gaussian_mixture,abundance,2.25,2,COMPLETE
2345,0.12912472476991105,2025-03-03 19:36:46.346365,2025-03-03 19:36:46.570432,0 days 00:00:00.224067,kmeans,abundance,2.4000000000000004,2,COMPLETE
2346,0.5693698142564336,2025-03-03 19:36:46.572239,2025-03-03 19:36:46.819980,0 days 00:00:00.247741,gaussian_mixture,abundance,2.3000000000000003,2,COMPLETE
2347,0.382865324984192,2025-03-03 19:36:46.821977,2025-03-03 19:36:47.053858,0 days 00:00:00.231881,gaussian_mixture,abundance,2.5,2,COMPLETE
2348,0.6797217905443015,2025-03-03 19:36:47.055858,2025-03-03 19:36:47.301103,0 days 00:00:00.245245,gaussian_mixture,abundance,2.2,2,COMPLETE
2349,0.41473187915436044,2025-03-03 19:36:47.302103,2025-03-03 19:36:47.547572,0 days 00:00:00.245469,gaussian_mixture,abundance,2.3000000000000003,2,COMPLETE
2350,0.2883912436115995,2025-03-03 19:36:47.548572,2025-03-03 19:36:47.786247,0 days 00:00:00.237675,gaussian_mixture,abundance,2.35,2,COMPLETE
2351,0.5025699019361921,2025-03-03 19:36:47.787247,2025-03-03 19:36:48.029575,0 days 00:00:00.242328,gaussian_mixture,abundance,1.55,2,COMPLETE
2352,0.3313893041344524,2025-03-03 19:36:48.031375,2025-03-03 19:36:48.291220,0 days 00:00:00.259845,gaussian_mixture,abundance,0.6000000000000001,2,COMPLETE
2353,0.4962166247370887,2025-03-03 19:36:48.293220,2025-03-03 19:36:48.527339,0 days 00:00:00.234119,gaussian_mixture,abundance,2.2,2,COMPLETE
2354,0.6093395350645647,2025-03-03 19:36:48.529334,2025-03-03 19:36:48.766159,0 days 00:00:00.236825,gaussian_mixture,abundance,2.25,2,COMPLETE
2355,0.4577931444420734,2025-03-03 19:36:48.767154,2025-03-03 19:36:49.003031,0 days 00:00:00.235877,gaussian_mixture,abundance,2.45,2,COMPLETE
2356,0.44680259286319624,2025-03-03 19:36:49.005031,2025-03-03 19:36:49.269040,0 days 00:00:00.264009,gaussian_mixture,abundance,2.3000000000000003,2,COMPLETE
2357,0.44824455365319676,2025-03-03 19:36:49.271038,2025-03-03 19:36:49.526043,0 days 00:00:00.255005,gaussian_mixture,abundance,2.2,2,COMPLETE
2358,0.07171256266603024,2025-03-03 19:36:49.528033,2025-03-03 19:36:50.887448,0 days 00:00:01.359415,gaussian_mixture,presence,30.0,2,COMPLETE
2359,0.5015936535654089,2025-03-03 19:36:50.889446,2025-03-03 19:36:51.130569,0 days 00:00:00.241123,gaussian_mixture,abundance,2.35,2,COMPLETE
2360,0.5130606017320043,2025-03-03 19:36:51.131568,2025-03-03 19:36:51.371653,0 days 00:00:00.240085,gaussian_mixture,abundance,2.25,2,COMPLETE
2361,0.5783173674346977,2025-03-03 19:36:51.373652,2025-03-03 19:36:51.613811,0 days 00:00:00.240159,gaussian_mixture,abundance,2.4000000000000004,3,COMPLETE
2362,0.6307387831906717,2025-03-03 19:36:51.614998,2025-03-03 19:36:51.865611,0 days 00:00:00.250613,gaussian_mixture,abundance,2.2,2,COMPLETE
2363,0.632556189693099,2025-03-03 19:36:51.867615,2025-03-03 19:36:52.103071,0 days 00:00:00.235456,gaussian_mixture,abundance,2.15,2,COMPLETE
2364,0.37944753549774574,2025-03-03 19:36:52.104878,2025-03-03 19:36:52.334575,0 days 00:00:00.229697,kmeans,abundance,2.35,2,COMPLETE
2365,0.5817397315436154,2025-03-03 19:36:52.336569,2025-03-03 19:36:52.582754,0 days 00:00:00.246185,gaussian_mixture,abundance,2.15,2,COMPLETE
2366,0.533273403106168,2025-03-03 19:36:52.584750,2025-03-03 19:36:52.821679,0 days 00:00:00.236929,gaussian_mixture,abundance,2.5,2,COMPLETE
2367,0.6029835475581553,2025-03-03 19:36:52.823679,2025-03-03 19:36:53.059203,0 days 00:00:00.235524,gaussian_mixture,abundance,2.3000000000000003,2,COMPLETE
