number,value,datetime_start,datetime_complete,duration,params_algorithm,params_filter_criteria,params_filter_threshold,params_k,state
2073,0.48319510835207363,2025-03-03 19:35:24.080942,2025-03-03 19:35:24.316013,0 days 00:00:00.235071,gaussian_mixture,abundance,2.4000000000000004,3,COMPLETE
2074,0.3737042907543956,2025-03-03 19:35:24.318008,2025-03-03 19:35:24.565418,0 days 00:00:00.247410,gaussian_mixture,abundance,0.8500000000000001,2,COMPLETE
2075,0.021700683299858796,2025-03-03 19:35:24.567410,2025-03-03 19:35:25.943521,0 days 00:00:01.376111,gaussian_mixture,presence,10.0,2,COMPLETE
2076,0.20885508991134422,2025-03-03 19:35:25.945521,2025-03-03 19:35:26.174155,0 days 00:00:00.228634,gaussian_mixture,abundance,2.15,2,COMPLETE
2077,0.48084508907853085,2025-03-03 19:35:26.176140,2025-03-03 19:35:26.403951,0 days 00:00:00.227811,gaussian_mixture,abundance,2.3000000000000003,2,COMPLETE
2078,0.27528955875940897,2025-03-03 19:35:26.405942,2025-03-03 19:35:26.636942,0 days 00:00:00.231000,gaussian_mixture,abundance,2.15,2,COMPLETE
2079,0.45175845477343624,2025-03-03 19:35:26.637939,2025-03-03 19:35:26.868939,0 days 00:00:00.231000,gaussian_mixture,abundance,2.25,2,COMPLETE
2080,0.5409546452527707,2025-03-03 19:35:26.870937,2025-03-03 19:35:27.102369,0 days 00:00:00.231432,gaussian_mixture,abundance,2.2,2,COMPLETE
2081,0.6197620523904895,2025-03-03 19:35:27.103365,2025-03-03 19:35:27.344345,0 days 00:00:00.240980,gaussian_mixture,abundance,2.4000000000000004,2,COMPLETE
2082,0.5338574221688029,2025-03-03 19:35:27.346355,2025-03-03 19:35:27.572704,0 days 00:00:00.226349,kmeans,abundance,2.35,2,COMPLETE
2083,0.43248747490893935,2025-03-03 19:35:27.574702,2025-03-03 19:35:27.814826,0 days 00:00:00.240124,gaussian_mixture,abundance,2.2,2,COMPLETE
2084,0.5701570778621505,2025-03-03 19:35:27.816817,2025-03-03 19:35:28.093342,0 days 00:00:00.276525,gaussian_mixture,abundance,2.1,4,COMPLETE
2085,0.5947647635296942,2025-03-03 19:35:28.094338,2025-03-03 19:35:28.362242,0 days 00:00:00.267904,gaussian_mixture,abundance,2.5,3,COMPLETE
2086,0.4667911887686661,2025-03-03 19:35:28.364230,2025-03-03 19:35:28.623011,0 days 00:00:00.258781,gaussian_mixture,abundance,2.25,2,COMPLETE
2087,0.5165113709179312,2025-03-03 19:35:28.625009,2025-03-03 19:35:28.861800,0 days 00:00:00.236791,gaussian_mixture,abundance,2.15,2,COMPLETE
2088,0.6051419088052015,2025-03-03 19:35:28.862810,2025-03-03 19:35:29.098173,0 days 00:00:00.235363,gaussian_mixture,abundance,2.3000000000000003,2,COMPLETE
2089,0.515444165855147,2025-03-03 19:35:29.099166,2025-03-03 19:35:29.339667,0 days 00:00:00.240501,gaussian_mixture,abundance,1.4500000000000002,2,COMPLETE
2090,0.5605269387661995,2025-03-03 19:35:29.341430,2025-03-03 19:35:29.584303,0 days 00:00:00.242873,gaussian_mixture,abundance,2.35,5,COMPLETE
2091,0.6691001849927931,2025-03-03 19:35:29.586309,2025-03-03 19:35:29.819401,0 days 00:00:00.233092,gaussian_mixture,abundance,2.45,2,COMPLETE
2092,0.4142394184064231,2025-03-03 19:35:29.820401,2025-03-03 19:35:30.051721,0 days 00:00:00.231320,gaussian_mixture,abundance,2.1,2,COMPLETE
2093,0.5796796500920715,2025-03-03 19:35:30.052715,2025-03-03 19:35:30.298510,0 days 00:00:00.245795,gaussian_mixture,abundance,2.2,2,COMPLETE
2094,0.06817659502728894,2025-03-03 19:35:30.299514,2025-03-03 19:35:31.637512,0 days 00:00:01.337998,gaussian_mixture,presence,15.0,2,COMPLETE
2095,0.6224695185114969,2025-03-03 19:35:31.638510,2025-03-03 19:35:31.867828,0 days 00:00:00.229318,gaussian_mixture,abundance,2.25,2,COMPLETE
2096,0.2879580393889053,2025-03-03 19:35:31.869823,2025-03-03 19:35:32.097912,0 days 00:00:00.228089,gaussian_mixture,abundance,2.15,2,COMPLETE
2097,0.6634017623408495,2025-03-03 19:35:32.098914,2025-03-03 19:35:32.341902,0 days 00:00:00.242988,gaussian_mixture,abundance,2.3000000000000003,2,COMPLETE
2098,0.35673202726787895,2025-03-03 19:35:32.343897,2025-03-03 19:35:32.601469,0 days 00:00:00.257572,gaussian_mixture,abundance,2.4000000000000004,6,COMPLETE
2099,0.5591318298635575,2025-03-03 19:35:32.602472,2025-03-03 19:35:32.837506,0 days 00:00:00.235034,gaussian_mixture,abundance,2.2,2,COMPLETE
2100,0.5315134031068002,2025-03-03 19:35:32.839312,2025-03-03 19:35:33.063380,0 days 00:00:00.224068,kmeans,abundance,2.15,2,COMPLETE
2101,0.3894089728482955,2025-03-03 19:35:33.064382,2025-03-03 19:35:33.300013,0 days 00:00:00.235631,gaussian_mixture,abundance,2.25,2,COMPLETE
2102,0.5560867552486879,2025-03-03 19:35:33.302011,2025-03-03 19:35:33.532757,0 days 00:00:00.230746,gaussian_mixture,abundance,2.1,2,COMPLETE
2103,0.4512418416854767,2025-03-03 19:35:33.533750,2025-03-03 19:35:33.766049,0 days 00:00:00.232299,gaussian_mixture,abundance,2.2,2,COMPLETE
2104,0.24680259286319628,2025-03-03 19:35:33.768601,2025-03-03 19:35:34.001759,0 days 00:00:00.233158,gaussian_mixture,abundance,2.35,2,COMPLETE
2105,0.33195109798729333,2025-03-03 19:35:34.002742,2025-03-03 19:35:34.235144,0 days 00:00:00.232402,gaussian_mixture,abundance,2.3000000000000003,2,COMPLETE
2106,0.31153825268899793,2025-03-03 19:35:34.236132,2025-03-03 19:35:34.477124,0 days 00:00:00.240992,gaussian_mixture,abundance,2.15,2,COMPLETE
2107,0.4231345464454267,2025-03-03 19:35:34.479123,2025-03-03 19:35:34.711363,0 days 00:00:00.232240,gaussian_mixture,abundance,2.45,2,COMPLETE
2108,0.2693023479969446,2025-03-03 19:35:34.712350,2025-03-03 19:35:34.947679,0 days 00:00:00.235329,gaussian_mixture,abundance,2.25,2,COMPLETE
2109,0.5655940701021398,2025-03-03 19:35:34.949482,2025-03-03 19:35:35.189492,0 days 00:00:00.240010,gaussian_mixture,abundance,2.1,2,COMPLETE
2110,0.3760464242613541,2025-03-03 19:35:35.191471,2025-03-03 19:35:35.423072,0 days 00:00:00.231601,gaussian_mixture,abundance,2.2,2,COMPLETE
2111,0.05562081583890849,2025-03-03 19:35:35.425074,2025-03-03 19:35:35.651501,0 days 00:00:00.226427,gaussian_mixture,abundance,2.5,2,COMPLETE
2112,0.3793608887748552,2025-03-03 19:35:35.653489,2025-03-03 19:35:35.880131,0 days 00:00:00.226642,gaussian_mixture,abundance,2.3000000000000003,2,COMPLETE
2113,0.001938158039304768,2025-03-03 19:35:35.882121,2025-03-03 19:35:37.262533,0 days 00:00:01.380412,gaussian_mixture,presence,10.0,2,COMPLETE
2114,0.3693598810781617,2025-03-03 19:35:37.263536,2025-03-03 19:35:37.494346,0 days 00:00:00.230810,gaussian_mixture,abundance,2.1,2,COMPLETE
2115,0.6054222198344281,2025-03-03 19:35:37.496343,2025-03-03 19:35:37.734874,0 days 00:00:00.238531,gaussian_mixture,abundance,2.4000000000000004,2,COMPLETE
2116,0.09310378818874483,2025-03-03 19:35:37.736678,2025-03-03 19:35:38.043519,0 days 00:00:00.306841,gaussian_mixture,abundance,0.2,2,COMPLETE
2117,0.7171740049356445,2025-03-03 19:35:38.045518,2025-03-03 19:35:38.281176,0 days 00:00:00.235658,gaussian_mixture,abundance,2.15,2,COMPLETE
2118,0.5632261314935414,2025-03-03 19:35:38.283159,2025-03-03 19:35:38.516749,0 days 00:00:00.233590,gaussian_mixture,abundance,2.25,2,COMPLETE
2119,0.4452399686122752,2025-03-03 19:35:38.517747,2025-03-03 19:35:38.759306,0 days 00:00:00.241559,gaussian_mixture,abundance,2.25,2,COMPLETE
2120,0.6101409063559491,2025-03-03 19:35:38.761314,2025-03-03 19:35:38.997564,0 days 00:00:00.236250,gaussian_mixture,abundance,2.2,2,COMPLETE
2121,0.49121740425453114,2025-03-03 19:35:38.998564,2025-03-03 19:35:39.226312,0 days 00:00:00.227748,kmeans,abundance,2.35,2,COMPLETE
2122,0.3950258007094901,2025-03-03 19:35:39.228310,2025-03-03 19:35:39.464067,0 days 00:00:00.235757,gaussian_mixture,abundance,2.2,2,COMPLETE
2123,0.2212765472693472,2025-03-03 19:35:39.466060,2025-03-03 19:35:39.724895,0 days 00:00:00.258835,gaussian_mixture,abundance,2.3000000000000003,2,COMPLETE
2124,0.6368292638230464,2025-03-03 19:35:39.726891,2025-03-03 19:35:39.981496,0 days 00:00:00.254605,gaussian_mixture,abundance,2.15,2,COMPLETE
2125,0.6013339886961185,2025-03-03 19:35:39.983494,2025-03-03 19:35:40.268750,0 days 00:00:00.285256,gaussian_mixture,abundance,2.25,2,COMPLETE
2126,0.4893133005213281,2025-03-03 19:35:40.270754,2025-03-03 19:35:40.537341,0 days 00:00:00.266587,gaussian_mixture,abundance,2.2,2,COMPLETE
2127,0.46799892771966756,2025-03-03 19:35:40.539341,2025-03-03 19:35:40.771274,0 days 00:00:00.231933,gaussian_mixture,abundance,2.3000000000000003,2,COMPLETE
2128,0.5753065877580047,2025-03-03 19:35:40.773035,2025-03-03 19:35:41.024675,0 days 00:00:00.251640,gaussian_mixture,abundance,2.4000000000000004,2,COMPLETE
2129,0.569080770138446,2025-03-03 19:35:41.026674,2025-03-03 19:35:41.258805,0 days 00:00:00.232131,gaussian_mixture,abundance,2.15,2,COMPLETE
2130,0.4470554677666364,2025-03-03 19:35:41.259799,2025-03-03 19:35:41.492461,0 days 00:00:00.232662,gaussian_mixture,abundance,2.25,2,COMPLETE
2131,0.38163991760442795,2025-03-03 19:35:41.493459,2025-03-03 19:35:41.725592,0 days 00:00:00.232133,gaussian_mixture,abundance,2.15,2,COMPLETE
2132,0.47948774853920745,2025-03-03 19:35:41.727585,2025-03-03 19:35:41.957832,0 days 00:00:00.230247,gaussian_mixture,abundance,2.45,2,COMPLETE
2133,0.05004423270995136,2025-03-03 19:35:41.959843,2025-03-03 19:35:43.234481,0 days 00:00:01.274638,gaussian_mixture,presence,95.0,2,COMPLETE
2134,0.474527060718385,2025-03-03 19:35:43.235488,2025-03-03 19:35:43.467563,0 days 00:00:00.232075,gaussian_mixture,abundance,2.35,2,COMPLETE
2135,0.48554047798333855,2025-03-03 19:35:43.469561,2025-03-03 19:35:43.699118,0 days 00:00:00.229557,gaussian_mixture,abundance,2.2,2,COMPLETE
2136,0.6289343762111583,2025-03-03 19:35:43.701117,2025-03-03 19:35:43.935253,0 days 00:00:00.234136,gaussian_mixture,abundance,2.3000000000000003,2,COMPLETE
2137,0.5361226634903717,2025-03-03 19:35:43.936249,2025-03-03 19:35:44.215944,0 days 00:00:00.279695,gaussian_mixture,abundance,2.2,2,COMPLETE
2138,0.4167945805179958,2025-03-03 19:35:44.217941,2025-03-03 19:35:44.493863,0 days 00:00:00.275922,kmeans,abundance,2.25,2,COMPLETE
2139,0.5763653448116101,2025-03-03 19:35:44.494860,2025-03-03 19:35:44.729606,0 days 00:00:00.234746,gaussian_mixture,abundance,2.35,2,COMPLETE
2140,0.4968804168625227,2025-03-03 19:35:44.731599,2025-03-03 19:35:44.964178,0 days 00:00:00.232579,gaussian_mixture,abundance,2.15,2,COMPLETE
2141,0.4446846075417337,2025-03-03 19:35:44.966176,2025-03-03 19:35:45.208248,0 days 00:00:00.242072,gaussian_mixture,abundance,2.25,2,COMPLETE
2142,0.3962878902934703,2025-03-03 19:35:45.209647,2025-03-03 19:35:45.446904,0 days 00:00:00.237257,gaussian_mixture,abundance,2.1,2,COMPLETE
2143,0.47135272117172206,2025-03-03 19:35:45.448900,2025-03-03 19:35:45.682010,0 days 00:00:00.233110,gaussian_mixture,abundance,2.35,2,COMPLETE
2144,0.17652054662236263,2025-03-03 19:35:45.682521,2025-03-03 19:35:45.923660,0 days 00:00:00.241139,gaussian_mixture,abundance,1.25,2,COMPLETE
2145,0.3429561196000678,2025-03-03 19:35:45.926657,2025-03-03 19:35:46.155095,0 days 00:00:00.228438,gaussian_mixture,abundance,2.5500000000000003,2,COMPLETE
2146,0.5298083321028766,2025-03-03 19:35:46.157092,2025-03-03 19:35:46.387745,0 days 00:00:00.230653,gaussian_mixture,abundance,2.2,2,COMPLETE
2147,0.25842719784589174,2025-03-03 19:35:46.388738,2025-03-03 19:35:46.617849,0 days 00:00:00.229111,gaussian_mixture,abundance,2.3000000000000003,2,COMPLETE
2148,0.20700411345474107,2025-03-03 19:35:46.619846,2025-03-03 19:35:46.848939,0 days 00:00:00.229093,gaussian_mixture,abundance,2.15,2,COMPLETE
2149,0.4153993590583709,2025-03-03 19:35:46.849932,2025-03-03 19:35:47.083127,0 days 00:00:00.233195,gaussian_mixture,abundance,2.45,2,COMPLETE
2150,0.07853781268046858,2025-03-03 19:35:47.084136,2025-03-03 19:35:48.319272,0 days 00:00:01.235136,gaussian_mixture,presence,70.0,2,COMPLETE
2151,0.6634017623408495,2025-03-03 19:35:48.321271,2025-03-03 19:35:48.554411,0 days 00:00:00.233140,gaussian_mixture,abundance,2.25,2,COMPLETE
2152,0.5581434607424189,2025-03-03 19:35:48.556406,2025-03-03 19:35:48.794973,0 days 00:00:00.238567,gaussian_mixture,abundance,2.2,2,COMPLETE
2153,0.4258130241967454,2025-03-03 19:35:48.795977,2025-03-03 19:35:49.037110,0 days 00:00:00.241133,gaussian_mixture,abundance,2.4000000000000004,2,COMPLETE
2154,0.46650338442561823,2025-03-03 19:35:49.038868,2025-03-03 19:35:49.281932,0 days 00:00:00.243064,gaussian_mixture,abundance,2.15,5,COMPLETE
2155,0.4340916574275836,2025-03-03 19:35:49.283938,2025-03-03 19:35:49.530299,0 days 00:00:00.246361,gaussian_mixture,abundance,2.1,2,COMPLETE
2156,0.4408296624024978,2025-03-03 19:35:49.532294,2025-03-03 19:35:49.765780,0 days 00:00:00.233486,gaussian_mixture,abundance,2.3000000000000003,2,COMPLETE
2157,0.25512750093703995,2025-03-03 19:35:49.766770,2025-03-03 19:35:49.990463,0 days 00:00:00.223693,kmeans,abundance,2.25,2,COMPLETE
2158,0.5229883882357691,2025-03-03 19:35:49.992460,2025-03-03 19:35:50.226755,0 days 00:00:00.234295,gaussian_mixture,abundance,2.15,2,COMPLETE
2159,0.3425983212532418,2025-03-03 19:35:50.228751,2025-03-03 19:35:50.466901,0 days 00:00:00.238150,gaussian_mixture,abundance,2.2,3,COMPLETE
2160,0.22783455238023026,2025-03-03 19:35:50.467903,2025-03-03 19:35:50.701119,0 days 00:00:00.233216,gaussian_mixture,abundance,2.0500000000000003,2,COMPLETE
2161,0.6289343762111583,2025-03-03 19:35:50.702122,2025-03-03 19:35:50.935266,0 days 00:00:00.233144,gaussian_mixture,abundance,2.35,2,COMPLETE
2162,0.4541115187930189,2025-03-03 19:35:50.937259,2025-03-03 19:35:51.177845,0 days 00:00:00.240586,gaussian_mixture,abundance,2.25,4,COMPLETE
2163,0.4686586316217638,2025-03-03 19:35:51.179844,2025-03-03 19:35:51.414037,0 days 00:00:00.234193,gaussian_mixture,abundance,2.1,2,COMPLETE
2164,0.6855404779833385,2025-03-03 19:35:51.416028,2025-03-03 19:35:51.660928,0 days 00:00:00.244900,gaussian_mixture,abundance,2.15,2,COMPLETE
2165,0.6702504625301888,2025-03-03 19:35:51.662925,2025-03-03 19:35:51.896577,0 days 00:00:00.233652,gaussian_mixture,abundance,2.5,2,COMPLETE
2166,0.5445536737771448,2025-03-03 19:35:51.897567,2025-03-03 19:35:52.132679,0 days 00:00:00.235112,gaussian_mixture,abundance,2.3000000000000003,2,COMPLETE
2167,0.38979020933023695,2025-03-03 19:35:52.133672,2025-03-03 19:35:52.367772,0 days 00:00:00.234100,gaussian_mixture,abundance,2.4000000000000004,2,COMPLETE
2168,0.21305108058942773,2025-03-03 19:35:52.368765,2025-03-03 19:35:52.620556,0 days 00:00:00.251791,gaussian_mixture,abundance,2.2,2,COMPLETE
2169,0.019980222274168444,2025-03-03 19:35:52.622551,2025-03-03 19:35:54.063305,0 days 00:00:01.440754,gaussian_mixture,presence,10.0,2,COMPLETE
2170,0.36039653611143363,2025-03-03 19:35:54.065306,2025-03-03 19:35:54.302943,0 days 00:00:00.237637,gaussian_mixture,abundance,2.0500000000000003,2,COMPLETE
2171,0.34059259216374027,2025-03-03 19:35:54.304932,2025-03-03 19:35:54.537380,0 days 00:00:00.232448,gaussian_mixture,abundance,2.35,2,COMPLETE
2172,0.6189039945953072,2025-03-03 19:35:54.539375,2025-03-03 19:35:54.779513,0 days 00:00:00.240138,gaussian_mixture,abundance,2.25,2,COMPLETE
2173,0.4470554677666364,2025-03-03 19:35:54.780509,2025-03-03 19:35:55.011296,0 days 00:00:00.230787,gaussian_mixture,abundance,2.15,2,COMPLETE
2174,0.6353749482218015,2025-03-03 19:35:55.013295,2025-03-03 19:35:55.251322,0 days 00:00:00.238027,gaussian_mixture,abundance,2.3000000000000003,2,COMPLETE
2175,0.5206965275632813,2025-03-03 19:35:55.253127,2025-03-03 19:35:55.479848,0 days 00:00:00.226721,kmeans,abundance,2.2,2,COMPLETE
2176,0.7171740049356445,2025-03-03 19:35:55.481852,2025-03-03 19:35:55.723466,0 days 00:00:00.241614,gaussian_mixture,abundance,2.1,2,COMPLETE
2177,0.5066495379835066,2025-03-03 19:35:55.724462,2025-03-03 19:35:55.975841,0 days 00:00:00.251379,gaussian_mixture,abundance,2.0500000000000003,2,COMPLETE
2178,0.398772986964466,2025-03-03 19:35:55.977836,2025-03-03 19:35:56.219246,0 days 00:00:00.241410,gaussian_mixture,abundance,2.0500000000000003,2,COMPLETE
2179,0.34828230237753477,2025-03-03 19:35:56.221050,2025-03-03 19:35:56.457109,0 days 00:00:00.236059,gaussian_mixture,abundance,2.0500000000000003,2,COMPLETE
2180,0.36524601442605614,2025-03-03 19:35:56.459110,2025-03-03 19:35:56.696760,0 days 00:00:00.237650,gaussian_mixture,abundance,2.0500000000000003,2,COMPLETE
2181,0.539451118161149,2025-03-03 19:35:56.697759,2025-03-03 19:35:56.935877,0 days 00:00:00.238118,gaussian_mixture,abundance,2.1,2,COMPLETE
2182,0.5253937439009575,2025-03-03 19:35:56.937869,2025-03-03 19:35:57.173944,0 days 00:00:00.236075,gaussian_mixture,abundance,2.0,2,COMPLETE
2183,0.3689460531876986,2025-03-03 19:35:57.175941,2025-03-03 19:35:57.411912,0 days 00:00:00.235971,gaussian_mixture,abundance,2.0500000000000003,2,COMPLETE
2184,0.4244324983168912,2025-03-03 19:35:57.412916,2025-03-03 19:35:57.651471,0 days 00:00:00.238555,gaussian_mixture,abundance,2.1,2,COMPLETE
2185,0.5645204323639288,2025-03-03 19:35:57.653469,2025-03-03 19:35:57.893192,0 days 00:00:00.239723,gaussian_mixture,abundance,2.1,2,COMPLETE
2186,0.5585239892388433,2025-03-03 19:35:57.895684,2025-03-03 19:35:58.142607,0 days 00:00:00.246923,gaussian_mixture,abundance,2.1,2,COMPLETE
2187,0.6785019127379108,2025-03-03 19:35:58.144601,2025-03-03 19:35:58.377992,0 days 00:00:00.233391,gaussian_mixture,abundance,2.0,2,COMPLETE
2188,0.44040354687040983,2025-03-03 19:35:58.378995,2025-03-03 19:35:58.627578,0 days 00:00:00.248583,gaussian_mixture,abundance,2.1,6,COMPLETE
2189,0.02534188011651194,2025-03-03 19:35:58.629578,2025-03-03 19:35:59.963554,0 days 00:00:01.333976,gaussian_mixture,presence,15.0,2,COMPLETE
2190,0.24807042548630592,2025-03-03 19:35:59.965552,2025-03-03 19:36:00.210732,0 days 00:00:00.245180,gaussian_mixture,abundance,2.0500000000000003,2,COMPLETE
2191,0.5708399927001896,2025-03-03 19:36:00.212373,2025-03-03 19:36:00.449077,0 days 00:00:00.236704,gaussian_mixture,abundance,2.45,2,COMPLETE
2192,0.526531841807331,2025-03-03 19:36:00.450077,2025-03-03 19:36:00.682348,0 days 00:00:00.232271,gaussian_mixture,abundance,2.1,2,COMPLETE
2193,0.0825999566320764,2025-03-03 19:36:00.684361,2025-03-03 19:36:00.941979,0 days 00:00:00.257618,gaussian_mixture,abundance,0.5,2,COMPLETE
2194,0.5936670676615192,2025-03-03 19:36:00.943974,2025-03-03 19:36:01.179734,0 days 00:00:00.235760,gaussian_mixture,abundance,2.15,2,COMPLETE
2195,0.24701818781411383,2025-03-03 19:36:01.181743,2025-03-03 19:36:01.412737,0 days 00:00:00.230994,kmeans,abundance,2.0,2,COMPLETE
2196,0.4914295167728528,2025-03-03 19:36:01.414736,2025-03-03 19:36:01.652449,0 days 00:00:00.237713,gaussian_mixture,abundance,2.4000000000000004,2,COMPLETE
2197,0.5803982037711855,2025-03-03 19:36:01.654257,2025-03-03 19:36:01.886587,0 days 00:00:00.232330,gaussian_mixture,abundance,2.15,2,COMPLETE
2198,0.3860966537974585,2025-03-03 19:36:01.887598,2025-03-03 19:36:02.122827,0 days 00:00:00.235229,gaussian_mixture,abundance,2.5,2,COMPLETE
2199,0.6372029905809062,2025-03-03 19:36:02.124624,2025-03-03 19:36:02.372394,0 days 00:00:00.247770,gaussian_mixture,abundance,2.1,2,COMPLETE
2200,0.3001551720216996,2025-03-03 19:36:02.374395,2025-03-03 19:36:02.607415,0 days 00:00:00.233020,gaussian_mixture,abundance,2.15,2,COMPLETE
2201,0.5620509239339299,2025-03-03 19:36:02.609405,2025-03-03 19:36:02.847991,0 days 00:00:00.238586,gaussian_mixture,abundance,2.0500000000000003,2,COMPLETE
2202,0.4860269633953004,2025-03-03 19:36:02.848999,2025-03-03 19:36:03.090675,0 days 00:00:00.241676,gaussian_mixture,abundance,2.15,2,COMPLETE
2203,0.3594709345911463,2025-03-03 19:36:03.092681,2025-03-03 19:36:03.331698,0 days 00:00:00.239017,gaussian_mixture,abundance,2.0500000000000003,2,COMPLETE
2204,0.5966284709591211,2025-03-03 19:36:03.332691,2025-03-03 19:36:03.566853,0 days 00:00:00.234162,gaussian_mixture,abundance,2.4000000000000004,2,COMPLETE
2205,0.4075142438074851,2025-03-03 19:36:03.567848,2025-03-03 19:36:03.798966,0 days 00:00:00.231118,gaussian_mixture,abundance,2.2,2,COMPLETE
2206,0.49033354956980607,2025-03-03 19:36:03.799961,2025-03-03 19:36:04.032655,0 days 00:00:00.232694,gaussian_mixture,abundance,2.15,2,COMPLETE
2207,0.4677329352043273,2025-03-03 19:36:04.033646,2025-03-03 19:36:04.265966,0 days 00:00:00.232320,gaussian_mixture,abundance,2.5,2,COMPLETE
2208,0.018483271744032494,2025-03-03 19:36:04.266963,2025-03-03 19:36:05.645579,0 days 00:00:01.378616,gaussian_mixture,presence,10.0,2,COMPLETE
2209,0.4464534200550075,2025-03-03 19:36:05.646582,2025-03-03 19:36:05.875939,0 days 00:00:00.229357,gaussian_mixture,abundance,2.35,2,COMPLETE
2210,0.46631185490744603,2025-03-03 19:36:05.877936,2025-03-03 19:36:06.142798,0 days 00:00:00.264862,gaussian_mixture,abundance,0.75,3,COMPLETE
2211,0.5059476514216298,2025-03-03 19:36:06.144797,2025-03-03 19:36:06.376856,0 days 00:00:00.232059,gaussian_mixture,abundance,2.1,2,COMPLETE
2212,0.6470554677666364,2025-03-03 19:36:06.378855,2025-03-03 19:36:06.622754,0 days 00:00:00.243899,gaussian_mixture,abundance,2.2,2,COMPLETE
2213,0.2681902139900492,2025-03-03 19:36:06.623764,2025-03-03 19:36:06.862696,0 days 00:00:00.238932,kmeans,abundance,2.0,2,COMPLETE
2214,0.39890096078708004,2025-03-03 19:36:06.864691,2025-03-03 19:36:07.097050,0 days 00:00:00.232359,gaussian_mixture,abundance,2.4000000000000004,2,COMPLETE
2215,0.5059476514216298,2025-03-03 19:36:07.099041,2025-03-03 19:36:07.332506,0 days 00:00:00.233465,gaussian_mixture,abundance,2.15,2,COMPLETE
2216,0.5671616659346184,2025-03-03 19:36:07.334501,2025-03-03 19:36:07.583545,0 days 00:00:00.249044,gaussian_mixture,abundance,2.25,4,COMPLETE
2217,0.6488065969196712,2025-03-03 19:36:07.584539,2025-03-03 19:36:07.819313,0 days 00:00:00.234774,gaussian_mixture,abundance,2.3000000000000003,2,COMPLETE
2218,0.38026219591259675,2025-03-03 19:36:07.821313,2025-03-03 19:36:08.056173,0 days 00:00:00.234860,gaussian_mixture,abundance,2.0500000000000003,2,COMPLETE
2219,0.5421436190632352,2025-03-03 19:36:08.057173,2025-03-03 19:36:08.295251,0 days 00:00:00.238078,gaussian_mixture,abundance,2.45,2,COMPLETE
2220,0.38937286270654003,2025-03-03 19:36:08.297259,2025-03-03 19:36:08.529903,0 days 00:00:00.232644,gaussian_mixture,abundance,2.2,2,COMPLETE
