number,value,datetime_start,datetime_complete,duration,params_algorithm,params_filter_criteria,params_filter_threshold,params_k,state
1481,0.7119436633010585,2025-03-03 19:32:33.236611,2025-03-03 19:32:33.451926,0 days 00:00:00.215315,gaussian_mixture,abundance,2.15,2,COMPLETE
1482,0.4421501713119923,2025-03-03 19:32:33.452929,2025-03-03 19:32:33.668535,0 days 00:00:00.215606,gaussian_mixture,abundance,2.1,2,COMPLETE
1483,0.3577754458959895,2025-03-03 19:32:33.669543,2025-03-03 19:32:33.881059,0 days 00:00:00.211516,gaussian_mixture,abundance,2.1,2,COMPLETE
1484,0.5004400620527567,2025-03-03 19:32:33.882059,2025-03-03 19:32:34.094705,0 days 00:00:00.212646,gaussian_mixture,abundance,2.15,2,COMPLETE
1485,0.5018672996938406,2025-03-03 19:32:34.095708,2025-03-03 19:32:34.306521,0 days 00:00:00.210813,gaussian_mixture,abundance,2.0500000000000003,2,COMPLETE
1486,0.5059476514216298,2025-03-03 19:32:34.308319,2025-03-03 19:32:34.534696,0 days 00:00:00.226377,gaussian_mixture,abundance,2.15,2,COMPLETE
1487,0.5148294142452781,2025-03-03 19:32:34.536348,2025-03-03 19:32:34.752029,0 days 00:00:00.215681,gaussian_mixture,abundance,2.0500000000000003,2,COMPLETE
1488,0.5847791507669869,2025-03-03 19:32:34.754027,2025-03-03 19:32:34.965110,0 days 00:00:00.211083,gaussian_mixture,abundance,2.15,2,COMPLETE
1489,0.5680772187748012,2025-03-03 19:32:34.967108,2025-03-03 19:32:35.175890,0 days 00:00:00.208782,gaussian_mixture,abundance,2.2,2,COMPLETE
1490,0.01356816642206583,2025-03-03 19:32:35.177882,2025-03-03 19:32:36.537757,0 days 00:00:01.359875,gaussian_mixture,presence,10.0,2,COMPLETE
1491,0.5921302924295784,2025-03-03 19:32:36.539756,2025-03-03 19:32:36.767233,0 days 00:00:00.227477,gaussian_mixture,abundance,2.1,2,COMPLETE
1492,0.4973017424945806,2025-03-03 19:32:36.768236,2025-03-03 19:32:36.986969,0 days 00:00:00.218733,gaussian_mixture,abundance,2.2,4,COMPLETE
1493,0.3244436823993026,2025-03-03 19:32:36.987949,2025-03-03 19:32:37.201002,0 days 00:00:00.213053,gaussian_mixture,abundance,2.1,2,COMPLETE
1494,0.5841319908383386,2025-03-03 19:32:37.202004,2025-03-03 19:32:37.415152,0 days 00:00:00.213148,gaussian_mixture,abundance,2.0,2,COMPLETE
1495,0.538391432968081,2025-03-03 19:32:37.416142,2025-03-03 19:32:37.626793,0 days 00:00:00.210651,gaussian_mixture,abundance,2.25,2,COMPLETE
1496,0.41232825080508045,2025-03-03 19:32:37.628781,2025-03-03 19:32:37.835881,0 days 00:00:00.207100,kmeans,abundance,2.15,2,COMPLETE
1497,0.5307056306258237,2025-03-03 19:32:37.837878,2025-03-03 19:32:38.055172,0 days 00:00:00.217294,gaussian_mixture,abundance,2.0500000000000003,2,COMPLETE
1498,0.44079918560047215,2025-03-03 19:32:38.057168,2025-03-03 19:32:38.304993,0 days 00:00:00.247825,gaussian_mixture,abundance,2.15,2,COMPLETE
1499,0.7171740049356445,2025-03-03 19:32:38.305992,2025-03-03 19:32:38.524107,0 days 00:00:00.218115,gaussian_mixture,abundance,2.2,2,COMPLETE
1500,0.5907653568158635,2025-03-03 19:32:38.526096,2025-03-03 19:32:38.740212,0 days 00:00:00.214116,gaussian_mixture,abundance,2.2,2,COMPLETE
1501,0.6848143061816131,2025-03-03 19:32:38.741202,2025-03-03 19:32:38.984329,0 days 00:00:00.243127,gaussian_mixture,abundance,2.25,2,COMPLETE
1502,0.5139787182499069,2025-03-03 19:32:38.985329,2025-03-03 19:32:39.234943,0 days 00:00:00.249614,gaussian_mixture,abundance,2.1,2,COMPLETE
1503,0.6996495812435517,2025-03-03 19:32:39.235937,2025-03-03 19:32:39.448037,0 days 00:00:00.212100,gaussian_mixture,abundance,2.25,2,COMPLETE
1504,0.39097767420453616,2025-03-03 19:32:39.449854,2025-03-03 19:32:39.674497,0 days 00:00:00.224643,gaussian_mixture,abundance,2.2,5,COMPLETE
1505,0.24440226296274004,2025-03-03 19:32:39.676495,2025-03-03 19:32:39.895110,0 days 00:00:00.218615,gaussian_mixture,abundance,2.0,2,COMPLETE
1506,0.4745067998826862,2025-03-03 19:32:39.896108,2025-03-03 19:32:40.115211,0 days 00:00:00.219103,gaussian_mixture,abundance,2.3000000000000003,3,COMPLETE
1507,0.5760464242613541,2025-03-03 19:32:40.116210,2025-03-03 19:32:40.331487,0 days 00:00:00.215277,gaussian_mixture,abundance,2.15,2,COMPLETE
1508,0.5103312357157352,2025-03-03 19:32:40.333465,2025-03-03 19:32:40.546172,0 days 00:00:00.212707,gaussian_mixture,abundance,2.1,2,COMPLETE
1509,0.051596794148263514,2025-03-03 19:32:40.547963,2025-03-03 19:32:41.811042,0 days 00:00:01.263079,gaussian_mixture,presence,30.0,2,COMPLETE
1510,0.3226238856172373,2025-03-03 19:32:41.812035,2025-03-03 19:32:42.060165,0 days 00:00:00.248130,gaussian_mixture,abundance,0.45,2,COMPLETE
1511,0.35231485209868446,2025-03-03 19:32:42.061173,2025-03-03 19:32:42.270436,0 days 00:00:00.209263,gaussian_mixture,abundance,2.25,2,COMPLETE
1512,0.3632261314935414,2025-03-03 19:32:42.271437,2025-03-03 19:32:42.483957,0 days 00:00:00.212520,gaussian_mixture,abundance,2.15,2,COMPLETE
1513,0.5328869054116229,2025-03-03 19:32:42.484958,2025-03-03 19:32:42.700547,0 days 00:00:00.215589,gaussian_mixture,abundance,2.0500000000000003,2,COMPLETE
1514,0.48347422659252837,2025-03-03 19:32:42.701552,2025-03-03 19:32:42.916629,0 days 00:00:00.215077,gaussian_mixture,abundance,2.2,2,COMPLETE
1515,0.5925648090199861,2025-03-03 19:32:42.918628,2025-03-03 19:32:43.149240,0 days 00:00:00.230612,gaussian_mixture,abundance,2.3000000000000003,2,COMPLETE
1516,0.5166970866566032,2025-03-03 19:32:43.150236,2025-03-03 19:32:43.359536,0 days 00:00:00.209300,kmeans,abundance,2.25,2,COMPLETE
1517,0.5109434723977809,2025-03-03 19:32:43.361531,2025-03-03 19:32:43.607700,0 days 00:00:00.246169,gaussian_mixture,abundance,1.85,2,COMPLETE
1518,0.4462034873946318,2025-03-03 19:32:43.609692,2025-03-03 19:32:43.823354,0 days 00:00:00.213662,gaussian_mixture,abundance,2.1,2,COMPLETE
1519,0.5794847203055438,2025-03-03 19:32:43.825339,2025-03-03 19:32:44.038398,0 days 00:00:00.213059,gaussian_mixture,abundance,2.2,2,COMPLETE
1520,0.6190582636458367,2025-03-03 19:32:44.040395,2025-03-03 19:32:44.258248,0 days 00:00:00.217853,gaussian_mixture,abundance,2.3000000000000003,2,COMPLETE
1521,0.5591841276759507,2025-03-03 19:32:44.260246,2025-03-03 19:32:44.475303,0 days 00:00:00.215057,gaussian_mixture,abundance,2.15,2,COMPLETE
1522,0.6282619979114271,2025-03-03 19:32:44.477298,2025-03-03 19:32:44.694543,0 days 00:00:00.217245,gaussian_mixture,abundance,2.35,2,COMPLETE
1523,0.3392727219575037,2025-03-03 19:32:44.695543,2025-03-03 19:32:44.909460,0 days 00:00:00.213917,gaussian_mixture,abundance,2.25,2,COMPLETE
1524,0.4876332956059314,2025-03-03 19:32:44.910471,2025-03-03 19:32:45.128944,0 days 00:00:00.218473,gaussian_mixture,abundance,2.1,2,COMPLETE
1525,0.5078160016195247,2025-03-03 19:32:45.129941,2025-03-03 19:32:45.359717,0 days 00:00:00.229776,gaussian_mixture,abundance,2.0500000000000003,2,COMPLETE
1526,0.3224134028400507,2025-03-03 19:32:45.361711,2025-03-03 19:32:45.573000,0 days 00:00:00.211289,gaussian_mixture,abundance,2.2,2,COMPLETE
1527,0.40592264949719664,2025-03-03 19:32:45.575801,2025-03-03 19:32:45.789404,0 days 00:00:00.213603,gaussian_mixture,abundance,2.3000000000000003,2,COMPLETE
1528,0.5562115096426888,2025-03-03 19:32:45.791402,2025-03-03 19:32:46.006201,0 days 00:00:00.214799,gaussian_mixture,abundance,2.15,2,COMPLETE
1529,0.0020548649774955003,2025-03-03 19:32:46.008199,2025-03-03 19:32:47.327886,0 days 00:00:01.319687,gaussian_mixture,presence,10.0,2,COMPLETE
1530,0.34852832463939815,2025-03-03 19:32:47.330089,2025-03-03 19:32:47.549199,0 days 00:00:00.219110,gaussian_mixture,abundance,2.0,2,COMPLETE
1531,0.4322504368881761,2025-03-03 19:32:47.550210,2025-03-03 19:32:47.763113,0 days 00:00:00.212903,gaussian_mixture,abundance,2.25,2,COMPLETE
1532,0.7171740049356445,2025-03-03 19:32:47.764111,2025-03-03 19:32:47.977176,0 days 00:00:00.213065,gaussian_mixture,abundance,2.2,2,COMPLETE
1533,0.3855004459046282,2025-03-03 19:32:47.979172,2025-03-03 19:32:48.189243,0 days 00:00:00.210071,gaussian_mixture,abundance,2.3000000000000003,2,COMPLETE
1534,0.1771810721559371,2025-03-03 19:32:48.191244,2025-03-03 19:32:48.395305,0 days 00:00:00.204061,kmeans,abundance,2.35,2,COMPLETE
1535,0.22887630098271655,2025-03-03 19:32:48.396303,2025-03-03 19:32:48.611208,0 days 00:00:00.214905,gaussian_mixture,abundance,2.25,2,COMPLETE
1536,0.6210504632471086,2025-03-03 19:32:48.612960,2025-03-03 19:32:48.827042,0 days 00:00:00.214082,gaussian_mixture,abundance,2.35,2,COMPLETE
1537,0.19889774135846683,2025-03-03 19:32:48.829039,2025-03-03 19:32:49.035640,0 days 00:00:00.206601,gaussian_mixture,abundance,2.3000000000000003,2,COMPLETE
1538,0.5722193343990332,2025-03-03 19:32:49.036642,2025-03-03 19:32:49.256220,0 days 00:00:00.219578,gaussian_mixture,abundance,2.2,3,COMPLETE
1539,0.3081122306560635,2025-03-03 19:32:49.257218,2025-03-03 19:32:49.491522,0 days 00:00:00.234304,gaussian_mixture,abundance,0.9500000000000001,2,COMPLETE
1540,0.5118680109476761,2025-03-03 19:32:49.493297,2025-03-03 19:32:49.706962,0 days 00:00:00.213665,gaussian_mixture,abundance,2.25,2,COMPLETE
1541,0.5410874158510521,2025-03-03 19:32:49.707965,2025-03-03 19:32:49.920038,0 days 00:00:00.212073,gaussian_mixture,abundance,2.2,2,COMPLETE
1542,0.467010064763426,2025-03-03 19:32:49.923035,2025-03-03 19:32:50.167244,0 days 00:00:00.244209,gaussian_mixture,abundance,2.35,2,COMPLETE
1543,0.6567380271333609,2025-03-03 19:32:50.169239,2025-03-03 19:32:50.415160,0 days 00:00:00.245921,gaussian_mixture,abundance,2.25,2,COMPLETE
1544,0.3027473357941258,2025-03-03 19:32:50.416966,2025-03-03 19:32:50.631038,0 days 00:00:00.214072,gaussian_mixture,abundance,2.2,2,COMPLETE
1545,0.4891425630132682,2025-03-03 19:32:50.632041,2025-03-03 19:32:50.842934,0 days 00:00:00.210893,gaussian_mixture,abundance,2.35,2,COMPLETE
1546,0.3932832251718411,2025-03-03 19:32:50.844937,2025-03-03 19:32:51.058705,0 days 00:00:00.213768,gaussian_mixture,abundance,2.3000000000000003,2,COMPLETE
1547,-0.003530715123907056,2025-03-03 19:32:51.060704,2025-03-03 19:32:52.406706,0 days 00:00:01.346002,gaussian_mixture,presence,10.0,2,COMPLETE
1548,0.4132460103759554,2025-03-03 19:32:52.408714,2025-03-03 19:32:52.622813,0 days 00:00:00.214099,gaussian_mixture,abundance,2.15,2,COMPLETE
1549,0.5151586625364658,2025-03-03 19:32:52.624803,2025-03-03 19:32:52.838207,0 days 00:00:00.213404,gaussian_mixture,abundance,2.25,2,COMPLETE
1550,0.4160770864782838,2025-03-03 19:32:52.840200,2025-03-03 19:32:53.053283,0 days 00:00:00.213083,gaussian_mixture,abundance,2.2,2,COMPLETE
1551,0.4338971631528916,2025-03-03 19:32:53.054278,2025-03-03 19:32:53.264383,0 days 00:00:00.210105,gaussian_mixture,abundance,2.3000000000000003,2,COMPLETE
1552,0.5581434607424189,2025-03-03 19:32:53.265896,2025-03-03 19:32:53.476972,0 days 00:00:00.211076,gaussian_mixture,abundance,2.2,2,COMPLETE
1553,0.3783770453042105,2025-03-03 19:32:53.478971,2025-03-03 19:32:53.697051,0 days 00:00:00.218080,kmeans,abundance,1.4500000000000002,2,COMPLETE
1554,0.380237127533699,2025-03-03 19:32:53.699047,2025-03-03 19:32:53.927441,0 days 00:00:00.228394,gaussian_mixture,abundance,1.8,2,COMPLETE
1555,0.4761562157820052,2025-03-03 19:32:53.929441,2025-03-03 19:32:54.148757,0 days 00:00:00.219316,gaussian_mixture,abundance,2.1,2,COMPLETE
1556,0.4466483498415351,2025-03-03 19:32:54.149756,2025-03-03 19:32:54.367600,0 days 00:00:00.217844,gaussian_mixture,abundance,1.9500000000000002,2,COMPLETE
1557,0.4773327731497144,2025-03-03 19:32:54.369599,2025-03-03 19:32:54.582415,0 days 00:00:00.212816,gaussian_mixture,abundance,2.35,2,COMPLETE
1558,0.5737312313033898,2025-03-03 19:32:54.584416,2025-03-03 19:32:54.801137,0 days 00:00:00.216721,gaussian_mixture,abundance,2.15,2,COMPLETE
1559,0.4808773106285071,2025-03-03 19:32:54.803135,2025-03-03 19:32:55.014739,0 days 00:00:00.211604,gaussian_mixture,abundance,2.25,2,COMPLETE
1560,0.44537273921055676,2025-03-03 19:32:55.015733,2025-03-03 19:32:55.228878,0 days 00:00:00.213145,gaussian_mixture,abundance,2.3000000000000003,2,COMPLETE
1561,0.48134820077280993,2025-03-03 19:32:55.229641,2025-03-03 19:32:55.444958,0 days 00:00:00.215317,gaussian_mixture,abundance,2.4000000000000004,2,COMPLETE
1562,0.45524716893031447,2025-03-03 19:32:55.446961,2025-03-03 19:32:55.657876,0 days 00:00:00.210915,gaussian_mixture,abundance,2.15,2,COMPLETE
1563,0.5572602776768953,2025-03-03 19:32:55.660868,2025-03-03 19:32:55.880197,0 days 00:00:00.219329,gaussian_mixture,abundance,2.25,2,COMPLETE
1564,0.4450819956607403,2025-03-03 19:32:55.881260,2025-03-03 19:32:56.116645,0 days 00:00:00.235385,gaussian_mixture,abundance,2.0500000000000003,6,COMPLETE
1565,0.38128777031205063,2025-03-03 19:32:56.117649,2025-03-03 19:32:56.356741,0 days 00:00:00.239092,gaussian_mixture,abundance,0.7000000000000001,2,COMPLETE
1566,0.09965214589162605,2025-03-03 19:32:56.357739,2025-03-03 19:32:57.643014,0 days 00:00:01.285275,gaussian_mixture,presence,35.0,2,COMPLETE
1567,0.4944867362006504,2025-03-03 19:32:57.645028,2025-03-03 19:32:57.858320,0 days 00:00:00.213292,gaussian_mixture,abundance,2.35,2,COMPLETE
1568,0.4672995026184713,2025-03-03 19:32:57.860309,2025-03-03 19:32:58.084537,0 days 00:00:00.224228,gaussian_mixture,abundance,2.15,2,COMPLETE
1569,0.444390735288586,2025-03-03 19:32:58.086536,2025-03-03 19:32:58.301288,0 days 00:00:00.214752,gaussian_mixture,abundance,2.1,2,COMPLETE
1570,0.6028421761239852,2025-03-03 19:32:58.302289,2025-03-03 19:32:58.515932,0 days 00:00:00.213643,gaussian_mixture,abundance,2.2,2,COMPLETE
1571,0.3754273121710737,2025-03-03 19:32:58.517922,2025-03-03 19:32:58.732740,0 days 00:00:00.214818,gaussian_mixture,abundance,2.25,2,COMPLETE
1572,0.38312128264864265,2025-03-03 19:32:58.734734,2025-03-03 19:32:58.946582,0 days 00:00:00.211848,kmeans,abundance,1.7000000000000002,2,COMPLETE
1573,0.4724893973939109,2025-03-03 19:32:58.948573,2025-03-03 19:32:59.165169,0 days 00:00:00.216596,gaussian_mixture,abundance,2.3000000000000003,2,COMPLETE
1574,0.33696671097605824,2025-03-03 19:32:59.167164,2025-03-03 19:32:59.394609,0 days 00:00:00.227445,gaussian_mixture,abundance,1.1,2,COMPLETE
1575,0.5674721674145273,2025-03-03 19:32:59.395610,2025-03-03 19:32:59.611606,0 days 00:00:00.215996,gaussian_mixture,abundance,2.2,2,COMPLETE
1576,0.5001551720216997,2025-03-03 19:32:59.612597,2025-03-03 19:32:59.822586,0 days 00:00:00.209989,gaussian_mixture,abundance,2.35,2,COMPLETE
1577,0.482379093697213,2025-03-03 19:32:59.824585,2025-03-03 19:33:00.046679,0 days 00:00:00.222094,gaussian_mixture,abundance,2.4000000000000004,2,COMPLETE
1578,0.4742087844921595,2025-03-03 19:33:00.048676,2025-03-03 19:33:00.291198,0 days 00:00:00.242522,gaussian_mixture,abundance,1.35,2,COMPLETE
1579,0.44755357712457666,2025-03-03 19:33:00.293193,2025-03-03 19:33:00.508440,0 days 00:00:00.215247,gaussian_mixture,abundance,2.1,2,COMPLETE
1580,0.6340657220860416,2025-03-03 19:33:00.510440,2025-03-03 19:33:00.732030,0 days 00:00:00.221590,gaussian_mixture,abundance,1.6,2,COMPLETE
1581,0.230705169824844,2025-03-03 19:33:00.733025,2025-03-03 19:33:00.945027,0 days 00:00:00.212002,gaussian_mixture,abundance,2.15,2,COMPLETE
1582,0.6333162633551945,2025-03-03 19:33:00.947025,2025-03-03 19:33:01.165157,0 days 00:00:00.218132,gaussian_mixture,abundance,2.3000000000000003,2,COMPLETE
1583,0.3406704617976538,2025-03-03 19:33:01.166156,2025-03-03 19:33:01.383735,0 days 00:00:00.217579,gaussian_mixture,abundance,1.85,2,COMPLETE
1584,0.2842204270945374,2025-03-03 19:33:01.384747,2025-03-03 19:33:01.595009,0 days 00:00:00.210262,gaussian_mixture,abundance,2.2,2,COMPLETE
1585,0.038452594196374236,2025-03-03 19:33:01.596008,2025-03-03 19:33:03.066564,0 days 00:00:01.470556,gaussian_mixture,presence,10.0,3,COMPLETE
1586,0.37397494976615764,2025-03-03 19:33:03.067568,2025-03-03 19:33:03.295623,0 days 00:00:00.228055,gaussian_mixture,abundance,2.0,2,COMPLETE
1587,-0.0009627475233740509,2025-03-03 19:33:03.297615,2025-03-03 19:33:05.126990,0 days 00:00:01.829375,gaussian_mixture,abundance,0.0,4,COMPLETE
1588,0.488371554085667,2025-03-03 19:33:05.127979,2025-03-03 19:33:05.345679,0 days 00:00:00.217700,gaussian_mixture,abundance,2.25,2,COMPLETE
1589,0.5328869054116229,2025-03-03 19:33:05.346672,2025-03-03 19:33:05.566455,0 days 00:00:00.219783,gaussian_mixture,abundance,2.0500000000000003,2,COMPLETE
1590,0.44690019549707927,2025-03-03 19:33:05.567453,2025-03-03 19:33:05.784557,0 days 00:00:00.217104,gaussian_mixture,abundance,2.4000000000000004,2,COMPLETE
1591,0.3382956479958104,2025-03-03 19:33:05.786548,2025-03-03 19:33:05.994645,0 days 00:00:00.208097,kmeans,abundance,2.25,2,COMPLETE
1592,0.3196830647499843,2025-03-03 19:33:05.995925,2025-03-03 19:33:06.211310,0 days 00:00:00.215385,gaussian_mixture,abundance,2.15,2,COMPLETE
1593,0.5344079380526929,2025-03-03 19:33:06.212310,2025-03-03 19:33:06.429975,0 days 00:00:00.217665,gaussian_mixture,abundance,2.3000000000000003,2,COMPLETE
1594,0.5377362873041276,2025-03-03 19:33:06.431980,2025-03-03 19:33:06.654664,0 days 00:00:00.222684,gaussian_mixture,abundance,2.2,2,COMPLETE
1595,0.34537458018989364,2025-03-03 19:33:06.656667,2025-03-03 19:33:06.867277,0 days 00:00:00.210610,gaussian_mixture,abundance,2.1,2,COMPLETE
1596,0.47025046253018876,2025-03-03 19:33:06.868277,2025-03-03 19:33:07.087784,0 days 00:00:00.219507,gaussian_mixture,abundance,2.35,2,COMPLETE
1597,0.5191441085762982,2025-03-03 19:33:07.088784,2025-03-03 19:33:07.304298,0 days 00:00:00.215514,gaussian_mixture,abundance,2.2,2,COMPLETE
1598,0.6293027178587558,2025-03-03 19:33:07.305104,2025-03-03 19:33:07.519247,0 days 00:00:00.214143,gaussian_mixture,abundance,2.15,2,COMPLETE
1599,0.48346891283589005,2025-03-03 19:33:07.521247,2025-03-03 19:33:07.734480,0 days 00:00:00.213233,gaussian_mixture,abundance,2.25,2,COMPLETE
1600,0.4530186916117455,2025-03-03 19:33:07.735485,2025-03-03 19:33:07.948119,0 days 00:00:00.212634,gaussian_mixture,abundance,2.3000000000000003,2,COMPLETE
1601,0.3317978755572404,2025-03-03 19:33:07.949878,2025-03-03 19:33:08.161906,0 days 00:00:00.212028,gaussian_mixture,abundance,2.0500000000000003,2,COMPLETE
1602,0.35577260051751625,2025-03-03 19:33:08.163907,2025-03-03 19:33:08.373403,0 days 00:00:00.209496,gaussian_mixture,abundance,2.15,2,COMPLETE
1603,0.5313891959769932,2025-03-03 19:33:08.374389,2025-03-03 19:33:08.588192,0 days 00:00:00.213803,gaussian_mixture,abundance,2.4000000000000004,2,COMPLETE
1604,0.008063392488406193,2025-03-03 19:33:08.589191,2025-03-03 19:33:09.961214,0 days 00:00:01.372023,gaussian_mixture,presence,10.0,2,COMPLETE
1605,0.11615853161326906,2025-03-03 19:33:09.963233,2025-03-03 19:33:10.174167,0 days 00:00:00.210934,gaussian_mixture,abundance,1.9500000000000002,2,COMPLETE
1606,0.5932832251718411,2025-03-03 19:33:10.177156,2025-03-03 19:33:10.399221,0 days 00:00:00.222065,gaussian_mixture,abundance,2.2,2,COMPLETE
1607,0.2513024613689473,2025-03-03 19:33:10.400218,2025-03-03 19:33:10.611712,0 days 00:00:00.211494,gaussian_mixture,abundance,2.3000000000000003,2,COMPLETE
1608,0.4433031040542551,2025-03-03 19:33:10.613713,2025-03-03 19:33:10.833534,0 days 00:00:00.219821,gaussian_mixture,abundance,2.35,2,COMPLETE
1609,0.5022812682949738,2025-03-03 19:33:10.835719,2025-03-03 19:33:11.056733,0 days 00:00:00.221014,gaussian_mixture,abundance,2.1,2,COMPLETE
1610,0.42555266569851213,2025-03-03 19:33:11.058518,2025-03-03 19:33:11.262631,0 days 00:00:00.204113,kmeans,abundance,2.25,2,COMPLETE
1611,0.39424738575575047,2025-03-03 19:33:11.263631,2025-03-03 19:33:11.489320,0 days 00:00:00.225689,gaussian_mixture,abundance,2.2,2,COMPLETE
1612,0.6376974644505164,2025-03-03 19:33:11.490321,2025-03-03 19:33:11.705814,0 days 00:00:00.215493,gaussian_mixture,abundance,2.4000000000000004,2,COMPLETE
1613,0.5290820977707609,2025-03-03 19:33:11.707618,2025-03-03 19:33:11.922802,0 days 00:00:00.215184,gaussian_mixture,abundance,1.9000000000000001,2,COMPLETE
1614,0.5070933985140855,2025-03-03 19:33:11.923802,2025-03-03 19:33:12.137442,0 days 00:00:00.213640,gaussian_mixture,abundance,2.15,2,COMPLETE
1615,0.4334387625265276,2025-03-03 19:33:12.138443,2025-03-03 19:33:12.357724,0 days 00:00:00.219281,gaussian_mixture,abundance,2.0,2,COMPLETE
1616,0.5134216412232634,2025-03-03 19:33:12.358725,2025-03-03 19:33:12.575797,0 days 00:00:00.217072,gaussian_mixture,abundance,2.25,2,COMPLETE
1617,0.22209855081925092,2025-03-03 19:33:12.577797,2025-03-03 19:33:12.788249,0 days 00:00:00.210452,gaussian_mixture,abundance,2.1,2,COMPLETE
1618,0.5523509813424887,2025-03-03 19:33:12.789254,2025-03-03 19:33:13.018353,0 days 00:00:00.229099,gaussian_mixture,abundance,2.3000000000000003,2,COMPLETE
1619,0.3661545722957942,2025-03-03 19:33:13.019991,2025-03-03 19:33:13.236545,0 days 00:00:00.216554,gaussian_mixture,abundance,2.35,2,COMPLETE
1620,0.32002739273021263,2025-03-03 19:33:13.238349,2025-03-03 19:33:13.454416,0 days 00:00:00.216067,gaussian_mixture,abundance,2.25,2,COMPLETE
1621,0.3099857343342493,2025-03-03 19:33:13.455420,2025-03-03 19:33:13.671540,0 days 00:00:00.216120,gaussian_mixture,abundance,2.0500000000000003,2,COMPLETE
1622,0.013388576833736154,2025-03-03 19:33:13.672539,2025-03-03 19:33:14.995914,0 days 00:00:01.323375,gaussian_mixture,presence,10.0,2,COMPLETE
1623,0.48963096684566504,2025-03-03 19:33:14.997914,2025-03-03 19:33:15.233064,0 days 00:00:00.235150,gaussian_mixture,abundance,2.2,2,COMPLETE
1624,0.3779802040818351,2025-03-03 19:33:15.234061,2025-03-03 19:33:15.459694,0 days 00:00:00.225633,gaussian_mixture,abundance,2.15,5,COMPLETE
1625,0.4860269633953004,2025-03-03 19:33:15.461699,2025-03-03 19:33:15.683370,0 days 00:00:00.221671,gaussian_mixture,abundance,2.35,2,COMPLETE
1626,0.35439109703003757,2025-03-03 19:33:15.684367,2025-03-03 19:33:15.916732,0 days 00:00:00.232365,gaussian_mixture,abundance,2.25,2,COMPLETE
1627,0.5162837298465229,2025-03-03 19:33:15.918732,2025-03-03 19:33:16.171320,0 days 00:00:00.252588,gaussian_mixture,abundance,2.1,2,COMPLETE
1628,0.45154537879601875,2025-03-03 19:33:16.173320,2025-03-03 19:33:16.379426,0 days 00:00:00.206106,kmeans,abundance,2.4000000000000004,2,COMPLETE
