number,value,datetime_start,datetime_complete,duration,params_algorithm,params_filter_criteria,params_filter_threshold,params_k,state
1629,0.6057604477939588,2025-03-03 19:33:16.381424,2025-03-03 19:33:16.600714,0 days 00:00:00.219290,gaussian_mixture,abundance,2.2,2,COMPLETE
1630,0.19844054716861376,2025-03-03 19:33:16.601714,2025-03-03 19:33:16.869327,0 days 00:00:00.267613,gaussian_mixture,abundance,0.30000000000000004,2,COMPLETE
1631,0.4989984021839852,2025-03-03 19:33:16.870330,2025-03-03 19:33:17.092966,0 days 00:00:00.222636,gaussian_mixture,abundance,2.3000000000000003,2,COMPLETE
1632,0.48120568912162076,2025-03-03 19:33:17.094964,2025-03-03 19:33:17.322328,0 days 00:00:00.227364,gaussian_mixture,abundance,2.15,3,COMPLETE
1633,0.6236538683491097,2025-03-03 19:33:17.323328,2025-03-03 19:33:17.538132,0 days 00:00:00.214804,gaussian_mixture,abundance,2.25,2,COMPLETE
1634,0.5356504471486276,2025-03-03 19:33:17.539932,2025-03-03 19:33:17.754883,0 days 00:00:00.214951,gaussian_mixture,abundance,2.1,2,COMPLETE
1635,0.6182530169166588,2025-03-03 19:33:17.756867,2025-03-03 19:33:17.972573,0 days 00:00:00.215706,gaussian_mixture,abundance,2.2,2,COMPLETE
1636,0.535365427079225,2025-03-03 19:33:17.974156,2025-03-03 19:33:18.190295,0 days 00:00:00.216139,gaussian_mixture,abundance,2.35,2,COMPLETE
1637,0.3266943652922801,2025-03-03 19:33:18.192296,2025-03-03 19:33:18.408585,0 days 00:00:00.216289,gaussian_mixture,abundance,2.0,2,COMPLETE
1638,0.7008573203596798,2025-03-03 19:33:18.410581,2025-03-03 19:33:18.636243,0 days 00:00:00.225662,gaussian_mixture,abundance,2.3000000000000003,2,COMPLETE
1639,0.4968311529247643,2025-03-03 19:33:18.637241,2025-03-03 19:33:18.853378,0 days 00:00:00.216137,gaussian_mixture,abundance,2.15,2,COMPLETE
1640,0.5319937990765133,2025-03-03 19:33:18.855378,2025-03-03 19:33:19.073473,0 days 00:00:00.218095,gaussian_mixture,abundance,1.75,2,COMPLETE
1641,0.015288627447756182,2025-03-03 19:33:19.075476,2025-03-03 19:33:20.449844,0 days 00:00:01.374368,gaussian_mixture,presence,10.0,2,COMPLETE
1642,0.5504266039042403,2025-03-03 19:33:20.450843,2025-03-03 19:33:20.672891,0 days 00:00:00.222048,gaussian_mixture,abundance,2.4000000000000004,4,COMPLETE
1643,0.45717037381574654,2025-03-03 19:33:20.674699,2025-03-03 19:33:20.890784,0 days 00:00:00.216085,gaussian_mixture,abundance,2.25,2,COMPLETE
1644,0.352528818177715,2025-03-03 19:33:20.892784,2025-03-03 19:33:21.107058,0 days 00:00:00.214274,gaussian_mixture,abundance,2.0500000000000003,2,COMPLETE
1645,0.32089529122540894,2025-03-03 19:33:21.109046,2025-03-03 19:33:21.319330,0 days 00:00:00.210284,gaussian_mixture,abundance,2.3000000000000003,2,COMPLETE
1646,0.6224695185114969,2025-03-03 19:33:21.321321,2025-03-03 19:33:21.550180,0 days 00:00:00.228859,gaussian_mixture,abundance,2.2,2,COMPLETE
1647,0.1203768737245319,2025-03-03 19:33:21.551893,2025-03-03 19:33:21.766699,0 days 00:00:00.214806,gaussian_mixture,abundance,2.1,2,COMPLETE
1648,0.3131958163838995,2025-03-03 19:33:21.768697,2025-03-03 19:33:21.978330,0 days 00:00:00.209633,kmeans,abundance,2.4000000000000004,2,COMPLETE
1649,0.3494456365651037,2025-03-03 19:33:21.980327,2025-03-03 19:33:22.195703,0 days 00:00:00.215376,gaussian_mixture,abundance,2.2,2,COMPLETE
1650,0.5671938838180586,2025-03-03 19:33:22.196703,2025-03-03 19:33:22.414052,0 days 00:00:00.217349,gaussian_mixture,abundance,1.9000000000000001,2,COMPLETE
1651,0.5713812603087451,2025-03-03 19:33:22.415048,2025-03-03 19:33:22.636021,0 days 00:00:00.220973,gaussian_mixture,abundance,2.15,2,COMPLETE
1652,0.6606199848939529,2025-03-03 19:33:22.637047,2025-03-03 19:33:22.853208,0 days 00:00:00.216161,gaussian_mixture,abundance,2.35,2,COMPLETE
1653,0.5034596761363723,2025-03-03 19:33:22.855202,2025-03-03 19:33:23.074752,0 days 00:00:00.219550,gaussian_mixture,abundance,1.8,2,COMPLETE
1654,0.4220108450570403,2025-03-03 19:33:23.076745,2025-03-03 19:33:23.293877,0 days 00:00:00.217132,gaussian_mixture,abundance,2.25,2,COMPLETE
1655,0.35543257757426555,2025-03-03 19:33:23.294875,2025-03-03 19:33:23.509172,0 days 00:00:00.214297,gaussian_mixture,abundance,2.0500000000000003,2,COMPLETE
1656,0.47020244363432634,2025-03-03 19:33:23.510160,2025-03-03 19:33:23.740766,0 days 00:00:00.230606,gaussian_mixture,abundance,2.15,2,COMPLETE
1657,0.5001551720216997,2025-03-03 19:33:23.742769,2025-03-03 19:33:23.955892,0 days 00:00:00.213123,gaussian_mixture,abundance,2.3000000000000003,2,COMPLETE
1658,0.5678260201091435,2025-03-03 19:33:23.957878,2025-03-03 19:33:24.176270,0 days 00:00:00.218392,gaussian_mixture,abundance,2.2,2,COMPLETE
1659,0.4346365234682935,2025-03-03 19:33:24.178254,2025-03-03 19:33:24.437956,0 days 00:00:00.259702,gaussian_mixture,abundance,2.4000000000000004,2,COMPLETE
1660,0.07993486742647023,2025-03-03 19:33:24.438982,2025-03-03 19:33:25.685581,0 days 00:00:01.246599,gaussian_mixture,presence,120.0,6,COMPLETE
1661,0.6077447360631429,2025-03-03 19:33:25.687578,2025-03-03 19:33:25.919465,0 days 00:00:00.231887,gaussian_mixture,abundance,2.1,2,COMPLETE
1662,0.2976856635917007,2025-03-03 19:33:25.921452,2025-03-03 19:33:26.135743,0 days 00:00:00.214291,gaussian_mixture,abundance,2.25,2,COMPLETE
1663,0.6252944405429411,2025-03-03 19:33:26.137538,2025-03-03 19:33:26.356133,0 days 00:00:00.218595,gaussian_mixture,abundance,2.3000000000000003,2,COMPLETE
1664,0.3758838021462475,2025-03-03 19:33:26.358130,2025-03-03 19:33:26.577434,0 days 00:00:00.219304,gaussian_mixture,abundance,2.0,2,COMPLETE
1665,0.4157031414758438,2025-03-03 19:33:26.579429,2025-03-03 19:33:26.802961,0 days 00:00:00.223532,gaussian_mixture,abundance,2.2,2,COMPLETE
1666,0.5484636125978326,2025-03-03 19:33:26.803958,2025-03-03 19:33:27.018465,0 days 00:00:00.214507,gaussian_mixture,abundance,2.35,2,COMPLETE
1667,0.19633449992637603,2025-03-03 19:33:27.020456,2025-03-03 19:33:27.228809,0 days 00:00:00.208353,kmeans,abundance,2.15,2,COMPLETE
1668,0.5863439056011688,2025-03-03 19:33:27.230807,2025-03-03 19:33:27.449706,0 days 00:00:00.218899,gaussian_mixture,abundance,1.9500000000000002,2,COMPLETE
1669,0.6509159960668365,2025-03-03 19:33:27.451702,2025-03-03 19:33:27.671051,0 days 00:00:00.219349,gaussian_mixture,abundance,2.25,2,COMPLETE
1670,0.3861871951626302,2025-03-03 19:33:27.672051,2025-03-03 19:33:27.899058,0 days 00:00:00.227007,gaussian_mixture,abundance,2.1,2,COMPLETE
1671,0.406037678612997,2025-03-03 19:33:27.900042,2025-03-03 19:33:28.123009,0 days 00:00:00.222967,gaussian_mixture,abundance,2.4000000000000004,2,COMPLETE
1672,0.5406704617976538,2025-03-03 19:33:28.124005,2025-03-03 19:33:28.344645,0 days 00:00:00.220640,gaussian_mixture,abundance,2.15,2,COMPLETE
1673,0.5989117476046195,2025-03-03 19:33:28.345653,2025-03-03 19:33:28.570755,0 days 00:00:00.225102,gaussian_mixture,abundance,2.2,2,COMPLETE
1674,0.4872239884995322,2025-03-03 19:33:28.572749,2025-03-03 19:33:28.791833,0 days 00:00:00.219084,gaussian_mixture,abundance,2.0500000000000003,2,COMPLETE
1675,0.4525366453716611,2025-03-03 19:33:28.793828,2025-03-03 19:33:29.011867,0 days 00:00:00.218039,gaussian_mixture,abundance,2.3000000000000003,2,COMPLETE
1676,0.6182530169166588,2025-03-03 19:33:29.013866,2025-03-03 19:33:29.237979,0 days 00:00:00.224113,gaussian_mixture,abundance,2.2,2,COMPLETE
1677,0.3449851561286741,2025-03-03 19:33:29.238981,2025-03-03 19:33:29.455566,0 days 00:00:00.216585,gaussian_mixture,abundance,2.35,2,COMPLETE
1678,0.5476077256722555,2025-03-03 19:33:29.457571,2025-03-03 19:33:29.687060,0 days 00:00:00.229489,gaussian_mixture,abundance,1.85,3,COMPLETE
1679,0.03714976991859956,2025-03-03 19:33:29.687872,2025-03-03 19:33:31.048524,0 days 00:00:01.360652,gaussian_mixture,presence,10.0,2,COMPLETE
1680,0.566998954031531,2025-03-03 19:33:31.049524,2025-03-03 19:33:31.265777,0 days 00:00:00.216253,gaussian_mixture,abundance,2.3000000000000003,2,COMPLETE
1681,0.30592788709234586,2025-03-03 19:33:31.267771,2025-03-03 19:33:31.489483,0 days 00:00:00.221712,gaussian_mixture,abundance,1.6500000000000001,2,COMPLETE
1682,0.35439974256984874,2025-03-03 19:33:31.491482,2025-03-03 19:33:31.707621,0 days 00:00:00.216139,gaussian_mixture,abundance,2.25,2,COMPLETE
1683,0.4405991962412722,2025-03-03 19:33:31.709618,2025-03-03 19:33:31.922717,0 days 00:00:00.213099,gaussian_mixture,abundance,2.45,2,COMPLETE
1684,0.675073472609933,2025-03-03 19:33:31.924713,2025-03-03 19:33:32.147821,0 days 00:00:00.223108,gaussian_mixture,abundance,2.1,2,COMPLETE
1685,0.26099039267448837,2025-03-03 19:33:32.148813,2025-03-03 19:33:32.371419,0 days 00:00:00.222606,kmeans,abundance,2.35,2,COMPLETE
1686,0.42246951851149694,2025-03-03 19:33:32.372424,2025-03-03 19:33:32.592577,0 days 00:00:00.220153,gaussian_mixture,abundance,2.15,2,COMPLETE
1687,0.45127134672434155,2025-03-03 19:33:32.593580,2025-03-03 19:33:32.811031,0 days 00:00:00.217451,gaussian_mixture,abundance,2.2,2,COMPLETE
1688,0.40947887123225907,2025-03-03 19:33:32.813021,2025-03-03 19:33:33.037209,0 days 00:00:00.224188,gaussian_mixture,abundance,2.25,2,COMPLETE
1689,0.4607264112444452,2025-03-03 19:33:33.039200,2025-03-03 19:33:33.270483,0 days 00:00:00.231283,gaussian_mixture,abundance,2.1,5,COMPLETE
1690,0.4073454247198603,2025-03-03 19:33:33.271471,2025-03-03 19:33:33.488935,0 days 00:00:00.217464,gaussian_mixture,abundance,2.3000000000000003,2,COMPLETE
1691,0.6479646551774148,2025-03-03 19:33:33.489931,2025-03-03 19:33:33.709372,0 days 00:00:00.219441,gaussian_mixture,abundance,2.4000000000000004,2,COMPLETE
1692,0.4871638149695389,2025-03-03 19:33:33.711371,2025-03-03 19:33:33.929781,0 days 00:00:00.218410,gaussian_mixture,abundance,2.0,2,COMPLETE
1693,0.47000528336051167,2025-03-03 19:33:33.931803,2025-03-03 19:33:34.156046,0 days 00:00:00.224243,gaussian_mixture,abundance,2.15,2,COMPLETE
1694,0.6192824691145307,2025-03-03 19:33:34.158836,2025-03-03 19:33:34.385158,0 days 00:00:00.226322,gaussian_mixture,abundance,2.25,2,COMPLETE
1695,0.42319287765545494,2025-03-03 19:33:34.386770,2025-03-03 19:33:34.606368,0 days 00:00:00.219598,gaussian_mixture,abundance,2.0500000000000003,2,COMPLETE
1696,0.5335069890342256,2025-03-03 19:33:34.609357,2025-03-03 19:33:34.833369,0 days 00:00:00.224012,gaussian_mixture,abundance,2.2,2,COMPLETE
1697,0.49057271328132634,2025-03-03 19:33:34.835381,2025-03-03 19:33:35.051675,0 days 00:00:00.216294,gaussian_mixture,abundance,2.3000000000000003,2,COMPLETE
1698,0.34713531949731513,2025-03-03 19:33:35.053471,2025-03-03 19:33:35.271785,0 days 00:00:00.218314,gaussian_mixture,abundance,2.35,2,COMPLETE
1699,0.06604505305267651,2025-03-03 19:33:35.272783,2025-03-03 19:33:36.426604,0 days 00:00:01.153821,gaussian_mixture,presence,100.0,2,COMPLETE
1700,0.3611517127960722,2025-03-03 19:33:36.428597,2025-03-03 19:33:36.664528,0 days 00:00:00.235931,gaussian_mixture,abundance,2.1,2,COMPLETE
1701,0.5724555669623936,2025-03-03 19:33:36.666528,2025-03-03 19:33:36.902671,0 days 00:00:00.236143,gaussian_mixture,abundance,0.8,2,COMPLETE
1702,0.6048339411217721,2025-03-03 19:33:36.903676,2025-03-03 19:33:37.122010,0 days 00:00:00.218334,gaussian_mixture,abundance,2.45,2,COMPLETE
1703,0.412305385825327,2025-03-03 19:33:37.123010,2025-03-03 19:33:37.352346,0 days 00:00:00.229336,kmeans,abundance,2.25,2,COMPLETE
1704,0.5774721281861831,2025-03-03 19:33:37.354341,2025-03-03 19:33:37.596368,0 days 00:00:00.242027,gaussian_mixture,abundance,1.8,2,COMPLETE
1705,0.5670075402058281,2025-03-03 19:33:37.597368,2025-03-03 19:33:37.824545,0 days 00:00:00.227177,gaussian_mixture,abundance,2.15,2,COMPLETE
1706,0.47808694700731336,2025-03-03 19:33:37.826542,2025-03-03 19:33:38.040319,0 days 00:00:00.213777,gaussian_mixture,abundance,2.2,2,COMPLETE
1707,0.6271025897960951,2025-03-03 19:33:38.042314,2025-03-03 19:33:38.268200,0 days 00:00:00.225886,gaussian_mixture,abundance,1.5,2,COMPLETE
1708,0.36401190535900835,2025-03-03 19:33:38.269202,2025-03-03 19:33:38.486547,0 days 00:00:00.217345,gaussian_mixture,abundance,1.9500000000000002,2,COMPLETE
1709,0.47229446760738314,2025-03-03 19:33:38.487546,2025-03-03 19:33:38.711379,0 days 00:00:00.223833,gaussian_mixture,abundance,2.3000000000000003,2,COMPLETE
1710,0.5578358805019386,2025-03-03 19:33:38.713378,2025-03-03 19:33:38.960530,0 days 00:00:00.247152,gaussian_mixture,abundance,2.4000000000000004,2,COMPLETE
1711,0.6782857252123856,2025-03-03 19:33:38.962519,2025-03-03 19:33:39.185692,0 days 00:00:00.223173,gaussian_mixture,abundance,2.15,2,COMPLETE
1712,0.48765030038150065,2025-03-03 19:33:39.186691,2025-03-03 19:33:39.405347,0 days 00:00:00.218656,gaussian_mixture,abundance,2.25,2,COMPLETE
1713,0.3780466542703075,2025-03-03 19:33:39.406347,2025-03-03 19:33:39.625186,0 days 00:00:00.218839,gaussian_mixture,abundance,2.2,2,COMPLETE
1714,0.5059476514216298,2025-03-03 19:33:39.626184,2025-03-03 19:33:39.841304,0 days 00:00:00.215120,gaussian_mixture,abundance,2.1,2,COMPLETE
1715,0.4023187223198891,2025-03-03 19:33:39.843304,2025-03-03 19:33:40.064583,0 days 00:00:00.221279,gaussian_mixture,abundance,2.0500000000000003,2,COMPLETE
1716,0.01774671016452583,2025-03-03 19:33:40.065582,2025-03-03 19:33:41.433567,0 days 00:00:01.367985,gaussian_mixture,presence,10.0,2,COMPLETE
1717,0.3850643152242541,2025-03-03 19:33:41.435567,2025-03-03 19:33:41.653415,0 days 00:00:00.217848,gaussian_mixture,abundance,2.35,2,COMPLETE
1718,0.478744562221574,2025-03-03 19:33:41.654415,2025-03-03 19:33:41.877420,0 days 00:00:00.223005,gaussian_mixture,abundance,2.25,2,COMPLETE
1719,0.5982313989794674,2025-03-03 19:33:41.878421,2025-03-03 19:33:42.099743,0 days 00:00:00.221322,gaussian_mixture,abundance,2.4000000000000004,3,COMPLETE
1720,0.648071064913182,2025-03-03 19:33:42.101550,2025-03-03 19:33:42.333685,0 days 00:00:00.232135,gaussian_mixture,abundance,2.15,4,COMPLETE
1721,0.4694496659871124,2025-03-03 19:33:42.335479,2025-03-03 19:33:42.554649,0 days 00:00:00.219170,gaussian_mixture,abundance,2.2,2,COMPLETE
1722,0.5803196574913291,2025-03-03 19:33:42.555647,2025-03-03 19:33:42.781159,0 days 00:00:00.225512,gaussian_mixture,abundance,2.45,2,COMPLETE
1723,0.43656033123557814,2025-03-03 19:33:42.783157,2025-03-03 19:33:43.007403,0 days 00:00:00.224246,kmeans,abundance,1.7000000000000002,2,COMPLETE
1724,0.5763932860207628,2025-03-03 19:33:43.009573,2025-03-03 19:33:43.233872,0 days 00:00:00.224299,gaussian_mixture,abundance,2.3000000000000003,2,COMPLETE
1725,0.45524716893031447,2025-03-03 19:33:43.234867,2025-03-03 19:33:43.462206,0 days 00:00:00.227339,gaussian_mixture,abundance,2.3000000000000003,2,COMPLETE
1726,0.38900769899215537,2025-03-03 19:33:43.464210,2025-03-03 19:33:43.681029,0 days 00:00:00.216819,gaussian_mixture,abundance,2.0500000000000003,2,COMPLETE
1727,0.535365427079225,2025-03-03 19:33:43.683029,2025-03-03 19:33:43.905086,0 days 00:00:00.222057,gaussian_mixture,abundance,2.15,2,COMPLETE
1728,0.5660572075958697,2025-03-03 19:33:43.906091,2025-03-03 19:33:44.126223,0 days 00:00:00.220132,gaussian_mixture,abundance,2.25,2,COMPLETE
1729,0.5589487074715969,2025-03-03 19:33:44.128228,2025-03-03 19:33:44.350883,0 days 00:00:00.222655,gaussian_mixture,abundance,2.35,2,COMPLETE
1730,0.6407477641854399,2025-03-03 19:33:44.352881,2025-03-03 19:33:44.569769,0 days 00:00:00.216888,gaussian_mixture,abundance,2.2,2,COMPLETE
1731,0.4520011688177899,2025-03-03 19:33:44.570769,2025-03-03 19:33:44.787284,0 days 00:00:00.216515,gaussian_mixture,abundance,2.1,2,COMPLETE
1732,0.4065724973718239,2025-03-03 19:33:44.788284,2025-03-03 19:33:45.013861,0 days 00:00:00.225577,gaussian_mixture,abundance,2.25,2,COMPLETE
1733,0.3789023250773841,2025-03-03 19:33:45.014867,2025-03-03 19:33:45.245533,0 days 00:00:00.230666,gaussian_mixture,abundance,2.45,2,COMPLETE
1734,0.42246951851149694,2025-03-03 19:33:45.246533,2025-03-03 19:33:45.462165,0 days 00:00:00.215632,gaussian_mixture,abundance,2.35,2,COMPLETE
1735,0.03800825008668979,2025-03-03 19:33:45.463165,2025-03-03 19:33:46.749269,0 days 00:00:01.286104,gaussian_mixture,presence,20.0,2,COMPLETE
1736,0.5691169393529935,2025-03-03 19:33:46.750270,2025-03-03 19:33:46.978814,0 days 00:00:00.228544,gaussian_mixture,abundance,1.9000000000000001,2,COMPLETE
1737,0.7399133263679473,2025-03-03 19:33:46.979810,2025-03-03 19:33:47.207141,0 days 00:00:00.227331,gaussian_mixture,abundance,2.0,2,COMPLETE
1738,0.5328869054116229,2025-03-03 19:33:47.208728,2025-03-03 19:33:47.439893,0 days 00:00:00.231165,gaussian_mixture,abundance,2.0500000000000003,2,COMPLETE
1739,0.5207495136081375,2025-03-03 19:33:47.441873,2025-03-03 19:33:47.701175,0 days 00:00:00.259302,gaussian_mixture,abundance,2.1,2,COMPLETE
1740,0.5022251520473182,2025-03-03 19:33:47.702935,2025-03-03 19:33:47.923710,0 days 00:00:00.220775,gaussian_mixture,abundance,2.0,2,COMPLETE
1741,0.31358421240355006,2025-03-03 19:33:47.925703,2025-03-03 19:33:48.145783,0 days 00:00:00.220080,gaussian_mixture,abundance,1.85,2,COMPLETE
1742,0.5604261307339449,2025-03-03 19:33:48.147783,2025-03-03 19:33:48.372868,0 days 00:00:00.225085,gaussian_mixture,abundance,1.9000000000000001,2,COMPLETE
1743,0.505587875732809,2025-03-03 19:33:48.374868,2025-03-03 19:33:48.589014,0 days 00:00:00.214146,kmeans,abundance,1.9500000000000002,2,COMPLETE
1744,0.35488426327041794,2025-03-03 19:33:48.590015,2025-03-03 19:33:48.812145,0 days 00:00:00.222130,gaussian_mixture,abundance,2.0,2,COMPLETE
1745,0.31852104315548024,2025-03-03 19:33:48.813145,2025-03-03 19:33:49.033811,0 days 00:00:00.220666,gaussian_mixture,abundance,2.0,2,COMPLETE
1746,0.5717539435086527,2025-03-03 19:33:49.034811,2025-03-03 19:33:49.264404,0 days 00:00:00.229593,gaussian_mixture,abundance,1.9500000000000002,2,COMPLETE
1747,0.5335575114872793,2025-03-03 19:33:49.265657,2025-03-03 19:33:49.499367,0 days 00:00:00.233710,gaussian_mixture,abundance,1.9000000000000001,2,COMPLETE
1748,0.3914482628308662,2025-03-03 19:33:49.500367,2025-03-03 19:33:49.719252,0 days 00:00:00.218885,gaussian_mixture,abundance,2.0,2,COMPLETE
1749,0.5262617076219899,2025-03-03 19:33:49.721247,2025-03-03 19:33:49.938856,0 days 00:00:00.217609,gaussian_mixture,abundance,1.9500000000000002,2,COMPLETE
1750,0.4088156521649949,2025-03-03 19:33:49.940662,2025-03-03 19:33:50.168581,0 days 00:00:00.227919,gaussian_mixture,abundance,1.9500000000000002,2,COMPLETE
1751,0.4442504648391525,2025-03-03 19:33:50.169378,2025-03-03 19:33:50.394452,0 days 00:00:00.225074,gaussian_mixture,abundance,1.9000000000000001,2,COMPLETE
1752,0.5549769855536347,2025-03-03 19:33:50.396449,2025-03-03 19:33:50.621925,0 days 00:00:00.225476,gaussian_mixture,abundance,1.85,2,COMPLETE
1753,0.5366597279496125,2025-03-03 19:33:50.623926,2025-03-03 19:33:50.843656,0 days 00:00:00.219730,gaussian_mixture,abundance,2.0,2,COMPLETE
1754,0.013700065705748995,2025-03-03 19:33:50.844656,2025-03-03 19:33:52.211246,0 days 00:00:01.366590,gaussian_mixture,presence,10.0,2,COMPLETE
1755,0.4391912815802951,2025-03-03 19:33:52.213246,2025-03-03 19:33:52.447564,0 days 00:00:00.234318,gaussian_mixture,abundance,2.0,5,COMPLETE
1756,0.30803810926479747,2025-03-03 19:33:52.448564,2025-03-03 19:33:52.683584,0 days 00:00:00.235020,gaussian_mixture,abundance,1.9500000000000002,2,COMPLETE
1757,0.6651697564734274,2025-03-03 19:33:52.684585,2025-03-03 19:33:52.907166,0 days 00:00:00.222581,gaussian_mixture,abundance,2.0500000000000003,2,COMPLETE
1758,0.573402195187577,2025-03-03 19:33:52.909158,2025-03-03 19:33:53.129976,0 days 00:00:00.220818,gaussian_mixture,abundance,2.0500000000000003,2,COMPLETE
1759,0.5376692080492349,2025-03-03 19:33:53.131781,2025-03-03 19:33:53.355476,0 days 00:00:00.223695,gaussian_mixture,abundance,1.9000000000000001,2,COMPLETE
1760,0.292472080040342,2025-03-03 19:33:53.357282,2025-03-03 19:33:53.576207,0 days 00:00:00.218925,kmeans,abundance,1.6,2,COMPLETE
1761,0.5388245067318052,2025-03-03 19:33:53.578200,2025-03-03 19:33:53.812330,0 days 00:00:00.234130,gaussian_mixture,abundance,2.0,2,COMPLETE
1762,0.5335575114872793,2025-03-03 19:33:53.813330,2025-03-03 19:33:54.035514,0 days 00:00:00.222184,gaussian_mixture,abundance,2.0500000000000003,2,COMPLETE
1763,0.41044600961635885,2025-03-03 19:33:54.037515,2025-03-03 19:33:54.261656,0 days 00:00:00.224141,gaussian_mixture,abundance,1.9500000000000002,2,COMPLETE
1764,0.5966284709591211,2025-03-03 19:33:54.263656,2025-03-03 19:33:54.489417,0 days 00:00:00.225761,gaussian_mixture,abundance,2.0500000000000003,2,COMPLETE
1765,0.5550547739197408,2025-03-03 19:33:54.490416,2025-03-03 19:33:54.711532,0 days 00:00:00.221116,gaussian_mixture,abundance,1.8,2,COMPLETE
1766,0.4897397716582059,2025-03-03 19:33:54.713548,2025-03-03 19:33:54.941137,0 days 00:00:00.227589,gaussian_mixture,abundance,1.2000000000000002,2,COMPLETE
1767,0.38681840600945117,2025-03-03 19:33:54.943137,2025-03-03 19:33:55.161990,0 days 00:00:00.218853,gaussian_mixture,abundance,2.1,2,COMPLETE
1768,0.489490882713093,2025-03-03 19:33:55.163989,2025-03-03 19:33:55.395755,0 days 00:00:00.231766,gaussian_mixture,abundance,2.4000000000000004,3,COMPLETE
1769,0.324173249285946,2025-03-03 19:33:55.396755,2025-03-03 19:33:55.611397,0 days 00:00:00.214642,gaussian_mixture,abundance,2.1,2,COMPLETE
1770,0.5044709522561904,2025-03-03 19:33:55.613397,2025-03-03 19:33:55.845644,0 days 00:00:00.232247,gaussian_mixture,abundance,2.45,2,COMPLETE
1771,0.4875876297961687,2025-03-03 19:33:55.847803,2025-03-03 19:33:56.073131,0 days 00:00:00.225328,gaussian_mixture,abundance,2.0500000000000003,2,COMPLETE
1772,0.4694496659871124,2025-03-03 19:33:56.075120,2025-03-03 19:33:56.294331,0 days 00:00:00.219211,gaussian_mixture,abundance,2.4000000000000004,2,COMPLETE
1773,0.6282619979114271,2025-03-03 19:33:56.296328,2025-03-03 19:33:56.510470,0 days 00:00:00.214142,gaussian_mixture,abundance,2.35,2,COMPLETE
1774,0.03995505358861042,2025-03-03 19:33:56.512470,2025-03-03 19:33:57.838912,0 days 00:00:01.326442,gaussian_mixture,presence,15.0,2,COMPLETE
1775,0.6050357221398829,2025-03-03 19:33:57.840910,2025-03-03 19:33:58.077259,0 days 00:00:00.236349,gaussian_mixture,abundance,1.75,2,COMPLETE
