number,value,datetime_start,datetime_complete,duration,params_algorithm,params_filter_criteria,params_filter_threshold,params_k,state
295,0.4320310617770036,2025-03-03 19:27:24.996118,2025-03-03 19:27:25.176216,0 days 00:00:00.180098,gaussian_mixture,abundance,2.0500000000000003,2,COMPLETE
296,0.4446846075417337,2025-03-03 19:27:25.177216,2025-03-03 19:27:25.364277,0 days 00:00:00.187061,gaussian_mixture,abundance,1.85,2,COMPLETE
297,0.05230589975677078,2025-03-03 19:27:25.366273,2025-03-03 19:27:26.697312,0 days 00:00:01.331039,gaussian_mixture,presence,45.0,2,COMPLETE
298,0.37413007719645497,2025-03-03 19:27:26.698317,2025-03-03 19:27:26.883834,0 days 00:00:00.185517,gaussian_mixture,abundance,1.7000000000000002,2,COMPLETE
299,0.42376460052995724,2025-03-03 19:27:26.885835,2025-03-03 19:27:27.066471,0 days 00:00:00.180636,gaussian_mixture,abundance,2.1,2,COMPLETE
300,0.5454069372717991,2025-03-03 19:27:27.067471,2025-03-03 19:27:27.254971,0 days 00:00:00.187500,gaussian_mixture,abundance,1.9500000000000002,5,COMPLETE
301,0.7508058246648754,2025-03-03 19:27:27.256966,2025-03-03 19:27:27.439092,0 days 00:00:00.182126,gaussian_mixture,abundance,1.8,2,COMPLETE
302,0.5459279884678057,2025-03-03 19:27:27.440092,2025-03-03 19:27:27.622417,0 days 00:00:00.182325,gaussian_mixture,abundance,1.8,2,COMPLETE
303,0.39781776601543906,2025-03-03 19:27:27.624412,2025-03-03 19:27:27.797529,0 days 00:00:00.173117,kmeans,abundance,1.75,2,COMPLETE
304,0.3603455222323523,2025-03-03 19:27:27.798534,2025-03-03 19:27:27.985494,0 days 00:00:00.186960,gaussian_mixture,abundance,1.6500000000000001,2,COMPLETE
305,0.5335371345121894,2025-03-03 19:27:27.986492,2025-03-03 19:27:28.181282,0 days 00:00:00.194790,gaussian_mixture,abundance,1.85,2,COMPLETE
306,0.3339671844232778,2025-03-03 19:27:28.182287,2025-03-03 19:27:28.365317,0 days 00:00:00.183030,gaussian_mixture,abundance,1.75,2,COMPLETE
307,0.3262570588866727,2025-03-03 19:27:28.366315,2025-03-03 19:27:28.546642,0 days 00:00:00.180327,gaussian_mixture,abundance,1.8,2,COMPLETE
308,0.3294333336315761,2025-03-03 19:27:28.547653,2025-03-03 19:27:28.734430,0 days 00:00:00.186777,gaussian_mixture,abundance,1.4500000000000002,2,COMPLETE
309,0.4652468899102167,2025-03-03 19:27:28.735226,2025-03-03 19:27:28.918613,0 days 00:00:00.183387,gaussian_mixture,abundance,1.7000000000000002,2,COMPLETE
310,0.3327952409496938,2025-03-03 19:27:28.919613,2025-03-03 19:27:29.104749,0 days 00:00:00.185136,gaussian_mixture,abundance,1.55,2,COMPLETE
311,0.398404617791575,2025-03-03 19:27:29.105749,2025-03-03 19:27:29.292448,0 days 00:00:00.186699,gaussian_mixture,abundance,1.6,2,COMPLETE
312,0.37854297386988256,2025-03-03 19:27:29.293448,2025-03-03 19:27:29.471582,0 days 00:00:00.178134,gaussian_mixture,abundance,2.5500000000000003,2,COMPLETE
313,0.43779125355874376,2025-03-03 19:27:29.472566,2025-03-03 19:27:29.653751,0 days 00:00:00.181185,gaussian_mixture,abundance,1.9000000000000001,2,COMPLETE
314,0.47874540857913905,2025-03-03 19:27:29.655326,2025-03-03 19:27:29.837105,0 days 00:00:00.181779,gaussian_mixture,abundance,1.85,2,COMPLETE
315,0.535595295082438,2025-03-03 19:27:29.838102,2025-03-03 19:27:30.027701,0 days 00:00:00.189599,gaussian_mixture,abundance,1.75,4,COMPLETE
316,0.031166032972700642,2025-03-03 19:27:30.029693,2025-03-03 19:27:31.327734,0 days 00:00:01.298041,gaussian_mixture,presence,15.0,2,COMPLETE
317,0.3936670676615192,2025-03-03 19:27:31.329743,2025-03-03 19:27:31.517530,0 days 00:00:00.187787,gaussian_mixture,abundance,2.25,2,COMPLETE
318,0.3108643192006203,2025-03-03 19:27:31.518338,2025-03-03 19:27:31.695742,0 days 00:00:00.177404,gaussian_mixture,abundance,2.6,2,COMPLETE
319,0.1975175666957008,2025-03-03 19:27:31.696738,2025-03-03 19:27:31.877999,0 days 00:00:00.181261,gaussian_mixture,abundance,1.6500000000000001,2,COMPLETE
320,0.3488084192331767,2025-03-03 19:27:31.878999,2025-03-03 19:27:32.087321,0 days 00:00:00.208322,gaussian_mixture,abundance,0.5,2,COMPLETE
321,0.3825183913899538,2025-03-03 19:27:32.088326,2025-03-03 19:27:32.276559,0 days 00:00:00.188233,gaussian_mixture,abundance,1.7000000000000002,2,COMPLETE
322,0.5005649462675505,2025-03-03 19:27:32.278556,2025-03-03 19:27:32.463864,0 days 00:00:00.185308,kmeans,abundance,1.8,2,COMPLETE
323,0.631711483016012,2025-03-03 19:27:32.464863,2025-03-03 19:27:32.650086,0 days 00:00:00.185223,gaussian_mixture,abundance,2.4000000000000004,2,COMPLETE
324,0.604223672562018,2025-03-03 19:27:32.650086,2025-03-03 19:27:32.832389,0 days 00:00:00.182303,gaussian_mixture,abundance,1.9000000000000001,2,COMPLETE
325,0.44924330793134787,2025-03-03 19:27:32.833196,2025-03-03 19:27:33.017150,0 days 00:00:00.183954,gaussian_mixture,abundance,2.35,2,COMPLETE
326,0.5925167901241235,2025-03-03 19:27:33.018150,2025-03-03 19:27:33.198281,0 days 00:00:00.180131,gaussian_mixture,abundance,2.45,2,COMPLETE
327,0.6691001849927931,2025-03-03 19:27:33.199281,2025-03-03 19:27:33.383497,0 days 00:00:00.184216,gaussian_mixture,abundance,2.45,2,COMPLETE
328,0.37964969567603546,2025-03-03 19:27:33.384492,2025-03-03 19:27:33.564019,0 days 00:00:00.179527,gaussian_mixture,abundance,2.4000000000000004,2,COMPLETE
329,0.6286769636420244,2025-03-03 19:27:33.564793,2025-03-03 19:27:33.743931,0 days 00:00:00.179138,gaussian_mixture,abundance,2.5,2,COMPLETE
330,0.3894053894282216,2025-03-03 19:27:33.745941,2025-03-03 19:27:33.922249,0 days 00:00:00.176308,gaussian_mixture,abundance,2.35,2,COMPLETE
331,0.2868373622561743,2025-03-03 19:27:33.924056,2025-03-03 19:27:34.102309,0 days 00:00:00.178253,gaussian_mixture,abundance,2.5,2,COMPLETE
332,0.6997070428222841,2025-03-03 19:27:34.103310,2025-03-03 19:27:34.283799,0 days 00:00:00.180489,gaussian_mixture,abundance,2.45,2,COMPLETE
333,0.35699017246258974,2025-03-03 19:27:34.284799,2025-03-03 19:27:34.462181,0 days 00:00:00.177382,gaussian_mixture,abundance,2.45,2,COMPLETE
334,0.5892866524493573,2025-03-03 19:27:34.463180,2025-03-03 19:27:34.650964,0 days 00:00:00.187784,gaussian_mixture,abundance,2.5,2,COMPLETE
335,0.30301212015062157,2025-03-03 19:27:34.651964,2025-03-03 19:27:34.829073,0 days 00:00:00.177109,gaussian_mixture,abundance,2.4000000000000004,2,COMPLETE
336,-0.006068634990370946,2025-03-03 19:27:34.830073,2025-03-03 19:27:36.113279,0 days 00:00:01.283206,gaussian_mixture,presence,10.0,2,COMPLETE
337,0.3702511032458563,2025-03-03 19:27:36.114284,2025-03-03 19:27:36.299979,0 days 00:00:00.185695,gaussian_mixture,abundance,2.45,2,COMPLETE
338,0.4590241090161741,2025-03-03 19:27:36.300778,2025-03-03 19:27:36.477910,0 days 00:00:00.177132,gaussian_mixture,abundance,2.5500000000000003,2,COMPLETE
339,0.43537494822180156,2025-03-03 19:27:36.478910,2025-03-03 19:27:36.666234,0 days 00:00:00.187324,gaussian_mixture,abundance,2.4000000000000004,2,COMPLETE
340,0.5532043360519874,2025-03-03 19:27:36.667889,2025-03-03 19:27:36.846211,0 days 00:00:00.178322,gaussian_mixture,abundance,2.5500000000000003,2,COMPLETE
341,0.5866194899643528,2025-03-03 19:27:36.847206,2025-03-03 19:27:37.028630,0 days 00:00:00.181424,gaussian_mixture,abundance,2.5,2,COMPLETE
342,0.34620871809215614,2025-03-03 19:27:37.029630,2025-03-03 19:27:37.203408,0 days 00:00:00.173778,kmeans,abundance,2.45,2,COMPLETE
343,0.46641911887517595,2025-03-03 19:27:37.204409,2025-03-03 19:27:37.383742,0 days 00:00:00.179333,gaussian_mixture,abundance,2.35,2,COMPLETE
344,0.49438544312923416,2025-03-03 19:27:37.384741,2025-03-03 19:27:37.564229,0 days 00:00:00.179488,gaussian_mixture,abundance,2.3000000000000003,2,COMPLETE
345,0.4831078733446309,2025-03-03 19:27:37.566035,2025-03-03 19:27:37.742607,0 days 00:00:00.176572,gaussian_mixture,abundance,2.5,2,COMPLETE
346,0.547806321193011,2025-03-03 19:27:37.743612,2025-03-03 19:27:37.922603,0 days 00:00:00.178991,gaussian_mixture,abundance,2.6,2,COMPLETE
347,0.4413999927843486,2025-03-03 19:27:37.924591,2025-03-03 19:27:38.099719,0 days 00:00:00.175128,gaussian_mixture,abundance,2.5500000000000003,2,COMPLETE
348,0.24926871041824067,2025-03-03 19:27:38.100719,2025-03-03 19:27:38.276150,0 days 00:00:00.175431,gaussian_mixture,abundance,2.35,2,COMPLETE
349,0.42721764542837326,2025-03-03 19:27:38.277147,2025-03-03 19:27:38.452727,0 days 00:00:00.175580,gaussian_mixture,abundance,2.45,2,COMPLETE
350,0.633449033953476,2025-03-03 19:27:38.453727,2025-03-03 19:27:38.633042,0 days 00:00:00.179315,gaussian_mixture,abundance,2.6500000000000004,2,COMPLETE
351,0.5209244708547204,2025-03-03 19:27:38.634849,2025-03-03 19:27:38.819785,0 days 00:00:00.184936,gaussian_mixture,abundance,2.6,2,COMPLETE
352,0.45637408917768524,2025-03-03 19:27:38.820836,2025-03-03 19:27:38.999977,0 days 00:00:00.179141,gaussian_mixture,abundance,2.6,2,COMPLETE
353,0.3904954108935401,2025-03-03 19:27:39.000972,2025-03-03 19:27:39.177607,0 days 00:00:00.176635,gaussian_mixture,abundance,2.4000000000000004,2,COMPLETE
354,0.5948843332807321,2025-03-03 19:27:39.179607,2025-03-03 19:27:39.363490,0 days 00:00:00.183883,gaussian_mixture,abundance,2.5500000000000003,2,COMPLETE
355,0.6224100384577351,2025-03-03 19:27:39.364495,2025-03-03 19:27:39.551061,0 days 00:00:00.186566,gaussian_mixture,abundance,2.4000000000000004,2,COMPLETE
356,0.4945073858572404,2025-03-03 19:27:39.553070,2025-03-03 19:27:39.730337,0 days 00:00:00.177267,gaussian_mixture,abundance,2.6500000000000004,2,COMPLETE
357,0.017170677594502987,2025-03-03 19:27:39.731142,2025-03-03 19:27:41.024386,0 days 00:00:01.293244,gaussian_mixture,presence,10.0,2,COMPLETE
358,0.2300097782052261,2025-03-03 19:27:41.025391,2025-03-03 19:27:41.209474,0 days 00:00:00.184083,gaussian_mixture,abundance,2.5500000000000003,2,COMPLETE
359,0.5637143392741459,2025-03-03 19:27:41.211470,2025-03-03 19:27:41.402519,0 days 00:00:00.191049,gaussian_mixture,abundance,2.6500000000000004,2,COMPLETE
360,0.34059259216374027,2025-03-03 19:27:41.404532,2025-03-03 19:27:41.594847,0 days 00:00:00.190315,gaussian_mixture,abundance,2.6500000000000004,2,COMPLETE
361,0.5370462256441575,2025-03-03 19:27:41.595847,2025-03-03 19:27:41.775233,0 days 00:00:00.179386,gaussian_mixture,abundance,2.5,2,COMPLETE
362,0.34107049838222886,2025-03-03 19:27:41.777224,2025-03-03 19:27:41.947809,0 days 00:00:00.170585,kmeans,abundance,2.3000000000000003,2,COMPLETE
363,0.33307371031548144,2025-03-03 19:27:41.948809,2025-03-03 19:27:42.128094,0 days 00:00:00.179285,gaussian_mixture,abundance,2.45,2,COMPLETE
364,0.2587750685946385,2025-03-03 19:27:42.129095,2025-03-03 19:27:42.302420,0 days 00:00:00.173325,gaussian_mixture,abundance,2.5,2,COMPLETE
365,0.14998012111758602,2025-03-03 19:27:42.304220,2025-03-03 19:27:42.482986,0 days 00:00:00.178766,gaussian_mixture,abundance,2.4000000000000004,2,COMPLETE
366,0.533273403106168,2025-03-03 19:27:42.483986,2025-03-03 19:27:42.666136,0 days 00:00:00.182150,gaussian_mixture,abundance,2.5,2,COMPLETE
367,0.37612605375862035,2025-03-03 19:27:42.667136,2025-03-03 19:27:42.849107,0 days 00:00:00.181971,gaussian_mixture,abundance,2.6,2,COMPLETE
368,0.43663436098179964,2025-03-03 19:27:42.850107,2025-03-03 19:27:43.030985,0 days 00:00:00.180878,gaussian_mixture,abundance,2.35,2,COMPLETE
369,0.4510696834206126,2025-03-03 19:27:43.031985,2025-03-03 19:27:43.233927,0 days 00:00:00.201942,gaussian_mixture,abundance,2.6500000000000004,5,COMPLETE
370,0.5823377820300791,2025-03-03 19:27:43.234734,2025-03-03 19:27:43.422865,0 days 00:00:00.188131,gaussian_mixture,abundance,1.4000000000000001,2,COMPLETE
371,0.4992915675956918,2025-03-03 19:27:43.423853,2025-03-03 19:27:43.603184,0 days 00:00:00.179331,gaussian_mixture,abundance,2.25,2,COMPLETE
372,0.6527007770680043,2025-03-03 19:27:43.604179,2025-03-03 19:27:43.787751,0 days 00:00:00.183572,gaussian_mixture,abundance,2.5500000000000003,2,COMPLETE
373,0.3936670676615192,2025-03-03 19:27:43.789534,2025-03-03 19:27:43.967666,0 days 00:00:00.178132,gaussian_mixture,abundance,2.6500000000000004,2,COMPLETE
374,0.5132433319469495,2025-03-03 19:27:43.968665,2025-03-03 19:27:44.147450,0 days 00:00:00.178785,gaussian_mixture,abundance,2.45,2,COMPLETE
375,0.655603862812464,2025-03-03 19:27:44.148450,2025-03-03 19:27:44.328231,0 days 00:00:00.179781,gaussian_mixture,abundance,2.5500000000000003,2,COMPLETE
376,0.013388576833736154,2025-03-03 19:27:44.329029,2025-03-03 19:27:45.660012,0 days 00:00:01.330983,gaussian_mixture,presence,10.0,2,COMPLETE
377,0.6778632732321512,2025-03-03 19:27:45.661011,2025-03-03 19:27:45.839778,0 days 00:00:00.178767,gaussian_mixture,abundance,2.5500000000000003,2,COMPLETE
378,0.3108643192006203,2025-03-03 19:27:45.840773,2025-03-03 19:27:46.016386,0 days 00:00:00.175613,gaussian_mixture,abundance,2.5500000000000003,2,COMPLETE
379,0.4709831465618771,2025-03-03 19:27:46.017391,2025-03-03 19:27:46.193523,0 days 00:00:00.176132,gaussian_mixture,abundance,2.5500000000000003,2,COMPLETE
380,0.41375015470113646,2025-03-03 19:27:46.194523,2025-03-03 19:27:46.371723,0 days 00:00:00.177200,gaussian_mixture,abundance,2.6,2,COMPLETE
381,0.5605426825061668,2025-03-03 19:27:46.372720,2025-03-03 19:27:46.551159,0 days 00:00:00.178439,gaussian_mixture,abundance,2.45,2,COMPLETE
382,0.5965597807813311,2025-03-03 19:27:46.552159,2025-03-03 19:27:46.724470,0 days 00:00:00.172311,kmeans,abundance,2.5,2,COMPLETE
383,0.37608665671787617,2025-03-03 19:27:46.725475,2025-03-03 19:27:46.903504,0 days 00:00:00.178029,gaussian_mixture,abundance,2.0,2,COMPLETE
384,0.596035020166824,2025-03-03 19:27:46.904503,2025-03-03 19:27:47.113282,0 days 00:00:00.208779,gaussian_mixture,abundance,2.6500000000000004,2,COMPLETE
385,0.4023173998168306,2025-03-03 19:27:47.114282,2025-03-03 19:27:47.303634,0 days 00:00:00.189352,gaussian_mixture,abundance,2.5500000000000003,6,COMPLETE
386,0.6595723275190408,2025-03-03 19:27:47.304634,2025-03-03 19:27:47.511959,0 days 00:00:00.207325,gaussian_mixture,abundance,1.25,2,COMPLETE
387,0.40587041666712753,2025-03-03 19:27:47.512959,2025-03-03 19:27:47.690091,0 days 00:00:00.177132,gaussian_mixture,abundance,2.1,2,COMPLETE
388,0.44323525468534253,2025-03-03 19:27:47.692091,2025-03-03 19:27:47.872780,0 days 00:00:00.180689,gaussian_mixture,abundance,2.0500000000000003,2,COMPLETE
389,0.5284327688370024,2025-03-03 19:27:47.874772,2025-03-03 19:27:48.063600,0 days 00:00:00.188828,gaussian_mixture,abundance,1.35,2,COMPLETE
390,0.4409057219277309,2025-03-03 19:27:48.064600,2025-03-03 19:27:48.249345,0 days 00:00:00.184745,gaussian_mixture,abundance,1.9500000000000002,2,COMPLETE
391,0.36216899295910654,2025-03-03 19:27:48.251148,2025-03-03 19:27:48.442273,0 days 00:00:00.191125,gaussian_mixture,abundance,1.2000000000000002,2,COMPLETE
392,0.4189223988173382,2025-03-03 19:27:48.443278,2025-03-03 19:27:48.641491,0 days 00:00:00.198213,gaussian_mixture,abundance,1.2000000000000002,2,COMPLETE
393,0.2656952007516674,2025-03-03 19:27:48.643471,2025-03-03 19:27:48.844989,0 days 00:00:00.201518,gaussian_mixture,abundance,2.6,2,COMPLETE
394,0.3190873756334633,2025-03-03 19:27:48.845990,2025-03-03 19:27:49.045860,0 days 00:00:00.199870,gaussian_mixture,abundance,1.85,2,COMPLETE
395,0.36010257092685805,2025-03-03 19:27:49.047856,2025-03-03 19:27:49.252540,0 days 00:00:00.204684,gaussian_mixture,abundance,1.2000000000000002,2,COMPLETE
396,0.01744376884052499,2025-03-03 19:27:49.253546,2025-03-03 19:27:50.590710,0 days 00:00:01.337164,gaussian_mixture,presence,10.0,2,COMPLETE
397,0.4667911887686661,2025-03-03 19:27:50.592709,2025-03-03 19:27:50.770188,0 days 00:00:00.177479,gaussian_mixture,abundance,2.6500000000000004,2,COMPLETE
398,0.5935690871115125,2025-03-03 19:27:50.771212,2025-03-03 19:27:50.963155,0 days 00:00:00.191943,gaussian_mixture,abundance,2.15,4,COMPLETE
399,0.42720988780282826,2025-03-03 19:27:50.963946,2025-03-03 19:27:51.157050,0 days 00:00:00.193104,gaussian_mixture,abundance,1.25,2,COMPLETE
400,0.4571463469784627,2025-03-03 19:27:51.159050,2025-03-03 19:27:51.344652,0 days 00:00:00.185602,gaussian_mixture,abundance,1.9500000000000002,2,COMPLETE
401,0.4492433065585262,2025-03-03 19:27:51.345652,2025-03-03 19:27:51.528775,0 days 00:00:00.183123,gaussian_mixture,abundance,2.2,2,COMPLETE
402,0.5354691262622073,2025-03-03 19:27:51.529775,2025-03-03 19:27:51.719067,0 days 00:00:00.189292,kmeans,abundance,2.6,2,COMPLETE
403,0.5260667778354622,2025-03-03 19:27:51.720714,2025-03-03 19:27:51.917374,0 days 00:00:00.196660,gaussian_mixture,abundance,1.9000000000000001,2,COMPLETE
404,0.5401377013316608,2025-03-03 19:27:51.918975,2025-03-03 19:27:52.125884,0 days 00:00:00.206909,gaussian_mixture,abundance,1.1,2,COMPLETE
405,0.43464568047313523,2025-03-03 19:27:52.127881,2025-03-03 19:27:52.334674,0 days 00:00:00.206793,gaussian_mixture,abundance,1.3,2,COMPLETE
406,0.3076655869559596,2025-03-03 19:27:52.335474,2025-03-03 19:27:52.545544,0 days 00:00:00.210070,gaussian_mixture,abundance,1.35,2,COMPLETE
407,0.3077897427343112,2025-03-03 19:27:52.547544,2025-03-03 19:27:52.757875,0 days 00:00:00.210331,gaussian_mixture,abundance,2.5500000000000003,2,COMPLETE
408,0.5328869054116229,2025-03-03 19:27:52.759878,2025-03-03 19:27:52.946957,0 days 00:00:00.187079,gaussian_mixture,abundance,1.5,2,COMPLETE
409,0.5982518079453213,2025-03-03 19:27:52.947952,2025-03-03 19:27:53.138170,0 days 00:00:00.190218,gaussian_mixture,abundance,2.0500000000000003,2,COMPLETE
410,0.4353799023277257,2025-03-03 19:27:53.140172,2025-03-03 19:27:53.338791,0 days 00:00:00.198619,gaussian_mixture,abundance,1.25,2,COMPLETE
411,0.27229446760738324,2025-03-03 19:27:53.340786,2025-03-03 19:27:53.525997,0 days 00:00:00.185211,gaussian_mixture,abundance,2.5,2,COMPLETE
412,0.42952298876810946,2025-03-03 19:27:53.527001,2025-03-03 19:27:53.711748,0 days 00:00:00.184747,gaussian_mixture,abundance,1.9500000000000002,2,COMPLETE
413,0.556368524026001,2025-03-03 19:27:53.713744,2025-03-03 19:27:53.909258,0 days 00:00:00.195514,gaussian_mixture,abundance,2.0,2,COMPLETE
414,0.3294995316700355,2025-03-03 19:27:53.910253,2025-03-03 19:27:54.089450,0 days 00:00:00.179197,gaussian_mixture,abundance,2.5500000000000003,2,COMPLETE
415,0.03784185709611574,2025-03-03 19:27:54.091229,2025-03-03 19:27:55.259732,0 days 00:00:01.168503,gaussian_mixture,presence,80.0,2,COMPLETE
416,0.5438403084569524,2025-03-03 19:27:55.260750,2025-03-03 19:27:55.447406,0 days 00:00:00.186656,gaussian_mixture,abundance,1.85,2,COMPLETE
417,0.5576892947115988,2025-03-03 19:27:55.448405,2025-03-03 19:27:55.629745,0 days 00:00:00.181340,gaussian_mixture,abundance,2.45,2,COMPLETE
418,0.4466483498415351,2025-03-03 19:27:55.630745,2025-03-03 19:27:55.811246,0 days 00:00:00.180501,gaussian_mixture,abundance,2.1,2,COMPLETE
419,0.2859377135455279,2025-03-03 19:27:55.812246,2025-03-03 19:27:56.014696,0 days 00:00:00.202450,gaussian_mixture,abundance,1.1,2,COMPLETE
420,0.2605424672356007,2025-03-03 19:27:56.015772,2025-03-03 19:27:56.206796,0 days 00:00:00.191024,gaussian_mixture,abundance,1.3,2,COMPLETE
421,0.5782480874150814,2025-03-03 19:27:56.207791,2025-03-03 19:27:56.395571,0 days 00:00:00.187780,gaussian_mixture,abundance,1.8,2,COMPLETE
422,0.456951417191935,2025-03-03 19:27:56.396575,2025-03-03 19:27:56.575535,0 days 00:00:00.178960,gaussian_mixture,abundance,2.6500000000000004,2,COMPLETE
423,0.12231434648979722,2025-03-03 19:27:56.575535,2025-03-03 19:27:56.763071,0 days 00:00:00.187536,gaussian_mixture,abundance,2.0,2,COMPLETE
424,0.24395008755818925,2025-03-03 19:27:56.764066,2025-03-03 19:27:56.935171,0 days 00:00:00.171105,kmeans,abundance,2.5,2,COMPLETE
425,0.39108717533104376,2025-03-03 19:27:56.937175,2025-03-03 19:27:57.132301,0 days 00:00:00.195126,gaussian_mixture,abundance,1.4000000000000001,2,COMPLETE
426,0.4395348970201221,2025-03-03 19:27:57.133301,2025-03-03 19:27:57.334432,0 days 00:00:00.201131,gaussian_mixture,abundance,0.7000000000000001,2,COMPLETE
427,0.5008573203596798,2025-03-03 19:27:57.335433,2025-03-03 19:27:57.517092,0 days 00:00:00.181659,gaussian_mixture,abundance,2.2,2,COMPLETE
428,0.5010816212222433,2025-03-03 19:27:57.518092,2025-03-03 19:27:57.713697,0 days 00:00:00.195605,gaussian_mixture,abundance,1.4500000000000002,5,COMPLETE
429,0.22950459918795776,2025-03-03 19:27:57.715504,2025-03-03 19:27:57.894608,0 days 00:00:00.179104,gaussian_mixture,abundance,2.25,2,COMPLETE
430,0.3315810576746544,2025-03-03 19:27:57.895608,2025-03-03 19:27:58.080218,0 days 00:00:00.184610,gaussian_mixture,abundance,2.5500000000000003,2,COMPLETE
431,0.31808549600156694,2025-03-03 19:27:58.082220,2025-03-03 19:27:58.271946,0 days 00:00:00.189726,gaussian_mixture,abundance,1.9000000000000001,2,COMPLETE
432,0.4831078733446309,2025-03-03 19:27:58.273944,2025-03-03 19:27:58.453244,0 days 00:00:00.179300,gaussian_mixture,abundance,2.45,2,COMPLETE
433,0.39759382603706783,2025-03-03 19:27:58.454239,2025-03-03 19:27:58.637507,0 days 00:00:00.183268,gaussian_mixture,abundance,1.9500000000000002,2,COMPLETE
434,0.09763190628491328,2025-03-03 19:27:58.638507,2025-03-03 19:27:58.963085,0 days 00:00:00.324578,gaussian_mixture,abundance,0.1,2,COMPLETE
435,0.06678715992427947,2025-03-03 19:27:58.964085,2025-03-03 19:28:00.049232,0 days 00:00:01.085147,gaussian_mixture,presence,115.0,2,COMPLETE
436,0.4239582000793728,2025-03-03 19:28:00.051232,2025-03-03 19:28:00.238983,0 days 00:00:00.187751,gaussian_mixture,abundance,2.1,2,COMPLETE
437,0.4893133005213281,2025-03-03 19:28:00.240778,2025-03-03 19:28:00.426721,0 days 00:00:00.185943,gaussian_mixture,abundance,2.6,2,COMPLETE
438,0.38305913212632614,2025-03-03 19:28:00.427721,2025-03-03 19:28:00.618047,0 days 00:00:00.190326,gaussian_mixture,abundance,1.8,2,COMPLETE
439,0.24680418245251473,2025-03-03 19:28:00.619047,2025-03-03 19:28:00.798375,0 days 00:00:00.179328,gaussian_mixture,abundance,2.0500000000000003,2,COMPLETE
440,0.4606831471563706,2025-03-03 19:28:00.799375,2025-03-03 19:28:00.973035,0 days 00:00:00.173660,kmeans,abundance,2.5500000000000003,2,COMPLETE
441,0.5479088613331629,2025-03-03 19:28:00.975029,2025-03-03 19:28:01.183261,0 days 00:00:00.208232,gaussian_mixture,abundance,1.85,2,COMPLETE
