number,value,datetime_start,datetime_complete,duration,params_algorithm,params_filter_criteria,params_filter_threshold,params_k,state
4431,0.31124491457417636,2025-03-03 19:48:59.956977,2025-03-03 19:49:00.275618,0 days 00:00:00.318641,gaussian_mixture,abundance,2.3000000000000003,2,COMPLETE
4432,0.4243408659159017,2025-03-03 19:49:00.278617,2025-03-03 19:49:00.607279,0 days 00:00:00.328662,gaussian_mixture,abundance,2.15,6,COMPLETE
4433,0.3944400717579676,2025-03-03 19:49:00.609277,2025-03-03 19:49:00.920084,0 days 00:00:00.310807,gaussian_mixture,abundance,2.25,2,COMPLETE
4434,0.5135551609575886,2025-03-03 19:49:00.921582,2025-03-03 19:49:01.274609,0 days 00:00:00.353027,gaussian_mixture,abundance,2.1,3,COMPLETE
4435,0.43537494822180156,2025-03-03 19:49:01.279150,2025-03-03 19:49:01.639082,0 days 00:00:00.359932,gaussian_mixture,abundance,2.35,2,COMPLETE
4436,0.2062313885251028,2025-03-03 19:49:01.641088,2025-03-03 19:49:01.970994,0 days 00:00:00.329906,gaussian_mixture,abundance,2.2,2,COMPLETE
4437,0.6620612526264399,2025-03-03 19:49:01.972505,2025-03-03 19:49:02.346727,0 days 00:00:00.374222,gaussian_mixture,abundance,2.0500000000000003,2,COMPLETE
4438,0.2964732989374214,2025-03-03 19:49:02.348725,2025-03-03 19:49:02.664247,0 days 00:00:00.315522,gaussian_mixture,abundance,2.25,2,COMPLETE
4439,0.4160770864782838,2025-03-03 19:49:02.666751,2025-03-03 19:49:02.988581,0 days 00:00:00.321830,gaussian_mixture,abundance,2.3000000000000003,2,COMPLETE
4440,0.4988301603884532,2025-03-03 19:49:02.990585,2025-03-03 19:49:03.319547,0 days 00:00:00.328962,gaussian_mixture,abundance,0.9500000000000001,2,COMPLETE
4441,0.4421501713119923,2025-03-03 19:49:03.321856,2025-03-03 19:49:03.659439,0 days 00:00:00.337583,gaussian_mixture,abundance,1.8,2,COMPLETE
4442,0.47431412446932386,2025-03-03 19:49:03.663028,2025-03-03 19:49:03.982798,0 days 00:00:00.319770,gaussian_mixture,abundance,2.15,2,COMPLETE
4443,0.022289112275517477,2025-03-03 19:49:03.984800,2025-03-03 19:49:05.525694,0 days 00:00:01.540894,gaussian_mixture,presence,10.0,2,COMPLETE
4444,0.6204505096715158,2025-03-03 19:49:05.528896,2025-03-03 19:49:05.853932,0 days 00:00:00.325036,gaussian_mixture,abundance,2.35,2,COMPLETE
4445,0.3779750948953693,2025-03-03 19:49:05.855925,2025-03-03 19:49:06.175342,0 days 00:00:00.319417,gaussian_mixture,abundance,2.0,2,COMPLETE
4446,0.48637649780889297,2025-03-03 19:49:06.177345,2025-03-03 19:49:06.488192,0 days 00:00:00.310847,kmeans,abundance,2.25,2,COMPLETE
4447,0.5598562382421484,2025-03-03 19:49:06.491726,2025-03-03 19:49:06.813516,0 days 00:00:00.321790,gaussian_mixture,abundance,2.1,2,COMPLETE
4448,0.4405991962412722,2025-03-03 19:49:06.815518,2025-03-03 19:49:07.149425,0 days 00:00:00.333907,gaussian_mixture,abundance,2.3000000000000003,2,COMPLETE
4449,0.5861983103302792,2025-03-03 19:49:07.151940,2025-03-03 19:49:07.477625,0 days 00:00:00.325685,gaussian_mixture,abundance,2.15,2,COMPLETE
4450,0.25015180424359457,2025-03-03 19:49:07.479626,2025-03-03 19:49:07.843661,0 days 00:00:00.364035,gaussian_mixture,abundance,2.2,2,COMPLETE
4451,0.42125131851206293,2025-03-03 19:49:07.847665,2025-03-03 19:49:08.223784,0 days 00:00:00.376119,gaussian_mixture,abundance,2.35,2,COMPLETE
4452,0.2670283901052878,2025-03-03 19:49:08.226785,2025-03-03 19:49:08.566176,0 days 00:00:00.339391,gaussian_mixture,abundance,2.2,2,COMPLETE
4453,0.5925167901241235,2025-03-03 19:49:08.568691,2025-03-03 19:49:08.961727,0 days 00:00:00.393036,gaussian_mixture,abundance,2.25,2,COMPLETE
4454,0.4043150183626366,2025-03-03 19:49:08.965987,2025-03-03 19:49:09.336344,0 days 00:00:00.370357,gaussian_mixture,abundance,1.9000000000000001,2,COMPLETE
4455,0.6093331722909419,2025-03-03 19:49:09.338372,2025-03-03 19:49:09.655658,0 days 00:00:00.317286,gaussian_mixture,abundance,2.0500000000000003,2,COMPLETE
4456,0.7171740049356445,2025-03-03 19:49:09.657667,2025-03-03 19:49:09.979795,0 days 00:00:00.322128,gaussian_mixture,abundance,2.3000000000000003,2,COMPLETE
4457,0.43655272786772426,2025-03-03 19:49:09.982696,2025-03-03 19:49:10.315592,0 days 00:00:00.332896,gaussian_mixture,abundance,2.35,5,COMPLETE
4458,0.2976856635917007,2025-03-03 19:49:10.317581,2025-03-03 19:49:10.628040,0 days 00:00:00.310459,gaussian_mixture,abundance,2.5500000000000003,2,COMPLETE
4459,0.5673758818534257,2025-03-03 19:49:10.631043,2025-03-03 19:49:10.953845,0 days 00:00:00.322802,gaussian_mixture,abundance,2.15,2,COMPLETE
4460,0.011662906108576685,2025-03-03 19:49:10.956969,2025-03-03 19:49:12.423556,0 days 00:00:01.466587,gaussian_mixture,presence,10.0,2,COMPLETE
4461,0.6123890108326364,2025-03-03 19:49:12.426562,2025-03-03 19:49:12.743589,0 days 00:00:00.317027,gaussian_mixture,abundance,2.25,2,COMPLETE
4462,0.2704666590121271,2025-03-03 19:49:12.746596,2025-03-03 19:49:13.071749,0 days 00:00:00.325153,gaussian_mixture,abundance,2.5,2,COMPLETE
4463,0.3870661045265716,2025-03-03 19:49:13.073714,2025-03-03 19:49:13.386599,0 days 00:00:00.312885,gaussian_mixture,abundance,2.1,2,COMPLETE
4464,0.4600973349745888,2025-03-03 19:49:13.388607,2025-03-03 19:49:13.706930,0 days 00:00:00.318323,gaussian_mixture,abundance,2.4000000000000004,2,COMPLETE
4465,0.5523509813424887,2025-03-03 19:49:13.709931,2025-03-03 19:49:14.071694,0 days 00:00:00.361763,gaussian_mixture,abundance,2.3000000000000003,2,COMPLETE
4466,0.26524688991021667,2025-03-03 19:49:14.074712,2025-03-03 19:49:14.424902,0 days 00:00:00.350190,gaussian_mixture,abundance,2.2,2,COMPLETE
4467,0.5370462256441575,2025-03-03 19:49:14.426913,2025-03-03 19:49:14.764961,0 days 00:00:00.338048,gaussian_mixture,abundance,2.45,2,COMPLETE
4468,0.46682993125396316,2025-03-03 19:49:14.766949,2025-03-03 19:49:15.095641,0 days 00:00:00.328692,kmeans,abundance,2.35,2,COMPLETE
4469,0.467542216662825,2025-03-03 19:49:15.099640,2025-03-03 19:49:15.425403,0 days 00:00:00.325763,gaussian_mixture,abundance,2.0,2,COMPLETE
4470,0.6430983158829674,2025-03-03 19:49:15.427397,2025-03-03 19:49:15.787567,0 days 00:00:00.360170,gaussian_mixture,abundance,2.25,2,COMPLETE
4471,0.46738954134950295,2025-03-03 19:49:15.789566,2025-03-03 19:49:16.121803,0 days 00:00:00.332237,gaussian_mixture,abundance,2.1,4,COMPLETE
4472,0.6855404779833385,2025-03-03 19:49:16.123237,2025-03-03 19:49:16.458516,0 days 00:00:00.335279,gaussian_mixture,abundance,2.4000000000000004,2,COMPLETE
4473,0.38900769899215537,2025-03-03 19:49:16.461048,2025-03-03 19:49:16.786655,0 days 00:00:00.325607,gaussian_mixture,abundance,1.9000000000000001,2,COMPLETE
4474,0.46070577945787816,2025-03-03 19:49:16.789656,2025-03-03 19:49:17.104713,0 days 00:00:00.315057,gaussian_mixture,abundance,2.3000000000000003,2,COMPLETE
4475,0.488371554085667,2025-03-03 19:49:17.107710,2025-03-03 19:49:17.431811,0 days 00:00:00.324101,gaussian_mixture,abundance,2.2,2,COMPLETE
4476,0.44939520947662254,2025-03-03 19:49:17.434335,2025-03-03 19:49:17.756605,0 days 00:00:00.322270,gaussian_mixture,abundance,2.0500000000000003,2,COMPLETE
4477,0.5303704620903129,2025-03-03 19:49:17.758605,2025-03-03 19:49:18.077315,0 days 00:00:00.318710,gaussian_mixture,abundance,2.15,2,COMPLETE
4478,0.42529073490455704,2025-03-03 19:49:18.080317,2025-03-03 19:49:18.401069,0 days 00:00:00.320752,gaussian_mixture,abundance,2.5500000000000003,2,COMPLETE
4479,0.05390378839615062,2025-03-03 19:49:18.403771,2025-03-03 19:49:19.978255,0 days 00:00:01.574484,gaussian_mixture,presence,15.0,2,COMPLETE
4480,0.41083650855994047,2025-03-03 19:49:19.980765,2025-03-03 19:49:20.409604,0 days 00:00:00.428839,gaussian_mixture,abundance,0.4,2,COMPLETE
4481,0.33536542707922495,2025-03-03 19:49:20.413073,2025-03-03 19:49:20.776051,0 days 00:00:00.362978,gaussian_mixture,abundance,2.3000000000000003,2,COMPLETE
4482,0.5890076989921553,2025-03-03 19:49:20.777563,2025-03-03 19:49:21.107827,0 days 00:00:00.330264,gaussian_mixture,abundance,2.35,2,COMPLETE
4483,0.5022378685900106,2025-03-03 19:49:21.109833,2025-03-03 19:49:21.434746,0 days 00:00:00.324913,gaussian_mixture,abundance,1.4000000000000001,2,COMPLETE
4484,0.41293294787169776,2025-03-03 19:49:21.436743,2025-03-03 19:49:21.751005,0 days 00:00:00.314262,kmeans,abundance,1.9500000000000002,2,COMPLETE
4485,0.2919835981134461,2025-03-03 19:49:21.752971,2025-03-03 19:49:22.089962,0 days 00:00:00.336991,gaussian_mixture,abundance,1.85,2,COMPLETE
4486,0.18880197678538577,2025-03-03 19:49:22.092481,2025-03-03 19:49:22.473800,0 days 00:00:00.381319,gaussian_mixture,abundance,0.25,2,COMPLETE
4487,0.5305138739601061,2025-03-03 19:49:22.475803,2025-03-03 19:49:22.838550,0 days 00:00:00.362747,gaussian_mixture,abundance,2.25,2,COMPLETE
4488,0.4593500582962978,2025-03-03 19:49:22.841639,2025-03-03 19:49:23.161692,0 days 00:00:00.320053,gaussian_mixture,abundance,2.45,2,COMPLETE
4489,0.5830983522020544,2025-03-03 19:49:23.163528,2025-03-03 19:49:23.490994,0 days 00:00:00.327466,gaussian_mixture,abundance,2.2,2,COMPLETE
4490,0.0007523537315790244,2025-03-03 19:49:23.493555,2025-03-03 19:49:25.334531,0 days 00:00:01.840976,gaussian_mixture,abundance,0.0,2,COMPLETE
4491,0.44021269854672695,2025-03-03 19:49:25.337528,2025-03-03 19:49:25.654562,0 days 00:00:00.317034,gaussian_mixture,abundance,2.1,2,COMPLETE
4492,0.546462941197584,2025-03-03 19:49:25.656554,2025-03-03 19:49:25.973618,0 days 00:00:00.317064,gaussian_mixture,abundance,2.35,2,COMPLETE
4493,0.6586296920293979,2025-03-03 19:49:25.975623,2025-03-03 19:49:26.306312,0 days 00:00:00.330689,gaussian_mixture,abundance,2.15,2,COMPLETE
4494,0.5794847203055438,2025-03-03 19:49:26.307309,2025-03-03 19:49:26.633867,0 days 00:00:00.326558,gaussian_mixture,abundance,2.4000000000000004,2,COMPLETE
4495,0.43750398184563866,2025-03-03 19:49:26.635869,2025-03-03 19:49:26.971061,0 days 00:00:00.335192,gaussian_mixture,abundance,2.3000000000000003,2,COMPLETE
4496,0.017570714168526003,2025-03-03 19:49:26.973575,2025-03-03 19:49:28.501440,0 days 00:00:01.527865,gaussian_mixture,presence,10.0,2,COMPLETE
4497,0.4955936396186438,2025-03-03 19:49:28.503954,2025-03-03 19:49:28.820922,0 days 00:00:00.316968,gaussian_mixture,abundance,2.25,2,COMPLETE
4498,0.5059476514216298,2025-03-03 19:49:28.825312,2025-03-03 19:49:29.144067,0 days 00:00:00.318755,gaussian_mixture,abundance,2.45,2,COMPLETE
4499,0.5495217326698658,2025-03-03 19:49:29.146064,2025-03-03 19:49:29.477217,0 days 00:00:00.331153,gaussian_mixture,abundance,2.0500000000000003,2,COMPLETE
4500,0.5720963474506086,2025-03-03 19:49:29.479216,2025-03-03 19:49:29.798180,0 days 00:00:00.318964,gaussian_mixture,abundance,2.5,2,COMPLETE
4501,0.40836782941259964,2025-03-03 19:49:29.800703,2025-03-03 19:49:30.125462,0 days 00:00:00.324759,gaussian_mixture,abundance,2.2,2,COMPLETE
4502,0.5747091192328991,2025-03-03 19:49:30.127456,2025-03-03 19:49:30.460778,0 days 00:00:00.333322,kmeans,abundance,2.0,2,COMPLETE
4503,0.6567380271333609,2025-03-03 19:49:30.462798,2025-03-03 19:49:30.797672,0 days 00:00:00.334874,gaussian_mixture,abundance,2.25,2,COMPLETE
4504,0.5074616947604278,2025-03-03 19:49:30.799659,2025-03-03 19:49:31.125757,0 days 00:00:00.326098,gaussian_mixture,abundance,2.35,2,COMPLETE
4505,0.5171740049356446,2025-03-03 19:49:31.127754,2025-03-03 19:49:31.543854,0 days 00:00:00.416100,gaussian_mixture,abundance,2.4000000000000004,2,COMPLETE
4506,0.43235766091249317,2025-03-03 19:49:31.546855,2025-03-03 19:49:31.891094,0 days 00:00:00.344239,gaussian_mixture,abundance,2.1,2,COMPLETE
4507,0.29470448642414776,2025-03-03 19:49:31.893058,2025-03-03 19:49:32.239132,0 days 00:00:00.346074,gaussian_mixture,abundance,2.15,2,COMPLETE
4508,0.4133556894235202,2025-03-03 19:49:32.242155,2025-03-03 19:49:32.616488,0 days 00:00:00.374333,gaussian_mixture,abundance,2.2,2,COMPLETE
4509,0.48364008455389546,2025-03-03 19:49:32.618491,2025-03-03 19:49:32.956166,0 days 00:00:00.337675,gaussian_mixture,abundance,2.4000000000000004,2,COMPLETE
4510,0.30181716393867325,2025-03-03 19:49:32.958160,2025-03-03 19:49:33.276918,0 days 00:00:00.318758,gaussian_mixture,abundance,2.3000000000000003,2,COMPLETE
4511,0.4893133005213281,2025-03-03 19:49:33.277921,2025-03-03 19:49:33.609947,0 days 00:00:00.332026,gaussian_mixture,abundance,2.35,2,COMPLETE
4512,0.39537202227188856,2025-03-03 19:49:33.612601,2025-03-03 19:49:33.983895,0 days 00:00:00.371294,gaussian_mixture,abundance,2.2,5,COMPLETE
4513,0.5842667083316971,2025-03-03 19:49:33.985903,2025-03-03 19:49:34.348089,0 days 00:00:00.362186,gaussian_mixture,abundance,2.3000000000000003,2,COMPLETE
4514,0.5884368964667802,2025-03-03 19:49:34.350088,2025-03-03 19:49:34.766585,0 days 00:00:00.416497,gaussian_mixture,abundance,2.15,2,COMPLETE
4515,0.05170859876440266,2025-03-03 19:49:34.769582,2025-03-03 19:49:36.197774,0 days 00:00:01.428192,gaussian_mixture,presence,30.0,2,COMPLETE
4516,0.617102739379263,2025-03-03 19:49:36.200778,2025-03-03 19:49:36.518884,0 days 00:00:00.318106,gaussian_mixture,abundance,2.5,2,COMPLETE
4517,0.557383204519297,2025-03-03 19:49:36.521386,2025-03-03 19:49:36.846092,0 days 00:00:00.324706,gaussian_mixture,abundance,1.9500000000000002,2,COMPLETE
4518,0.16999822834241618,2025-03-03 19:49:36.849101,2025-03-03 19:49:37.167176,0 days 00:00:00.318075,gaussian_mixture,abundance,2.25,2,COMPLETE
4519,0.620576769984918,2025-03-03 19:49:37.169181,2025-03-03 19:49:37.489486,0 days 00:00:00.320305,gaussian_mixture,abundance,2.1,2,COMPLETE
4520,0.4004263816062143,2025-03-03 19:49:37.492554,2025-03-03 19:49:37.809946,0 days 00:00:00.317392,gaussian_mixture,abundance,2.4000000000000004,2,COMPLETE
4521,0.3945664309901584,2025-03-03 19:49:37.812972,2025-03-03 19:49:38.140643,0 days 00:00:00.327671,kmeans,abundance,1.8,2,COMPLETE
4522,0.4345727275815946,2025-03-03 19:49:38.142670,2025-03-03 19:49:38.461804,0 days 00:00:00.319134,gaussian_mixture,abundance,2.25,2,COMPLETE
4523,0.2981678650913334,2025-03-03 19:49:38.464325,2025-03-03 19:49:38.783510,0 days 00:00:00.319185,gaussian_mixture,abundance,2.35,2,COMPLETE
4524,0.45242549239936186,2025-03-03 19:49:38.785513,2025-03-03 19:49:39.116493,0 days 00:00:00.330980,gaussian_mixture,abundance,1.5,2,COMPLETE
4525,0.43636730562344983,2025-03-03 19:49:39.119501,2025-03-03 19:49:39.433259,0 days 00:00:00.313758,gaussian_mixture,abundance,2.6,2,COMPLETE
4526,0.36114699457783894,2025-03-03 19:49:39.435263,2025-03-03 19:49:39.758628,0 days 00:00:00.323365,gaussian_mixture,abundance,2.0500000000000003,2,COMPLETE
4527,0.4622923580963917,2025-03-03 19:49:39.760626,2025-03-03 19:49:40.099352,0 days 00:00:00.338726,gaussian_mixture,abundance,2.45,3,COMPLETE
4528,0.6855404779833385,2025-03-03 19:49:40.102988,2025-03-03 19:49:40.425972,0 days 00:00:00.322984,gaussian_mixture,abundance,2.15,2,COMPLETE
4529,0.4696321132524755,2025-03-03 19:49:40.427974,2025-03-03 19:49:40.748707,0 days 00:00:00.320733,gaussian_mixture,abundance,2.3000000000000003,2,COMPLETE
4530,0.6550892487945671,2025-03-03 19:49:40.751706,2025-03-03 19:49:41.079546,0 days 00:00:00.327840,gaussian_mixture,abundance,2.2,2,COMPLETE
4531,0.42656351598625564,2025-03-03 19:49:41.083074,2025-03-03 19:49:41.406986,0 days 00:00:00.323912,gaussian_mixture,abundance,2.35,2,COMPLETE
4532,0.5366597279496125,2025-03-03 19:49:41.408986,2025-03-03 19:49:41.728063,0 days 00:00:00.319077,gaussian_mixture,abundance,2.1,2,COMPLETE
4533,0.4075012738269077,2025-03-03 19:49:41.730068,2025-03-03 19:49:42.073569,0 days 00:00:00.343501,gaussian_mixture,abundance,2.25,2,COMPLETE
4534,0.4968519096281366,2025-03-03 19:49:42.076569,2025-03-03 19:49:42.446220,0 days 00:00:00.369651,gaussian_mixture,abundance,2.0,2,COMPLETE
4535,0.04945119862615527,2025-03-03 19:49:42.449223,2025-03-03 19:49:43.895211,0 days 00:00:01.445988,gaussian_mixture,presence,80.0,2,COMPLETE
4536,0.4876332956059314,2025-03-03 19:49:43.897217,2025-03-03 19:49:44.218582,0 days 00:00:00.321365,gaussian_mixture,abundance,2.45,2,COMPLETE
4537,0.3813634517431847,2025-03-03 19:49:44.219574,2025-03-03 19:49:44.554622,0 days 00:00:00.335048,gaussian_mixture,abundance,2.3000000000000003,2,COMPLETE
4538,0.4376974644505164,2025-03-03 19:49:44.556624,2025-03-03 19:49:44.901701,0 days 00:00:00.345077,gaussian_mixture,abundance,2.2,2,COMPLETE
4539,0.49207144259254554,2025-03-03 19:49:44.904618,2025-03-03 19:49:45.261453,0 days 00:00:00.356835,gaussian_mixture,abundance,2.4000000000000004,2,COMPLETE
4540,0.29098936865288844,2025-03-03 19:49:45.264050,2025-03-03 19:49:45.609892,0 days 00:00:00.345842,gaussian_mixture,abundance,2.2,2,COMPLETE
4541,0.43656033123557814,2025-03-03 19:49:45.611911,2025-03-03 19:49:45.942621,0 days 00:00:00.330710,kmeans,abundance,2.15,2,COMPLETE
4542,0.4761618751482559,2025-03-03 19:49:45.944790,2025-03-03 19:49:46.287513,0 days 00:00:00.342723,gaussian_mixture,abundance,1.9500000000000002,2,COMPLETE
4543,0.4494723905751054,2025-03-03 19:49:46.291045,2025-03-03 19:49:46.729581,0 days 00:00:00.438536,gaussian_mixture,abundance,2.3000000000000003,2,COMPLETE
4544,0.5594369497124074,2025-03-03 19:49:46.732640,2025-03-03 19:49:47.091645,0 days 00:00:00.359005,gaussian_mixture,abundance,2.5,3,COMPLETE
4545,0.6353749482218015,2025-03-03 19:49:47.094656,2025-03-03 19:49:47.447678,0 days 00:00:00.353022,gaussian_mixture,abundance,2.4000000000000004,2,COMPLETE
4546,0.4009279716214406,2025-03-03 19:49:47.450678,2025-03-03 19:49:47.797271,0 days 00:00:00.346593,gaussian_mixture,abundance,2.0500000000000003,4,COMPLETE
4547,0.5113513978597166,2025-03-03 19:49:47.799286,2025-03-03 19:49:48.145053,0 days 00:00:00.345767,gaussian_mixture,abundance,2.25,2,COMPLETE
4548,0.5286016495770394,2025-03-03 19:49:48.148053,2025-03-03 19:49:48.478484,0 days 00:00:00.330431,gaussian_mixture,abundance,2.35,2,COMPLETE
4549,0.5948596584458474,2025-03-03 19:49:48.481516,2025-03-03 19:49:48.813707,0 days 00:00:00.332191,gaussian_mixture,abundance,2.25,2,COMPLETE
4550,0.12110620409003159,2025-03-03 19:49:48.817704,2025-03-03 19:49:49.294608,0 days 00:00:00.476904,gaussian_mixture,abundance,0.1,2,COMPLETE
4551,0.5652564110527933,2025-03-03 19:49:49.296616,2025-03-03 19:49:49.618941,0 days 00:00:00.322325,gaussian_mixture,abundance,2.15,2,COMPLETE
4552,0.38130323788871584,2025-03-03 19:49:49.621441,2025-03-03 19:49:49.942489,0 days 00:00:00.321048,gaussian_mixture,abundance,1.6500000000000001,2,COMPLETE
4553,0.062274569577326654,2025-03-03 19:49:49.945045,2025-03-03 19:49:51.489736,0 days 00:00:01.544691,gaussian_mixture,presence,20.0,2,COMPLETE
4554,0.4168719423658316,2025-03-03 19:49:51.492534,2025-03-03 19:49:51.832894,0 days 00:00:00.340360,gaussian_mixture,abundance,1.0,2,COMPLETE
4555,0.6078548244731359,2025-03-03 19:49:51.834727,2025-03-03 19:49:52.160650,0 days 00:00:00.325923,gaussian_mixture,abundance,2.45,2,COMPLETE
4556,0.688371554085667,2025-03-03 19:49:52.163046,2025-03-03 19:49:52.548087,0 days 00:00:00.385041,gaussian_mixture,abundance,2.3000000000000003,2,COMPLETE
4557,0.24483867814699484,2025-03-03 19:49:52.550614,2025-03-03 19:49:52.897540,0 days 00:00:00.346926,gaussian_mixture,abundance,2.1,2,COMPLETE
4558,0.4309067908746587,2025-03-03 19:49:52.900072,2025-03-03 19:49:53.266555,0 days 00:00:00.366483,gaussian_mixture,abundance,1.9000000000000001,2,COMPLETE
4559,0.19016884237786527,2025-03-03 19:49:53.269555,2025-03-03 19:49:53.628459,0 days 00:00:00.358904,kmeans,abundance,2.35,2,COMPLETE
4560,0.5948596584458474,2025-03-03 19:49:53.630974,2025-03-03 19:49:53.963234,0 days 00:00:00.332260,gaussian_mixture,abundance,2.2,2,COMPLETE
4561,0.5001551720216997,2025-03-03 19:49:53.966230,2025-03-03 19:49:54.301418,0 days 00:00:00.335188,gaussian_mixture,abundance,2.4000000000000004,2,COMPLETE
4562,0.728396462102792,2025-03-03 19:49:54.302937,2025-03-03 19:49:54.640750,0 days 00:00:00.337813,gaussian_mixture,abundance,2.3000000000000003,2,COMPLETE
4563,0.4821711345556022,2025-03-03 19:49:54.642775,2025-03-03 19:49:54.977542,0 days 00:00:00.334767,gaussian_mixture,abundance,2.35,2,COMPLETE
4564,0.535365427079225,2025-03-03 19:49:54.979545,2025-03-03 19:49:55.346219,0 days 00:00:00.366674,gaussian_mixture,abundance,2.35,2,COMPLETE
4565,0.47056879688222375,2025-03-03 19:49:55.348231,2025-03-03 19:49:55.664774,0 days 00:00:00.316543,gaussian_mixture,abundance,2.4000000000000004,2,COMPLETE
4566,0.5148294142452781,2025-03-03 19:49:55.666776,2025-03-03 19:49:55.987384,0 days 00:00:00.320608,gaussian_mixture,abundance,2.35,2,COMPLETE
4567,0.5171740049356446,2025-03-03 19:49:55.989387,2025-03-03 19:49:56.326727,0 days 00:00:00.337340,gaussian_mixture,abundance,2.4000000000000004,2,COMPLETE
4568,0.6166446770015755,2025-03-03 19:49:56.329723,2025-03-03 19:49:56.697562,0 days 00:00:00.367839,gaussian_mixture,abundance,2.45,2,COMPLETE
4569,0.43919647686969,2025-03-03 19:49:56.699559,2025-03-03 19:49:57.043738,0 days 00:00:00.344179,gaussian_mixture,abundance,2.35,2,COMPLETE
4570,0.6617355897934502,2025-03-03 19:49:57.046745,2025-03-03 19:49:57.474718,0 days 00:00:00.427973,gaussian_mixture,abundance,2.35,2,COMPLETE
4571,0.6097761109381328,2025-03-03 19:49:57.477719,2025-03-03 19:49:57.833584,0 days 00:00:00.355865,gaussian_mixture,abundance,2.4000000000000004,2,COMPLETE
4572,0.34970345306169526,2025-03-03 19:49:57.835584,2025-03-03 19:49:58.246495,0 days 00:00:00.410911,gaussian_mixture,abundance,2.45,2,COMPLETE
4573,0.5190952914006416,2025-03-03 19:49:58.249496,2025-03-03 19:49:58.674928,0 days 00:00:00.425432,gaussian_mixture,abundance,2.35,2,COMPLETE
4574,0.025999029541098544,2025-03-03 19:49:58.676930,2025-03-03 19:50:00.119243,0 days 00:00:01.442313,gaussian_mixture,presence,50.0,2,COMPLETE
4575,0.53108964768631,2025-03-03 19:50:00.121759,2025-03-03 19:50:00.462500,0 days 00:00:00.340741,gaussian_mixture,abundance,2.3000000000000003,6,COMPLETE
4576,0.4960384751202662,2025-03-03 19:50:00.464508,2025-03-03 19:50:00.791679,0 days 00:00:00.327171,gaussian_mixture,abundance,2.45,2,COMPLETE
4577,0.6073454247198603,2025-03-03 19:50:00.794190,2025-03-03 19:50:01.119495,0 days 00:00:00.325305,gaussian_mixture,abundance,2.3000000000000003,2,COMPLETE
