number,value,datetime_start,datetime_complete,duration,params_algorithm,params_filter_criteria,params_filter_threshold,params_k,state
2810,0.2597024168776959,2025-03-03 19:39:13.074555,2025-03-03 19:39:13.342587,0 days 00:00:00.268032,gaussian_mixture,abundance,0.9500000000000001,2,COMPLETE
2811,0.566998954031531,2025-03-03 19:39:13.344584,2025-03-03 19:39:13.612245,0 days 00:00:00.267661,gaussian_mixture,abundance,2.2,2,COMPLETE
2812,0.5039152830468656,2025-03-03 19:39:13.614242,2025-03-03 19:39:13.862444,0 days 00:00:00.248202,gaussian_mixture,abundance,2.4000000000000004,2,COMPLETE
2813,0.5272690481802945,2025-03-03 19:39:13.864431,2025-03-03 19:39:14.126022,0 days 00:00:00.261591,gaussian_mixture,abundance,1.9000000000000001,4,COMPLETE
2814,0.5102265272192292,2025-03-03 19:39:14.128021,2025-03-03 19:39:14.373492,0 days 00:00:00.245471,kmeans,abundance,2.0500000000000003,2,COMPLETE
2815,0.6407477641854399,2025-03-03 19:39:14.375255,2025-03-03 19:39:14.625933,0 days 00:00:00.250678,gaussian_mixture,abundance,2.5,2,COMPLETE
2816,0.4184654393048127,2025-03-03 19:39:14.627931,2025-03-03 19:39:14.879276,0 days 00:00:00.251345,gaussian_mixture,abundance,2.15,2,COMPLETE
2817,0.5013395218593125,2025-03-03 19:39:14.881287,2025-03-03 19:39:15.140886,0 days 00:00:00.259599,gaussian_mixture,abundance,2.2,2,COMPLETE
2818,0.3067579060157749,2025-03-03 19:39:15.142885,2025-03-03 19:39:15.392151,0 days 00:00:00.249266,gaussian_mixture,abundance,2.3000000000000003,2,COMPLETE
2819,0.45039690414334155,2025-03-03 19:39:15.394147,2025-03-03 19:39:15.663126,0 days 00:00:00.268979,gaussian_mixture,abundance,1.9500000000000002,2,COMPLETE
2820,0.5073786617140513,2025-03-03 19:39:15.664678,2025-03-03 19:39:15.920518,0 days 00:00:00.255840,gaussian_mixture,abundance,2.4000000000000004,2,COMPLETE
2821,0.3157030616637784,2025-03-03 19:39:15.922517,2025-03-03 19:39:16.175753,0 days 00:00:00.253236,gaussian_mixture,abundance,2.1,2,COMPLETE
2822,0.4446846075417337,2025-03-03 19:39:16.178753,2025-03-03 19:39:16.432365,0 days 00:00:00.253612,gaussian_mixture,abundance,2.15,2,COMPLETE
2823,0.35017505090411366,2025-03-03 19:39:16.434364,2025-03-03 19:39:16.683646,0 days 00:00:00.249282,gaussian_mixture,abundance,2.25,2,COMPLETE
2824,0.25292391238322587,2025-03-03 19:39:16.685643,2025-03-03 19:39:16.934370,0 days 00:00:00.248727,gaussian_mixture,abundance,2.0500000000000003,2,COMPLETE
2825,0.45933151218817125,2025-03-03 19:39:16.936356,2025-03-03 19:39:17.197599,0 days 00:00:00.261243,gaussian_mixture,abundance,1.4000000000000001,2,COMPLETE
2826,0.086763239373703,2025-03-03 19:39:17.199404,2025-03-03 19:39:17.500002,0 days 00:00:00.300598,gaussian_mixture,abundance,0.25,2,COMPLETE
2827,0.01356816642206583,2025-03-03 19:39:17.501000,2025-03-03 19:39:18.898818,0 days 00:00:01.397818,gaussian_mixture,presence,10.0,2,COMPLETE
2828,0.41214350987450227,2025-03-03 19:39:18.899820,2025-03-03 19:39:19.156159,0 days 00:00:00.256339,gaussian_mixture,abundance,2.25,2,COMPLETE
2829,0.22439080497649383,2025-03-03 19:39:19.157966,2025-03-03 19:39:19.420704,0 days 00:00:00.262738,gaussian_mixture,abundance,1.1,2,COMPLETE
2830,0.4793479378639959,2025-03-03 19:39:19.422715,2025-03-03 19:39:19.677803,0 days 00:00:00.255088,gaussian_mixture,abundance,2.35,2,COMPLETE
2831,0.5213603788544849,2025-03-03 19:39:19.679791,2025-03-03 19:39:19.937046,0 days 00:00:00.257255,gaussian_mixture,abundance,2.3000000000000003,2,COMPLETE
2832,0.329444108283639,2025-03-03 19:39:19.939095,2025-03-03 19:39:20.188603,0 days 00:00:00.249508,gaussian_mixture,abundance,2.45,2,COMPLETE
2833,0.3213550137612936,2025-03-03 19:39:20.189599,2025-03-03 19:39:20.436494,0 days 00:00:00.246895,kmeans,abundance,2.2,2,COMPLETE
2834,0.3401607418371219,2025-03-03 19:39:20.438492,2025-03-03 19:39:20.735149,0 days 00:00:00.296657,gaussian_mixture,abundance,0.8500000000000001,6,COMPLETE
2835,0.45175845477343624,2025-03-03 19:39:20.736152,2025-03-03 19:39:21.011467,0 days 00:00:00.275315,gaussian_mixture,abundance,2.1,2,COMPLETE
2836,0.5315385026472983,2025-03-03 19:39:21.013465,2025-03-03 19:39:21.271133,0 days 00:00:00.257668,gaussian_mixture,abundance,2.35,2,COMPLETE
2837,0.45356637036538183,2025-03-03 19:39:21.273111,2025-03-03 19:39:21.546721,0 days 00:00:00.273610,gaussian_mixture,abundance,2.2,2,COMPLETE
2838,0.585277199705474,2025-03-03 19:39:21.548719,2025-03-03 19:39:21.820870,0 days 00:00:00.272151,gaussian_mixture,abundance,2.0,2,COMPLETE
2839,0.6526839901994146,2025-03-03 19:39:21.823406,2025-03-03 19:39:22.106247,0 days 00:00:00.282841,gaussian_mixture,abundance,2.15,2,COMPLETE
2840,0.4902601514464971,2025-03-03 19:39:22.108256,2025-03-03 19:39:22.381831,0 days 00:00:00.273575,gaussian_mixture,abundance,2.35,2,COMPLETE
2841,0.6584188256982936,2025-03-03 19:39:22.383833,2025-03-03 19:39:22.662060,0 days 00:00:00.278227,gaussian_mixture,abundance,2.5500000000000003,2,COMPLETE
2842,0.28774713017409875,2025-03-03 19:39:22.664059,2025-03-03 19:39:23.026000,0 days 00:00:00.361941,gaussian_mixture,abundance,1.25,2,COMPLETE
2843,0.16808051936472346,2025-03-03 19:39:23.028003,2025-03-03 19:39:23.306176,0 days 00:00:00.278173,gaussian_mixture,abundance,2.1,2,COMPLETE
2844,0.5605139507395899,2025-03-03 19:39:23.308181,2025-03-03 19:39:23.591746,0 days 00:00:00.283565,gaussian_mixture,abundance,2.25,2,COMPLETE
2845,0.2579882887207191,2025-03-03 19:39:23.592730,2025-03-03 19:39:23.852216,0 days 00:00:00.259486,gaussian_mixture,abundance,2.4000000000000004,2,COMPLETE
2846,0.059009198413905097,2025-03-03 19:39:23.854211,2025-03-03 19:39:25.173085,0 days 00:00:01.318874,gaussian_mixture,presence,60.0,2,COMPLETE
2847,0.397180965449463,2025-03-03 19:39:25.175256,2025-03-03 19:39:25.427672,0 days 00:00:00.252416,gaussian_mixture,abundance,2.25,2,COMPLETE
2848,0.33839143296808094,2025-03-03 19:39:25.430679,2025-03-03 19:39:25.681272,0 days 00:00:00.250593,gaussian_mixture,abundance,2.3000000000000003,2,COMPLETE
2849,0.6132431228182821,2025-03-03 19:39:25.682277,2025-03-03 19:39:25.949789,0 days 00:00:00.267512,gaussian_mixture,abundance,2.0500000000000003,2,COMPLETE
2850,0.5223982529551152,2025-03-03 19:39:25.951789,2025-03-03 19:39:26.208626,0 days 00:00:00.256837,gaussian_mixture,abundance,2.15,2,COMPLETE
2851,0.3125042410224891,2025-03-03 19:39:26.210612,2025-03-03 19:39:26.487135,0 days 00:00:00.276523,kmeans,abundance,2.2,2,COMPLETE
2852,0.64813421861994,2025-03-03 19:39:26.489135,2025-03-03 19:39:26.746554,0 days 00:00:00.257419,gaussian_mixture,abundance,2.45,2,COMPLETE
2853,0.6527777325757057,2025-03-03 19:39:26.747559,2025-03-03 19:39:27.019266,0 days 00:00:00.271707,gaussian_mixture,abundance,1.9500000000000002,2,COMPLETE
2854,0.5645204323639288,2025-03-03 19:39:27.021266,2025-03-03 19:39:27.293922,0 days 00:00:00.272656,gaussian_mixture,abundance,2.0,2,COMPLETE
2855,0.38853260620135227,2025-03-03 19:39:27.295923,2025-03-03 19:39:27.565613,0 days 00:00:00.269690,gaussian_mixture,abundance,2.4000000000000004,2,COMPLETE
2856,0.4062313885251029,2025-03-03 19:39:27.566613,2025-03-03 19:39:27.837550,0 days 00:00:00.270937,gaussian_mixture,abundance,2.3000000000000003,2,COMPLETE
2857,0.41434538145981514,2025-03-03 19:39:27.839546,2025-03-03 19:39:28.139954,0 days 00:00:00.300408,gaussian_mixture,abundance,2.1,2,COMPLETE
2858,0.5369887640654253,2025-03-03 19:39:28.141953,2025-03-03 19:39:28.467161,0 days 00:00:00.325208,gaussian_mixture,abundance,2.15,2,COMPLETE
2859,0.3226698321666328,2025-03-03 19:39:28.469226,2025-03-03 19:39:28.760892,0 days 00:00:00.291666,gaussian_mixture,abundance,1.85,2,COMPLETE
2860,0.564906930058474,2025-03-03 19:39:28.761888,2025-03-03 19:39:29.044557,0 days 00:00:00.282669,gaussian_mixture,abundance,2.3000000000000003,2,COMPLETE
2861,0.34887786247605285,2025-03-03 19:39:29.047554,2025-03-03 19:39:29.417132,0 days 00:00:00.369578,gaussian_mixture,abundance,2.2,2,COMPLETE
2862,0.6172538566663234,2025-03-03 19:39:29.419133,2025-03-03 19:39:29.692821,0 days 00:00:00.273688,gaussian_mixture,abundance,2.1,2,COMPLETE
2863,0.5525367678114899,2025-03-03 19:39:29.693836,2025-03-03 19:39:29.978198,0 days 00:00:00.284362,gaussian_mixture,abundance,2.0500000000000003,2,COMPLETE
2864,0.015723307814834636,2025-03-03 19:39:29.980196,2025-03-03 19:39:31.485637,0 days 00:00:01.505441,gaussian_mixture,presence,10.0,2,COMPLETE
2865,0.488371554085667,2025-03-03 19:39:31.486637,2025-03-03 19:39:31.770769,0 days 00:00:00.284132,gaussian_mixture,abundance,2.2,2,COMPLETE
2866,0.5001551720216997,2025-03-03 19:39:31.771769,2025-03-03 19:39:32.021331,0 days 00:00:00.249562,gaussian_mixture,abundance,2.5,2,COMPLETE
2867,0.48531404040525733,2025-03-03 19:39:32.023097,2025-03-03 19:39:32.279667,0 days 00:00:00.256570,gaussian_mixture,abundance,2.35,2,COMPLETE
2868,0.5322414547126202,2025-03-03 19:39:32.281667,2025-03-03 19:39:32.561566,0 days 00:00:00.279899,gaussian_mixture,abundance,2.25,3,COMPLETE
2869,0.6414096378904388,2025-03-03 19:39:32.563559,2025-03-03 19:39:32.875116,0 days 00:00:00.311557,gaussian_mixture,abundance,2.4000000000000004,2,COMPLETE
2870,0.5633527701398364,2025-03-03 19:39:32.877105,2025-03-03 19:39:33.134374,0 days 00:00:00.257269,kmeans,abundance,2.2,2,COMPLETE
2871,0.3372629094256719,2025-03-03 19:39:33.136413,2025-03-03 19:39:33.396673,0 days 00:00:00.260260,gaussian_mixture,abundance,2.35,2,COMPLETE
2872,0.5720066413406013,2025-03-03 19:39:33.398678,2025-03-03 19:39:33.674443,0 days 00:00:00.275765,gaussian_mixture,abundance,1.9000000000000001,4,COMPLETE
2873,0.17856659998610597,2025-03-03 19:39:33.676440,2025-03-03 19:39:33.934912,0 days 00:00:00.258472,gaussian_mixture,abundance,1.7000000000000002,2,COMPLETE
2874,0.3192888274468282,2025-03-03 19:39:33.936434,2025-03-03 19:39:34.190654,0 days 00:00:00.254220,gaussian_mixture,abundance,2.1,2,COMPLETE
2875,0.5785429738698825,2025-03-03 19:39:34.192654,2025-03-03 19:39:34.451778,0 days 00:00:00.259124,gaussian_mixture,abundance,2.3000000000000003,2,COMPLETE
2876,0.5223982529551152,2025-03-03 19:39:34.453782,2025-03-03 19:39:34.704127,0 days 00:00:00.250345,gaussian_mixture,abundance,2.45,2,COMPLETE
2877,0.4062313885251029,2025-03-03 19:39:34.706137,2025-03-03 19:39:34.977603,0 days 00:00:00.271466,gaussian_mixture,abundance,2.15,2,COMPLETE
2878,0.6333915723747436,2025-03-03 19:39:34.979708,2025-03-03 19:39:35.258489,0 days 00:00:00.278781,gaussian_mixture,abundance,2.25,2,COMPLETE
2879,0.6282619979114271,2025-03-03 19:39:35.259475,2025-03-03 19:39:35.539194,0 days 00:00:00.279719,gaussian_mixture,abundance,2.15,2,COMPLETE
2880,0.5504193269703301,2025-03-03 19:39:35.541199,2025-03-03 19:39:35.813578,0 days 00:00:00.272379,gaussian_mixture,abundance,2.0,2,COMPLETE
2881,0.6210504632471086,2025-03-03 19:39:35.815578,2025-03-03 19:39:36.092078,0 days 00:00:00.276500,gaussian_mixture,abundance,2.25,2,COMPLETE
2882,0.5538034406041394,2025-03-03 19:39:36.094080,2025-03-03 19:39:36.366605,0 days 00:00:00.272525,gaussian_mixture,abundance,2.3000000000000003,2,COMPLETE
2883,0.03724109721470496,2025-03-03 19:39:36.369605,2025-03-03 19:39:37.617368,0 days 00:00:01.247763,gaussian_mixture,presence,90.0,2,COMPLETE
2884,0.3632261314935414,2025-03-03 19:39:37.619374,2025-03-03 19:39:37.871163,0 days 00:00:00.251789,gaussian_mixture,abundance,2.45,2,COMPLETE
2885,0.5416584339974235,2025-03-03 19:39:37.873163,2025-03-03 19:39:38.124378,0 days 00:00:00.251215,gaussian_mixture,abundance,2.4000000000000004,2,COMPLETE
2886,0.5681253085626488,2025-03-03 19:39:38.126364,2025-03-03 19:39:38.380170,0 days 00:00:00.253806,gaussian_mixture,abundance,2.0500000000000003,2,COMPLETE
2887,0.5068622646827524,2025-03-03 19:39:38.382170,2025-03-03 19:39:38.636570,0 days 00:00:00.254400,gaussian_mixture,abundance,2.2,2,COMPLETE
2888,0.48554047798333855,2025-03-03 19:39:38.637570,2025-03-03 19:39:38.893216,0 days 00:00:00.255646,gaussian_mixture,abundance,2.15,2,COMPLETE
2889,0.5523509813424887,2025-03-03 19:39:38.894229,2025-03-03 19:39:39.159823,0 days 00:00:00.265594,gaussian_mixture,abundance,2.35,2,COMPLETE
2890,0.206037678612997,2025-03-03 19:39:39.162697,2025-03-03 19:39:39.426090,0 days 00:00:00.263393,gaussian_mixture,abundance,2.25,2,COMPLETE
2891,0.43290506637979276,2025-03-03 19:39:39.429080,2025-03-03 19:39:39.686371,0 days 00:00:00.257291,kmeans,abundance,1.8,2,COMPLETE
2892,0.44054376559497455,2025-03-03 19:39:39.688179,2025-03-03 19:39:39.962230,0 days 00:00:00.274051,gaussian_mixture,abundance,2.0500000000000003,5,COMPLETE
2893,0.4357387290253478,2025-03-03 19:39:39.963234,2025-03-03 19:39:40.225531,0 days 00:00:00.262297,gaussian_mixture,abundance,2.0,2,COMPLETE
2894,0.43896312191502596,2025-03-03 19:39:40.227528,2025-03-03 19:39:40.521717,0 days 00:00:00.294189,gaussian_mixture,abundance,2.1,2,COMPLETE
2895,0.6284086357321879,2025-03-03 19:39:40.523717,2025-03-03 19:39:40.787227,0 days 00:00:00.263510,gaussian_mixture,abundance,2.2,2,COMPLETE
2896,0.501066268270349,2025-03-03 19:39:40.789227,2025-03-03 19:39:41.050831,0 days 00:00:00.261604,gaussian_mixture,abundance,2.4000000000000004,2,COMPLETE
2897,0.5632634018026172,2025-03-03 19:39:41.051827,2025-03-03 19:39:41.314463,0 days 00:00:00.262636,gaussian_mixture,abundance,2.3000000000000003,2,COMPLETE
2898,0.36288555082789065,2025-03-03 19:39:41.316465,2025-03-03 19:39:41.583486,0 days 00:00:00.267021,gaussian_mixture,abundance,2.25,2,COMPLETE
2899,0.43537494822180156,2025-03-03 19:39:41.584929,2025-03-03 19:39:41.839046,0 days 00:00:00.254117,gaussian_mixture,abundance,2.5,2,COMPLETE
2900,0.4152931621887855,2025-03-03 19:39:41.841046,2025-03-03 19:39:42.103433,0 days 00:00:00.262387,gaussian_mixture,abundance,2.15,2,COMPLETE
2901,0.5730322801447396,2025-03-03 19:39:42.105435,2025-03-03 19:39:42.369369,0 days 00:00:00.263934,gaussian_mixture,abundance,1.3,2,COMPLETE
2902,0.014005823454486055,2025-03-03 19:39:42.370365,2025-03-03 19:39:43.906675,0 days 00:00:01.536310,gaussian_mixture,presence,10.0,2,COMPLETE
2903,0.6669276884751494,2025-03-03 19:39:43.908680,2025-03-03 19:39:44.175671,0 days 00:00:00.266991,gaussian_mixture,abundance,2.1,2,COMPLETE
2904,0.5255463680060172,2025-03-03 19:39:44.177671,2025-03-03 19:39:44.434522,0 days 00:00:00.256851,gaussian_mixture,abundance,2.35,2,COMPLETE
2905,0.5600260694182072,2025-03-03 19:39:44.436531,2025-03-03 19:39:44.695318,0 days 00:00:00.258787,gaussian_mixture,abundance,2.25,2,COMPLETE
2906,0.4604958552737425,2025-03-03 19:39:44.696323,2025-03-03 19:39:44.957773,0 days 00:00:00.261450,gaussian_mixture,abundance,1.9500000000000002,2,COMPLETE
2907,0.44234173922000986,2025-03-03 19:39:44.959775,2025-03-03 19:39:45.210221,0 days 00:00:00.250446,gaussian_mixture,abundance,2.15,2,COMPLETE
2908,0.5652732833063714,2025-03-03 19:39:45.212229,2025-03-03 19:39:45.480567,0 days 00:00:00.268338,gaussian_mixture,abundance,2.3000000000000003,2,COMPLETE
2909,0.4911420332179676,2025-03-03 19:39:45.482568,2025-03-03 19:39:45.739776,0 days 00:00:00.257208,kmeans,abundance,2.4000000000000004,3,COMPLETE
2910,0.7171740049356445,2025-03-03 19:39:45.741782,2025-03-03 19:39:46.005359,0 days 00:00:00.263577,gaussian_mixture,abundance,2.1,2,COMPLETE
2911,0.5033917250046102,2025-03-03 19:39:46.007353,2025-03-03 19:39:46.267699,0 days 00:00:00.260346,gaussian_mixture,abundance,2.0500000000000003,2,COMPLETE
2912,0.32517141225794977,2025-03-03 19:39:46.269699,2025-03-03 19:39:46.527807,0 days 00:00:00.258108,gaussian_mixture,abundance,2.0,2,COMPLETE
2913,0.4848460415832747,2025-03-03 19:39:46.529792,2025-03-03 19:39:46.794075,0 days 00:00:00.264283,gaussian_mixture,abundance,2.0500000000000003,4,COMPLETE
2914,0.5544449015310396,2025-03-03 19:39:46.796072,2025-03-03 19:39:47.051886,0 days 00:00:00.255814,gaussian_mixture,abundance,2.1,2,COMPLETE
2915,0.26578330738427536,2025-03-03 19:39:47.053398,2025-03-03 19:39:47.308443,0 days 00:00:00.255045,gaussian_mixture,abundance,2.0500000000000003,2,COMPLETE
2916,0.4443810828023736,2025-03-03 19:39:47.310446,2025-03-03 19:39:47.589425,0 days 00:00:00.278979,gaussian_mixture,abundance,2.0500000000000003,6,COMPLETE
2917,0.6144246542934022,2025-03-03 19:39:47.591425,2025-03-03 19:39:47.869008,0 days 00:00:00.277583,gaussian_mixture,abundance,1.9500000000000002,2,COMPLETE
2918,0.2761562157820052,2025-03-03 19:39:47.870649,2025-03-03 19:39:48.131562,0 days 00:00:00.260913,gaussian_mixture,abundance,2.0,2,COMPLETE
2919,0.3838557635392099,2025-03-03 19:39:48.132562,2025-03-03 19:39:48.392116,0 days 00:00:00.259554,gaussian_mixture,abundance,2.1,2,COMPLETE
2920,0.59071123716519,2025-03-03 19:39:48.394115,2025-03-03 19:39:48.653762,0 days 00:00:00.259647,gaussian_mixture,abundance,2.1,2,COMPLETE
2921,0.5567410200665605,2025-03-03 19:39:48.656282,2025-03-03 19:39:48.917307,0 days 00:00:00.261025,gaussian_mixture,abundance,2.0,2,COMPLETE
2922,0.4027790050025498,2025-03-03 19:39:48.919307,2025-03-03 19:39:49.173262,0 days 00:00:00.253955,gaussian_mixture,abundance,2.1,2,COMPLETE
2923,0.32860164957703936,2025-03-03 19:39:49.174453,2025-03-03 19:39:49.440951,0 days 00:00:00.266498,gaussian_mixture,abundance,2.1,2,COMPLETE
2924,0.01261154010569479,2025-03-03 19:39:49.442957,2025-03-03 19:39:50.935290,0 days 00:00:01.492333,gaussian_mixture,presence,15.0,2,COMPLETE
2925,0.3691169393529935,2025-03-03 19:39:50.937289,2025-03-03 19:39:51.213104,0 days 00:00:00.275815,gaussian_mixture,abundance,2.0,2,COMPLETE
2926,0.40408553046757534,2025-03-03 19:39:51.215110,2025-03-03 19:39:51.486256,0 days 00:00:00.271146,gaussian_mixture,abundance,2.0500000000000003,2,COMPLETE
2927,0.3141890571445393,2025-03-03 19:39:51.487256,2025-03-03 19:39:51.759693,0 days 00:00:00.272437,kmeans,abundance,2.15,2,COMPLETE
2928,0.44528988198275316,2025-03-03 19:39:51.762024,2025-03-03 19:39:52.016818,0 days 00:00:00.254794,gaussian_mixture,abundance,2.0500000000000003,2,COMPLETE
2929,0.3973114726440205,2025-03-03 19:39:52.018818,2025-03-03 19:39:52.289179,0 days 00:00:00.270361,gaussian_mixture,abundance,1.9500000000000002,2,COMPLETE
2930,0.5948596584458474,2025-03-03 19:39:52.291179,2025-03-03 19:39:52.550995,0 days 00:00:00.259816,gaussian_mixture,abundance,2.15,2,COMPLETE
2931,0.3993466817657522,2025-03-03 19:39:52.552995,2025-03-03 19:39:52.835159,0 days 00:00:00.282164,gaussian_mixture,abundance,2.0500000000000003,2,COMPLETE
2932,0.5285913918893197,2025-03-03 19:39:52.836168,2025-03-03 19:39:53.139977,0 days 00:00:00.303809,gaussian_mixture,abundance,2.1,2,COMPLETE
2933,0.6224695185114969,2025-03-03 19:39:53.141979,2025-03-03 19:39:53.420901,0 days 00:00:00.278922,gaussian_mixture,abundance,2.15,2,COMPLETE
2934,0.4323307339180854,2025-03-03 19:39:53.422900,2025-03-03 19:39:53.735656,0 days 00:00:00.312756,gaussian_mixture,abundance,2.1,2,COMPLETE
2935,0.6855404779833385,2025-03-03 19:39:53.737648,2025-03-03 19:39:54.086680,0 days 00:00:00.349032,gaussian_mixture,abundance,2.15,2,COMPLETE
2936,0.38140049765872835,2025-03-03 19:39:54.088677,2025-03-03 19:39:54.386737,0 days 00:00:00.298060,gaussian_mixture,abundance,2.0,2,COMPLETE
2937,0.2996243952284958,2025-03-03 19:39:54.388736,2025-03-03 19:39:54.669690,0 days 00:00:00.280954,gaussian_mixture,abundance,2.15,2,COMPLETE
2938,-0.012682317449024363,2025-03-03 19:39:54.670688,2025-03-03 19:39:56.534880,0 days 00:00:01.864192,gaussian_mixture,abundance,0.0,2,COMPLETE
2939,-0.012378826586357066,2025-03-03 19:39:56.536889,2025-03-03 19:39:57.988810,0 days 00:00:01.451921,gaussian_mixture,presence,10.0,2,COMPLETE
2940,0.579425240251782,2025-03-03 19:39:57.990811,2025-03-03 19:39:58.263891,0 days 00:00:00.273080,gaussian_mixture,abundance,1.9000000000000001,2,COMPLETE
2941,0.4813118555158469,2025-03-03 19:39:58.264900,2025-03-03 19:39:58.559916,0 days 00:00:00.295016,gaussian_mixture,abundance,2.0500000000000003,2,COMPLETE
2942,0.4849907138321474,2025-03-03 19:39:58.561912,2025-03-03 19:39:58.844605,0 days 00:00:00.282693,gaussian_mixture,abundance,2.15,2,COMPLETE
2943,0.47595277606109654,2025-03-03 19:39:58.846594,2025-03-03 19:39:59.135553,0 days 00:00:00.288959,gaussian_mixture,abundance,2.1,2,COMPLETE
2944,0.3293066342617385,2025-03-03 19:39:59.137542,2025-03-03 19:39:59.408206,0 days 00:00:00.270664,gaussian_mixture,abundance,1.9500000000000002,2,COMPLETE
2945,0.3748478396225183,2025-03-03 19:39:59.411195,2025-03-03 19:39:59.681189,0 days 00:00:00.269994,kmeans,abundance,2.1,2,COMPLETE
2946,0.534722969097069,2025-03-03 19:39:59.682186,2025-03-03 19:39:59.971984,0 days 00:00:00.289798,gaussian_mixture,abundance,2.15,2,COMPLETE
2947,0.5475689346883048,2025-03-03 19:39:59.972980,2025-03-03 19:40:00.251185,0 days 00:00:00.278205,gaussian_mixture,abundance,2.0,2,COMPLETE
2948,0.48605919649045576,2025-03-03 19:40:00.254154,2025-03-03 19:40:00.534399,0 days 00:00:00.280245,gaussian_mixture,abundance,2.2,2,COMPLETE
2949,0.45424355144443196,2025-03-03 19:40:00.536394,2025-03-03 19:40:00.846259,0 days 00:00:00.309865,gaussian_mixture,abundance,1.85,2,COMPLETE
2950,0.3924593285453911,2025-03-03 19:40:00.848253,2025-03-03 19:40:01.144497,0 days 00:00:00.296244,gaussian_mixture,abundance,2.0500000000000003,2,COMPLETE
2951,0.5854633250966426,2025-03-03 19:40:01.146492,2025-03-03 19:40:01.432761,0 days 00:00:00.286269,gaussian_mixture,abundance,2.15,2,COMPLETE
2952,0.6990529133801665,2025-03-03 19:40:01.434746,2025-03-03 19:40:01.742416,0 days 00:00:00.307670,gaussian_mixture,abundance,2.2,2,COMPLETE
2953,0.30384413454414994,2025-03-03 19:40:01.745413,2025-03-03 19:40:02.065053,0 days 00:00:00.319640,gaussian_mixture,abundance,2.0500000000000003,2,COMPLETE
2954,0.5660572075958697,2025-03-03 19:40:02.067037,2025-03-03 19:40:02.378638,0 days 00:00:00.311601,gaussian_mixture,abundance,2.2,2,COMPLETE
2955,0.5702471929147146,2025-03-03 19:40:02.381634,2025-03-03 19:40:02.679353,0 days 00:00:00.297719,gaussian_mixture,abundance,1.55,2,COMPLETE
2956,0.6010649193875917,2025-03-03 19:40:02.680347,2025-03-03 19:40:02.981702,0 days 00:00:00.301355,gaussian_mixture,abundance,2.1,3,COMPLETE
2957,0.6474914761703152,2025-03-03 19:40:02.984687,2025-03-03 19:40:03.296982,0 days 00:00:00.312295,gaussian_mixture,abundance,2.1,4,COMPLETE
