number,value,datetime_start,datetime_complete,duration,params_algorithm,params_filter_criteria,params_filter_threshold,params_k,state
1925,0.043140596293494246,2025-03-03 19:34:40.015685,2025-03-03 19:34:41.380335,0 days 00:00:01.364650,gaussian_mixture,presence,10.0,2,COMPLETE
1926,0.47808694700731336,2025-03-03 19:34:41.382331,2025-03-03 19:34:41.605963,0 days 00:00:00.223632,gaussian_mixture,abundance,2.1,2,COMPLETE
1927,0.5794847203055438,2025-03-03 19:34:41.606957,2025-03-03 19:34:41.831789,0 days 00:00:00.224832,gaussian_mixture,abundance,2.3000000000000003,2,COMPLETE
1928,0.5235485304925109,2025-03-03 19:34:41.832786,2025-03-03 19:34:42.056070,0 days 00:00:00.223284,gaussian_mixture,abundance,2.25,2,COMPLETE
1929,0.5224604842148073,2025-03-03 19:34:42.057070,2025-03-03 19:34:42.285933,0 days 00:00:00.228863,gaussian_mixture,abundance,2.2,2,COMPLETE
1930,0.4893419980074777,2025-03-03 19:34:42.287932,2025-03-03 19:34:42.515798,0 days 00:00:00.227866,gaussian_mixture,abundance,2.15,2,COMPLETE
1931,0.4134006357461136,2025-03-03 19:34:42.516798,2025-03-03 19:34:42.745674,0 days 00:00:00.228876,gaussian_mixture,abundance,2.0500000000000003,2,COMPLETE
1932,0.30416857335045594,2025-03-03 19:34:42.746673,2025-03-03 19:34:42.975698,0 days 00:00:00.229025,kmeans,abundance,2.5,2,COMPLETE
1933,0.511556409525124,2025-03-03 19:34:42.977417,2025-03-03 19:34:43.204979,0 days 00:00:00.227562,gaussian_mixture,abundance,1.9500000000000002,2,COMPLETE
1934,0.2964732989374214,2025-03-03 19:34:43.206975,2025-03-03 19:34:43.433872,0 days 00:00:00.226897,gaussian_mixture,abundance,2.1,2,COMPLETE
1935,0.5209856578314096,2025-03-03 19:34:43.434865,2025-03-03 19:34:43.662171,0 days 00:00:00.227306,gaussian_mixture,abundance,2.2,2,COMPLETE
1936,0.3904954108935401,2025-03-03 19:34:43.664169,2025-03-03 19:34:43.888270,0 days 00:00:00.224101,gaussian_mixture,abundance,2.3000000000000003,2,COMPLETE
1937,0.39640203338103974,2025-03-03 19:34:43.890267,2025-03-03 19:34:44.118214,0 days 00:00:00.227947,gaussian_mixture,abundance,2.25,2,COMPLETE
1938,0.5581434607424189,2025-03-03 19:34:44.119217,2025-03-03 19:34:44.348284,0 days 00:00:00.229067,gaussian_mixture,abundance,2.15,2,COMPLETE
1939,0.3678437556979679,2025-03-03 19:34:44.350280,2025-03-03 19:34:44.575406,0 days 00:00:00.225126,gaussian_mixture,abundance,2.35,2,COMPLETE
1940,0.45752380099882795,2025-03-03 19:34:44.577409,2025-03-03 19:34:44.805323,0 days 00:00:00.227914,gaussian_mixture,abundance,2.2,2,COMPLETE
1941,0.4118276733069499,2025-03-03 19:34:44.806323,2025-03-03 19:34:45.039698,0 days 00:00:00.233375,gaussian_mixture,abundance,2.0500000000000003,2,COMPLETE
1942,0.41740044245666325,2025-03-03 19:34:45.041697,2025-03-03 19:34:45.271713,0 days 00:00:00.230016,gaussian_mixture,abundance,2.25,2,COMPLETE
1943,0.07113539624233736,2025-03-03 19:34:45.273710,2025-03-03 19:34:46.665770,0 days 00:00:01.392060,gaussian_mixture,presence,45.0,3,COMPLETE
1944,0.433950236023942,2025-03-03 19:34:46.666769,2025-03-03 19:34:46.892800,0 days 00:00:00.226031,gaussian_mixture,abundance,2.1,2,COMPLETE
1945,0.4066474685413207,2025-03-03 19:34:46.894796,2025-03-03 19:34:47.140975,0 days 00:00:00.246179,gaussian_mixture,abundance,0.9500000000000001,2,COMPLETE
1946,0.42551282002615665,2025-03-03 19:34:47.142973,2025-03-03 19:34:47.387369,0 days 00:00:00.244396,gaussian_mixture,abundance,2.15,2,COMPLETE
1947,0.4466483498415351,2025-03-03 19:34:47.388373,2025-03-03 19:34:47.614749,0 days 00:00:00.226376,gaussian_mixture,abundance,2.25,2,COMPLETE
1948,0.6470554677666364,2025-03-03 19:34:47.615760,2025-03-03 19:34:47.843726,0 days 00:00:00.227966,gaussian_mixture,abundance,2.35,2,COMPLETE
1949,0.18505174712312708,2025-03-03 19:34:47.845721,2025-03-03 19:34:48.062847,0 days 00:00:00.217126,kmeans,abundance,2.4000000000000004,2,COMPLETE
1950,0.5653070976737183,2025-03-03 19:34:48.063840,2025-03-03 19:34:48.290821,0 days 00:00:00.226981,gaussian_mixture,abundance,2.2,2,COMPLETE
1951,0.4461639728030929,2025-03-03 19:34:48.292811,2025-03-03 19:34:48.532241,0 days 00:00:00.239430,gaussian_mixture,abundance,1.9000000000000001,2,COMPLETE
1952,0.47431412446932386,2025-03-03 19:34:48.533246,2025-03-03 19:34:48.758549,0 days 00:00:00.225303,gaussian_mixture,abundance,2.0,2,COMPLETE
1953,0.41792803924812433,2025-03-03 19:34:48.760534,2025-03-03 19:34:49.002350,0 days 00:00:00.241816,gaussian_mixture,abundance,2.1,6,COMPLETE
1954,0.5039170521168035,2025-03-03 19:34:49.003350,2025-03-03 19:34:49.239399,0 days 00:00:00.236049,gaussian_mixture,abundance,2.3000000000000003,2,COMPLETE
1955,0.21419123386619127,2025-03-03 19:34:49.240396,2025-03-03 19:34:49.543973,0 days 00:00:00.303577,gaussian_mixture,abundance,0.4,2,COMPLETE
1956,0.5368546577361399,2025-03-03 19:34:49.545970,2025-03-03 19:34:49.783033,0 days 00:00:00.237063,gaussian_mixture,abundance,1.8,2,COMPLETE
1957,0.37953900330184875,2025-03-03 19:34:49.785033,2025-03-03 19:34:50.014390,0 days 00:00:00.229357,gaussian_mixture,abundance,2.15,2,COMPLETE
1958,0.5396575737691245,2025-03-03 19:34:50.015385,2025-03-03 19:34:50.243336,0 days 00:00:00.227951,gaussian_mixture,abundance,2.45,2,COMPLETE
1959,0.2743510227671262,2025-03-03 19:34:50.244336,2025-03-03 19:34:50.474017,0 days 00:00:00.229681,gaussian_mixture,abundance,2.2,2,COMPLETE
1960,0.40830889999925535,2025-03-03 19:34:50.476014,2025-03-03 19:34:50.710358,0 days 00:00:00.234344,gaussian_mixture,abundance,2.0500000000000003,2,COMPLETE
1961,0.40871240647301443,2025-03-03 19:34:50.712359,2025-03-03 19:34:50.944688,0 days 00:00:00.232329,gaussian_mixture,abundance,2.15,4,COMPLETE
1962,0.03893397882080023,2025-03-03 19:34:50.946688,2025-03-03 19:34:52.307971,0 days 00:00:01.361283,gaussian_mixture,presence,10.0,2,COMPLETE
1963,0.4182530169166587,2025-03-03 19:34:52.308960,2025-03-03 19:34:52.535732,0 days 00:00:00.226772,gaussian_mixture,abundance,2.25,2,COMPLETE
1964,0.5144776863549104,2025-03-03 19:34:52.536732,2025-03-03 19:34:52.770320,0 days 00:00:00.233588,gaussian_mixture,abundance,2.0,2,COMPLETE
1965,0.4289063754311185,2025-03-03 19:34:52.771320,2025-03-03 19:34:52.999145,0 days 00:00:00.227825,gaussian_mixture,abundance,2.3000000000000003,2,COMPLETE
1966,0.46573521516198146,2025-03-03 19:34:53.001144,2025-03-03 19:34:53.236450,0 days 00:00:00.235306,gaussian_mixture,abundance,1.1500000000000001,2,COMPLETE
1967,0.21305108058942773,2025-03-03 19:34:53.237450,2025-03-03 19:34:53.456745,0 days 00:00:00.219295,gaussian_mixture,abundance,2.1,2,COMPLETE
1968,0.46717437238562265,2025-03-03 19:34:53.458735,2025-03-03 19:34:53.693964,0 days 00:00:00.235229,kmeans,abundance,2.2,2,COMPLETE
1969,0.4571463469784627,2025-03-03 19:34:53.695963,2025-03-03 19:34:53.923292,0 days 00:00:00.227329,gaussian_mixture,abundance,2.4000000000000004,2,COMPLETE
1970,0.4473502364034118,2025-03-03 19:34:53.925001,2025-03-03 19:34:54.156721,0 days 00:00:00.231720,gaussian_mixture,abundance,1.9500000000000002,2,COMPLETE
1971,0.14998012111758602,2025-03-03 19:34:54.157721,2025-03-03 19:34:54.383011,0 days 00:00:00.225290,gaussian_mixture,abundance,2.35,2,COMPLETE
1972,0.623752688692037,2025-03-03 19:34:54.385006,2025-03-03 19:34:54.612211,0 days 00:00:00.227205,gaussian_mixture,abundance,2.15,2,COMPLETE
1973,0.5497269217046981,2025-03-03 19:34:54.613208,2025-03-03 19:34:54.839139,0 days 00:00:00.225931,gaussian_mixture,abundance,2.3000000000000003,2,COMPLETE
1974,0.38582964081364135,2025-03-03 19:34:54.840139,2025-03-03 19:34:55.087796,0 days 00:00:00.247657,gaussian_mixture,abundance,1.35,2,COMPLETE
1975,0.4192824691145306,2025-03-03 19:34:55.088799,2025-03-03 19:34:55.312581,0 days 00:00:00.223782,gaussian_mixture,abundance,2.25,2,COMPLETE
1976,0.41473187915436044,2025-03-03 19:34:55.314578,2025-03-03 19:34:55.538209,0 days 00:00:00.223631,gaussian_mixture,abundance,2.0500000000000003,2,COMPLETE
1977,0.6872212765482711,2025-03-03 19:34:55.540014,2025-03-03 19:34:55.775917,0 days 00:00:00.235903,gaussian_mixture,abundance,2.5,2,COMPLETE
1978,0.5581434607424189,2025-03-03 19:34:55.777451,2025-03-03 19:34:56.007549,0 days 00:00:00.230098,gaussian_mixture,abundance,2.2,2,COMPLETE
1979,0.5206566217155968,2025-03-03 19:34:56.009549,2025-03-03 19:34:56.236396,0 days 00:00:00.226847,gaussian_mixture,abundance,2.1,2,COMPLETE
1980,0.6423417392200099,2025-03-03 19:34:56.238064,2025-03-03 19:34:56.464984,0 days 00:00:00.226920,gaussian_mixture,abundance,2.25,2,COMPLETE
1981,0.009861662129572795,2025-03-03 19:34:56.465992,2025-03-03 19:34:57.875957,0 days 00:00:01.409965,gaussian_mixture,presence,10.0,2,COMPLETE
1982,0.3845479181929553,2025-03-03 19:34:57.877952,2025-03-03 19:34:58.118349,0 days 00:00:00.240397,gaussian_mixture,abundance,2.15,2,COMPLETE
1983,0.42721764542837326,2025-03-03 19:34:58.120349,2025-03-03 19:34:58.351029,0 days 00:00:00.230680,gaussian_mixture,abundance,2.45,2,COMPLETE
1984,0.6208227922467813,2025-03-03 19:34:58.353027,2025-03-03 19:34:58.584388,0 days 00:00:00.231361,gaussian_mixture,abundance,2.35,2,COMPLETE
1985,0.05782433175356723,2025-03-03 19:34:58.586386,2025-03-03 19:34:58.866531,0 days 00:00:00.280145,gaussian_mixture,abundance,2.1,2,COMPLETE
1986,0.37980595477882073,2025-03-03 19:34:58.868530,2025-03-03 19:34:59.094160,0 days 00:00:00.225630,gaussian_mixture,abundance,2.2,2,COMPLETE
1987,0.31377902398347945,2025-03-03 19:34:59.095160,2025-03-03 19:34:59.316318,0 days 00:00:00.221158,kmeans,abundance,1.9500000000000002,2,COMPLETE
1988,0.43168052962633274,2025-03-03 19:34:59.317318,2025-03-03 19:34:59.540988,0 days 00:00:00.223670,gaussian_mixture,abundance,2.3000000000000003,2,COMPLETE
1989,0.4633460358428235,2025-03-03 19:34:59.541989,2025-03-03 19:34:59.774279,0 days 00:00:00.232290,gaussian_mixture,abundance,2.0500000000000003,3,COMPLETE
1990,0.6037414212694955,2025-03-03 19:34:59.776279,2025-03-03 19:35:00.002411,0 days 00:00:00.226132,gaussian_mixture,abundance,2.4000000000000004,2,COMPLETE
1991,0.4269318576338531,2025-03-03 19:35:00.004414,2025-03-03 19:35:00.245817,0 days 00:00:00.241403,gaussian_mixture,abundance,2.15,2,COMPLETE
1992,0.4907971687055797,2025-03-03 19:35:00.246816,2025-03-03 19:35:00.473153,0 days 00:00:00.226337,gaussian_mixture,abundance,2.25,2,COMPLETE
1993,0.49369645828791275,2025-03-03 19:35:00.475153,2025-03-03 19:35:00.704528,0 days 00:00:00.229375,gaussian_mixture,abundance,1.75,2,COMPLETE
1994,0.5545951898055819,2025-03-03 19:35:00.705528,2025-03-03 19:35:00.935481,0 days 00:00:00.229953,gaussian_mixture,abundance,2.2,2,COMPLETE
1995,0.13019784306700055,2025-03-03 19:35:00.937482,2025-03-03 19:35:01.476391,0 days 00:00:00.538909,gaussian_mixture,abundance,0.05,2,COMPLETE
1996,0.4083690693725794,2025-03-03 19:35:01.478387,2025-03-03 19:35:01.774446,0 days 00:00:00.296059,gaussian_mixture,abundance,2.3000000000000003,2,COMPLETE
1997,0.2062313885251028,2025-03-03 19:35:01.776447,2025-03-03 19:35:01.999386,0 days 00:00:00.222939,gaussian_mixture,abundance,2.15,2,COMPLETE
1998,0.45178692280948846,2025-03-03 19:35:02.001012,2025-03-03 19:35:02.236799,0 days 00:00:00.235787,gaussian_mixture,abundance,2.1,2,COMPLETE
1999,0.38528297222267976,2025-03-03 19:35:02.238400,2025-03-03 19:35:02.466757,0 days 00:00:00.228357,gaussian_mixture,abundance,2.25,2,COMPLETE
2000,0.3328050378131049,2025-03-03 19:35:02.468762,2025-03-03 19:35:02.701450,0 days 00:00:00.232688,gaussian_mixture,abundance,2.0500000000000003,2,COMPLETE
2001,0.014049081127806073,2025-03-03 19:35:02.702449,2025-03-03 19:35:04.141445,0 days 00:00:01.438996,gaussian_mixture,presence,10.0,3,COMPLETE
2002,0.5861983103302792,2025-03-03 19:35:04.143447,2025-03-03 19:35:04.380279,0 days 00:00:00.236832,gaussian_mixture,abundance,2.2,2,COMPLETE
2003,0.4064642365386117,2025-03-03 19:35:04.382897,2025-03-03 19:35:04.607770,0 days 00:00:00.224873,gaussian_mixture,abundance,2.35,2,COMPLETE
2004,0.4364832176633852,2025-03-03 19:35:04.609758,2025-03-03 19:35:04.840366,0 days 00:00:00.230608,gaussian_mixture,abundance,2.0,2,COMPLETE
2005,0.47636127628215397,2025-03-03 19:35:04.841367,2025-03-03 19:35:05.069260,0 days 00:00:00.227893,gaussian_mixture,abundance,2.1,2,COMPLETE
2006,0.5544960459822782,2025-03-03 19:35:05.070259,2025-03-03 19:35:05.296839,0 days 00:00:00.226580,kmeans,abundance,2.45,2,COMPLETE
2007,0.5775615154201117,2025-03-03 19:35:05.298848,2025-03-03 19:35:05.525980,0 days 00:00:00.227132,gaussian_mixture,abundance,2.15,2,COMPLETE
2008,0.32860164957703936,2025-03-03 19:35:05.527980,2025-03-03 19:35:05.752901,0 days 00:00:00.224921,gaussian_mixture,abundance,2.3000000000000003,2,COMPLETE
2009,0.32554636800601716,2025-03-03 19:35:05.753906,2025-03-03 19:35:05.974213,0 days 00:00:00.220307,gaussian_mixture,abundance,2.4000000000000004,2,COMPLETE
2010,0.42005429307780284,2025-03-03 19:35:05.976009,2025-03-03 19:35:06.202144,0 days 00:00:00.226135,gaussian_mixture,abundance,2.2,2,COMPLETE
2011,0.6161450764563082,2025-03-03 19:35:06.203144,2025-03-03 19:35:06.441807,0 days 00:00:00.238663,gaussian_mixture,abundance,2.0500000000000003,2,COMPLETE
2012,0.38163991760442795,2025-03-03 19:35:06.444811,2025-03-03 19:35:06.680362,0 days 00:00:00.235551,gaussian_mixture,abundance,2.35,2,COMPLETE
2013,0.5488107382140041,2025-03-03 19:35:06.681362,2025-03-03 19:35:06.906808,0 days 00:00:00.225446,gaussian_mixture,abundance,2.25,2,COMPLETE
2014,0.6209058061007309,2025-03-03 19:35:06.908475,2025-03-03 19:35:07.139152,0 days 00:00:00.230677,gaussian_mixture,abundance,2.15,2,COMPLETE
2015,0.3295527911142078,2025-03-03 19:35:07.141152,2025-03-03 19:35:07.371690,0 days 00:00:00.230538,gaussian_mixture,abundance,2.1,2,COMPLETE
2016,0.4037414212694955,2025-03-03 19:35:07.373690,2025-03-03 19:35:07.612742,0 days 00:00:00.239052,gaussian_mixture,abundance,1.6500000000000001,2,COMPLETE
2017,0.5632261314935414,2025-03-03 19:35:07.613738,2025-03-03 19:35:07.842392,0 days 00:00:00.228654,gaussian_mixture,abundance,2.25,2,COMPLETE
2018,0.017080980341675822,2025-03-03 19:35:07.844393,2025-03-03 19:35:09.205978,0 days 00:00:01.361585,gaussian_mixture,presence,10.0,2,COMPLETE
2019,0.3792690573795254,2025-03-03 19:35:09.206983,2025-03-03 19:35:09.444785,0 days 00:00:00.237802,gaussian_mixture,abundance,2.15,2,COMPLETE
2020,0.558649389499285,2025-03-03 19:35:09.445782,2025-03-03 19:35:09.676919,0 days 00:00:00.231137,gaussian_mixture,abundance,2.0,2,COMPLETE
2021,0.5054126986918515,2025-03-03 19:35:09.677919,2025-03-03 19:35:09.902292,0 days 00:00:00.224373,gaussian_mixture,abundance,2.5,2,COMPLETE
2022,0.49057271328132634,2025-03-03 19:35:09.903292,2025-03-03 19:35:10.131765,0 days 00:00:00.228473,gaussian_mixture,abundance,2.3000000000000003,2,COMPLETE
2023,0.6224695185114969,2025-03-03 19:35:10.133767,2025-03-03 19:35:10.364425,0 days 00:00:00.230658,gaussian_mixture,abundance,2.2,2,COMPLETE
2024,0.5248279607401043,2025-03-03 19:35:10.366086,2025-03-03 19:35:10.591184,0 days 00:00:00.225098,kmeans,abundance,1.9500000000000002,2,COMPLETE
2025,0.36699895403153093,2025-03-03 19:35:10.593195,2025-03-03 19:35:10.828815,0 days 00:00:00.235620,gaussian_mixture,abundance,2.4000000000000004,2,COMPLETE
2026,0.5197667304961094,2025-03-03 19:35:10.830946,2025-03-03 19:35:11.058342,0 days 00:00:00.227396,gaussian_mixture,abundance,1.85,2,COMPLETE
2027,0.4770191417644303,2025-03-03 19:35:11.060347,2025-03-03 19:35:11.293463,0 days 00:00:00.233116,gaussian_mixture,abundance,2.1,2,COMPLETE
2028,0.29033354956980606,2025-03-03 19:35:11.294463,2025-03-03 19:35:11.516958,0 days 00:00:00.222495,gaussian_mixture,abundance,2.2,2,COMPLETE
2029,0.43663622751467795,2025-03-03 19:35:11.518766,2025-03-03 19:35:11.758139,0 days 00:00:00.239373,gaussian_mixture,abundance,2.15,5,COMPLETE
2030,0.29943896099366285,2025-03-03 19:35:11.760140,2025-03-03 19:35:11.998220,0 days 00:00:00.238080,gaussian_mixture,abundance,2.25,2,COMPLETE
2031,0.44109834611606474,2025-03-03 19:35:11.999222,2025-03-03 19:35:12.228967,0 days 00:00:00.229745,gaussian_mixture,abundance,2.0500000000000003,2,COMPLETE
2032,0.7296597712096574,2025-03-03 19:35:12.230579,2025-03-03 19:35:12.464323,0 days 00:00:00.233744,gaussian_mixture,abundance,2.3000000000000003,2,COMPLETE
2033,0.41492680894088796,2025-03-03 19:35:12.466326,2025-03-03 19:35:12.695870,0 days 00:00:00.229544,gaussian_mixture,abundance,2.35,2,COMPLETE
2034,0.4970753466490504,2025-03-03 19:35:12.697625,2025-03-03 19:35:12.940264,0 days 00:00:00.242639,gaussian_mixture,abundance,2.35,2,COMPLETE
2035,0.5110956079038714,2025-03-03 19:35:12.942412,2025-03-03 19:35:13.203540,0 days 00:00:00.261128,gaussian_mixture,abundance,2.35,2,COMPLETE
2036,0.23792898603117463,2025-03-03 19:35:13.205540,2025-03-03 19:35:13.450185,0 days 00:00:00.244645,gaussian_mixture,abundance,2.3000000000000003,2,COMPLETE
2037,0.28299638140302913,2025-03-03 19:35:13.452183,2025-03-03 19:35:13.676568,0 days 00:00:00.224385,gaussian_mixture,abundance,2.4000000000000004,2,COMPLETE
2038,0.013447115010777357,2025-03-03 19:35:13.677572,2025-03-03 19:35:15.028916,0 days 00:00:01.351344,gaussian_mixture,presence,10.0,2,COMPLETE
2039,0.5706292270164317,2025-03-03 19:35:15.030925,2025-03-03 19:35:15.275799,0 days 00:00:00.244874,gaussian_mixture,abundance,2.3000000000000003,2,COMPLETE
2040,0.17537131710190348,2025-03-03 19:35:15.277787,2025-03-03 19:35:15.509856,0 days 00:00:00.232069,gaussian_mixture,abundance,2.35,2,COMPLETE
2041,0.38365963523647945,2025-03-03 19:35:15.511854,2025-03-03 19:35:15.744926,0 days 00:00:00.233072,gaussian_mixture,abundance,2.3000000000000003,2,COMPLETE
2042,0.5076405124113761,2025-03-03 19:35:15.746921,2025-03-03 19:35:15.972583,0 days 00:00:00.225662,gaussian_mixture,abundance,2.3000000000000003,2,COMPLETE
2043,0.5164527512314783,2025-03-03 19:35:15.974589,2025-03-03 19:35:16.198719,0 days 00:00:00.224130,gaussian_mixture,abundance,2.45,2,COMPLETE
2044,0.566335161906097,2025-03-03 19:35:16.200526,2025-03-03 19:35:16.427404,0 days 00:00:00.226878,gaussian_mixture,abundance,2.4000000000000004,2,COMPLETE
2045,0.34546359902452783,2025-03-03 19:35:16.428402,2025-03-03 19:35:16.652637,0 days 00:00:00.224235,kmeans,abundance,2.25,4,COMPLETE
2046,0.617907986108441,2025-03-03 19:35:16.653637,2025-03-03 19:35:16.890682,0 days 00:00:00.237045,gaussian_mixture,abundance,2.3000000000000003,2,COMPLETE
2047,0.5722232020510016,2025-03-03 19:35:16.892684,2025-03-03 19:35:17.121719,0 days 00:00:00.229035,gaussian_mixture,abundance,2.25,2,COMPLETE
2048,0.4306229249580579,2025-03-03 19:35:17.123735,2025-03-03 19:35:17.363227,0 days 00:00:00.239492,gaussian_mixture,abundance,2.4000000000000004,2,COMPLETE
2049,0.483311195026784,2025-03-03 19:35:17.365222,2025-03-03 19:35:17.601310,0 days 00:00:00.236088,gaussian_mixture,abundance,2.25,2,COMPLETE
2050,0.5994595470614495,2025-03-03 19:35:17.603309,2025-03-03 19:35:17.832166,0 days 00:00:00.228857,gaussian_mixture,abundance,2.3000000000000003,2,COMPLETE
2051,0.15847452000769816,2025-03-03 19:35:17.833965,2025-03-03 19:35:18.066011,0 days 00:00:00.232046,gaussian_mixture,abundance,2.35,2,COMPLETE
2052,0.5296597712096573,2025-03-03 19:35:18.068013,2025-03-03 19:35:18.293152,0 days 00:00:00.225139,gaussian_mixture,abundance,2.25,2,COMPLETE
2053,0.407576781870826,2025-03-03 19:35:18.295151,2025-03-03 19:35:18.515492,0 days 00:00:00.220341,gaussian_mixture,abundance,2.45,2,COMPLETE
2054,0.3503865351067291,2025-03-03 19:35:18.517292,2025-03-03 19:35:18.749531,0 days 00:00:00.232239,gaussian_mixture,abundance,2.2,2,COMPLETE
2055,0.43053102992407305,2025-03-03 19:35:18.750533,2025-03-03 19:35:18.986641,0 days 00:00:00.236108,gaussian_mixture,abundance,2.35,2,COMPLETE
2056,0.6013339886961185,2025-03-03 19:35:18.987642,2025-03-03 19:35:19.225689,0 days 00:00:00.238047,gaussian_mixture,abundance,2.4000000000000004,2,COMPLETE
2057,0.37773425648874664,2025-03-03 19:35:19.226684,2025-03-03 19:35:19.469644,0 days 00:00:00.242960,gaussian_mixture,abundance,2.25,2,COMPLETE
2058,0.6407477641854399,2025-03-03 19:35:19.470643,2025-03-03 19:35:19.698932,0 days 00:00:00.228289,gaussian_mixture,abundance,2.5,2,COMPLETE
2059,0.6227983066879359,2025-03-03 19:35:19.700932,2025-03-03 19:35:19.929259,0 days 00:00:00.228327,gaussian_mixture,abundance,2.3000000000000003,2,COMPLETE
2060,0.45356637036538183,2025-03-03 19:35:19.931253,2025-03-03 19:35:20.163220,0 days 00:00:00.231967,gaussian_mixture,abundance,2.2,2,COMPLETE
2061,0.013383367134267035,2025-03-03 19:35:20.164218,2025-03-03 19:35:21.512345,0 days 00:00:01.348127,gaussian_mixture,presence,10.0,2,COMPLETE
2062,0.5374834124006875,2025-03-03 19:35:21.513994,2025-03-03 19:35:21.744497,0 days 00:00:00.230503,gaussian_mixture,abundance,2.3000000000000003,2,COMPLETE
2063,0.36946288864686516,2025-03-03 19:35:21.746502,2025-03-03 19:35:21.965852,0 days 00:00:00.219350,kmeans,abundance,2.25,2,COMPLETE
2064,0.5262587812553156,2025-03-03 19:35:21.966843,2025-03-03 19:35:22.191880,0 days 00:00:00.225037,gaussian_mixture,abundance,2.45,2,COMPLETE
2065,0.5059783956485481,2025-03-03 19:35:22.194880,2025-03-03 19:35:22.430974,0 days 00:00:00.236094,gaussian_mixture,abundance,2.2,2,COMPLETE
2066,0.47229446760738314,2025-03-03 19:35:22.432974,2025-03-03 19:35:22.661637,0 days 00:00:00.228663,gaussian_mixture,abundance,2.35,2,COMPLETE
2067,0.5606581517036583,2025-03-03 19:35:22.663635,2025-03-03 19:35:22.888357,0 days 00:00:00.224722,gaussian_mixture,abundance,2.15,2,COMPLETE
2068,0.4540809710021511,2025-03-03 19:35:22.890357,2025-03-03 19:35:23.128969,0 days 00:00:00.238612,gaussian_mixture,abundance,2.35,2,COMPLETE
2069,0.6509159960668365,2025-03-03 19:35:23.129969,2025-03-03 19:35:23.360921,0 days 00:00:00.230952,gaussian_mixture,abundance,2.2,2,COMPLETE
2070,0.475214469346344,2025-03-03 19:35:23.363918,2025-03-03 19:35:23.601444,0 days 00:00:00.237526,gaussian_mixture,abundance,2.3000000000000003,2,COMPLETE
2071,0.4037414212694955,2025-03-03 19:35:23.602439,2025-03-03 19:35:23.845165,0 days 00:00:00.242726,gaussian_mixture,abundance,2.2,2,COMPLETE
2072,0.6855404779833385,2025-03-03 19:35:23.847154,2025-03-03 19:35:24.078946,0 days 00:00:00.231792,gaussian_mixture,abundance,2.25,2,COMPLETE
