number,value,datetime_start,datetime_complete,duration,params_algorithm,params_filter_criteria,params_filter_threshold,params_k,state
1037,0.4195365108616021,2025-03-03 19:30:33.620073,2025-03-03 19:30:33.867753,0 days 00:00:00.247680,gaussian_mixture,abundance,2.35,5,COMPLETE
1038,0.5319937990765133,2025-03-03 19:30:33.868751,2025-03-03 19:30:34.096897,0 days 00:00:00.228146,gaussian_mixture,abundance,2.2,2,COMPLETE
1039,0.4816616128480139,2025-03-03 19:30:34.098896,2025-03-03 19:30:34.291068,0 days 00:00:00.192172,kmeans,abundance,2.3000000000000003,2,COMPLETE
1040,0.5907793067180581,2025-03-03 19:30:34.293066,2025-03-03 19:30:34.505429,0 days 00:00:00.212363,gaussian_mixture,abundance,2.1,2,COMPLETE
1041,0.538391432968081,2025-03-03 19:30:34.507495,2025-03-03 19:30:34.712089,0 days 00:00:00.204594,gaussian_mixture,abundance,2.2,2,COMPLETE
1042,0.6003320227434294,2025-03-03 19:30:34.714084,2025-03-03 19:30:34.969436,0 days 00:00:00.255352,gaussian_mixture,abundance,2.4000000000000004,2,COMPLETE
1043,0.3001551720216996,2025-03-03 19:30:34.971433,2025-03-03 19:30:35.233259,0 days 00:00:00.261826,gaussian_mixture,abundance,2.15,2,COMPLETE
1044,0.49705403944216675,2025-03-03 19:30:35.235259,2025-03-03 19:30:35.492576,0 days 00:00:00.257317,gaussian_mixture,abundance,2.25,3,COMPLETE
1045,0.5158462676312948,2025-03-03 19:30:35.494581,2025-03-03 19:30:35.730897,0 days 00:00:00.236316,gaussian_mixture,abundance,2.35,4,COMPLETE
1046,0.4827213756500857,2025-03-03 19:30:35.731897,2025-03-03 19:30:35.931032,0 days 00:00:00.199135,gaussian_mixture,abundance,2.1,2,COMPLETE
1047,0.5464914092336361,2025-03-03 19:30:35.932032,2025-03-03 19:30:36.131882,0 days 00:00:00.199850,gaussian_mixture,abundance,2.0500000000000003,2,COMPLETE
1048,0.47087541234299496,2025-03-03 19:30:36.132882,2025-03-03 19:30:36.328008,0 days 00:00:00.195126,gaussian_mixture,abundance,2.3000000000000003,2,COMPLETE
1049,0.6900632517116441,2025-03-03 19:30:36.329008,2025-03-03 19:30:36.536959,0 days 00:00:00.207951,gaussian_mixture,abundance,2.15,2,COMPLETE
1050,0.4425420503964597,2025-03-03 19:30:36.538976,2025-03-03 19:30:36.744693,0 days 00:00:00.205717,gaussian_mixture,abundance,2.1,2,COMPLETE
1051,0.36543192342985115,2025-03-03 19:30:36.746693,2025-03-03 19:30:36.944441,0 days 00:00:00.197748,gaussian_mixture,abundance,2.0500000000000003,2,COMPLETE
1052,0.546462941197584,2025-03-03 19:30:36.945441,2025-03-03 19:30:37.146204,0 days 00:00:00.200763,gaussian_mixture,abundance,2.1,2,COMPLETE
1053,0.036390335987531684,2025-03-03 19:30:37.147007,2025-03-03 19:30:38.375755,0 days 00:00:01.228748,gaussian_mixture,presence,65.0,2,COMPLETE
1054,0.6154219408143303,2025-03-03 19:30:38.376747,2025-03-03 19:30:38.587824,0 days 00:00:00.211077,gaussian_mixture,abundance,2.15,2,COMPLETE
1055,0.3577832825890206,2025-03-03 19:30:38.588824,2025-03-03 19:30:38.830046,0 days 00:00:00.241222,gaussian_mixture,abundance,2.15,2,COMPLETE
1056,0.7008573203596798,2025-03-03 19:30:38.831046,2025-03-03 19:30:39.071914,0 days 00:00:00.240868,gaussian_mixture,abundance,2.2,2,COMPLETE
1057,0.38115116210274413,2025-03-03 19:30:39.074902,2025-03-03 19:30:39.283138,0 days 00:00:00.208236,gaussian_mixture,abundance,2.2,2,COMPLETE
1058,0.5509958477975154,2025-03-03 19:30:39.284139,2025-03-03 19:30:39.486019,0 days 00:00:00.201880,gaussian_mixture,abundance,2.2,2,COMPLETE
1059,0.449720151144186,2025-03-03 19:30:39.488018,2025-03-03 19:30:39.679213,0 days 00:00:00.191195,kmeans,abundance,2.15,2,COMPLETE
1060,0.7203017678935375,2025-03-03 19:30:39.681213,2025-03-03 19:30:39.880540,0 days 00:00:00.199327,gaussian_mixture,abundance,2.2,2,COMPLETE
1061,0.6423417392200099,2025-03-03 19:30:39.881540,2025-03-03 19:30:40.079030,0 days 00:00:00.197490,gaussian_mixture,abundance,2.15,2,COMPLETE
1062,0.5084546411252842,2025-03-03 19:30:40.081030,2025-03-03 19:30:40.282575,0 days 00:00:00.201545,gaussian_mixture,abundance,2.25,2,COMPLETE
1063,0.5986840766042922,2025-03-03 19:30:40.284374,2025-03-03 19:30:40.489499,0 days 00:00:00.205125,gaussian_mixture,abundance,2.2,2,COMPLETE
1064,0.35789058583897876,2025-03-03 19:30:40.490183,2025-03-03 19:30:40.695435,0 days 00:00:00.205252,gaussian_mixture,abundance,2.15,2,COMPLETE
1065,0.5748913726766954,2025-03-03 19:30:40.696436,2025-03-03 19:30:40.910406,0 days 00:00:00.213970,gaussian_mixture,abundance,2.25,2,COMPLETE
1066,0.4960608703917158,2025-03-03 19:30:40.911489,2025-03-03 19:30:41.116852,0 days 00:00:00.205363,gaussian_mixture,abundance,2.2,2,COMPLETE
1067,0.5008573203596798,2025-03-03 19:30:41.118846,2025-03-03 19:30:41.317042,0 days 00:00:00.198196,gaussian_mixture,abundance,2.25,2,COMPLETE
1068,0.5463821544986258,2025-03-03 19:30:41.318042,2025-03-03 19:30:41.516373,0 days 00:00:00.198331,gaussian_mixture,abundance,2.1,2,COMPLETE
1069,0.4270565584864,2025-03-03 19:30:41.518373,2025-03-03 19:30:41.718892,0 days 00:00:00.200519,gaussian_mixture,abundance,2.15,2,COMPLETE
1070,0.418271210305185,2025-03-03 19:30:41.719892,2025-03-03 19:30:41.928537,0 days 00:00:00.208645,gaussian_mixture,abundance,2.3000000000000003,2,COMPLETE
1071,0.3605426825061667,2025-03-03 19:30:41.930551,2025-03-03 19:30:42.127164,0 days 00:00:00.196613,gaussian_mixture,abundance,2.1,2,COMPLETE
1072,-0.005990826374894693,2025-03-03 19:30:42.129165,2025-03-03 19:30:43.468228,0 days 00:00:01.339063,gaussian_mixture,presence,10.0,2,COMPLETE
1073,0.4178438840635068,2025-03-03 19:30:43.469228,2025-03-03 19:30:43.665818,0 days 00:00:00.196590,gaussian_mixture,abundance,2.2,2,COMPLETE
1074,0.5895899057136933,2025-03-03 19:30:43.667809,2025-03-03 19:30:43.866040,0 days 00:00:00.198231,gaussian_mixture,abundance,2.25,2,COMPLETE
1075,0.40045025971321546,2025-03-03 19:30:43.868049,2025-03-03 19:30:44.082408,0 days 00:00:00.214359,gaussian_mixture,abundance,2.15,2,COMPLETE
1076,0.5390237355329383,2025-03-03 19:30:44.083406,2025-03-03 19:30:44.316646,0 days 00:00:00.233240,gaussian_mixture,abundance,2.35,2,COMPLETE
1077,0.5125717996923289,2025-03-03 19:30:44.318643,2025-03-03 19:30:44.514383,0 days 00:00:00.195740,gaussian_mixture,abundance,2.4000000000000004,2,COMPLETE
1078,0.5192168157400218,2025-03-03 19:30:44.515383,2025-03-03 19:30:44.707514,0 days 00:00:00.192131,kmeans,abundance,2.2,2,COMPLETE
1079,0.5340152879265428,2025-03-03 19:30:44.709499,2025-03-03 19:30:44.907191,0 days 00:00:00.197692,gaussian_mixture,abundance,2.3000000000000003,2,COMPLETE
1080,0.38913685606332404,2025-03-03 19:30:44.909200,2025-03-03 19:30:45.118392,0 days 00:00:00.209192,gaussian_mixture,abundance,2.1,2,COMPLETE
1081,0.611567189564887,2025-03-03 19:30:45.119403,2025-03-03 19:30:45.341520,0 days 00:00:00.222117,gaussian_mixture,abundance,2.25,2,COMPLETE
1082,0.5262013196765831,2025-03-03 19:30:45.342518,2025-03-03 19:30:45.545754,0 days 00:00:00.203236,gaussian_mixture,abundance,2.15,2,COMPLETE
1083,0.38691877841785793,2025-03-03 19:30:45.546754,2025-03-03 19:30:45.747596,0 days 00:00:00.200842,gaussian_mixture,abundance,2.2,2,COMPLETE
1084,0.2847942238418715,2025-03-03 19:30:45.748619,2025-03-03 19:30:45.950986,0 days 00:00:00.202367,gaussian_mixture,abundance,2.0500000000000003,2,COMPLETE
1085,0.538391432968081,2025-03-03 19:30:45.952790,2025-03-03 19:30:46.156361,0 days 00:00:00.203571,gaussian_mixture,abundance,2.3000000000000003,2,COMPLETE
1086,0.6065915153662704,2025-03-03 19:30:46.158005,2025-03-03 19:30:46.353314,0 days 00:00:00.195309,gaussian_mixture,abundance,2.45,2,COMPLETE
1087,0.2810263333682191,2025-03-03 19:30:46.354314,2025-03-03 19:30:46.571092,0 days 00:00:00.216778,gaussian_mixture,abundance,0.65,2,COMPLETE
1088,0.3253659369949385,2025-03-03 19:30:46.572092,2025-03-03 19:30:46.769385,0 days 00:00:00.197293,gaussian_mixture,abundance,2.15,2,COMPLETE
1089,0.5769196231542087,2025-03-03 19:30:46.771385,2025-03-03 19:30:46.971461,0 days 00:00:00.200076,gaussian_mixture,abundance,2.4000000000000004,2,COMPLETE
1090,0.535365427079225,2025-03-03 19:30:46.973261,2025-03-03 19:30:47.173894,0 days 00:00:00.200633,gaussian_mixture,abundance,2.25,2,COMPLETE
1091,0.34586342421615257,2025-03-03 19:30:47.174893,2025-03-03 19:30:47.387783,0 days 00:00:00.212890,gaussian_mixture,abundance,2.1,2,COMPLETE
1092,0.07008190543201184,2025-03-03 19:30:47.389588,2025-03-03 19:30:48.546237,0 days 00:00:01.156649,gaussian_mixture,presence,90.0,2,COMPLETE
1093,0.33839143296808094,2025-03-03 19:30:48.548237,2025-03-03 19:30:48.747563,0 days 00:00:00.199326,gaussian_mixture,abundance,2.2,2,COMPLETE
1094,0.5527361020382425,2025-03-03 19:30:48.749370,2025-03-03 19:30:48.946888,0 days 00:00:00.197518,gaussian_mixture,abundance,2.35,2,COMPLETE
1095,0.482895170085325,2025-03-03 19:30:48.947695,2025-03-03 19:30:49.153203,0 days 00:00:00.205508,gaussian_mixture,abundance,2.3000000000000003,4,COMPLETE
1096,0.6473718435242747,2025-03-03 19:30:49.154203,2025-03-03 19:30:49.356334,0 days 00:00:00.202131,gaussian_mixture,abundance,2.0500000000000003,2,COMPLETE
1097,0.4212997997278368,2025-03-03 19:30:49.357335,2025-03-03 19:30:49.563265,0 days 00:00:00.205930,kmeans,abundance,2.15,2,COMPLETE
1098,0.36637701249625504,2025-03-03 19:30:49.564264,2025-03-03 19:30:49.788277,0 days 00:00:00.224013,gaussian_mixture,abundance,0.75,2,COMPLETE
1099,0.5344078981265337,2025-03-03 19:30:49.789277,2025-03-03 19:30:49.987884,0 days 00:00:00.198607,gaussian_mixture,abundance,2.25,2,COMPLETE
1100,0.7171740049356445,2025-03-03 19:30:49.988688,2025-03-03 19:30:50.193280,0 days 00:00:00.204592,gaussian_mixture,abundance,2.2,2,COMPLETE
1101,0.5370462256441575,2025-03-03 19:30:50.194275,2025-03-03 19:30:50.394791,0 days 00:00:00.200516,gaussian_mixture,abundance,2.25,2,COMPLETE
1102,0.4338971631528916,2025-03-03 19:30:50.396596,2025-03-03 19:30:50.599130,0 days 00:00:00.202534,gaussian_mixture,abundance,2.2,2,COMPLETE
1103,0.5936670676615192,2025-03-03 19:30:50.600130,2025-03-03 19:30:50.802454,0 days 00:00:00.202324,gaussian_mixture,abundance,2.2,2,COMPLETE
1104,0.3833824605831657,2025-03-03 19:30:50.804261,2025-03-03 19:30:51.004553,0 days 00:00:00.200292,gaussian_mixture,abundance,2.3000000000000003,2,COMPLETE
1105,0.5691169393529935,2025-03-03 19:30:51.005554,2025-03-03 19:30:51.212132,0 days 00:00:00.206578,gaussian_mixture,abundance,2.25,2,COMPLETE
1106,0.7171740049356445,2025-03-03 19:30:51.213129,2025-03-03 19:30:51.420262,0 days 00:00:00.207133,gaussian_mixture,abundance,2.35,2,COMPLETE
1107,0.42950459918795775,2025-03-03 19:30:51.422260,2025-03-03 19:30:51.635734,0 days 00:00:00.213474,gaussian_mixture,abundance,2.4000000000000004,2,COMPLETE
1108,0.618587408879508,2025-03-03 19:30:51.636735,2025-03-03 19:30:51.844908,0 days 00:00:00.208173,gaussian_mixture,abundance,2.3000000000000003,3,COMPLETE
1109,0.6555877495959652,2025-03-03 19:30:51.845906,2025-03-03 19:30:52.043421,0 days 00:00:00.197515,gaussian_mixture,abundance,2.45,2,COMPLETE
1110,0.7296597712096574,2025-03-03 19:30:52.044417,2025-03-03 19:30:52.246577,0 days 00:00:00.202160,gaussian_mixture,abundance,2.4000000000000004,2,COMPLETE
1111,0.43296797785514346,2025-03-03 19:30:52.247574,2025-03-03 19:30:52.458796,0 days 00:00:00.211222,gaussian_mixture,abundance,2.4000000000000004,2,COMPLETE
1112,0.019374193509161728,2025-03-03 19:30:52.460794,2025-03-03 19:30:53.803273,0 days 00:00:01.342479,gaussian_mixture,presence,10.0,2,COMPLETE
1113,0.6555877495959652,2025-03-03 19:30:53.805278,2025-03-03 19:30:54.007358,0 days 00:00:00.202080,gaussian_mixture,abundance,2.45,2,COMPLETE
1114,0.38900769899215537,2025-03-03 19:30:54.008353,2025-03-03 19:30:54.205392,0 days 00:00:00.197039,gaussian_mixture,abundance,2.45,2,COMPLETE
1115,0.4600973349745888,2025-03-03 19:30:54.206394,2025-03-03 19:30:54.416021,0 days 00:00:00.209627,gaussian_mixture,abundance,2.4000000000000004,2,COMPLETE
1116,0.7171740049356445,2025-03-03 19:30:54.417029,2025-03-03 19:30:54.649651,0 days 00:00:00.232622,gaussian_mixture,abundance,2.4000000000000004,2,COMPLETE
1117,0.2595104228281941,2025-03-03 19:30:54.650652,2025-03-03 19:30:54.842357,0 days 00:00:00.191705,kmeans,abundance,2.45,2,COMPLETE
1118,0.2834742265925284,2025-03-03 19:30:54.843349,2025-03-03 19:30:55.041077,0 days 00:00:00.197728,gaussian_mixture,abundance,2.45,2,COMPLETE
1119,0.45389540416445157,2025-03-03 19:30:55.042073,2025-03-03 19:30:55.238344,0 days 00:00:00.196271,gaussian_mixture,abundance,2.5,2,COMPLETE
1120,0.44680259286319624,2025-03-03 19:30:55.240349,2025-03-03 19:30:55.438743,0 days 00:00:00.198394,gaussian_mixture,abundance,2.4000000000000004,2,COMPLETE
1121,0.6154219408143303,2025-03-03 19:30:55.439744,2025-03-03 19:30:55.638436,0 days 00:00:00.198692,gaussian_mixture,abundance,2.5,2,COMPLETE
1122,0.5195557369559369,2025-03-03 19:30:55.639437,2025-03-03 19:30:55.853054,0 days 00:00:00.213617,gaussian_mixture,abundance,2.4000000000000004,5,COMPLETE
1123,0.4234680759365553,2025-03-03 19:30:55.855331,2025-03-03 19:30:56.073295,0 days 00:00:00.217964,gaussian_mixture,abundance,2.35,6,COMPLETE
1124,0.47007354240740123,2025-03-03 19:30:56.074297,2025-03-03 19:30:56.272994,0 days 00:00:00.198697,gaussian_mixture,abundance,2.5,2,COMPLETE
1125,0.6028421761239852,2025-03-03 19:30:56.274798,2025-03-03 19:30:56.472960,0 days 00:00:00.198162,gaussian_mixture,abundance,2.45,2,COMPLETE
1126,0.4684510103260663,2025-03-03 19:30:56.474958,2025-03-03 19:30:56.677044,0 days 00:00:00.202086,gaussian_mixture,abundance,2.4000000000000004,2,COMPLETE
1127,0.268241634363719,2025-03-03 19:30:56.678068,2025-03-03 19:30:56.879623,0 days 00:00:00.201555,gaussian_mixture,abundance,2.35,2,COMPLETE
1128,0.44978200096081133,2025-03-03 19:30:56.881619,2025-03-03 19:30:57.087021,0 days 00:00:00.205402,gaussian_mixture,abundance,2.35,2,COMPLETE
1129,0.2280730365109677,2025-03-03 19:30:57.088034,2025-03-03 19:30:57.288156,0 days 00:00:00.200122,gaussian_mixture,abundance,2.5,2,COMPLETE
1130,0.016654031625691,2025-03-03 19:30:57.289149,2025-03-03 19:30:58.641721,0 days 00:00:01.352572,gaussian_mixture,presence,10.0,2,COMPLETE
1131,0.6478607144958144,2025-03-03 19:30:58.642723,2025-03-03 19:30:58.849515,0 days 00:00:00.206792,gaussian_mixture,abundance,2.4000000000000004,2,COMPLETE
1132,0.5137251186729772,2025-03-03 19:30:58.850517,2025-03-03 19:30:59.053163,0 days 00:00:00.202646,gaussian_mixture,abundance,2.45,2,COMPLETE
1133,0.5491639319455223,2025-03-03 19:30:59.054166,2025-03-03 19:30:59.263855,0 days 00:00:00.209689,gaussian_mixture,abundance,1.4500000000000002,2,COMPLETE
1134,0.36699895403153093,2025-03-03 19:30:59.265868,2025-03-03 19:30:59.462961,0 days 00:00:00.197093,gaussian_mixture,abundance,2.35,2,COMPLETE
1135,0.5012992954882113,2025-03-03 19:30:59.464952,2025-03-03 19:30:59.667076,0 days 00:00:00.202124,gaussian_mixture,abundance,2.35,2,COMPLETE
1136,0.5761367536970724,2025-03-03 19:30:59.668078,2025-03-03 19:30:59.863111,0 days 00:00:00.195033,kmeans,abundance,2.5,2,COMPLETE
1137,0.47279360787870217,2025-03-03 19:30:59.864114,2025-03-03 19:31:00.082210,0 days 00:00:00.218096,gaussian_mixture,abundance,2.4000000000000004,3,COMPLETE
1138,0.6088799197006685,2025-03-03 19:31:00.083215,2025-03-03 19:31:00.304502,0 days 00:00:00.221287,gaussian_mixture,abundance,2.35,2,COMPLETE
1139,0.5372411554306852,2025-03-03 19:31:00.306502,2025-03-03 19:31:00.507686,0 days 00:00:00.201184,gaussian_mixture,abundance,2.45,2,COMPLETE
1140,0.2092294006949876,2025-03-03 19:31:00.509678,2025-03-03 19:31:00.711463,0 days 00:00:00.201785,gaussian_mixture,abundance,2.35,2,COMPLETE
1141,0.543649299468974,2025-03-03 19:31:00.712464,2025-03-03 19:31:00.928761,0 days 00:00:00.216297,gaussian_mixture,abundance,1.05,2,COMPLETE
1142,0.4007205379181319,2025-03-03 19:31:00.930745,2025-03-03 19:31:01.132174,0 days 00:00:00.201429,gaussian_mixture,abundance,2.4000000000000004,2,COMPLETE
1143,0.48958220359490195,2025-03-03 19:31:01.133176,2025-03-03 19:31:01.338468,0 days 00:00:00.205292,gaussian_mixture,abundance,2.5,2,COMPLETE
1144,0.37537131710190347,2025-03-03 19:31:01.340274,2025-03-03 19:31:01.540714,0 days 00:00:00.200440,gaussian_mixture,abundance,2.35,2,COMPLETE
1145,0.6282619979114271,2025-03-03 19:31:01.542704,2025-03-03 19:31:01.744983,0 days 00:00:00.202279,gaussian_mixture,abundance,2.45,2,COMPLETE
1146,0.5183328686473375,2025-03-03 19:31:01.746976,2025-03-03 19:31:01.955014,0 days 00:00:00.208038,gaussian_mixture,abundance,2.3000000000000003,2,COMPLETE
1147,0.4864593100776859,2025-03-03 19:31:01.957012,2025-03-03 19:31:02.160263,0 days 00:00:00.203251,gaussian_mixture,abundance,2.3000000000000003,2,COMPLETE
1148,0.5169475673575634,2025-03-03 19:31:02.161267,2025-03-03 19:31:02.377621,0 days 00:00:00.216354,gaussian_mixture,abundance,2.4000000000000004,2,COMPLETE
1149,0.010135740924917425,2025-03-03 19:31:02.379134,2025-03-03 19:31:03.702942,0 days 00:00:01.323808,gaussian_mixture,presence,10.0,2,COMPLETE
1150,0.3386551193984749,2025-03-03 19:31:03.703945,2025-03-03 19:31:03.907235,0 days 00:00:00.203290,gaussian_mixture,abundance,2.35,2,COMPLETE
1151,0.4665981444596389,2025-03-03 19:31:03.908239,2025-03-03 19:31:04.111551,0 days 00:00:00.203312,gaussian_mixture,abundance,2.5500000000000003,2,COMPLETE
1152,0.37589154770882194,2025-03-03 19:31:04.112551,2025-03-03 19:31:04.315527,0 days 00:00:00.202976,gaussian_mixture,abundance,2.3000000000000003,2,COMPLETE
1153,0.11018855429356474,2025-03-03 19:31:04.316528,2025-03-03 19:31:04.529936,0 days 00:00:00.213408,gaussian_mixture,abundance,2.45,2,COMPLETE
1154,0.47045055991243767,2025-03-03 19:31:04.531116,2025-03-03 19:31:04.746576,0 days 00:00:00.215460,gaussian_mixture,abundance,2.35,2,COMPLETE
1155,0.4768864580217273,2025-03-03 19:31:04.748576,2025-03-03 19:31:04.981505,0 days 00:00:00.232929,kmeans,abundance,2.5500000000000003,2,COMPLETE
1156,0.4875876297961687,2025-03-03 19:31:04.983498,2025-03-03 19:31:05.185213,0 days 00:00:00.201715,gaussian_mixture,abundance,2.4000000000000004,2,COMPLETE
1157,0.45906056430717584,2025-03-03 19:31:05.187743,2025-03-03 19:31:05.386833,0 days 00:00:00.199090,gaussian_mixture,abundance,2.5,2,COMPLETE
1158,0.4849619396266795,2025-03-03 19:31:05.387855,2025-03-03 19:31:05.592182,0 days 00:00:00.204327,gaussian_mixture,abundance,2.3000000000000003,2,COMPLETE
1159,0.44036964041486454,2025-03-03 19:31:05.593175,2025-03-03 19:31:05.799299,0 days 00:00:00.206124,gaussian_mixture,abundance,2.25,2,COMPLETE
1160,0.6071264680960488,2025-03-03 19:31:05.801285,2025-03-03 19:31:06.003821,0 days 00:00:00.202536,gaussian_mixture,abundance,2.4000000000000004,2,COMPLETE
1161,0.47916503343468014,2025-03-03 19:31:06.004816,2025-03-03 19:31:06.217168,0 days 00:00:00.212352,gaussian_mixture,abundance,2.15,4,COMPLETE
1162,0.48519989731768787,2025-03-03 19:31:06.218169,2025-03-03 19:31:06.426411,0 days 00:00:00.208242,gaussian_mixture,abundance,2.35,2,COMPLETE
1163,0.5208641039139152,2025-03-03 19:31:06.427405,2025-03-03 19:31:06.637249,0 days 00:00:00.209844,gaussian_mixture,abundance,2.45,2,COMPLETE
1164,0.3266955920469886,2025-03-03 19:31:06.639520,2025-03-03 19:31:06.847941,0 days 00:00:00.208421,gaussian_mixture,abundance,2.25,2,COMPLETE
1165,0.617102739379263,2025-03-03 19:31:06.849521,2025-03-03 19:31:07.055332,0 days 00:00:00.205811,gaussian_mixture,abundance,2.3000000000000003,2,COMPLETE
1166,0.6872212765482711,2025-03-03 19:31:07.056965,2025-03-03 19:31:07.259040,0 days 00:00:00.202075,gaussian_mixture,abundance,2.5,2,COMPLETE
1167,0.6170326174423562,2025-03-03 19:31:07.261042,2025-03-03 19:31:07.465302,0 days 00:00:00.204260,gaussian_mixture,abundance,2.1,2,COMPLETE
1168,0.07253890282081242,2025-03-03 19:31:07.467294,2025-03-03 19:31:08.793581,0 days 00:00:01.326287,gaussian_mixture,presence,15.0,2,COMPLETE
1169,0.5562115096426888,2025-03-03 19:31:08.795779,2025-03-03 19:31:09.001522,0 days 00:00:00.205743,gaussian_mixture,abundance,2.15,2,COMPLETE
1170,0.43811178424414765,2025-03-03 19:31:09.003522,2025-03-03 19:31:09.209616,0 days 00:00:00.206094,gaussian_mixture,abundance,1.6,2,COMPLETE
1171,0.617907986108441,2025-03-03 19:31:09.210619,2025-03-03 19:31:09.414021,0 days 00:00:00.203402,gaussian_mixture,abundance,2.25,2,COMPLETE
1172,0.36288555082789065,2025-03-03 19:31:09.416017,2025-03-03 19:31:09.617629,0 days 00:00:00.201612,gaussian_mixture,abundance,2.35,2,COMPLETE
1173,0.2919474671880754,2025-03-03 19:31:09.618634,2025-03-03 19:31:09.821279,0 days 00:00:00.202645,gaussian_mixture,abundance,2.2,2,COMPLETE
1174,0.3982933265082119,2025-03-03 19:31:09.822280,2025-03-03 19:31:10.018829,0 days 00:00:00.196549,kmeans,abundance,2.45,2,COMPLETE
1175,0.46771739471574303,2025-03-03 19:31:10.020830,2025-03-03 19:31:10.225928,0 days 00:00:00.205098,gaussian_mixture,abundance,2.1,2,COMPLETE
1176,0.5235485304925109,2025-03-03 19:31:10.227922,2025-03-03 19:31:10.436796,0 days 00:00:00.208874,gaussian_mixture,abundance,2.3000000000000003,2,COMPLETE
1177,0.5286016495770394,2025-03-03 19:31:10.437529,2025-03-03 19:31:10.641609,0 days 00:00:00.204080,gaussian_mixture,abundance,2.15,2,COMPLETE
1178,0.4319550022517705,2025-03-03 19:31:10.642608,2025-03-03 19:31:10.850928,0 days 00:00:00.208320,gaussian_mixture,abundance,2.25,2,COMPLETE
1179,0.3606928720254581,2025-03-03 19:31:10.851917,2025-03-03 19:31:11.061660,0 days 00:00:00.209743,gaussian_mixture,abundance,2.4000000000000004,2,COMPLETE
1180,0.6555302880172329,2025-03-03 19:31:11.062463,2025-03-03 19:31:11.270544,0 days 00:00:00.208081,gaussian_mixture,abundance,2.2,2,COMPLETE
1181,0.38562243507885674,2025-03-03 19:31:11.271543,2025-03-03 19:31:11.476218,0 days 00:00:00.204675,gaussian_mixture,abundance,2.15,2,COMPLETE
1182,0.4352941615228433,2025-03-03 19:31:11.477220,2025-03-03 19:31:11.679640,0 days 00:00:00.202420,gaussian_mixture,abundance,2.3000000000000003,2,COMPLETE
1183,0.49188545187361077,2025-03-03 19:31:11.680646,2025-03-03 19:31:11.887233,0 days 00:00:00.206587,gaussian_mixture,abundance,2.2,2,COMPLETE
1184,0.5622952840097575,2025-03-03 19:31:11.888232,2025-03-03 19:31:12.091495,0 days 00:00:00.203263,gaussian_mixture,abundance,2.5500000000000003,2,COMPLETE
