number,value,datetime_start,datetime_complete,duration,params_algorithm,params_filter_criteria,params_filter_threshold,params_k,state
2662,0.48753462829878635,2025-03-03 19:38:25.097987,2025-03-03 19:38:25.344092,0 days 00:00:00.246105,gaussian_mixture,abundance,2.6,2,COMPLETE
2663,0.5697570961027484,2025-03-03 19:38:25.346109,2025-03-03 19:38:25.601257,0 days 00:00:00.255148,gaussian_mixture,abundance,2.0,2,COMPLETE
2664,0.5797659209720271,2025-03-03 19:38:25.603056,2025-03-03 19:38:25.849625,0 days 00:00:00.246569,gaussian_mixture,abundance,2.35,2,COMPLETE
2665,0.3556077546152229,2025-03-03 19:38:25.851625,2025-03-03 19:38:26.094162,0 days 00:00:00.242537,kmeans,abundance,2.4000000000000004,2,COMPLETE
2666,0.4732903403060412,2025-03-03 19:38:26.095155,2025-03-03 19:38:26.363474,0 days 00:00:00.268319,gaussian_mixture,abundance,2.0500000000000003,2,COMPLETE
2667,0.5671938838180586,2025-03-03 19:38:26.366265,2025-03-03 19:38:26.614377,0 days 00:00:00.248112,gaussian_mixture,abundance,2.45,2,COMPLETE
2668,0.6106859005754641,2025-03-03 19:38:26.616374,2025-03-03 19:38:26.862816,0 days 00:00:00.246442,gaussian_mixture,abundance,2.3000000000000003,2,COMPLETE
2669,0.6634017623408495,2025-03-03 19:38:26.864814,2025-03-03 19:38:27.118447,0 days 00:00:00.253633,gaussian_mixture,abundance,2.35,2,COMPLETE
2670,0.476120967007662,2025-03-03 19:38:27.119446,2025-03-03 19:38:27.363881,0 days 00:00:00.244435,gaussian_mixture,abundance,2.0500000000000003,2,COMPLETE
2671,0.4483429159954471,2025-03-03 19:38:27.365892,2025-03-03 19:38:27.615051,0 days 00:00:00.249159,gaussian_mixture,abundance,2.35,2,COMPLETE
2672,0.18838360755704314,2025-03-03 19:38:27.616050,2025-03-03 19:38:27.864638,0 days 00:00:00.248588,gaussian_mixture,abundance,2.5,2,COMPLETE
2673,0.5581434607424189,2025-03-03 19:38:27.866649,2025-03-03 19:38:28.112860,0 days 00:00:00.246211,gaussian_mixture,abundance,2.3000000000000003,2,COMPLETE
2674,0.6162400294335308,2025-03-03 19:38:28.114859,2025-03-03 19:38:28.377914,0 days 00:00:00.263055,gaussian_mixture,abundance,2.0,2,COMPLETE
2675,0.4211188238784297,2025-03-03 19:38:28.380924,2025-03-03 19:38:28.637958,0 days 00:00:00.257034,gaussian_mixture,abundance,1.05,2,COMPLETE
2676,0.42721764542837326,2025-03-03 19:38:28.639955,2025-03-03 19:38:28.893824,0 days 00:00:00.253869,gaussian_mixture,abundance,2.3000000000000003,2,COMPLETE
2677,0.006560461197038408,2025-03-03 19:38:28.895830,2025-03-03 19:38:30.306212,0 days 00:00:01.410382,gaussian_mixture,presence,10.0,2,COMPLETE
2678,0.4640238717842006,2025-03-03 19:38:30.308226,2025-03-03 19:38:30.569925,0 days 00:00:00.261699,gaussian_mixture,abundance,2.4000000000000004,2,COMPLETE
2679,0.4901597237867298,2025-03-03 19:38:30.570923,2025-03-03 19:38:30.821082,0 days 00:00:00.250159,gaussian_mixture,abundance,1.85,2,COMPLETE
2680,0.5265099337901129,2025-03-03 19:38:30.823081,2025-03-03 19:38:31.076482,0 days 00:00:00.253401,gaussian_mixture,abundance,1.75,2,COMPLETE
2681,0.5660572075958697,2025-03-03 19:38:31.077481,2025-03-03 19:38:31.326624,0 days 00:00:00.249143,gaussian_mixture,abundance,2.25,2,COMPLETE
2682,0.5578730815577974,2025-03-03 19:38:31.328636,2025-03-03 19:38:31.575287,0 days 00:00:00.246651,gaussian_mixture,abundance,2.0500000000000003,2,COMPLETE
2683,0.5024429026252963,2025-03-03 19:38:31.577287,2025-03-03 19:38:31.815887,0 days 00:00:00.238600,kmeans,abundance,2.5,2,COMPLETE
2684,0.36466904207376544,2025-03-03 19:38:31.816886,2025-03-03 19:38:32.072015,0 days 00:00:00.255129,gaussian_mixture,abundance,2.1,2,COMPLETE
2685,0.6224695185114969,2025-03-03 19:38:32.074016,2025-03-03 19:38:32.321229,0 days 00:00:00.247213,gaussian_mixture,abundance,2.35,2,COMPLETE
2686,0.4192824691145306,2025-03-03 19:38:32.322229,2025-03-03 19:38:32.574259,0 days 00:00:00.252030,gaussian_mixture,abundance,2.25,2,COMPLETE
2687,0.6227312618120411,2025-03-03 19:38:32.575963,2025-03-03 19:38:32.832277,0 days 00:00:00.256314,gaussian_mixture,abundance,2.45,2,COMPLETE
2688,0.4821914582230706,2025-03-03 19:38:32.834290,2025-03-03 19:38:33.108746,0 days 00:00:00.274456,gaussian_mixture,abundance,2.4000000000000004,3,COMPLETE
2689,0.595677718823763,2025-03-03 19:38:33.110759,2025-03-03 19:38:33.364350,0 days 00:00:00.253591,gaussian_mixture,abundance,1.9500000000000002,2,COMPLETE
2690,0.5391642109656201,2025-03-03 19:38:33.366347,2025-03-03 19:38:33.616453,0 days 00:00:00.250106,gaussian_mixture,abundance,2.3000000000000003,2,COMPLETE
2691,0.11989541037009244,2025-03-03 19:38:33.618464,2025-03-03 19:38:33.982062,0 days 00:00:00.363598,gaussian_mixture,abundance,0.15000000000000002,2,COMPLETE
2692,0.6960384751202662,2025-03-03 19:38:33.985079,2025-03-03 19:38:34.248880,0 days 00:00:00.263801,gaussian_mixture,abundance,2.25,2,COMPLETE
2693,0.5366597279496125,2025-03-03 19:38:34.250894,2025-03-03 19:38:34.501050,0 days 00:00:00.250156,gaussian_mixture,abundance,2.1,2,COMPLETE
2694,0.5602919833714213,2025-03-03 19:38:34.503062,2025-03-03 19:38:34.762362,0 days 00:00:00.259300,gaussian_mixture,abundance,2.0500000000000003,2,COMPLETE
2695,0.4528045934276667,2025-03-03 19:38:34.764527,2025-03-03 19:38:35.016704,0 days 00:00:00.252177,gaussian_mixture,abundance,2.2,2,COMPLETE
2696,0.02958086808004643,2025-03-03 19:38:35.018707,2025-03-03 19:38:36.359925,0 days 00:00:01.341218,gaussian_mixture,presence,15.0,2,COMPLETE
2697,0.397180965449463,2025-03-03 19:38:36.361938,2025-03-03 19:38:36.606693,0 days 00:00:00.244755,gaussian_mixture,abundance,2.3000000000000003,2,COMPLETE
2698,0.5401707209632723,2025-03-03 19:38:36.608706,2025-03-03 19:38:36.858666,0 days 00:00:00.249960,gaussian_mixture,abundance,2.35,2,COMPLETE
2699,0.4087736565674832,2025-03-03 19:38:36.860998,2025-03-03 19:38:37.125296,0 days 00:00:00.264298,gaussian_mixture,abundance,2.45,2,COMPLETE
2700,0.4045711475164415,2025-03-03 19:38:37.127308,2025-03-03 19:38:37.371506,0 days 00:00:00.244198,gaussian_mixture,abundance,2.15,2,COMPLETE
2701,0.5939288109620635,2025-03-03 19:38:37.373517,2025-03-03 19:38:37.636465,0 days 00:00:00.262948,gaussian_mixture,abundance,2.5500000000000003,2,COMPLETE
2702,0.32151938871739266,2025-03-03 19:38:37.638477,2025-03-03 19:38:37.912172,0 days 00:00:00.273695,gaussian_mixture,abundance,2.25,2,COMPLETE
2703,0.512700968262762,2025-03-03 19:38:37.914184,2025-03-03 19:38:38.158494,0 days 00:00:00.244310,kmeans,abundance,2.0,2,COMPLETE
2704,0.31848358071765015,2025-03-03 19:38:38.160506,2025-03-03 19:38:38.409147,0 days 00:00:00.248641,gaussian_mixture,abundance,2.1,2,COMPLETE
2705,0.16288555082789066,2025-03-03 19:38:38.411160,2025-03-03 19:38:38.654745,0 days 00:00:00.243585,gaussian_mixture,abundance,2.15,2,COMPLETE
2706,0.45169188824979284,2025-03-03 19:38:38.656743,2025-03-03 19:38:38.907456,0 days 00:00:00.250713,gaussian_mixture,abundance,2.4000000000000004,2,COMPLETE
2707,0.44467292617130855,2025-03-03 19:38:38.909468,2025-03-03 19:38:39.172646,0 days 00:00:00.263178,gaussian_mixture,abundance,2.3000000000000003,2,COMPLETE
2708,0.5814422634522156,2025-03-03 19:38:39.174643,2025-03-03 19:38:39.425725,0 days 00:00:00.251082,gaussian_mixture,abundance,2.2,2,COMPLETE
2709,0.3936670676615192,2025-03-03 19:38:39.427739,2025-03-03 19:38:39.682308,0 days 00:00:00.254569,gaussian_mixture,abundance,2.25,2,COMPLETE
2710,0.636365025372317,2025-03-03 19:38:39.684309,2025-03-03 19:38:39.933717,0 days 00:00:00.249408,gaussian_mixture,abundance,1.9500000000000002,2,COMPLETE
2711,0.5453035330822521,2025-03-03 19:38:39.935729,2025-03-03 19:38:40.196392,0 days 00:00:00.260663,gaussian_mixture,abundance,2.1,2,COMPLETE
2712,0.5047550606373017,2025-03-03 19:38:40.198389,2025-03-03 19:38:40.448970,0 days 00:00:00.250581,gaussian_mixture,abundance,2.35,2,COMPLETE
2713,0.37468864657740897,2025-03-03 19:38:40.450970,2025-03-03 19:38:40.708059,0 days 00:00:00.257089,gaussian_mixture,abundance,1.35,2,COMPLETE
2714,0.014042047862136867,2025-03-03 19:38:40.710060,2025-03-03 19:38:42.200466,0 days 00:00:01.490406,gaussian_mixture,presence,10.0,2,COMPLETE
2715,0.6012745086423565,2025-03-03 19:38:42.202479,2025-03-03 19:38:42.466735,0 days 00:00:00.264256,gaussian_mixture,abundance,1.9000000000000001,2,COMPLETE
2716,0.26605068042561003,2025-03-03 19:38:42.467748,2025-03-03 19:38:42.734061,0 days 00:00:00.266313,gaussian_mixture,abundance,2.2,2,COMPLETE
2717,0.5282176788015046,2025-03-03 19:38:42.736079,2025-03-03 19:38:43.003209,0 days 00:00:00.267130,gaussian_mixture,abundance,2.5,3,COMPLETE
2718,0.2763715032620988,2025-03-03 19:38:43.005220,2025-03-03 19:38:43.308278,0 days 00:00:00.303058,gaussian_mixture,abundance,0.55,2,COMPLETE
2719,0.4029940190575755,2025-03-03 19:38:43.310339,2025-03-03 19:38:43.573265,0 days 00:00:00.262926,gaussian_mixture,abundance,2.0500000000000003,2,COMPLETE
2720,0.414759849330415,2025-03-03 19:38:43.575277,2025-03-03 19:38:43.816163,0 days 00:00:00.240886,kmeans,abundance,2.4000000000000004,2,COMPLETE
2721,0.4397896299800058,2025-03-03 19:38:43.817163,2025-03-03 19:38:44.084303,0 days 00:00:00.267140,gaussian_mixture,abundance,2.15,4,COMPLETE
2722,0.5033570476430034,2025-03-03 19:38:44.085818,2025-03-03 19:38:44.335687,0 days 00:00:00.249869,gaussian_mixture,abundance,2.35,2,COMPLETE
2723,0.44806036973716534,2025-03-03 19:38:44.337697,2025-03-03 19:38:44.601499,0 days 00:00:00.263802,gaussian_mixture,abundance,2.3000000000000003,2,COMPLETE
2724,0.3741631586419206,2025-03-03 19:38:44.602500,2025-03-03 19:38:44.873106,0 days 00:00:00.270606,gaussian_mixture,abundance,2.25,6,COMPLETE
2725,0.5132878332896693,2025-03-03 19:38:44.875117,2025-03-03 19:38:45.134535,0 days 00:00:00.259418,gaussian_mixture,abundance,2.2,2,COMPLETE
2726,0.5065810548214944,2025-03-03 19:38:45.136533,2025-03-03 19:38:45.432370,0 days 00:00:00.295837,gaussian_mixture,abundance,2.1,2,COMPLETE
2727,0.5523509813424887,2025-03-03 19:38:45.434373,2025-03-03 19:38:45.704250,0 days 00:00:00.269877,gaussian_mixture,abundance,2.4000000000000004,2,COMPLETE
2728,0.5737886928821221,2025-03-03 19:38:45.706247,2025-03-03 19:38:45.970669,0 days 00:00:00.264422,gaussian_mixture,abundance,2.45,2,COMPLETE
2729,0.45614024408630716,2025-03-03 19:38:45.971668,2025-03-03 19:38:46.246960,0 days 00:00:00.275292,gaussian_mixture,abundance,2.15,2,COMPLETE
2730,0.32835202510279415,2025-03-03 19:38:46.248959,2025-03-03 19:38:46.500561,0 days 00:00:00.251602,gaussian_mixture,abundance,2.3000000000000003,2,COMPLETE
2731,0.5374834124006875,2025-03-03 19:38:46.501562,2025-03-03 19:38:46.754797,0 days 00:00:00.253235,gaussian_mixture,abundance,2.25,2,COMPLETE
2732,0.438578221462061,2025-03-03 19:38:46.756793,2025-03-03 19:38:47.043158,0 days 00:00:00.286365,gaussian_mixture,abundance,2.0,2,COMPLETE
2733,0.069255926222847,2025-03-03 19:38:47.045137,2025-03-03 19:38:48.430911,0 days 00:00:01.385774,gaussian_mixture,presence,25.0,2,COMPLETE
2734,0.507143641838466,2025-03-03 19:38:48.432916,2025-03-03 19:38:48.689983,0 days 00:00:00.257067,gaussian_mixture,abundance,2.0500000000000003,2,COMPLETE
2735,0.05153317530307565,2025-03-03 19:38:48.690985,2025-03-03 19:38:48.942316,0 days 00:00:00.251331,gaussian_mixture,abundance,2.2,2,COMPLETE
2736,0.2653518746921281,2025-03-03 19:38:48.944323,2025-03-03 19:38:49.198556,0 days 00:00:00.254233,gaussian_mixture,abundance,2.35,2,COMPLETE
2737,0.4765230386008339,2025-03-03 19:38:49.199559,2025-03-03 19:38:49.453718,0 days 00:00:00.254159,gaussian_mixture,abundance,2.1,2,COMPLETE
2738,0.5893297407271572,2025-03-03 19:38:49.455717,2025-03-03 19:38:49.707322,0 days 00:00:00.251605,gaussian_mixture,abundance,2.25,2,COMPLETE
2739,0.4917177012051299,2025-03-03 19:38:49.709319,2025-03-03 19:38:49.975122,0 days 00:00:00.265803,kmeans,abundance,1.8,2,COMPLETE
2740,0.4106709061778561,2025-03-03 19:38:49.976120,2025-03-03 19:38:50.226701,0 days 00:00:00.250581,gaussian_mixture,abundance,2.15,2,COMPLETE
2741,0.39666555029494327,2025-03-03 19:38:50.228694,2025-03-03 19:38:50.477382,0 days 00:00:00.248688,gaussian_mixture,abundance,2.35,2,COMPLETE
2742,0.48427716887647315,2025-03-03 19:38:50.479392,2025-03-03 19:38:50.725992,0 days 00:00:00.246600,gaussian_mixture,abundance,2.5,2,COMPLETE
2743,0.33224531720247136,2025-03-03 19:38:50.727981,2025-03-03 19:38:50.978241,0 days 00:00:00.250260,gaussian_mixture,abundance,2.2,2,COMPLETE
2744,0.5219018042277954,2025-03-03 19:38:50.980260,2025-03-03 19:38:51.230018,0 days 00:00:00.249758,gaussian_mixture,abundance,2.3000000000000003,2,COMPLETE
2745,0.43554322172659166,2025-03-03 19:38:51.232017,2025-03-03 19:38:51.481906,0 days 00:00:00.249889,gaussian_mixture,abundance,2.0500000000000003,2,COMPLETE
2746,0.39438341795337556,2025-03-03 19:38:51.483904,2025-03-03 19:38:51.730497,0 days 00:00:00.246593,gaussian_mixture,abundance,2.4000000000000004,2,COMPLETE
2747,0.5562115096426888,2025-03-03 19:38:51.732496,2025-03-03 19:38:51.992933,0 days 00:00:00.260437,gaussian_mixture,abundance,2.15,2,COMPLETE
2748,0.3115853451418364,2025-03-03 19:38:51.995482,2025-03-03 19:38:52.251304,0 days 00:00:00.255822,gaussian_mixture,abundance,2.1,2,COMPLETE
2749,0.49734404057225595,2025-03-03 19:38:52.253302,2025-03-03 19:38:52.505888,0 days 00:00:00.252586,gaussian_mixture,abundance,1.9500000000000002,2,COMPLETE
2750,0.5629580719619316,2025-03-03 19:38:52.506887,2025-03-03 19:38:52.756426,0 days 00:00:00.249539,gaussian_mixture,abundance,2.25,2,COMPLETE
2751,0.29197512040787865,2025-03-03 19:38:52.757421,2025-03-03 19:38:53.006413,0 days 00:00:00.248992,gaussian_mixture,abundance,2.0,2,COMPLETE
2752,-0.009150470815442504,2025-03-03 19:38:53.007408,2025-03-03 19:38:54.414395,0 days 00:00:01.406987,gaussian_mixture,presence,10.0,2,COMPLETE
2753,0.3853853059616389,2025-03-03 19:38:54.416385,2025-03-03 19:38:54.661725,0 days 00:00:00.245340,gaussian_mixture,abundance,2.45,2,COMPLETE
2754,0.40514421886333984,2025-03-03 19:38:54.663715,2025-03-03 19:38:54.917592,0 days 00:00:00.253877,gaussian_mixture,abundance,2.15,2,COMPLETE
2755,0.541896391688432,2025-03-03 19:38:54.918588,2025-03-03 19:38:55.172515,0 days 00:00:00.253927,gaussian_mixture,abundance,2.3000000000000003,2,COMPLETE
2756,0.6170275269539653,2025-03-03 19:38:55.174512,2025-03-03 19:38:55.431122,0 days 00:00:00.256610,gaussian_mixture,abundance,2.2,2,COMPLETE
2757,0.42778162169809686,2025-03-03 19:38:55.433124,2025-03-03 19:38:55.689520,0 days 00:00:00.256396,gaussian_mixture,abundance,2.4000000000000004,2,COMPLETE
2758,0.35946278179381247,2025-03-03 19:38:55.690519,2025-03-03 19:38:55.943470,0 days 00:00:00.252951,kmeans,abundance,1.9000000000000001,5,COMPLETE
2759,0.450339399509048,2025-03-03 19:38:55.946465,2025-03-03 19:38:56.215155,0 days 00:00:00.268690,gaussian_mixture,abundance,2.1,2,COMPLETE
2760,0.48129218618680303,2025-03-03 19:38:56.217454,2025-03-03 19:38:56.481465,0 days 00:00:00.264011,gaussian_mixture,abundance,2.3000000000000003,2,COMPLETE
2761,0.6555302880172329,2025-03-03 19:38:56.483457,2025-03-03 19:38:56.745100,0 days 00:00:00.261643,gaussian_mixture,abundance,2.25,2,COMPLETE
2762,0.5202703414126029,2025-03-03 19:38:56.746097,2025-03-03 19:38:57.050755,0 days 00:00:00.304658,gaussian_mixture,abundance,2.2,2,COMPLETE
2763,0.6276255675565062,2025-03-03 19:38:57.052755,2025-03-03 19:38:57.323592,0 days 00:00:00.270837,gaussian_mixture,abundance,2.0500000000000003,2,COMPLETE
2764,0.3718024258015248,2025-03-03 19:38:57.325590,2025-03-03 19:38:57.590662,0 days 00:00:00.265072,gaussian_mixture,abundance,2.5500000000000003,2,COMPLETE
2765,0.3361128513560946,2025-03-03 19:38:57.592661,2025-03-03 19:38:57.854261,0 days 00:00:00.261600,gaussian_mixture,abundance,2.35,2,COMPLETE
2766,0.4652468899102167,2025-03-03 19:38:57.856259,2025-03-03 19:38:58.116428,0 days 00:00:00.260169,gaussian_mixture,abundance,2.2,2,COMPLETE
2767,0.33751289876770313,2025-03-03 19:38:58.118426,2025-03-03 19:38:58.386497,0 days 00:00:00.268071,gaussian_mixture,abundance,2.15,2,COMPLETE
2768,0.5322201647289051,2025-03-03 19:38:58.388102,2025-03-03 19:38:58.656399,0 days 00:00:00.268297,gaussian_mixture,abundance,2.25,2,COMPLETE
2769,0.5524976308662213,2025-03-03 19:38:58.658398,2025-03-03 19:38:58.911041,0 days 00:00:00.252643,gaussian_mixture,abundance,2.45,2,COMPLETE
2770,0.45356637036538183,2025-03-03 19:38:58.913040,2025-03-03 19:38:59.163903,0 days 00:00:00.250863,gaussian_mixture,abundance,2.35,2,COMPLETE
2771,0.04582068006051743,2025-03-03 19:38:59.165902,2025-03-03 19:39:00.591022,0 days 00:00:01.425120,gaussian_mixture,presence,10.0,2,COMPLETE
2772,0.41359693227108335,2025-03-03 19:39:00.593178,2025-03-03 19:39:00.850286,0 days 00:00:00.257108,gaussian_mixture,abundance,2.1,2,COMPLETE
2773,0.5129865098984934,2025-03-03 19:39:00.851289,2025-03-03 19:39:01.103112,0 days 00:00:00.251823,gaussian_mixture,abundance,2.3000000000000003,2,COMPLETE
2774,0.36772231317548904,2025-03-03 19:39:01.104120,2025-03-03 19:39:01.358812,0 days 00:00:00.254692,gaussian_mixture,abundance,2.15,2,COMPLETE
2775,0.3494288543909604,2025-03-03 19:39:01.360796,2025-03-03 19:39:01.624385,0 days 00:00:00.263589,gaussian_mixture,abundance,2.0,2,COMPLETE
2776,0.41492680894088796,2025-03-03 19:39:01.626389,2025-03-03 19:39:01.885787,0 days 00:00:00.259398,gaussian_mixture,abundance,2.2,2,COMPLETE
2777,0.43883264808804173,2025-03-03 19:39:01.886775,2025-03-03 19:39:02.147517,0 days 00:00:00.260742,gaussian_mixture,abundance,2.4000000000000004,2,COMPLETE
2778,0.38667432709307165,2025-03-03 19:39:02.149513,2025-03-03 19:39:02.403604,0 days 00:00:00.254091,kmeans,abundance,2.3000000000000003,2,COMPLETE
2779,0.5491886445750442,2025-03-03 19:39:02.406133,2025-03-03 19:39:02.667234,0 days 00:00:00.261101,gaussian_mixture,abundance,2.1,3,COMPLETE
2780,0.29141987166676264,2025-03-03 19:39:02.669227,2025-03-03 19:39:02.946475,0 days 00:00:00.277248,gaussian_mixture,abundance,2.25,2,COMPLETE
2781,0.5551624290478088,2025-03-03 19:39:02.948457,2025-03-03 19:39:03.214896,0 days 00:00:00.266439,gaussian_mixture,abundance,1.85,2,COMPLETE
2782,0.3870661045265716,2025-03-03 19:39:03.215888,2025-03-03 19:39:03.466058,0 days 00:00:00.250170,gaussian_mixture,abundance,2.45,2,COMPLETE
2783,0.4814270747796983,2025-03-03 19:39:03.467059,2025-03-03 19:39:03.744857,0 days 00:00:00.277798,gaussian_mixture,abundance,2.35,2,COMPLETE
2784,0.36401190535900835,2025-03-03 19:39:03.745854,2025-03-03 19:39:04.011628,0 days 00:00:00.265774,gaussian_mixture,abundance,2.0500000000000003,2,COMPLETE
2785,0.4521754088268347,2025-03-03 19:39:04.013629,2025-03-03 19:39:04.287073,0 days 00:00:00.273444,gaussian_mixture,abundance,2.25,2,COMPLETE
2786,0.5652564110527933,2025-03-03 19:39:04.288856,2025-03-03 19:39:04.556465,0 days 00:00:00.267609,gaussian_mixture,abundance,2.15,2,COMPLETE
2787,0.4890949132296251,2025-03-03 19:39:04.557462,2025-03-03 19:39:04.829338,0 days 00:00:00.271876,gaussian_mixture,abundance,2.2,2,COMPLETE
2788,0.44700563360153545,2025-03-03 19:39:04.830339,2025-03-03 19:39:05.115000,0 days 00:00:00.284661,gaussian_mixture,abundance,1.9500000000000002,2,COMPLETE
2789,0.4610043182066697,2025-03-03 19:39:05.115998,2025-03-03 19:39:05.408998,0 days 00:00:00.293000,gaussian_mixture,abundance,2.4000000000000004,2,COMPLETE
2790,0.05751750550872616,2025-03-03 19:39:05.410005,2025-03-03 19:39:06.861893,0 days 00:00:01.451888,gaussian_mixture,presence,45.0,2,COMPLETE
2791,0.470596648867332,2025-03-03 19:39:06.863896,2025-03-03 19:39:07.156453,0 days 00:00:00.292557,gaussian_mixture,abundance,2.1,2,COMPLETE
2792,0.23929215803083884,2025-03-03 19:39:07.158456,2025-03-03 19:39:07.404404,0 days 00:00:00.245948,gaussian_mixture,abundance,2.3000000000000003,2,COMPLETE
2793,0.6430983158829674,2025-03-03 19:39:07.406402,2025-03-03 19:39:07.657955,0 days 00:00:00.251553,gaussian_mixture,abundance,2.5,2,COMPLETE
2794,0.4377506617808028,2025-03-03 19:39:07.659955,2025-03-03 19:39:07.921619,0 days 00:00:00.261664,gaussian_mixture,abundance,1.2000000000000002,2,COMPLETE
2795,0.3396003099248718,2025-03-03 19:39:07.922613,2025-03-03 19:39:08.180610,0 days 00:00:00.257997,kmeans,abundance,1.75,5,COMPLETE
2796,0.529444108283639,2025-03-03 19:39:08.182606,2025-03-03 19:39:08.434805,0 days 00:00:00.252199,gaussian_mixture,abundance,2.15,2,COMPLETE
2797,0.5866194899643528,2025-03-03 19:39:08.435808,2025-03-03 19:39:08.690226,0 days 00:00:00.254418,gaussian_mixture,abundance,2.35,2,COMPLETE
2798,0.5474552985992324,2025-03-03 19:39:08.692031,2025-03-03 19:39:08.949924,0 days 00:00:00.257893,gaussian_mixture,abundance,2.6,2,COMPLETE
2799,0.37955295320404336,2025-03-03 19:39:08.951925,2025-03-03 19:39:09.237770,0 days 00:00:00.285845,gaussian_mixture,abundance,2.0,2,COMPLETE
2800,0.5001551720216997,2025-03-03 19:39:09.238764,2025-03-03 19:39:09.495593,0 days 00:00:00.256829,gaussian_mixture,abundance,2.2,2,COMPLETE
2801,0.46853500913225543,2025-03-03 19:39:09.496603,2025-03-03 19:39:09.754615,0 days 00:00:00.258012,gaussian_mixture,abundance,2.0500000000000003,2,COMPLETE
2802,0.585469212426957,2025-03-03 19:39:09.756610,2025-03-03 19:39:10.013185,0 days 00:00:00.256575,gaussian_mixture,abundance,2.25,2,COMPLETE
2803,0.3167972550554464,2025-03-03 19:39:10.014184,2025-03-03 19:39:10.331015,0 days 00:00:00.316831,gaussian_mixture,abundance,2.45,2,COMPLETE
2804,0.5179833876530182,2025-03-03 19:39:10.333015,2025-03-03 19:39:10.582103,0 days 00:00:00.249088,gaussian_mixture,abundance,2.15,2,COMPLETE
2805,0.5936670676615192,2025-03-03 19:39:10.584097,2025-03-03 19:39:10.838753,0 days 00:00:00.254656,gaussian_mixture,abundance,2.25,2,COMPLETE
2806,0.5256976995515477,2025-03-03 19:39:10.840753,2025-03-03 19:39:11.097845,0 days 00:00:00.257092,gaussian_mixture,abundance,2.35,3,COMPLETE
2807,0.5448990327911045,2025-03-03 19:39:11.099838,2025-03-03 19:39:11.367105,0 days 00:00:00.267267,gaussian_mixture,abundance,2.1,2,COMPLETE
2808,0.39640203338103974,2025-03-03 19:39:11.368757,2025-03-03 19:39:11.619559,0 days 00:00:00.250802,gaussian_mixture,abundance,2.3000000000000003,2,COMPLETE
2809,0.026696431825811984,2025-03-03 19:39:11.621558,2025-03-03 19:39:13.073561,0 days 00:00:01.452003,gaussian_mixture,presence,10.0,2,COMPLETE
