number,value,datetime_start,datetime_complete,duration,params_algorithm,params_filter_criteria,params_filter_threshold,params_k,state
4282,0.32433400335173784,2025-03-03 19:48:01.973992,2025-03-03 19:48:02.288302,0 days 00:00:00.314310,gaussian_mixture,abundance,2.15,2,COMPLETE
4283,0.37967965009207144,2025-03-03 19:48:02.290808,2025-03-03 19:48:02.601578,0 days 00:00:00.310770,gaussian_mixture,abundance,2.4000000000000004,2,COMPLETE
4284,0.6509159960668365,2025-03-03 19:48:02.603583,2025-03-03 19:48:02.918778,0 days 00:00:00.315195,gaussian_mixture,abundance,2.3000000000000003,2,COMPLETE
4285,0.553910538412778,2025-03-03 19:48:02.921787,2025-03-03 19:48:03.250082,0 days 00:00:00.328295,gaussian_mixture,abundance,2.0,5,COMPLETE
4286,0.5318845205302898,2025-03-03 19:48:03.252149,2025-03-03 19:48:03.579559,0 days 00:00:00.327410,gaussian_mixture,abundance,2.35,2,COMPLETE
4287,0.30161187190537475,2025-03-03 19:48:03.583603,2025-03-03 19:48:03.896228,0 days 00:00:00.312625,gaussian_mixture,abundance,1.9000000000000001,2,COMPLETE
4288,0.4509444497743056,2025-03-03 19:48:03.899223,2025-03-03 19:48:04.212650,0 days 00:00:00.313427,gaussian_mixture,abundance,2.5,4,COMPLETE
4289,0.5223982529551152,2025-03-03 19:48:04.215670,2025-03-03 19:48:04.578896,0 days 00:00:00.363226,gaussian_mixture,abundance,2.25,2,COMPLETE
4290,0.6470554677666364,2025-03-03 19:48:04.581896,2025-03-03 19:48:04.917946,0 days 00:00:00.336050,gaussian_mixture,abundance,2.35,2,COMPLETE
4291,0.042748366022901205,2025-03-03 19:48:04.920946,2025-03-03 19:48:06.293871,0 days 00:00:01.372925,gaussian_mixture,presence,90.0,3,COMPLETE
4292,0.19049541089354016,2025-03-03 19:48:06.296870,2025-03-03 19:48:06.598612,0 days 00:00:00.301742,gaussian_mixture,abundance,2.45,2,COMPLETE
4293,0.5483938294588198,2025-03-03 19:48:06.601636,2025-03-03 19:48:06.919516,0 days 00:00:00.317880,gaussian_mixture,abundance,2.2,2,COMPLETE
4294,0.29996642422013753,2025-03-03 19:48:06.922556,2025-03-03 19:48:07.232660,0 days 00:00:00.310104,gaussian_mixture,abundance,2.15,2,COMPLETE
4295,0.5007975785298147,2025-03-03 19:48:07.234667,2025-03-03 19:48:07.601321,0 days 00:00:00.366654,gaussian_mixture,abundance,1.8,2,COMPLETE
4296,0.4709319624231342,2025-03-03 19:48:07.604563,2025-03-03 19:48:07.925979,0 days 00:00:00.321416,kmeans,abundance,2.4000000000000004,2,COMPLETE
4297,0.5351227547552725,2025-03-03 19:48:07.927982,2025-03-03 19:48:08.241194,0 days 00:00:00.313212,gaussian_mixture,abundance,2.25,2,COMPLETE
4298,0.3639252056052501,2025-03-03 19:48:08.243149,2025-03-03 19:48:08.555417,0 days 00:00:00.312268,gaussian_mixture,abundance,2.1,2,COMPLETE
4299,0.347981409537615,2025-03-03 19:48:08.557410,2025-03-03 19:48:08.866617,0 days 00:00:00.309207,gaussian_mixture,abundance,2.3000000000000003,2,COMPLETE
4300,0.3916389017822694,2025-03-03 19:48:08.868627,2025-03-03 19:48:09.183553,0 days 00:00:00.314926,gaussian_mixture,abundance,2.2,2,COMPLETE
4301,0.40217593043837496,2025-03-03 19:48:09.185555,2025-03-03 19:48:09.498721,0 days 00:00:00.313166,gaussian_mixture,abundance,2.3000000000000003,2,COMPLETE
4302,0.482519594631975,2025-03-03 19:48:09.501731,2025-03-03 19:48:09.826829,0 days 00:00:00.325098,gaussian_mixture,abundance,2.35,2,COMPLETE
4303,0.27313139138801457,2025-03-03 19:48:09.829827,2025-03-03 19:48:10.140935,0 days 00:00:00.311108,gaussian_mixture,abundance,2.45,2,COMPLETE
4304,0.5130606017320043,2025-03-03 19:48:10.143218,2025-03-03 19:48:10.455703,0 days 00:00:00.312485,gaussian_mixture,abundance,2.0500000000000003,2,COMPLETE
4305,0.2765866142972828,2025-03-03 19:48:10.458701,2025-03-03 19:48:10.769290,0 days 00:00:00.310589,gaussian_mixture,abundance,2.4000000000000004,2,COMPLETE
4306,0.3922480123971309,2025-03-03 19:48:10.773315,2025-03-03 19:48:11.083596,0 days 00:00:00.310281,gaussian_mixture,abundance,2.25,2,COMPLETE
4307,0.562003989042619,2025-03-03 19:48:11.086596,2025-03-03 19:48:11.402676,0 days 00:00:00.316080,gaussian_mixture,abundance,2.15,2,COMPLETE
4308,0.4289474240240031,2025-03-03 19:48:11.405237,2025-03-03 19:48:11.718757,0 days 00:00:00.313520,gaussian_mixture,abundance,2.5,2,COMPLETE
4309,0.47996992506772324,2025-03-03 19:48:11.721772,2025-03-03 19:48:12.044423,0 days 00:00:00.322651,gaussian_mixture,abundance,2.0,2,COMPLETE
4310,0.7296597712096574,2025-03-03 19:48:12.047424,2025-03-03 19:48:12.359802,0 days 00:00:00.312378,gaussian_mixture,abundance,2.2,2,COMPLETE
4311,0.005437431723612757,2025-03-03 19:48:12.361312,2025-03-03 19:48:13.880769,0 days 00:00:01.519457,gaussian_mixture,presence,10.0,2,COMPLETE
4312,0.13847727197166937,2025-03-03 19:48:13.882801,2025-03-03 19:48:14.208610,0 days 00:00:00.325809,gaussian_mixture,abundance,2.1,2,COMPLETE
4313,0.45184069964022233,2025-03-03 19:48:14.211115,2025-03-03 19:48:14.520998,0 days 00:00:00.309883,gaussian_mixture,abundance,2.15,2,COMPLETE
4314,0.4499467837625396,2025-03-03 19:48:14.523548,2025-03-03 19:48:14.837555,0 days 00:00:00.314007,gaussian_mixture,abundance,2.1,2,COMPLETE
4315,0.5633527701398364,2025-03-03 19:48:14.839552,2025-03-03 19:48:15.145666,0 days 00:00:00.306114,kmeans,abundance,2.15,2,COMPLETE
4316,0.3032030205291436,2025-03-03 19:48:15.148662,2025-03-03 19:48:15.457039,0 days 00:00:00.308377,gaussian_mixture,abundance,2.15,2,COMPLETE
4317,0.4446846075417337,2025-03-03 19:48:15.460038,2025-03-03 19:48:15.783593,0 days 00:00:00.323555,gaussian_mixture,abundance,2.15,2,COMPLETE
4318,0.4631313940777909,2025-03-03 19:48:15.785595,2025-03-03 19:48:16.145072,0 days 00:00:00.359477,gaussian_mixture,abundance,2.15,2,COMPLETE
4319,0.6263312666861188,2025-03-03 19:48:16.150056,2025-03-03 19:48:16.514234,0 days 00:00:00.364178,gaussian_mixture,abundance,2.1,2,COMPLETE
4320,0.32113533718582465,2025-03-03 19:48:16.517235,2025-03-03 19:48:16.846729,0 days 00:00:00.329494,gaussian_mixture,abundance,2.2,2,COMPLETE
4321,0.36699895403153093,2025-03-03 19:48:16.849721,2025-03-03 19:48:17.168559,0 days 00:00:00.318838,gaussian_mixture,abundance,2.0500000000000003,2,COMPLETE
4322,0.5722232020510016,2025-03-03 19:48:17.171068,2025-03-03 19:48:17.482646,0 days 00:00:00.311578,gaussian_mixture,abundance,2.2,2,COMPLETE
4323,0.4352270665409927,2025-03-03 19:48:17.485576,2025-03-03 19:48:17.802794,0 days 00:00:00.317218,gaussian_mixture,abundance,2.15,2,COMPLETE
4324,0.5013395218593125,2025-03-03 19:48:17.804294,2025-03-03 19:48:18.116808,0 days 00:00:00.312514,gaussian_mixture,abundance,2.2,2,COMPLETE
4325,0.5370462256441575,2025-03-03 19:48:18.118811,2025-03-03 19:48:18.454619,0 days 00:00:00.335808,gaussian_mixture,abundance,2.1,2,COMPLETE
4326,0.3660572075958698,2025-03-03 19:48:18.457628,2025-03-03 19:48:18.841040,0 days 00:00:00.383412,gaussian_mixture,abundance,2.2,2,COMPLETE
4327,0.42131736902072364,2025-03-03 19:48:18.845558,2025-03-03 19:48:19.183680,0 days 00:00:00.338122,gaussian_mixture,abundance,2.0500000000000003,6,COMPLETE
4328,0.45859165412069514,2025-03-03 19:48:19.185682,2025-03-03 19:48:19.499603,0 days 00:00:00.313921,gaussian_mixture,abundance,2.15,2,COMPLETE
4329,0.5626763673423503,2025-03-03 19:48:19.501637,2025-03-03 19:48:19.819680,0 days 00:00:00.318043,gaussian_mixture,abundance,2.2,2,COMPLETE
4330,0.013982200885778288,2025-03-03 19:48:19.821692,2025-03-03 19:48:21.205261,0 days 00:00:01.383569,gaussian_mixture,presence,75.0,2,COMPLETE
4331,0.3904954108935401,2025-03-03 19:48:21.208259,2025-03-03 19:48:21.529247,0 days 00:00:00.320988,gaussian_mixture,abundance,2.15,2,COMPLETE
4332,0.4354374862851424,2025-03-03 19:48:21.531779,2025-03-03 19:48:21.888313,0 days 00:00:00.356534,gaussian_mixture,abundance,2.1,2,COMPLETE
4333,0.32924194914022065,2025-03-03 19:48:21.891824,2025-03-03 19:48:22.218605,0 days 00:00:00.326781,gaussian_mixture,abundance,2.0500000000000003,2,COMPLETE
4334,0.3902491908053526,2025-03-03 19:48:22.220608,2025-03-03 19:48:22.535681,0 days 00:00:00.315073,kmeans,abundance,2.2,3,COMPLETE
4335,0.5322349938118114,2025-03-03 19:48:22.538681,2025-03-03 19:48:22.874051,0 days 00:00:00.335370,gaussian_mixture,abundance,2.2,2,COMPLETE
4336,0.6054366962148418,2025-03-03 19:48:22.877046,2025-03-03 19:48:23.200054,0 days 00:00:00.323008,gaussian_mixture,abundance,2.1,2,COMPLETE
4337,0.5652564110527933,2025-03-03 19:48:23.202568,2025-03-03 19:48:23.515880,0 days 00:00:00.313312,gaussian_mixture,abundance,2.2,2,COMPLETE
4338,0.422441652440457,2025-03-03 19:48:23.518873,2025-03-03 19:48:23.838172,0 days 00:00:00.319299,gaussian_mixture,abundance,2.1,2,COMPLETE
4339,0.7171740049356445,2025-03-03 19:48:23.839174,2025-03-03 19:48:24.157116,0 days 00:00:00.317942,gaussian_mixture,abundance,2.15,2,COMPLETE
4340,0.2612630438798961,2025-03-03 19:48:24.160120,2025-03-03 19:48:24.467850,0 days 00:00:00.307730,gaussian_mixture,abundance,2.2,2,COMPLETE
4341,0.4325264066574449,2025-03-03 19:48:24.469849,2025-03-03 19:48:24.802759,0 days 00:00:00.332910,gaussian_mixture,abundance,2.0500000000000003,4,COMPLETE
4342,0.5196622003579161,2025-03-03 19:48:24.805760,2025-03-03 19:48:25.129678,0 days 00:00:00.323918,gaussian_mixture,abundance,2.2,2,COMPLETE
4343,0.6467419553818103,2025-03-03 19:48:25.133063,2025-03-03 19:48:25.451343,0 days 00:00:00.318280,gaussian_mixture,abundance,2.1,2,COMPLETE
4344,0.5943834179533756,2025-03-03 19:48:25.453872,2025-03-03 19:48:25.805366,0 days 00:00:00.351494,gaussian_mixture,abundance,2.15,2,COMPLETE
4345,0.329444108283639,2025-03-03 19:48:25.810864,2025-03-03 19:48:26.149627,0 days 00:00:00.338763,gaussian_mixture,abundance,1.9500000000000002,2,COMPLETE
4346,0.5979206644540467,2025-03-03 19:48:26.151658,2025-03-03 19:48:26.486737,0 days 00:00:00.335079,gaussian_mixture,abundance,2.2,2,COMPLETE
4347,0.618569392674297,2025-03-03 19:48:26.488736,2025-03-03 19:48:26.866999,0 days 00:00:00.378263,gaussian_mixture,abundance,2.25,2,COMPLETE
4348,0.40394736113219265,2025-03-03 19:48:26.869142,2025-03-03 19:48:27.193789,0 days 00:00:00.324647,gaussian_mixture,abundance,2.0500000000000003,2,COMPLETE
4349,0.0026800837670231774,2025-03-03 19:48:27.195787,2025-03-03 19:48:28.624516,0 days 00:00:01.428729,gaussian_mixture,presence,10.0,2,COMPLETE
4350,0.42246951851149694,2025-03-03 19:48:28.627515,2025-03-03 19:48:28.940023,0 days 00:00:00.312508,gaussian_mixture,abundance,2.15,2,COMPLETE
4351,0.38311111401796916,2025-03-03 19:48:28.941525,2025-03-03 19:48:29.292626,0 days 00:00:00.351101,gaussian_mixture,abundance,2.0,2,COMPLETE
4352,0.6509159960668365,2025-03-03 19:48:29.294632,2025-03-03 19:48:29.611871,0 days 00:00:00.317239,gaussian_mixture,abundance,2.25,2,COMPLETE
4353,0.40269181183023345,2025-03-03 19:48:29.614888,2025-03-03 19:48:29.924469,0 days 00:00:00.309581,kmeans,abundance,2.2,2,COMPLETE
4354,0.6192824691145307,2025-03-03 19:48:29.927472,2025-03-03 19:48:30.239585,0 days 00:00:00.312113,gaussian_mixture,abundance,2.25,2,COMPLETE
4355,0.5336228841004873,2025-03-03 19:48:30.242622,2025-03-03 19:48:30.560888,0 days 00:00:00.318266,gaussian_mixture,abundance,2.1,2,COMPLETE
4356,0.6236136419780085,2025-03-03 19:48:30.563160,2025-03-03 19:48:30.883651,0 days 00:00:00.320491,gaussian_mixture,abundance,2.15,2,COMPLETE
4357,0.4893133005213281,2025-03-03 19:48:30.885647,2025-03-03 19:48:31.203436,0 days 00:00:00.317789,gaussian_mixture,abundance,2.25,2,COMPLETE
4358,0.393240031472942,2025-03-03 19:48:31.205632,2025-03-03 19:48:31.523582,0 days 00:00:00.317950,gaussian_mixture,abundance,2.2,2,COMPLETE
4359,0.4209058061007308,2025-03-03 19:48:31.525581,2025-03-03 19:48:31.839100,0 days 00:00:00.313519,gaussian_mixture,abundance,2.1,2,COMPLETE
4360,0.5025935963585988,2025-03-03 19:48:31.841643,2025-03-03 19:48:32.152645,0 days 00:00:00.311002,gaussian_mixture,abundance,1.85,2,COMPLETE
4361,0.45637935584540984,2025-03-03 19:48:32.155656,2025-03-03 19:48:32.467777,0 days 00:00:00.312121,gaussian_mixture,abundance,2.0,2,COMPLETE
4362,0.3924593285453911,2025-03-03 19:48:32.470761,2025-03-03 19:48:32.830645,0 days 00:00:00.359884,gaussian_mixture,abundance,2.15,2,COMPLETE
4363,0.3904954108935401,2025-03-03 19:48:32.833742,2025-03-03 19:48:33.169273,0 days 00:00:00.335531,gaussian_mixture,abundance,2.25,2,COMPLETE
4364,0.5923901500158484,2025-03-03 19:48:33.170782,2025-03-03 19:48:33.511074,0 days 00:00:00.340292,gaussian_mixture,abundance,2.2,2,COMPLETE
4365,0.0140231475808002,2025-03-03 19:48:33.513613,2025-03-03 19:48:35.002635,0 days 00:00:01.489022,gaussian_mixture,presence,10.0,2,COMPLETE
4366,0.6353749482218015,2025-03-03 19:48:35.005630,2025-03-03 19:48:35.322197,0 days 00:00:00.316567,gaussian_mixture,abundance,2.25,2,COMPLETE
4367,0.5889432430326119,2025-03-03 19:48:35.324207,2025-03-03 19:48:35.654264,0 days 00:00:00.330057,gaussian_mixture,abundance,2.1,2,COMPLETE
4368,0.6223447641174961,2025-03-03 19:48:35.656253,2025-03-03 19:48:35.970069,0 days 00:00:00.313816,gaussian_mixture,abundance,1.9500000000000002,2,COMPLETE
4369,0.3585919279205527,2025-03-03 19:48:35.971566,2025-03-03 19:48:36.285550,0 days 00:00:00.313984,gaussian_mixture,abundance,2.0500000000000003,2,COMPLETE
4370,0.5737151980381816,2025-03-03 19:48:36.286537,2025-03-03 19:48:36.602631,0 days 00:00:00.316094,gaussian_mixture,abundance,2.25,2,COMPLETE
4371,0.35976019625360467,2025-03-03 19:48:36.604625,2025-03-03 19:48:36.985064,0 days 00:00:00.380439,kmeans,abundance,2.15,5,COMPLETE
4372,0.5637719831751971,2025-03-03 19:48:36.987066,2025-03-03 19:48:37.319165,0 days 00:00:00.332099,gaussian_mixture,abundance,1.9000000000000001,2,COMPLETE
4373,0.4079993826576809,2025-03-03 19:48:37.322588,2025-03-03 19:48:37.648101,0 days 00:00:00.325513,gaussian_mixture,abundance,2.2,2,COMPLETE
4374,0.43490766382829815,2025-03-03 19:48:37.650710,2025-03-03 19:48:37.966934,0 days 00:00:00.316224,gaussian_mixture,abundance,2.1,2,COMPLETE
4375,0.5068479962986501,2025-03-03 19:48:37.968922,2025-03-03 19:48:38.282483,0 days 00:00:00.313561,gaussian_mixture,abundance,2.25,2,COMPLETE
4376,0.41209520334200683,2025-03-03 19:48:38.284664,2025-03-03 19:48:38.617144,0 days 00:00:00.332480,gaussian_mixture,abundance,1.1500000000000001,3,COMPLETE
4377,0.6555302880172329,2025-03-03 19:48:38.619132,2025-03-03 19:48:38.963795,0 days 00:00:00.344663,gaussian_mixture,abundance,2.15,2,COMPLETE
4378,0.5281847631569248,2025-03-03 19:48:38.966807,2025-03-03 19:48:39.287074,0 days 00:00:00.320267,gaussian_mixture,abundance,2.0,2,COMPLETE
4379,0.34059259216374027,2025-03-03 19:48:39.289082,2025-03-03 19:48:39.599584,0 days 00:00:00.310502,gaussian_mixture,abundance,2.25,2,COMPLETE
4380,0.5818684553278785,2025-03-03 19:48:39.601614,2025-03-03 19:48:39.948564,0 days 00:00:00.346950,gaussian_mixture,abundance,2.15,2,COMPLETE
4381,0.4894275044141908,2025-03-03 19:48:39.951591,2025-03-03 19:48:40.316743,0 days 00:00:00.365152,gaussian_mixture,abundance,2.0500000000000003,2,COMPLETE
4382,0.3494745303394381,2025-03-03 19:48:40.319743,2025-03-03 19:48:40.649859,0 days 00:00:00.330116,gaussian_mixture,abundance,2.2,2,COMPLETE
4383,0.5660572075958697,2025-03-03 19:48:40.651877,2025-03-03 19:48:40.990585,0 days 00:00:00.338708,gaussian_mixture,abundance,2.25,2,COMPLETE
4384,0.07929045241743966,2025-03-03 19:48:40.992738,2025-03-03 19:48:42.401636,0 days 00:00:01.408898,gaussian_mixture,presence,35.0,2,COMPLETE
4385,0.37291449550785266,2025-03-03 19:48:42.403642,2025-03-03 19:48:42.724798,0 days 00:00:00.321156,gaussian_mixture,abundance,2.2,2,COMPLETE
4386,0.6223447641174961,2025-03-03 19:48:42.726802,2025-03-03 19:48:43.083188,0 days 00:00:00.356386,gaussian_mixture,abundance,2.0500000000000003,2,COMPLETE
4387,0.43135833438838533,2025-03-03 19:48:43.085198,2025-03-03 19:48:43.412483,0 days 00:00:00.327285,gaussian_mixture,abundance,2.25,2,COMPLETE
4388,0.3255307021362842,2025-03-03 19:48:43.415484,2025-03-03 19:48:43.750726,0 days 00:00:00.335242,gaussian_mixture,abundance,2.1,2,COMPLETE
4389,0.4548005100588573,2025-03-03 19:48:43.753240,2025-03-03 19:48:44.113548,0 days 00:00:00.360308,gaussian_mixture,abundance,1.3,2,COMPLETE
4390,0.47119390575344344,2025-03-03 19:48:44.116561,2025-03-03 19:48:44.428837,0 days 00:00:00.312276,kmeans,abundance,2.25,2,COMPLETE
4391,0.525174749278292,2025-03-03 19:48:44.430634,2025-03-03 19:48:44.747291,0 days 00:00:00.316657,gaussian_mixture,abundance,1.75,2,COMPLETE
4392,0.5564060039173808,2025-03-03 19:48:44.749812,2025-03-03 19:48:45.070615,0 days 00:00:00.320803,gaussian_mixture,abundance,2.1,2,COMPLETE
4393,0.5001551720216997,2025-03-03 19:48:45.072655,2025-03-03 19:48:45.435609,0 days 00:00:00.362954,gaussian_mixture,abundance,2.2,2,COMPLETE
4394,0.4736311314875481,2025-03-03 19:48:45.438605,2025-03-03 19:48:45.758839,0 days 00:00:00.320234,gaussian_mixture,abundance,2.0,2,COMPLETE
4395,0.5460583540026802,2025-03-03 19:48:45.761334,2025-03-03 19:48:46.076629,0 days 00:00:00.315295,gaussian_mixture,abundance,2.15,2,COMPLETE
4396,0.6523742131945071,2025-03-03 19:48:46.078631,2025-03-03 19:48:46.454824,0 days 00:00:00.376193,gaussian_mixture,abundance,1.9500000000000002,2,COMPLETE
4397,0.4669276884751493,2025-03-03 19:48:46.457824,2025-03-03 19:48:46.774282,0 days 00:00:00.316458,gaussian_mixture,abundance,2.3000000000000003,2,COMPLETE
4398,0.5176604903476064,2025-03-03 19:48:46.777287,2025-03-03 19:48:47.093725,0 days 00:00:00.316438,gaussian_mixture,abundance,2.2,2,COMPLETE
4399,0.4126426878724068,2025-03-03 19:48:47.095718,2025-03-03 19:48:47.407394,0 days 00:00:00.311676,gaussian_mixture,abundance,2.3000000000000003,2,COMPLETE
4400,0.5092331249076552,2025-03-03 19:48:47.409403,2025-03-03 19:48:47.719530,0 days 00:00:00.310127,gaussian_mixture,abundance,2.15,2,COMPLETE
4401,0.5303393956954948,2025-03-03 19:48:47.722613,2025-03-03 19:48:48.041716,0 days 00:00:00.319103,gaussian_mixture,abundance,2.3000000000000003,4,COMPLETE
4402,0.3525416085645169,2025-03-03 19:48:48.044240,2025-03-03 19:48:48.369304,0 days 00:00:00.325064,gaussian_mixture,abundance,1.55,2,COMPLETE
4403,0.013388576833736154,2025-03-03 19:48:48.372651,2025-03-03 19:48:49.932602,0 days 00:00:01.559951,gaussian_mixture,presence,10.0,2,COMPLETE
4404,0.4864320357185978,2025-03-03 19:48:49.934606,2025-03-03 19:48:50.275678,0 days 00:00:00.341072,gaussian_mixture,abundance,1.85,2,COMPLETE
4405,0.5003602721242073,2025-03-03 19:48:50.277679,2025-03-03 19:48:50.624597,0 days 00:00:00.346918,gaussian_mixture,abundance,2.25,2,COMPLETE
4406,0.40126860158336947,2025-03-03 19:48:50.626590,2025-03-03 19:48:50.939965,0 days 00:00:00.313375,gaussian_mixture,abundance,2.25,2,COMPLETE
4407,0.6231162583371163,2025-03-03 19:48:50.941474,2025-03-03 19:48:51.255418,0 days 00:00:00.313944,gaussian_mixture,abundance,2.0500000000000003,2,COMPLETE
4408,0.5171740049356446,2025-03-03 19:48:51.257427,2025-03-03 19:48:51.612740,0 days 00:00:00.355313,gaussian_mixture,abundance,2.15,2,COMPLETE
4409,0.5527486739786427,2025-03-03 19:48:51.616193,2025-03-03 19:48:51.933978,0 days 00:00:00.317785,gaussian_mixture,abundance,2.2,2,COMPLETE
4410,0.5039930943770482,2025-03-03 19:48:51.935968,2025-03-03 19:48:52.245088,0 days 00:00:00.309120,gaussian_mixture,abundance,2.3000000000000003,2,COMPLETE
4411,0.30034628664894397,2025-03-03 19:48:52.247084,2025-03-03 19:48:52.565884,0 days 00:00:00.318800,kmeans,abundance,0.8,2,COMPLETE
4412,0.4621766538386751,2025-03-03 19:48:52.567883,2025-03-03 19:48:52.897509,0 days 00:00:00.329626,gaussian_mixture,abundance,2.1,2,COMPLETE
4413,0.21305108058942773,2025-03-03 19:48:52.899510,2025-03-03 19:48:53.218178,0 days 00:00:00.318668,gaussian_mixture,abundance,2.15,2,COMPLETE
4414,0.562003989042619,2025-03-03 19:48:53.220672,2025-03-03 19:48:53.541734,0 days 00:00:00.321062,gaussian_mixture,abundance,1.9500000000000002,2,COMPLETE
4415,0.5816027056270063,2025-03-03 19:48:53.543275,2025-03-03 19:48:53.858581,0 days 00:00:00.315306,gaussian_mixture,abundance,2.3000000000000003,2,COMPLETE
4416,0.41749216714142695,2025-03-03 19:48:53.861092,2025-03-03 19:48:54.178138,0 days 00:00:00.317046,gaussian_mixture,abundance,1.7000000000000002,2,COMPLETE
4417,0.3264170380045764,2025-03-03 19:48:54.180641,2025-03-03 19:48:54.493945,0 days 00:00:00.313304,gaussian_mixture,abundance,2.2,2,COMPLETE
4418,0.4449294487140388,2025-03-03 19:48:54.497932,2025-03-03 19:48:54.827462,0 days 00:00:00.329530,gaussian_mixture,abundance,2.0500000000000003,2,COMPLETE
4419,0.6895690735646912,2025-03-03 19:48:54.831488,2025-03-03 19:48:55.154758,0 days 00:00:00.323270,gaussian_mixture,abundance,2.25,2,COMPLETE
4420,0.4967439171560395,2025-03-03 19:48:55.156753,2025-03-03 19:48:55.471724,0 days 00:00:00.314971,gaussian_mixture,abundance,2.3000000000000003,2,COMPLETE
4421,0.45736530360227423,2025-03-03 19:48:55.473735,2025-03-03 19:48:55.792935,0 days 00:00:00.319200,gaussian_mixture,abundance,2.15,2,COMPLETE
4422,-0.0035307151239070563,2025-03-03 19:48:55.795130,2025-03-03 19:48:57.329132,0 days 00:00:01.534002,gaussian_mixture,presence,10.0,2,COMPLETE
4423,0.4126478960596033,2025-03-03 19:48:57.334189,2025-03-03 19:48:57.670752,0 days 00:00:00.336563,gaussian_mixture,abundance,2.2,2,COMPLETE
4424,0.5780156814509319,2025-03-03 19:48:57.672645,2025-03-03 19:48:58.046328,0 days 00:00:00.373683,gaussian_mixture,abundance,2.1,2,COMPLETE
4425,0.35087719924209376,2025-03-03 19:48:58.049346,2025-03-03 19:48:58.365737,0 days 00:00:00.316391,gaussian_mixture,abundance,2.3000000000000003,2,COMPLETE
4426,0.05782433175356723,2025-03-03 19:48:58.367736,2025-03-03 19:48:58.679703,0 days 00:00:00.311967,gaussian_mixture,abundance,1.9000000000000001,2,COMPLETE
4427,0.4427297918076184,2025-03-03 19:48:58.681743,2025-03-03 19:48:58.989506,0 days 00:00:00.307763,kmeans,abundance,2.25,3,COMPLETE
4428,0.6407477641854399,2025-03-03 19:48:58.991541,2025-03-03 19:48:59.321579,0 days 00:00:00.330038,gaussian_mixture,abundance,2.2,2,COMPLETE
4429,0.5604533865260926,2025-03-03 19:48:59.324590,2025-03-03 19:48:59.637705,0 days 00:00:00.313115,gaussian_mixture,abundance,2.0,2,COMPLETE
4430,0.25948875721011494,2025-03-03 19:48:59.639705,2025-03-03 19:48:59.954982,0 days 00:00:00.315277,gaussian_mixture,abundance,2.6500000000000004,2,COMPLETE
