number,value,datetime_start,datetime_complete,duration,params_algorithm,params_filter_criteria,params_filter_threshold,params_k,state
4870,0.41423842439935754,2025-03-03 19:52:00.774893,2025-03-03 19:52:01.088421,0 days 00:00:00.313528,gaussian_mixture,abundance,1.9500000000000002,2,COMPLETE
4871,0.556274334990696,2025-03-03 19:52:01.090417,2025-03-03 19:52:01.417289,0 days 00:00:00.326872,gaussian_mixture,abundance,2.2,3,COMPLETE
4872,0.010333057740814007,2025-03-03 19:52:01.420289,2025-03-03 19:52:02.908622,0 days 00:00:01.488333,gaussian_mixture,presence,15.0,2,COMPLETE
4873,0.550844730510455,2025-03-03 19:52:02.911630,2025-03-03 19:52:03.267606,0 days 00:00:00.355976,gaussian_mixture,abundance,2.3000000000000003,2,COMPLETE
4874,0.6538954041644516,2025-03-03 19:52:03.271608,2025-03-03 19:52:03.603798,0 days 00:00:00.332190,gaussian_mixture,abundance,2.35,2,COMPLETE
4875,0.4196493136781438,2025-03-03 19:52:03.605798,2025-03-03 19:52:03.946010,0 days 00:00:00.340212,gaussian_mixture,abundance,2.0500000000000003,2,COMPLETE
4876,0.610416912027491,2025-03-03 19:52:03.948633,2025-03-03 19:52:04.276313,0 days 00:00:00.327680,gaussian_mixture,abundance,2.5,2,COMPLETE
4877,0.4968804168625227,2025-03-03 19:52:04.278313,2025-03-03 19:52:04.590652,0 days 00:00:00.312339,gaussian_mixture,abundance,2.3000000000000003,2,COMPLETE
4878,0.4901720474304295,2025-03-03 19:52:04.592453,2025-03-03 19:52:04.907156,0 days 00:00:00.314703,kmeans,abundance,2.4000000000000004,2,COMPLETE
4879,0.3483333948528705,2025-03-03 19:52:04.909156,2025-03-03 19:52:05.230803,0 days 00:00:00.321647,gaussian_mixture,abundance,1.6500000000000001,2,COMPLETE
4880,0.40321737520183093,2025-03-03 19:52:05.232803,2025-03-03 19:52:05.545169,0 days 00:00:00.312366,gaussian_mixture,abundance,2.2,2,COMPLETE
4881,0.3519378983308086,2025-03-03 19:52:05.547170,2025-03-03 19:52:05.876437,0 days 00:00:00.329267,gaussian_mixture,abundance,2.25,6,COMPLETE
4882,0.5632261314935414,2025-03-03 19:52:05.878437,2025-03-03 19:52:06.200916,0 days 00:00:00.322479,gaussian_mixture,abundance,2.35,2,COMPLETE
4883,0.5253274113822056,2025-03-03 19:52:06.204004,2025-03-03 19:52:06.527356,0 days 00:00:00.323352,gaussian_mixture,abundance,1.9000000000000001,2,COMPLETE
4884,0.6353749482218015,2025-03-03 19:52:06.530358,2025-03-03 19:52:06.848180,0 days 00:00:00.317822,gaussian_mixture,abundance,2.15,2,COMPLETE
4885,0.5602427359366935,2025-03-03 19:52:06.850167,2025-03-03 19:52:07.166644,0 days 00:00:00.316477,gaussian_mixture,abundance,2.45,2,COMPLETE
4886,0.39785796004125157,2025-03-03 19:52:07.169646,2025-03-03 19:52:07.492464,0 days 00:00:00.322818,gaussian_mixture,abundance,2.0500000000000003,2,COMPLETE
4887,0.09470448642414774,2025-03-03 19:52:07.494463,2025-03-03 19:52:07.849495,0 days 00:00:00.355032,gaussian_mixture,abundance,2.5500000000000003,2,COMPLETE
4888,0.6509159960668365,2025-03-03 19:52:07.851490,2025-03-03 19:52:08.216092,0 days 00:00:00.364602,gaussian_mixture,abundance,2.1,2,COMPLETE
4889,0.42414859470778676,2025-03-03 19:52:08.218931,2025-03-03 19:52:08.634771,0 days 00:00:00.415840,gaussian_mixture,abundance,2.35,2,COMPLETE
4890,0.3866194899643527,2025-03-03 19:52:08.637772,2025-03-03 19:52:09.041901,0 days 00:00:00.404129,gaussian_mixture,abundance,2.2,2,COMPLETE
4891,0.0036586190649951196,2025-03-03 19:52:09.044901,2025-03-03 19:52:10.688565,0 days 00:00:01.643664,gaussian_mixture,presence,10.0,2,COMPLETE
4892,0.35280001179743403,2025-03-03 19:52:10.691567,2025-03-03 19:52:11.018694,0 days 00:00:00.327127,gaussian_mixture,abundance,2.0,2,COMPLETE
4893,0.6778058116534188,2025-03-03 19:52:11.020694,2025-03-03 19:52:11.359853,0 days 00:00:00.339159,gaussian_mixture,abundance,2.25,2,COMPLETE
4894,0.25213632926702717,2025-03-03 19:52:11.361854,2025-03-03 19:52:11.728196,0 days 00:00:00.366342,gaussian_mixture,abundance,2.45,2,COMPLETE
4895,0.4970753466490504,2025-03-03 19:52:11.730198,2025-03-03 19:52:12.060104,0 days 00:00:00.329906,gaussian_mixture,abundance,2.25,2,COMPLETE
4896,0.4652468899102167,2025-03-03 19:52:12.062104,2025-03-03 19:52:12.409807,0 days 00:00:00.347703,gaussian_mixture,abundance,2.4000000000000004,2,COMPLETE
4897,0.37996692180517655,2025-03-03 19:52:12.412812,2025-03-03 19:52:12.834869,0 days 00:00:00.422057,gaussian_mixture,abundance,2.3000000000000003,2,COMPLETE
4898,0.5296033250644416,2025-03-03 19:52:12.837874,2025-03-03 19:52:13.169132,0 days 00:00:00.331258,kmeans,abundance,2.2,2,COMPLETE
4899,0.5855016551297274,2025-03-03 19:52:13.172132,2025-03-03 19:52:13.506667,0 days 00:00:00.334535,gaussian_mixture,abundance,2.15,2,COMPLETE
4900,0.4309614712386319,2025-03-03 19:52:13.509466,2025-03-03 19:52:13.839843,0 days 00:00:00.330377,gaussian_mixture,abundance,2.1,2,COMPLETE
4901,0.5768306353155548,2025-03-03 19:52:13.841843,2025-03-03 19:52:14.168175,0 days 00:00:00.326332,gaussian_mixture,abundance,2.35,2,COMPLETE
4902,0.3358371019612895,2025-03-03 19:52:14.170174,2025-03-03 19:52:14.496196,0 days 00:00:00.326022,gaussian_mixture,abundance,1.8,2,COMPLETE
4903,0.31578230047479616,2025-03-03 19:52:14.499243,2025-03-03 19:52:14.844803,0 days 00:00:00.345560,gaussian_mixture,abundance,1.9000000000000001,2,COMPLETE
4904,0.39286627111844274,2025-03-03 19:52:14.847803,2025-03-03 19:52:15.167408,0 days 00:00:00.319605,gaussian_mixture,abundance,2.3000000000000003,2,COMPLETE
4905,0.6679398130149414,2025-03-03 19:52:15.170408,2025-03-03 19:52:15.521785,0 days 00:00:00.351377,gaussian_mixture,abundance,2.4000000000000004,2,COMPLETE
4906,0.3596009360705056,2025-03-03 19:52:15.523784,2025-03-03 19:52:15.913624,0 days 00:00:00.389840,gaussian_mixture,abundance,2.25,2,COMPLETE
4907,0.4030112067074542,2025-03-03 19:52:15.915630,2025-03-03 19:52:16.310570,0 days 00:00:00.394940,gaussian_mixture,abundance,1.9500000000000002,4,COMPLETE
4908,0.47941345474916214,2025-03-03 19:52:16.312575,2025-03-03 19:52:16.669617,0 days 00:00:00.357042,gaussian_mixture,abundance,2.5,2,COMPLETE
4909,0.01188564554236837,2025-03-03 19:52:16.671617,2025-03-03 19:52:18.339071,0 days 00:00:01.667454,gaussian_mixture,presence,10.0,2,COMPLETE
4910,0.39921636182457754,2025-03-03 19:52:18.342071,2025-03-03 19:52:18.683795,0 days 00:00:00.341724,gaussian_mixture,abundance,2.1,2,COMPLETE
4911,0.4592608849117104,2025-03-03 19:52:18.685810,2025-03-03 19:52:19.032741,0 days 00:00:00.346931,gaussian_mixture,abundance,1.35,2,COMPLETE
4912,0.430183284376424,2025-03-03 19:52:19.034745,2025-03-03 19:52:19.487599,0 days 00:00:00.452854,gaussian_mixture,abundance,2.35,2,COMPLETE
4913,0.5596105811765957,2025-03-03 19:52:19.490602,2025-03-03 19:52:19.850634,0 days 00:00:00.360032,gaussian_mixture,abundance,2.45,2,COMPLETE
4914,0.4825506021726664,2025-03-03 19:52:19.852637,2025-03-03 19:52:20.296648,0 days 00:00:00.444011,gaussian_mixture,abundance,2.2,3,COMPLETE
4915,0.35966665787380114,2025-03-03 19:52:20.299651,2025-03-03 19:52:20.652565,0 days 00:00:00.352914,kmeans,abundance,1.7000000000000002,2,COMPLETE
4916,0.3173193815008853,2025-03-03 19:52:20.654685,2025-03-03 19:52:21.031721,0 days 00:00:00.377036,gaussian_mixture,abundance,2.25,2,COMPLETE
4917,0.5485902454825092,2025-03-03 19:52:21.034706,2025-03-03 19:52:21.417681,0 days 00:00:00.382975,gaussian_mixture,abundance,2.6,2,COMPLETE
4918,0.6859579674414059,2025-03-03 19:52:21.419681,2025-03-03 19:52:21.812524,0 days 00:00:00.392843,gaussian_mixture,abundance,2.3000000000000003,2,COMPLETE
4919,0.2711198859453853,2025-03-03 19:52:21.814572,2025-03-03 19:52:22.142782,0 days 00:00:00.328210,gaussian_mixture,abundance,2.4000000000000004,2,COMPLETE
4920,0.3361512009446919,2025-03-03 19:52:22.145359,2025-03-03 19:52:22.475411,0 days 00:00:00.330052,gaussian_mixture,abundance,2.0,2,COMPLETE
4921,0.5012992954882113,2025-03-03 19:52:22.477613,2025-03-03 19:52:22.805720,0 days 00:00:00.328107,gaussian_mixture,abundance,2.15,2,COMPLETE
4922,0.5170549448156662,2025-03-03 19:52:22.807720,2025-03-03 19:52:23.146255,0 days 00:00:00.338535,gaussian_mixture,abundance,2.3000000000000003,5,COMPLETE
4923,0.47350771750631504,2025-03-03 19:52:23.148247,2025-03-03 19:52:23.483627,0 days 00:00:00.335380,gaussian_mixture,abundance,2.4000000000000004,2,COMPLETE
4924,0.4624693533391236,2025-03-03 19:52:23.485716,2025-03-03 19:52:23.823490,0 days 00:00:00.337774,gaussian_mixture,abundance,2.2,2,COMPLETE
4925,0.6748128103758299,2025-03-03 19:52:23.826640,2025-03-03 19:52:24.205911,0 days 00:00:00.379271,gaussian_mixture,abundance,2.0500000000000003,2,COMPLETE
4926,0.5847791507669869,2025-03-03 19:52:24.208913,2025-03-03 19:52:24.566791,0 days 00:00:00.357878,gaussian_mixture,abundance,2.5,2,COMPLETE
4927,0.525313380387764,2025-03-03 19:52:24.569785,2025-03-03 19:52:24.934684,0 days 00:00:00.364899,gaussian_mixture,abundance,2.35,2,COMPLETE
4928,0.01750540123390382,2025-03-03 19:52:24.937213,2025-03-03 19:52:26.557671,0 days 00:00:01.620458,gaussian_mixture,presence,10.0,2,COMPLETE
4929,0.3777615216912479,2025-03-03 19:52:26.560670,2025-03-03 19:52:27.017913,0 days 00:00:00.457243,gaussian_mixture,abundance,1.85,2,COMPLETE
4930,0.7078160016195246,2025-03-03 19:52:27.019910,2025-03-03 19:52:27.393347,0 days 00:00:00.373437,gaussian_mixture,abundance,2.15,2,COMPLETE
4931,0.70594765142163,2025-03-03 19:52:27.396638,2025-03-03 19:52:27.802879,0 days 00:00:00.406241,gaussian_mixture,abundance,2.35,2,COMPLETE
4932,0.5565795523359395,2025-03-03 19:52:27.805402,2025-03-03 19:52:28.180416,0 days 00:00:00.375014,gaussian_mixture,abundance,2.1,2,COMPLETE
4933,0.688371554085667,2025-03-03 19:52:28.183444,2025-03-03 19:52:28.538737,0 days 00:00:00.355293,gaussian_mixture,abundance,2.25,2,COMPLETE
4934,0.3605426825061667,2025-03-03 19:52:28.540863,2025-03-03 19:52:28.941953,0 days 00:00:00.401090,gaussian_mixture,abundance,2.45,2,COMPLETE
4935,0.40078161963195524,2025-03-03 19:52:28.945962,2025-03-03 19:52:29.325929,0 days 00:00:00.379967,kmeans,abundance,0.55,2,COMPLETE
4936,0.3590762432144571,2025-03-03 19:52:29.327929,2025-03-03 19:52:29.662596,0 days 00:00:00.334667,gaussian_mixture,abundance,1.1500000000000001,2,COMPLETE
4937,0.5048204332505096,2025-03-03 19:52:29.664832,2025-03-03 19:52:30.003191,0 days 00:00:00.338359,gaussian_mixture,abundance,2.25,2,COMPLETE
4938,0.5344236806435637,2025-03-03 19:52:30.004730,2025-03-03 19:52:30.328875,0 days 00:00:00.324145,gaussian_mixture,abundance,2.3000000000000003,2,COMPLETE
4939,0.48519989731768787,2025-03-03 19:52:30.330875,2025-03-03 19:52:30.658255,0 days 00:00:00.327380,gaussian_mixture,abundance,2.15,2,COMPLETE
4940,0.6098816143673874,2025-03-03 19:52:30.660258,2025-03-03 19:52:30.999139,0 days 00:00:00.338881,gaussian_mixture,abundance,2.3000000000000003,2,COMPLETE
4941,0.23043657157232,2025-03-03 19:52:31.002649,2025-03-03 19:52:31.399255,0 days 00:00:00.396606,gaussian_mixture,abundance,2.2,2,COMPLETE
4942,0.5406704617976538,2025-03-03 19:52:31.401257,2025-03-03 19:52:31.739075,0 days 00:00:00.337818,gaussian_mixture,abundance,2.4000000000000004,2,COMPLETE
4943,0.4321305550412425,2025-03-03 19:52:31.741075,2025-03-03 19:52:32.095756,0 days 00:00:00.354681,gaussian_mixture,abundance,1.75,2,COMPLETE
4944,0.470688929046288,2025-03-03 19:52:32.099550,2025-03-03 19:52:32.444785,0 days 00:00:00.345235,gaussian_mixture,abundance,2.5500000000000003,2,COMPLETE
4945,0.566998954031531,2025-03-03 19:52:32.447795,2025-03-03 19:52:32.816739,0 days 00:00:00.368944,gaussian_mixture,abundance,2.0,2,COMPLETE
4946,0.5279770542242896,2025-03-03 19:52:32.819735,2025-03-03 19:52:33.162544,0 days 00:00:00.342809,gaussian_mixture,abundance,2.35,2,COMPLETE
4947,-0.005985616675425573,2025-03-03 19:52:33.165591,2025-03-03 19:52:34.817105,0 days 00:00:01.651514,gaussian_mixture,presence,10.0,2,COMPLETE
4948,0.41948053867947194,2025-03-03 19:52:34.820105,2025-03-03 19:52:35.183398,0 days 00:00:00.363293,gaussian_mixture,abundance,2.45,2,COMPLETE
4949,0.5489397264768285,2025-03-03 19:52:35.186405,2025-03-03 19:52:35.541388,0 days 00:00:00.354983,gaussian_mixture,abundance,2.25,2,COMPLETE
4950,0.706706999562239,2025-03-03 19:52:35.543312,2025-03-03 19:52:35.900501,0 days 00:00:00.357189,gaussian_mixture,abundance,2.1,2,COMPLETE
4951,0.24368694654393322,2025-03-03 19:52:35.903525,2025-03-03 19:52:36.247981,0 days 00:00:00.344456,gaussian_mixture,abundance,2.3000000000000003,2,COMPLETE
4952,0.4183956296281234,2025-03-03 19:52:36.250987,2025-03-03 19:52:36.590547,0 days 00:00:00.339560,gaussian_mixture,abundance,2.2,2,COMPLETE
4953,0.5254886585582977,2025-03-03 19:52:36.593042,2025-03-03 19:52:36.940817,0 days 00:00:00.347775,gaussian_mixture,abundance,1.9000000000000001,3,COMPLETE
4954,0.4057470732761952,2025-03-03 19:52:36.943340,2025-03-03 19:52:37.292876,0 days 00:00:00.349536,kmeans,abundance,2.35,2,COMPLETE
4955,0.5306880299217909,2025-03-03 19:52:37.295627,2025-03-03 19:52:37.637691,0 days 00:00:00.342064,gaussian_mixture,abundance,2.4000000000000004,2,COMPLETE
4956,0.6282619979114271,2025-03-03 19:52:37.639885,2025-03-03 19:52:37.996998,0 days 00:00:00.357113,gaussian_mixture,abundance,2.15,2,COMPLETE
4957,0.7440537806899228,2025-03-03 19:52:38.000999,2025-03-03 19:52:38.374511,0 days 00:00:00.373512,gaussian_mixture,abundance,2.0500000000000003,2,COMPLETE
4958,0.4521128341847328,2025-03-03 19:52:38.377539,2025-03-03 19:52:38.723518,0 days 00:00:00.345979,gaussian_mixture,abundance,2.0,2,COMPLETE
4959,0.44667681787758723,2025-03-03 19:52:38.725489,2025-03-03 19:52:39.078073,0 days 00:00:00.352584,gaussian_mixture,abundance,2.0,2,COMPLETE
4960,0.5770061986379418,2025-03-03 19:52:39.081752,2025-03-03 19:52:39.421552,0 days 00:00:00.339800,gaussian_mixture,abundance,1.9500000000000002,2,COMPLETE
4961,0.4998105391521329,2025-03-03 19:52:39.423596,2025-03-03 19:52:39.763371,0 days 00:00:00.339775,gaussian_mixture,abundance,1.9000000000000001,2,COMPLETE
4962,0.5461808914416262,2025-03-03 19:52:39.767714,2025-03-03 19:52:40.110165,0 days 00:00:00.342451,gaussian_mixture,abundance,1.9000000000000001,2,COMPLETE
4963,0.39136146626575663,2025-03-03 19:52:40.112686,2025-03-03 19:52:40.454271,0 days 00:00:00.341585,gaussian_mixture,abundance,1.9000000000000001,2,COMPLETE
4964,0.5634325882193367,2025-03-03 19:52:40.457505,2025-03-03 19:52:40.825631,0 days 00:00:00.368126,gaussian_mixture,abundance,1.9500000000000002,2,COMPLETE
4965,0.6534511511015305,2025-03-03 19:52:40.828630,2025-03-03 19:52:41.181160,0 days 00:00:00.352530,gaussian_mixture,abundance,2.0,2,COMPLETE
4966,0.013364096695831985,2025-03-03 19:52:41.183704,2025-03-03 19:52:42.719909,0 days 00:00:01.536205,gaussian_mixture,presence,10.0,2,COMPLETE
4967,0.4396709785247749,2025-03-03 19:52:42.721912,2025-03-03 19:52:43.062735,0 days 00:00:00.340823,gaussian_mixture,abundance,2.0,2,COMPLETE
4968,0.5282227112898423,2025-03-03 19:52:43.064951,2025-03-03 19:52:43.403487,0 days 00:00:00.338536,gaussian_mixture,abundance,2.0500000000000003,2,COMPLETE
4969,0.3262570588866727,2025-03-03 19:52:43.406491,2025-03-03 19:52:43.746487,0 days 00:00:00.339996,gaussian_mixture,abundance,2.0,2,COMPLETE
4970,0.3667640547312886,2025-03-03 19:52:43.749475,2025-03-03 19:52:44.102678,0 days 00:00:00.353203,gaussian_mixture,abundance,1.9500000000000002,2,COMPLETE
4971,0.4276695836029164,2025-03-03 19:52:44.105022,2025-03-03 19:52:44.444698,0 days 00:00:00.339676,gaussian_mixture,abundance,2.0,2,COMPLETE
4972,0.585502718426645,2025-03-03 19:52:44.447694,2025-03-03 19:52:44.823705,0 days 00:00:00.376011,kmeans,abundance,1.9500000000000002,2,COMPLETE
4973,0.48257441169008664,2025-03-03 19:52:44.825787,2025-03-03 19:52:45.158926,0 days 00:00:00.333139,gaussian_mixture,abundance,2.0,2,COMPLETE
4974,0.5955020649539623,2025-03-03 19:52:45.161128,2025-03-03 19:52:45.534821,0 days 00:00:00.373693,gaussian_mixture,abundance,1.9500000000000002,2,COMPLETE
4975,0.4510427093847085,2025-03-03 19:52:45.537821,2025-03-03 19:52:45.874149,0 days 00:00:00.336328,gaussian_mixture,abundance,2.0500000000000003,4,COMPLETE
4976,0.28661839165950587,2025-03-03 19:52:45.876171,2025-03-03 19:52:46.207264,0 days 00:00:00.331093,gaussian_mixture,abundance,1.9500000000000002,2,COMPLETE
4977,0.3855016551297274,2025-03-03 19:52:46.210272,2025-03-03 19:52:46.540960,0 days 00:00:00.330688,gaussian_mixture,abundance,1.9500000000000002,2,COMPLETE
4978,0.43689974766247835,2025-03-03 19:52:46.543465,2025-03-03 19:52:46.877489,0 days 00:00:00.334024,gaussian_mixture,abundance,1.9500000000000002,2,COMPLETE
4979,0.5274275600939344,2025-03-03 19:52:46.879492,2025-03-03 19:52:47.236552,0 days 00:00:00.357060,gaussian_mixture,abundance,2.0500000000000003,2,COMPLETE
4980,0.4448795373282614,2025-03-03 19:52:47.239552,2025-03-03 19:52:47.618980,0 days 00:00:00.379428,gaussian_mixture,abundance,2.0500000000000003,2,COMPLETE
4981,0.546462941197584,2025-03-03 19:52:47.620980,2025-03-03 19:52:47.953755,0 days 00:00:00.332775,gaussian_mixture,abundance,1.85,2,COMPLETE
4982,0.3826122412240425,2025-03-03 19:52:47.955787,2025-03-03 19:52:48.285849,0 days 00:00:00.330062,gaussian_mixture,abundance,1.9000000000000001,2,COMPLETE
4983,0.5291925541308117,2025-03-03 19:52:48.287854,2025-03-03 19:52:48.612907,0 days 00:00:00.325053,gaussian_mixture,abundance,1.9500000000000002,2,COMPLETE
4984,0.2513538675785324,2025-03-03 19:52:48.615565,2025-03-03 19:52:48.951439,0 days 00:00:00.335874,gaussian_mixture,abundance,2.0,2,COMPLETE
4985,0.29685190962813657,2025-03-03 19:52:48.953512,2025-03-03 19:52:49.291380,0 days 00:00:00.337868,gaussian_mixture,abundance,2.0500000000000003,2,COMPLETE
4986,0.06751013726352291,2025-03-03 19:52:49.293433,2025-03-03 19:52:50.670839,0 days 00:00:01.377406,gaussian_mixture,presence,60.0,2,COMPLETE
4987,0.42414859470778676,2025-03-03 19:52:50.673350,2025-03-03 19:52:51.001371,0 days 00:00:00.328021,gaussian_mixture,abundance,2.0500000000000003,2,COMPLETE
4988,0.4767179683873616,2025-03-03 19:52:51.004427,2025-03-03 19:52:51.342724,0 days 00:00:00.338297,gaussian_mixture,abundance,2.0,2,COMPLETE
4989,0.5430531598791828,2025-03-03 19:52:51.344709,2025-03-03 19:52:51.675533,0 days 00:00:00.330824,gaussian_mixture,abundance,1.85,2,COMPLETE
4990,0.3211075569555971,2025-03-03 19:52:51.677533,2025-03-03 19:52:52.006380,0 days 00:00:00.328847,gaussian_mixture,abundance,2.0,2,COMPLETE
4991,0.42252000719679383,2025-03-03 19:52:52.009378,2025-03-03 19:52:52.330831,0 days 00:00:00.321453,kmeans,abundance,2.0500000000000003,2,COMPLETE
4992,0.492236863708423,2025-03-03 19:52:52.333348,2025-03-03 19:52:52.660555,0 days 00:00:00.327207,gaussian_mixture,abundance,2.0500000000000003,2,COMPLETE
4993,0.33910674938688773,2025-03-03 19:52:52.661550,2025-03-03 19:52:52.993732,0 days 00:00:00.332182,gaussian_mixture,abundance,2.0,2,COMPLETE
4994,0.2761804470614238,2025-03-03 19:52:52.995253,2025-03-03 19:52:53.327393,0 days 00:00:00.332140,gaussian_mixture,abundance,1.9000000000000001,2,COMPLETE
4995,0.5159767635679156,2025-03-03 19:52:53.329518,2025-03-03 19:52:53.670640,0 days 00:00:00.341122,gaussian_mixture,abundance,1.8,2,COMPLETE
4996,0.4864593100776859,2025-03-03 19:52:53.672650,2025-03-03 19:52:54.001315,0 days 00:00:00.328665,gaussian_mixture,abundance,2.5,2,COMPLETE
4997,0.5251834417752221,2025-03-03 19:52:54.003372,2025-03-03 19:52:54.342582,0 days 00:00:00.339210,gaussian_mixture,abundance,2.0500000000000003,2,COMPLETE
4998,0.6690427234140607,2025-03-03 19:52:54.344097,2025-03-03 19:52:54.688202,0 days 00:00:00.344105,gaussian_mixture,abundance,2.45,2,COMPLETE
4999,0.355565698685181,2025-03-03 19:52:54.690212,2025-03-03 19:52:55.058731,0 days 00:00:00.368519,gaussian_mixture,abundance,2.5,6,COMPLETE
