number,value,datetime_start,datetime_complete,duration,params_algorithm,params_filter_criteria,params_filter_threshold,params_k,state
3695,0.49905291338016655,2025-03-03 19:44:19.709485,2025-03-03 19:44:19.993032,0 days 00:00:00.283547,gaussian_mixture,abundance,2.4000000000000004,2,COMPLETE
3696,0.3836797357531645,2025-03-03 19:44:19.995218,2025-03-03 19:44:20.288101,0 days 00:00:00.292883,kmeans,abundance,2.3000000000000003,2,COMPLETE
3697,0.42281509011427776,2025-03-03 19:44:20.290100,2025-03-03 19:44:20.570722,0 days 00:00:00.280622,gaussian_mixture,abundance,2.35,2,COMPLETE
3698,0.6794134547491621,2025-03-03 19:44:20.571746,2025-03-03 19:44:20.859096,0 days 00:00:00.287350,gaussian_mixture,abundance,2.2,2,COMPLETE
3699,0.42672783716725526,2025-03-03 19:44:20.862098,2025-03-03 19:44:21.149774,0 days 00:00:00.287676,gaussian_mixture,abundance,2.25,2,COMPLETE
3700,0.516382681722007,2025-03-03 19:44:21.151572,2025-03-03 19:44:21.437955,0 days 00:00:00.286383,gaussian_mixture,abundance,1.9500000000000002,2,COMPLETE
3701,0.47163067548194926,2025-03-03 19:44:21.439759,2025-03-03 19:44:21.727491,0 days 00:00:00.287732,gaussian_mixture,abundance,2.1,2,COMPLETE
3702,0.2571703738157466,2025-03-03 19:44:21.729489,2025-03-03 19:44:22.009811,0 days 00:00:00.280322,gaussian_mixture,abundance,2.5,2,COMPLETE
3703,0.41074761121943926,2025-03-03 19:44:22.011810,2025-03-03 19:44:22.323344,0 days 00:00:00.311534,gaussian_mixture,abundance,2.45,5,COMPLETE
3704,0.4338971631528916,2025-03-03 19:44:22.324500,2025-03-03 19:44:22.619621,0 days 00:00:00.295121,gaussian_mixture,abundance,2.3000000000000003,2,COMPLETE
3705,0.5674721674145273,2025-03-03 19:44:22.621621,2025-03-03 19:44:22.915319,0 days 00:00:00.293698,gaussian_mixture,abundance,2.2,2,COMPLETE
3706,0.6286769636420244,2025-03-03 19:44:22.917319,2025-03-03 19:44:23.207697,0 days 00:00:00.290378,gaussian_mixture,abundance,2.1,2,COMPLETE
3707,0.43889402758894036,2025-03-03 19:44:23.209693,2025-03-03 19:44:23.501797,0 days 00:00:00.292104,gaussian_mixture,abundance,1.9500000000000002,2,COMPLETE
3708,0.5110956079038714,2025-03-03 19:44:23.503980,2025-03-03 19:44:23.800673,0 days 00:00:00.296693,gaussian_mixture,abundance,2.35,2,COMPLETE
3709,0.009866871829041918,2025-03-03 19:44:23.802480,2025-03-03 19:44:25.259270,0 days 00:00:01.456790,gaussian_mixture,presence,10.0,2,COMPLETE
3710,0.5480448675596323,2025-03-03 19:44:25.261278,2025-03-03 19:44:25.552843,0 days 00:00:00.291565,gaussian_mixture,abundance,1.8,3,COMPLETE
3711,0.43081733778024234,2025-03-03 19:44:25.554843,2025-03-03 19:44:25.842855,0 days 00:00:00.288012,gaussian_mixture,abundance,1.6500000000000001,2,COMPLETE
3712,0.6855404779833385,2025-03-03 19:44:25.844843,2025-03-03 19:44:26.132192,0 days 00:00:00.287349,gaussian_mixture,abundance,2.4000000000000004,2,COMPLETE
3713,0.42940282745137354,2025-03-03 19:44:26.134201,2025-03-03 19:44:26.437895,0 days 00:00:00.303694,gaussian_mixture,abundance,2.15,6,COMPLETE
3714,0.17217039082113375,2025-03-03 19:44:26.439447,2025-03-03 19:44:26.726575,0 days 00:00:00.287128,kmeans,abundance,2.0,2,COMPLETE
3715,0.42532646664041873,2025-03-03 19:44:26.729570,2025-03-03 19:44:27.025950,0 days 00:00:00.296380,gaussian_mixture,abundance,2.25,2,COMPLETE
3716,0.5083812430019752,2025-03-03 19:44:27.028959,2025-03-03 19:44:27.320140,0 days 00:00:00.291181,gaussian_mixture,abundance,2.3000000000000003,2,COMPLETE
3717,0.6353749482218015,2025-03-03 19:44:27.322138,2025-03-03 19:44:27.610847,0 days 00:00:00.288709,gaussian_mixture,abundance,2.15,2,COMPLETE
3718,0.48594637586493744,2025-03-03 19:44:27.612854,2025-03-03 19:44:27.902263,0 days 00:00:00.289409,gaussian_mixture,abundance,2.0500000000000003,2,COMPLETE
3719,0.3481501678248215,2025-03-03 19:44:27.904250,2025-03-03 19:44:28.226232,0 days 00:00:00.321982,gaussian_mixture,abundance,0.35000000000000003,2,COMPLETE
3720,0.5118680109476761,2025-03-03 19:44:28.229217,2025-03-03 19:44:28.512593,0 days 00:00:00.283376,gaussian_mixture,abundance,2.35,2,COMPLETE
3721,0.44228427764127753,2025-03-03 19:44:28.515588,2025-03-03 19:44:28.805867,0 days 00:00:00.290279,gaussian_mixture,abundance,2.45,2,COMPLETE
3722,0.47830946125556445,2025-03-03 19:44:28.807861,2025-03-03 19:44:29.105853,0 days 00:00:00.297992,gaussian_mixture,abundance,1.9000000000000001,2,COMPLETE
3723,0.4521754088268347,2025-03-03 19:44:29.107855,2025-03-03 19:44:29.399666,0 days 00:00:00.291811,gaussian_mixture,abundance,2.2,2,COMPLETE
3724,0.456738027133361,2025-03-03 19:44:29.401665,2025-03-03 19:44:29.692198,0 days 00:00:00.290533,gaussian_mixture,abundance,2.25,2,COMPLETE
3725,0.535365427079225,2025-03-03 19:44:29.694191,2025-03-03 19:44:29.974512,0 days 00:00:00.280321,gaussian_mixture,abundance,2.4000000000000004,2,COMPLETE
3726,0.37948472030554375,2025-03-03 19:44:29.977517,2025-03-03 19:44:30.267396,0 days 00:00:00.289879,gaussian_mixture,abundance,2.3000000000000003,2,COMPLETE
3727,0.04924985662536929,2025-03-03 19:44:30.268388,2025-03-03 19:44:31.698288,0 days 00:00:01.429900,gaussian_mixture,presence,30.0,2,COMPLETE
3728,0.6470554677666364,2025-03-03 19:44:31.700287,2025-03-03 19:44:32.005342,0 days 00:00:00.305055,gaussian_mixture,abundance,2.1,2,COMPLETE
3729,0.6509159960668365,2025-03-03 19:44:32.007330,2025-03-03 19:44:32.309614,0 days 00:00:00.302284,gaussian_mixture,abundance,2.2,2,COMPLETE
3730,0.5224874409001156,2025-03-03 19:44:32.311596,2025-03-03 19:44:32.598957,0 days 00:00:00.287361,gaussian_mixture,abundance,2.35,2,COMPLETE
3731,0.4791016876808527,2025-03-03 19:44:32.600958,2025-03-03 19:44:32.936957,0 days 00:00:00.335999,gaussian_mixture,abundance,2.25,4,COMPLETE
3732,0.34517965040336607,2025-03-03 19:44:32.938541,2025-03-03 19:44:33.289708,0 days 00:00:00.351167,gaussian_mixture,abundance,2.1,2,COMPLETE
3733,0.30098012708968347,2025-03-03 19:44:33.291709,2025-03-03 19:44:33.981202,0 days 00:00:00.689493,kmeans,abundance,2.5500000000000003,3,COMPLETE
3734,0.3223398723263671,2025-03-03 19:44:33.983202,2025-03-03 19:44:34.422134,0 days 00:00:00.438932,gaussian_mixture,abundance,2.3000000000000003,2,COMPLETE
3735,0.4261275071860327,2025-03-03 19:44:34.425133,2025-03-03 19:44:34.783705,0 days 00:00:00.358572,gaussian_mixture,abundance,2.15,2,COMPLETE
3736,0.27171466655045695,2025-03-03 19:44:34.785747,2025-03-03 19:44:35.197120,0 days 00:00:00.411373,gaussian_mixture,abundance,2.4000000000000004,2,COMPLETE
3737,0.5915849032866705,2025-03-03 19:44:35.200095,2025-03-03 19:44:35.573848,0 days 00:00:00.373753,gaussian_mixture,abundance,2.35,2,COMPLETE
3738,0.5513282655398657,2025-03-03 19:44:35.575845,2025-03-03 19:44:35.860798,0 days 00:00:00.284953,gaussian_mixture,abundance,2.2,2,COMPLETE
3739,0.3241390735652102,2025-03-03 19:44:35.862781,2025-03-03 19:44:36.154486,0 days 00:00:00.291705,gaussian_mixture,abundance,2.25,2,COMPLETE
3740,0.46202239202050527,2025-03-03 19:44:36.157482,2025-03-03 19:44:36.450728,0 days 00:00:00.293246,gaussian_mixture,abundance,2.0500000000000003,2,COMPLETE
3741,0.603693823526673,2025-03-03 19:44:36.452730,2025-03-03 19:44:36.740913,0 days 00:00:00.288183,gaussian_mixture,abundance,2.45,2,COMPLETE
3742,0.35559650762174017,2025-03-03 19:44:36.742915,2025-03-03 19:44:37.044630,0 days 00:00:00.301715,gaussian_mixture,abundance,2.3000000000000003,2,COMPLETE
3743,0.6406660757904129,2025-03-03 19:44:37.047626,2025-03-03 19:44:37.394872,0 days 00:00:00.347246,gaussian_mixture,abundance,2.15,2,COMPLETE
3744,0.5629616587542392,2025-03-03 19:44:37.396870,2025-03-03 19:44:37.688514,0 days 00:00:00.291644,gaussian_mixture,abundance,1.9000000000000001,2,COMPLETE
3745,0.5776240534834527,2025-03-03 19:44:37.690528,2025-03-03 19:44:37.969470,0 days 00:00:00.278942,gaussian_mixture,abundance,2.35,2,COMPLETE
3746,0.5491639319455223,2025-03-03 19:44:37.971463,2025-03-03 19:44:38.256500,0 days 00:00:00.285037,gaussian_mixture,abundance,2.25,2,COMPLETE
3747,-0.007789096016061298,2025-03-03 19:44:38.258498,2025-03-03 19:44:39.746920,0 days 00:00:01.488422,gaussian_mixture,presence,10.0,2,COMPLETE
3748,0.39424128124794666,2025-03-03 19:44:39.749906,2025-03-03 19:44:40.033779,0 days 00:00:00.283873,gaussian_mixture,abundance,2.5,2,COMPLETE
3749,0.37439852237761995,2025-03-03 19:44:40.034920,2025-03-03 19:44:40.350555,0 days 00:00:00.315635,gaussian_mixture,abundance,0.5,2,COMPLETE
3750,0.27511054931210355,2025-03-03 19:44:40.351550,2025-03-03 19:44:40.671274,0 days 00:00:00.319724,gaussian_mixture,abundance,2.15,2,COMPLETE
3751,0.4266555844114411,2025-03-03 19:44:40.673285,2025-03-03 19:44:40.958376,0 days 00:00:00.285091,gaussian_mixture,abundance,2.4000000000000004,2,COMPLETE
3752,0.17356840937492496,2025-03-03 19:44:40.960375,2025-03-03 19:44:41.250914,0 days 00:00:00.290539,gaussian_mixture,abundance,2.2,2,COMPLETE
3753,0.4119017005275351,2025-03-03 19:44:41.252918,2025-03-03 19:44:41.555596,0 days 00:00:00.302678,kmeans,abundance,2.1,2,COMPLETE
3754,0.3764156928336891,2025-03-03 19:44:41.557311,2025-03-03 19:44:41.851740,0 days 00:00:00.294429,gaussian_mixture,abundance,2.0,2,COMPLETE
3755,0.42048221158113064,2025-03-03 19:44:41.853739,2025-03-03 19:44:42.141032,0 days 00:00:00.287293,gaussian_mixture,abundance,2.3000000000000003,2,COMPLETE
3756,0.3374816433307496,2025-03-03 19:44:42.143032,2025-03-03 19:44:42.425950,0 days 00:00:00.282918,gaussian_mixture,abundance,2.35,2,COMPLETE
3757,0.5130606017320043,2025-03-03 19:44:42.427940,2025-03-03 19:44:42.732551,0 days 00:00:00.304611,gaussian_mixture,abundance,2.2,2,COMPLETE
3758,0.5972649170409998,2025-03-03 19:44:42.734554,2025-03-03 19:44:43.080082,0 days 00:00:00.345528,gaussian_mixture,abundance,2.45,2,COMPLETE
3759,0.6073454247198603,2025-03-03 19:44:43.083103,2025-03-03 19:44:43.371793,0 days 00:00:00.288690,gaussian_mixture,abundance,2.25,2,COMPLETE
3760,0.40189473912230833,2025-03-03 19:44:43.373785,2025-03-03 19:44:43.667964,0 days 00:00:00.294179,gaussian_mixture,abundance,2.1,2,COMPLETE
3761,0.5674126873607656,2025-03-03 19:44:43.670241,2025-03-03 19:44:43.963836,0 days 00:00:00.293595,gaussian_mixture,abundance,1.85,2,COMPLETE
3762,0.4876332956059314,2025-03-03 19:44:43.965833,2025-03-03 19:44:44.252295,0 days 00:00:00.286462,gaussian_mixture,abundance,2.4000000000000004,2,COMPLETE
3763,0.3067289704001247,2025-03-03 19:44:44.254288,2025-03-03 19:44:44.545658,0 days 00:00:00.291370,gaussian_mixture,abundance,1.9500000000000002,2,COMPLETE
3764,0.6353008563882906,2025-03-03 19:44:44.547645,2025-03-03 19:44:44.832592,0 days 00:00:00.284947,gaussian_mixture,abundance,2.3000000000000003,2,COMPLETE
3765,0.015109037859426504,2025-03-03 19:44:44.834839,2025-03-03 19:44:46.438516,0 days 00:00:01.603677,gaussian_mixture,presence,10.0,2,COMPLETE
3766,0.6872212765482711,2025-03-03 19:44:46.440517,2025-03-03 19:44:46.751201,0 days 00:00:00.310684,gaussian_mixture,abundance,2.5,2,COMPLETE
3767,0.5370462256441575,2025-03-03 19:44:46.753785,2025-03-03 19:44:47.065103,0 days 00:00:00.311318,gaussian_mixture,abundance,2.25,2,COMPLETE
3768,0.4746653278322858,2025-03-03 19:44:47.067100,2025-03-03 19:44:47.350802,0 days 00:00:00.283702,gaussian_mixture,abundance,2.15,2,COMPLETE
3769,0.5095809956564018,2025-03-03 19:44:47.352795,2025-03-03 19:44:47.647563,0 days 00:00:00.294768,gaussian_mixture,abundance,2.0500000000000003,2,COMPLETE
3770,0.5130402496389952,2025-03-03 19:44:47.649560,2025-03-03 19:44:48.011716,0 days 00:00:00.362156,gaussian_mixture,abundance,2.35,2,COMPLETE
3771,0.35223484773826097,2025-03-03 19:44:48.015047,2025-03-03 19:44:48.369998,0 days 00:00:00.354951,kmeans,abundance,1.7000000000000002,2,COMPLETE
3772,0.5178720745437817,2025-03-03 19:44:48.372008,2025-03-03 19:44:48.702234,0 days 00:00:00.330226,gaussian_mixture,abundance,2.2,4,COMPLETE
3773,0.6224695185114969,2025-03-03 19:44:48.704948,2025-03-03 19:44:48.996626,0 days 00:00:00.291678,gaussian_mixture,abundance,2.4000000000000004,2,COMPLETE
3774,0.4284025937225214,2025-03-03 19:44:48.999614,2025-03-03 19:44:49.304898,0 days 00:00:00.305284,gaussian_mixture,abundance,2.3000000000000003,5,COMPLETE
3775,0.5206468196468552,2025-03-03 19:44:49.306432,2025-03-03 19:44:49.598187,0 days 00:00:00.291755,gaussian_mixture,abundance,2.15,2,COMPLETE
3776,0.4721284255359356,2025-03-03 19:44:49.600183,2025-03-03 19:44:49.950879,0 days 00:00:00.350696,gaussian_mixture,abundance,2.0500000000000003,2,COMPLETE
3777,0.5279384567946315,2025-03-03 19:44:49.952874,2025-03-03 19:44:50.304279,0 days 00:00:00.351405,gaussian_mixture,abundance,2.45,2,COMPLETE
3778,0.6114757482246641,2025-03-03 19:44:50.306278,2025-03-03 19:44:50.602850,0 days 00:00:00.296572,gaussian_mixture,abundance,2.3000000000000003,2,COMPLETE
3779,0.5005036839940005,2025-03-03 19:44:50.603854,2025-03-03 19:44:50.906037,0 days 00:00:00.302183,gaussian_mixture,abundance,2.2,2,COMPLETE
3780,0.3938492180171975,2025-03-03 19:44:50.908562,2025-03-03 19:44:51.208378,0 days 00:00:00.299816,gaussian_mixture,abundance,2.35,2,COMPLETE
3781,0.5813532338490701,2025-03-03 19:44:51.209391,2025-03-03 19:44:51.530520,0 days 00:00:00.321129,gaussian_mixture,abundance,2.0,2,COMPLETE
3782,0.4509159960668366,2025-03-03 19:44:51.532525,2025-03-03 19:44:51.837206,0 days 00:00:00.304681,gaussian_mixture,abundance,2.25,2,COMPLETE
3783,0.4509159960668366,2025-03-03 19:44:51.839210,2025-03-03 19:44:52.140293,0 days 00:00:00.301083,gaussian_mixture,abundance,2.1,2,COMPLETE
3784,0.015109037859426504,2025-03-03 19:44:52.141298,2025-03-03 19:44:53.738026,0 days 00:00:01.596728,gaussian_mixture,presence,10.0,2,COMPLETE
3785,0.26653433813902744,2025-03-03 19:44:53.740017,2025-03-03 19:44:54.065106,0 days 00:00:00.325089,gaussian_mixture,abundance,2.4000000000000004,2,COMPLETE
3786,0.34887786247605285,2025-03-03 19:44:54.067103,2025-03-03 19:44:54.362824,0 days 00:00:00.295721,gaussian_mixture,abundance,2.5500000000000003,2,COMPLETE
3787,0.5258198721301428,2025-03-03 19:44:54.365060,2025-03-03 19:44:54.688238,0 days 00:00:00.323178,gaussian_mixture,abundance,2.2,2,COMPLETE
3788,0.3895536644578789,2025-03-03 19:44:54.690241,2025-03-03 19:44:54.999317,0 days 00:00:00.309076,gaussian_mixture,abundance,2.25,2,COMPLETE
3789,0.5208641039139152,2025-03-03 19:44:55.001308,2025-03-03 19:44:55.302042,0 days 00:00:00.300734,gaussian_mixture,abundance,2.45,2,COMPLETE
3790,0.37694303982408595,2025-03-03 19:44:55.304046,2025-03-03 19:44:55.599250,0 days 00:00:00.295204,kmeans,abundance,2.3000000000000003,2,COMPLETE
3791,0.4089089844478334,2025-03-03 19:44:55.601253,2025-03-03 19:44:55.900842,0 days 00:00:00.299589,gaussian_mixture,abundance,2.15,2,COMPLETE
3792,0.6314313364292232,2025-03-03 19:44:55.902850,2025-03-03 19:44:56.205252,0 days 00:00:00.302402,gaussian_mixture,abundance,2.35,2,COMPLETE
3793,0.5312177363920808,2025-03-03 19:44:56.206256,2025-03-03 19:44:56.510960,0 days 00:00:00.304704,gaussian_mixture,abundance,1.9500000000000002,2,COMPLETE
3794,0.3833824605831657,2025-03-03 19:44:56.512963,2025-03-03 19:44:56.822121,0 days 00:00:00.309158,gaussian_mixture,abundance,2.1,2,COMPLETE
3795,0.6267852987459875,2025-03-03 19:44:56.824126,2025-03-03 19:44:57.134865,0 days 00:00:00.310739,gaussian_mixture,abundance,2.25,2,COMPLETE
3796,0.34541858871453013,2025-03-03 19:44:57.136865,2025-03-03 19:44:57.437268,0 days 00:00:00.300403,gaussian_mixture,abundance,2.4000000000000004,2,COMPLETE
3797,0.5758928079977897,2025-03-03 19:44:57.438272,2025-03-03 19:44:57.744827,0 days 00:00:00.306555,gaussian_mixture,abundance,2.0500000000000003,2,COMPLETE
3798,0.5038556219550839,2025-03-03 19:44:57.746820,2025-03-03 19:44:58.047834,0 days 00:00:00.301014,gaussian_mixture,abundance,2.2,2,COMPLETE
3799,0.48915044244086425,2025-03-03 19:44:58.049838,2025-03-03 19:44:58.350679,0 days 00:00:00.300841,gaussian_mixture,abundance,2.35,2,COMPLETE
3800,0.4520426382285532,2025-03-03 19:44:58.352683,2025-03-03 19:44:58.653602,0 days 00:00:00.300919,gaussian_mixture,abundance,2.3000000000000003,2,COMPLETE
3801,0.4066362699409263,2025-03-03 19:44:58.655611,2025-03-03 19:44:58.973490,0 days 00:00:00.317879,gaussian_mixture,abundance,2.15,6,COMPLETE
3802,0.017588419548849193,2025-03-03 19:44:58.975673,2025-03-03 19:45:00.520454,0 days 00:00:01.544781,gaussian_mixture,presence,10.0,2,COMPLETE
3803,0.41842024240973447,2025-03-03 19:45:00.522479,2025-03-03 19:45:00.818435,0 days 00:00:00.295956,gaussian_mixture,abundance,2.45,2,COMPLETE
3804,0.2132460103759554,2025-03-03 19:45:00.820604,2025-03-03 19:45:01.113751,0 days 00:00:00.293147,gaussian_mixture,abundance,2.25,2,COMPLETE
3805,0.3671938838180586,2025-03-03 19:45:01.116539,2025-03-03 19:45:01.396907,0 days 00:00:00.280368,gaussian_mixture,abundance,2.4000000000000004,2,COMPLETE
3806,0.39978389324377234,2025-03-03 19:45:01.398898,2025-03-03 19:45:01.696064,0 days 00:00:00.297166,gaussian_mixture,abundance,2.0,3,COMPLETE
3807,0.4795725965608978,2025-03-03 19:45:01.699052,2025-03-03 19:45:01.999125,0 days 00:00:00.300073,gaussian_mixture,abundance,1.85,2,COMPLETE
3808,0.3729808682958987,2025-03-03 19:45:02.002115,2025-03-03 19:45:02.281230,0 days 00:00:00.279115,kmeans,abundance,2.3000000000000003,2,COMPLETE
3809,0.43741214684430585,2025-03-03 19:45:02.284238,2025-03-03 19:45:02.593094,0 days 00:00:00.308856,gaussian_mixture,abundance,2.5,2,COMPLETE
3810,0.6055036167317025,2025-03-03 19:45:02.595094,2025-03-03 19:45:02.893194,0 days 00:00:00.298100,gaussian_mixture,abundance,2.15,2,COMPLETE
3811,0.633449033953476,2025-03-03 19:45:02.895366,2025-03-03 19:45:03.199298,0 days 00:00:00.303932,gaussian_mixture,abundance,2.2,2,COMPLETE
3812,0.6196122343700615,2025-03-03 19:45:03.201299,2025-03-03 19:45:03.539124,0 days 00:00:00.337825,gaussian_mixture,abundance,2.35,2,COMPLETE
3813,0.6019034203014624,2025-03-03 19:45:03.541126,2025-03-03 19:45:03.885839,0 days 00:00:00.344713,gaussian_mixture,abundance,2.1,2,COMPLETE
3814,0.38992128179636587,2025-03-03 19:45:03.887829,2025-03-03 19:45:04.179938,0 days 00:00:00.292109,gaussian_mixture,abundance,2.35,2,COMPLETE
3815,0.3200861049675191,2025-03-03 19:45:04.182926,2025-03-03 19:45:04.469637,0 days 00:00:00.286711,gaussian_mixture,abundance,2.2,2,COMPLETE
3816,0.5054126986918515,2025-03-03 19:45:04.471634,2025-03-03 19:45:04.763015,0 days 00:00:00.291381,gaussian_mixture,abundance,2.4000000000000004,2,COMPLETE
3817,0.6741892067296915,2025-03-03 19:45:04.765008,2025-03-03 19:45:05.063372,0 days 00:00:00.298364,gaussian_mixture,abundance,2.25,2,COMPLETE
3818,0.4970753466490504,2025-03-03 19:45:05.065749,2025-03-03 19:45:05.375597,0 days 00:00:00.309848,gaussian_mixture,abundance,1.75,2,COMPLETE
3819,0.3922974578741839,2025-03-03 19:45:05.377578,2025-03-03 19:45:05.668061,0 days 00:00:00.290483,gaussian_mixture,abundance,2.1,2,COMPLETE
3820,0.456773031000653,2025-03-03 19:45:05.669055,2025-03-03 19:45:05.977959,0 days 00:00:00.308904,gaussian_mixture,abundance,1.1,3,COMPLETE
3821,-0.004206617472694019,2025-03-03 19:45:05.980968,2025-03-03 19:45:07.464602,0 days 00:00:01.483634,gaussian_mixture,presence,10.0,2,COMPLETE
3822,0.4976077166826801,2025-03-03 19:45:07.466591,2025-03-03 19:45:07.756154,0 days 00:00:00.289563,gaussian_mixture,abundance,2.0,2,COMPLETE
3823,0.4724893973939109,2025-03-03 19:45:07.758151,2025-03-03 19:45:08.047024,0 days 00:00:00.288873,gaussian_mixture,abundance,2.3000000000000003,2,COMPLETE
3824,0.5994595470614495,2025-03-03 19:45:08.049021,2025-03-03 19:45:08.352987,0 days 00:00:00.303966,gaussian_mixture,abundance,2.25,2,COMPLETE
3825,0.5984968211570159,2025-03-03 19:45:08.355204,2025-03-03 19:45:08.646562,0 days 00:00:00.291358,gaussian_mixture,abundance,2.5,2,COMPLETE
3826,0.4408316336196291,2025-03-03 19:45:08.648558,2025-03-03 19:45:08.945823,0 days 00:00:00.297265,gaussian_mixture,abundance,1.55,2,COMPLETE
3827,0.5562115096426888,2025-03-03 19:45:08.947820,2025-03-03 19:45:09.249532,0 days 00:00:00.301712,gaussian_mixture,abundance,2.15,2,COMPLETE
3828,0.4202647657828395,2025-03-03 19:45:09.251540,2025-03-03 19:45:09.547388,0 days 00:00:00.295848,kmeans,abundance,2.3000000000000003,2,COMPLETE
3829,0.3579946651286209,2025-03-03 19:45:09.549374,2025-03-03 19:45:09.854844,0 days 00:00:00.305470,gaussian_mixture,abundance,2.45,2,COMPLETE
3830,0.46843573908115294,2025-03-03 19:45:09.856832,2025-03-03 19:45:10.151064,0 days 00:00:00.294232,gaussian_mixture,abundance,1.9000000000000001,2,COMPLETE
3831,0.45313374016568764,2025-03-03 19:45:10.153058,2025-03-03 19:45:10.454423,0 days 00:00:00.301365,gaussian_mixture,abundance,2.0500000000000003,2,COMPLETE
3832,0.16288555082789066,2025-03-03 19:45:10.456413,2025-03-03 19:45:10.741454,0 days 00:00:00.285041,gaussian_mixture,abundance,2.25,2,COMPLETE
3833,0.23193725270203217,2025-03-03 19:45:10.742450,2025-03-03 19:45:11.034143,0 days 00:00:00.291693,gaussian_mixture,abundance,2.2,2,COMPLETE
3834,0.2526194021624749,2025-03-03 19:45:11.036481,2025-03-03 19:45:11.336395,0 days 00:00:00.299914,gaussian_mixture,abundance,0.9500000000000001,2,COMPLETE
3835,0.41542194081433037,2025-03-03 19:45:11.338379,2025-03-03 19:45:11.637880,0 days 00:00:00.299501,gaussian_mixture,abundance,2.35,2,COMPLETE
3836,0.47330842521737465,2025-03-03 19:45:11.639880,2025-03-03 19:45:11.945222,0 days 00:00:00.305342,gaussian_mixture,abundance,2.4000000000000004,2,COMPLETE
3837,0.4940495401586539,2025-03-03 19:45:11.947218,2025-03-03 19:45:12.245035,0 days 00:00:00.297817,gaussian_mixture,abundance,2.15,2,COMPLETE
3838,0.368258366791529,2025-03-03 19:45:12.247032,2025-03-03 19:45:12.535901,0 days 00:00:00.288869,gaussian_mixture,abundance,2.6,2,COMPLETE
3839,0.49696812262473333,2025-03-03 19:45:12.538642,2025-03-03 19:45:12.830607,0 days 00:00:00.291965,gaussian_mixture,abundance,2.3000000000000003,2,COMPLETE
3840,0.013364096695831985,2025-03-03 19:45:12.832603,2025-03-03 19:45:14.253458,0 days 00:00:01.420855,gaussian_mixture,presence,10.0,2,COMPLETE
3841,0.4774505166523927,2025-03-03 19:45:14.255445,2025-03-03 19:45:14.539113,0 days 00:00:00.283668,gaussian_mixture,abundance,2.0500000000000003,2,COMPLETE
