number,value,datetime_start,datetime_complete,duration,params_algorithm,params_filter_criteria,params_filter_threshold,params_k,state
3401,0.38323345164178674,2025-03-03 19:42:35.474257,2025-03-03 19:42:35.749494,0 days 00:00:00.275237,gaussian_mixture,abundance,2.5500000000000003,2,COMPLETE
3402,0.5175863985140954,2025-03-03 19:42:35.751494,2025-03-03 19:42:36.023608,0 days 00:00:00.272114,gaussian_mixture,abundance,2.3000000000000003,2,COMPLETE
3403,0.4197620523904895,2025-03-03 19:42:36.025615,2025-03-03 19:42:36.295333,0 days 00:00:00.269718,gaussian_mixture,abundance,2.45,2,COMPLETE
3404,0.14284572232831028,2025-03-03 19:42:36.297323,2025-03-03 19:42:36.891842,0 days 00:00:00.594519,gaussian_mixture,abundance,0.05,2,COMPLETE
3405,0.5807974588978283,2025-03-03 19:42:36.893842,2025-03-03 19:42:37.179758,0 days 00:00:00.285916,gaussian_mixture,abundance,2.25,2,COMPLETE
3406,0.5406704617976538,2025-03-03 19:42:37.181321,2025-03-03 19:42:37.462392,0 days 00:00:00.281071,gaussian_mixture,abundance,2.35,2,COMPLETE
3407,0.42045417611231795,2025-03-03 19:42:37.463388,2025-03-03 19:42:37.747287,0 days 00:00:00.283899,gaussian_mixture,abundance,2.25,2,COMPLETE
3408,0.4899548867948097,2025-03-03 19:42:37.749286,2025-03-03 19:42:38.026072,0 days 00:00:00.276786,gaussian_mixture,abundance,1.8,2,COMPLETE
3409,0.010135740924917425,2025-03-03 19:42:38.029073,2025-03-03 19:42:39.557180,0 days 00:00:01.528107,gaussian_mixture,presence,10.0,2,COMPLETE
3410,0.6584188256982936,2025-03-03 19:42:39.559180,2025-03-03 19:42:39.845134,0 days 00:00:00.285954,gaussian_mixture,abundance,2.3000000000000003,2,COMPLETE
3411,0.5637778675467932,2025-03-03 19:42:39.846676,2025-03-03 19:42:40.124294,0 days 00:00:00.277618,gaussian_mixture,abundance,2.45,2,COMPLETE
3412,0.58730112827895,2025-03-03 19:42:40.126291,2025-03-03 19:42:40.398317,0 days 00:00:00.272026,gaussian_mixture,abundance,2.35,2,COMPLETE
3413,0.5149947055693138,2025-03-03 19:42:40.400316,2025-03-03 19:42:40.678578,0 days 00:00:00.278262,gaussian_mixture,abundance,2.4000000000000004,2,COMPLETE
3414,0.6310823666302119,2025-03-03 19:42:40.680577,2025-03-03 19:42:40.974947,0 days 00:00:00.294370,gaussian_mixture,abundance,2.25,2,COMPLETE
3415,0.3094646004789939,2025-03-03 19:42:40.976946,2025-03-03 19:42:41.254606,0 days 00:00:00.277660,kmeans,abundance,1.85,2,COMPLETE
3416,0.4167093890431411,2025-03-03 19:42:41.256410,2025-03-03 19:42:41.564562,0 days 00:00:00.308152,gaussian_mixture,abundance,2.4000000000000004,2,COMPLETE
3417,0.4616370772920947,2025-03-03 19:42:41.565560,2025-03-03 19:42:41.841133,0 days 00:00:00.275573,gaussian_mixture,abundance,2.5,2,COMPLETE
3418,0.41248650243643337,2025-03-03 19:42:41.843131,2025-03-03 19:42:42.116450,0 days 00:00:00.273319,gaussian_mixture,abundance,2.3000000000000003,3,COMPLETE
3419,0.5934747789021949,2025-03-03 19:42:42.118447,2025-03-03 19:42:42.401147,0 days 00:00:00.282700,gaussian_mixture,abundance,1.9000000000000001,2,COMPLETE
3420,0.5688094439497415,2025-03-03 19:42:42.402139,2025-03-03 19:42:42.680315,0 days 00:00:00.278176,gaussian_mixture,abundance,2.3000000000000003,2,COMPLETE
3421,0.41479059139166685,2025-03-03 19:42:42.682308,2025-03-03 19:42:42.973130,0 days 00:00:00.290822,gaussian_mixture,abundance,2.35,2,COMPLETE
3422,0.5727914334314612,2025-03-03 19:42:42.975130,2025-03-03 19:42:43.314216,0 days 00:00:00.339086,gaussian_mixture,abundance,2.25,2,COMPLETE
3423,0.5652564110527933,2025-03-03 19:42:43.315210,2025-03-03 19:42:43.585805,0 days 00:00:00.270595,gaussian_mixture,abundance,2.4000000000000004,2,COMPLETE
3424,0.46649630231386496,2025-03-03 19:42:43.587808,2025-03-03 19:42:43.884967,0 days 00:00:00.297159,gaussian_mixture,abundance,2.25,2,COMPLETE
3425,0.49058778952271426,2025-03-03 19:42:43.886957,2025-03-03 19:42:44.175164,0 days 00:00:00.288207,gaussian_mixture,abundance,2.35,2,COMPLETE
3426,0.31326392341415743,2025-03-03 19:42:44.176160,2025-03-03 19:42:44.461584,0 days 00:00:00.285424,gaussian_mixture,abundance,2.3000000000000003,2,COMPLETE
3427,0.04616608209467823,2025-03-03 19:42:44.462578,2025-03-03 19:42:45.836917,0 days 00:00:01.374339,gaussian_mixture,presence,20.0,2,COMPLETE
3428,0.46625592703318414,2025-03-03 19:42:45.839145,2025-03-03 19:42:46.132171,0 days 00:00:00.293026,gaussian_mixture,abundance,1.25,2,COMPLETE
3429,0.23822833601636956,2025-03-03 19:42:46.134316,2025-03-03 19:42:46.402231,0 days 00:00:00.267915,gaussian_mixture,abundance,2.5,2,COMPLETE
3430,0.6353749482218015,2025-03-03 19:42:46.404030,2025-03-03 19:42:46.695065,0 days 00:00:00.291035,gaussian_mixture,abundance,2.25,2,COMPLETE
3431,0.5652732833063714,2025-03-03 19:42:46.698060,2025-03-03 19:42:46.979236,0 days 00:00:00.281176,gaussian_mixture,abundance,2.4000000000000004,2,COMPLETE
3432,0.5816027056270063,2025-03-03 19:42:46.981233,2025-03-03 19:42:47.270595,0 days 00:00:00.289362,gaussian_mixture,abundance,2.25,2,COMPLETE
3433,0.5125921560411326,2025-03-03 19:42:47.272593,2025-03-03 19:42:47.539691,0 days 00:00:00.267098,kmeans,abundance,2.45,2,COMPLETE
3434,0.43902757787456936,2025-03-03 19:42:47.541700,2025-03-03 19:42:47.831485,0 days 00:00:00.289785,gaussian_mixture,abundance,2.35,2,COMPLETE
3435,0.6634017623408495,2025-03-03 19:42:47.833484,2025-03-03 19:42:48.120157,0 days 00:00:00.286673,gaussian_mixture,abundance,2.2,2,COMPLETE
3436,0.6333915723747436,2025-03-03 19:42:48.122154,2025-03-03 19:42:48.400505,0 days 00:00:00.278351,gaussian_mixture,abundance,2.3000000000000003,2,COMPLETE
3437,0.670847130393574,2025-03-03 19:42:48.402502,2025-03-03 19:42:48.681613,0 days 00:00:00.279111,gaussian_mixture,abundance,2.25,2,COMPLETE
3438,0.3858626691792765,2025-03-03 19:42:48.682608,2025-03-03 19:42:48.956412,0 days 00:00:00.273804,gaussian_mixture,abundance,2.4000000000000004,3,COMPLETE
3439,0.4780869470073135,2025-03-03 19:42:48.957923,2025-03-03 19:42:49.239863,0 days 00:00:00.281940,gaussian_mixture,abundance,2.2,2,COMPLETE
3440,0.332539473514389,2025-03-03 19:42:49.240859,2025-03-03 19:42:49.519042,0 days 00:00:00.278183,gaussian_mixture,abundance,2.35,2,COMPLETE
3441,0.5697570961027484,2025-03-03 19:42:49.521040,2025-03-03 19:42:49.803159,0 days 00:00:00.282119,gaussian_mixture,abundance,2.3000000000000003,2,COMPLETE
3442,0.5678260201091435,2025-03-03 19:42:49.804155,2025-03-03 19:42:50.096775,0 days 00:00:00.292620,gaussian_mixture,abundance,2.45,2,COMPLETE
3443,0.46471408365454103,2025-03-03 19:42:50.098989,2025-03-03 19:42:50.385238,0 days 00:00:00.286249,gaussian_mixture,abundance,2.3000000000000003,5,COMPLETE
3444,0.6307387831906717,2025-03-03 19:42:50.387231,2025-03-03 19:42:50.662872,0 days 00:00:00.275641,gaussian_mixture,abundance,2.2,2,COMPLETE
3445,0.4724893973939109,2025-03-03 19:42:50.666082,2025-03-03 19:42:50.939038,0 days 00:00:00.272956,gaussian_mixture,abundance,2.25,2,COMPLETE
3446,0.688371554085667,2025-03-03 19:42:50.940034,2025-03-03 19:42:51.224116,0 days 00:00:00.284082,gaussian_mixture,abundance,2.2,2,COMPLETE
3447,0.03839042699545929,2025-03-03 19:42:51.227123,2025-03-03 19:42:52.649235,0 days 00:00:01.422112,gaussian_mixture,presence,15.0,2,COMPLETE
3448,0.50040439456535,2025-03-03 19:42:52.651227,2025-03-03 19:42:52.925280,0 days 00:00:00.274053,gaussian_mixture,abundance,2.35,2,COMPLETE
3449,0.41373421815655986,2025-03-03 19:42:52.927277,2025-03-03 19:42:53.226226,0 days 00:00:00.298949,gaussian_mixture,abundance,2.5500000000000003,2,COMPLETE
3450,0.4576188133069866,2025-03-03 19:42:53.228225,2025-03-03 19:42:53.527170,0 days 00:00:00.298945,gaussian_mixture,abundance,1.9000000000000001,2,COMPLETE
3451,0.5353036826654198,2025-03-03 19:42:53.529170,2025-03-03 19:42:53.818008,0 days 00:00:00.288838,gaussian_mixture,abundance,2.45,2,COMPLETE
3452,0.6037414212694955,2025-03-03 19:42:53.820591,2025-03-03 19:42:54.123195,0 days 00:00:00.302604,gaussian_mixture,abundance,2.4000000000000004,2,COMPLETE
3453,0.3961811339599861,2025-03-03 19:42:54.126199,2025-03-03 19:42:54.491017,0 days 00:00:00.364818,kmeans,abundance,2.3000000000000003,2,COMPLETE
3454,0.3498814729124896,2025-03-03 19:42:54.494017,2025-03-03 19:42:54.771057,0 days 00:00:00.277040,gaussian_mixture,abundance,2.25,2,COMPLETE
3455,0.5917067847696168,2025-03-03 19:42:54.772057,2025-03-03 19:42:55.057242,0 days 00:00:00.285185,gaussian_mixture,abundance,2.2,2,COMPLETE
3456,0.5907653568158635,2025-03-03 19:42:55.059242,2025-03-03 19:42:55.340536,0 days 00:00:00.281294,gaussian_mixture,abundance,2.35,2,COMPLETE
3457,0.4961873452544509,2025-03-03 19:42:55.342536,2025-03-03 19:42:55.628960,0 days 00:00:00.286424,gaussian_mixture,abundance,2.2,2,COMPLETE
3458,0.6669276884751494,2025-03-03 19:42:55.631959,2025-03-03 19:42:55.905946,0 days 00:00:00.273987,gaussian_mixture,abundance,2.4000000000000004,2,COMPLETE
3459,0.4828147833937725,2025-03-03 19:42:55.908709,2025-03-03 19:42:56.253438,0 days 00:00:00.344729,gaussian_mixture,abundance,2.25,2,COMPLETE
3460,0.17537131710190348,2025-03-03 19:42:56.256430,2025-03-03 19:42:56.543152,0 days 00:00:00.286722,gaussian_mixture,abundance,1.6,2,COMPLETE
3461,0.547551325454006,2025-03-03 19:42:56.545382,2025-03-03 19:42:56.823307,0 days 00:00:00.277925,gaussian_mixture,abundance,2.3000000000000003,2,COMPLETE
3462,0.47983311818545393,2025-03-03 19:42:56.825307,2025-03-03 19:42:57.101133,0 days 00:00:00.275826,gaussian_mixture,abundance,2.45,2,COMPLETE
3463,0.382865324984192,2025-03-03 19:42:57.103138,2025-03-03 19:42:57.376244,0 days 00:00:00.273106,gaussian_mixture,abundance,2.35,2,COMPLETE
3464,0.4705519246286456,2025-03-03 19:42:57.378244,2025-03-03 19:42:57.655250,0 days 00:00:00.277006,gaussian_mixture,abundance,2.2,2,COMPLETE
3465,0.04595837912906281,2025-03-03 19:42:57.656250,2025-03-03 19:42:59.050338,0 days 00:00:01.394088,gaussian_mixture,presence,20.0,2,COMPLETE
3466,0.497513974306389,2025-03-03 19:42:59.052338,2025-03-03 19:42:59.325250,0 days 00:00:00.272912,gaussian_mixture,abundance,1.85,2,COMPLETE
3467,0.5669550631580996,2025-03-03 19:42:59.326249,2025-03-03 19:42:59.600706,0 days 00:00:00.274457,gaussian_mixture,abundance,2.5,2,COMPLETE
3468,0.4190582636458367,2025-03-03 19:42:59.602514,2025-03-03 19:42:59.874282,0 days 00:00:00.271768,gaussian_mixture,abundance,2.3000000000000003,2,COMPLETE
3469,0.3261693531244621,2025-03-03 19:42:59.875376,2025-03-03 19:43:00.160594,0 days 00:00:00.285218,gaussian_mixture,abundance,2.25,2,COMPLETE
3470,0.6535086126802628,2025-03-03 19:43:00.162600,2025-03-03 19:43:00.442510,0 days 00:00:00.279910,gaussian_mixture,abundance,2.4000000000000004,2,COMPLETE
3471,0.18985334736617704,2025-03-03 19:43:00.444509,2025-03-03 19:43:00.725794,0 days 00:00:00.281285,kmeans,abundance,0.9,2,COMPLETE
3472,0.7119436633010585,2025-03-03 19:43:00.726794,2025-03-03 19:43:01.015054,0 days 00:00:00.288260,gaussian_mixture,abundance,2.2,2,COMPLETE
3473,0.3915349207299921,2025-03-03 19:43:01.017373,2025-03-03 19:43:01.307845,0 days 00:00:00.290472,gaussian_mixture,abundance,2.3000000000000003,2,COMPLETE
3474,0.3591236272417785,2025-03-03 19:43:01.309845,2025-03-03 19:43:01.590612,0 days 00:00:00.280767,gaussian_mixture,abundance,2.35,2,COMPLETE
3475,0.44472774932984793,2025-03-03 19:43:01.592612,2025-03-03 19:43:01.871690,0 days 00:00:00.279078,gaussian_mixture,abundance,2.2,2,COMPLETE
3476,0.6709045919723063,2025-03-03 19:43:01.872713,2025-03-03 19:43:02.195913,0 days 00:00:00.323200,gaussian_mixture,abundance,2.25,2,COMPLETE
3477,0.1632838022965714,2025-03-03 19:43:02.197911,2025-03-03 19:43:02.525036,0 days 00:00:00.327125,gaussian_mixture,abundance,2.35,2,COMPLETE
3478,0.16869151680400177,2025-03-03 19:43:02.527036,2025-03-03 19:43:02.800772,0 days 00:00:00.273736,gaussian_mixture,abundance,2.2,2,COMPLETE
3479,0.7078160016195246,2025-03-03 19:43:02.802772,2025-03-03 19:43:03.089486,0 days 00:00:00.286714,gaussian_mixture,abundance,2.15,2,COMPLETE
3480,0.38271185450750916,2025-03-03 19:43:03.091284,2025-03-03 19:43:03.373684,0 days 00:00:00.282400,gaussian_mixture,abundance,1.9000000000000001,2,COMPLETE
3481,0.4025175097486352,2025-03-03 19:43:03.374896,2025-03-03 19:43:03.672165,0 days 00:00:00.297269,gaussian_mixture,abundance,2.5,2,COMPLETE
3482,0.5019778102816003,2025-03-03 19:43:03.674188,2025-03-03 19:43:03.958022,0 days 00:00:00.283834,gaussian_mixture,abundance,2.45,2,COMPLETE
3483,0.045467086084191324,2025-03-03 19:43:03.961045,2025-03-03 19:43:05.546184,0 days 00:00:01.585139,gaussian_mixture,presence,10.0,2,COMPLETE
3484,0.3547566326278058,2025-03-03 19:43:05.548179,2025-03-03 19:43:05.825566,0 days 00:00:00.277387,gaussian_mixture,abundance,1.75,2,COMPLETE
3485,0.6407477641854399,2025-03-03 19:43:05.826566,2025-03-03 19:43:06.109078,0 days 00:00:00.282512,gaussian_mixture,abundance,2.4000000000000004,2,COMPLETE
3486,0.34703282920132345,2025-03-03 19:43:06.111080,2025-03-03 19:43:06.414074,0 days 00:00:00.302994,gaussian_mixture,abundance,1.05,4,COMPLETE
3487,0.42003365141812415,2025-03-03 19:43:06.417066,2025-03-03 19:43:06.696144,0 days 00:00:00.279078,gaussian_mixture,abundance,2.25,2,COMPLETE
3488,0.551457633390647,2025-03-03 19:43:06.698143,2025-03-03 19:43:06.980508,0 days 00:00:00.282365,gaussian_mixture,abundance,2.3000000000000003,2,COMPLETE
3489,0.2890637442082269,2025-03-03 19:43:06.982506,2025-03-03 19:43:07.268319,0 days 00:00:00.285813,kmeans,abundance,1.9500000000000002,2,COMPLETE
3490,0.4793479378639959,2025-03-03 19:43:07.270485,2025-03-03 19:43:07.606699,0 days 00:00:00.336214,gaussian_mixture,abundance,2.35,2,COMPLETE
3491,0.699421255027764,2025-03-03 19:43:07.609702,2025-03-03 19:43:07.968071,0 days 00:00:00.358369,gaussian_mixture,abundance,2.15,2,COMPLETE
3492,0.2730864886197775,2025-03-03 19:43:07.971070,2025-03-03 19:43:08.297665,0 days 00:00:00.326595,gaussian_mixture,abundance,2.25,2,COMPLETE
3493,0.562586433569464,2025-03-03 19:43:08.299659,2025-03-03 19:43:08.589617,0 days 00:00:00.289958,gaussian_mixture,abundance,2.2,3,COMPLETE
3494,0.5391027808039006,2025-03-03 19:43:08.590617,2025-03-03 19:43:08.875685,0 days 00:00:00.285068,gaussian_mixture,abundance,2.6,2,COMPLETE
3495,0.16288555082789066,2025-03-03 19:43:08.876685,2025-03-03 19:43:09.174527,0 days 00:00:00.297842,gaussian_mixture,abundance,2.4000000000000004,2,COMPLETE
3496,0.6509159960668365,2025-03-03 19:43:09.177532,2025-03-03 19:43:09.493632,0 days 00:00:00.316100,gaussian_mixture,abundance,2.3000000000000003,2,COMPLETE
3497,0.4290722525055721,2025-03-03 19:43:09.495654,2025-03-03 19:43:09.790668,0 days 00:00:00.295014,gaussian_mixture,abundance,2.3000000000000003,2,COMPLETE
3498,0.5581434607424189,2025-03-03 19:43:09.792667,2025-03-03 19:43:10.153165,0 days 00:00:00.360498,gaussian_mixture,abundance,2.15,2,COMPLETE
3499,0.7113220454819527,2025-03-03 19:43:10.155455,2025-03-03 19:43:10.468307,0 days 00:00:00.312852,gaussian_mixture,abundance,2.35,2,COMPLETE
3500,0.6634017623408495,2025-03-03 19:43:10.470307,2025-03-03 19:43:10.758129,0 days 00:00:00.287822,gaussian_mixture,abundance,2.15,2,COMPLETE
3501,0.39329638673397554,2025-03-03 19:43:10.760129,2025-03-03 19:43:11.030641,0 days 00:00:00.270512,gaussian_mixture,abundance,2.25,2,COMPLETE
3502,0.4113034043748546,2025-03-03 19:43:11.031637,2025-03-03 19:43:11.307008,0 days 00:00:00.275371,gaussian_mixture,abundance,2.2,2,COMPLETE
3503,0.09809066960573615,2025-03-03 19:43:11.309017,2025-03-03 19:43:12.846607,0 days 00:00:01.537590,gaussian_mixture,presence,25.0,6,COMPLETE
3504,0.5255463680060172,2025-03-03 19:43:12.847604,2025-03-03 19:43:13.122036,0 days 00:00:00.274432,gaussian_mixture,abundance,2.35,2,COMPLETE
3505,0.47020244363432634,2025-03-03 19:43:13.124036,2025-03-03 19:43:13.403172,0 days 00:00:00.279136,gaussian_mixture,abundance,2.45,2,COMPLETE
3506,0.5370462256441575,2025-03-03 19:43:13.405171,2025-03-03 19:43:13.688054,0 days 00:00:00.282883,gaussian_mixture,abundance,2.5,2,COMPLETE
3507,0.7008573203596798,2025-03-03 19:43:13.689606,2025-03-03 19:43:14.018677,0 days 00:00:00.329071,gaussian_mixture,abundance,2.3000000000000003,2,COMPLETE
3508,0.1260838641850513,2025-03-03 19:43:14.020671,2025-03-03 19:43:14.309270,0 days 00:00:00.288599,kmeans,abundance,1.5,2,COMPLETE
3509,0.17189225866607322,2025-03-03 19:43:14.312271,2025-03-03 19:43:14.645841,0 days 00:00:00.333570,gaussian_mixture,abundance,0.25,2,COMPLETE
3510,0.4065724973718239,2025-03-03 19:43:14.649857,2025-03-03 19:43:14.930248,0 days 00:00:00.280391,gaussian_mixture,abundance,2.2,2,COMPLETE
3511,0.39485965844584736,2025-03-03 19:43:14.933247,2025-03-03 19:43:15.211357,0 days 00:00:00.278110,gaussian_mixture,abundance,2.25,2,COMPLETE
3512,0.535365427079225,2025-03-03 19:43:15.213358,2025-03-03 19:43:15.494547,0 days 00:00:00.281189,gaussian_mixture,abundance,2.6,2,COMPLETE
3513,0.5488504195606962,2025-03-03 19:43:15.497562,2025-03-03 19:43:15.780641,0 days 00:00:00.283079,gaussian_mixture,abundance,2.4000000000000004,2,COMPLETE
3514,0.4640643675023095,2025-03-03 19:43:15.782640,2025-03-03 19:43:16.084685,0 days 00:00:00.302045,gaussian_mixture,abundance,2.15,2,COMPLETE
3515,0.32137260005413604,2025-03-03 19:43:16.086196,2025-03-03 19:43:16.365018,0 days 00:00:00.278822,gaussian_mixture,abundance,2.25,2,COMPLETE
3516,0.34517965040336607,2025-03-03 19:43:16.368031,2025-03-03 19:43:16.643220,0 days 00:00:00.275189,gaussian_mixture,abundance,1.9000000000000001,2,COMPLETE
3517,0.5901233239543693,2025-03-03 19:43:16.645306,2025-03-03 19:43:16.925486,0 days 00:00:00.280180,gaussian_mixture,abundance,2.35,2,COMPLETE
3518,0.6743141244693239,2025-03-03 19:43:16.927491,2025-03-03 19:43:17.215836,0 days 00:00:00.288345,gaussian_mixture,abundance,2.15,2,COMPLETE
3519,0.3309141126571495,2025-03-03 19:43:17.217835,2025-03-03 19:43:17.507895,0 days 00:00:00.290060,gaussian_mixture,abundance,2.3000000000000003,2,COMPLETE
3520,0.7296597712096574,2025-03-03 19:43:17.509894,2025-03-03 19:43:17.788970,0 days 00:00:00.279076,gaussian_mixture,abundance,2.4000000000000004,2,COMPLETE
3521,0.46176876651908555,2025-03-03 19:43:17.791184,2025-03-03 19:43:18.086290,0 days 00:00:00.295106,gaussian_mixture,abundance,2.45,2,COMPLETE
3522,0.27135272117172204,2025-03-03 19:43:18.087812,2025-03-03 19:43:18.370263,0 days 00:00:00.282451,gaussian_mixture,abundance,2.5500000000000003,2,COMPLETE
3523,0.4322879618737174,2025-03-03 19:43:18.372841,2025-03-03 19:43:18.656137,0 days 00:00:00.283296,gaussian_mixture,abundance,2.5,4,COMPLETE
3524,0.04486125837605494,2025-03-03 19:43:18.658137,2025-03-03 19:43:19.992444,0 days 00:00:01.334307,gaussian_mixture,presence,85.0,2,COMPLETE
3525,0.45717037381574654,2025-03-03 19:43:19.994446,2025-03-03 19:43:20.306190,0 days 00:00:00.311744,gaussian_mixture,abundance,2.4000000000000004,2,COMPLETE
3526,0.5701750609856115,2025-03-03 19:43:20.308175,2025-03-03 19:43:20.585581,0 days 00:00:00.277406,gaussian_mixture,abundance,2.5,2,COMPLETE
3527,0.22832249928692683,2025-03-03 19:43:20.587581,2025-03-03 19:43:20.863560,0 days 00:00:00.275979,kmeans,abundance,2.4000000000000004,2,COMPLETE
3528,0.463041632970865,2025-03-03 19:43:20.864929,2025-03-03 19:43:21.147325,0 days 00:00:00.282396,gaussian_mixture,abundance,2.5500000000000003,2,COMPLETE
3529,0.3539023038981572,2025-03-03 19:43:21.149307,2025-03-03 19:43:21.428508,0 days 00:00:00.279201,gaussian_mixture,abundance,2.5,2,COMPLETE
3530,0.4614068651361542,2025-03-03 19:43:21.430502,2025-03-03 19:43:21.721839,0 days 00:00:00.291337,gaussian_mixture,abundance,2.45,5,COMPLETE
3531,0.38767460727306524,2025-03-03 19:43:21.723833,2025-03-03 19:43:22.003128,0 days 00:00:00.279295,gaussian_mixture,abundance,2.4000000000000004,2,COMPLETE
3532,0.4466483498415351,2025-03-03 19:43:22.005128,2025-03-03 19:43:22.304653,0 days 00:00:00.299525,gaussian_mixture,abundance,2.45,2,COMPLETE
3533,0.4561284579197372,2025-03-03 19:43:22.306957,2025-03-03 19:43:22.589876,0 days 00:00:00.282919,gaussian_mixture,abundance,2.5,2,COMPLETE
3534,0.36894501297109344,2025-03-03 19:43:22.591873,2025-03-03 19:43:22.873213,0 days 00:00:00.281340,gaussian_mixture,abundance,2.5500000000000003,2,COMPLETE
3535,0.4752502252982154,2025-03-03 19:43:22.874603,2025-03-03 19:43:23.154238,0 days 00:00:00.279635,gaussian_mixture,abundance,2.45,2,COMPLETE
3536,0.378595742433571,2025-03-03 19:43:23.156231,2025-03-03 19:43:23.442154,0 days 00:00:00.285923,gaussian_mixture,abundance,2.45,2,COMPLETE
3537,0.49696812262473333,2025-03-03 19:43:23.444143,2025-03-03 19:43:23.731853,0 days 00:00:00.287710,gaussian_mixture,abundance,2.4000000000000004,2,COMPLETE
3538,0.5054126986918515,2025-03-03 19:43:23.733850,2025-03-03 19:43:24.007097,0 days 00:00:00.273247,gaussian_mixture,abundance,2.45,2,COMPLETE
3539,0.29606087039171575,2025-03-03 19:43:24.008888,2025-03-03 19:43:24.286344,0 days 00:00:00.277456,gaussian_mixture,abundance,2.4000000000000004,2,COMPLETE
3540,0.017588419548849193,2025-03-03 19:43:24.288327,2025-03-03 19:43:25.714232,0 days 00:00:01.425905,gaussian_mixture,presence,10.0,2,COMPLETE
3541,0.5057146167767947,2025-03-03 19:43:25.716227,2025-03-03 19:43:25.993897,0 days 00:00:00.277670,gaussian_mixture,abundance,2.45,3,COMPLETE
3542,0.5013790060108875,2025-03-03 19:43:25.996899,2025-03-03 19:43:26.269595,0 days 00:00:00.272696,gaussian_mixture,abundance,2.45,2,COMPLETE
3543,0.5095611129230633,2025-03-03 19:43:26.270591,2025-03-03 19:43:26.551527,0 days 00:00:00.280936,gaussian_mixture,abundance,2.4000000000000004,2,COMPLETE
3544,0.37222320205100157,2025-03-03 19:43:26.553153,2025-03-03 19:43:26.839252,0 days 00:00:00.286099,gaussian_mixture,abundance,2.5,2,COMPLETE
3545,0.5361044792084965,2025-03-03 19:43:26.841236,2025-03-03 19:43:27.123988,0 days 00:00:00.282752,gaussian_mixture,abundance,2.5500000000000003,2,COMPLETE
3546,0.3125042410224891,2025-03-03 19:43:27.126600,2025-03-03 19:43:27.398283,0 days 00:00:00.271683,kmeans,abundance,2.4000000000000004,2,COMPLETE
3547,0.5130402496389953,2025-03-03 19:43:27.400807,2025-03-03 19:43:27.675336,0 days 00:00:00.274529,gaussian_mixture,abundance,2.45,2,COMPLETE
