number,value,datetime_start,datetime_complete,duration,params_algorithm,params_filter_criteria,params_filter_threshold,params_k,state
2958,0.07859600080203363,2025-03-03 19:40:03.298977,2025-03-03 19:40:04.433763,0 days 00:00:01.134786,gaussian_mixture,presence,120.0,2,COMPLETE
2959,0.3697570961027484,2025-03-03 19:40:04.436106,2025-03-03 19:40:04.694713,0 days 00:00:00.258607,gaussian_mixture,abundance,2.0,2,COMPLETE
2960,0.688371554085667,2025-03-03 19:40:04.696697,2025-03-03 19:40:04.956316,0 days 00:00:00.259619,gaussian_mixture,abundance,2.15,2,COMPLETE
2961,0.5200273927302126,2025-03-03 19:40:04.958309,2025-03-03 19:40:05.233464,0 days 00:00:00.275155,gaussian_mixture,abundance,2.2,2,COMPLETE
2962,0.39613571680969384,2025-03-03 19:40:05.235453,2025-03-03 19:40:05.516787,0 days 00:00:00.281334,gaussian_mixture,abundance,0.75,2,COMPLETE
2963,0.4485759603297484,2025-03-03 19:40:05.518787,2025-03-03 19:40:05.786704,0 days 00:00:00.267917,gaussian_mixture,abundance,2.1,5,COMPLETE
2964,0.2404024371409384,2025-03-03 19:40:05.787693,2025-03-03 19:40:06.043932,0 days 00:00:00.256239,kmeans,abundance,2.0,2,COMPLETE
2965,0.5441058597978851,2025-03-03 19:40:06.045942,2025-03-03 19:40:06.309786,0 days 00:00:00.263844,gaussian_mixture,abundance,1.9000000000000001,2,COMPLETE
2966,0.34541858871453013,2025-03-03 19:40:06.311781,2025-03-03 19:40:06.570012,0 days 00:00:00.258231,gaussian_mixture,abundance,2.2,2,COMPLETE
2967,0.5491639319455223,2025-03-03 19:40:06.572011,2025-03-03 19:40:06.831931,0 days 00:00:00.259920,gaussian_mixture,abundance,2.2,2,COMPLETE
2968,0.47828187679384104,2025-03-03 19:40:06.833927,2025-03-03 19:40:07.099689,0 days 00:00:00.265762,gaussian_mixture,abundance,2.0500000000000003,2,COMPLETE
2969,0.34586342421615257,2025-03-03 19:40:07.101684,2025-03-03 19:40:07.374262,0 days 00:00:00.272578,gaussian_mixture,abundance,2.15,2,COMPLETE
2970,0.3570312689226138,2025-03-03 19:40:07.376274,2025-03-03 19:40:07.643287,0 days 00:00:00.267013,gaussian_mixture,abundance,2.15,2,COMPLETE
2971,0.6340657220860416,2025-03-03 19:40:07.645278,2025-03-03 19:40:07.914231,0 days 00:00:00.268953,gaussian_mixture,abundance,2.1,2,COMPLETE
2972,0.6468320307457226,2025-03-03 19:40:07.916406,2025-03-03 19:40:08.189005,0 days 00:00:00.272599,gaussian_mixture,abundance,1.9500000000000002,2,COMPLETE
2973,0.2991871270685066,2025-03-03 19:40:08.190321,2025-03-03 19:40:08.454058,0 days 00:00:00.263737,gaussian_mixture,abundance,2.0500000000000003,2,COMPLETE
2974,0.3605426825061667,2025-03-03 19:40:08.456058,2025-03-03 19:40:08.716274,0 days 00:00:00.260216,gaussian_mixture,abundance,2.2,2,COMPLETE
2975,0.7171740049356445,2025-03-03 19:40:08.717279,2025-03-03 19:40:08.986289,0 days 00:00:00.269010,gaussian_mixture,abundance,2.15,2,COMPLETE
2976,0.48933608039086385,2025-03-03 19:40:08.987287,2025-03-03 19:40:09.253036,0 days 00:00:00.265749,gaussian_mixture,abundance,2.1,2,COMPLETE
2977,0.03605877724446989,2025-03-03 19:40:09.254645,2025-03-03 19:40:10.691342,0 days 00:00:01.436697,gaussian_mixture,presence,35.0,3,COMPLETE
2978,0.5008573203596798,2025-03-03 19:40:10.693344,2025-03-03 19:40:10.951316,0 days 00:00:00.257972,gaussian_mixture,abundance,2.2,2,COMPLETE
2979,0.5335575114872793,2025-03-03 19:40:10.953317,2025-03-03 19:40:11.212607,0 days 00:00:00.259290,gaussian_mixture,abundance,1.9000000000000001,2,COMPLETE
2980,0.42531789023962896,2025-03-03 19:40:11.214601,2025-03-03 19:40:11.481124,0 days 00:00:00.266523,gaussian_mixture,abundance,2.2,2,COMPLETE
2981,0.49800677139364036,2025-03-03 19:40:11.483124,2025-03-03 19:40:11.740920,0 days 00:00:00.257796,gaussian_mixture,abundance,2.1,2,COMPLETE
2982,0.15112951700555266,2025-03-03 19:40:11.741920,2025-03-03 19:40:12.008584,0 days 00:00:00.266664,gaussian_mixture,abundance,2.15,2,COMPLETE
2983,0.4326545628171773,2025-03-03 19:40:12.010586,2025-03-03 19:40:12.275538,0 days 00:00:00.264952,kmeans,abundance,2.2,2,COMPLETE
2984,0.579933159796784,2025-03-03 19:40:12.276525,2025-03-03 19:40:12.550788,0 days 00:00:00.274263,gaussian_mixture,abundance,1.6500000000000001,2,COMPLETE
2985,0.5936670676615192,2025-03-03 19:40:12.552790,2025-03-03 19:40:12.816662,0 days 00:00:00.263872,gaussian_mixture,abundance,2.25,2,COMPLETE
2986,0.5287926037816388,2025-03-03 19:40:12.818661,2025-03-03 19:40:13.080224,0 days 00:00:00.261563,gaussian_mixture,abundance,2.0,2,COMPLETE
2987,0.27760688803844513,2025-03-03 19:40:13.082214,2025-03-03 19:40:13.339350,0 days 00:00:00.257136,gaussian_mixture,abundance,1.9500000000000002,2,COMPLETE
2988,0.4652468899102167,2025-03-03 19:40:13.341349,2025-03-03 19:40:13.612401,0 days 00:00:00.271052,gaussian_mixture,abundance,2.2,2,COMPLETE
2989,0.6090163706118368,2025-03-03 19:40:13.614570,2025-03-03 19:40:13.878229,0 days 00:00:00.263659,gaussian_mixture,abundance,2.0500000000000003,2,COMPLETE
2990,0.3814068571976306,2025-03-03 19:40:13.880224,2025-03-03 19:40:14.145573,0 days 00:00:00.265349,gaussian_mixture,abundance,2.0500000000000003,2,COMPLETE
2991,0.5839001923245045,2025-03-03 19:40:14.147572,2025-03-03 19:40:14.408963,0 days 00:00:00.261391,gaussian_mixture,abundance,2.1,2,COMPLETE
2992,0.5253274113822056,2025-03-03 19:40:14.411959,2025-03-03 19:40:14.680245,0 days 00:00:00.268286,gaussian_mixture,abundance,2.15,2,COMPLETE
2993,0.6106709061778561,2025-03-03 19:40:14.682227,2025-03-03 19:40:14.956532,0 days 00:00:00.274305,gaussian_mixture,abundance,2.25,2,COMPLETE
2994,0.2252856002162172,2025-03-03 19:40:14.958528,2025-03-03 19:40:15.222827,0 days 00:00:00.264299,gaussian_mixture,abundance,1.8,2,COMPLETE
2995,0.019308880574539545,2025-03-03 19:40:15.225122,2025-03-03 19:40:16.623286,0 days 00:00:01.398164,gaussian_mixture,presence,10.0,2,COMPLETE
2996,0.47056879688222375,2025-03-03 19:40:16.625584,2025-03-03 19:40:16.884163,0 days 00:00:00.258579,gaussian_mixture,abundance,2.15,2,COMPLETE
2997,0.47431412446932386,2025-03-03 19:40:16.885504,2025-03-03 19:40:17.148871,0 days 00:00:00.263367,gaussian_mixture,abundance,2.0500000000000003,2,COMPLETE
2998,0.3410795159615242,2025-03-03 19:40:17.150854,2025-03-03 19:40:17.411671,0 days 00:00:00.260817,gaussian_mixture,abundance,2.25,2,COMPLETE
2999,0.3833824605831657,2025-03-03 19:40:17.413657,2025-03-03 19:40:17.677547,0 days 00:00:00.263890,gaussian_mixture,abundance,2.1,2,COMPLETE
3000,0.29361762947046577,2025-03-03 19:40:17.679541,2025-03-03 19:40:17.952889,0 days 00:00:00.273348,gaussian_mixture,abundance,2.0,2,COMPLETE
3001,0.566998954031531,2025-03-03 19:40:17.953880,2025-03-03 19:40:18.215386,0 days 00:00:00.261506,gaussian_mixture,abundance,2.2,2,COMPLETE
3002,0.4128188925027464,2025-03-03 19:40:18.217372,2025-03-03 19:40:18.477659,0 days 00:00:00.260287,kmeans,abundance,1.4500000000000002,2,COMPLETE
3003,0.3962878902934703,2025-03-03 19:40:18.479642,2025-03-03 19:40:18.741878,0 days 00:00:00.262236,gaussian_mixture,abundance,2.15,2,COMPLETE
3004,0.2532502919379095,2025-03-03 19:40:18.743630,2025-03-03 19:40:19.004234,0 days 00:00:00.260604,gaussian_mixture,abundance,2.2,2,COMPLETE
3005,0.4853385845808941,2025-03-03 19:40:19.006233,2025-03-03 19:40:19.265167,0 days 00:00:00.258934,gaussian_mixture,abundance,2.25,2,COMPLETE
3006,0.5206093375424384,2025-03-03 19:40:19.267169,2025-03-03 19:40:19.530567,0 days 00:00:00.263398,gaussian_mixture,abundance,2.0500000000000003,2,COMPLETE
3007,0.4130510805894277,2025-03-03 19:40:19.532554,2025-03-03 19:40:19.804044,0 days 00:00:00.271490,gaussian_mixture,abundance,2.15,2,COMPLETE
3008,0.45954123404064917,2025-03-03 19:40:19.806040,2025-03-03 19:40:20.089414,0 days 00:00:00.283374,gaussian_mixture,abundance,2.25,2,COMPLETE
3009,0.18098594907502813,2025-03-03 19:40:20.091417,2025-03-03 19:40:20.372482,0 days 00:00:00.281065,gaussian_mixture,abundance,2.1,2,COMPLETE
3010,0.5991837626861909,2025-03-03 19:40:20.374760,2025-03-03 19:40:20.658359,0 days 00:00:00.283599,gaussian_mixture,abundance,1.9500000000000002,2,COMPLETE
3011,0.521028013203475,2025-03-03 19:40:20.660357,2025-03-03 19:40:20.940113,0 days 00:00:00.279756,gaussian_mixture,abundance,1.9000000000000001,4,COMPLETE
3012,0.528396462102792,2025-03-03 19:40:20.942100,2025-03-03 19:40:21.217573,0 days 00:00:00.275473,gaussian_mixture,abundance,2.2,2,COMPLETE
3013,0.6725562109079275,2025-03-03 19:40:21.219553,2025-03-03 19:40:21.484949,0 days 00:00:00.265396,gaussian_mixture,abundance,2.15,2,COMPLETE
3014,0.057555245873094255,2025-03-03 19:40:21.485972,2025-03-03 19:40:22.954151,0 days 00:00:01.468179,gaussian_mixture,presence,70.0,2,COMPLETE
3015,0.29656338922029646,2025-03-03 19:40:22.956151,2025-03-03 19:40:23.246658,0 days 00:00:00.290507,gaussian_mixture,abundance,2.1,2,COMPLETE
3016,0.41797872569458716,2025-03-03 19:40:23.248648,2025-03-03 19:40:23.536060,0 days 00:00:00.287412,gaussian_mixture,abundance,2.0,2,COMPLETE
3017,0.5966284709591211,2025-03-03 19:40:23.537063,2025-03-03 19:40:23.892845,0 days 00:00:00.355782,gaussian_mixture,abundance,2.25,2,COMPLETE
3018,0.7171740049356445,2025-03-03 19:40:23.894848,2025-03-03 19:40:24.207803,0 days 00:00:00.312955,gaussian_mixture,abundance,2.2,2,COMPLETE
3019,0.5486936562451706,2025-03-03 19:40:24.209805,2025-03-03 19:40:24.516298,0 days 00:00:00.306493,gaussian_mixture,abundance,2.0500000000000003,2,COMPLETE
3020,0.47595277606109654,2025-03-03 19:40:24.518300,2025-03-03 19:40:24.804477,0 days 00:00:00.286177,gaussian_mixture,abundance,2.15,2,COMPLETE
3021,0.23989121903674024,2025-03-03 19:40:24.807024,2025-03-03 19:40:25.213977,0 days 00:00:00.406953,gaussian_mixture,abundance,1.75,2,COMPLETE
3022,0.33197096143804716,2025-03-03 19:40:25.215983,2025-03-03 19:40:25.567853,0 days 00:00:00.351870,kmeans,abundance,2.1,2,COMPLETE
3023,0.6997070428222841,2025-03-03 19:40:25.570840,2025-03-03 19:40:25.853437,0 days 00:00:00.282597,gaussian_mixture,abundance,2.25,2,COMPLETE
3024,0.4843878477398228,2025-03-03 19:40:25.855426,2025-03-03 19:40:26.164755,0 days 00:00:00.309329,gaussian_mixture,abundance,2.2,2,COMPLETE
3025,0.47808694700731336,2025-03-03 19:40:26.167731,2025-03-03 19:40:26.577749,0 days 00:00:00.410018,gaussian_mixture,abundance,2.25,2,COMPLETE
3026,0.4183561153078566,2025-03-03 19:40:26.580742,2025-03-03 19:40:26.854442,0 days 00:00:00.273700,gaussian_mixture,abundance,2.0,2,COMPLETE
3027,0.531187704087533,2025-03-03 19:40:26.855986,2025-03-03 19:40:27.134786,0 days 00:00:00.278800,gaussian_mixture,abundance,1.85,2,COMPLETE
3028,0.3783288187093289,2025-03-03 19:40:27.136784,2025-03-03 19:40:27.400911,0 days 00:00:00.264127,gaussian_mixture,abundance,2.5500000000000003,2,COMPLETE
3029,0.39460881409718046,2025-03-03 19:40:27.402908,2025-03-03 19:40:27.674029,0 days 00:00:00.271121,gaussian_mixture,abundance,2.15,2,COMPLETE
3030,0.6219529054235373,2025-03-03 19:40:27.676024,2025-03-03 19:40:27.956268,0 days 00:00:00.280244,gaussian_mixture,abundance,2.3000000000000003,2,COMPLETE
3031,0.6467419553818103,2025-03-03 19:40:27.958252,2025-03-03 19:40:28.231375,0 days 00:00:00.273123,gaussian_mixture,abundance,2.1,2,COMPLETE
3032,0.41627604356477904,2025-03-03 19:40:28.232382,2025-03-03 19:40:28.505143,0 days 00:00:00.272761,gaussian_mixture,abundance,2.25,2,COMPLETE
3033,0.508912180451347,2025-03-03 19:40:28.506142,2025-03-03 19:40:28.790147,0 days 00:00:00.284005,gaussian_mixture,abundance,1.9500000000000002,2,COMPLETE
3034,0.026911814383683515,2025-03-03 19:40:28.792142,2025-03-03 19:40:30.112541,0 days 00:00:01.320399,gaussian_mixture,presence,65.0,2,COMPLETE
3035,0.5387771687907721,2025-03-03 19:40:30.114541,2025-03-03 19:40:30.388273,0 days 00:00:00.273732,gaussian_mixture,abundance,2.0500000000000003,2,COMPLETE
3036,0.46588044735408296,2025-03-03 19:40:30.390270,2025-03-03 19:40:30.663570,0 days 00:00:00.273300,gaussian_mixture,abundance,2.2,2,COMPLETE
3037,0.5328869054116229,2025-03-03 19:40:30.665568,2025-03-03 19:40:30.953735,0 days 00:00:00.288167,gaussian_mixture,abundance,2.1,2,COMPLETE
3038,0.37816679873799225,2025-03-03 19:40:30.955723,2025-03-03 19:40:31.231170,0 days 00:00:00.275447,gaussian_mixture,abundance,2.3000000000000003,2,COMPLETE
3039,0.4889762204922441,2025-03-03 19:40:31.233171,2025-03-03 19:40:31.500194,0 days 00:00:00.267023,gaussian_mixture,abundance,2.15,2,COMPLETE
3040,0.34987917514270467,2025-03-03 19:40:31.501198,2025-03-03 19:40:31.770124,0 days 00:00:00.268926,kmeans,abundance,2.2,2,COMPLETE
3041,0.4666150008971254,2025-03-03 19:40:31.771124,2025-03-03 19:40:32.057365,0 days 00:00:00.286241,gaussian_mixture,abundance,1.85,6,COMPLETE
3042,0.40232941811603773,2025-03-03 19:40:32.059358,2025-03-03 19:40:32.330545,0 days 00:00:00.271187,gaussian_mixture,abundance,2.3000000000000003,2,COMPLETE
3043,0.566998954031531,2025-03-03 19:40:32.332547,2025-03-03 19:40:32.601298,0 days 00:00:00.268751,gaussian_mixture,abundance,2.15,2,COMPLETE
3044,0.6176690477972769,2025-03-03 19:40:32.603294,2025-03-03 19:40:32.877869,0 days 00:00:00.274575,gaussian_mixture,abundance,2.0500000000000003,2,COMPLETE
3045,0.5330652618056803,2025-03-03 19:40:32.880651,2025-03-03 19:40:33.160794,0 days 00:00:00.280143,gaussian_mixture,abundance,2.25,2,COMPLETE
3046,0.686834778853726,2025-03-03 19:40:33.162797,2025-03-03 19:40:33.439403,0 days 00:00:00.276606,gaussian_mixture,abundance,1.6,2,COMPLETE
3047,0.43247844407478075,2025-03-03 19:40:33.441401,2025-03-03 19:40:33.727668,0 days 00:00:00.286267,gaussian_mixture,abundance,1.1500000000000001,2,COMPLETE
3048,0.37605164318396045,2025-03-03 19:40:33.729666,2025-03-03 19:40:34.009024,0 days 00:00:00.279358,gaussian_mixture,abundance,2.0,5,COMPLETE
3049,0.5475505106282685,2025-03-03 19:40:34.011753,2025-03-03 19:40:34.287344,0 days 00:00:00.275591,gaussian_mixture,abundance,2.1,2,COMPLETE
3050,0.32180875571164924,2025-03-03 19:40:34.289345,2025-03-03 19:40:34.549279,0 days 00:00:00.259934,gaussian_mixture,abundance,2.25,2,COMPLETE
3051,0.4958249967696095,2025-03-03 19:40:34.551282,2025-03-03 19:40:34.836056,0 days 00:00:00.284774,gaussian_mixture,abundance,2.15,2,COMPLETE
3052,0.0034326755884696815,2025-03-03 19:40:34.837057,2025-03-03 19:40:36.339187,0 days 00:00:01.502130,gaussian_mixture,presence,10.0,3,COMPLETE
3053,0.6691001849927931,2025-03-03 19:40:36.341184,2025-03-03 19:40:36.629122,0 days 00:00:00.287938,gaussian_mixture,abundance,2.5,2,COMPLETE
3054,0.4606311868183804,2025-03-03 19:40:36.631110,2025-03-03 19:40:36.922990,0 days 00:00:00.291880,gaussian_mixture,abundance,0.65,2,COMPLETE
3055,0.4444597245414724,2025-03-03 19:40:36.924171,2025-03-03 19:40:37.212684,0 days 00:00:00.288513,gaussian_mixture,abundance,2.3000000000000003,2,COMPLETE
3056,0.4968804168625227,2025-03-03 19:40:37.215188,2025-03-03 19:40:37.510075,0 days 00:00:00.294887,gaussian_mixture,abundance,2.2,2,COMPLETE
3057,0.6990529133801665,2025-03-03 19:40:37.512078,2025-03-03 19:40:37.795870,0 days 00:00:00.283792,gaussian_mixture,abundance,2.15,2,COMPLETE
3058,0.5033982088574052,2025-03-03 19:40:37.798850,2025-03-03 19:40:38.081339,0 days 00:00:00.282489,kmeans,abundance,2.0,2,COMPLETE
3059,0.42914328690084974,2025-03-03 19:40:38.083343,2025-03-03 19:40:38.357560,0 days 00:00:00.274217,gaussian_mixture,abundance,2.3000000000000003,2,COMPLETE
3060,0.4771334518723604,2025-03-03 19:40:38.359558,2025-03-03 19:40:38.635010,0 days 00:00:00.275452,gaussian_mixture,abundance,2.1,2,COMPLETE
3061,0.11018855429356474,2025-03-03 19:40:38.636993,2025-03-03 19:40:38.900050,0 days 00:00:00.263057,gaussian_mixture,abundance,2.6,2,COMPLETE
3062,0.5872704676430012,2025-03-03 19:40:38.901052,2025-03-03 19:40:39.173639,0 days 00:00:00.272587,gaussian_mixture,abundance,2.2,2,COMPLETE
3063,0.5040844545616452,2025-03-03 19:40:39.175641,2025-03-03 19:40:39.476018,0 days 00:00:00.300377,gaussian_mixture,abundance,2.0500000000000003,2,COMPLETE
3064,0.45169465888673743,2025-03-03 19:40:39.478028,2025-03-03 19:40:39.752853,0 days 00:00:00.274825,gaussian_mixture,abundance,2.25,2,COMPLETE
3065,0.5054126986918515,2025-03-03 19:40:39.754853,2025-03-03 19:40:40.044809,0 days 00:00:00.289956,gaussian_mixture,abundance,2.45,2,COMPLETE
3066,0.38751714839155665,2025-03-03 19:40:40.045805,2025-03-03 19:40:40.327392,0 days 00:00:00.281587,gaussian_mixture,abundance,1.9000000000000001,2,COMPLETE
3067,0.4968804168625227,2025-03-03 19:40:40.330389,2025-03-03 19:40:40.614453,0 days 00:00:00.284064,gaussian_mixture,abundance,2.35,2,COMPLETE
3068,0.31135139785971655,2025-03-03 19:40:40.616453,2025-03-03 19:40:40.902960,0 days 00:00:00.286507,gaussian_mixture,abundance,2.2,2,COMPLETE
3069,0.23849825182081297,2025-03-03 19:40:40.904972,2025-03-03 19:40:41.213284,0 days 00:00:00.308312,gaussian_mixture,abundance,0.45,2,COMPLETE
3070,0.43294643678583355,2025-03-03 19:40:41.215287,2025-03-03 19:40:41.504644,0 days 00:00:00.289357,gaussian_mixture,abundance,2.5500000000000003,2,COMPLETE
3071,0.01398220088577829,2025-03-03 19:40:41.506216,2025-03-03 19:40:42.908643,0 days 00:00:01.402427,gaussian_mixture,presence,75.0,2,COMPLETE
3072,0.48029193657428254,2025-03-03 19:40:42.910646,2025-03-03 19:40:43.213592,0 days 00:00:00.302946,gaussian_mixture,abundance,2.15,3,COMPLETE
3073,0.5807974588978283,2025-03-03 19:40:43.215590,2025-03-03 19:40:43.485084,0 days 00:00:00.269494,gaussian_mixture,abundance,2.3000000000000003,2,COMPLETE
3074,0.5195349319822754,2025-03-03 19:40:43.487078,2025-03-03 19:40:43.772850,0 days 00:00:00.285772,gaussian_mixture,abundance,2.1,2,COMPLETE
3075,0.49815409750235407,2025-03-03 19:40:43.774843,2025-03-03 19:40:44.036840,0 days 00:00:00.261997,gaussian_mixture,abundance,2.25,2,COMPLETE
3076,0.4866325648936426,2025-03-03 19:40:44.038839,2025-03-03 19:40:44.299171,0 days 00:00:00.260332,kmeans,abundance,1.9500000000000002,2,COMPLETE
3077,0.4079477165299645,2025-03-03 19:40:44.301168,2025-03-03 19:40:44.565914,0 days 00:00:00.264746,gaussian_mixture,abundance,2.2,2,COMPLETE
3078,0.34069920912521956,2025-03-03 19:40:44.567913,2025-03-03 19:40:44.840814,0 days 00:00:00.272901,gaussian_mixture,abundance,2.0500000000000003,2,COMPLETE
3079,0.5796796500920715,2025-03-03 19:40:44.842804,2025-03-03 19:40:45.117661,0 days 00:00:00.274857,gaussian_mixture,abundance,2.35,2,COMPLETE
3080,0.5741179411733099,2025-03-03 19:40:45.118657,2025-03-03 19:40:45.393891,0 days 00:00:00.275234,gaussian_mixture,abundance,2.5,2,COMPLETE
3081,0.3009358749492505,2025-03-03 19:40:45.395890,2025-03-03 19:40:45.666478,0 days 00:00:00.270588,gaussian_mixture,abundance,2.1,2,COMPLETE
3082,0.3261693531244621,2025-03-03 19:40:45.668480,2025-03-03 19:40:45.986117,0 days 00:00:00.317637,gaussian_mixture,abundance,2.2,2,COMPLETE
3083,0.6147318791543604,2025-03-03 19:40:45.988114,2025-03-03 19:40:46.291850,0 days 00:00:00.303736,gaussian_mixture,abundance,2.3000000000000003,2,COMPLETE
3084,0.39518380751324417,2025-03-03 19:40:46.293856,2025-03-03 19:40:46.592847,0 days 00:00:00.298991,gaussian_mixture,abundance,2.45,2,COMPLETE
3085,0.5523509813424887,2025-03-03 19:40:46.594850,2025-03-03 19:40:46.954368,0 days 00:00:00.359518,gaussian_mixture,abundance,2.15,2,COMPLETE
3086,0.3390206549962431,2025-03-03 19:40:46.956369,2025-03-03 19:40:47.314349,0 days 00:00:00.357980,gaussian_mixture,abundance,2.1,2,COMPLETE
3087,0.560417928112166,2025-03-03 19:40:47.316331,2025-03-03 19:40:47.637716,0 days 00:00:00.321385,gaussian_mixture,abundance,2.0,2,COMPLETE
3088,0.6414096378904388,2025-03-03 19:40:47.639707,2025-03-03 19:40:47.919323,0 days 00:00:00.279616,gaussian_mixture,abundance,2.35,2,COMPLETE
3089,0.01980973058609479,2025-03-03 19:40:47.920972,2025-03-03 19:40:49.370141,0 days 00:00:01.449169,gaussian_mixture,presence,10.0,2,COMPLETE
3090,0.7296597712096574,2025-03-03 19:40:49.372140,2025-03-03 19:40:49.642439,0 days 00:00:00.270299,gaussian_mixture,abundance,2.25,2,COMPLETE
3091,0.41644323008890166,2025-03-03 19:40:49.644621,2025-03-03 19:40:49.908070,0 days 00:00:00.263449,gaussian_mixture,abundance,2.3000000000000003,2,COMPLETE
3092,0.5697570961027484,2025-03-03 19:40:49.909067,2025-03-03 19:40:50.188468,0 days 00:00:00.279401,gaussian_mixture,abundance,2.3000000000000003,2,COMPLETE
3093,0.3987789770063379,2025-03-03 19:40:50.190465,2025-03-03 19:40:50.451997,0 days 00:00:00.261532,gaussian_mixture,abundance,2.3000000000000003,2,COMPLETE
3094,0.492286111407885,2025-03-03 19:40:50.452988,2025-03-03 19:40:50.717826,0 days 00:00:00.264838,gaussian_mixture,abundance,2.25,2,COMPLETE
3095,0.41739785041098526,2025-03-03 19:40:50.719824,2025-03-03 19:40:50.978231,0 days 00:00:00.258407,kmeans,abundance,2.35,2,COMPLETE
3096,0.14650062178725787,2025-03-03 19:40:50.980218,2025-03-03 19:40:51.285546,0 days 00:00:00.305328,gaussian_mixture,abundance,0.35000000000000003,2,COMPLETE
3097,0.5777421773268061,2025-03-03 19:40:51.286529,2025-03-03 19:40:51.547160,0 days 00:00:00.260631,gaussian_mixture,abundance,2.35,2,COMPLETE
3098,0.6196122343700615,2025-03-03 19:40:51.549158,2025-03-03 19:40:51.814632,0 days 00:00:00.265474,gaussian_mixture,abundance,2.3000000000000003,2,COMPLETE
3099,0.36365687769541355,2025-03-03 19:40:51.815621,2025-03-03 19:40:52.078310,0 days 00:00:00.262689,gaussian_mixture,abundance,2.25,2,COMPLETE
3100,0.3072086422783123,2025-03-03 19:40:52.080310,2025-03-03 19:40:52.359444,0 days 00:00:00.279134,gaussian_mixture,abundance,2.4000000000000004,2,COMPLETE
3101,0.2477456135499331,2025-03-03 19:40:52.361445,2025-03-03 19:40:52.624804,0 days 00:00:00.263359,gaussian_mixture,abundance,2.3000000000000003,2,COMPLETE
3102,0.558150888580705,2025-03-03 19:40:52.625799,2025-03-03 19:40:52.907383,0 days 00:00:00.281584,gaussian_mixture,abundance,2.25,4,COMPLETE
3103,0.5130606017320043,2025-03-03 19:40:52.908383,2025-03-03 19:40:53.203293,0 days 00:00:00.294910,gaussian_mixture,abundance,2.25,2,COMPLETE
3104,0.582200426593219,2025-03-03 19:40:53.205294,2025-03-03 19:40:53.481233,0 days 00:00:00.275939,gaussian_mixture,abundance,2.4000000000000004,2,COMPLETE
3105,0.4127351609846621,2025-03-03 19:40:53.483232,2025-03-03 19:40:53.745156,0 days 00:00:00.261924,gaussian_mixture,abundance,2.35,2,COMPLETE
