number,value,datetime_start,datetime_complete,duration,params_algorithm,params_filter_criteria,params_filter_threshold,params_k,state
3548,0.5948596584458474,2025-03-03 19:43:27.678336,2025-03-03 19:43:27.954346,0 days 00:00:00.276010,gaussian_mixture,abundance,2.4000000000000004,2,COMPLETE
3549,0.39460881409718046,2025-03-03 19:43:27.956344,2025-03-03 19:43:28.231819,0 days 00:00:00.275475,gaussian_mixture,abundance,2.35,2,COMPLETE
3550,0.1935669082207802,2025-03-03 19:43:28.233804,2025-03-03 19:43:28.522075,0 days 00:00:00.288271,gaussian_mixture,abundance,1.1500000000000001,2,COMPLETE
3551,0.4642008931891447,2025-03-03 19:43:28.523072,2025-03-03 19:43:28.806925,0 days 00:00:00.283853,gaussian_mixture,abundance,2.35,2,COMPLETE
3552,0.17537131710190348,2025-03-03 19:43:28.808918,2025-03-03 19:43:29.102665,0 days 00:00:00.293747,gaussian_mixture,abundance,2.5,2,COMPLETE
3553,0.14998012111758602,2025-03-03 19:43:29.105196,2025-03-03 19:43:29.392174,0 days 00:00:00.286978,gaussian_mixture,abundance,2.4000000000000004,2,COMPLETE
3554,0.6355576784367468,2025-03-03 19:43:29.394513,2025-03-03 19:43:29.685223,0 days 00:00:00.290710,gaussian_mixture,abundance,2.35,2,COMPLETE
3555,0.2551617876876155,2025-03-03 19:43:29.687223,2025-03-03 19:43:29.966893,0 days 00:00:00.279670,gaussian_mixture,abundance,2.5,2,COMPLETE
3556,0.3011788166744188,2025-03-03 19:43:29.968693,2025-03-03 19:43:30.244113,0 days 00:00:00.275420,gaussian_mixture,abundance,2.4000000000000004,2,COMPLETE
3557,0.43135833438838533,2025-03-03 19:43:30.247123,2025-03-03 19:43:30.533318,0 days 00:00:00.286195,gaussian_mixture,abundance,2.35,2,COMPLETE
3558,0.3920706911326274,2025-03-03 19:43:30.535519,2025-03-03 19:43:30.844314,0 days 00:00:00.308795,gaussian_mixture,abundance,0.65,2,COMPLETE
3559,0.013388576833736154,2025-03-03 19:43:30.847313,2025-03-03 19:43:32.270080,0 days 00:00:01.422767,gaussian_mixture,presence,10.0,2,COMPLETE
3560,0.25264722824470304,2025-03-03 19:43:32.271080,2025-03-03 19:43:32.550190,0 days 00:00:00.279110,gaussian_mixture,abundance,2.6,2,COMPLETE
3561,0.20566270773449244,2025-03-03 19:43:32.552179,2025-03-03 19:43:32.835219,0 days 00:00:00.283040,gaussian_mixture,abundance,2.4000000000000004,2,COMPLETE
3562,0.6997070428222841,2025-03-03 19:43:32.837428,2025-03-03 19:43:33.146571,0 days 00:00:00.309143,gaussian_mixture,abundance,2.45,2,COMPLETE
3563,0.5332697356671832,2025-03-03 19:43:33.148380,2025-03-03 19:43:33.424795,0 days 00:00:00.276415,gaussian_mixture,abundance,2.35,2,COMPLETE
3564,0.5403114568098457,2025-03-03 19:43:33.426795,2025-03-03 19:43:33.712486,0 days 00:00:00.285691,gaussian_mixture,abundance,2.45,2,COMPLETE
3565,0.40337219670380914,2025-03-03 19:43:33.714488,2025-03-03 19:43:34.006663,0 days 00:00:00.292175,gaussian_mixture,abundance,2.35,2,COMPLETE
3566,0.34300047644913684,2025-03-03 19:43:34.008658,2025-03-03 19:43:34.284642,0 days 00:00:00.275984,kmeans,abundance,2.5,2,COMPLETE
3567,0.4936938844298996,2025-03-03 19:43:34.286249,2025-03-03 19:43:34.585295,0 days 00:00:00.299046,gaussian_mixture,abundance,2.35,2,COMPLETE
3568,0.6136964126613064,2025-03-03 19:43:34.587297,2025-03-03 19:43:34.875359,0 days 00:00:00.288062,gaussian_mixture,abundance,2.4000000000000004,2,COMPLETE
3569,0.6178505245297086,2025-03-03 19:43:34.877345,2025-03-03 19:43:35.187357,0 days 00:00:00.310012,gaussian_mixture,abundance,2.4000000000000004,2,COMPLETE
3570,0.6356024973179826,2025-03-03 19:43:35.188362,2025-03-03 19:43:35.491307,0 days 00:00:00.302945,gaussian_mixture,abundance,2.35,2,COMPLETE
3571,0.6188538685322978,2025-03-03 19:43:35.493306,2025-03-03 19:43:35.783293,0 days 00:00:00.289987,gaussian_mixture,abundance,2.45,2,COMPLETE
3572,0.6282619979114271,2025-03-03 19:43:35.785474,2025-03-03 19:43:36.086888,0 days 00:00:00.301414,gaussian_mixture,abundance,2.35,2,COMPLETE
3573,0.332220164728905,2025-03-03 19:43:36.087887,2025-03-03 19:43:36.423791,0 days 00:00:00.335904,gaussian_mixture,abundance,2.5500000000000003,2,COMPLETE
3574,0.21091792723307473,2025-03-03 19:43:36.425792,2025-03-03 19:43:36.738845,0 days 00:00:00.313053,gaussian_mixture,abundance,1.8,2,COMPLETE
3575,0.582605891454117,2025-03-03 19:43:36.740844,2025-03-03 19:43:37.031881,0 days 00:00:00.291037,gaussian_mixture,abundance,2.35,2,COMPLETE
3576,0.46036821351326845,2025-03-03 19:43:37.033876,2025-03-03 19:43:37.382885,0 days 00:00:00.349009,gaussian_mixture,abundance,0.55,2,COMPLETE
3577,0.4382626148852499,2025-03-03 19:43:37.385130,2025-03-03 19:43:37.675581,0 days 00:00:00.290451,gaussian_mixture,abundance,2.4000000000000004,6,COMPLETE
3578,0.02681418167917008,2025-03-03 19:43:37.678595,2025-03-03 19:43:38.952122,0 days 00:00:01.273527,gaussian_mixture,presence,95.0,2,COMPLETE
3579,0.32733230494714205,2025-03-03 19:43:38.954115,2025-03-03 19:43:39.249285,0 days 00:00:00.295170,gaussian_mixture,abundance,2.45,2,COMPLETE
3580,0.3265907437378027,2025-03-03 19:43:39.251285,2025-03-03 19:43:39.541177,0 days 00:00:00.289892,gaussian_mixture,abundance,1.9500000000000002,2,COMPLETE
3581,0.4888301703025886,2025-03-03 19:43:39.542176,2025-03-03 19:43:39.817760,0 days 00:00:00.275584,gaussian_mixture,abundance,2.3000000000000003,2,COMPLETE
3582,0.5070930153645758,2025-03-03 19:43:39.819756,2025-03-03 19:43:40.100426,0 days 00:00:00.280670,gaussian_mixture,abundance,2.5,2,COMPLETE
3583,0.394132564014955,2025-03-03 19:43:40.102447,2025-03-03 19:43:40.369797,0 days 00:00:00.267350,kmeans,abundance,2.3000000000000003,2,COMPLETE
3584,0.46071227319530594,2025-03-03 19:43:40.371797,2025-03-03 19:43:40.656979,0 days 00:00:00.285182,gaussian_mixture,abundance,2.4000000000000004,4,COMPLETE
3585,0.4065740869611423,2025-03-03 19:43:40.658990,2025-03-03 19:43:40.944777,0 days 00:00:00.285787,gaussian_mixture,abundance,2.35,2,COMPLETE
3586,0.2850564112147008,2025-03-03 19:43:40.946780,2025-03-03 19:43:41.236833,0 days 00:00:00.290053,gaussian_mixture,abundance,2.45,2,COMPLETE
3587,0.35422588534805355,2025-03-03 19:43:41.238838,2025-03-03 19:43:41.533673,0 days 00:00:00.294835,gaussian_mixture,abundance,2.3000000000000003,2,COMPLETE
3588,0.4150813601486797,2025-03-03 19:43:41.536426,2025-03-03 19:43:41.821139,0 days 00:00:00.284713,gaussian_mixture,abundance,2.3000000000000003,2,COMPLETE
3589,0.5552841761390128,2025-03-03 19:43:41.823134,2025-03-03 19:43:42.110474,0 days 00:00:00.287340,gaussian_mixture,abundance,1.9500000000000002,3,COMPLETE
3590,0.3652564110527933,2025-03-03 19:43:42.113469,2025-03-03 19:43:42.394171,0 days 00:00:00.280702,gaussian_mixture,abundance,2.35,2,COMPLETE
3591,0.4893027866836713,2025-03-03 19:43:42.396172,2025-03-03 19:43:42.679047,0 days 00:00:00.282875,gaussian_mixture,abundance,2.4000000000000004,2,COMPLETE
3592,0.38952248120321203,2025-03-03 19:43:42.681051,2025-03-03 19:43:42.960618,0 days 00:00:00.279567,gaussian_mixture,abundance,1.85,2,COMPLETE
3593,0.3279365982375829,2025-03-03 19:43:42.962623,2025-03-03 19:43:43.237730,0 days 00:00:00.275107,gaussian_mixture,abundance,2.5500000000000003,2,COMPLETE
3594,0.40819952747030885,2025-03-03 19:43:43.239731,2025-03-03 19:43:43.517376,0 days 00:00:00.277645,gaussian_mixture,abundance,2.3000000000000003,2,COMPLETE
3595,0.47431412446932386,2025-03-03 19:43:43.518949,2025-03-03 19:43:43.817826,0 days 00:00:00.298877,gaussian_mixture,abundance,2.45,2,COMPLETE
3596,0.30129929548821127,2025-03-03 19:43:43.819837,2025-03-03 19:43:44.085785,0 days 00:00:00.265948,gaussian_mixture,abundance,2.4000000000000004,2,COMPLETE
3597,0.42105046324710854,2025-03-03 19:43:44.087789,2025-03-03 19:43:44.365874,0 days 00:00:00.278085,gaussian_mixture,abundance,2.3000000000000003,2,COMPLETE
3598,-0.0060100968133297425,2025-03-03 19:43:44.367869,2025-03-03 19:43:45.759523,0 days 00:00:01.391654,gaussian_mixture,presence,10.0,2,COMPLETE
3599,0.3884033869204832,2025-03-03 19:43:45.761656,2025-03-03 19:43:46.039204,0 days 00:00:00.277548,gaussian_mixture,abundance,2.35,2,COMPLETE
3600,0.3470265320183171,2025-03-03 19:43:46.041204,2025-03-03 19:43:46.320479,0 days 00:00:00.279275,gaussian_mixture,abundance,2.5,2,COMPLETE
3601,0.3578164940054678,2025-03-03 19:43:46.321474,2025-03-03 19:43:46.609728,0 days 00:00:00.288254,gaussian_mixture,abundance,2.3000000000000003,2,COMPLETE
3602,0.5437243356435544,2025-03-03 19:43:46.612720,2025-03-03 19:43:46.884179,0 days 00:00:00.271459,kmeans,abundance,2.45,2,COMPLETE
3603,0.16852339464608795,2025-03-03 19:43:46.886168,2025-03-03 19:43:47.164221,0 days 00:00:00.278053,gaussian_mixture,abundance,2.35,2,COMPLETE
3604,0.4672995026184713,2025-03-03 19:43:47.166221,2025-03-03 19:43:47.456189,0 days 00:00:00.289968,gaussian_mixture,abundance,2.3000000000000003,2,COMPLETE
3605,0.371538551474667,2025-03-03 19:43:47.458189,2025-03-03 19:43:47.733018,0 days 00:00:00.274829,gaussian_mixture,abundance,2.35,2,COMPLETE
3606,0.44485195185197757,2025-03-03 19:43:47.735290,2025-03-03 19:43:48.018279,0 days 00:00:00.282989,gaussian_mixture,abundance,2.4000000000000004,2,COMPLETE
3607,0.36699895403153093,2025-03-03 19:43:48.020087,2025-03-03 19:43:48.299654,0 days 00:00:00.279567,gaussian_mixture,abundance,2.3000000000000003,2,COMPLETE
3608,0.6872212765482711,2025-03-03 19:43:48.300664,2025-03-03 19:43:48.575997,0 days 00:00:00.275333,gaussian_mixture,abundance,2.5,2,COMPLETE
3609,0.680982819400034,2025-03-03 19:43:48.577993,2025-03-03 19:43:48.872668,0 days 00:00:00.294675,gaussian_mixture,abundance,1.9500000000000002,2,COMPLETE
3610,0.2907971687055797,2025-03-03 19:43:48.875016,2025-03-03 19:43:49.151744,0 days 00:00:00.276728,gaussian_mixture,abundance,2.4000000000000004,2,COMPLETE
3611,0.3989756998484998,2025-03-03 19:43:49.153511,2025-03-03 19:43:49.438263,0 days 00:00:00.284752,gaussian_mixture,abundance,2.5500000000000003,2,COMPLETE
3612,0.38309835220205435,2025-03-03 19:43:49.439268,2025-03-03 19:43:49.720690,0 days 00:00:00.281422,gaussian_mixture,abundance,2.45,2,COMPLETE
3613,0.5468495038283298,2025-03-03 19:43:49.722690,2025-03-03 19:43:50.006603,0 days 00:00:00.283913,gaussian_mixture,abundance,2.25,2,COMPLETE
3614,0.3018732720245509,2025-03-03 19:43:50.008606,2025-03-03 19:43:50.308450,0 days 00:00:00.299844,gaussian_mixture,abundance,2.3000000000000003,2,COMPLETE
3615,0.01855431052530357,2025-03-03 19:43:50.310450,2025-03-03 19:43:51.673416,0 days 00:00:01.362966,gaussian_mixture,presence,10.0,2,COMPLETE
3616,0.34504983185556026,2025-03-03 19:43:51.675416,2025-03-03 19:43:51.960697,0 days 00:00:00.285281,gaussian_mixture,abundance,1.3,2,COMPLETE
3617,0.533273403106168,2025-03-03 19:43:51.962705,2025-03-03 19:43:52.242636,0 days 00:00:00.279931,gaussian_mixture,abundance,2.25,2,COMPLETE
3618,0.564906930058474,2025-03-03 19:43:52.244852,2025-03-03 19:43:52.518027,0 days 00:00:00.273175,gaussian_mixture,abundance,2.35,2,COMPLETE
3619,0.5242900132555981,2025-03-03 19:43:52.519031,2025-03-03 19:43:52.791115,0 days 00:00:00.272084,gaussian_mixture,abundance,2.35,2,COMPLETE
3620,0.6182530169166588,2025-03-03 19:43:52.793115,2025-03-03 19:43:53.066890,0 days 00:00:00.273775,gaussian_mixture,abundance,2.25,2,COMPLETE
3621,0.20579247939993017,2025-03-03 19:43:53.068704,2025-03-03 19:43:53.337776,0 days 00:00:00.269072,gaussian_mixture,abundance,2.4000000000000004,2,COMPLETE
3622,0.35154015991891374,2025-03-03 19:43:53.339776,2025-03-03 19:43:53.604601,0 days 00:00:00.264825,kmeans,abundance,2.45,2,COMPLETE
3623,0.6855404779833385,2025-03-03 19:43:53.606213,2025-03-03 19:43:53.879703,0 days 00:00:00.273490,gaussian_mixture,abundance,2.3000000000000003,2,COMPLETE
3624,0.6470554677666364,2025-03-03 19:43:53.881684,2025-03-03 19:43:54.160147,0 days 00:00:00.278463,gaussian_mixture,abundance,2.25,2,COMPLETE
3625,0.5671938838180586,2025-03-03 19:43:54.162147,2025-03-03 19:43:54.441330,0 days 00:00:00.279183,gaussian_mixture,abundance,2.4000000000000004,2,COMPLETE
3626,0.4776013067387296,2025-03-03 19:43:54.444130,2025-03-03 19:43:54.717658,0 days 00:00:00.273528,gaussian_mixture,abundance,1.9500000000000002,2,COMPLETE
3627,0.5608930999297363,2025-03-03 19:43:54.719675,2025-03-03 19:43:54.995440,0 days 00:00:00.275765,gaussian_mixture,abundance,2.3000000000000003,2,COMPLETE
3628,0.5626839869046618,2025-03-03 19:43:54.997437,2025-03-03 19:43:55.266820,0 days 00:00:00.269383,gaussian_mixture,abundance,2.5,2,COMPLETE
3629,0.5313252248832654,2025-03-03 19:43:55.268621,2025-03-03 19:43:55.545454,0 days 00:00:00.276833,gaussian_mixture,abundance,2.25,3,COMPLETE
3630,0.3086471247488346,2025-03-03 19:43:55.547446,2025-03-03 19:43:55.824699,0 days 00:00:00.277253,gaussian_mixture,abundance,1.75,2,COMPLETE
3631,0.5374834124006875,2025-03-03 19:43:55.826694,2025-03-03 19:43:56.102470,0 days 00:00:00.275776,gaussian_mixture,abundance,2.35,2,COMPLETE
3632,0.5046269246167634,2025-03-03 19:43:56.104470,2025-03-03 19:43:56.387284,0 days 00:00:00.282814,gaussian_mixture,abundance,1.9000000000000001,2,COMPLETE
3633,0.12137260005413601,2025-03-03 19:43:56.389281,2025-03-03 19:43:56.671876,0 days 00:00:00.282595,gaussian_mixture,abundance,2.6,2,COMPLETE
3634,0.03721351779510988,2025-03-03 19:43:56.672874,2025-03-03 19:43:58.191060,0 days 00:00:01.518186,gaussian_mixture,presence,10.0,2,COMPLETE
3635,0.6050357221398829,2025-03-03 19:43:58.194060,2025-03-03 19:43:58.503710,0 days 00:00:00.309650,gaussian_mixture,abundance,1.85,2,COMPLETE
3636,0.41673324502643555,2025-03-03 19:43:58.505712,2025-03-03 19:43:58.817668,0 days 00:00:00.311956,gaussian_mixture,abundance,2.4000000000000004,5,COMPLETE
3637,0.613111515195377,2025-03-03 19:43:58.819674,2025-03-03 19:43:59.101894,0 days 00:00:00.282220,gaussian_mixture,abundance,2.2,2,COMPLETE
3638,0.6182530169166588,2025-03-03 19:43:59.103898,2025-03-03 19:43:59.390422,0 days 00:00:00.286524,gaussian_mixture,abundance,2.25,2,COMPLETE
3639,0.5113220454819526,2025-03-03 19:43:59.393430,2025-03-03 19:43:59.697728,0 days 00:00:00.304298,gaussian_mixture,abundance,2.35,2,COMPLETE
3640,0.3993375888902273,2025-03-03 19:43:59.698730,2025-03-03 19:43:59.992880,0 days 00:00:00.294150,gaussian_mixture,abundance,2.0,2,COMPLETE
3641,0.4258221323513619,2025-03-03 19:43:59.994883,2025-03-03 19:44:00.288252,0 days 00:00:00.293369,kmeans,abundance,2.45,2,COMPLETE
3642,0.4192824691145306,2025-03-03 19:44:00.290250,2025-03-03 19:44:00.631508,0 days 00:00:00.341258,gaussian_mixture,abundance,2.3000000000000003,2,COMPLETE
3643,0.699421255027764,2025-03-03 19:44:00.633489,2025-03-03 19:44:00.977169,0 days 00:00:00.343680,gaussian_mixture,abundance,2.15,2,COMPLETE
3644,0.6872212765482711,2025-03-03 19:44:00.980177,2025-03-03 19:44:01.306118,0 days 00:00:00.325941,gaussian_mixture,abundance,2.35,2,COMPLETE
3645,0.44474026672967354,2025-03-03 19:44:01.308114,2025-03-03 19:44:01.604862,0 days 00:00:00.296748,gaussian_mixture,abundance,2.45,3,COMPLETE
3646,0.447736734097957,2025-03-03 19:44:01.606869,2025-03-03 19:44:01.889189,0 days 00:00:00.282320,gaussian_mixture,abundance,2.25,2,COMPLETE
3647,0.5535029223983997,2025-03-03 19:44:01.891197,2025-03-03 19:44:02.184093,0 days 00:00:00.292896,gaussian_mixture,abundance,2.3000000000000003,2,COMPLETE
3648,0.5303989301263652,2025-03-03 19:44:02.186092,2025-03-03 19:44:02.466473,0 days 00:00:00.280381,gaussian_mixture,abundance,2.0,2,COMPLETE
3649,0.64813421861994,2025-03-03 19:44:02.468482,2025-03-03 19:44:02.746630,0 days 00:00:00.278148,gaussian_mixture,abundance,2.2,2,COMPLETE
3650,0.5929045008532527,2025-03-03 19:44:02.748633,2025-03-03 19:44:03.046925,0 days 00:00:00.298292,gaussian_mixture,abundance,1.4500000000000002,2,COMPLETE
3651,0.44821359310952813,2025-03-03 19:44:03.048928,2025-03-03 19:44:03.333634,0 days 00:00:00.284706,gaussian_mixture,abundance,2.15,2,COMPLETE
3652,0.11366586824875827,2025-03-03 19:44:03.335852,2025-03-03 19:44:04.757929,0 days 00:00:01.422077,gaussian_mixture,presence,100.0,4,COMPLETE
3653,0.5360974802632035,2025-03-03 19:44:04.760868,2025-03-03 19:44:05.070553,0 days 00:00:00.309685,gaussian_mixture,abundance,1.8,2,COMPLETE
3654,0.47229446760738314,2025-03-03 19:44:05.073547,2025-03-03 19:44:05.369450,0 days 00:00:00.295903,gaussian_mixture,abundance,2.4000000000000004,2,COMPLETE
3655,0.47390141823185095,2025-03-03 19:44:05.371455,2025-03-03 19:44:05.678166,0 days 00:00:00.306711,gaussian_mixture,abundance,2.3000000000000003,2,COMPLETE
3656,0.2573380256681784,2025-03-03 19:44:05.683164,2025-03-03 19:44:06.050925,0 days 00:00:00.367761,gaussian_mixture,abundance,2.25,2,COMPLETE
3657,0.34455742742321277,2025-03-03 19:44:06.052925,2025-03-03 19:44:06.336903,0 days 00:00:00.283978,gaussian_mixture,abundance,2.4000000000000004,2,COMPLETE
3658,0.33254699400807,2025-03-03 19:44:06.338630,2025-03-03 19:44:06.615288,0 days 00:00:00.276658,kmeans,abundance,2.2,2,COMPLETE
3659,0.16721542389295355,2025-03-03 19:44:06.617288,2025-03-03 19:44:07.007048,0 days 00:00:00.389760,gaussian_mixture,abundance,0.15000000000000002,2,COMPLETE
3660,0.2030427555410541,2025-03-03 19:44:07.009047,2025-03-03 19:44:07.295790,0 days 00:00:00.286743,gaussian_mixture,abundance,2.35,2,COMPLETE
3661,0.41083250731090415,2025-03-03 19:44:07.297795,2025-03-03 19:44:07.576605,0 days 00:00:00.278810,gaussian_mixture,abundance,2.5,2,COMPLETE
3662,0.532138456222891,2025-03-03 19:44:07.578611,2025-03-03 19:44:07.861728,0 days 00:00:00.283117,gaussian_mixture,abundance,2.0500000000000003,2,COMPLETE
3663,0.4338971631528916,2025-03-03 19:44:07.864727,2025-03-03 19:44:08.154928,0 days 00:00:00.290201,gaussian_mixture,abundance,2.2,2,COMPLETE
3664,0.5893297407271572,2025-03-03 19:44:08.156928,2025-03-03 19:44:08.437356,0 days 00:00:00.280428,gaussian_mixture,abundance,2.3000000000000003,2,COMPLETE
3665,0.5303704620903129,2025-03-03 19:44:08.439590,2025-03-03 19:44:08.723917,0 days 00:00:00.284327,gaussian_mixture,abundance,2.25,2,COMPLETE
3666,0.4466483498415351,2025-03-03 19:44:08.725917,2025-03-03 19:44:09.007155,0 days 00:00:00.281238,gaussian_mixture,abundance,2.4000000000000004,2,COMPLETE
3667,0.12089529122540896,2025-03-03 19:44:09.009155,2025-03-03 19:44:09.316323,0 days 00:00:00.307168,gaussian_mixture,abundance,2.6,2,COMPLETE
3668,0.5358699910834338,2025-03-03 19:44:09.320182,2025-03-03 19:44:09.649643,0 days 00:00:00.329461,gaussian_mixture,abundance,1.9000000000000001,2,COMPLETE
3669,0.6353749482218015,2025-03-03 19:44:09.650643,2025-03-03 19:44:09.934726,0 days 00:00:00.284083,gaussian_mixture,abundance,2.15,2,COMPLETE
3670,0.6013339886961185,2025-03-03 19:44:09.936726,2025-03-03 19:44:10.216886,0 days 00:00:00.280160,gaussian_mixture,abundance,2.35,2,COMPLETE
3671,0.013441905311308238,2025-03-03 19:44:10.219887,2025-03-03 19:44:11.714576,0 days 00:00:01.494689,gaussian_mixture,presence,10.0,2,COMPLETE
3672,0.48523690696846805,2025-03-03 19:44:11.716576,2025-03-03 19:44:11.997978,0 days 00:00:00.281402,gaussian_mixture,abundance,2.5,2,COMPLETE
3673,0.6101409063559491,2025-03-03 19:44:11.999785,2025-03-03 19:44:12.282223,0 days 00:00:00.282438,gaussian_mixture,abundance,2.15,2,COMPLETE
3674,0.3816027056270063,2025-03-03 19:44:12.284223,2025-03-03 19:44:12.575067,0 days 00:00:00.290844,gaussian_mixture,abundance,2.25,2,COMPLETE
3675,0.4543776056640844,2025-03-03 19:44:12.577066,2025-03-03 19:44:12.872836,0 days 00:00:00.295770,gaussian_mixture,abundance,2.45,2,COMPLETE
3676,0.6204505096715158,2025-03-03 19:44:12.874971,2025-03-03 19:44:13.160889,0 days 00:00:00.285918,gaussian_mixture,abundance,2.3000000000000003,2,COMPLETE
3677,0.1228342561211239,2025-03-03 19:44:13.162893,2025-03-03 19:44:13.464349,0 days 00:00:00.301456,kmeans,abundance,2.0,2,COMPLETE
3678,0.613111515195377,2025-03-03 19:44:13.467353,2025-03-03 19:44:13.862741,0 days 00:00:00.395388,gaussian_mixture,abundance,2.35,2,COMPLETE
3679,0.4388105155359169,2025-03-03 19:44:13.865735,2025-03-03 19:44:14.204356,0 days 00:00:00.338621,gaussian_mixture,abundance,2.1,2,COMPLETE
3680,0.5671938838180586,2025-03-03 19:44:14.206356,2025-03-03 19:44:14.511207,0 days 00:00:00.304851,gaussian_mixture,abundance,2.25,2,COMPLETE
3681,0.3978262000754249,2025-03-03 19:44:14.513192,2025-03-03 19:44:14.797582,0 days 00:00:00.284390,gaussian_mixture,abundance,2.2,2,COMPLETE
3682,0.38382010441404696,2025-03-03 19:44:14.798582,2025-03-03 19:44:15.082950,0 days 00:00:00.284368,gaussian_mixture,abundance,1.6500000000000001,2,COMPLETE
3683,0.41542194081433037,2025-03-03 19:44:15.085136,2025-03-03 19:44:15.371705,0 days 00:00:00.286569,gaussian_mixture,abundance,2.4000000000000004,2,COMPLETE
3684,0.6154219408143303,2025-03-03 19:44:15.373705,2025-03-03 19:44:15.667488,0 days 00:00:00.293783,gaussian_mixture,abundance,2.15,2,COMPLETE
3685,0.45996585545183527,2025-03-03 19:44:15.669490,2025-03-03 19:44:15.980602,0 days 00:00:00.311112,gaussian_mixture,abundance,2.0500000000000003,2,COMPLETE
3686,0.3968915275944177,2025-03-03 19:44:15.982602,2025-03-03 19:44:16.289083,0 days 00:00:00.306481,gaussian_mixture,abundance,2.3000000000000003,2,COMPLETE
3687,0.5132888706249819,2025-03-03 19:44:16.292072,2025-03-03 19:44:16.624028,0 days 00:00:00.331956,gaussian_mixture,abundance,2.2,2,COMPLETE
3688,0.413111515195377,2025-03-03 19:44:16.625187,2025-03-03 19:44:16.906017,0 days 00:00:00.280830,gaussian_mixture,abundance,2.35,2,COMPLETE
3689,0.5497269217046981,2025-03-03 19:44:16.908018,2025-03-03 19:44:17.188615,0 days 00:00:00.280597,gaussian_mixture,abundance,2.45,2,COMPLETE
3690,0.02155738790562997,2025-03-03 19:44:17.190610,2025-03-03 19:44:18.559540,0 days 00:00:01.368930,gaussian_mixture,presence,15.0,2,COMPLETE
3691,0.4223526149599396,2025-03-03 19:44:18.561530,2025-03-03 19:44:18.843925,0 days 00:00:00.282395,gaussian_mixture,abundance,2.0500000000000003,2,COMPLETE
3692,0.4315033085160219,2025-03-03 19:44:18.845936,2025-03-03 19:44:19.133823,0 days 00:00:00.287887,gaussian_mixture,abundance,2.25,2,COMPLETE
3693,0.15209810643904853,2025-03-03 19:44:19.136155,2025-03-03 19:44:19.418971,0 days 00:00:00.282816,gaussian_mixture,abundance,2.15,2,COMPLETE
3694,0.09750785239654691,2025-03-03 19:44:19.420965,2025-03-03 19:44:19.706492,0 days 00:00:00.285527,gaussian_mixture,abundance,2.5500000000000003,2,COMPLETE
