number,value,datetime_start,datetime_complete,duration,params_algorithm,params_filter_criteria,params_filter_threshold,params_k,state
2368,0.48519989731768787,2025-03-03 19:36:53.061217,2025-03-03 19:36:53.303860,0 days 00:00:00.242643,gaussian_mixture,abundance,2.4000000000000004,2,COMPLETE
2369,0.49122338719535835,2025-03-03 19:36:53.305862,2025-03-03 19:36:53.541974,0 days 00:00:00.236112,gaussian_mixture,abundance,2.45,2,COMPLETE
2370,0.4772375243107872,2025-03-03 19:36:53.544993,2025-03-03 19:36:53.780894,0 days 00:00:00.235901,gaussian_mixture,abundance,2.2,2,COMPLETE
2371,0.45301669118313254,2025-03-03 19:36:53.782656,2025-03-03 19:36:54.032769,0 days 00:00:00.250113,gaussian_mixture,abundance,2.25,2,COMPLETE
2372,0.6347035692912067,2025-03-03 19:36:54.034764,2025-03-03 19:36:54.270443,0 days 00:00:00.235679,gaussian_mixture,abundance,2.15,2,COMPLETE
2373,0.06832209912542248,2025-03-03 19:36:54.271443,2025-03-03 19:36:54.648063,0 days 00:00:00.376620,gaussian_mixture,abundance,0.1,2,COMPLETE
2374,0.5070947479153582,2025-03-03 19:36:54.649068,2025-03-03 19:36:54.890227,0 days 00:00:00.241159,gaussian_mixture,abundance,2.35,2,COMPLETE
2375,0.5029637671672742,2025-03-03 19:36:54.891808,2025-03-03 19:36:55.127168,0 days 00:00:00.235360,gaussian_mixture,abundance,2.3000000000000003,2,COMPLETE
2376,0.6298272411794201,2025-03-03 19:36:55.129173,2025-03-03 19:36:55.366820,0 days 00:00:00.237647,gaussian_mixture,abundance,2.2,2,COMPLETE
2377,0.013447115010777357,2025-03-03 19:36:55.368820,2025-03-03 19:36:56.721036,0 days 00:00:01.352216,gaussian_mixture,presence,10.0,2,COMPLETE
2378,0.5936670676615192,2025-03-03 19:36:56.723032,2025-03-03 19:36:56.964343,0 days 00:00:00.241311,gaussian_mixture,abundance,2.25,2,COMPLETE
2379,0.6368736354573501,2025-03-03 19:36:56.966343,2025-03-03 19:36:57.206593,0 days 00:00:00.240250,gaussian_mixture,abundance,2.1,2,COMPLETE
2380,0.5602629315430512,2025-03-03 19:36:57.207590,2025-03-03 19:36:57.443713,0 days 00:00:00.236123,gaussian_mixture,abundance,2.15,2,COMPLETE
2381,0.6336363919717497,2025-03-03 19:36:57.444708,2025-03-03 19:36:57.681086,0 days 00:00:00.236378,gaussian_mixture,abundance,2.45,2,COMPLETE
2382,0.5870661045265716,2025-03-03 19:36:57.683086,2025-03-03 19:36:57.919200,0 days 00:00:00.236114,gaussian_mixture,abundance,2.25,2,COMPLETE
2383,0.41099323233710655,2025-03-03 19:36:57.921195,2025-03-03 19:36:58.157970,0 days 00:00:00.236775,gaussian_mixture,abundance,2.35,2,COMPLETE
2384,0.31228038067758035,2025-03-03 19:36:58.160031,2025-03-03 19:36:58.393015,0 days 00:00:00.232984,kmeans,abundance,2.4000000000000004,2,COMPLETE
2385,0.5513641894451129,2025-03-03 19:36:58.394011,2025-03-03 19:36:58.634446,0 days 00:00:00.240435,gaussian_mixture,abundance,2.15,2,COMPLETE
2386,0.5244798133468208,2025-03-03 19:36:58.636451,2025-03-03 19:36:58.870901,0 days 00:00:00.234450,gaussian_mixture,abundance,2.5500000000000003,2,COMPLETE
2387,0.2060787821459938,2025-03-03 19:36:58.872692,2025-03-03 19:36:59.108198,0 days 00:00:00.235506,gaussian_mixture,abundance,2.3000000000000003,2,COMPLETE
2388,0.34773090341309104,2025-03-03 19:36:59.110198,2025-03-03 19:36:59.350703,0 days 00:00:00.240505,gaussian_mixture,abundance,2.25,2,COMPLETE
2389,0.37613731866343403,2025-03-03 19:36:59.351703,2025-03-03 19:36:59.590574,0 days 00:00:00.238871,gaussian_mixture,abundance,2.0500000000000003,2,COMPLETE
2390,0.6584188256982936,2025-03-03 19:36:59.591579,2025-03-03 19:36:59.839645,0 days 00:00:00.248066,gaussian_mixture,abundance,2.2,2,COMPLETE
2391,0.4989984021839852,2025-03-03 19:36:59.840645,2025-03-03 19:37:00.091961,0 days 00:00:00.251316,gaussian_mixture,abundance,2.15,2,COMPLETE
2392,0.4176800219171037,2025-03-03 19:37:00.094959,2025-03-03 19:37:00.365334,0 days 00:00:00.270375,gaussian_mixture,abundance,2.4000000000000004,2,COMPLETE
2393,0.4433031040542551,2025-03-03 19:37:00.367425,2025-03-03 19:37:00.607202,0 days 00:00:00.239777,gaussian_mixture,abundance,2.3000000000000003,2,COMPLETE
2394,0.566998954031531,2025-03-03 19:37:00.608830,2025-03-03 19:37:00.849087,0 days 00:00:00.240257,gaussian_mixture,abundance,2.2,2,COMPLETE
2395,0.05561481574335664,2025-03-03 19:37:00.851110,2025-03-03 19:37:02.175145,0 days 00:00:01.324035,gaussian_mixture,presence,40.0,2,COMPLETE
2396,0.47229446760738314,2025-03-03 19:37:02.177127,2025-03-03 19:37:02.423211,0 days 00:00:00.246084,gaussian_mixture,abundance,2.1,2,COMPLETE
2397,0.5400223691869407,2025-03-03 19:37:02.425224,2025-03-03 19:37:02.693753,0 days 00:00:00.268529,gaussian_mixture,abundance,2.35,2,COMPLETE
2398,0.3594059447522882,2025-03-03 19:37:02.695753,2025-03-03 19:37:02.935906,0 days 00:00:00.240153,gaussian_mixture,abundance,2.0,2,COMPLETE
2399,0.49105568594884164,2025-03-03 19:37:02.936907,2025-03-03 19:37:03.192119,0 days 00:00:00.255212,gaussian_mixture,abundance,2.15,4,COMPLETE
2400,0.35293587880841815,2025-03-03 19:37:03.194109,2025-03-03 19:37:03.440240,0 days 00:00:00.246131,gaussian_mixture,abundance,2.45,2,COMPLETE
2401,0.35564402802415906,2025-03-03 19:37:03.441241,2025-03-03 19:37:03.675848,0 days 00:00:00.234607,kmeans,abundance,2.25,2,COMPLETE
2402,0.42829626771930246,2025-03-03 19:37:03.677846,2025-03-03 19:37:03.935418,0 days 00:00:00.257572,gaussian_mixture,abundance,2.3000000000000003,2,COMPLETE
2403,0.4311153857059951,2025-03-03 19:37:03.937413,2025-03-03 19:37:04.183206,0 days 00:00:00.245793,gaussian_mixture,abundance,2.1,2,COMPLETE
2404,0.48225658897434076,2025-03-03 19:37:04.185204,2025-03-03 19:37:04.448250,0 days 00:00:00.263046,gaussian_mixture,abundance,1.0,2,COMPLETE
2405,0.3807974588978283,2025-03-03 19:37:04.449252,2025-03-03 19:37:04.727931,0 days 00:00:00.278679,gaussian_mixture,abundance,2.2,2,COMPLETE
2406,0.5155241981342339,2025-03-03 19:37:04.729931,2025-03-03 19:37:04.970628,0 days 00:00:00.240697,gaussian_mixture,abundance,2.1,2,COMPLETE
2407,0.42713477974030684,2025-03-03 19:37:04.971622,2025-03-03 19:37:05.213218,0 days 00:00:00.241596,gaussian_mixture,abundance,2.25,2,COMPLETE
2408,0.5286092089843876,2025-03-03 19:37:05.215214,2025-03-03 19:37:05.456617,0 days 00:00:00.241403,gaussian_mixture,abundance,2.5,2,COMPLETE
2409,0.3507433913084997,2025-03-03 19:37:05.458599,2025-03-03 19:37:05.704201,0 days 00:00:00.245602,gaussian_mixture,abundance,2.35,2,COMPLETE
2410,0.4519021311504538,2025-03-03 19:37:05.705202,2025-03-03 19:37:05.952269,0 days 00:00:00.247067,gaussian_mixture,abundance,2.0500000000000003,2,COMPLETE
2411,0.2952690519543107,2025-03-03 19:37:05.954265,2025-03-03 19:37:06.201861,0 days 00:00:00.247596,gaussian_mixture,abundance,2.2,2,COMPLETE
2412,0.19410559632887034,2025-03-03 19:37:06.203872,2025-03-03 19:37:06.466920,0 days 00:00:00.263048,gaussian_mixture,abundance,2.3000000000000003,2,COMPLETE
2413,0.5163212514097513,2025-03-03 19:37:06.468919,2025-03-03 19:37:06.707930,0 days 00:00:00.239011,gaussian_mixture,abundance,2.4000000000000004,2,COMPLETE
2414,0.04630088632700127,2025-03-03 19:37:06.710926,2025-03-03 19:37:08.019715,0 days 00:00:01.308789,gaussian_mixture,presence,105.0,6,COMPLETE
2415,0.6260169449056815,2025-03-03 19:37:08.021711,2025-03-03 19:37:08.264640,0 days 00:00:00.242929,gaussian_mixture,abundance,2.15,2,COMPLETE
2416,0.4780869470073135,2025-03-03 19:37:08.266631,2025-03-03 19:37:08.504387,0 days 00:00:00.237756,gaussian_mixture,abundance,2.2,2,COMPLETE
2417,0.4846087840851763,2025-03-03 19:37:08.505378,2025-03-03 19:37:08.766497,0 days 00:00:00.261119,gaussian_mixture,abundance,2.0500000000000003,5,COMPLETE
2418,0.264906094752448,2025-03-03 19:37:08.768494,2025-03-03 19:37:09.015802,0 days 00:00:00.247308,gaussian_mixture,abundance,2.45,2,COMPLETE
2419,0.40188516168136224,2025-03-03 19:37:09.016801,2025-03-03 19:37:09.254392,0 days 00:00:00.237591,gaussian_mixture,abundance,2.25,2,COMPLETE
2420,0.5160177268937026,2025-03-03 19:37:09.256384,2025-03-03 19:37:09.495410,0 days 00:00:00.239026,kmeans,abundance,2.15,2,COMPLETE
2421,0.6754025087257458,2025-03-03 19:37:09.497401,2025-03-03 19:37:09.744642,0 days 00:00:00.247241,gaussian_mixture,abundance,2.3000000000000003,2,COMPLETE
2422,0.4645700883816527,2025-03-03 19:37:09.746629,2025-03-03 19:37:09.994161,0 days 00:00:00.247532,gaussian_mixture,abundance,2.35,3,COMPLETE
2423,0.5799043837418356,2025-03-03 19:37:09.996155,2025-03-03 19:37:10.238309,0 days 00:00:00.242154,gaussian_mixture,abundance,2.0,2,COMPLETE
2424,0.3667247509198043,2025-03-03 19:37:10.240299,2025-03-03 19:37:10.482941,0 days 00:00:00.242642,gaussian_mixture,abundance,2.2,2,COMPLETE
2425,0.4254769037741937,2025-03-03 19:37:10.483937,2025-03-03 19:37:10.722610,0 days 00:00:00.238673,gaussian_mixture,abundance,2.4000000000000004,2,COMPLETE
2426,0.6735138330054123,2025-03-03 19:37:10.723613,2025-03-03 19:37:10.969887,0 days 00:00:00.246274,gaussian_mixture,abundance,2.0500000000000003,2,COMPLETE
2427,0.5387777132710749,2025-03-03 19:37:10.971870,2025-03-03 19:37:11.229781,0 days 00:00:00.257911,gaussian_mixture,abundance,2.1,2,COMPLETE
2428,0.5794847203055438,2025-03-03 19:37:11.231778,2025-03-03 19:37:11.471746,0 days 00:00:00.239968,gaussian_mixture,abundance,2.25,2,COMPLETE
2429,0.6277959813974023,2025-03-03 19:37:11.473740,2025-03-03 19:37:11.730315,0 days 00:00:00.256575,gaussian_mixture,abundance,1.3,2,COMPLETE
2430,0.5671938838180586,2025-03-03 19:37:11.732312,2025-03-03 19:37:11.974760,0 days 00:00:00.242448,gaussian_mixture,abundance,2.15,2,COMPLETE
2431,0.6007205379181318,2025-03-03 19:37:11.976755,2025-03-03 19:37:12.222922,0 days 00:00:00.246167,gaussian_mixture,abundance,2.35,2,COMPLETE
2432,0.64813421861994,2025-03-03 19:37:12.224910,2025-03-03 19:37:12.465543,0 days 00:00:00.240633,gaussian_mixture,abundance,2.25,2,COMPLETE
2433,0.01666431306480038,2025-03-03 19:37:12.467539,2025-03-03 19:37:13.937562,0 days 00:00:01.470023,gaussian_mixture,presence,5.0,2,COMPLETE
2434,0.5189251340886795,2025-03-03 19:37:13.939562,2025-03-03 19:37:14.187596,0 days 00:00:00.248034,gaussian_mixture,abundance,2.5,2,COMPLETE
2435,0.34541858871453013,2025-03-03 19:37:14.189595,2025-03-03 19:37:14.427933,0 days 00:00:00.238338,gaussian_mixture,abundance,2.3000000000000003,2,COMPLETE
2436,0.6488065969196712,2025-03-03 19:37:14.429925,2025-03-03 19:37:14.672211,0 days 00:00:00.242286,gaussian_mixture,abundance,2.2,2,COMPLETE
2437,0.2886819696173372,2025-03-03 19:37:14.673212,2025-03-03 19:37:14.920812,0 days 00:00:00.247600,gaussian_mixture,abundance,2.15,2,COMPLETE
2438,0.19211675078906393,2025-03-03 19:37:14.922807,2025-03-03 19:37:15.164147,0 days 00:00:00.241340,gaussian_mixture,abundance,2.45,2,COMPLETE
2439,0.37606940196898514,2025-03-03 19:37:15.166146,2025-03-03 19:37:15.415769,0 days 00:00:00.249623,kmeans,abundance,1.9500000000000002,2,COMPLETE
2440,0.32239682898866273,2025-03-03 19:37:15.416767,2025-03-03 19:37:15.660850,0 days 00:00:00.244083,gaussian_mixture,abundance,2.1,2,COMPLETE
2441,0.17243328172246472,2025-03-03 19:37:15.662850,2025-03-03 19:37:15.898808,0 days 00:00:00.235958,gaussian_mixture,abundance,2.3000000000000003,2,COMPLETE
2442,0.6478607144958144,2025-03-03 19:37:15.900810,2025-03-03 19:37:16.148383,0 days 00:00:00.247573,gaussian_mixture,abundance,2.2,2,COMPLETE
2443,0.5015486012961905,2025-03-03 19:37:16.150184,2025-03-03 19:37:16.391412,0 days 00:00:00.241228,gaussian_mixture,abundance,2.1,2,COMPLETE
2444,0.5907653568158635,2025-03-03 19:37:16.393410,2025-03-03 19:37:16.635490,0 days 00:00:00.242080,gaussian_mixture,abundance,2.4000000000000004,2,COMPLETE
2445,0.3410874158510522,2025-03-03 19:37:16.636482,2025-03-03 19:37:16.877160,0 days 00:00:00.240678,gaussian_mixture,abundance,2.15,2,COMPLETE
2446,0.338834183172618,2025-03-03 19:37:16.879158,2025-03-03 19:37:17.123064,0 days 00:00:00.243906,gaussian_mixture,abundance,2.35,2,COMPLETE
2447,0.3523011471773877,2025-03-03 19:37:17.124064,2025-03-03 19:37:17.367076,0 days 00:00:00.243012,gaussian_mixture,abundance,2.25,2,COMPLETE
2448,0.6078548244731359,2025-03-03 19:37:17.368077,2025-03-03 19:37:17.631018,0 days 00:00:00.262941,gaussian_mixture,abundance,2.0500000000000003,2,COMPLETE
2449,0.5495319919181704,2025-03-03 19:37:17.632993,2025-03-03 19:37:17.877446,0 days 00:00:00.244453,gaussian_mixture,abundance,2.5500000000000003,2,COMPLETE
2450,0.4312411929251522,2025-03-03 19:37:17.879438,2025-03-03 19:37:18.122609,0 days 00:00:00.243171,gaussian_mixture,abundance,2.45,2,COMPLETE
2451,0.33536542707922495,2025-03-03 19:37:18.123613,2025-03-03 19:37:18.365922,0 days 00:00:00.242309,gaussian_mixture,abundance,2.2,2,COMPLETE
2452,0.011645684487659552,2025-03-03 19:37:18.367915,2025-03-03 19:37:19.751773,0 days 00:00:01.383858,gaussian_mixture,presence,10.0,2,COMPLETE
2453,0.6208227922467813,2025-03-03 19:37:19.753769,2025-03-03 19:37:19.996854,0 days 00:00:00.243085,gaussian_mixture,abundance,2.25,2,COMPLETE
2454,0.44234173922000986,2025-03-03 19:37:19.998657,2025-03-03 19:37:20.238725,0 days 00:00:00.240068,gaussian_mixture,abundance,2.4000000000000004,2,COMPLETE
2455,0.5471353194973152,2025-03-03 19:37:20.240724,2025-03-03 19:37:20.485859,0 days 00:00:00.245135,gaussian_mixture,abundance,2.15,2,COMPLETE
2456,0.5936670676615192,2025-03-03 19:37:20.486864,2025-03-03 19:37:20.730449,0 days 00:00:00.243585,gaussian_mixture,abundance,2.3000000000000003,2,COMPLETE
2457,0.5144248270503742,2025-03-03 19:37:20.731457,2025-03-03 19:37:20.990408,0 days 00:00:00.258951,gaussian_mixture,abundance,2.35,2,COMPLETE
2458,0.5944427720257328,2025-03-03 19:37:20.991428,2025-03-03 19:37:21.246514,0 days 00:00:00.255086,gaussian_mixture,abundance,2.1,2,COMPLETE
2459,0.23475759707923682,2025-03-03 19:37:21.247516,2025-03-03 19:37:21.492096,0 days 00:00:00.244580,kmeans,abundance,2.2,2,COMPLETE
2460,0.47429436014003984,2025-03-03 19:37:21.494109,2025-03-03 19:37:21.763540,0 days 00:00:00.269431,gaussian_mixture,abundance,2.25,2,COMPLETE
2461,0.3317978755572404,2025-03-03 19:37:21.765154,2025-03-03 19:37:22.018346,0 days 00:00:00.253192,gaussian_mixture,abundance,2.0,2,COMPLETE
2462,0.4989984021839852,2025-03-03 19:37:22.019347,2025-03-03 19:37:22.261396,0 days 00:00:00.242049,gaussian_mixture,abundance,2.3000000000000003,2,COMPLETE
2463,0.6470554677666364,2025-03-03 19:37:22.262395,2025-03-03 19:37:22.506000,0 days 00:00:00.243605,gaussian_mixture,abundance,2.15,2,COMPLETE
2464,0.5160589033274084,2025-03-03 19:37:22.507997,2025-03-03 19:37:22.768208,0 days 00:00:00.260211,gaussian_mixture,abundance,2.0500000000000003,2,COMPLETE
2465,0.4478607144958143,2025-03-03 19:37:22.770211,2025-03-03 19:37:23.052697,0 days 00:00:00.282486,gaussian_mixture,abundance,2.4000000000000004,2,COMPLETE
2466,0.6050357221398829,2025-03-03 19:37:23.053693,2025-03-03 19:37:23.294334,0 days 00:00:00.240641,gaussian_mixture,abundance,2.1,2,COMPLETE
2467,0.2831099319697844,2025-03-03 19:37:23.296318,2025-03-03 19:37:23.536476,0 days 00:00:00.240158,gaussian_mixture,abundance,2.2,2,COMPLETE
2468,0.3725785489502413,2025-03-03 19:37:23.538469,2025-03-03 19:37:23.781162,0 days 00:00:00.242693,gaussian_mixture,abundance,1.4500000000000002,2,COMPLETE
2469,0.2540311979369325,2025-03-03 19:37:23.783160,2025-03-03 19:37:24.042116,0 days 00:00:00.258956,gaussian_mixture,abundance,1.6,2,COMPLETE
2470,0.04964366597754964,2025-03-03 19:37:24.044112,2025-03-03 19:37:25.484514,0 days 00:00:01.440402,gaussian_mixture,presence,15.0,3,COMPLETE
2471,0.5313124584815337,2025-03-03 19:37:25.486506,2025-03-03 19:37:25.726644,0 days 00:00:00.240138,gaussian_mixture,abundance,2.35,2,COMPLETE
2472,0.5070360356780519,2025-03-03 19:37:25.728642,2025-03-03 19:37:25.970081,0 days 00:00:00.241439,gaussian_mixture,abundance,2.25,2,COMPLETE
2473,0.29827832871065546,2025-03-03 19:37:25.972072,2025-03-03 19:37:26.236249,0 days 00:00:00.264177,gaussian_mixture,abundance,2.15,2,COMPLETE
2474,0.5171740049356446,2025-03-03 19:37:26.238248,2025-03-03 19:37:26.478585,0 days 00:00:00.240337,gaussian_mixture,abundance,2.5,2,COMPLETE
2475,0.6478607144958144,2025-03-03 19:37:26.480359,2025-03-03 19:37:26.725000,0 days 00:00:00.244641,gaussian_mixture,abundance,2.3000000000000003,2,COMPLETE
2476,0.33700807839991154,2025-03-03 19:37:26.726999,2025-03-03 19:37:26.966738,0 days 00:00:00.239739,kmeans,abundance,2.45,2,COMPLETE
2477,0.5773633912493494,2025-03-03 19:37:26.967731,2025-03-03 19:37:27.212834,0 days 00:00:00.245103,gaussian_mixture,abundance,1.9500000000000002,2,COMPLETE
2478,0.23518429772722263,2025-03-03 19:37:27.214834,2025-03-03 19:37:27.459085,0 days 00:00:00.244251,gaussian_mixture,abundance,2.1,2,COMPLETE
2479,0.5118680109476761,2025-03-03 19:37:27.461074,2025-03-03 19:37:27.706671,0 days 00:00:00.245597,gaussian_mixture,abundance,2.3000000000000003,2,COMPLETE
2480,0.4739625546594922,2025-03-03 19:37:27.707678,2025-03-03 19:37:27.953052,0 days 00:00:00.245374,gaussian_mixture,abundance,2.35,2,COMPLETE
2481,0.45614024408630716,2025-03-03 19:37:27.954810,2025-03-03 19:37:28.211256,0 days 00:00:00.256446,gaussian_mixture,abundance,2.2,2,COMPLETE
2482,0.20992243819261575,2025-03-03 19:37:28.213257,2025-03-03 19:37:28.463589,0 days 00:00:00.250332,gaussian_mixture,abundance,2.0500000000000003,2,COMPLETE
2483,0.6123890108326364,2025-03-03 19:37:28.465586,2025-03-03 19:37:28.713948,0 days 00:00:00.248362,gaussian_mixture,abundance,2.25,2,COMPLETE
2484,0.6282619979114271,2025-03-03 19:37:28.715947,2025-03-03 19:37:28.963081,0 days 00:00:00.247134,gaussian_mixture,abundance,2.15,2,COMPLETE
2485,0.46101672351139744,2025-03-03 19:37:28.964084,2025-03-03 19:37:29.214234,0 days 00:00:00.250150,gaussian_mixture,abundance,2.2,2,COMPLETE
2486,0.5660572075958697,2025-03-03 19:37:29.216030,2025-03-03 19:37:29.463150,0 days 00:00:00.247120,gaussian_mixture,abundance,2.4000000000000004,2,COMPLETE
2487,0.4330283091101788,2025-03-03 19:37:29.465143,2025-03-03 19:37:29.735632,0 days 00:00:00.270489,gaussian_mixture,abundance,2.1,2,COMPLETE
2488,0.48509213828571324,2025-03-03 19:37:29.736632,2025-03-03 19:37:29.992033,0 days 00:00:00.255401,gaussian_mixture,abundance,2.25,4,COMPLETE
2489,-0.004265155649735222,2025-03-03 19:37:29.993782,2025-03-03 19:37:31.346110,0 days 00:00:01.352328,gaussian_mixture,presence,10.0,2,COMPLETE
2490,0.19889774135846683,2025-03-03 19:37:31.348106,2025-03-03 19:37:31.588156,0 days 00:00:00.240050,gaussian_mixture,abundance,2.3000000000000003,2,COMPLETE
2491,0.37652981267252683,2025-03-03 19:37:31.590150,2025-03-03 19:37:31.831021,0 days 00:00:00.240871,gaussian_mixture,abundance,2.2,2,COMPLETE
2492,0.5933019873061867,2025-03-03 19:37:31.833014,2025-03-03 19:37:32.078057,0 days 00:00:00.245043,gaussian_mixture,abundance,2.0,2,COMPLETE
2493,0.5027976114581197,2025-03-03 19:37:32.079054,2025-03-03 19:37:32.320632,0 days 00:00:00.241578,gaussian_mixture,abundance,2.35,2,COMPLETE
2494,0.4463532620363161,2025-03-03 19:37:32.322630,2025-03-03 19:37:32.591331,0 days 00:00:00.268701,gaussian_mixture,abundance,1.2000000000000002,2,COMPLETE
2495,0.4325729207010607,2025-03-03 19:37:32.594315,2025-03-03 19:37:32.827151,0 days 00:00:00.232836,kmeans,abundance,2.15,2,COMPLETE
2496,0.33536542707922495,2025-03-03 19:37:32.829152,2025-03-03 19:37:33.073265,0 days 00:00:00.244113,gaussian_mixture,abundance,2.4000000000000004,2,COMPLETE
2497,0.3870661045265716,2025-03-03 19:37:33.075264,2025-03-03 19:37:33.324859,0 days 00:00:00.249595,gaussian_mixture,abundance,2.0500000000000003,2,COMPLETE
2498,0.30093587494925056,2025-03-03 19:37:33.325852,2025-03-03 19:37:33.568317,0 days 00:00:00.242465,gaussian_mixture,abundance,2.25,2,COMPLETE
2499,0.45803200438679015,2025-03-03 19:37:33.570327,2025-03-03 19:37:33.813031,0 days 00:00:00.242704,gaussian_mixture,abundance,2.45,2,COMPLETE
2500,0.5798233825507595,2025-03-03 19:37:33.815029,2025-03-03 19:37:34.057069,0 days 00:00:00.242040,gaussian_mixture,abundance,2.5500000000000003,2,COMPLETE
2501,0.6154219408143303,2025-03-03 19:37:34.059071,2025-03-03 19:37:34.302170,0 days 00:00:00.243099,gaussian_mixture,abundance,2.15,2,COMPLETE
2502,0.4464534200550075,2025-03-03 19:37:34.303163,2025-03-03 19:37:34.550860,0 days 00:00:00.247697,gaussian_mixture,abundance,2.2,2,COMPLETE
2503,0.564906930058474,2025-03-03 19:37:34.551857,2025-03-03 19:37:34.822239,0 days 00:00:00.270382,gaussian_mixture,abundance,2.1,2,COMPLETE
2504,0.2338971631528916,2025-03-03 19:37:34.823243,2025-03-03 19:37:35.067022,0 days 00:00:00.243779,gaussian_mixture,abundance,2.3000000000000003,2,COMPLETE
2505,0.5531399003060588,2025-03-03 19:37:35.069021,2025-03-03 19:37:35.315060,0 days 00:00:00.246039,gaussian_mixture,abundance,2.35,5,COMPLETE
2506,0.5066318257512854,2025-03-03 19:37:35.316865,2025-03-03 19:37:35.563929,0 days 00:00:00.247064,gaussian_mixture,abundance,2.0,2,COMPLETE
2507,0.5362717047015721,2025-03-03 19:37:35.564927,2025-03-03 19:37:35.822542,0 days 00:00:00.257615,gaussian_mixture,abundance,2.15,2,COMPLETE
2508,0.21700021527933816,2025-03-03 19:37:35.824539,2025-03-03 19:37:36.066415,0 days 00:00:00.241876,gaussian_mixture,abundance,2.2,2,COMPLETE
2509,0.4625395356360533,2025-03-03 19:37:36.068403,2025-03-03 19:37:36.330042,0 days 00:00:00.261639,gaussian_mixture,abundance,2.5,2,COMPLETE
2510,-0.0009365812550537195,2025-03-03 19:37:36.332039,2025-03-03 19:37:37.845021,0 days 00:00:01.512982,gaussian_mixture,presence,10.0,4,COMPLETE
2511,0.4014309178108829,2025-03-03 19:37:37.847017,2025-03-03 19:37:38.090271,0 days 00:00:00.243254,gaussian_mixture,abundance,2.0500000000000003,2,COMPLETE
2512,0.5932832251718411,2025-03-03 19:37:38.091266,2025-03-03 19:37:38.338080,0 days 00:00:00.246814,gaussian_mixture,abundance,2.25,2,COMPLETE
2513,0.26406436750230944,2025-03-03 19:37:38.340076,2025-03-03 19:37:38.579172,0 days 00:00:00.239096,gaussian_mixture,abundance,2.1,2,COMPLETE
2514,0.2360467252179858,2025-03-03 19:37:38.581167,2025-03-03 19:37:38.818795,0 days 00:00:00.237628,kmeans,abundance,2.4000000000000004,2,COMPLETE
2515,0.39999628871709303,2025-03-03 19:37:38.820790,2025-03-03 19:37:39.101239,0 days 00:00:00.280449,gaussian_mixture,abundance,1.9500000000000002,2,COMPLETE
