number,value,datetime_start,datetime_complete,duration,params_algorithm,params_filter_criteria,params_filter_threshold,params_k,state
4724,0.5258722835607703,2025-03-03 19:51:01.763097,2025-03-03 19:51:02.099811,0 days 00:00:00.336714,gaussian_mixture,abundance,1.75,2,COMPLETE
4725,0.4908452085465423,2025-03-03 19:51:02.101808,2025-03-03 19:51:02.440961,0 days 00:00:00.339153,gaussian_mixture,abundance,1.85,2,COMPLETE
4726,0.42511593319038987,2025-03-03 19:51:02.442957,2025-03-03 19:51:02.784177,0 days 00:00:00.341220,gaussian_mixture,abundance,1.8,2,COMPLETE
4727,0.2537532034719231,2025-03-03 19:51:02.787169,2025-03-03 19:51:03.124858,0 days 00:00:00.337689,gaussian_mixture,abundance,1.7000000000000002,2,COMPLETE
4728,0.3472692575914074,2025-03-03 19:51:03.126857,2025-03-03 19:51:03.437911,0 days 00:00:00.311054,kmeans,abundance,1.6500000000000001,2,COMPLETE
4729,0.42060280599767685,2025-03-03 19:51:03.439916,2025-03-03 19:51:03.766411,0 days 00:00:00.326495,gaussian_mixture,abundance,1.9000000000000001,3,COMPLETE
4730,0.6016194763283806,2025-03-03 19:51:03.769410,2025-03-03 19:51:04.129733,0 days 00:00:00.360323,gaussian_mixture,abundance,1.8,2,COMPLETE
4731,0.3559675303040438,2025-03-03 19:51:04.132732,2025-03-03 19:51:04.463996,0 days 00:00:00.331264,gaussian_mixture,abundance,1.75,2,COMPLETE
4732,0.3465867833601107,2025-03-03 19:51:04.468003,2025-03-03 19:51:04.817627,0 days 00:00:00.349624,gaussian_mixture,abundance,1.6500000000000001,2,COMPLETE
4733,0.4941246968750857,2025-03-03 19:51:04.819616,2025-03-03 19:51:05.219008,0 days 00:00:00.399392,gaussian_mixture,abundance,1.3,2,COMPLETE
4734,0.5634860339678983,2025-03-03 19:51:05.222004,2025-03-03 19:51:05.576094,0 days 00:00:00.354090,gaussian_mixture,abundance,1.9000000000000001,4,COMPLETE
4735,0.4183561153078566,2025-03-03 19:51:05.578089,2025-03-03 19:51:05.915274,0 days 00:00:00.337185,gaussian_mixture,abundance,1.6,2,COMPLETE
4736,0.676241828739576,2025-03-03 19:51:05.917264,2025-03-03 19:51:06.257451,0 days 00:00:00.340187,gaussian_mixture,abundance,1.9000000000000001,2,COMPLETE
4737,0.43590178577148775,2025-03-03 19:51:06.258971,2025-03-03 19:51:06.631649,0 days 00:00:00.372678,gaussian_mixture,abundance,1.8,2,COMPLETE
4738,0.6073454247198603,2025-03-03 19:51:06.634649,2025-03-03 19:51:06.976461,0 days 00:00:00.341812,gaussian_mixture,abundance,2.4000000000000004,2,COMPLETE
4739,0.43896312191502596,2025-03-03 19:51:06.978462,2025-03-03 19:51:07.385714,0 days 00:00:00.407252,gaussian_mixture,abundance,1.7000000000000002,2,COMPLETE
4740,0.45486067123576934,2025-03-03 19:51:07.387716,2025-03-03 19:51:07.740176,0 days 00:00:00.352460,gaussian_mixture,abundance,1.85,2,COMPLETE
4741,0.009866871829041918,2025-03-03 19:51:07.742176,2025-03-03 19:51:09.272765,0 days 00:00:01.530589,gaussian_mixture,presence,10.0,2,COMPLETE
4742,0.4620412517431093,2025-03-03 19:51:09.274767,2025-03-03 19:51:09.632423,0 days 00:00:00.357656,gaussian_mixture,abundance,1.85,2,COMPLETE
4743,0.4900747686417434,2025-03-03 19:51:09.634422,2025-03-03 19:51:09.962728,0 days 00:00:00.328306,gaussian_mixture,abundance,1.85,2,COMPLETE
4744,0.3671938838180586,2025-03-03 19:51:09.964747,2025-03-03 19:51:10.301376,0 days 00:00:00.336629,gaussian_mixture,abundance,2.45,2,COMPLETE
4745,0.41665786105596964,2025-03-03 19:51:10.303375,2025-03-03 19:51:10.660420,0 days 00:00:00.357045,gaussian_mixture,abundance,1.9000000000000001,2,COMPLETE
4746,0.3914887159598216,2025-03-03 19:51:10.662420,2025-03-03 19:51:11.015564,0 days 00:00:00.353144,gaussian_mixture,abundance,1.8,2,COMPLETE
4747,0.4883565596880589,2025-03-03 19:51:11.017564,2025-03-03 19:51:11.334521,0 days 00:00:00.316957,gaussian_mixture,abundance,1.75,2,COMPLETE
4748,0.324487043400011,2025-03-03 19:51:11.336521,2025-03-03 19:51:11.669106,0 days 00:00:00.332585,kmeans,abundance,1.7000000000000002,2,COMPLETE
4749,0.4170275269539654,2025-03-03 19:51:11.671106,2025-03-03 19:51:12.006963,0 days 00:00:00.335857,gaussian_mixture,abundance,1.8,2,COMPLETE
4750,0.4762369595162134,2025-03-03 19:51:12.009966,2025-03-03 19:51:12.342464,0 days 00:00:00.332498,gaussian_mixture,abundance,1.4000000000000001,2,COMPLETE
4751,0.5840829225394499,2025-03-03 19:51:12.344464,2025-03-03 19:51:12.700043,0 days 00:00:00.355579,gaussian_mixture,abundance,1.4500000000000002,2,COMPLETE
4752,0.41334280389862793,2025-03-03 19:51:12.702042,2025-03-03 19:51:13.013805,0 days 00:00:00.311763,gaussian_mixture,abundance,2.45,2,COMPLETE
4753,0.35118457459299524,2025-03-03 19:51:13.016801,2025-03-03 19:51:13.350062,0 days 00:00:00.333261,gaussian_mixture,abundance,1.5,2,COMPLETE
4754,0.6224695185114969,2025-03-03 19:51:13.352083,2025-03-03 19:51:13.736892,0 days 00:00:00.384809,gaussian_mixture,abundance,2.4000000000000004,2,COMPLETE
4755,0.30530092731943964,2025-03-03 19:51:13.739888,2025-03-03 19:51:14.117578,0 days 00:00:00.377690,gaussian_mixture,abundance,1.9000000000000001,2,COMPLETE
4756,0.4804090180548745,2025-03-03 19:51:14.120567,2025-03-03 19:51:14.472147,0 days 00:00:00.351580,gaussian_mixture,abundance,1.9000000000000001,2,COMPLETE
4757,0.6414096378904388,2025-03-03 19:51:14.474148,2025-03-03 19:51:14.828421,0 days 00:00:00.354273,gaussian_mixture,abundance,2.4000000000000004,2,COMPLETE
4758,0.508912180451347,2025-03-03 19:51:14.831423,2025-03-03 19:51:15.181668,0 days 00:00:00.350245,gaussian_mixture,abundance,1.85,2,COMPLETE
4759,0.5560867552486879,2025-03-03 19:51:15.183682,2025-03-03 19:51:15.522256,0 days 00:00:00.338574,gaussian_mixture,abundance,1.55,2,COMPLETE
4760,0.5197081456534262,2025-03-03 19:51:15.524256,2025-03-03 19:51:15.872999,0 days 00:00:00.348743,gaussian_mixture,abundance,1.25,2,COMPLETE
4761,-0.005585580101402557,2025-03-03 19:51:15.874999,2025-03-03 19:51:17.413381,0 days 00:00:01.538382,gaussian_mixture,presence,10.0,2,COMPLETE
4762,0.46712261826167695,2025-03-03 19:51:17.415389,2025-03-03 19:51:17.850250,0 days 00:00:00.434861,gaussian_mixture,abundance,2.5,2,COMPLETE
4763,0.5077897427343112,2025-03-03 19:51:17.853247,2025-03-03 19:51:18.221664,0 days 00:00:00.368417,gaussian_mixture,abundance,2.0,2,COMPLETE
4764,0.4751762061294631,2025-03-03 19:51:18.223855,2025-03-03 19:51:18.597991,0 days 00:00:00.374136,gaussian_mixture,abundance,2.0,4,COMPLETE
4765,0.4666754228870583,2025-03-03 19:51:18.599987,2025-03-03 19:51:18.958992,0 days 00:00:00.359005,gaussian_mixture,abundance,2.4000000000000004,5,COMPLETE
4766,0.33064835357183164,2025-03-03 19:51:18.961996,2025-03-03 19:51:19.280533,0 days 00:00:00.318537,kmeans,abundance,2.5,2,COMPLETE
4767,0.4115710041888675,2025-03-03 19:51:19.282537,2025-03-03 19:51:19.609680,0 days 00:00:00.327143,gaussian_mixture,abundance,2.35,3,COMPLETE
4768,0.5072086422783123,2025-03-03 19:51:19.611683,2025-03-03 19:51:19.971621,0 days 00:00:00.359938,gaussian_mixture,abundance,2.4000000000000004,2,COMPLETE
4769,0.46147678838547945,2025-03-03 19:51:19.975155,2025-03-03 19:51:20.351724,0 days 00:00:00.376569,gaussian_mixture,abundance,2.5500000000000003,2,COMPLETE
4770,0.4192341105994862,2025-03-03 19:51:20.353724,2025-03-03 19:51:20.671419,0 days 00:00:00.317695,gaussian_mixture,abundance,2.45,2,COMPLETE
4771,0.5351274693882166,2025-03-03 19:51:20.673964,2025-03-03 19:51:21.003428,0 days 00:00:00.329464,gaussian_mixture,abundance,2.35,2,COMPLETE
4772,0.27206907146357834,2025-03-03 19:51:21.006423,2025-03-03 19:51:21.335770,0 days 00:00:00.329347,gaussian_mixture,abundance,2.35,2,COMPLETE
4773,0.5461762681279454,2025-03-03 19:51:21.338770,2025-03-03 19:51:21.671641,0 days 00:00:00.332871,gaussian_mixture,abundance,1.75,2,COMPLETE
4774,0.5068622646827524,2025-03-03 19:51:21.673639,2025-03-03 19:51:22.024335,0 days 00:00:00.350696,gaussian_mixture,abundance,1.9000000000000001,2,COMPLETE
4775,0.4652468899102167,2025-03-03 19:51:22.026334,2025-03-03 19:51:22.362508,0 days 00:00:00.336174,gaussian_mixture,abundance,2.4000000000000004,2,COMPLETE
4776,0.7051520364577484,2025-03-03 19:51:22.365505,2025-03-03 19:51:22.683856,0 days 00:00:00.318351,gaussian_mixture,abundance,2.0,2,COMPLETE
4777,0.5111346874636788,2025-03-03 19:51:22.685856,2025-03-03 19:51:22.999622,0 days 00:00:00.313766,gaussian_mixture,abundance,2.5,2,COMPLETE
4778,0.5296597712096573,2025-03-03 19:51:23.001627,2025-03-03 19:51:23.338270,0 days 00:00:00.336643,gaussian_mixture,abundance,2.45,2,COMPLETE
4779,0.07842174094221417,2025-03-03 19:51:23.340270,2025-03-03 19:51:24.783647,0 days 00:00:01.443377,gaussian_mixture,presence,40.0,2,COMPLETE
4780,0.3652732833063715,2025-03-03 19:51:24.787637,2025-03-03 19:51:25.171408,0 days 00:00:00.383771,gaussian_mixture,abundance,2.35,2,COMPLETE
4781,0.44140963789043874,2025-03-03 19:51:25.174402,2025-03-03 19:51:25.555829,0 days 00:00:00.381427,gaussian_mixture,abundance,2.4000000000000004,2,COMPLETE
4782,0.42061157419961903,2025-03-03 19:51:25.557830,2025-03-03 19:51:25.929485,0 days 00:00:00.371655,gaussian_mixture,abundance,2.35,2,COMPLETE
4783,0.3472900489322206,2025-03-03 19:51:25.932488,2025-03-03 19:51:26.284181,0 days 00:00:00.351693,gaussian_mixture,abundance,2.4000000000000004,2,COMPLETE
4784,0.34566592908003335,2025-03-03 19:51:26.287184,2025-03-03 19:51:26.619248,0 days 00:00:00.332064,kmeans,abundance,2.0,6,COMPLETE
4785,0.2332920745595793,2025-03-03 19:51:26.621252,2025-03-03 19:51:26.964669,0 days 00:00:00.343417,gaussian_mixture,abundance,2.45,2,COMPLETE
4786,0.47431412446932386,2025-03-03 19:51:26.966671,2025-03-03 19:51:27.309843,0 days 00:00:00.343172,gaussian_mixture,abundance,1.9000000000000001,2,COMPLETE
4787,0.5557328239349586,2025-03-03 19:51:27.311844,2025-03-03 19:51:27.646211,0 days 00:00:00.334367,gaussian_mixture,abundance,2.3000000000000003,2,COMPLETE
4788,0.5039152830468656,2025-03-03 19:51:27.649202,2025-03-03 19:51:27.977029,0 days 00:00:00.327827,gaussian_mixture,abundance,2.35,2,COMPLETE
4789,0.40518230793022286,2025-03-03 19:51:27.979029,2025-03-03 19:51:28.399457,0 days 00:00:00.420428,gaussian_mixture,abundance,1.9500000000000002,2,COMPLETE
4790,0.4167093890431411,2025-03-03 19:51:28.401452,2025-03-03 19:51:28.734589,0 days 00:00:00.333137,gaussian_mixture,abundance,2.35,2,COMPLETE
4791,0.6210504632471086,2025-03-03 19:51:28.736594,2025-03-03 19:51:29.058807,0 days 00:00:00.322213,gaussian_mixture,abundance,2.4000000000000004,2,COMPLETE
4792,0.47020244363432634,2025-03-03 19:51:29.060807,2025-03-03 19:51:29.376839,0 days 00:00:00.316032,gaussian_mixture,abundance,2.5,2,COMPLETE
4793,0.5293114175159781,2025-03-03 19:51:29.378574,2025-03-03 19:51:29.717797,0 days 00:00:00.339223,gaussian_mixture,abundance,2.3000000000000003,2,COMPLETE
4794,0.5053905190993939,2025-03-03 19:51:29.720797,2025-03-03 19:51:30.045629,0 days 00:00:00.324832,gaussian_mixture,abundance,1.8,2,COMPLETE
4795,0.4563057323316385,2025-03-03 19:51:30.047629,2025-03-03 19:51:30.372821,0 days 00:00:00.325192,gaussian_mixture,abundance,1.75,2,COMPLETE
4796,0.47025046253018876,2025-03-03 19:51:30.375022,2025-03-03 19:51:30.776497,0 days 00:00:00.401475,gaussian_mixture,abundance,2.5500000000000003,2,COMPLETE
4797,0.04272096210285802,2025-03-03 19:51:30.778487,2025-03-03 19:51:32.084344,0 days 00:00:01.305857,gaussian_mixture,presence,110.0,2,COMPLETE
4798,0.28413971917402125,2025-03-03 19:51:32.087863,2025-03-03 19:51:32.424740,0 days 00:00:00.336877,gaussian_mixture,abundance,2.0,2,COMPLETE
4799,0.6078548244731359,2025-03-03 19:51:32.426745,2025-03-03 19:51:32.747351,0 days 00:00:00.320606,gaussian_mixture,abundance,2.35,2,COMPLETE
4800,0.2976856635917007,2025-03-03 19:51:32.749356,2025-03-03 19:51:33.072336,0 days 00:00:00.322980,gaussian_mixture,abundance,2.3000000000000003,2,COMPLETE
4801,0.5335575114872793,2025-03-03 19:51:33.074337,2025-03-03 19:51:33.420365,0 days 00:00:00.346028,gaussian_mixture,abundance,2.45,2,COMPLETE
4802,0.4079684098383051,2025-03-03 19:51:33.422366,2025-03-03 19:51:33.746931,0 days 00:00:00.324565,gaussian_mixture,abundance,2.4000000000000004,2,COMPLETE
4803,0.5673158760009673,2025-03-03 19:51:33.748936,2025-03-03 19:51:34.079741,0 days 00:00:00.330805,gaussian_mixture,abundance,2.3000000000000003,2,COMPLETE
4804,0.5633527701398364,2025-03-03 19:51:34.082741,2025-03-03 19:51:34.398964,0 days 00:00:00.316223,kmeans,abundance,1.85,2,COMPLETE
4805,0.29263017981008627,2025-03-03 19:51:34.401960,2025-03-03 19:51:34.716106,0 days 00:00:00.314146,gaussian_mixture,abundance,2.4000000000000004,2,COMPLETE
4806,0.46233199982801737,2025-03-03 19:51:34.718097,2025-03-03 19:51:35.071019,0 days 00:00:00.352922,gaussian_mixture,abundance,0.7000000000000001,2,COMPLETE
4807,0.6593031105552225,2025-03-03 19:51:35.073028,2025-03-03 19:51:35.400022,0 days 00:00:00.326994,gaussian_mixture,abundance,1.9500000000000002,2,COMPLETE
4808,0.2551897073515822,2025-03-03 19:51:35.402022,2025-03-03 19:51:35.724679,0 days 00:00:00.322657,gaussian_mixture,abundance,2.45,2,COMPLETE
4809,0.5240992969826526,2025-03-03 19:51:35.725679,2025-03-03 19:51:36.053134,0 days 00:00:00.327455,gaussian_mixture,abundance,2.3000000000000003,2,COMPLETE
4810,0.38286584749520614,2025-03-03 19:51:36.056339,2025-03-03 19:51:36.394509,0 days 00:00:00.338170,gaussian_mixture,abundance,2.35,2,COMPLETE
4811,0.5437114906152215,2025-03-03 19:51:36.396508,2025-03-03 19:51:36.732579,0 days 00:00:00.336071,gaussian_mixture,abundance,0.9,2,COMPLETE
4812,0.4849619396266795,2025-03-03 19:51:36.734579,2025-03-03 19:51:37.061237,0 days 00:00:00.326658,gaussian_mixture,abundance,2.5,2,COMPLETE
4813,0.4668267870704644,2025-03-03 19:51:37.064238,2025-03-03 19:51:37.418982,0 days 00:00:00.354744,gaussian_mixture,abundance,2.3000000000000003,3,COMPLETE
4814,0.6154219408143303,2025-03-03 19:51:37.420982,2025-03-03 19:51:37.788056,0 days 00:00:00.367074,gaussian_mixture,abundance,2.35,2,COMPLETE
4815,0.3412851114742746,2025-03-03 19:51:37.790382,2025-03-03 19:51:38.110102,0 days 00:00:00.319720,gaussian_mixture,abundance,1.85,2,COMPLETE
4816,0.40556880562476805,2025-03-03 19:51:38.112090,2025-03-03 19:51:38.445738,0 days 00:00:00.333648,gaussian_mixture,abundance,2.6,2,COMPLETE
4817,0.023007632612583893,2025-03-03 19:51:38.447723,2025-03-03 19:51:39.978550,0 days 00:00:01.530827,gaussian_mixture,presence,15.0,2,COMPLETE
4818,0.39991933813296165,2025-03-03 19:51:39.981546,2025-03-03 19:51:40.312163,0 days 00:00:00.330617,gaussian_mixture,abundance,2.0,2,COMPLETE
4819,0.3762786601377295,2025-03-03 19:51:40.314792,2025-03-03 19:51:40.651704,0 days 00:00:00.336912,gaussian_mixture,abundance,2.3000000000000003,2,COMPLETE
4820,0.37250731978252954,2025-03-03 19:51:40.653906,2025-03-03 19:51:40.989398,0 days 00:00:00.335492,gaussian_mixture,abundance,2.4000000000000004,2,COMPLETE
4821,0.564906930058474,2025-03-03 19:51:40.991398,2025-03-03 19:51:41.327638,0 days 00:00:00.336240,gaussian_mixture,abundance,2.45,2,COMPLETE
4822,0.3308159771716002,2025-03-03 19:51:41.329623,2025-03-03 19:51:41.665486,0 days 00:00:00.335863,kmeans,abundance,2.25,2,COMPLETE
4823,0.20537824548759942,2025-03-03 19:51:41.667477,2025-03-03 19:51:42.010586,0 days 00:00:00.343109,gaussian_mixture,abundance,2.35,2,COMPLETE
4824,0.5068444677700342,2025-03-03 19:51:42.012578,2025-03-03 19:51:42.381471,0 days 00:00:00.368893,gaussian_mixture,abundance,2.0500000000000003,2,COMPLETE
4825,0.6595412340406492,2025-03-03 19:51:42.383657,2025-03-03 19:51:42.798282,0 days 00:00:00.414625,gaussian_mixture,abundance,2.25,2,COMPLETE
4826,0.5522915012887267,2025-03-03 19:51:42.800284,2025-03-03 19:51:43.189413,0 days 00:00:00.389129,gaussian_mixture,abundance,2.35,2,COMPLETE
4827,0.5421436190632352,2025-03-03 19:51:43.191418,2025-03-03 19:51:43.613930,0 days 00:00:00.422512,gaussian_mixture,abundance,2.5,2,COMPLETE
4828,0.38997238713318305,2025-03-03 19:51:43.615935,2025-03-03 19:51:43.962186,0 days 00:00:00.346251,gaussian_mixture,abundance,2.25,2,COMPLETE
4829,0.546462941197584,2025-03-03 19:51:43.964192,2025-03-03 19:51:44.438716,0 days 00:00:00.474524,gaussian_mixture,abundance,2.45,2,COMPLETE
4830,0.0660692610672459,2025-03-03 19:51:44.441715,2025-03-03 19:51:44.940761,0 days 00:00:00.499046,gaussian_mixture,abundance,1.7000000000000002,2,COMPLETE
4831,0.37948472030554375,2025-03-03 19:51:44.942759,2025-03-03 19:51:45.316053,0 days 00:00:00.373294,gaussian_mixture,abundance,2.3000000000000003,2,COMPLETE
4832,0.3135410980674712,2025-03-03 19:51:45.317054,2025-03-03 19:51:45.797917,0 days 00:00:00.480863,gaussian_mixture,abundance,2.4000000000000004,2,COMPLETE
4833,0.44584122097950524,2025-03-03 19:51:45.800464,2025-03-03 19:51:46.218653,0 days 00:00:00.418189,gaussian_mixture,abundance,2.0500000000000003,2,COMPLETE
4834,0.38171347265840183,2025-03-03 19:51:46.220653,2025-03-03 19:51:46.591766,0 days 00:00:00.371113,gaussian_mixture,abundance,1.85,2,COMPLETE
4835,0.01550907443344952,2025-03-03 19:51:46.593766,2025-03-03 19:51:48.427922,0 days 00:00:01.834156,gaussian_mixture,presence,10.0,2,COMPLETE
4836,0.6414096378904388,2025-03-03 19:51:48.429914,2025-03-03 19:51:48.763367,0 days 00:00:00.333453,gaussian_mixture,abundance,2.4000000000000004,2,COMPLETE
4837,0.5994595470614495,2025-03-03 19:51:48.765367,2025-03-03 19:51:49.106225,0 days 00:00:00.340858,gaussian_mixture,abundance,2.5500000000000003,2,COMPLETE
4838,0.3631968293511176,2025-03-03 19:51:49.108225,2025-03-03 19:51:49.455946,0 days 00:00:00.347721,gaussian_mixture,abundance,2.25,4,COMPLETE
4839,0.5703216467759514,2025-03-03 19:51:49.457958,2025-03-03 19:51:49.797203,0 days 00:00:00.339245,gaussian_mixture,abundance,2.3000000000000003,2,COMPLETE
4840,0.3787533769147066,2025-03-03 19:51:49.799203,2025-03-03 19:51:50.130845,0 days 00:00:00.331642,kmeans,abundance,1.9500000000000002,2,COMPLETE
4841,0.44120367027243806,2025-03-03 19:51:50.132847,2025-03-03 19:51:50.450641,0 days 00:00:00.317794,gaussian_mixture,abundance,2.25,2,COMPLETE
4842,0.3709786758618627,2025-03-03 19:51:50.452642,2025-03-03 19:51:50.779666,0 days 00:00:00.327024,gaussian_mixture,abundance,2.35,2,COMPLETE
4843,0.5604261307339449,2025-03-03 19:51:50.781658,2025-03-03 19:51:51.113355,0 days 00:00:00.331697,gaussian_mixture,abundance,2.0500000000000003,2,COMPLETE
4844,0.5607551668497578,2025-03-03 19:51:51.115493,2025-03-03 19:51:51.449961,0 days 00:00:00.334468,gaussian_mixture,abundance,1.55,2,COMPLETE
4845,0.4139450844876641,2025-03-03 19:51:51.451960,2025-03-03 19:51:51.771289,0 days 00:00:00.319329,gaussian_mixture,abundance,2.4000000000000004,2,COMPLETE
4846,0.5138306388779769,2025-03-03 19:51:51.773291,2025-03-03 19:51:52.144855,0 days 00:00:00.371564,gaussian_mixture,abundance,2.3000000000000003,5,COMPLETE
4847,0.4671836680964484,2025-03-03 19:51:52.146856,2025-03-03 19:51:52.480942,0 days 00:00:00.334086,gaussian_mixture,abundance,1.8,2,COMPLETE
4848,0.562003989042619,2025-03-03 19:51:52.482947,2025-03-03 19:51:52.811015,0 days 00:00:00.328068,gaussian_mixture,abundance,2.45,2,COMPLETE
4849,0.48746176444833555,2025-03-03 19:51:52.813001,2025-03-03 19:51:53.136531,0 days 00:00:00.323530,gaussian_mixture,abundance,2.35,2,COMPLETE
4850,0.4889024113697146,2025-03-03 19:51:53.138532,2025-03-03 19:51:53.482805,0 days 00:00:00.344273,gaussian_mixture,abundance,2.0,2,COMPLETE
4851,0.5936670676615192,2025-03-03 19:51:53.484805,2025-03-03 19:51:53.814246,0 days 00:00:00.329441,gaussian_mixture,abundance,2.25,2,COMPLETE
4852,0.7070934972567843,2025-03-03 19:51:53.816253,2025-03-03 19:51:54.181437,0 days 00:00:00.365184,gaussian_mixture,abundance,2.5,2,COMPLETE
4853,0.015787175569845303,2025-03-03 19:51:54.183872,2025-03-03 19:51:55.641637,0 days 00:00:01.457765,gaussian_mixture,presence,10.0,2,COMPLETE
4854,0.21116687346025292,2025-03-03 19:51:55.643631,2025-03-03 19:51:55.976501,0 days 00:00:00.332870,gaussian_mixture,abundance,2.35,2,COMPLETE
4855,0.3010451093673825,2025-03-03 19:51:55.978502,2025-03-03 19:51:56.304995,0 days 00:00:00.326493,gaussian_mixture,abundance,1.9000000000000001,2,COMPLETE
4856,0.6119453133354623,2025-03-03 19:51:56.307518,2025-03-03 19:51:56.616586,0 days 00:00:00.309068,gaussian_mixture,abundance,2.2,2,COMPLETE
4857,0.4446846075417337,2025-03-03 19:51:56.618574,2025-03-03 19:51:56.926758,0 days 00:00:00.308184,gaussian_mixture,abundance,2.4000000000000004,2,COMPLETE
4858,0.6920714425925455,2025-03-03 19:51:56.929758,2025-03-03 19:51:57.253754,0 days 00:00:00.323996,gaussian_mixture,abundance,2.3000000000000003,2,COMPLETE
4859,0.4509994814590579,2025-03-03 19:51:57.256746,2025-03-03 19:51:57.596951,0 days 00:00:00.340205,kmeans,abundance,1.75,2,COMPLETE
4860,0.6001319253611805,2025-03-03 19:51:57.598965,2025-03-03 19:51:57.918672,0 days 00:00:00.319707,gaussian_mixture,abundance,2.2,2,COMPLETE
4861,0.47903660871515186,2025-03-03 19:51:57.920667,2025-03-03 19:51:58.234345,0 days 00:00:00.313678,gaussian_mixture,abundance,2.45,2,COMPLETE
4862,0.16915503877370336,2025-03-03 19:51:58.236345,2025-03-03 19:51:58.548351,0 days 00:00:00.312006,gaussian_mixture,abundance,2.0500000000000003,2,COMPLETE
4863,0.5722232020510016,2025-03-03 19:51:58.550360,2025-03-03 19:51:58.867824,0 days 00:00:00.317464,gaussian_mixture,abundance,2.25,2,COMPLETE
4864,0.45091599606683647,2025-03-03 19:51:58.869833,2025-03-03 19:51:59.185221,0 days 00:00:00.315388,gaussian_mixture,abundance,2.3000000000000003,2,COMPLETE
4865,0.5084546411252842,2025-03-03 19:51:59.188221,2025-03-03 19:51:59.502017,0 days 00:00:00.313796,gaussian_mixture,abundance,2.35,2,COMPLETE
4866,0.6634017623408495,2025-03-03 19:51:59.504017,2025-03-03 19:51:59.827358,0 days 00:00:00.323341,gaussian_mixture,abundance,2.25,2,COMPLETE
4867,0.6282619979114271,2025-03-03 19:51:59.829358,2025-03-03 19:52:00.141084,0 days 00:00:00.311726,gaussian_mixture,abundance,2.45,2,COMPLETE
4868,0.5490395311702332,2025-03-03 19:52:00.143084,2025-03-03 19:52:00.451033,0 days 00:00:00.307949,gaussian_mixture,abundance,2.4000000000000004,2,COMPLETE
4869,0.3406984552557691,2025-03-03 19:52:00.454034,2025-03-03 19:52:00.772894,0 days 00:00:00.318860,gaussian_mixture,abundance,1.4500000000000002,2,COMPLETE
