number,value,datetime_start,datetime_complete,duration,params_algorithm,params_filter_criteria,params_filter_threshold,params_k,state
2516,0.4396896425528218,2025-03-03 19:37:39.103238,2025-03-03 19:37:39.347401,0 days 00:00:00.244163,gaussian_mixture,abundance,2.25,2,COMPLETE
2517,0.3410483362912447,2025-03-03 19:37:39.349401,2025-03-03 19:37:39.595627,0 days 00:00:00.246226,gaussian_mixture,abundance,2.4000000000000004,2,COMPLETE
2518,0.6725145043508753,2025-03-03 19:37:39.597626,2025-03-03 19:37:39.850792,0 days 00:00:00.253166,gaussian_mixture,abundance,2.3000000000000003,3,COMPLETE
2519,0.35862546984284754,2025-03-03 19:37:39.852556,2025-03-03 19:37:40.102633,0 days 00:00:00.250077,gaussian_mixture,abundance,2.15,2,COMPLETE
2520,0.49030759356493664,2025-03-03 19:37:40.103634,2025-03-03 19:37:40.365224,0 days 00:00:00.261590,gaussian_mixture,abundance,2.1,2,COMPLETE
2521,0.42952298876810946,2025-03-03 19:37:40.367219,2025-03-03 19:37:40.628115,0 days 00:00:00.260896,gaussian_mixture,abundance,2.35,2,COMPLETE
2522,0.4061879450113456,2025-03-03 19:37:40.630108,2025-03-03 19:37:40.925315,0 days 00:00:00.295207,gaussian_mixture,abundance,2.2,2,COMPLETE
2523,0.49063383513425973,2025-03-03 19:37:40.927313,2025-03-03 19:37:41.188261,0 days 00:00:00.260948,gaussian_mixture,abundance,2.25,2,COMPLETE
2524,0.5713812603087451,2025-03-03 19:37:41.190260,2025-03-03 19:37:41.437923,0 days 00:00:00.247663,gaussian_mixture,abundance,2.45,2,COMPLETE
2525,0.3920605381019625,2025-03-03 19:37:41.439917,2025-03-03 19:37:41.693492,0 days 00:00:00.253575,gaussian_mixture,abundance,2.15,6,COMPLETE
2526,0.430366711489261,2025-03-03 19:37:41.695521,2025-03-03 19:37:41.957415,0 days 00:00:00.261894,gaussian_mixture,abundance,0.9,2,COMPLETE
2527,0.31326903484415436,2025-03-03 19:37:41.959407,2025-03-03 19:37:42.198731,0 days 00:00:00.239324,gaussian_mixture,abundance,2.3000000000000003,2,COMPLETE
2528,0.051438737305557536,2025-03-03 19:37:42.199727,2025-03-03 19:37:43.452045,0 days 00:00:01.252318,gaussian_mixture,presence,85.0,2,COMPLETE
2529,0.5596105811765957,2025-03-03 19:37:43.454042,2025-03-03 19:37:43.699592,0 days 00:00:00.245550,gaussian_mixture,abundance,2.35,2,COMPLETE
2530,0.2841115363099976,2025-03-03 19:37:43.701591,2025-03-03 19:37:43.946220,0 days 00:00:00.244629,gaussian_mixture,abundance,2.0500000000000003,2,COMPLETE
2531,0.5936670676615192,2025-03-03 19:37:43.948213,2025-03-03 19:37:44.198353,0 days 00:00:00.250140,gaussian_mixture,abundance,2.2,2,COMPLETE
2532,0.43235766091249317,2025-03-03 19:37:44.200352,2025-03-03 19:37:44.445965,0 days 00:00:00.245613,gaussian_mixture,abundance,2.1,2,COMPLETE
2533,0.42982041560074097,2025-03-03 19:37:44.447959,2025-03-03 19:37:44.685610,0 days 00:00:00.237651,kmeans,abundance,2.25,2,COMPLETE
2534,0.37349670783885536,2025-03-03 19:37:44.687609,2025-03-03 19:37:44.956304,0 days 00:00:00.268695,gaussian_mixture,abundance,0.7000000000000001,2,COMPLETE
2535,0.5104805580215612,2025-03-03 19:37:44.958301,2025-03-03 19:37:45.231380,0 days 00:00:00.273079,gaussian_mixture,abundance,2.2,2,COMPLETE
2536,0.48557755731916075,2025-03-03 19:37:45.232383,2025-03-03 19:37:45.492311,0 days 00:00:00.259928,gaussian_mixture,abundance,2.35,2,COMPLETE
2537,0.566335161906097,2025-03-03 19:37:45.493313,2025-03-03 19:37:45.735601,0 days 00:00:00.242288,gaussian_mixture,abundance,2.45,2,COMPLETE
2538,0.36007552219057043,2025-03-03 19:37:45.737583,2025-03-03 19:37:45.983418,0 days 00:00:00.245835,gaussian_mixture,abundance,2.15,2,COMPLETE
2539,0.506757906015775,2025-03-03 19:37:45.985415,2025-03-03 19:37:46.236068,0 days 00:00:00.250653,gaussian_mixture,abundance,2.3000000000000003,2,COMPLETE
2540,0.2009280237123189,2025-03-03 19:37:46.238065,2025-03-03 19:37:46.486389,0 days 00:00:00.248324,gaussian_mixture,abundance,1.5,2,COMPLETE
2541,0.4593012010272316,2025-03-03 19:37:46.487382,2025-03-03 19:37:46.732047,0 days 00:00:00.244665,gaussian_mixture,abundance,2.0,2,COMPLETE
2542,0.629062982680547,2025-03-03 19:37:46.734043,2025-03-03 19:37:46.974447,0 days 00:00:00.240404,gaussian_mixture,abundance,2.4000000000000004,2,COMPLETE
2543,0.6871638149695389,2025-03-03 19:37:46.976436,2025-03-03 19:37:47.222020,0 days 00:00:00.245584,gaussian_mixture,abundance,2.25,2,COMPLETE
2544,0.2811713577189792,2025-03-03 19:37:47.224019,2025-03-03 19:37:47.465364,0 days 00:00:00.241345,gaussian_mixture,abundance,2.1,2,COMPLETE
2545,0.551457633390647,2025-03-03 19:37:47.466365,2025-03-03 19:37:47.725856,0 days 00:00:00.259491,gaussian_mixture,abundance,2.5,2,COMPLETE
2546,0.5406704617976538,2025-03-03 19:37:47.727851,2025-03-03 19:37:47.972014,0 days 00:00:00.244163,gaussian_mixture,abundance,2.2,2,COMPLETE
2547,0.49393641251746123,2025-03-03 19:37:47.974010,2025-03-03 19:37:48.219091,0 days 00:00:00.245081,gaussian_mixture,abundance,2.15,2,COMPLETE
2548,0.4170188329139449,2025-03-03 19:37:48.220095,2025-03-03 19:37:48.470180,0 days 00:00:00.250085,gaussian_mixture,abundance,2.3000000000000003,2,COMPLETE
2549,0.5276402776933484,2025-03-03 19:37:48.471176,2025-03-03 19:37:48.720350,0 days 00:00:00.249174,gaussian_mixture,abundance,2.0500000000000003,2,COMPLETE
2550,0.019367418751580746,2025-03-03 19:37:48.721349,2025-03-03 19:37:50.180836,0 days 00:00:01.459487,gaussian_mixture,presence,10.0,2,COMPLETE
2551,0.4830060908136752,2025-03-03 19:37:50.182831,2025-03-03 19:37:50.436288,0 days 00:00:00.253457,kmeans,abundance,2.35,2,COMPLETE
2552,0.5601746373623749,2025-03-03 19:37:50.438289,2025-03-03 19:37:50.685211,0 days 00:00:00.246922,gaussian_mixture,abundance,2.15,2,COMPLETE
2553,0.6407477641854399,2025-03-03 19:37:50.686208,2025-03-03 19:37:50.931794,0 days 00:00:00.245586,gaussian_mixture,abundance,2.25,2,COMPLETE
2554,0.5766197689844506,2025-03-03 19:37:50.932795,2025-03-03 19:37:51.181455,0 days 00:00:00.248660,gaussian_mixture,abundance,2.45,2,COMPLETE
2555,0.45091599606683647,2025-03-03 19:37:51.183453,2025-03-03 19:37:51.429858,0 days 00:00:00.246405,gaussian_mixture,abundance,2.2,2,COMPLETE
2556,0.546462941197584,2025-03-03 19:37:51.430877,2025-03-03 19:37:51.675927,0 days 00:00:00.245050,gaussian_mixture,abundance,2.1,2,COMPLETE
2557,0.43953316448900115,2025-03-03 19:37:51.677925,2025-03-03 19:37:51.938685,0 days 00:00:00.260760,gaussian_mixture,abundance,2.3000000000000003,2,COMPLETE
2558,0.5265099337901129,2025-03-03 19:37:51.940684,2025-03-03 19:37:52.185762,0 days 00:00:00.245078,gaussian_mixture,abundance,2.4000000000000004,2,COMPLETE
2559,0.280555951554882,2025-03-03 19:37:52.186762,2025-03-03 19:37:52.429078,0 days 00:00:00.242316,gaussian_mixture,abundance,2.2,2,COMPLETE
2560,0.5012991362479752,2025-03-03 19:37:52.430715,2025-03-03 19:37:52.681822,0 days 00:00:00.251107,gaussian_mixture,abundance,1.9500000000000002,2,COMPLETE
2561,0.4666052099891604,2025-03-03 19:37:52.683822,2025-03-03 19:37:52.937564,0 days 00:00:00.253742,gaussian_mixture,abundance,2.0500000000000003,3,COMPLETE
2562,0.47442705221258824,2025-03-03 19:37:52.938568,2025-03-03 19:37:53.190165,0 days 00:00:00.251597,gaussian_mixture,abundance,2.15,5,COMPLETE
2563,0.5785817644685896,2025-03-03 19:37:53.191166,2025-03-03 19:37:53.439286,0 days 00:00:00.248120,gaussian_mixture,abundance,2.3000000000000003,2,COMPLETE
2564,0.01245418891057796,2025-03-03 19:37:53.441286,2025-03-03 19:37:54.811696,0 days 00:00:01.370410,gaussian_mixture,presence,10.0,2,COMPLETE
2565,0.48753462829878635,2025-03-03 19:37:54.814708,2025-03-03 19:37:55.062499,0 days 00:00:00.247791,gaussian_mixture,abundance,2.4000000000000004,2,COMPLETE
2566,0.4161216432001943,2025-03-03 19:37:55.063493,2025-03-03 19:37:55.311752,0 days 00:00:00.248259,gaussian_mixture,abundance,2.5500000000000003,2,COMPLETE
2567,0.5159177985016999,2025-03-03 19:37:55.312774,2025-03-03 19:37:55.557361,0 days 00:00:00.244587,gaussian_mixture,abundance,2.25,2,COMPLETE
2568,0.36699895403153093,2025-03-03 19:37:55.558363,2025-03-03 19:37:55.803446,0 days 00:00:00.245083,gaussian_mixture,abundance,2.1,2,COMPLETE
2569,0.5720963474506086,2025-03-03 19:37:55.804445,2025-03-03 19:37:56.054060,0 days 00:00:00.249615,gaussian_mixture,abundance,2.35,2,COMPLETE
2570,0.2404134244520677,2025-03-03 19:37:56.056056,2025-03-03 19:37:56.309901,0 days 00:00:00.253845,kmeans,abundance,2.0,2,COMPLETE
2571,0.50199836959992,2025-03-03 19:37:56.311896,2025-03-03 19:37:56.563806,0 days 00:00:00.251910,gaussian_mixture,abundance,2.25,2,COMPLETE
2572,0.25916728673768674,2025-03-03 19:37:56.565804,2025-03-03 19:37:56.817248,0 days 00:00:00.251444,gaussian_mixture,abundance,2.15,2,COMPLETE
2573,0.5578720249265439,2025-03-03 19:37:56.819247,2025-03-03 19:37:57.063873,0 days 00:00:00.244626,gaussian_mixture,abundance,2.35,2,COMPLETE
2574,0.435297078587888,2025-03-03 19:37:57.064873,2025-03-03 19:37:57.308405,0 days 00:00:00.243532,gaussian_mixture,abundance,2.5,2,COMPLETE
2575,0.6736217311360886,2025-03-03 19:37:57.310395,2025-03-03 19:37:57.557317,0 days 00:00:00.246922,gaussian_mixture,abundance,2.0500000000000003,2,COMPLETE
2576,0.6785019127379108,2025-03-03 19:37:57.559317,2025-03-03 19:37:57.804539,0 days 00:00:00.245222,gaussian_mixture,abundance,2.2,2,COMPLETE
2577,0.4670788057622097,2025-03-03 19:37:57.805536,2025-03-03 19:37:58.051429,0 days 00:00:00.245893,gaussian_mixture,abundance,2.25,2,COMPLETE
2578,0.259342443368209,2025-03-03 19:37:58.053438,2025-03-03 19:37:58.301255,0 days 00:00:00.247817,gaussian_mixture,abundance,2.1,2,COMPLETE
2579,0.4677329352043273,2025-03-03 19:37:58.303253,2025-03-03 19:37:58.544850,0 days 00:00:00.241597,gaussian_mixture,abundance,2.45,2,COMPLETE
2580,0.2799755443681436,2025-03-03 19:37:58.546102,2025-03-03 19:37:58.785897,0 days 00:00:00.239795,gaussian_mixture,abundance,2.15,2,COMPLETE
2581,0.29813979320665995,2025-03-03 19:37:58.786894,2025-03-03 19:37:59.031948,0 days 00:00:00.245054,gaussian_mixture,abundance,2.3000000000000003,2,COMPLETE
2582,0.33997666229356266,2025-03-03 19:37:59.033956,2025-03-03 19:37:59.315467,0 days 00:00:00.281511,gaussian_mixture,abundance,0.4,2,COMPLETE
2583,0.00984220514702383,2025-03-03 19:37:59.317474,2025-03-03 19:38:00.729429,0 days 00:00:01.411955,gaussian_mixture,presence,10.0,2,COMPLETE
2584,0.5185498382831646,2025-03-03 19:38:00.730429,2025-03-03 19:38:00.978911,0 days 00:00:00.248482,gaussian_mixture,abundance,2.2,2,COMPLETE
2585,0.48084508907853074,2025-03-03 19:38:00.980920,2025-03-03 19:38:01.232955,0 days 00:00:00.252035,gaussian_mixture,abundance,2.3000000000000003,2,COMPLETE
2586,0.5350759798273105,2025-03-03 19:38:01.234974,2025-03-03 19:38:01.482435,0 days 00:00:00.247461,gaussian_mixture,abundance,2.1,2,COMPLETE
2587,0.46471564789501896,2025-03-03 19:38:01.484432,2025-03-03 19:38:01.725603,0 days 00:00:00.241171,gaussian_mixture,abundance,2.35,2,COMPLETE
2588,0.5737312313033898,2025-03-03 19:38:01.727593,2025-03-03 19:38:01.974559,0 days 00:00:00.246966,gaussian_mixture,abundance,2.15,2,COMPLETE
2589,0.3720791679639227,2025-03-03 19:38:01.977560,2025-03-03 19:38:02.212716,0 days 00:00:00.235156,kmeans,abundance,2.4000000000000004,2,COMPLETE
2590,0.5001551720216997,2025-03-03 19:38:02.213713,2025-03-03 19:38:02.455920,0 days 00:00:00.242207,gaussian_mixture,abundance,2.2,2,COMPLETE
2591,0.44706715087028337,2025-03-03 19:38:02.456917,2025-03-03 19:38:02.714244,0 days 00:00:00.257327,gaussian_mixture,abundance,2.0500000000000003,2,COMPLETE
2592,0.566998954031531,2025-03-03 19:38:02.716254,2025-03-03 19:38:02.963062,0 days 00:00:00.246808,gaussian_mixture,abundance,2.4000000000000004,2,COMPLETE
2593,0.3329328224405173,2025-03-03 19:38:02.965069,2025-03-03 19:38:03.211829,0 days 00:00:00.246760,gaussian_mixture,abundance,2.25,2,COMPLETE
2594,0.5810791635174098,2025-03-03 19:38:03.213837,2025-03-03 19:38:03.462617,0 days 00:00:00.248780,gaussian_mixture,abundance,2.2,2,COMPLETE
2595,0.5262587812553156,2025-03-03 19:38:03.463618,2025-03-03 19:38:03.715250,0 days 00:00:00.251632,gaussian_mixture,abundance,2.3000000000000003,2,COMPLETE
2596,0.47229446760738314,2025-03-03 19:38:03.717250,2025-03-03 19:38:03.964248,0 days 00:00:00.246998,gaussian_mixture,abundance,2.0,2,COMPLETE
2597,0.38111383465546667,2025-03-03 19:38:03.966253,2025-03-03 19:38:04.210369,0 days 00:00:00.244116,gaussian_mixture,abundance,2.1,2,COMPLETE
2598,0.7338002255316329,2025-03-03 19:38:04.212360,2025-03-03 19:38:04.461185,0 days 00:00:00.248825,gaussian_mixture,abundance,1.9000000000000001,2,COMPLETE
2599,0.35139554911353965,2025-03-03 19:38:04.463185,2025-03-03 19:38:04.722684,0 days 00:00:00.259499,gaussian_mixture,abundance,1.9500000000000002,2,COMPLETE
2600,0.566998954031531,2025-03-03 19:38:04.724847,2025-03-03 19:38:04.995297,0 days 00:00:00.270450,gaussian_mixture,abundance,2.0,2,COMPLETE
2601,0.425841291035881,2025-03-03 19:38:04.997307,2025-03-03 19:38:05.244001,0 days 00:00:00.246694,gaussian_mixture,abundance,1.8,2,COMPLETE
2602,0.5841319908383386,2025-03-03 19:38:05.246011,2025-03-03 19:38:05.499415,0 days 00:00:00.253404,gaussian_mixture,abundance,1.9500000000000002,2,COMPLETE
2603,0.017888586344108084,2025-03-03 19:38:05.501424,2025-03-03 19:38:06.927137,0 days 00:00:01.425713,gaussian_mixture,presence,10.0,2,COMPLETE
2604,0.3997937572852176,2025-03-03 19:38:06.929656,2025-03-03 19:38:07.175905,0 days 00:00:00.246249,gaussian_mixture,abundance,1.9000000000000001,2,COMPLETE
2605,0.4850927886802824,2025-03-03 19:38:07.177911,2025-03-03 19:38:07.438281,0 days 00:00:00.260370,gaussian_mixture,abundance,2.0,3,COMPLETE
2606,0.5972728484788125,2025-03-03 19:38:07.439277,2025-03-03 19:38:07.717927,0 days 00:00:00.278650,gaussian_mixture,abundance,1.85,2,COMPLETE
2607,0.6465703102134606,2025-03-03 19:38:07.719917,2025-03-03 19:38:07.972755,0 days 00:00:00.252838,gaussian_mixture,abundance,2.0,2,COMPLETE
2608,0.5086635416124875,2025-03-03 19:38:07.974764,2025-03-03 19:38:08.211258,0 days 00:00:00.236494,kmeans,abundance,1.9000000000000001,2,COMPLETE
2609,0.5125542041553872,2025-03-03 19:38:08.212254,2025-03-03 19:38:08.461990,0 days 00:00:00.249736,gaussian_mixture,abundance,1.85,2,COMPLETE
2610,0.48691106109288107,2025-03-03 19:38:08.462988,2025-03-03 19:38:08.713355,0 days 00:00:00.250367,gaussian_mixture,abundance,2.0,2,COMPLETE
2611,0.45808500942351793,2025-03-03 19:38:08.715363,2025-03-03 19:38:08.995266,0 days 00:00:00.279903,gaussian_mixture,abundance,1.9000000000000001,6,COMPLETE
2612,0.08020130686638821,2025-03-03 19:38:08.997521,2025-03-03 19:38:09.244915,0 days 00:00:00.247394,gaussian_mixture,abundance,2.0,2,COMPLETE
2613,0.3903744608718377,2025-03-03 19:38:09.245910,2025-03-03 19:38:09.499665,0 days 00:00:00.253755,gaussian_mixture,abundance,1.9500000000000002,4,COMPLETE
2614,0.3990393270213882,2025-03-03 19:38:09.500666,2025-03-03 19:38:09.753366,0 days 00:00:00.252700,gaussian_mixture,abundance,1.9000000000000001,2,COMPLETE
2615,0.47654146712298645,2025-03-03 19:38:09.755355,2025-03-03 19:38:10.001189,0 days 00:00:00.245834,gaussian_mixture,abundance,1.9000000000000001,2,COMPLETE
2616,0.37063229826630295,2025-03-03 19:38:10.003198,2025-03-03 19:38:10.253088,0 days 00:00:00.249890,gaussian_mixture,abundance,1.85,2,COMPLETE
2617,0.38900769899215537,2025-03-03 19:38:10.255077,2025-03-03 19:38:10.500291,0 days 00:00:00.245214,gaussian_mixture,abundance,1.9000000000000001,2,COMPLETE
2618,0.6071264680960488,2025-03-03 19:38:10.502280,2025-03-03 19:38:10.757983,0 days 00:00:00.255703,gaussian_mixture,abundance,1.9000000000000001,2,COMPLETE
2619,0.26448546450036237,2025-03-03 19:38:10.759975,2025-03-03 19:38:11.006724,0 days 00:00:00.246749,gaussian_mixture,abundance,1.9000000000000001,2,COMPLETE
2620,0.5464616833742262,2025-03-03 19:38:11.007729,2025-03-03 19:38:11.268494,0 days 00:00:00.260765,gaussian_mixture,abundance,1.9000000000000001,2,COMPLETE
2621,0.013364096695831985,2025-03-03 19:38:11.270492,2025-03-03 19:38:12.623721,0 days 00:00:01.353229,gaussian_mixture,presence,10.0,2,COMPLETE
2622,0.5140736712271294,2025-03-03 19:38:12.625720,2025-03-03 19:38:12.877769,0 days 00:00:00.252049,gaussian_mixture,abundance,1.9500000000000002,2,COMPLETE
2623,0.44506403661314453,2025-03-03 19:38:12.879767,2025-03-03 19:38:13.131542,0 days 00:00:00.251775,gaussian_mixture,abundance,2.0,2,COMPLETE
2624,0.47954440805359466,2025-03-03 19:38:13.132552,2025-03-03 19:38:13.404354,0 days 00:00:00.271802,gaussian_mixture,abundance,1.9000000000000001,2,COMPLETE
2625,0.5833835416496068,2025-03-03 19:38:13.405355,2025-03-03 19:38:13.653314,0 days 00:00:00.247959,gaussian_mixture,abundance,2.0,2,COMPLETE
2626,0.5966284709591211,2025-03-03 19:38:13.655323,2025-03-03 19:38:13.902729,0 days 00:00:00.247406,gaussian_mixture,abundance,2.0,2,COMPLETE
2627,0.26159957976589326,2025-03-03 19:38:13.904738,2025-03-03 19:38:14.154795,0 days 00:00:00.250057,gaussian_mixture,abundance,1.8,2,COMPLETE
2628,0.4287574163885425,2025-03-03 19:38:14.155792,2025-03-03 19:38:14.396048,0 days 00:00:00.240256,kmeans,abundance,1.9500000000000002,2,COMPLETE
2629,0.5394178700208296,2025-03-03 19:38:14.397045,2025-03-03 19:38:14.644344,0 days 00:00:00.247299,gaussian_mixture,abundance,1.9000000000000001,2,COMPLETE
2630,0.6632989191378915,2025-03-03 19:38:14.646335,2025-03-03 19:38:14.893087,0 days 00:00:00.246752,gaussian_mixture,abundance,1.85,2,COMPLETE
2631,0.48794167928428267,2025-03-03 19:38:14.895075,2025-03-03 19:38:15.151158,0 days 00:00:00.256083,gaussian_mixture,abundance,1.8,3,COMPLETE
2632,0.5464914092336361,2025-03-03 19:38:15.152155,2025-03-03 19:38:15.398808,0 days 00:00:00.246653,gaussian_mixture,abundance,1.9000000000000001,2,COMPLETE
2633,0.4401285516779945,2025-03-03 19:38:15.400817,2025-03-03 19:38:15.663227,0 days 00:00:00.262410,gaussian_mixture,abundance,1.9000000000000001,2,COMPLETE
2634,0.4151135876632381,2025-03-03 19:38:15.665229,2025-03-03 19:38:15.919343,0 days 00:00:00.254114,gaussian_mixture,abundance,1.9500000000000002,2,COMPLETE
2635,0.2632832252020299,2025-03-03 19:38:15.921351,2025-03-03 19:38:16.167145,0 days 00:00:00.245794,gaussian_mixture,abundance,1.85,2,COMPLETE
2636,0.39135896784629637,2025-03-03 19:38:16.169136,2025-03-03 19:38:16.419504,0 days 00:00:00.250368,gaussian_mixture,abundance,1.9500000000000002,2,COMPLETE
2637,0.3130606017320043,2025-03-03 19:38:16.421503,2025-03-03 19:38:16.665772,0 days 00:00:00.244269,gaussian_mixture,abundance,1.9500000000000002,2,COMPLETE
2638,0.3296926668876842,2025-03-03 19:38:16.667760,2025-03-03 19:38:16.916885,0 days 00:00:00.249125,gaussian_mixture,abundance,1.9500000000000002,2,COMPLETE
2639,0.0357105865037421,2025-03-03 19:38:16.918878,2025-03-03 19:38:18.294638,0 days 00:00:01.375760,gaussian_mixture,presence,10.0,2,COMPLETE
2640,0.5366597279496125,2025-03-03 19:38:18.296634,2025-03-03 19:38:18.546638,0 days 00:00:00.250004,gaussian_mixture,abundance,1.8,2,COMPLETE
2641,0.5607566230635423,2025-03-03 19:38:18.548647,2025-03-03 19:38:18.803583,0 days 00:00:00.254936,gaussian_mixture,abundance,1.9500000000000002,2,COMPLETE
2642,0.5354864128803651,2025-03-03 19:38:18.805596,2025-03-03 19:38:19.051351,0 days 00:00:00.245755,gaussian_mixture,abundance,2.45,2,COMPLETE
2643,0.4615767630992321,2025-03-03 19:38:19.052349,2025-03-03 19:38:19.305166,0 days 00:00:00.252817,gaussian_mixture,abundance,1.9500000000000002,2,COMPLETE
2644,0.5054873174180067,2025-03-03 19:38:19.307153,2025-03-03 19:38:19.558926,0 days 00:00:00.251773,gaussian_mixture,abundance,1.85,2,COMPLETE
2645,0.39005767733131663,2025-03-03 19:38:19.560935,2025-03-03 19:38:19.812519,0 days 00:00:00.251584,kmeans,abundance,2.0500000000000003,2,COMPLETE
2646,0.433162282218159,2025-03-03 19:38:19.814519,2025-03-03 19:38:20.066226,0 days 00:00:00.251707,gaussian_mixture,abundance,2.0,2,COMPLETE
2647,0.5148294142452781,2025-03-03 19:38:20.067224,2025-03-03 19:38:20.315383,0 days 00:00:00.248159,gaussian_mixture,abundance,2.5,2,COMPLETE
2648,0.47431412446932386,2025-03-03 19:38:20.317381,2025-03-03 19:38:20.565556,0 days 00:00:00.248175,gaussian_mixture,abundance,2.4000000000000004,2,COMPLETE
2649,0.4628160659482382,2025-03-03 19:38:20.567552,2025-03-03 19:38:20.818462,0 days 00:00:00.250910,gaussian_mixture,abundance,1.9500000000000002,2,COMPLETE
2650,0.5377362873041276,2025-03-03 19:38:20.819459,2025-03-03 19:38:21.070072,0 days 00:00:00.250613,gaussian_mixture,abundance,2.45,2,COMPLETE
2651,0.680982819400034,2025-03-03 19:38:21.072068,2025-03-03 19:38:21.324308,0 days 00:00:00.252240,gaussian_mixture,abundance,2.0500000000000003,2,COMPLETE
2652,0.6282619979114271,2025-03-03 19:38:21.325303,2025-03-03 19:38:21.575931,0 days 00:00:00.250628,gaussian_mixture,abundance,2.35,2,COMPLETE
2653,0.6119453133354623,2025-03-03 19:38:21.577927,2025-03-03 19:38:21.852787,0 days 00:00:00.274860,gaussian_mixture,abundance,2.35,2,COMPLETE
2654,0.5607381562082837,2025-03-03 19:38:21.854983,2025-03-03 19:38:22.147165,0 days 00:00:00.292182,gaussian_mixture,abundance,1.85,2,COMPLETE
2655,0.45389540416445157,2025-03-03 19:38:22.148163,2025-03-03 19:38:22.399142,0 days 00:00:00.250979,gaussian_mixture,abundance,2.5500000000000003,2,COMPLETE
2656,0.4613122214502484,2025-03-03 19:38:22.400908,2025-03-03 19:38:22.660599,0 days 00:00:00.259691,gaussian_mixture,abundance,2.0500000000000003,5,COMPLETE
2657,0.4470554677666364,2025-03-03 19:38:22.662591,2025-03-03 19:38:22.912900,0 days 00:00:00.250309,gaussian_mixture,abundance,2.45,2,COMPLETE
2658,0.5514110389284689,2025-03-03 19:38:22.914907,2025-03-03 19:38:23.175182,0 days 00:00:00.260275,gaussian_mixture,abundance,2.0500000000000003,2,COMPLETE
2659,0.011587332854732268,2025-03-03 19:38:23.177177,2025-03-03 19:38:24.581172,0 days 00:00:01.403995,gaussian_mixture,presence,10.0,2,COMPLETE
2660,0.3355603568657526,2025-03-03 19:38:24.583172,2025-03-03 19:38:24.827763,0 days 00:00:00.244591,gaussian_mixture,abundance,2.4000000000000004,2,COMPLETE
2661,0.547287267271816,2025-03-03 19:38:24.829757,2025-03-03 19:38:25.095997,0 days 00:00:00.266240,gaussian_mixture,abundance,1.9500000000000002,4,COMPLETE
