number,value,datetime_start,datetime_complete,duration,params_algorithm,params_filter_criteria,params_filter_threshold,params_k,state
3989,0.47135272117172206,2025-03-03 19:46:09.058437,2025-03-03 19:46:09.378192,0 days 00:00:00.319755,gaussian_mixture,abundance,2.3000000000000003,2,COMPLETE
3990,0.011645684487659552,2025-03-03 19:46:09.380363,2025-03-03 19:46:10.903583,0 days 00:00:01.523220,gaussian_mixture,presence,10.0,2,COMPLETE
3991,0.38244071414750447,2025-03-03 19:46:10.906124,2025-03-03 19:46:11.211366,0 days 00:00:00.305242,gaussian_mixture,abundance,2.5500000000000003,2,COMPLETE
3992,0.5671938838180586,2025-03-03 19:46:11.213369,2025-03-03 19:46:11.525630,0 days 00:00:00.312261,gaussian_mixture,abundance,2.35,2,COMPLETE
3993,0.48133909622163873,2025-03-03 19:46:11.528330,2025-03-03 19:46:11.852571,0 days 00:00:00.324241,gaussian_mixture,abundance,2.5,2,COMPLETE
3994,0.2688824961900502,2025-03-03 19:46:11.854561,2025-03-03 19:46:12.197676,0 days 00:00:00.343115,gaussian_mixture,abundance,2.4000000000000004,2,COMPLETE
3995,0.688371554085667,2025-03-03 19:46:12.200677,2025-03-03 19:46:12.559151,0 days 00:00:00.358474,gaussian_mixture,abundance,2.3000000000000003,2,COMPLETE
3996,0.4432163779421338,2025-03-03 19:46:12.561151,2025-03-03 19:46:12.870104,0 days 00:00:00.308953,kmeans,abundance,2.4000000000000004,2,COMPLETE
3997,0.3762786601377295,2025-03-03 19:46:12.872104,2025-03-03 19:46:13.191221,0 days 00:00:00.319117,gaussian_mixture,abundance,2.3000000000000003,2,COMPLETE
3998,0.6555877495959652,2025-03-03 19:46:13.193216,2025-03-03 19:46:13.506222,0 days 00:00:00.313006,gaussian_mixture,abundance,2.45,2,COMPLETE
3999,0.6470554677666364,2025-03-03 19:46:13.507224,2025-03-03 19:46:13.846356,0 days 00:00:00.339132,gaussian_mixture,abundance,2.35,2,COMPLETE
4000,0.4213752867371234,2025-03-03 19:46:13.848359,2025-03-03 19:46:14.163641,0 days 00:00:00.315282,gaussian_mixture,abundance,2.3000000000000003,2,COMPLETE
4001,0.48686330225018937,2025-03-03 19:46:14.165636,2025-03-03 19:46:14.477976,0 days 00:00:00.312340,gaussian_mixture,abundance,2.45,2,COMPLETE
4002,0.5183839586153115,2025-03-03 19:46:14.479983,2025-03-03 19:46:14.804643,0 days 00:00:00.324660,gaussian_mixture,abundance,2.35,3,COMPLETE
4003,0.24094596072447994,2025-03-03 19:46:14.806632,2025-03-03 19:46:15.119984,0 days 00:00:00.313352,gaussian_mixture,abundance,2.4000000000000004,2,COMPLETE
4004,0.6470554677666364,2025-03-03 19:46:15.121973,2025-03-03 19:46:15.451099,0 days 00:00:00.329126,gaussian_mixture,abundance,2.4000000000000004,2,COMPLETE
4005,0.23943556990063192,2025-03-03 19:46:15.453099,2025-03-03 19:46:15.770195,0 days 00:00:00.317096,gaussian_mixture,abundance,2.3000000000000003,2,COMPLETE
4006,0.4372601245450431,2025-03-03 19:46:15.772197,2025-03-03 19:46:16.104845,0 days 00:00:00.332648,gaussian_mixture,abundance,2.5,2,COMPLETE
4007,0.44239378246955885,2025-03-03 19:46:16.106849,2025-03-03 19:46:16.419756,0 days 00:00:00.312907,gaussian_mixture,abundance,2.35,2,COMPLETE
4008,0.544069076878206,2025-03-03 19:46:16.420759,2025-03-03 19:46:16.755109,0 days 00:00:00.334350,gaussian_mixture,abundance,1.85,2,COMPLETE
4009,0.08266212278163787,2025-03-03 19:46:16.757109,2025-03-03 19:46:18.024006,0 days 00:00:01.266897,gaussian_mixture,presence,115.0,2,COMPLETE
4010,0.4967439171560395,2025-03-03 19:46:18.026022,2025-03-03 19:46:18.349022,0 days 00:00:00.323000,gaussian_mixture,abundance,2.3000000000000003,2,COMPLETE
4011,0.4464534200550075,2025-03-03 19:46:18.351026,2025-03-03 19:46:18.660387,0 days 00:00:00.309361,gaussian_mixture,abundance,2.3000000000000003,2,COMPLETE
4012,0.3130606017320043,2025-03-03 19:46:18.663383,2025-03-03 19:46:18.976479,0 days 00:00:00.313096,gaussian_mixture,abundance,2.4000000000000004,2,COMPLETE
4013,0.5368546577361399,2025-03-03 19:46:18.979493,2025-03-03 19:46:19.293235,0 days 00:00:00.313742,gaussian_mixture,abundance,1.9000000000000001,2,COMPLETE
4014,0.3661813181396209,2025-03-03 19:46:19.295224,2025-03-03 19:46:19.619555,0 days 00:00:00.324331,kmeans,abundance,2.3000000000000003,2,COMPLETE
4015,0.4213752867371234,2025-03-03 19:46:19.621545,2025-03-03 19:46:19.939643,0 days 00:00:00.318098,gaussian_mixture,abundance,1.7000000000000002,2,COMPLETE
4016,0.4478607144958143,2025-03-03 19:46:19.941644,2025-03-03 19:46:20.403628,0 days 00:00:00.461984,gaussian_mixture,abundance,2.45,2,COMPLETE
4017,0.48960037004154994,2025-03-03 19:46:20.406627,2025-03-03 19:46:20.805222,0 days 00:00:00.398595,gaussian_mixture,abundance,2.35,5,COMPLETE
4018,0.6353749482218015,2025-03-03 19:46:20.807222,2025-03-03 19:46:21.117357,0 days 00:00:00.310135,gaussian_mixture,abundance,2.25,2,COMPLETE
4019,0.4733644429300047,2025-03-03 19:46:21.119381,2025-03-03 19:46:21.412087,0 days 00:00:00.292706,gaussian_mixture,abundance,2.5,2,COMPLETE
4020,0.7159106958287792,2025-03-03 19:46:21.414079,2025-03-03 19:46:21.716287,0 days 00:00:00.302208,gaussian_mixture,abundance,2.3000000000000003,2,COMPLETE
4021,0.4103437263152644,2025-03-03 19:46:21.717791,2025-03-03 19:46:22.011535,0 days 00:00:00.293744,gaussian_mixture,abundance,2.4000000000000004,2,COMPLETE
4022,0.4684821343154071,2025-03-03 19:46:22.013526,2025-03-03 19:46:22.310979,0 days 00:00:00.297453,gaussian_mixture,abundance,2.25,2,COMPLETE
4023,0.41233154925390414,2025-03-03 19:46:22.313988,2025-03-03 19:46:22.635349,0 days 00:00:00.321361,gaussian_mixture,abundance,2.45,2,COMPLETE
4024,0.5035509993616116,2025-03-03 19:46:22.637343,2025-03-03 19:46:22.950941,0 days 00:00:00.313598,gaussian_mixture,abundance,2.35,4,COMPLETE
4025,0.49381074468043556,2025-03-03 19:46:22.952944,2025-03-03 19:46:23.263553,0 days 00:00:00.310609,gaussian_mixture,abundance,1.4000000000000001,2,COMPLETE
4026,0.3220592618787829,2025-03-03 19:46:23.266555,2025-03-03 19:46:23.560818,0 days 00:00:00.294263,gaussian_mixture,abundance,2.3000000000000003,2,COMPLETE
4027,0.01516757603646771,2025-03-03 19:46:23.563817,2025-03-03 19:46:24.991424,0 days 00:00:01.427607,gaussian_mixture,presence,10.0,2,COMPLETE
4028,0.42631077167227344,2025-03-03 19:46:24.993419,2025-03-03 19:46:25.297204,0 days 00:00:00.303785,gaussian_mixture,abundance,1.25,2,COMPLETE
4029,0.42068411487954516,2025-03-03 19:46:25.299212,2025-03-03 19:46:25.600688,0 days 00:00:00.301476,gaussian_mixture,abundance,2.4000000000000004,6,COMPLETE
4030,0.5760464242613541,2025-03-03 19:46:25.602491,2025-03-03 19:46:25.916445,0 days 00:00:00.313954,gaussian_mixture,abundance,2.25,2,COMPLETE
4031,0.6813437749850368,2025-03-03 19:46:25.918435,2025-03-03 19:46:26.222379,0 days 00:00:00.303944,gaussian_mixture,abundance,1.8,2,COMPLETE
4032,0.4372962346867985,2025-03-03 19:46:26.225714,2025-03-03 19:46:26.517633,0 days 00:00:00.291919,gaussian_mixture,abundance,2.4000000000000004,2,COMPLETE
4033,0.3272498794771096,2025-03-03 19:46:26.519627,2025-03-03 19:46:26.816816,0 days 00:00:00.297189,kmeans,abundance,2.35,2,COMPLETE
4034,0.3797585996292332,2025-03-03 19:46:26.818814,2025-03-03 19:46:27.112494,0 days 00:00:00.293680,gaussian_mixture,abundance,2.5500000000000003,2,COMPLETE
4035,0.38997879780558053,2025-03-03 19:46:27.114691,2025-03-03 19:46:27.406933,0 days 00:00:00.292242,gaussian_mixture,abundance,2.25,2,COMPLETE
4036,0.3367828349160945,2025-03-03 19:46:27.408930,2025-03-03 19:46:27.704928,0 days 00:00:00.295998,gaussian_mixture,abundance,2.25,2,COMPLETE
4037,0.398889236782871,2025-03-03 19:46:27.706926,2025-03-03 19:46:27.994906,0 days 00:00:00.287980,gaussian_mixture,abundance,2.45,2,COMPLETE
4038,0.5439529468481749,2025-03-03 19:46:27.996913,2025-03-03 19:46:28.290075,0 days 00:00:00.293162,gaussian_mixture,abundance,2.3000000000000003,2,COMPLETE
4039,0.6797217905443015,2025-03-03 19:46:28.291072,2025-03-03 19:46:28.593150,0 days 00:00:00.302078,gaussian_mixture,abundance,2.25,2,COMPLETE
4040,0.30129929548821127,2025-03-03 19:46:28.595460,2025-03-03 19:46:28.945777,0 days 00:00:00.350317,gaussian_mixture,abundance,2.35,2,COMPLETE
4041,0.42048221158113064,2025-03-03 19:46:28.949757,2025-03-03 19:46:29.269760,0 days 00:00:00.320003,gaussian_mixture,abundance,2.6,2,COMPLETE
4042,0.5081542505241554,2025-03-03 19:46:29.271757,2025-03-03 19:46:29.588532,0 days 00:00:00.316775,gaussian_mixture,abundance,2.35,2,COMPLETE
4043,0.6872212765482711,2025-03-03 19:46:29.590530,2025-03-03 19:46:29.890483,0 days 00:00:00.299953,gaussian_mixture,abundance,2.5,2,COMPLETE
4044,0.43537494822180156,2025-03-03 19:46:29.892480,2025-03-03 19:46:30.186177,0 days 00:00:00.293697,gaussian_mixture,abundance,2.4000000000000004,2,COMPLETE
4045,0.5471353194973152,2025-03-03 19:46:30.188174,2025-03-03 19:46:30.482745,0 days 00:00:00.294571,gaussian_mixture,abundance,2.3000000000000003,2,COMPLETE
4046,0.01722921577154419,2025-03-03 19:46:30.485743,2025-03-03 19:46:31.966428,0 days 00:00:01.480685,gaussian_mixture,presence,10.0,2,COMPLETE
4047,0.5367066409262276,2025-03-03 19:46:31.968428,2025-03-03 19:46:32.263643,0 days 00:00:00.295215,gaussian_mixture,abundance,2.45,2,COMPLETE
4048,0.3241390735652102,2025-03-03 19:46:32.265637,2025-03-03 19:46:32.560084,0 days 00:00:00.294447,gaussian_mixture,abundance,1.9000000000000001,2,COMPLETE
4049,0.40066173708177066,2025-03-03 19:46:32.562075,2025-03-03 19:46:32.863215,0 days 00:00:00.301140,gaussian_mixture,abundance,1.9500000000000002,2,COMPLETE
4050,0.66697230595956,2025-03-03 19:46:32.866214,2025-03-03 19:46:33.176632,0 days 00:00:00.310418,gaussian_mixture,abundance,2.25,2,COMPLETE
4051,0.6071264680960488,2025-03-03 19:46:33.178629,2025-03-03 19:46:33.476405,0 days 00:00:00.297776,gaussian_mixture,abundance,2.35,2,COMPLETE
4052,0.6901865156665743,2025-03-03 19:46:33.478412,2025-03-03 19:46:33.806532,0 days 00:00:00.328120,gaussian_mixture,abundance,2.4000000000000004,2,COMPLETE
4053,0.4617003182680891,2025-03-03 19:46:33.809295,2025-03-03 19:46:34.109728,0 days 00:00:00.300433,kmeans,abundance,2.25,2,COMPLETE
4054,0.40416665438776533,2025-03-03 19:46:34.111719,2025-03-03 19:46:34.409072,0 days 00:00:00.297353,gaussian_mixture,abundance,2.3000000000000003,2,COMPLETE
4055,0.5184334176956427,2025-03-03 19:46:34.410878,2025-03-03 19:46:34.718742,0 days 00:00:00.307864,gaussian_mixture,abundance,2.45,2,COMPLETE
4056,0.6855404779833385,2025-03-03 19:46:34.720765,2025-03-03 19:46:35.013585,0 days 00:00:00.292820,gaussian_mixture,abundance,2.35,2,COMPLETE
4057,0.6264936708020251,2025-03-03 19:46:35.016584,2025-03-03 19:46:35.333298,0 days 00:00:00.316714,gaussian_mixture,abundance,1.05,2,COMPLETE
4058,0.566998954031531,2025-03-03 19:46:35.334294,2025-03-03 19:46:35.633106,0 days 00:00:00.298812,gaussian_mixture,abundance,2.25,2,COMPLETE
4059,0.42551282002615665,2025-03-03 19:46:35.635105,2025-03-03 19:46:35.926369,0 days 00:00:00.291264,gaussian_mixture,abundance,2.3000000000000003,2,COMPLETE
4060,0.2715798631418008,2025-03-03 19:46:35.928367,2025-03-03 19:46:36.222757,0 days 00:00:00.294390,gaussian_mixture,abundance,2.5500000000000003,2,COMPLETE
4061,0.19588330309856652,2025-03-03 19:46:36.224757,2025-03-03 19:46:36.530348,0 days 00:00:00.305591,gaussian_mixture,abundance,1.9500000000000002,2,COMPLETE
4062,0.49236161810242385,2025-03-03 19:46:36.532348,2025-03-03 19:46:36.840719,0 days 00:00:00.308371,gaussian_mixture,abundance,2.35,2,COMPLETE
4063,0.549474530339438,2025-03-03 19:46:36.842718,2025-03-03 19:46:37.155442,0 days 00:00:00.312724,gaussian_mixture,abundance,2.2,2,COMPLETE
4064,0.5159647966815244,2025-03-03 19:46:37.157445,2025-03-03 19:46:37.580682,0 days 00:00:00.423237,gaussian_mixture,abundance,2.4000000000000004,3,COMPLETE
4065,0.06534031908365334,2025-03-03 19:46:37.582673,2025-03-03 19:46:39.037768,0 days 00:00:01.455095,gaussian_mixture,presence,25.0,2,COMPLETE
4066,0.2853086256895672,2025-03-03 19:46:39.039762,2025-03-03 19:46:39.342516,0 days 00:00:00.302754,gaussian_mixture,abundance,2.25,2,COMPLETE
4067,0.45767977356902223,2025-03-03 19:46:39.344857,2025-03-03 19:46:39.652118,0 days 00:00:00.307261,gaussian_mixture,abundance,2.5,2,COMPLETE
4068,0.29707534664905033,2025-03-03 19:46:39.654110,2025-03-03 19:46:39.947414,0 days 00:00:00.293304,gaussian_mixture,abundance,2.45,2,COMPLETE
4069,0.548212812527261,2025-03-03 19:46:39.949407,2025-03-03 19:46:40.246055,0 days 00:00:00.296648,gaussian_mixture,abundance,2.3000000000000003,2,COMPLETE
4070,0.37641801254479457,2025-03-03 19:46:40.248043,2025-03-03 19:46:40.567129,0 days 00:00:00.319086,gaussian_mixture,abundance,2.2,2,COMPLETE
4071,0.38117682306592676,2025-03-03 19:46:40.569117,2025-03-03 19:46:40.861031,0 days 00:00:00.291914,kmeans,abundance,2.4000000000000004,2,COMPLETE
4072,0.6083874589527312,2025-03-03 19:46:40.863033,2025-03-03 19:46:41.169056,0 days 00:00:00.306023,gaussian_mixture,abundance,2.35,2,COMPLETE
4073,0.4190582636458367,2025-03-03 19:46:41.171049,2025-03-03 19:46:41.468193,0 days 00:00:00.297144,gaussian_mixture,abundance,2.25,2,COMPLETE
4074,0.3682126908430513,2025-03-03 19:46:41.470193,2025-03-03 19:46:41.777430,0 days 00:00:00.307237,gaussian_mixture,abundance,1.85,2,COMPLETE
4075,0.5159106958287791,2025-03-03 19:46:41.780422,2025-03-03 19:46:42.067702,0 days 00:00:00.287280,gaussian_mixture,abundance,2.5,2,COMPLETE
4076,0.5239495755107837,2025-03-03 19:46:42.069508,2025-03-03 19:46:42.364660,0 days 00:00:00.295152,gaussian_mixture,abundance,2.3000000000000003,2,COMPLETE
4077,0.2612630438798961,2025-03-03 19:46:42.366682,2025-03-03 19:46:42.684462,0 days 00:00:00.317780,gaussian_mixture,abundance,2.35,2,COMPLETE
4078,0.5327236389549768,2025-03-03 19:46:42.686725,2025-03-03 19:46:42.982057,0 days 00:00:00.295332,gaussian_mixture,abundance,2.2,2,COMPLETE
4079,0.48268629148790393,2025-03-03 19:46:42.984111,2025-03-03 19:46:43.291068,0 days 00:00:00.306957,gaussian_mixture,abundance,1.4500000000000002,2,COMPLETE
4080,0.3823008020102641,2025-03-03 19:46:43.293056,2025-03-03 19:46:43.593990,0 days 00:00:00.300934,gaussian_mixture,abundance,2.25,2,COMPLETE
4081,0.559054970604782,2025-03-03 19:46:43.595192,2025-03-03 19:46:43.908151,0 days 00:00:00.312959,gaussian_mixture,abundance,2.45,2,COMPLETE
4082,0.46771446834906866,2025-03-03 19:46:43.910146,2025-03-03 19:46:44.207274,0 days 00:00:00.297128,gaussian_mixture,abundance,2.4000000000000004,2,COMPLETE
4083,0.013866422023235426,2025-03-03 19:46:44.209263,2025-03-03 19:46:45.652779,0 days 00:00:01.443516,gaussian_mixture,presence,10.0,2,COMPLETE
4084,0.5272167700333867,2025-03-03 19:46:45.654935,2025-03-03 19:46:45.958006,0 days 00:00:00.303071,gaussian_mixture,abundance,2.2,2,COMPLETE
4085,0.3578358805019386,2025-03-03 19:46:45.960188,2025-03-03 19:46:46.266755,0 days 00:00:00.306567,gaussian_mixture,abundance,2.3000000000000003,2,COMPLETE
4086,0.6161790655005184,2025-03-03 19:46:46.268744,2025-03-03 19:46:46.592946,0 days 00:00:00.324202,gaussian_mixture,abundance,2.4000000000000004,3,COMPLETE
4087,0.4417494737786679,2025-03-03 19:46:46.596068,2025-03-03 19:46:46.904348,0 days 00:00:00.308280,gaussian_mixture,abundance,2.3000000000000003,2,COMPLETE
4088,0.46723602427028854,2025-03-03 19:46:46.906344,2025-03-03 19:46:47.239168,0 days 00:00:00.332824,gaussian_mixture,abundance,2.5500000000000003,2,COMPLETE
4089,0.5122206825740182,2025-03-03 19:46:47.242157,2025-03-03 19:46:47.551615,0 days 00:00:00.309458,kmeans,abundance,2.2,2,COMPLETE
4090,0.5773926963324868,2025-03-03 19:46:47.553624,2025-03-03 19:46:47.888995,0 days 00:00:00.335371,gaussian_mixture,abundance,2.35,2,COMPLETE
4091,0.35235098134248866,2025-03-03 19:46:47.891993,2025-03-03 19:46:48.273616,0 days 00:00:00.381623,gaussian_mixture,abundance,2.25,2,COMPLETE
4092,0.6114569095030655,2025-03-03 19:46:48.275612,2025-03-03 19:46:48.622101,0 days 00:00:00.346489,gaussian_mixture,abundance,2.45,2,COMPLETE
4093,0.44762010876080904,2025-03-03 19:46:48.625097,2025-03-03 19:46:49.134659,0 days 00:00:00.509562,gaussian_mixture,abundance,2.0,2,COMPLETE
4094,0.5572914803704143,2025-03-03 19:46:49.136655,2025-03-03 19:46:49.518940,0 days 00:00:00.382285,gaussian_mixture,abundance,2.25,2,COMPLETE
4095,0.5089802500042151,2025-03-03 19:46:49.519936,2025-03-03 19:46:49.822903,0 days 00:00:00.302967,gaussian_mixture,abundance,1.9500000000000002,2,COMPLETE
4096,0.5894731525969503,2025-03-03 19:46:49.823921,2025-03-03 19:46:50.135942,0 days 00:00:00.312021,gaussian_mixture,abundance,2.35,2,COMPLETE
4097,0.15805238826457305,2025-03-03 19:46:50.137940,2025-03-03 19:46:50.534330,0 days 00:00:00.396390,gaussian_mixture,abundance,0.2,2,COMPLETE
4098,0.4871344172371366,2025-03-03 19:46:50.536335,2025-03-03 19:46:50.841738,0 days 00:00:00.305403,gaussian_mixture,abundance,2.2,2,COMPLETE
4099,0.5724975772143264,2025-03-03 19:46:50.843757,2025-03-03 19:46:51.203671,0 days 00:00:00.359914,gaussian_mixture,abundance,2.3000000000000003,2,COMPLETE
4100,0.4073454247198603,2025-03-03 19:46:51.205670,2025-03-03 19:46:51.589820,0 days 00:00:00.384150,gaussian_mixture,abundance,2.45,2,COMPLETE
4101,0.27248939739391087,2025-03-03 19:46:51.591826,2025-03-03 19:46:51.933868,0 days 00:00:00.342042,gaussian_mixture,abundance,1.5,2,COMPLETE
4102,0.05820866376609557,2025-03-03 19:46:51.934869,2025-03-03 19:46:53.528091,0 days 00:00:01.593222,gaussian_mixture,presence,55.0,2,COMPLETE
4103,0.5149619643555142,2025-03-03 19:46:53.531609,2025-03-03 19:46:53.863026,0 days 00:00:00.331417,gaussian_mixture,abundance,2.4000000000000004,2,COMPLETE
4104,0.5446817271311974,2025-03-03 19:46:53.866024,2025-03-03 19:46:54.210831,0 days 00:00:00.344807,gaussian_mixture,abundance,1.9000000000000001,2,COMPLETE
4105,0.15418372938324465,2025-03-03 19:46:54.214379,2025-03-03 19:46:54.963674,0 days 00:00:00.749295,gaussian_mixture,abundance,0.05,2,COMPLETE
4106,0.5796796500920715,2025-03-03 19:46:54.966672,2025-03-03 19:46:55.268655,0 days 00:00:00.301983,gaussian_mixture,abundance,2.35,2,COMPLETE
4107,0.5219805734745343,2025-03-03 19:46:55.270877,2025-03-03 19:46:55.580725,0 days 00:00:00.309848,gaussian_mixture,abundance,2.3000000000000003,4,COMPLETE
4108,0.2782303396703452,2025-03-03 19:46:55.582885,2025-03-03 19:46:55.874723,0 days 00:00:00.291838,kmeans,abundance,2.2,2,COMPLETE
4109,0.5336381863884466,2025-03-03 19:46:55.876728,2025-03-03 19:46:56.201258,0 days 00:00:00.324530,gaussian_mixture,abundance,1.75,5,COMPLETE
4110,0.4354374862851424,2025-03-03 19:46:56.203814,2025-03-03 19:46:56.506349,0 days 00:00:00.302535,gaussian_mixture,abundance,2.5,2,COMPLETE
4111,0.43081733778024234,2025-03-03 19:46:56.508343,2025-03-03 19:46:56.843908,0 days 00:00:00.335565,gaussian_mixture,abundance,2.4000000000000004,2,COMPLETE
4112,0.6709045919723063,2025-03-03 19:46:56.846909,2025-03-03 19:46:57.152942,0 days 00:00:00.306033,gaussian_mixture,abundance,2.2,2,COMPLETE
4113,0.5110019168653974,2025-03-03 19:46:57.153935,2025-03-03 19:46:57.493622,0 days 00:00:00.339687,gaussian_mixture,abundance,2.25,2,COMPLETE
4114,0.5758230681170986,2025-03-03 19:46:57.496609,2025-03-03 19:46:57.837488,0 days 00:00:00.340879,gaussian_mixture,abundance,2.0500000000000003,2,COMPLETE
4115,0.6012745086423565,2025-03-03 19:46:57.839486,2025-03-03 19:46:58.230840,0 days 00:00:00.391354,gaussian_mixture,abundance,2.35,2,COMPLETE
4116,0.6307387831906717,2025-03-03 19:46:58.232898,2025-03-03 19:46:58.551557,0 days 00:00:00.318659,gaussian_mixture,abundance,2.25,2,COMPLETE
4117,0.6509159960668365,2025-03-03 19:46:58.553582,2025-03-03 19:46:58.858858,0 days 00:00:00.305276,gaussian_mixture,abundance,2.15,2,COMPLETE
4118,0.47856062497521723,2025-03-03 19:46:58.860937,2025-03-03 19:46:59.178890,0 days 00:00:00.317953,gaussian_mixture,abundance,2.4000000000000004,2,COMPLETE
4119,0.23311823108446833,2025-03-03 19:46:59.181956,2025-03-03 19:46:59.483790,0 days 00:00:00.301834,gaussian_mixture,abundance,2.0,2,COMPLETE
4120,0.5147341805236557,2025-03-03 19:46:59.485778,2025-03-03 19:46:59.787028,0 days 00:00:00.301250,gaussian_mixture,abundance,2.45,2,COMPLETE
4121,-0.00778686065442946,2025-03-03 19:46:59.789025,2025-03-03 19:47:01.229204,0 days 00:00:01.440179,gaussian_mixture,presence,10.0,2,COMPLETE
4122,0.36116233678231807,2025-03-03 19:47:01.230716,2025-03-03 19:47:01.533175,0 days 00:00:00.302459,gaussian_mixture,abundance,2.3000000000000003,2,COMPLETE
4123,0.48554047798333855,2025-03-03 19:47:01.535197,2025-03-03 19:47:01.835006,0 days 00:00:00.299809,gaussian_mixture,abundance,2.35,2,COMPLETE
4124,0.5059476514216298,2025-03-03 19:47:01.837008,2025-03-03 19:47:02.146754,0 days 00:00:00.309746,gaussian_mixture,abundance,2.15,2,COMPLETE
4125,0.41158570039941156,2025-03-03 19:47:02.148746,2025-03-03 19:47:02.462239,0 days 00:00:00.313493,gaussian_mixture,abundance,2.3000000000000003,6,COMPLETE
4126,0.5313124584815337,2025-03-03 19:47:02.464262,2025-03-03 19:47:02.768252,0 days 00:00:00.303990,gaussian_mixture,abundance,2.2,2,COMPLETE
4127,0.4089632522409155,2025-03-03 19:47:02.770779,2025-03-03 19:47:03.104885,0 days 00:00:00.334106,gaussian_mixture,abundance,1.8,2,COMPLETE
4128,0.48057016688351306,2025-03-03 19:47:03.107168,2025-03-03 19:47:03.419897,0 days 00:00:00.312729,kmeans,abundance,2.4000000000000004,2,COMPLETE
4129,0.4670788057622097,2025-03-03 19:47:03.421947,2025-03-03 19:47:03.728654,0 days 00:00:00.306707,gaussian_mixture,abundance,2.25,2,COMPLETE
4130,0.26332207076671377,2025-03-03 19:47:03.730645,2025-03-03 19:47:04.032816,0 days 00:00:00.302171,gaussian_mixture,abundance,2.5,2,COMPLETE
4131,0.6435823489002006,2025-03-03 19:47:04.034838,2025-03-03 19:47:04.337092,0 days 00:00:00.302254,gaussian_mixture,abundance,2.15,2,COMPLETE
4132,0.49278485883510603,2025-03-03 19:47:04.339098,2025-03-03 19:47:04.642809,0 days 00:00:00.303711,gaussian_mixture,abundance,2.3000000000000003,2,COMPLETE
4133,0.34036801385970583,2025-03-03 19:47:04.644700,2025-03-03 19:47:04.949396,0 days 00:00:00.304696,gaussian_mixture,abundance,2.6,2,COMPLETE
4134,0.65520125190142,2025-03-03 19:47:04.951942,2025-03-03 19:47:05.255801,0 days 00:00:00.303859,gaussian_mixture,abundance,2.1,2,COMPLETE
