number,value,datetime_start,datetime_complete,duration,params_algorithm,params_filter_criteria,params_filter_threshold,params_k,state
1333,0.5948596584458474,2025-03-03 19:31:52.542341,2025-03-03 19:31:52.748427,0 days 00:00:00.206086,gaussian_mixture,abundance,2.4000000000000004,2,COMPLETE
1334,0.5171740049356446,2025-03-03 19:31:52.749426,2025-03-03 19:31:52.957511,0 days 00:00:00.208085,gaussian_mixture,abundance,2.45,2,COMPLETE
1335,0.5419046807520711,2025-03-03 19:31:52.958518,2025-03-03 19:31:53.170431,0 days 00:00:00.211913,gaussian_mixture,abundance,2.35,2,COMPLETE
1336,0.3893384142672917,2025-03-03 19:31:53.172423,2025-03-03 19:31:53.384842,0 days 00:00:00.212419,gaussian_mixture,abundance,2.4000000000000004,4,COMPLETE
1337,0.4425366690065375,2025-03-03 19:31:53.386832,2025-03-03 19:31:53.595372,0 days 00:00:00.208540,gaussian_mixture,abundance,2.45,2,COMPLETE
1338,0.033267974283605166,2025-03-03 19:31:53.596379,2025-03-03 19:31:55.021078,0 days 00:00:01.424699,gaussian_mixture,presence,10.0,2,COMPLETE
1339,0.6101409063559491,2025-03-03 19:31:55.023076,2025-03-03 19:31:55.237471,0 days 00:00:00.214395,gaussian_mixture,abundance,2.35,2,COMPLETE
1340,0.6466043597453954,2025-03-03 19:31:55.238468,2025-03-03 19:31:55.464991,0 days 00:00:00.226523,gaussian_mixture,abundance,2.4000000000000004,2,COMPLETE
1341,0.4619651922178763,2025-03-03 19:31:55.466986,2025-03-03 19:31:55.721220,0 days 00:00:00.254234,gaussian_mixture,abundance,2.35,2,COMPLETE
1342,0.21329043262481476,2025-03-03 19:31:55.723217,2025-03-03 19:31:55.946624,0 days 00:00:00.223407,gaussian_mixture,abundance,2.45,2,COMPLETE
1343,0.6102723858787025,2025-03-03 19:31:55.947683,2025-03-03 19:31:56.161256,0 days 00:00:00.213573,gaussian_mixture,abundance,2.3000000000000003,2,COMPLETE
1344,0.6617034404556786,2025-03-03 19:31:56.162250,2025-03-03 19:31:56.371827,0 days 00:00:00.209577,gaussian_mixture,abundance,2.4000000000000004,2,COMPLETE
1345,0.4086887177301096,2025-03-03 19:31:56.372826,2025-03-03 19:31:56.571892,0 days 00:00:00.199066,kmeans,abundance,2.35,2,COMPLETE
1346,0.3559675303040438,2025-03-03 19:31:56.573891,2025-03-03 19:31:56.781984,0 days 00:00:00.208093,gaussian_mixture,abundance,2.3000000000000003,2,COMPLETE
1347,0.4580173336061404,2025-03-03 19:31:56.783981,2025-03-03 19:31:57.000212,0 days 00:00:00.216231,gaussian_mixture,abundance,1.75,2,COMPLETE
1348,0.3001551720216996,2025-03-03 19:31:57.001207,2025-03-03 19:31:57.203334,0 days 00:00:00.202127,gaussian_mixture,abundance,2.5,2,COMPLETE
1349,0.4159084262262921,2025-03-03 19:31:57.204343,2025-03-03 19:31:57.415159,0 days 00:00:00.210816,gaussian_mixture,abundance,2.2,2,COMPLETE
1350,0.2710703421295226,2025-03-03 19:31:57.417160,2025-03-03 19:31:57.619274,0 days 00:00:00.202114,gaussian_mixture,abundance,2.45,2,COMPLETE
1351,0.2980966359236217,2025-03-03 19:31:57.621274,2025-03-03 19:31:57.829339,0 days 00:00:00.208065,gaussian_mixture,abundance,2.25,2,COMPLETE
1352,0.33536542707922495,2025-03-03 19:31:57.831334,2025-03-03 19:31:58.037588,0 days 00:00:00.206254,gaussian_mixture,abundance,2.35,2,COMPLETE
1353,0.3206676202250818,2025-03-03 19:31:58.039587,2025-03-03 19:31:58.257488,0 days 00:00:00.217901,gaussian_mixture,abundance,2.3000000000000003,2,COMPLETE
1354,0.5948596584458474,2025-03-03 19:31:58.258484,2025-03-03 19:31:58.467817,0 days 00:00:00.209333,gaussian_mixture,abundance,2.2,2,COMPLETE
1355,0.4990909949583301,2025-03-03 19:31:58.469805,2025-03-03 19:31:58.682867,0 days 00:00:00.213062,gaussian_mixture,abundance,2.2,3,COMPLETE
1356,0.36288555082789065,2025-03-03 19:31:58.684867,2025-03-03 19:31:58.891965,0 days 00:00:00.207098,gaussian_mixture,abundance,2.4000000000000004,2,COMPLETE
1357,0.0195670409689803,2025-03-03 19:31:58.892958,2025-03-03 19:32:00.235343,0 days 00:00:01.342385,gaussian_mixture,presence,10.0,2,COMPLETE
1358,0.5514110389284689,2025-03-03 19:32:00.237644,2025-03-03 19:32:00.453516,0 days 00:00:00.215872,gaussian_mixture,abundance,2.25,2,COMPLETE
1359,0.3594044515991012,2025-03-03 19:32:00.454514,2025-03-03 19:32:00.664135,0 days 00:00:00.209621,gaussian_mixture,abundance,2.35,2,COMPLETE
1360,0.5732303425566337,2025-03-03 19:32:00.665939,2025-03-03 19:32:00.876269,0 days 00:00:00.210330,gaussian_mixture,abundance,2.3000000000000003,2,COMPLETE
1361,0.6079088753268549,2025-03-03 19:32:00.878252,2025-03-03 19:32:01.088654,0 days 00:00:00.210402,gaussian_mixture,abundance,2.45,2,COMPLETE
1362,0.4871638149695389,2025-03-03 19:32:01.089650,2025-03-03 19:32:01.300057,0 days 00:00:00.210407,gaussian_mixture,abundance,2.25,2,COMPLETE
1363,0.2907410078131314,2025-03-03 19:32:01.301790,2025-03-03 19:32:01.502405,0 days 00:00:00.200615,kmeans,abundance,2.2,2,COMPLETE
1364,0.28557755731916074,2025-03-03 19:32:01.503969,2025-03-03 19:32:01.709128,0 days 00:00:00.205159,gaussian_mixture,abundance,2.4000000000000004,2,COMPLETE
1365,0.5339724772178768,2025-03-03 19:32:01.710122,2025-03-03 19:32:01.920381,0 days 00:00:00.210259,gaussian_mixture,abundance,2.5,2,COMPLETE
1366,0.41972429109446896,2025-03-03 19:32:01.921379,2025-03-03 19:32:02.130655,0 days 00:00:00.209276,gaussian_mixture,abundance,2.35,2,COMPLETE
1367,0.2934219065224947,2025-03-03 19:32:02.131651,2025-03-03 19:32:02.349091,0 days 00:00:00.217440,gaussian_mixture,abundance,1.8,2,COMPLETE
1368,0.2843881696439987,2025-03-03 19:32:02.351082,2025-03-03 19:32:02.569640,0 days 00:00:00.218558,gaussian_mixture,abundance,2.2,2,COMPLETE
1369,0.3834452537590155,2025-03-03 19:32:02.571639,2025-03-03 19:32:02.790303,0 days 00:00:00.218664,gaussian_mixture,abundance,2.3000000000000003,5,COMPLETE
1370,0.4103437263152644,2025-03-03 19:32:02.792303,2025-03-03 19:32:03.001822,0 days 00:00:00.209519,gaussian_mixture,abundance,2.25,2,COMPLETE
1371,0.13195109798729338,2025-03-03 19:32:03.002815,2025-03-03 19:32:03.208924,0 days 00:00:00.206109,gaussian_mixture,abundance,2.2,2,COMPLETE
1372,0.5171740049356446,2025-03-03 19:32:03.210919,2025-03-03 19:32:03.425910,0 days 00:00:00.214991,gaussian_mixture,abundance,2.45,2,COMPLETE
1373,0.3173193815008853,2025-03-03 19:32:03.426914,2025-03-03 19:32:03.636922,0 days 00:00:00.210008,gaussian_mixture,abundance,2.3000000000000003,2,COMPLETE
1374,0.5515893898107824,2025-03-03 19:32:03.637724,2025-03-03 19:32:03.848061,0 days 00:00:00.210337,gaussian_mixture,abundance,2.4000000000000004,2,COMPLETE
1375,0.3449213602419753,2025-03-03 19:32:03.849054,2025-03-03 19:32:04.061276,0 days 00:00:00.212222,gaussian_mixture,abundance,2.1,2,COMPLETE
1376,0.014259081104212711,2025-03-03 19:32:04.062014,2025-03-03 19:32:05.387840,0 days 00:00:01.325826,gaussian_mixture,presence,10.0,2,COMPLETE
1377,0.31229314429537774,2025-03-03 19:32:05.389841,2025-03-03 19:32:05.600645,0 days 00:00:00.210804,gaussian_mixture,abundance,2.15,2,COMPLETE
1378,0.6468683857856048,2025-03-03 19:32:05.601637,2025-03-03 19:32:05.810767,0 days 00:00:00.209130,gaussian_mixture,abundance,2.35,2,COMPLETE
1379,0.6327949045113584,2025-03-03 19:32:05.811772,2025-03-03 19:32:06.020016,0 days 00:00:00.208244,gaussian_mixture,abundance,2.5,2,COMPLETE
1380,0.5093661831365355,2025-03-03 19:32:06.022020,2025-03-03 19:32:06.226104,0 days 00:00:00.204084,gaussian_mixture,abundance,2.25,2,COMPLETE
1381,0.5258198721301428,2025-03-03 19:32:06.228096,2025-03-03 19:32:06.434245,0 days 00:00:00.206149,gaussian_mixture,abundance,2.2,2,COMPLETE
1382,0.5106266016146737,2025-03-03 19:32:06.436237,2025-03-03 19:32:06.647146,0 days 00:00:00.210909,kmeans,abundance,2.4000000000000004,2,COMPLETE
1383,0.37537131710190347,2025-03-03 19:32:06.648810,2025-03-03 19:32:06.861206,0 days 00:00:00.212396,gaussian_mixture,abundance,2.3000000000000003,2,COMPLETE
1384,0.3520622858283707,2025-03-03 19:32:06.863206,2025-03-03 19:32:07.074323,0 days 00:00:00.211117,gaussian_mixture,abundance,2.15,2,COMPLETE
1385,0.5660572075958697,2025-03-03 19:32:07.075315,2025-03-03 19:32:07.295401,0 days 00:00:00.220086,gaussian_mixture,abundance,2.2,2,COMPLETE
1386,0.37647315441242146,2025-03-03 19:32:07.297401,2025-03-03 19:32:07.542536,0 days 00:00:00.245135,gaussian_mixture,abundance,2.1,2,COMPLETE
1387,0.5632261314935414,2025-03-03 19:32:07.544526,2025-03-03 19:32:07.753651,0 days 00:00:00.209125,gaussian_mixture,abundance,2.3000000000000003,2,COMPLETE
1388,0.5171740049356446,2025-03-03 19:32:07.755638,2025-03-03 19:32:07.963228,0 days 00:00:00.207590,gaussian_mixture,abundance,2.35,2,COMPLETE
1389,0.5022812682949738,2025-03-03 19:32:07.964224,2025-03-03 19:32:08.175327,0 days 00:00:00.211103,gaussian_mixture,abundance,2.0500000000000003,2,COMPLETE
1390,0.34772736182254915,2025-03-03 19:32:08.176326,2025-03-03 19:32:08.384643,0 days 00:00:00.208317,gaussian_mixture,abundance,2.25,2,COMPLETE
1391,0.585469212426957,2025-03-03 19:32:08.386445,2025-03-03 19:32:08.594206,0 days 00:00:00.207761,gaussian_mixture,abundance,2.5,2,COMPLETE
1392,0.6509159960668365,2025-03-03 19:32:08.595208,2025-03-03 19:32:08.814529,0 days 00:00:00.219321,gaussian_mixture,abundance,2.2,2,COMPLETE
1393,0.6920714425925455,2025-03-03 19:32:08.817032,2025-03-03 19:32:09.028714,0 days 00:00:00.211682,gaussian_mixture,abundance,2.4000000000000004,2,COMPLETE
1394,0.4627850057888712,2025-03-03 19:32:09.030715,2025-03-03 19:32:09.239118,0 days 00:00:00.208403,gaussian_mixture,abundance,2.15,2,COMPLETE
1395,0.5396575737691245,2025-03-03 19:32:09.241103,2025-03-03 19:32:09.448282,0 days 00:00:00.207179,gaussian_mixture,abundance,2.35,2,COMPLETE
1396,0.008063392488406193,2025-03-03 19:32:09.449284,2025-03-03 19:32:10.814404,0 days 00:00:01.365120,gaussian_mixture,presence,10.0,2,COMPLETE
1397,0.2446846075417337,2025-03-03 19:32:10.816398,2025-03-03 19:32:11.036141,0 days 00:00:00.219743,gaussian_mixture,abundance,2.45,2,COMPLETE
1398,0.33410276815947854,2025-03-03 19:32:11.038132,2025-03-03 19:32:11.248031,0 days 00:00:00.209899,gaussian_mixture,abundance,2.0500000000000003,2,COMPLETE
1399,0.47634440402857575,2025-03-03 19:32:11.249601,2025-03-03 19:32:11.457452,0 days 00:00:00.207851,gaussian_mixture,abundance,2.25,2,COMPLETE
1400,0.5220131587401605,2025-03-03 19:32:11.458445,2025-03-03 19:32:11.669721,0 days 00:00:00.211276,gaussian_mixture,abundance,2.3000000000000003,2,COMPLETE
1401,0.41473187915436044,2025-03-03 19:32:11.671720,2025-03-03 19:32:11.881918,0 days 00:00:00.210198,gaussian_mixture,abundance,2.2,2,COMPLETE
1402,0.5765342159809942,2025-03-03 19:32:11.883915,2025-03-03 19:32:12.087286,0 days 00:00:00.203371,kmeans,abundance,2.1,2,COMPLETE
1403,0.3126410150441245,2025-03-03 19:32:12.089276,2025-03-03 19:32:12.296403,0 days 00:00:00.207127,gaussian_mixture,abundance,2.0,2,COMPLETE
1404,0.407576781870826,2025-03-03 19:32:12.298399,2025-03-03 19:32:12.503865,0 days 00:00:00.205466,gaussian_mixture,abundance,2.45,2,COMPLETE
1405,0.5889432430326119,2025-03-03 19:32:12.504865,2025-03-03 19:32:12.723025,0 days 00:00:00.218160,gaussian_mixture,abundance,1.6500000000000001,2,COMPLETE
1406,0.4380174081535756,2025-03-03 19:32:12.725016,2025-03-03 19:32:12.934103,0 days 00:00:00.209087,gaussian_mixture,abundance,2.15,2,COMPLETE
1407,0.5523509813424887,2025-03-03 19:32:12.936097,2025-03-03 19:32:13.156486,0 days 00:00:00.220389,gaussian_mixture,abundance,2.35,2,COMPLETE
1408,0.4583613641195613,2025-03-03 19:32:13.158621,2025-03-03 19:32:13.367703,0 days 00:00:00.209082,gaussian_mixture,abundance,2.25,2,COMPLETE
1409,0.407831910131822,2025-03-03 19:32:13.368703,2025-03-03 19:32:13.577870,0 days 00:00:00.209167,gaussian_mixture,abundance,2.3000000000000003,2,COMPLETE
1410,0.3312520238755846,2025-03-03 19:32:13.578865,2025-03-03 19:32:13.786200,0 days 00:00:00.207335,gaussian_mixture,abundance,2.2,2,COMPLETE
1411,0.3603269510260924,2025-03-03 19:32:13.787202,2025-03-03 19:32:13.997309,0 days 00:00:00.210107,gaussian_mixture,abundance,2.5,3,COMPLETE
1412,0.3009127977936661,2025-03-03 19:32:13.999306,2025-03-03 19:32:14.216953,0 days 00:00:00.217647,gaussian_mixture,abundance,2.1,2,COMPLETE
1413,0.00551840122104021,2025-03-03 19:32:14.217948,2025-03-03 19:32:15.602946,0 days 00:00:01.384998,gaussian_mixture,presence,10.0,2,COMPLETE
1414,0.49168347370558996,2025-03-03 19:32:15.604943,2025-03-03 19:32:15.816546,0 days 00:00:00.211603,gaussian_mixture,abundance,2.25,4,COMPLETE
1415,0.7171740049356445,2025-03-03 19:32:15.817541,2025-03-03 19:32:16.031613,0 days 00:00:00.214072,gaussian_mixture,abundance,2.15,2,COMPLETE
1416,0.5335859795233315,2025-03-03 19:32:16.032613,2025-03-03 19:32:16.247606,0 days 00:00:00.214993,gaussian_mixture,abundance,2.0500000000000003,2,COMPLETE
1417,0.4781154150433656,2025-03-03 19:32:16.248599,2025-03-03 19:32:16.458404,0 days 00:00:00.209805,gaussian_mixture,abundance,2.1,2,COMPLETE
1418,0.23693865730027192,2025-03-03 19:32:16.460395,2025-03-03 19:32:16.668605,0 days 00:00:00.208210,gaussian_mixture,abundance,2.15,2,COMPLETE
1419,0.6423417392200099,2025-03-03 19:32:16.670410,2025-03-03 19:32:16.879316,0 days 00:00:00.208906,gaussian_mixture,abundance,2.15,2,COMPLETE
1420,0.4119243000218754,2025-03-03 19:32:16.880333,2025-03-03 19:32:17.093949,0 days 00:00:00.213616,kmeans,abundance,2.1,6,COMPLETE
1421,0.3223143464897972,2025-03-03 19:32:17.094943,2025-03-03 19:32:17.307075,0 days 00:00:00.212132,gaussian_mixture,abundance,2.0,2,COMPLETE
1422,0.35917970125591847,2025-03-03 19:32:17.309059,2025-03-03 19:32:17.536752,0 days 00:00:00.227693,gaussian_mixture,abundance,1.4000000000000001,2,COMPLETE
1423,0.3406704617976538,2025-03-03 19:32:17.538741,2025-03-03 19:32:17.749867,0 days 00:00:00.211126,gaussian_mixture,abundance,2.0500000000000003,2,COMPLETE
1424,0.5562115096426888,2025-03-03 19:32:17.750863,2025-03-03 19:32:17.967174,0 days 00:00:00.216311,gaussian_mixture,abundance,2.15,2,COMPLETE
1425,0.3925150677554808,2025-03-03 19:32:17.967174,2025-03-03 19:32:18.175038,0 days 00:00:00.207864,gaussian_mixture,abundance,2.2,2,COMPLETE
1426,0.45996585545183527,2025-03-03 19:32:18.177035,2025-03-03 19:32:18.419184,0 days 00:00:00.242149,gaussian_mixture,abundance,2.15,2,COMPLETE
1427,0.5949816553522199,2025-03-03 19:32:18.420184,2025-03-03 19:32:18.653530,0 days 00:00:00.233346,gaussian_mixture,abundance,2.1,2,COMPLETE
1428,0.47890996860687685,2025-03-03 19:32:18.655537,2025-03-03 19:32:18.865607,0 days 00:00:00.210070,gaussian_mixture,abundance,2.2,2,COMPLETE
1429,0.5892722791484248,2025-03-03 19:32:18.866607,2025-03-03 19:32:19.079160,0 days 00:00:00.212553,gaussian_mixture,abundance,2.2,2,COMPLETE
1430,0.47147827843531953,2025-03-03 19:32:19.081159,2025-03-03 19:32:19.290023,0 days 00:00:00.208864,gaussian_mixture,abundance,2.1,2,COMPLETE
1431,0.27682111417297817,2025-03-03 19:32:19.292020,2025-03-03 19:32:19.506948,0 days 00:00:00.214928,gaussian_mixture,abundance,2.0500000000000003,2,COMPLETE
1432,0.48554047798333855,2025-03-03 19:32:19.508620,2025-03-03 19:32:19.723000,0 days 00:00:00.214380,gaussian_mixture,abundance,2.25,2,COMPLETE
1433,0.2953078518241237,2025-03-03 19:32:19.724994,2025-03-03 19:32:19.932336,0 days 00:00:00.207342,gaussian_mixture,abundance,2.15,2,COMPLETE
1434,0.6073454247198603,2025-03-03 19:32:19.933333,2025-03-03 19:32:20.148026,0 days 00:00:00.214693,gaussian_mixture,abundance,2.25,2,COMPLETE
1435,0.03782647970098975,2025-03-03 19:32:20.149641,2025-03-03 19:32:21.356339,0 days 00:00:01.206698,gaussian_mixture,presence,70.0,2,COMPLETE
1436,0.35688214356516645,2025-03-03 19:32:21.358336,2025-03-03 19:32:21.565224,0 days 00:00:00.206888,gaussian_mixture,abundance,2.2,2,COMPLETE
1437,0.41008639515976764,2025-03-03 19:32:21.566218,2025-03-03 19:32:21.789173,0 days 00:00:00.222955,gaussian_mixture,abundance,2.15,2,COMPLETE
1438,0.34127901480821266,2025-03-03 19:32:21.789988,2025-03-03 19:32:22.008066,0 days 00:00:00.218078,gaussian_mixture,abundance,2.0,2,COMPLETE
1439,0.3345768937584601,2025-03-03 19:32:22.009067,2025-03-03 19:32:22.214037,0 days 00:00:00.204970,kmeans,abundance,2.25,2,COMPLETE
1440,0.3072086422783123,2025-03-03 19:32:22.215039,2025-03-03 19:32:22.427113,0 days 00:00:00.212074,gaussian_mixture,abundance,2.0500000000000003,2,COMPLETE
1441,0.5073115593672386,2025-03-03 19:32:22.428115,2025-03-03 19:32:22.644491,0 days 00:00:00.216376,gaussian_mixture,abundance,2.1,3,COMPLETE
1442,0.47984712006183416,2025-03-03 19:32:22.647477,2025-03-03 19:32:22.857860,0 days 00:00:00.210383,gaussian_mixture,abundance,2.2,2,COMPLETE
1443,0.5459672304884295,2025-03-03 19:32:22.858864,2025-03-03 19:32:23.070934,0 days 00:00:00.212070,gaussian_mixture,abundance,2.15,2,COMPLETE
1444,0.5176604903476064,2025-03-03 19:32:23.072918,2025-03-03 19:32:23.282133,0 days 00:00:00.209215,gaussian_mixture,abundance,2.25,2,COMPLETE
1445,0.49696812262473333,2025-03-03 19:32:23.284131,2025-03-03 19:32:23.497055,0 days 00:00:00.212924,gaussian_mixture,abundance,2.3000000000000003,2,COMPLETE
1446,0.4065724973718239,2025-03-03 19:32:23.498062,2025-03-03 19:32:23.706389,0 days 00:00:00.208327,gaussian_mixture,abundance,2.2,2,COMPLETE
1447,0.3606240794034411,2025-03-03 19:32:23.707389,2025-03-03 19:32:23.929104,0 days 00:00:00.221715,gaussian_mixture,abundance,2.3000000000000003,2,COMPLETE
1448,0.4430752083628507,2025-03-03 19:32:23.931101,2025-03-03 19:32:24.137050,0 days 00:00:00.205949,gaussian_mixture,abundance,2.15,2,COMPLETE
1449,0.36465436334116436,2025-03-03 19:32:24.139046,2025-03-03 19:32:24.347692,0 days 00:00:00.208646,gaussian_mixture,abundance,2.0,2,COMPLETE
1450,0.3568322893306861,2025-03-03 19:32:24.348697,2025-03-03 19:32:24.562918,0 days 00:00:00.214221,gaussian_mixture,abundance,1.8,2,COMPLETE
1451,0.5678077132172336,2025-03-03 19:32:24.564915,2025-03-03 19:32:24.777557,0 days 00:00:00.212642,gaussian_mixture,abundance,2.1,2,COMPLETE
1452,0.04530342204004649,2025-03-03 19:32:24.778553,2025-03-03 19:32:26.118896,0 days 00:00:01.340343,gaussian_mixture,presence,15.0,2,COMPLETE
1453,0.6595412340406492,2025-03-03 19:32:26.119890,2025-03-03 19:32:26.330677,0 days 00:00:00.210787,gaussian_mixture,abundance,2.25,2,COMPLETE
1454,0.47431412446932386,2025-03-03 19:32:26.332668,2025-03-03 19:32:26.541347,0 days 00:00:00.208679,gaussian_mixture,abundance,2.2,2,COMPLETE
1455,0.47875932530704457,2025-03-03 19:32:26.542352,2025-03-03 19:32:26.754417,0 days 00:00:00.212065,gaussian_mixture,abundance,2.2,2,COMPLETE
1456,0.4485714053764699,2025-03-03 19:32:26.756411,2025-03-03 19:32:26.971520,0 days 00:00:00.215109,gaussian_mixture,abundance,2.0500000000000003,2,COMPLETE
1457,0.12877920418945857,2025-03-03 19:32:26.973517,2025-03-03 19:32:27.178821,0 days 00:00:00.205304,gaussian_mixture,abundance,2.3000000000000003,2,COMPLETE
1458,0.41542194081433037,2025-03-03 19:32:27.180375,2025-03-03 19:32:27.389789,0 days 00:00:00.209414,gaussian_mixture,abundance,2.15,2,COMPLETE
1459,0.35542953247293646,2025-03-03 19:32:27.391789,2025-03-03 19:32:27.596922,0 days 00:00:00.205133,kmeans,abundance,2.25,5,COMPLETE
1460,0.47808694700731336,2025-03-03 19:32:27.597920,2025-03-03 19:32:27.810551,0 days 00:00:00.212631,gaussian_mixture,abundance,2.1,2,COMPLETE
1461,0.44680259286319624,2025-03-03 19:32:27.811545,2025-03-03 19:32:28.024938,0 days 00:00:00.213393,gaussian_mixture,abundance,2.2,2,COMPLETE
1462,0.48699483897019,2025-03-03 19:32:28.027930,2025-03-03 19:32:28.252370,0 days 00:00:00.224440,gaussian_mixture,abundance,1.7000000000000002,2,COMPLETE
1463,0.3124611222245283,2025-03-03 19:32:28.254365,2025-03-03 19:32:28.465447,0 days 00:00:00.211082,gaussian_mixture,abundance,2.3000000000000003,2,COMPLETE
1464,0.4079684098383051,2025-03-03 19:32:28.467456,2025-03-03 19:32:28.674589,0 days 00:00:00.207133,gaussian_mixture,abundance,2.15,2,COMPLETE
1465,0.5908097835200838,2025-03-03 19:32:28.676589,2025-03-03 19:32:28.886460,0 days 00:00:00.209871,gaussian_mixture,abundance,2.3000000000000003,2,COMPLETE
1466,0.4919420384254565,2025-03-03 19:32:28.887469,2025-03-03 19:32:29.101829,0 days 00:00:00.214360,gaussian_mixture,abundance,2.35,2,COMPLETE
1467,0.6031594355683281,2025-03-03 19:32:29.102820,2025-03-03 19:32:29.315489,0 days 00:00:00.212669,gaussian_mixture,abundance,2.0500000000000003,2,COMPLETE
1468,0.17481446107019322,2025-03-03 19:32:29.317480,2025-03-03 19:32:29.618205,0 days 00:00:00.300725,gaussian_mixture,abundance,0.2,2,COMPLETE
1469,0.5213600708355888,2025-03-03 19:32:29.620203,2025-03-03 19:32:29.850579,0 days 00:00:00.230376,gaussian_mixture,abundance,2.25,2,COMPLETE
1470,0.39021565993042456,2025-03-03 19:32:29.852372,2025-03-03 19:32:30.062437,0 days 00:00:00.210065,gaussian_mixture,abundance,2.15,2,COMPLETE
1471,0.04417130914295446,2025-03-03 19:32:30.063439,2025-03-03 19:32:31.274379,0 days 00:00:01.210940,gaussian_mixture,presence,85.0,2,COMPLETE
1472,0.5206607695490499,2025-03-03 19:32:31.276370,2025-03-03 19:32:31.492534,0 days 00:00:00.216164,gaussian_mixture,abundance,2.2,2,COMPLETE
1473,0.5233387821012988,2025-03-03 19:32:31.494531,2025-03-03 19:32:31.721636,0 days 00:00:00.227105,gaussian_mixture,abundance,2.35,2,COMPLETE
1474,0.5587976299814055,2025-03-03 19:32:31.723634,2025-03-03 19:32:31.934758,0 days 00:00:00.211124,gaussian_mixture,abundance,2.1,2,COMPLETE
1475,0.5171740049356446,2025-03-03 19:32:31.935752,2025-03-03 19:32:32.147908,0 days 00:00:00.212156,gaussian_mixture,abundance,2.3000000000000003,2,COMPLETE
1476,0.20879716071318036,2025-03-03 19:32:32.149899,2025-03-03 19:32:32.367980,0 days 00:00:00.218081,gaussian_mixture,abundance,2.25,2,COMPLETE
1477,0.25986755499521574,2025-03-03 19:32:32.369098,2025-03-03 19:32:32.586875,0 days 00:00:00.217777,kmeans,abundance,1.55,2,COMPLETE
1478,0.619342245895864,2025-03-03 19:32:32.587870,2025-03-03 19:32:32.802177,0 days 00:00:00.214307,gaussian_mixture,abundance,2.0,2,COMPLETE
1479,0.46208643371600217,2025-03-03 19:32:32.803188,2025-03-03 19:32:33.020429,0 days 00:00:00.217241,gaussian_mixture,abundance,2.2,4,COMPLETE
1480,0.2229004321895094,2025-03-03 19:32:33.022431,2025-03-03 19:32:33.235607,0 days 00:00:00.213176,gaussian_mixture,abundance,1.75,2,COMPLETE
