number,value,datetime_start,datetime_complete,duration,params_algorithm,params_filter_criteria,params_filter_threshold,params_k,state
4135,0.4489191190744316,2025-03-03 19:47:05.257818,2025-03-03 19:47:05.569283,0 days 00:00:00.311465,gaussian_mixture,abundance,1.9500000000000002,2,COMPLETE
4136,0.3962878902934703,2025-03-03 19:47:05.571822,2025-03-03 19:47:05.884258,0 days 00:00:00.312436,gaussian_mixture,abundance,2.2,2,COMPLETE
4137,0.3904954108935401,2025-03-03 19:47:05.886260,2025-03-03 19:47:06.209334,0 days 00:00:00.323074,gaussian_mixture,abundance,2.35,2,COMPLETE
4138,0.5406949023938363,2025-03-03 19:47:06.210851,2025-03-03 19:47:06.555932,0 days 00:00:00.345081,gaussian_mixture,abundance,2.25,4,COMPLETE
4139,0.013447115010777357,2025-03-03 19:47:06.557935,2025-03-03 19:47:08.081819,0 days 00:00:01.523884,gaussian_mixture,presence,10.0,2,COMPLETE
4140,0.31065363136534624,2025-03-03 19:47:08.084370,2025-03-03 19:47:08.392365,0 days 00:00:00.307995,gaussian_mixture,abundance,2.45,2,COMPLETE
4141,0.3968106825843204,2025-03-03 19:47:08.394694,2025-03-03 19:47:08.701644,0 days 00:00:00.306950,gaussian_mixture,abundance,2.35,2,COMPLETE
4142,0.5741116315460564,2025-03-03 19:47:08.703812,2025-03-03 19:47:09.013562,0 days 00:00:00.309750,gaussian_mixture,abundance,2.3000000000000003,2,COMPLETE
4143,0.6920714425925455,2025-03-03 19:47:09.015559,2025-03-03 19:47:09.322992,0 days 00:00:00.307433,gaussian_mixture,abundance,2.2,2,COMPLETE
4144,0.6958533872139856,2025-03-03 19:47:09.324515,2025-03-03 19:47:09.643495,0 days 00:00:00.318980,gaussian_mixture,abundance,2.0500000000000003,2,COMPLETE
4145,0.11202730387920179,2025-03-03 19:47:09.646744,2025-03-03 19:47:09.967737,0 days 00:00:00.320993,kmeans,abundance,0.45,2,COMPLETE
4146,0.5418466698792354,2025-03-03 19:47:09.970730,2025-03-03 19:47:10.283571,0 days 00:00:00.312841,gaussian_mixture,abundance,1.6500000000000001,2,COMPLETE
4147,0.37570997934711914,2025-03-03 19:47:10.285593,2025-03-03 19:47:10.587642,0 days 00:00:00.302049,gaussian_mixture,abundance,2.4000000000000004,2,COMPLETE
4148,0.26781433210160166,2025-03-03 19:47:10.589646,2025-03-03 19:47:10.893687,0 days 00:00:00.304041,gaussian_mixture,abundance,2.25,2,COMPLETE
4149,0.6997070428222841,2025-03-03 19:47:10.896679,2025-03-03 19:47:11.201522,0 days 00:00:00.304843,gaussian_mixture,abundance,2.5,2,COMPLETE
4150,0.1879819141037828,2025-03-03 19:47:11.203529,2025-03-03 19:47:11.502798,0 days 00:00:00.299269,gaussian_mixture,abundance,2.4000000000000004,2,COMPLETE
4151,0.6709045919723063,2025-03-03 19:47:11.504805,2025-03-03 19:47:11.821307,0 days 00:00:00.316502,gaussian_mixture,abundance,2.6500000000000004,2,COMPLETE
4152,0.5259456793492999,2025-03-03 19:47:11.822828,2025-03-03 19:47:12.136665,0 days 00:00:00.313837,gaussian_mixture,abundance,2.1,2,COMPLETE
4153,0.47395417005450147,2025-03-03 19:47:12.138664,2025-03-03 19:47:12.499346,0 days 00:00:00.360682,gaussian_mixture,abundance,2.3000000000000003,3,COMPLETE
4154,0.38309835220205435,2025-03-03 19:47:12.503933,2025-03-03 19:47:12.825765,0 days 00:00:00.321832,gaussian_mixture,abundance,2.5500000000000003,2,COMPLETE
4155,0.43775891132751366,2025-03-03 19:47:12.828767,2025-03-03 19:47:13.137638,0 days 00:00:00.308871,gaussian_mixture,abundance,2.2,2,COMPLETE
4156,0.6419563225919058,2025-03-03 19:47:13.141145,2025-03-03 19:47:13.453725,0 days 00:00:00.312580,gaussian_mixture,abundance,2.0500000000000003,2,COMPLETE
4157,0.47020244363432634,2025-03-03 19:47:13.456727,2025-03-03 19:47:13.758067,0 days 00:00:00.301340,gaussian_mixture,abundance,2.45,2,COMPLETE
4158,0.019228548061119156,2025-03-03 19:47:13.760070,2025-03-03 19:47:15.184885,0 days 00:00:01.424815,gaussian_mixture,presence,15.0,2,COMPLETE
4159,0.25396431364793226,2025-03-03 19:47:15.187884,2025-03-03 19:47:15.493196,0 days 00:00:00.305312,gaussian_mixture,abundance,2.15,2,COMPLETE
4160,0.34878817835521747,2025-03-03 19:47:15.495196,2025-03-03 19:47:15.794606,0 days 00:00:00.299410,gaussian_mixture,abundance,2.35,2,COMPLETE
4161,0.5276402776933484,2025-03-03 19:47:15.796611,2025-03-03 19:47:16.175185,0 days 00:00:00.378574,gaussian_mixture,abundance,2.0,2,COMPLETE
4162,0.5598945898954536,2025-03-03 19:47:16.176693,2025-03-03 19:47:16.501625,0 days 00:00:00.324932,gaussian_mixture,abundance,2.25,2,COMPLETE
4163,0.42656351598625564,2025-03-03 19:47:16.503633,2025-03-03 19:47:16.831598,0 days 00:00:00.327965,gaussian_mixture,abundance,2.15,2,COMPLETE
4164,0.46682993125396316,2025-03-03 19:47:16.833607,2025-03-03 19:47:17.133485,0 days 00:00:00.299878,kmeans,abundance,2.35,2,COMPLETE
4165,0.5103083964184869,2025-03-03 19:47:17.135488,2025-03-03 19:47:17.443276,0 days 00:00:00.307788,gaussian_mixture,abundance,2.3000000000000003,2,COMPLETE
4166,0.2968804168625227,2025-03-03 19:47:17.445301,2025-03-03 19:47:17.749802,0 days 00:00:00.304501,gaussian_mixture,abundance,2.1,2,COMPLETE
4167,0.4264947749874718,2025-03-03 19:47:17.751817,2025-03-03 19:47:18.059432,0 days 00:00:00.307615,gaussian_mixture,abundance,1.85,2,COMPLETE
4168,0.4708748525684053,2025-03-03 19:47:18.060940,2025-03-03 19:47:18.419550,0 days 00:00:00.358610,gaussian_mixture,abundance,2.5,2,COMPLETE
4169,0.34825445039242653,2025-03-03 19:47:18.421569,2025-03-03 19:47:18.730876,0 days 00:00:00.309307,gaussian_mixture,abundance,2.4000000000000004,2,COMPLETE
4170,0.3410874158510522,2025-03-03 19:47:18.733055,2025-03-03 19:47:19.039234,0 days 00:00:00.306179,gaussian_mixture,abundance,2.2,2,COMPLETE
4171,0.36305289513813455,2025-03-03 19:47:19.043282,2025-03-03 19:47:19.355685,0 days 00:00:00.312403,gaussian_mixture,abundance,2.45,2,COMPLETE
4172,0.6071264680960488,2025-03-03 19:47:19.357679,2025-03-03 19:47:19.672581,0 days 00:00:00.314902,gaussian_mixture,abundance,1.9000000000000001,2,COMPLETE
4173,0.6101409063559491,2025-03-03 19:47:19.674592,2025-03-03 19:47:19.981007,0 days 00:00:00.306415,gaussian_mixture,abundance,2.25,2,COMPLETE
4174,0.08608118630711058,2025-03-03 19:47:19.983532,2025-03-03 19:47:20.326764,0 days 00:00:00.343232,gaussian_mixture,abundance,2.25,2,COMPLETE
4175,0.40217593043837496,2025-03-03 19:47:20.331822,2025-03-03 19:47:20.672740,0 days 00:00:00.340918,gaussian_mixture,abundance,2.3000000000000003,2,COMPLETE
4176,0.6855404779833385,2025-03-03 19:47:20.675616,2025-03-03 19:47:21.011095,0 days 00:00:00.335479,gaussian_mixture,abundance,2.35,2,COMPLETE
4177,0.21701883291394494,2025-03-03 19:47:21.013755,2025-03-03 19:47:21.315713,0 days 00:00:00.301958,gaussian_mixture,abundance,2.4000000000000004,2,COMPLETE
4178,0.017977387916428566,2025-03-03 19:47:21.318713,2025-03-03 19:47:22.872515,0 days 00:00:01.553802,gaussian_mixture,presence,10.0,3,COMPLETE
4179,0.4028958025012477,2025-03-03 19:47:22.874525,2025-03-03 19:47:23.186357,0 days 00:00:00.311832,gaussian_mixture,abundance,2.2,2,COMPLETE
4180,0.5708849334855716,2025-03-03 19:47:23.188356,2025-03-03 19:47:23.535777,0 days 00:00:00.347421,gaussian_mixture,abundance,2.15,2,COMPLETE
4181,0.3932141418671894,2025-03-03 19:47:23.537780,2025-03-03 19:47:23.845757,0 days 00:00:00.307977,gaussian_mixture,abundance,2.0,2,COMPLETE
4182,0.3416585094549499,2025-03-03 19:47:23.848746,2025-03-03 19:47:24.163899,0 days 00:00:00.315153,gaussian_mixture,abundance,1.35,2,COMPLETE
4183,0.35970772332887735,2025-03-03 19:47:24.165899,2025-03-03 19:47:24.467716,0 days 00:00:00.301817,kmeans,abundance,2.3000000000000003,5,COMPLETE
4184,0.6120025131380913,2025-03-03 19:47:24.469716,2025-03-03 19:47:24.790870,0 days 00:00:00.321154,gaussian_mixture,abundance,2.1,2,COMPLETE
4185,0.5793463345587713,2025-03-03 19:47:24.793486,2025-03-03 19:47:25.102583,0 days 00:00:00.309097,gaussian_mixture,abundance,2.4000000000000004,2,COMPLETE
4186,0.6414096378904388,2025-03-03 19:47:25.104592,2025-03-03 19:47:25.421033,0 days 00:00:00.316441,gaussian_mixture,abundance,2.35,2,COMPLETE
4187,0.45074556674490696,2025-03-03 19:47:25.422662,2025-03-03 19:47:25.726688,0 days 00:00:00.304026,gaussian_mixture,abundance,2.45,2,COMPLETE
4188,0.16155813157141194,2025-03-03 19:47:25.728686,2025-03-03 19:47:26.030887,0 days 00:00:00.302201,gaussian_mixture,abundance,2.25,2,COMPLETE
4189,0.5046269246167634,2025-03-03 19:47:26.033055,2025-03-03 19:47:26.338469,0 days 00:00:00.305414,gaussian_mixture,abundance,1.9500000000000002,2,COMPLETE
4190,0.471475074504571,2025-03-03 19:47:26.339468,2025-03-03 19:47:26.645825,0 days 00:00:00.306357,gaussian_mixture,abundance,2.15,2,COMPLETE
4191,0.39460881409718046,2025-03-03 19:47:26.649822,2025-03-03 19:47:27.062966,0 days 00:00:00.413144,gaussian_mixture,abundance,2.5500000000000003,2,COMPLETE
4192,0.40320586948213377,2025-03-03 19:47:27.065962,2025-03-03 19:47:27.387911,0 days 00:00:00.321949,gaussian_mixture,abundance,2.2,2,COMPLETE
4193,0.4583613641195613,2025-03-03 19:47:27.389921,2025-03-03 19:47:27.694810,0 days 00:00:00.304889,gaussian_mixture,abundance,2.3000000000000003,2,COMPLETE
4194,0.6389709847134843,2025-03-03 19:47:27.697812,2025-03-03 19:47:28.004626,0 days 00:00:00.306814,gaussian_mixture,abundance,2.0500000000000003,2,COMPLETE
4195,0.16788024302095367,2025-03-03 19:47:28.006624,2025-03-03 19:47:28.314545,0 days 00:00:00.307921,gaussian_mixture,abundance,2.45,2,COMPLETE
4196,0.009368323706952794,2025-03-03 19:47:28.316546,2025-03-03 19:47:29.771149,0 days 00:00:01.454603,gaussian_mixture,presence,10.0,2,COMPLETE
4197,0.22934492461570172,2025-03-03 19:47:29.773706,2025-03-03 19:47:30.105840,0 days 00:00:00.332134,gaussian_mixture,abundance,0.75,2,COMPLETE
4198,0.2910284574088307,2025-03-03 19:47:30.108839,2025-03-03 19:47:30.419847,0 days 00:00:00.311008,gaussian_mixture,abundance,2.35,2,COMPLETE
4199,0.5418267761664539,2025-03-03 19:47:30.422740,2025-03-03 19:47:30.727318,0 days 00:00:00.304578,gaussian_mixture,abundance,2.25,2,COMPLETE
4200,0.5889432430326119,2025-03-03 19:47:30.729313,2025-03-03 19:47:31.071584,0 days 00:00:00.342271,gaussian_mixture,abundance,2.1,2,COMPLETE
4201,0.35789058583897876,2025-03-03 19:47:31.073604,2025-03-03 19:47:31.453244,0 days 00:00:00.379640,gaussian_mixture,abundance,2.2,2,COMPLETE
4202,0.7296597712096574,2025-03-03 19:47:31.455244,2025-03-03 19:47:31.773539,0 days 00:00:00.318295,gaussian_mixture,abundance,2.4000000000000004,2,COMPLETE
4203,0.5402983748584829,2025-03-03 19:47:31.775542,2025-03-03 19:47:32.119644,0 days 00:00:00.344102,gaussian_mixture,abundance,2.5,2,COMPLETE
4204,0.4516301968487519,2025-03-03 19:47:32.122764,2025-03-03 19:47:32.454765,0 days 00:00:00.332001,gaussian_mixture,abundance,2.3000000000000003,2,COMPLETE
4205,0.33086364038032245,2025-03-03 19:47:32.457767,2025-03-03 19:47:32.768962,0 days 00:00:00.311195,kmeans,abundance,2.4000000000000004,2,COMPLETE
4206,0.5307854278209104,2025-03-03 19:47:32.770959,2025-03-03 19:47:33.075544,0 days 00:00:00.304585,gaussian_mixture,abundance,2.15,2,COMPLETE
4207,0.4705806719562113,2025-03-03 19:47:33.077540,2025-03-03 19:47:33.399560,0 days 00:00:00.322020,gaussian_mixture,abundance,2.3000000000000003,2,COMPLETE
4208,0.5680096683624398,2025-03-03 19:47:33.402592,2025-03-03 19:47:33.729205,0 days 00:00:00.326613,gaussian_mixture,abundance,2.35,2,COMPLETE
4209,0.6143588556396896,2025-03-03 19:47:33.731734,2025-03-03 19:47:34.056270,0 days 00:00:00.324536,gaussian_mixture,abundance,2.25,4,COMPLETE
4210,0.5320790022131593,2025-03-03 19:47:34.058268,2025-03-03 19:47:34.377673,0 days 00:00:00.319405,gaussian_mixture,abundance,2.0500000000000003,2,COMPLETE
4211,0.2682728957990727,2025-03-03 19:47:34.379677,2025-03-03 19:47:34.687909,0 days 00:00:00.308232,gaussian_mixture,abundance,2.2,2,COMPLETE
4212,0.39170678476961684,2025-03-03 19:47:34.690413,2025-03-03 19:47:35.001523,0 days 00:00:00.311110,gaussian_mixture,abundance,2.4000000000000004,2,COMPLETE
4213,0.6224695185114969,2025-03-03 19:47:35.002654,2025-03-03 19:47:35.316281,0 days 00:00:00.313627,gaussian_mixture,abundance,2.15,2,COMPLETE
4214,0.4360803506530286,2025-03-03 19:47:35.318276,2025-03-03 19:47:35.644893,0 days 00:00:00.326617,gaussian_mixture,abundance,2.0,2,COMPLETE
4215,0.5994595470614495,2025-03-03 19:47:35.646896,2025-03-03 19:47:35.968278,0 days 00:00:00.321382,gaussian_mixture,abundance,2.3000000000000003,2,COMPLETE
4216,0.014005823454486055,2025-03-03 19:47:35.969278,2025-03-03 19:47:37.551823,0 days 00:00:01.582545,gaussian_mixture,presence,10.0,2,COMPLETE
4217,0.6365884623932307,2025-03-03 19:47:37.555136,2025-03-03 19:47:37.878873,0 days 00:00:00.323737,gaussian_mixture,abundance,1.75,2,COMPLETE
4218,0.37633488288599914,2025-03-03 19:47:37.881896,2025-03-03 19:47:38.185632,0 days 00:00:00.303736,gaussian_mixture,abundance,2.35,2,COMPLETE
4219,0.5254798491868922,2025-03-03 19:47:38.187644,2025-03-03 19:47:38.491669,0 days 00:00:00.304025,gaussian_mixture,abundance,2.45,2,COMPLETE
4220,0.284834516877701,2025-03-03 19:47:38.493674,2025-03-03 19:47:38.801906,0 days 00:00:00.308232,gaussian_mixture,abundance,2.2,2,COMPLETE
4221,0.3323298711866462,2025-03-03 19:47:38.803850,2025-03-03 19:47:39.104138,0 days 00:00:00.300288,kmeans,abundance,1.9000000000000001,2,COMPLETE
4222,0.5966284709591211,2025-03-03 19:47:39.106136,2025-03-03 19:47:39.416208,0 days 00:00:00.310072,gaussian_mixture,abundance,2.25,2,COMPLETE
4223,0.19169448660144472,2025-03-03 19:47:39.419210,2025-03-03 19:47:39.796303,0 days 00:00:00.377093,gaussian_mixture,abundance,1.85,2,COMPLETE
4224,0.5171740049356446,2025-03-03 19:47:39.799260,2025-03-03 19:47:40.129149,0 days 00:00:00.329889,gaussian_mixture,abundance,2.35,2,COMPLETE
4225,0.4552724009038077,2025-03-03 19:47:40.131670,2025-03-03 19:47:40.484514,0 days 00:00:00.352844,gaussian_mixture,abundance,2.2,2,COMPLETE
4226,0.4926114765951863,2025-03-03 19:47:40.488520,2025-03-03 19:47:40.822425,0 days 00:00:00.333905,gaussian_mixture,abundance,2.1,2,COMPLETE
4227,0.3652202418382458,2025-03-03 19:47:40.825433,2025-03-03 19:47:41.128665,0 days 00:00:00.303232,gaussian_mixture,abundance,2.5,2,COMPLETE
4228,0.3777421773268061,2025-03-03 19:47:41.131695,2025-03-03 19:47:41.443608,0 days 00:00:00.311913,gaussian_mixture,abundance,2.4000000000000004,2,COMPLETE
4229,0.5171740049356446,2025-03-03 19:47:41.445830,2025-03-03 19:47:41.749263,0 days 00:00:00.303433,gaussian_mixture,abundance,2.3000000000000003,2,COMPLETE
4230,0.1203768737245319,2025-03-03 19:47:41.752300,2025-03-03 19:47:42.069167,0 days 00:00:00.316867,gaussian_mixture,abundance,2.1,2,COMPLETE
4231,0.5596105811765957,2025-03-03 19:47:42.071689,2025-03-03 19:47:42.378721,0 days 00:00:00.307032,gaussian_mixture,abundance,2.4000000000000004,2,COMPLETE
4232,0.3870661045265716,2025-03-03 19:47:42.381239,2025-03-03 19:47:42.687599,0 days 00:00:00.306360,gaussian_mixture,abundance,2.25,2,COMPLETE
4233,0.43308890458349164,2025-03-03 19:47:42.689596,2025-03-03 19:47:43.001232,0 days 00:00:00.311636,gaussian_mixture,abundance,2.45,2,COMPLETE
4234,0.48114440815404186,2025-03-03 19:47:43.003763,2025-03-03 19:47:43.329142,0 days 00:00:00.325379,gaussian_mixture,abundance,2.0500000000000003,6,COMPLETE
4235,0.053763317329090884,2025-03-03 19:47:43.331676,2025-03-03 19:47:44.721747,0 days 00:00:01.390071,gaussian_mixture,presence,70.0,2,COMPLETE
4236,0.4057604477939588,2025-03-03 19:47:44.724270,2025-03-03 19:47:45.033287,0 days 00:00:00.309017,gaussian_mixture,abundance,2.6,2,COMPLETE
4237,0.6920714425925455,2025-03-03 19:47:45.036301,2025-03-03 19:47:45.347847,0 days 00:00:00.311546,gaussian_mixture,abundance,2.15,2,COMPLETE
4238,0.23295098227807012,2025-03-03 19:47:45.349859,2025-03-03 19:47:45.656179,0 days 00:00:00.306320,gaussian_mixture,abundance,2.25,2,COMPLETE
4239,0.40870606623309874,2025-03-03 19:47:45.659180,2025-03-03 19:47:45.998175,0 days 00:00:00.338995,gaussian_mixture,abundance,0.6000000000000001,2,COMPLETE
4240,0.46682993125396316,2025-03-03 19:47:46.000686,2025-03-03 19:47:46.307938,0 days 00:00:00.307252,kmeans,abundance,2.35,2,COMPLETE
4241,0.3660572075958698,2025-03-03 19:47:46.309935,2025-03-03 19:47:46.683939,0 days 00:00:00.374004,gaussian_mixture,abundance,2.2,2,COMPLETE
4242,0.5293410098924411,2025-03-03 19:47:46.685944,2025-03-03 19:47:47.016163,0 days 00:00:00.330219,gaussian_mixture,abundance,2.3000000000000003,2,COMPLETE
4243,0.3887697401683806,2025-03-03 19:47:47.018161,2025-03-03 19:47:47.386557,0 days 00:00:00.368396,gaussian_mixture,abundance,2.35,2,COMPLETE
4244,0.44241972737404334,2025-03-03 19:47:47.391592,2025-03-03 19:47:47.723698,0 days 00:00:00.332106,gaussian_mixture,abundance,2.0,2,COMPLETE
4245,0.41422141375788346,2025-03-03 19:47:47.725691,2025-03-03 19:47:48.035252,0 days 00:00:00.309561,gaussian_mixture,abundance,2.15,2,COMPLETE
4246,0.4610757290214574,2025-03-03 19:47:48.038252,2025-03-03 19:47:48.359468,0 days 00:00:00.321216,gaussian_mixture,abundance,2.45,2,COMPLETE
4247,0.5933026427706767,2025-03-03 19:47:48.362665,2025-03-03 19:47:48.681840,0 days 00:00:00.319175,gaussian_mixture,abundance,2.25,3,COMPLETE
4248,0.47636127628215397,2025-03-03 19:47:48.684846,2025-03-03 19:47:48.991706,0 days 00:00:00.306860,gaussian_mixture,abundance,1.9500000000000002,2,COMPLETE
4249,0.52201175526057,2025-03-03 19:47:48.993219,2025-03-03 19:47:49.309317,0 days 00:00:00.316098,gaussian_mixture,abundance,2.1,2,COMPLETE
4250,0.4332249700573193,2025-03-03 19:47:49.312340,2025-03-03 19:47:49.619847,0 days 00:00:00.307507,gaussian_mixture,abundance,2.4000000000000004,2,COMPLETE
4251,0.42675844577278327,2025-03-03 19:47:49.622868,2025-03-03 19:47:49.934014,0 days 00:00:00.311146,gaussian_mixture,abundance,2.3000000000000003,2,COMPLETE
4252,0.017834114586479034,2025-03-03 19:47:49.936012,2025-03-03 19:47:51.397742,0 days 00:00:01.461730,gaussian_mixture,presence,10.0,2,COMPLETE
4253,0.42441031952470354,2025-03-03 19:47:51.400750,2025-03-03 19:47:51.711474,0 days 00:00:00.310724,gaussian_mixture,abundance,2.5500000000000003,2,COMPLETE
4254,0.25041695188193247,2025-03-03 19:47:51.714486,2025-03-03 19:47:52.032944,0 days 00:00:00.318458,gaussian_mixture,abundance,2.15,2,COMPLETE
4255,0.5602029256905929,2025-03-03 19:47:52.035383,2025-03-03 19:47:52.353645,0 days 00:00:00.318262,gaussian_mixture,abundance,2.2,2,COMPLETE
4256,0.6247819981076513,2025-03-03 19:47:52.355642,2025-03-03 19:47:52.687277,0 days 00:00:00.331635,gaussian_mixture,abundance,2.0500000000000003,2,COMPLETE
4257,0.42356604423518596,2025-03-03 19:47:52.689276,2025-03-03 19:47:53.045555,0 days 00:00:00.356279,gaussian_mixture,abundance,2.5,2,COMPLETE
4258,0.3486549632856931,2025-03-03 19:47:53.048554,2025-03-03 19:47:53.373047,0 days 00:00:00.324493,kmeans,abundance,2.35,2,COMPLETE
4259,0.548621500459147,2025-03-03 19:47:53.374849,2025-03-03 19:47:53.685233,0 days 00:00:00.310384,gaussian_mixture,abundance,2.3000000000000003,2,COMPLETE
4260,0.5924593285453911,2025-03-03 19:47:53.687227,2025-03-03 19:47:53.993620,0 days 00:00:00.306393,gaussian_mixture,abundance,2.25,2,COMPLETE
4261,0.48197881083295,2025-03-03 19:47:53.995623,2025-03-03 19:47:54.305261,0 days 00:00:00.309638,gaussian_mixture,abundance,2.4000000000000004,2,COMPLETE
4262,0.5650627805149009,2025-03-03 19:47:54.307771,2025-03-03 19:47:54.627891,0 days 00:00:00.320120,gaussian_mixture,abundance,1.6,2,COMPLETE
4263,0.36699895403153093,2025-03-03 19:47:54.629893,2025-03-03 19:47:54.983174,0 days 00:00:00.353281,gaussian_mixture,abundance,2.2,2,COMPLETE
4264,0.29083841106234276,2025-03-03 19:47:54.986173,2025-03-03 19:47:55.377488,0 days 00:00:00.391315,gaussian_mixture,abundance,1.2000000000000002,2,COMPLETE
4265,0.46404000067016915,2025-03-03 19:47:55.379495,2025-03-03 19:47:55.687227,0 days 00:00:00.307732,gaussian_mixture,abundance,2.45,2,COMPLETE
4266,0.6249079428483959,2025-03-03 19:47:55.689227,2025-03-03 19:47:56.001554,0 days 00:00:00.312327,gaussian_mixture,abundance,2.1,2,COMPLETE
4267,0.38900769899215537,2025-03-03 19:47:56.004570,2025-03-03 19:47:56.316654,0 days 00:00:00.312084,gaussian_mixture,abundance,2.35,2,COMPLETE
4268,0.6422662325254709,2025-03-03 19:47:56.318656,2025-03-03 19:47:56.626801,0 days 00:00:00.308145,gaussian_mixture,abundance,2.3000000000000003,2,COMPLETE
4269,0.4247819981076513,2025-03-03 19:47:56.628798,2025-03-03 19:47:56.954768,0 days 00:00:00.325970,gaussian_mixture,abundance,1.9500000000000002,2,COMPLETE
4270,0.43168052962633274,2025-03-03 19:47:56.956760,2025-03-03 19:47:57.269635,0 days 00:00:00.312875,gaussian_mixture,abundance,2.25,2,COMPLETE
4271,0.03320943610656396,2025-03-03 19:47:57.271652,2025-03-03 19:47:58.735219,0 days 00:00:01.463567,gaussian_mixture,presence,10.0,2,COMPLETE
4272,0.5384750513612173,2025-03-03 19:47:58.739212,2025-03-03 19:47:59.065755,0 days 00:00:00.326543,gaussian_mixture,abundance,2.4000000000000004,2,COMPLETE
4273,0.4732007452297305,2025-03-03 19:47:59.068749,2025-03-03 19:47:59.377984,0 days 00:00:00.309235,gaussian_mixture,abundance,2.15,2,COMPLETE
4274,0.6119453133354623,2025-03-03 19:47:59.380988,2025-03-03 19:47:59.687837,0 days 00:00:00.306849,gaussian_mixture,abundance,2.5500000000000003,2,COMPLETE
4275,0.4402650459010717,2025-03-03 19:47:59.689837,2025-03-03 19:48:00.043758,0 days 00:00:00.353921,gaussian_mixture,abundance,2.2,2,COMPLETE
4276,0.46495612115320384,2025-03-03 19:48:00.048762,2025-03-03 19:48:00.380706,0 days 00:00:00.331944,gaussian_mixture,abundance,2.35,2,COMPLETE
4277,0.34955808351810536,2025-03-03 19:48:00.383247,2025-03-03 19:48:00.703552,0 days 00:00:00.320305,kmeans,abundance,2.25,2,COMPLETE
4278,0.40907484948719597,2025-03-03 19:48:00.706550,2025-03-03 19:48:01.015985,0 days 00:00:00.309435,gaussian_mixture,abundance,2.45,2,COMPLETE
4279,0.5565795523359395,2025-03-03 19:48:01.017990,2025-03-03 19:48:01.341862,0 days 00:00:00.323872,gaussian_mixture,abundance,2.1,2,COMPLETE
4280,0.678347675222811,2025-03-03 19:48:01.343868,2025-03-03 19:48:01.657611,0 days 00:00:00.313743,gaussian_mixture,abundance,2.0500000000000003,2,COMPLETE
4281,0.11526676879263069,2025-03-03 19:48:01.659604,2025-03-03 19:48:01.971848,0 days 00:00:00.312244,gaussian_mixture,abundance,2.3000000000000003,2,COMPLETE
