number,value,datetime_start,datetime_complete,duration,params_algorithm,params_filter_criteria,params_filter_threshold,params_k,state
442,0.36894501297109344,2025-03-03 19:28:01.185261,2025-03-03 19:28:01.379811,0 days 00:00:00.194550,gaussian_mixture,abundance,2.5,2,COMPLETE
443,0.4389557163278429,2025-03-03 19:28:01.382323,2025-03-03 19:28:01.567727,0 days 00:00:00.185404,gaussian_mixture,abundance,2.3000000000000003,2,COMPLETE
444,0.4390343544722676,2025-03-03 19:28:01.569467,2025-03-03 19:28:01.758577,0 days 00:00:00.189110,gaussian_mixture,abundance,1.55,2,COMPLETE
445,0.4561477082422492,2025-03-03 19:28:01.759578,2025-03-03 19:28:01.939703,0 days 00:00:00.180125,gaussian_mixture,abundance,2.6,2,COMPLETE
446,0.5632261314935414,2025-03-03 19:28:01.940698,2025-03-03 19:28:02.121251,0 days 00:00:00.180553,gaussian_mixture,abundance,2.4000000000000004,2,COMPLETE
447,0.48919570590035677,2025-03-03 19:28:02.123034,2025-03-03 19:28:02.307554,0 days 00:00:00.184520,gaussian_mixture,abundance,2.0,2,COMPLETE
448,0.6282904659474792,2025-03-03 19:28:02.308554,2025-03-03 19:28:02.509635,0 days 00:00:00.201081,gaussian_mixture,abundance,1.6,2,COMPLETE
449,0.5693698142564335,2025-03-03 19:28:02.510635,2025-03-03 19:28:02.695965,0 days 00:00:00.185330,gaussian_mixture,abundance,1.9000000000000001,2,COMPLETE
450,0.5652732833063714,2025-03-03 19:28:02.696965,2025-03-03 19:28:02.880752,0 days 00:00:00.183787,gaussian_mixture,abundance,2.15,2,COMPLETE
451,0.3703216467759514,2025-03-03 19:28:02.881551,2025-03-03 19:28:03.060099,0 days 00:00:00.178548,gaussian_mixture,abundance,2.45,2,COMPLETE
452,0.5099086903753633,2025-03-03 19:28:03.062101,2025-03-03 19:28:03.246712,0 days 00:00:00.184611,gaussian_mixture,abundance,1.85,2,COMPLETE
453,0.013861212323766303,2025-03-03 19:28:03.247469,2025-03-03 19:28:04.541255,0 days 00:00:01.293786,gaussian_mixture,presence,10.0,2,COMPLETE
454,0.552720568987313,2025-03-03 19:28:04.542900,2025-03-03 19:28:04.732800,0 days 00:00:00.189900,gaussian_mixture,abundance,2.35,2,COMPLETE
455,0.5741179411733099,2025-03-03 19:28:04.733602,2025-03-03 19:28:04.913734,0 days 00:00:00.180132,gaussian_mixture,abundance,2.6500000000000004,2,COMPLETE
456,0.5804649950837357,2025-03-03 19:28:04.914734,2025-03-03 19:28:05.098353,0 days 00:00:00.183619,gaussian_mixture,abundance,2.5,2,COMPLETE
457,0.5637143392741459,2025-03-03 19:28:05.099353,2025-03-03 19:28:05.281119,0 days 00:00:00.181766,gaussian_mixture,abundance,2.6,2,COMPLETE
458,0.5151771279432397,2025-03-03 19:28:05.282119,2025-03-03 19:28:05.469525,0 days 00:00:00.187406,gaussian_mixture,abundance,1.8,2,COMPLETE
459,0.142731448750398,2025-03-03 19:28:05.470518,2025-03-03 19:28:05.689679,0 days 00:00:00.219161,kmeans,abundance,0.30000000000000004,2,COMPLETE
460,0.48554047798333855,2025-03-03 19:28:05.690687,2025-03-03 19:28:05.876045,0 days 00:00:00.185358,gaussian_mixture,abundance,2.0500000000000003,2,COMPLETE
461,0.28805008449408465,2025-03-03 19:28:05.876856,2025-03-03 19:28:06.065080,0 days 00:00:00.188224,gaussian_mixture,abundance,1.9000000000000001,2,COMPLETE
462,0.4608181814329929,2025-03-03 19:28:06.066080,2025-03-03 19:28:06.248208,0 days 00:00:00.182128,gaussian_mixture,abundance,2.4000000000000004,2,COMPLETE
463,0.3190952914006416,2025-03-03 19:28:06.249213,2025-03-03 19:28:06.430366,0 days 00:00:00.181153,gaussian_mixture,abundance,2.5500000000000003,2,COMPLETE
464,0.48591338517222943,2025-03-03 19:28:06.431366,2025-03-03 19:28:06.636105,0 days 00:00:00.204739,gaussian_mixture,abundance,0.9,2,COMPLETE
465,0.2939272654891532,2025-03-03 19:28:06.637105,2025-03-03 19:28:06.834850,0 days 00:00:00.197745,gaussian_mixture,abundance,1.75,2,COMPLETE
466,0.2852089109421882,2025-03-03 19:28:06.835850,2025-03-03 19:28:07.020762,0 days 00:00:00.184912,gaussian_mixture,abundance,1.9500000000000002,2,COMPLETE
467,0.19415763237340705,2025-03-03 19:28:07.021564,2025-03-03 19:28:07.201695,0 days 00:00:00.180131,gaussian_mixture,abundance,2.3000000000000003,2,COMPLETE
468,0.40694912035809033,2025-03-03 19:28:07.203690,2025-03-03 19:28:07.395520,0 days 00:00:00.191830,gaussian_mixture,abundance,1.1500000000000001,2,COMPLETE
469,0.6584188256982936,2025-03-03 19:28:07.396520,2025-03-03 19:28:07.581108,0 days 00:00:00.184588,gaussian_mixture,abundance,2.2,2,COMPLETE
470,0.5583491904901654,2025-03-03 19:28:07.582108,2025-03-03 19:28:07.772336,0 days 00:00:00.190228,gaussian_mixture,abundance,2.2,2,COMPLETE
471,0.5230583927207595,2025-03-03 19:28:07.774347,2025-03-03 19:28:07.955662,0 days 00:00:00.181315,gaussian_mixture,abundance,2.25,2,COMPLETE
472,0.016340703031413308,2025-03-03 19:28:07.956649,2025-03-03 19:28:09.468320,0 days 00:00:01.511671,gaussian_mixture,presence,10.0,6,COMPLETE
473,0.48243450601433613,2025-03-03 19:28:09.469322,2025-03-03 19:28:09.660485,0 days 00:00:00.191163,gaussian_mixture,abundance,2.1,2,COMPLETE
474,0.3945622195683109,2025-03-03 19:28:09.661490,2025-03-03 19:28:09.848200,0 days 00:00:00.186710,gaussian_mixture,abundance,2.2,2,COMPLETE
475,0.7296597712096574,2025-03-03 19:28:09.850199,2025-03-03 19:28:10.038119,0 days 00:00:00.187920,gaussian_mixture,abundance,2.25,2,COMPLETE
476,0.3936670676615192,2025-03-03 19:28:10.039923,2025-03-03 19:28:10.222241,0 days 00:00:00.182318,gaussian_mixture,abundance,2.25,2,COMPLETE
477,0.49252982939330214,2025-03-03 19:28:10.223241,2025-03-03 19:28:10.408166,0 days 00:00:00.184925,gaussian_mixture,abundance,2.3000000000000003,2,COMPLETE
478,0.51719946336352,2025-03-03 19:28:10.409176,2025-03-03 19:28:10.590479,0 days 00:00:00.181303,gaussian_mixture,abundance,2.2,2,COMPLETE
479,0.5037025984158844,2025-03-03 19:28:10.591497,2025-03-03 19:28:10.776040,0 days 00:00:00.184543,gaussian_mixture,abundance,2.25,2,COMPLETE
480,0.05982284736034217,2025-03-03 19:28:10.777041,2025-03-03 19:28:10.956949,0 days 00:00:00.179908,kmeans,abundance,2.35,2,COMPLETE
481,0.4313431846551586,2025-03-03 19:28:10.958541,2025-03-03 19:28:11.145342,0 days 00:00:00.186801,gaussian_mixture,abundance,2.15,2,COMPLETE
482,0.49057271328132634,2025-03-03 19:28:11.146342,2025-03-03 19:28:11.351754,0 days 00:00:00.205412,gaussian_mixture,abundance,2.3000000000000003,2,COMPLETE
483,0.6855404779833385,2025-03-03 19:28:11.352753,2025-03-03 19:28:11.555902,0 days 00:00:00.203149,gaussian_mixture,abundance,2.25,2,COMPLETE
484,0.5410874158510521,2025-03-03 19:28:11.558897,2025-03-03 19:28:11.753220,0 days 00:00:00.194323,gaussian_mixture,abundance,2.25,2,COMPLETE
485,0.35200468703399534,2025-03-03 19:28:11.754023,2025-03-03 19:28:11.943705,0 days 00:00:00.189682,gaussian_mixture,abundance,2.25,4,COMPLETE
486,0.45175845477343624,2025-03-03 19:28:11.945701,2025-03-03 19:28:12.132583,0 days 00:00:00.186882,gaussian_mixture,abundance,2.35,2,COMPLETE
487,0.22333753724374997,2025-03-03 19:28:12.134345,2025-03-03 19:28:12.315476,0 days 00:00:00.181131,gaussian_mixture,abundance,2.15,2,COMPLETE
488,0.47349195156306256,2025-03-03 19:28:12.317476,2025-03-03 19:28:12.503062,0 days 00:00:00.185586,gaussian_mixture,abundance,2.2,3,COMPLETE
489,0.6405086004739197,2025-03-03 19:28:12.503859,2025-03-03 19:28:12.689635,0 days 00:00:00.185776,gaussian_mixture,abundance,2.3000000000000003,2,COMPLETE
490,0.4970753466490504,2025-03-03 19:28:12.691623,2025-03-03 19:28:12.874713,0 days 00:00:00.183090,gaussian_mixture,abundance,2.15,2,COMPLETE
491,0.5291455184543861,2025-03-03 19:28:12.876718,2025-03-03 19:28:13.078375,0 days 00:00:00.201657,gaussian_mixture,abundance,2.2,5,COMPLETE
492,0.7171740049356445,2025-03-03 19:28:13.080376,2025-03-03 19:28:13.278108,0 days 00:00:00.197732,gaussian_mixture,abundance,2.4000000000000004,2,COMPLETE
493,0.017646957725890394,2025-03-03 19:28:13.279130,2025-03-03 19:28:14.605844,0 days 00:00:01.326714,gaussian_mixture,presence,10.0,2,COMPLETE
494,0.5185764661762251,2025-03-03 19:28:14.607834,2025-03-03 19:28:14.797331,0 days 00:00:00.189497,gaussian_mixture,abundance,2.35,4,COMPLETE
495,0.3712911007214305,2025-03-03 19:28:14.798335,2025-03-03 19:28:14.981455,0 days 00:00:00.183120,gaussian_mixture,abundance,2.35,2,COMPLETE
496,0.3835773903696933,2025-03-03 19:28:14.983260,2025-03-03 19:28:15.166772,0 days 00:00:00.183512,gaussian_mixture,abundance,2.4000000000000004,2,COMPLETE
497,0.3991838108279363,2025-03-03 19:28:15.168765,2025-03-03 19:28:15.363108,0 days 00:00:00.194343,gaussian_mixture,abundance,2.3000000000000003,2,COMPLETE
498,0.5581434607424189,2025-03-03 19:28:15.364844,2025-03-03 19:28:15.546971,0 days 00:00:00.182127,gaussian_mixture,abundance,2.4000000000000004,2,COMPLETE
499,0.5006988540466709,2025-03-03 19:28:15.547971,2025-03-03 19:28:15.723097,0 days 00:00:00.175126,kmeans,abundance,2.25,2,COMPLETE
500,0.4511589377920048,2025-03-03 19:28:15.725084,2025-03-03 19:28:15.910796,0 days 00:00:00.185712,gaussian_mixture,abundance,2.3000000000000003,2,COMPLETE
501,0.614239418406423,2025-03-03 19:28:15.911796,2025-03-03 19:28:16.095824,0 days 00:00:00.184028,gaussian_mixture,abundance,2.4000000000000004,2,COMPLETE
502,0.5577518327749397,2025-03-03 19:28:16.097347,2025-03-03 19:28:16.279787,0 days 00:00:00.182440,gaussian_mixture,abundance,2.45,2,COMPLETE
503,0.5652564110527933,2025-03-03 19:28:16.280786,2025-03-03 19:28:16.471826,0 days 00:00:00.191040,gaussian_mixture,abundance,2.1,2,COMPLETE
504,0.5948596584458474,2025-03-03 19:28:16.472828,2025-03-03 19:28:16.660203,0 days 00:00:00.187375,gaussian_mixture,abundance,2.3000000000000003,2,COMPLETE
505,0.438847439498003,2025-03-03 19:28:16.661198,2025-03-03 19:28:16.861335,0 days 00:00:00.200137,gaussian_mixture,abundance,1.0,2,COMPLETE
506,0.45562482893178735,2025-03-03 19:28:16.862335,2025-03-03 19:28:17.043635,0 days 00:00:00.181300,gaussian_mixture,abundance,2.45,2,COMPLETE
507,0.41542194081433037,2025-03-03 19:28:17.044643,2025-03-03 19:28:17.230778,0 days 00:00:00.186135,gaussian_mixture,abundance,2.2,2,COMPLETE
508,0.28425815088202666,2025-03-03 19:28:17.231778,2025-03-03 19:28:17.424009,0 days 00:00:00.192231,gaussian_mixture,abundance,2.25,2,COMPLETE
509,0.5214520663760333,2025-03-03 19:28:17.425073,2025-03-03 19:28:17.611776,0 days 00:00:00.186703,gaussian_mixture,abundance,2.35,2,COMPLETE
510,0.6611021863935858,2025-03-03 19:28:17.612583,2025-03-03 19:28:17.797091,0 days 00:00:00.184508,gaussian_mixture,abundance,2.35,2,COMPLETE
511,0.36699895403153093,2025-03-03 19:28:17.797091,2025-03-03 19:28:17.981951,0 days 00:00:00.184860,gaussian_mixture,abundance,2.35,2,COMPLETE
512,0.6042071531465536,2025-03-03 19:28:17.982951,2025-03-03 19:28:18.170083,0 days 00:00:00.187132,gaussian_mixture,abundance,2.4000000000000004,3,COMPLETE
513,0.06878723130899418,2025-03-03 19:28:18.171083,2025-03-03 19:28:19.355307,0 days 00:00:01.184224,gaussian_mixture,presence,35.0,2,COMPLETE
514,0.3862768846979035,2025-03-03 19:28:19.357308,2025-03-03 19:28:19.551227,0 days 00:00:00.193919,gaussian_mixture,abundance,2.35,2,COMPLETE
515,0.566998954031531,2025-03-03 19:28:19.552884,2025-03-03 19:28:19.742841,0 days 00:00:00.189957,gaussian_mixture,abundance,2.25,2,COMPLETE
516,0.45175845477343624,2025-03-03 19:28:19.743841,2025-03-03 19:28:19.928401,0 days 00:00:00.184560,gaussian_mixture,abundance,2.45,2,COMPLETE
517,0.33536542707922495,2025-03-03 19:28:19.930400,2025-03-03 19:28:20.112376,0 days 00:00:00.181976,gaussian_mixture,abundance,2.4000000000000004,2,COMPLETE
518,0.528110674308272,2025-03-03 19:28:20.113183,2025-03-03 19:28:20.298772,0 days 00:00:00.185589,gaussian_mixture,abundance,2.15,2,COMPLETE
519,0.3126295267244087,2025-03-03 19:28:20.299767,2025-03-03 19:28:20.492410,0 days 00:00:00.192643,kmeans,abundance,2.3000000000000003,2,COMPLETE
520,0.6555877495959652,2025-03-03 19:28:20.494383,2025-03-03 19:28:20.690477,0 days 00:00:00.196094,gaussian_mixture,abundance,2.5,2,COMPLETE
521,0.48255149815131365,2025-03-03 19:28:20.691476,2025-03-03 19:28:20.885576,0 days 00:00:00.194100,gaussian_mixture,abundance,2.5,2,COMPLETE
522,0.6634017623408495,2025-03-03 19:28:20.886576,2025-03-03 19:28:21.070801,0 days 00:00:00.184225,gaussian_mixture,abundance,2.45,2,COMPLETE
523,0.4151049131721042,2025-03-03 19:28:21.071801,2025-03-03 19:28:21.255441,0 days 00:00:00.183640,gaussian_mixture,abundance,2.45,2,COMPLETE
524,0.5088775849637004,2025-03-03 19:28:21.256249,2025-03-03 19:28:21.440318,0 days 00:00:00.184069,gaussian_mixture,abundance,2.45,2,COMPLETE
525,0.42236546222096505,2025-03-03 19:28:21.441327,2025-03-03 19:28:21.638224,0 days 00:00:00.196897,gaussian_mixture,abundance,2.4000000000000004,2,COMPLETE
526,0.4901865156665742,2025-03-03 19:28:21.639877,2025-03-03 19:28:21.830976,0 days 00:00:00.191099,gaussian_mixture,abundance,2.35,2,COMPLETE
527,0.3242663040058075,2025-03-03 19:28:21.831976,2025-03-03 19:28:22.014546,0 days 00:00:00.182570,gaussian_mixture,abundance,2.3000000000000003,2,COMPLETE
528,0.5831587868080035,2025-03-03 19:28:22.015548,2025-03-03 19:28:22.199129,0 days 00:00:00.183581,gaussian_mixture,abundance,2.4000000000000004,2,COMPLETE
529,0.2898357107203199,2025-03-03 19:28:22.201129,2025-03-03 19:28:22.382232,0 days 00:00:00.181103,gaussian_mixture,abundance,2.5,2,COMPLETE
530,0.5008637441183492,2025-03-03 19:28:22.383232,2025-03-03 19:28:22.579545,0 days 00:00:00.196313,gaussian_mixture,abundance,1.25,2,COMPLETE
531,0.5008573203596798,2025-03-03 19:28:22.580545,2025-03-03 19:28:22.766879,0 days 00:00:00.186334,gaussian_mixture,abundance,2.2,2,COMPLETE
532,0.010213549540393677,2025-03-03 19:28:22.767879,2025-03-03 19:28:24.081940,0 days 00:00:01.314061,gaussian_mixture,presence,10.0,2,COMPLETE
533,0.4709831465618771,2025-03-03 19:28:24.082941,2025-03-03 19:28:24.312532,0 days 00:00:00.229591,gaussian_mixture,abundance,2.45,2,COMPLETE
534,0.5780156814509319,2025-03-03 19:28:24.313530,2025-03-03 19:28:24.507883,0 days 00:00:00.194353,gaussian_mixture,abundance,2.35,2,COMPLETE
535,0.45467303983314017,2025-03-03 19:28:24.509885,2025-03-03 19:28:24.722658,0 days 00:00:00.212773,gaussian_mixture,abundance,2.25,2,COMPLETE
536,0.467150365613865,2025-03-03 19:28:24.723666,2025-03-03 19:28:24.909267,0 days 00:00:00.185601,gaussian_mixture,abundance,2.5,2,COMPLETE
537,0.5910977348597353,2025-03-03 19:28:24.910267,2025-03-03 19:28:25.095101,0 days 00:00:00.184834,gaussian_mixture,abundance,2.45,2,COMPLETE
538,0.5515925156609006,2025-03-03 19:28:25.096101,2025-03-03 19:28:25.279712,0 days 00:00:00.183611,gaussian_mixture,abundance,2.3000000000000003,2,COMPLETE
539,0.3738131964556223,2025-03-03 19:28:25.280711,2025-03-03 19:28:25.459432,0 days 00:00:00.178721,kmeans,abundance,2.0500000000000003,2,COMPLETE
540,0.5882250761039878,2025-03-03 19:28:25.460431,2025-03-03 19:28:25.646763,0 days 00:00:00.186332,gaussian_mixture,abundance,2.15,2,COMPLETE
541,0.44659740538894893,2025-03-03 19:28:25.648532,2025-03-03 19:28:25.832630,0 days 00:00:00.184098,gaussian_mixture,abundance,2.4000000000000004,2,COMPLETE
542,0.3895536644578789,2025-03-03 19:28:25.833631,2025-03-03 19:28:26.039841,0 days 00:00:00.206210,gaussian_mixture,abundance,2.35,2,COMPLETE
543,0.6352170280860541,2025-03-03 19:28:26.040842,2025-03-03 19:28:26.226212,0 days 00:00:00.185370,gaussian_mixture,abundance,2.5,2,COMPLETE
544,0.3611545663460928,2025-03-03 19:28:26.228204,2025-03-03 19:28:26.415805,0 days 00:00:00.187601,gaussian_mixture,abundance,2.2,2,COMPLETE
545,0.3652564110527933,2025-03-03 19:28:26.416811,2025-03-03 19:28:26.603200,0 days 00:00:00.186389,gaussian_mixture,abundance,2.1,2,COMPLETE
546,0.2571703738157466,2025-03-03 19:28:26.604200,2025-03-03 19:28:26.787267,0 days 00:00:00.183067,gaussian_mixture,abundance,2.5,2,COMPLETE
547,0.7054126986918515,2025-03-03 19:28:26.788271,2025-03-03 19:28:26.979398,0 days 00:00:00.191127,gaussian_mixture,abundance,2.35,2,COMPLETE
548,0.5456182439558811,2025-03-03 19:28:26.980397,2025-03-03 19:28:27.163808,0 days 00:00:00.183411,gaussian_mixture,abundance,2.3000000000000003,2,COMPLETE
549,0.6344485523416019,2025-03-03 19:28:27.165800,2025-03-03 19:28:27.350104,0 days 00:00:00.184304,gaussian_mixture,abundance,2.4000000000000004,2,COMPLETE
550,0.5866194899643528,2025-03-03 19:28:27.351104,2025-03-03 19:28:27.536897,0 days 00:00:00.185793,gaussian_mixture,abundance,2.25,2,COMPLETE
551,0.4372962346867985,2025-03-03 19:28:27.537897,2025-03-03 19:28:27.723129,0 days 00:00:00.185232,gaussian_mixture,abundance,2.4000000000000004,2,COMPLETE
552,0.5890053765405705,2025-03-03 19:28:27.725131,2025-03-03 19:28:27.912361,0 days 00:00:00.187230,gaussian_mixture,abundance,2.35,2,COMPLETE
553,0.3691169393529935,2025-03-03 19:28:27.913360,2025-03-03 19:28:28.106904,0 days 00:00:00.193544,gaussian_mixture,abundance,2.3000000000000003,2,COMPLETE
554,0.4200007446582418,2025-03-03 19:28:28.108538,2025-03-03 19:28:28.296417,0 days 00:00:00.187879,gaussian_mixture,abundance,2.45,2,COMPLETE
555,0.3626763673423502,2025-03-03 19:28:28.297417,2025-03-03 19:28:28.484569,0 days 00:00:00.187152,gaussian_mixture,abundance,2.25,2,COMPLETE
556,0.5130606017320043,2025-03-03 19:28:28.485567,2025-03-03 19:28:28.672725,0 days 00:00:00.187158,gaussian_mixture,abundance,2.35,2,COMPLETE
557,0.4785019127379108,2025-03-03 19:28:28.674729,2025-03-03 19:28:28.858677,0 days 00:00:00.183948,gaussian_mixture,abundance,2.15,2,COMPLETE
558,0.3686402440823787,2025-03-03 19:28:28.860682,2025-03-03 19:28:29.046913,0 days 00:00:00.186231,gaussian_mixture,abundance,2.45,2,COMPLETE
559,-0.004265155649735222,2025-03-03 19:28:29.047913,2025-03-03 19:28:30.337388,0 days 00:00:01.289475,gaussian_mixture,presence,10.0,2,COMPLETE
560,0.41616178224420136,2025-03-03 19:28:30.338389,2025-03-03 19:28:30.516574,0 days 00:00:00.178185,kmeans,abundance,2.25,2,COMPLETE
561,0.5173204467156918,2025-03-03 19:28:30.517579,2025-03-03 19:28:30.707368,0 days 00:00:00.189789,gaussian_mixture,abundance,2.5,3,COMPLETE
562,0.421709922431514,2025-03-03 19:28:30.708373,2025-03-03 19:28:30.891750,0 days 00:00:00.183377,gaussian_mixture,abundance,2.35,2,COMPLETE
563,0.573402195187577,2025-03-03 19:28:30.893750,2025-03-03 19:28:31.087623,0 days 00:00:00.193873,gaussian_mixture,abundance,2.1,2,COMPLETE
564,0.3426588486312682,2025-03-03 19:28:31.088624,2025-03-03 19:28:31.274711,0 days 00:00:00.186087,gaussian_mixture,abundance,2.5500000000000003,2,COMPLETE
565,0.4871638149695389,2025-03-03 19:28:31.275710,2025-03-03 19:28:31.459803,0 days 00:00:00.184093,gaussian_mixture,abundance,2.3000000000000003,2,COMPLETE
566,0.4793479378639959,2025-03-03 19:28:31.460804,2025-03-03 19:28:31.647384,0 days 00:00:00.186580,gaussian_mixture,abundance,2.4000000000000004,2,COMPLETE
567,0.5337041493080401,2025-03-03 19:28:31.648190,2025-03-03 19:28:31.840652,0 days 00:00:00.192462,gaussian_mixture,abundance,2.2,2,COMPLETE
568,0.32209359299604573,2025-03-03 19:28:31.841653,2025-03-03 19:28:32.027983,0 days 00:00:00.186330,gaussian_mixture,abundance,2.5,2,COMPLETE
569,0.6001171851159993,2025-03-03 19:28:32.028983,2025-03-03 19:28:32.214345,0 days 00:00:00.185362,gaussian_mixture,abundance,2.45,2,COMPLETE
570,0.5951296477320679,2025-03-03 19:28:32.215367,2025-03-03 19:28:32.414977,0 days 00:00:00.199610,gaussian_mixture,abundance,2.0,2,COMPLETE
571,0.6073454247198603,2025-03-03 19:28:32.415983,2025-03-03 19:28:32.601720,0 days 00:00:00.185737,gaussian_mixture,abundance,2.35,2,COMPLETE
572,0.015109037859426504,2025-03-03 19:28:32.602716,2025-03-03 19:28:33.914475,0 days 00:00:01.311759,gaussian_mixture,presence,10.0,2,COMPLETE
573,0.26610641963569964,2025-03-03 19:28:33.915998,2025-03-03 19:28:34.100210,0 days 00:00:00.184212,gaussian_mixture,abundance,2.2,2,COMPLETE
574,0.5169962288266234,2025-03-03 19:28:34.101232,2025-03-03 19:28:34.301602,0 days 00:00:00.200370,gaussian_mixture,abundance,1.2000000000000002,2,COMPLETE
575,0.42439080497649384,2025-03-03 19:28:34.302613,2025-03-03 19:28:34.497765,0 days 00:00:00.195152,gaussian_mixture,abundance,2.4000000000000004,2,COMPLETE
576,0.5689494381713187,2025-03-03 19:28:34.498845,2025-03-03 19:28:34.691135,0 days 00:00:00.192290,gaussian_mixture,abundance,2.0500000000000003,2,COMPLETE
577,0.396334499926376,2025-03-03 19:28:34.692140,2025-03-03 19:28:34.866624,0 days 00:00:00.174484,kmeans,abundance,2.3000000000000003,2,COMPLETE
578,0.667542216662825,2025-03-03 19:28:34.868430,2025-03-03 19:28:35.056302,0 days 00:00:00.187872,gaussian_mixture,abundance,2.15,2,COMPLETE
579,0.2627850057888712,2025-03-03 19:28:35.058098,2025-03-03 19:28:35.248178,0 days 00:00:00.190080,gaussian_mixture,abundance,2.1,2,COMPLETE
580,0.6855404779833385,2025-03-03 19:28:35.250172,2025-03-03 19:28:35.492767,0 days 00:00:00.242595,gaussian_mixture,abundance,2.15,2,COMPLETE
581,0.3835773903696933,2025-03-03 19:28:35.494771,2025-03-03 19:28:35.680875,0 days 00:00:00.186104,gaussian_mixture,abundance,2.15,2,COMPLETE
582,0.6213672598699637,2025-03-03 19:28:35.681875,2025-03-03 19:28:35.870572,0 days 00:00:00.188697,gaussian_mixture,abundance,2.15,2,COMPLETE
583,0.5230809567947727,2025-03-03 19:28:35.872380,2025-03-03 19:28:36.073511,0 days 00:00:00.201131,gaussian_mixture,abundance,2.1,5,COMPLETE
584,0.4470554677666364,2025-03-03 19:28:36.075511,2025-03-03 19:28:36.259189,0 days 00:00:00.183678,gaussian_mixture,abundance,2.2,2,COMPLETE
585,0.41379186205761104,2025-03-03 19:28:36.259996,2025-03-03 19:28:36.445442,0 days 00:00:00.185446,gaussian_mixture,abundance,2.0,2,COMPLETE
586,0.595543832775503,2025-03-03 19:28:36.447123,2025-03-03 19:28:36.644135,0 days 00:00:00.197012,gaussian_mixture,abundance,2.15,2,COMPLETE
587,0.45356637036538183,2025-03-03 19:28:36.645762,2025-03-03 19:28:36.842254,0 days 00:00:00.196492,gaussian_mixture,abundance,2.25,2,COMPLETE
588,0.5125294630666628,2025-03-03 19:28:36.844254,2025-03-03 19:28:37.035933,0 days 00:00:00.191679,gaussian_mixture,abundance,2.1,4,COMPLETE
589,0.3616374924498027,2025-03-03 19:28:37.036933,2025-03-03 19:28:37.223691,0 days 00:00:00.186758,gaussian_mixture,abundance,2.2,2,COMPLETE
590,0.5920001770361638,2025-03-03 19:28:37.224700,2025-03-03 19:28:37.416316,0 days 00:00:00.191616,gaussian_mixture,abundance,2.15,2,COMPLETE
