number,value,datetime_start,datetime_complete,duration,params_algorithm,params_filter_criteria,params_filter_threshold,params_k,state
1185,0.587798033108586,2025-03-03 19:31:12.094036,2025-03-03 19:31:12.304082,0 days 00:00:00.210046,gaussian_mixture,abundance,1.5,2,COMPLETE
1186,0.5855016551297274,2025-03-03 19:31:12.306079,2025-03-03 19:31:12.508065,0 days 00:00:00.201986,gaussian_mixture,abundance,2.4000000000000004,2,COMPLETE
1187,-0.0011146063551110258,2025-03-03 19:31:12.509059,2025-03-03 19:31:13.937243,0 days 00:00:01.428184,gaussian_mixture,presence,10.0,3,COMPLETE
1188,0.5796796500920715,2025-03-03 19:31:13.938242,2025-03-03 19:31:14.151087,0 days 00:00:00.212845,gaussian_mixture,abundance,2.25,2,COMPLETE
1189,0.6037414212694955,2025-03-03 19:31:14.152083,2025-03-03 19:31:14.396129,0 days 00:00:00.244046,gaussian_mixture,abundance,2.35,2,COMPLETE
1190,0.550555610205477,2025-03-03 19:31:14.397162,2025-03-03 19:31:14.624887,0 days 00:00:00.227725,gaussian_mixture,abundance,2.1,2,COMPLETE
1191,0.5159106958287791,2025-03-03 19:31:14.626894,2025-03-03 19:31:14.830954,0 days 00:00:00.204060,gaussian_mixture,abundance,2.5,2,COMPLETE
1192,0.6371260773748364,2025-03-03 19:31:14.831961,2025-03-03 19:31:15.038479,0 days 00:00:00.206518,gaussian_mixture,abundance,2.25,2,COMPLETE
1193,0.2473732640557313,2025-03-03 19:31:15.039482,2025-03-03 19:31:15.244952,0 days 00:00:00.205470,kmeans,abundance,2.15,2,COMPLETE
1194,0.5504582328159098,2025-03-03 19:31:15.246946,2025-03-03 19:31:15.459144,0 days 00:00:00.212198,gaussian_mixture,abundance,2.1,2,COMPLETE
1195,0.5678260201091435,2025-03-03 19:31:15.461142,2025-03-03 19:31:15.662200,0 days 00:00:00.201058,gaussian_mixture,abundance,2.6,2,COMPLETE
1196,0.2935075310441617,2025-03-03 19:31:15.663201,2025-03-03 19:31:15.905994,0 days 00:00:00.242793,gaussian_mixture,abundance,2.35,2,COMPLETE
1197,0.5396770986131116,2025-03-03 19:31:15.907995,2025-03-03 19:31:16.141979,0 days 00:00:00.233984,gaussian_mixture,abundance,2.45,2,COMPLETE
1198,0.3444990723173665,2025-03-03 19:31:16.143971,2025-03-03 19:31:16.428163,0 days 00:00:00.284192,gaussian_mixture,abundance,0.55,2,COMPLETE
1199,0.6069401147103107,2025-03-03 19:31:16.430145,2025-03-03 19:31:16.665209,0 days 00:00:00.235064,gaussian_mixture,abundance,2.25,2,COMPLETE
1200,0.4311153857059951,2025-03-03 19:31:16.666201,2025-03-03 19:31:16.898290,0 days 00:00:00.232089,gaussian_mixture,abundance,2.2,2,COMPLETE
1201,0.41031914409365056,2025-03-03 19:31:16.899820,2025-03-03 19:31:17.157577,0 days 00:00:00.257757,gaussian_mixture,abundance,0.8500000000000001,3,COMPLETE
1202,0.4831078733446309,2025-03-03 19:31:17.158568,2025-03-03 19:31:17.432154,0 days 00:00:00.273586,gaussian_mixture,abundance,2.3000000000000003,2,COMPLETE
1203,0.6586296920293979,2025-03-03 19:31:17.433763,2025-03-03 19:31:17.652351,0 days 00:00:00.218588,gaussian_mixture,abundance,2.4000000000000004,2,COMPLETE
1204,0.13937398125577968,2025-03-03 19:31:17.654353,2025-03-03 19:31:17.872396,0 days 00:00:00.218043,gaussian_mixture,abundance,2.1,2,COMPLETE
1205,0.03849232697594468,2025-03-03 19:31:17.875394,2025-03-03 19:31:19.248056,0 days 00:00:01.372662,gaussian_mixture,presence,20.0,2,COMPLETE
1206,0.4057962572003328,2025-03-03 19:31:19.250042,2025-03-03 19:31:19.452015,0 days 00:00:00.201973,gaussian_mixture,abundance,2.2,2,COMPLETE
1207,0.41627604356477904,2025-03-03 19:31:19.452735,2025-03-03 19:31:19.676517,0 days 00:00:00.223782,gaussian_mixture,abundance,2.3000000000000003,2,COMPLETE
1208,0.5912679725691087,2025-03-03 19:31:19.677514,2025-03-03 19:31:19.883609,0 days 00:00:00.206095,gaussian_mixture,abundance,2.2,2,COMPLETE
1209,0.4871457178705505,2025-03-03 19:31:19.884610,2025-03-03 19:31:20.087071,0 days 00:00:00.202461,gaussian_mixture,abundance,2.5500000000000003,2,COMPLETE
1210,0.3835773903696933,2025-03-03 19:31:20.088069,2025-03-03 19:31:20.295607,0 days 00:00:00.207538,gaussian_mixture,abundance,2.15,2,COMPLETE
1211,0.48933608039086385,2025-03-03 19:31:20.297396,2025-03-03 19:31:20.499468,0 days 00:00:00.202072,gaussian_mixture,abundance,2.45,2,COMPLETE
1212,0.2982461780545377,2025-03-03 19:31:20.500468,2025-03-03 19:31:20.705071,0 days 00:00:00.204603,gaussian_mixture,abundance,2.25,2,COMPLETE
1213,0.41694392711145667,2025-03-03 19:31:20.707070,2025-03-03 19:31:20.907035,0 days 00:00:00.199965,kmeans,abundance,2.35,2,COMPLETE
1214,0.44821141310195733,2025-03-03 19:31:20.909381,2025-03-03 19:31:21.124467,0 days 00:00:00.215086,gaussian_mixture,abundance,2.15,4,COMPLETE
1215,0.4802049323287759,2025-03-03 19:31:21.125468,2025-03-03 19:31:21.331539,0 days 00:00:00.206071,gaussian_mixture,abundance,2.0500000000000003,2,COMPLETE
1216,0.4494307080980359,2025-03-03 19:31:21.333533,2025-03-03 19:31:21.548646,0 days 00:00:00.215113,gaussian_mixture,abundance,2.3000000000000003,5,COMPLETE
1217,0.12754315504002448,2025-03-03 19:31:21.549648,2025-03-03 19:31:21.759522,0 days 00:00:00.209874,gaussian_mixture,abundance,2.5,2,COMPLETE
1218,0.36366903025777564,2025-03-03 19:31:21.761515,2025-03-03 19:31:21.968337,0 days 00:00:00.206822,gaussian_mixture,abundance,2.2,2,COMPLETE
1219,0.382084907126639,2025-03-03 19:31:21.970323,2025-03-03 19:31:22.180417,0 days 00:00:00.210094,gaussian_mixture,abundance,1.7000000000000002,2,COMPLETE
1220,0.12285854993450593,2025-03-03 19:31:22.181415,2025-03-03 19:31:22.382318,0 days 00:00:00.200903,gaussian_mixture,abundance,2.35,2,COMPLETE
1221,0.3833824605831657,2025-03-03 19:31:22.383318,2025-03-03 19:31:22.586448,0 days 00:00:00.203130,gaussian_mixture,abundance,2.4000000000000004,2,COMPLETE
1222,0.57264910479856,2025-03-03 19:31:22.588243,2025-03-03 19:31:22.799744,0 days 00:00:00.211501,gaussian_mixture,abundance,2.25,2,COMPLETE
1223,0.19751173631659458,2025-03-03 19:31:22.801743,2025-03-03 19:31:23.005874,0 days 00:00:00.204131,gaussian_mixture,abundance,2.1,2,COMPLETE
1224,-0.0035870179393164225,2025-03-03 19:31:23.007872,2025-03-03 19:31:24.339943,0 days 00:00:01.332071,gaussian_mixture,presence,10.0,2,COMPLETE
1225,0.5948596584458474,2025-03-03 19:31:24.341937,2025-03-03 19:31:24.548045,0 days 00:00:00.206108,gaussian_mixture,abundance,2.0500000000000003,2,COMPLETE
1226,0.3523011471773877,2025-03-03 19:31:24.549045,2025-03-03 19:31:24.751691,0 days 00:00:00.202646,gaussian_mixture,abundance,2.15,2,COMPLETE
1227,0.3578905858389787,2025-03-03 19:31:24.753686,2025-03-03 19:31:24.964648,0 days 00:00:00.210962,gaussian_mixture,abundance,2.25,2,COMPLETE
1228,0.508524241394279,2025-03-03 19:31:24.966645,2025-03-03 19:31:25.189759,0 days 00:00:00.223114,gaussian_mixture,abundance,2.45,2,COMPLETE
1229,0.34586342421615257,2025-03-03 19:31:25.190756,2025-03-03 19:31:25.394301,0 days 00:00:00.203545,gaussian_mixture,abundance,2.3000000000000003,2,COMPLETE
1230,0.3219890791704509,2025-03-03 19:31:25.395304,2025-03-03 19:31:25.606530,0 days 00:00:00.211226,kmeans,abundance,2.15,6,COMPLETE
1231,0.20237086022490264,2025-03-03 19:31:25.608529,2025-03-03 19:31:25.807356,0 days 00:00:00.198827,gaussian_mixture,abundance,2.35,2,COMPLETE
1232,0.4893133005213281,2025-03-03 19:31:25.809342,2025-03-03 19:31:26.021043,0 days 00:00:00.211701,gaussian_mixture,abundance,2.2,2,COMPLETE
1233,0.3667723019613317,2025-03-03 19:31:26.022660,2025-03-03 19:31:26.226294,0 days 00:00:00.203634,gaussian_mixture,abundance,2.5500000000000003,2,COMPLETE
1234,0.6450640366131445,2025-03-03 19:31:26.227287,2025-03-03 19:31:26.436618,0 days 00:00:00.209331,gaussian_mixture,abundance,2.1,2,COMPLETE
1235,0.5001551720216997,2025-03-03 19:31:26.437619,2025-03-03 19:31:26.642690,0 days 00:00:00.205071,gaussian_mixture,abundance,2.4000000000000004,2,COMPLETE
1236,0.688371554085667,2025-03-03 19:31:26.643698,2025-03-03 19:31:26.852316,0 days 00:00:00.208618,gaussian_mixture,abundance,2.25,2,COMPLETE
1237,0.5479361160403917,2025-03-03 19:31:26.853305,2025-03-03 19:31:27.061252,0 days 00:00:00.207947,gaussian_mixture,abundance,2.3000000000000003,2,COMPLETE
1238,0.4998875876331015,2025-03-03 19:31:27.063244,2025-03-03 19:31:27.270625,0 days 00:00:00.207381,gaussian_mixture,abundance,2.5,2,COMPLETE
1239,0.250125180444646,2025-03-03 19:31:27.271398,2025-03-03 19:31:27.478920,0 days 00:00:00.207522,gaussian_mixture,abundance,2.2,2,COMPLETE
1240,0.43741214684430585,2025-03-03 19:31:27.480901,2025-03-03 19:31:27.685442,0 days 00:00:00.204541,gaussian_mixture,abundance,2.1,2,COMPLETE
1241,0.488371554085667,2025-03-03 19:31:27.687192,2025-03-03 19:31:27.889277,0 days 00:00:00.202085,gaussian_mixture,abundance,2.6,2,COMPLETE
1242,0.5314620333137928,2025-03-03 19:31:27.892277,2025-03-03 19:31:28.102829,0 days 00:00:00.210552,gaussian_mixture,abundance,2.0500000000000003,2,COMPLETE
1243,0.01970891714856256,2025-03-03 19:31:28.104457,2025-03-03 19:31:29.431779,0 days 00:00:01.327322,gaussian_mixture,presence,10.0,2,COMPLETE
1244,0.5861983103302795,2025-03-03 19:31:29.433773,2025-03-03 19:31:29.635247,0 days 00:00:00.201474,gaussian_mixture,abundance,2.4000000000000004,2,COMPLETE
1245,0.49039754418343595,2025-03-03 19:31:29.636242,2025-03-03 19:31:29.839360,0 days 00:00:00.203118,gaussian_mixture,abundance,2.15,2,COMPLETE
1246,0.5420824826355939,2025-03-03 19:31:29.840360,2025-03-03 19:31:30.043447,0 days 00:00:00.203087,gaussian_mixture,abundance,2.45,2,COMPLETE
1247,0.5948596584458474,2025-03-03 19:31:30.044452,2025-03-03 19:31:30.252142,0 days 00:00:00.207690,gaussian_mixture,abundance,2.3000000000000003,2,COMPLETE
1248,0.5831013252292712,2025-03-03 19:31:30.253220,2025-03-03 19:31:30.461437,0 days 00:00:00.208217,gaussian_mixture,abundance,2.2,2,COMPLETE
1249,0.4090229769330917,2025-03-03 19:31:30.462237,2025-03-03 19:31:30.661389,0 days 00:00:00.199152,kmeans,abundance,2.25,2,COMPLETE
1250,0.5860784284833456,2025-03-03 19:31:30.663395,2025-03-03 19:31:30.879486,0 days 00:00:00.216091,gaussian_mixture,abundance,1.75,2,COMPLETE
1251,0.3340316939728967,2025-03-03 19:31:30.880486,2025-03-03 19:31:31.090535,0 days 00:00:00.210049,gaussian_mixture,abundance,2.35,2,COMPLETE
1252,0.3297811032809224,2025-03-03 19:31:31.092341,2025-03-03 19:31:31.294873,0 days 00:00:00.202532,gaussian_mixture,abundance,2.15,2,COMPLETE
1253,0.49722874927688077,2025-03-03 19:31:31.296868,2025-03-03 19:31:31.510943,0 days 00:00:00.214075,gaussian_mixture,abundance,2.5,2,COMPLETE
1254,0.5516499772396329,2025-03-03 19:31:31.511940,2025-03-03 19:31:31.725413,0 days 00:00:00.213473,gaussian_mixture,abundance,2.25,2,COMPLETE
1255,0.30586131473715417,2025-03-03 19:31:31.727410,2025-03-03 19:31:31.929549,0 days 00:00:00.202139,gaussian_mixture,abundance,2.2,2,COMPLETE
1256,0.23822833601636956,2025-03-03 19:31:31.930553,2025-03-03 19:31:32.133481,0 days 00:00:00.202928,gaussian_mixture,abundance,2.0500000000000003,2,COMPLETE
1257,0.32332414242163166,2025-03-03 19:31:32.135288,2025-03-03 19:31:32.363647,0 days 00:00:00.228359,gaussian_mixture,abundance,1.0,2,COMPLETE
1258,0.015825220393288823,2025-03-03 19:31:32.365648,2025-03-03 19:31:32.710232,0 days 00:00:00.344584,gaussian_mixture,abundance,0.1,2,COMPLETE
1259,0.31992957436006336,2025-03-03 19:31:32.712231,2025-03-03 19:31:32.912951,0 days 00:00:00.200720,gaussian_mixture,abundance,2.4000000000000004,2,COMPLETE
1260,0.535365427079225,2025-03-03 19:31:32.913951,2025-03-03 19:31:33.119518,0 days 00:00:00.205567,gaussian_mixture,abundance,2.3000000000000003,2,COMPLETE
1261,0.45486067123576934,2025-03-03 19:31:33.121034,2025-03-03 19:31:33.343168,0 days 00:00:00.222134,gaussian_mixture,abundance,2.1,2,COMPLETE
1262,0.06560455629472277,2025-03-03 19:31:33.345167,2025-03-03 19:31:34.670122,0 days 00:00:01.324955,gaussian_mixture,presence,50.0,2,COMPLETE
1263,0.32433400335173784,2025-03-03 19:31:34.672115,2025-03-03 19:31:34.880894,0 days 00:00:00.208779,gaussian_mixture,abundance,2.2,2,COMPLETE
1264,0.5596105811765957,2025-03-03 19:31:34.881897,2025-03-03 19:31:35.088002,0 days 00:00:00.206105,gaussian_mixture,abundance,2.35,2,COMPLETE
1265,0.699421255027764,2025-03-03 19:31:35.090000,2025-03-03 19:31:35.301115,0 days 00:00:00.211115,gaussian_mixture,abundance,2.15,2,COMPLETE
1266,0.2132460103759554,2025-03-03 19:31:35.302105,2025-03-03 19:31:35.510259,0 days 00:00:00.208154,gaussian_mixture,abundance,2.0500000000000003,2,COMPLETE
1267,0.419120008680134,2025-03-03 19:31:35.511254,2025-03-03 19:31:35.722388,0 days 00:00:00.211134,gaussian_mixture,abundance,2.15,2,COMPLETE
1268,0.5370462256441575,2025-03-03 19:31:35.724561,2025-03-03 19:31:35.952600,0 days 00:00:00.228039,gaussian_mixture,abundance,2.1,2,COMPLETE
1269,0.5406704617976538,2025-03-03 19:31:35.954601,2025-03-03 19:31:36.164840,0 days 00:00:00.210239,gaussian_mixture,abundance,2.15,2,COMPLETE
1270,0.3120280269517337,2025-03-03 19:31:36.165839,2025-03-03 19:31:36.366340,0 days 00:00:00.200501,kmeans,abundance,2.1,2,COMPLETE
1271,0.5753536873467168,2025-03-03 19:31:36.367341,2025-03-03 19:31:36.572731,0 days 00:00:00.205390,gaussian_mixture,abundance,2.2,2,COMPLETE
1272,0.4274712605069265,2025-03-03 19:31:36.573731,2025-03-03 19:31:36.791146,0 days 00:00:00.217415,gaussian_mixture,abundance,2.0500000000000003,2,COMPLETE
1273,0.429192379018369,2025-03-03 19:31:36.792141,2025-03-03 19:31:36.998122,0 days 00:00:00.205981,gaussian_mixture,abundance,2.15,2,COMPLETE
1274,0.49133673324745314,2025-03-03 19:31:36.999121,2025-03-03 19:31:37.204381,0 days 00:00:00.205260,gaussian_mixture,abundance,2.25,3,COMPLETE
1275,0.44234001685136715,2025-03-03 19:31:37.206381,2025-03-03 19:31:37.408052,0 days 00:00:00.201671,gaussian_mixture,abundance,2.15,2,COMPLETE
1276,0.5678260201091435,2025-03-03 19:31:37.410064,2025-03-03 19:31:37.614199,0 days 00:00:00.204135,gaussian_mixture,abundance,2.2,2,COMPLETE
1277,0.48973770107314013,2025-03-03 19:31:37.615199,2025-03-03 19:31:37.826812,0 days 00:00:00.211613,gaussian_mixture,abundance,2.1,2,COMPLETE
1278,0.5422224289737535,2025-03-03 19:31:37.827814,2025-03-03 19:31:38.033759,0 days 00:00:00.205945,gaussian_mixture,abundance,2.25,2,COMPLETE
1279,0.36699895403153093,2025-03-03 19:31:38.034759,2025-03-03 19:31:38.238248,0 days 00:00:00.203489,gaussian_mixture,abundance,2.0500000000000003,2,COMPLETE
1280,0.5286016495770394,2025-03-03 19:31:38.240246,2025-03-03 19:31:38.450335,0 days 00:00:00.210089,gaussian_mixture,abundance,2.15,2,COMPLETE
1281,0.055812962932578966,2025-03-03 19:31:38.452333,2025-03-03 19:31:39.544731,0 days 00:00:01.092398,gaussian_mixture,presence,110.0,2,COMPLETE
1282,0.4987276316096107,2025-03-03 19:31:39.546731,2025-03-03 19:31:39.758798,0 days 00:00:00.212067,gaussian_mixture,abundance,2.3000000000000003,4,COMPLETE
1283,0.5883002885292854,2025-03-03 19:31:39.759804,2025-03-03 19:31:39.971202,0 days 00:00:00.211398,gaussian_mixture,abundance,2.25,2,COMPLETE
1284,0.45018323072452915,2025-03-03 19:31:39.973200,2025-03-03 19:31:40.177343,0 days 00:00:00.204143,gaussian_mixture,abundance,2.2,2,COMPLETE
1285,0.5050262009973064,2025-03-03 19:31:40.179329,2025-03-03 19:31:40.389224,0 days 00:00:00.209895,gaussian_mixture,abundance,2.1,2,COMPLETE
1286,0.43674372751374424,2025-03-03 19:31:40.391212,2025-03-03 19:31:40.596960,0 days 00:00:00.205748,gaussian_mixture,abundance,2.2,2,COMPLETE
1287,0.31777347849861437,2025-03-03 19:31:40.597960,2025-03-03 19:31:40.797287,0 days 00:00:00.199327,kmeans,abundance,2.3000000000000003,2,COMPLETE
1288,0.4446846075417337,2025-03-03 19:31:40.799287,2025-03-03 19:31:41.020225,0 days 00:00:00.220938,gaussian_mixture,abundance,2.15,2,COMPLETE
1289,0.5981937142271141,2025-03-03 19:31:41.022225,2025-03-03 19:31:41.232654,0 days 00:00:00.210429,gaussian_mixture,abundance,2.25,2,COMPLETE
1290,0.5560867552486879,2025-03-03 19:31:41.233654,2025-03-03 19:31:41.442978,0 days 00:00:00.209324,gaussian_mixture,abundance,2.1,2,COMPLETE
1291,0.47229446760738314,2025-03-03 19:31:41.443975,2025-03-03 19:31:41.648092,0 days 00:00:00.204117,gaussian_mixture,abundance,2.25,2,COMPLETE
1292,0.41124316499748215,2025-03-03 19:31:41.650092,2025-03-03 19:31:41.857476,0 days 00:00:00.207384,gaussian_mixture,abundance,2.35,2,COMPLETE
1293,0.3377121232093833,2025-03-03 19:31:41.859487,2025-03-03 19:31:42.066446,0 days 00:00:00.206959,gaussian_mixture,abundance,1.6500000000000001,2,COMPLETE
1294,0.5070897916184002,2025-03-03 19:31:42.068446,2025-03-03 19:31:42.276608,0 days 00:00:00.208162,gaussian_mixture,abundance,2.0500000000000003,2,COMPLETE
1295,0.47636973011449496,2025-03-03 19:31:42.277608,2025-03-03 19:31:42.483143,0 days 00:00:00.205535,gaussian_mixture,abundance,2.2,2,COMPLETE
1296,0.5767385668903693,2025-03-03 19:31:42.485156,2025-03-03 19:31:42.714632,0 days 00:00:00.229476,gaussian_mixture,abundance,2.15,2,COMPLETE
1297,0.5335575114872793,2025-03-03 19:31:42.715632,2025-03-03 19:31:42.923781,0 days 00:00:00.208149,gaussian_mixture,abundance,2.3000000000000003,2,COMPLETE
1298,0.36073815620828376,2025-03-03 19:31:42.925780,2025-03-03 19:31:43.145104,0 days 00:00:00.219324,gaussian_mixture,abundance,2.15,2,COMPLETE
1299,0.5888169827192098,2025-03-03 19:31:43.146191,2025-03-03 19:31:43.385718,0 days 00:00:00.239527,gaussian_mixture,abundance,2.35,2,COMPLETE
1300,0.0066896091740676015,2025-03-03 19:31:43.386718,2025-03-03 19:31:44.768269,0 days 00:00:01.381551,gaussian_mixture,presence,10.0,2,COMPLETE
1301,0.4949395101765262,2025-03-03 19:31:44.770256,2025-03-03 19:31:44.973399,0 days 00:00:00.203143,gaussian_mixture,abundance,2.2,2,COMPLETE
1302,0.7070934972567843,2025-03-03 19:31:44.975387,2025-03-03 19:31:45.182392,0 days 00:00:00.207005,gaussian_mixture,abundance,2.25,2,COMPLETE
1303,0.6355576784367468,2025-03-03 19:31:45.184392,2025-03-03 19:31:45.401488,0 days 00:00:00.217096,gaussian_mixture,abundance,2.35,2,COMPLETE
1304,0.3936670676615192,2025-03-03 19:31:45.402488,2025-03-03 19:31:45.607241,0 days 00:00:00.204753,gaussian_mixture,abundance,2.3000000000000003,2,COMPLETE
1305,0.4142414665928863,2025-03-03 19:31:45.609231,2025-03-03 19:31:45.814356,0 days 00:00:00.205125,gaussian_mixture,abundance,2.3000000000000003,2,COMPLETE
1306,0.34681761559937047,2025-03-03 19:31:45.815356,2025-03-03 19:31:46.040973,0 days 00:00:00.225617,kmeans,abundance,1.55,2,COMPLETE
1307,0.7054126986918515,2025-03-03 19:31:46.042969,2025-03-03 19:31:46.298079,0 days 00:00:00.255110,gaussian_mixture,abundance,2.25,2,COMPLETE
1308,0.3401538487096942,2025-03-03 19:31:46.299080,2025-03-03 19:31:46.502889,0 days 00:00:00.203809,gaussian_mixture,abundance,2.3000000000000003,2,COMPLETE
1309,0.35209810643904854,2025-03-03 19:31:46.503889,2025-03-03 19:31:46.708933,0 days 00:00:00.205044,gaussian_mixture,abundance,2.3000000000000003,2,COMPLETE
1310,0.3490727922625805,2025-03-03 19:31:46.709939,2025-03-03 19:31:46.914614,0 days 00:00:00.204675,gaussian_mixture,abundance,2.35,2,COMPLETE
1311,0.5127851016178004,2025-03-03 19:31:46.916614,2025-03-03 19:31:47.132018,0 days 00:00:00.215404,gaussian_mixture,abundance,2.25,5,COMPLETE
1312,0.38199429701572457,2025-03-03 19:31:47.133018,2025-03-03 19:31:47.336887,0 days 00:00:00.203869,gaussian_mixture,abundance,2.4000000000000004,2,COMPLETE
1313,0.5562115096426888,2025-03-03 19:31:47.338693,2025-03-03 19:31:47.564102,0 days 00:00:00.225409,gaussian_mixture,abundance,2.25,2,COMPLETE
1314,0.20425070458103467,2025-03-03 19:31:47.565909,2025-03-03 19:31:47.770788,0 days 00:00:00.204879,gaussian_mixture,abundance,2.35,2,COMPLETE
1315,0.3739541451976161,2025-03-03 19:31:47.771788,2025-03-03 19:31:47.979683,0 days 00:00:00.207895,gaussian_mixture,abundance,2.25,2,COMPLETE
1316,0.562499959691816,2025-03-03 19:31:47.981682,2025-03-03 19:31:48.183024,0 days 00:00:00.201342,gaussian_mixture,abundance,2.4000000000000004,2,COMPLETE
1317,0.33477672348529486,2025-03-03 19:31:48.185025,2025-03-03 19:31:48.387555,0 days 00:00:00.202530,gaussian_mixture,abundance,2.3000000000000003,2,COMPLETE
1318,0.47219232973728653,2025-03-03 19:31:48.389362,2025-03-03 19:31:48.596492,0 days 00:00:00.207130,gaussian_mixture,abundance,2.35,2,COMPLETE
1319,0.06601510209514544,2025-03-03 19:31:48.598493,2025-03-03 19:31:49.798750,0 days 00:00:01.200257,gaussian_mixture,presence,55.0,2,COMPLETE
1320,0.4600973349745888,2025-03-03 19:31:49.799750,2025-03-03 19:31:50.008803,0 days 00:00:00.209053,gaussian_mixture,abundance,2.25,2,COMPLETE
1321,0.3001551720216996,2025-03-03 19:31:50.010794,2025-03-03 19:31:50.212577,0 days 00:00:00.201783,gaussian_mixture,abundance,2.3000000000000003,2,COMPLETE
1322,0.45428010887071596,2025-03-03 19:31:50.214335,2025-03-03 19:31:50.433471,0 days 00:00:00.219136,gaussian_mixture,abundance,2.25,6,COMPLETE
1323,0.6224100384577351,2025-03-03 19:31:50.434471,2025-03-03 19:31:50.643982,0 days 00:00:00.209511,gaussian_mixture,abundance,2.4000000000000004,2,COMPLETE
1324,0.6269961650770919,2025-03-03 19:31:50.645791,2025-03-03 19:31:50.850117,0 days 00:00:00.204326,gaussian_mixture,abundance,2.3000000000000003,2,COMPLETE
1325,0.2986171684399057,2025-03-03 19:31:50.851117,2025-03-03 19:31:51.052338,0 days 00:00:00.201221,kmeans,abundance,2.35,2,COMPLETE
1326,0.43551002778689424,2025-03-03 19:31:51.053338,2025-03-03 19:31:51.265840,0 days 00:00:00.212502,gaussian_mixture,abundance,2.25,3,COMPLETE
1327,0.7296597712096574,2025-03-03 19:31:51.266840,2025-03-03 19:31:51.472971,0 days 00:00:00.206131,gaussian_mixture,abundance,2.4000000000000004,2,COMPLETE
1328,0.4677329352043273,2025-03-03 19:31:51.473972,2025-03-03 19:31:51.686576,0 days 00:00:00.212604,gaussian_mixture,abundance,2.45,2,COMPLETE
1329,0.5471353194973152,2025-03-03 19:31:51.688166,2025-03-03 19:31:51.901856,0 days 00:00:00.213690,gaussian_mixture,abundance,2.4000000000000004,2,COMPLETE
1330,0.4205405627971196,2025-03-03 19:31:51.902856,2025-03-03 19:31:52.108950,0 days 00:00:00.206094,gaussian_mixture,abundance,2.45,2,COMPLETE
1331,0.5345080188334966,2025-03-03 19:31:52.110961,2025-03-03 19:31:52.323345,0 days 00:00:00.212384,gaussian_mixture,abundance,2.4000000000000004,2,COMPLETE
1332,0.5059476514216298,2025-03-03 19:31:52.324344,2025-03-03 19:31:52.540330,0 days 00:00:00.215986,gaussian_mixture,abundance,2.45,2,COMPLETE
