number,value,datetime_start,datetime_complete,duration,params_algorithm,params_filter_criteria,params_filter_threshold,params_k,state
888,0.24487953732826137,2025-03-03 19:29:54.802760,2025-03-03 19:29:54.998418,0 days 00:00:00.195658,gaussian_mixture,abundance,2.15,2,COMPLETE
889,0.28645931007768594,2025-03-03 19:29:54.999429,2025-03-03 19:29:55.190507,0 days 00:00:00.191078,gaussian_mixture,abundance,2.3000000000000003,2,COMPLETE
890,0.17502680768146736,2025-03-03 19:29:55.191506,2025-03-03 19:29:55.385567,0 days 00:00:00.194061,gaussian_mixture,abundance,2.0,2,COMPLETE
891,0.6634017623408495,2025-03-03 19:29:55.386570,2025-03-03 19:29:55.582628,0 days 00:00:00.196058,gaussian_mixture,abundance,2.2,2,COMPLETE
892,0.2172889996999047,2025-03-03 19:29:55.583632,2025-03-03 19:29:55.779908,0 days 00:00:00.196276,gaussian_mixture,abundance,2.3000000000000003,2,COMPLETE
893,0.5737997029582915,2025-03-03 19:29:55.780898,2025-03-03 19:29:55.986873,0 days 00:00:00.205975,gaussian_mixture,abundance,2.0500000000000003,2,COMPLETE
894,0.3406704617976538,2025-03-03 19:29:55.988654,2025-03-03 19:29:56.181755,0 days 00:00:00.193101,gaussian_mixture,abundance,1.9500000000000002,2,COMPLETE
895,0.36459671460308385,2025-03-03 19:29:56.183749,2025-03-03 19:29:56.381039,0 days 00:00:00.197290,gaussian_mixture,abundance,1.85,2,COMPLETE
896,0.27932259674116977,2025-03-03 19:29:56.383035,2025-03-03 19:29:56.580524,0 days 00:00:00.197489,gaussian_mixture,abundance,2.15,2,COMPLETE
897,0.6209058061007309,2025-03-03 19:29:56.581529,2025-03-03 19:29:56.785349,0 days 00:00:00.203820,gaussian_mixture,abundance,2.25,2,COMPLETE
898,0.48783077028664196,2025-03-03 19:29:56.786159,2025-03-03 19:29:56.980375,0 days 00:00:00.194216,gaussian_mixture,abundance,2.5500000000000003,2,COMPLETE
899,0.49665697984160906,2025-03-03 19:29:56.981365,2025-03-03 19:29:57.177441,0 days 00:00:00.196076,gaussian_mixture,abundance,1.9000000000000001,2,COMPLETE
900,0.0743450887578116,2025-03-03 19:29:57.178445,2025-03-03 19:29:58.258351,0 days 00:00:01.079906,gaussian_mixture,presence,115.0,2,COMPLETE
901,0.505587881977325,2025-03-03 19:29:58.259352,2025-03-03 19:29:58.457961,0 days 00:00:00.198609,gaussian_mixture,abundance,2.35,2,COMPLETE
902,0.5846018259811949,2025-03-03 19:29:58.458957,2025-03-03 19:29:58.665213,0 days 00:00:00.206256,gaussian_mixture,abundance,2.1,2,COMPLETE
903,0.608485789202649,2025-03-03 19:29:58.667209,2025-03-03 19:29:58.884273,0 days 00:00:00.217064,gaussian_mixture,abundance,2.2,5,COMPLETE
904,0.46861881120520615,2025-03-03 19:29:58.885279,2025-03-03 19:29:59.089346,0 days 00:00:00.204067,gaussian_mixture,abundance,2.0500000000000003,2,COMPLETE
905,0.39716933815689365,2025-03-03 19:29:59.090360,2025-03-03 19:29:59.277875,0 days 00:00:00.187515,kmeans,abundance,2.4000000000000004,2,COMPLETE
906,0.5492940342271619,2025-03-03 19:29:59.278878,2025-03-03 19:29:59.474943,0 days 00:00:00.196065,gaussian_mixture,abundance,2.5,2,COMPLETE
907,0.478720350407178,2025-03-03 19:29:59.476938,2025-03-03 19:29:59.671278,0 days 00:00:00.194340,gaussian_mixture,abundance,2.0,2,COMPLETE
908,0.5552270288060785,2025-03-03 19:29:59.672280,2025-03-03 19:29:59.871343,0 days 00:00:00.199063,gaussian_mixture,abundance,2.15,2,COMPLETE
909,0.21921021805830523,2025-03-03 19:29:59.872351,2025-03-03 19:30:00.080264,0 days 00:00:00.207913,gaussian_mixture,abundance,2.25,2,COMPLETE
910,0.36214707298990373,2025-03-03 19:30:00.082259,2025-03-03 19:30:00.290426,0 days 00:00:00.208167,gaussian_mixture,abundance,1.9500000000000002,2,COMPLETE
911,0.45262462392972064,2025-03-03 19:30:00.292422,2025-03-03 19:30:00.488492,0 days 00:00:00.196070,gaussian_mixture,abundance,2.3000000000000003,2,COMPLETE
912,0.373455044952371,2025-03-03 19:30:00.489493,2025-03-03 19:30:00.695781,0 days 00:00:00.206288,gaussian_mixture,abundance,2.15,4,COMPLETE
913,0.36194552587672957,2025-03-03 19:30:00.696593,2025-03-03 19:30:00.900725,0 days 00:00:00.204132,gaussian_mixture,abundance,2.1,3,COMPLETE
914,0.3045552692818279,2025-03-03 19:30:00.901725,2025-03-03 19:30:01.097103,0 days 00:00:00.195378,gaussian_mixture,abundance,2.2,2,COMPLETE
915,0.5948596584458474,2025-03-03 19:30:01.098103,2025-03-03 19:30:01.296382,0 days 00:00:00.198279,gaussian_mixture,abundance,2.35,2,COMPLETE
916,0.538669420832098,2025-03-03 19:30:01.298381,2025-03-03 19:30:01.494796,0 days 00:00:00.196415,gaussian_mixture,abundance,2.0,2,COMPLETE
917,0.5103312357157352,2025-03-03 19:30:01.495793,2025-03-03 19:30:01.694407,0 days 00:00:00.198614,gaussian_mixture,abundance,2.0500000000000003,2,COMPLETE
918,0.06477113610976507,2025-03-03 19:30:01.696409,2025-03-03 19:30:01.888701,0 days 00:00:00.192292,gaussian_mixture,abundance,2.25,2,COMPLETE
919,0.5117279433635515,2025-03-03 19:30:01.889696,2025-03-03 19:30:02.091775,0 days 00:00:00.202079,gaussian_mixture,abundance,1.85,2,COMPLETE
920,0.013364096695831985,2025-03-03 19:30:02.093771,2025-03-03 19:30:03.456838,0 days 00:00:01.363067,gaussian_mixture,presence,10.0,2,COMPLETE
921,0.5161056256153067,2025-03-03 19:30:03.458837,2025-03-03 19:30:03.658533,0 days 00:00:00.199696,gaussian_mixture,abundance,2.5,2,COMPLETE
922,0.6282619979114271,2025-03-03 19:30:03.659336,2025-03-03 19:30:03.858461,0 days 00:00:00.199125,gaussian_mixture,abundance,2.1,2,COMPLETE
923,0.5689804088422905,2025-03-03 19:30:03.859466,2025-03-03 19:30:04.065613,0 days 00:00:00.206147,gaussian_mixture,abundance,1.9500000000000002,2,COMPLETE
924,0.32318252591541385,2025-03-03 19:30:04.067607,2025-03-03 19:30:04.298952,0 days 00:00:00.231345,kmeans,abundance,2.2,2,COMPLETE
925,0.17558950053332661,2025-03-03 19:30:04.299961,2025-03-03 19:30:04.510772,0 days 00:00:00.210811,gaussian_mixture,abundance,2.5500000000000003,2,COMPLETE
926,0.3001152586334287,2025-03-03 19:30:04.511753,2025-03-03 19:30:04.704430,0 days 00:00:00.192677,gaussian_mixture,abundance,2.6,2,COMPLETE
927,0.5467051514662911,2025-03-03 19:30:04.705430,2025-03-03 19:30:04.903712,0 days 00:00:00.198282,gaussian_mixture,abundance,2.4000000000000004,2,COMPLETE
928,0.616500691667634,2025-03-03 19:30:04.904722,2025-03-03 19:30:05.104246,0 days 00:00:00.199524,gaussian_mixture,abundance,1.9000000000000001,2,COMPLETE
929,0.4772375243107872,2025-03-03 19:30:05.105268,2025-03-03 19:30:05.302310,0 days 00:00:00.197042,gaussian_mixture,abundance,2.3000000000000003,2,COMPLETE
930,0.3605426825061667,2025-03-03 19:30:05.303311,2025-03-03 19:30:05.498576,0 days 00:00:00.195265,gaussian_mixture,abundance,2.2,2,COMPLETE
931,0.36288555082789065,2025-03-03 19:30:05.499571,2025-03-03 19:30:05.696680,0 days 00:00:00.197109,gaussian_mixture,abundance,2.1,2,COMPLETE
932,0.5890076989921553,2025-03-03 19:30:05.697675,2025-03-03 19:30:05.902970,0 days 00:00:00.205295,gaussian_mixture,abundance,2.0500000000000003,2,COMPLETE
933,0.6997070428222841,2025-03-03 19:30:05.904764,2025-03-03 19:30:06.102891,0 days 00:00:00.198127,gaussian_mixture,abundance,2.25,2,COMPLETE
934,0.6210504632471086,2025-03-03 19:30:06.104894,2025-03-03 19:30:06.302024,0 days 00:00:00.197130,gaussian_mixture,abundance,2.3000000000000003,2,COMPLETE
935,0.7189251340886795,2025-03-03 19:30:06.303027,2025-03-03 19:30:06.507113,0 days 00:00:00.204086,gaussian_mixture,abundance,2.25,2,COMPLETE
936,0.5888190231548327,2025-03-03 19:30:06.509106,2025-03-03 19:30:06.716402,0 days 00:00:00.207296,gaussian_mixture,abundance,2.3000000000000003,2,COMPLETE
937,0.4804401646879093,2025-03-03 19:30:06.717396,2025-03-03 19:30:06.925392,0 days 00:00:00.207996,gaussian_mixture,abundance,2.25,5,COMPLETE
938,0.27248939739391087,2025-03-03 19:30:06.927391,2025-03-03 19:30:07.119939,0 days 00:00:00.192548,gaussian_mixture,abundance,2.35,2,COMPLETE
939,0.4331935104842075,2025-03-03 19:30:07.120947,2025-03-03 19:30:07.322581,0 days 00:00:00.201634,gaussian_mixture,abundance,2.35,3,COMPLETE
940,0.546462941197584,2025-03-03 19:30:07.324577,2025-03-03 19:30:07.522638,0 days 00:00:00.198061,gaussian_mixture,abundance,2.25,2,COMPLETE
941,0.017588419548849193,2025-03-03 19:30:07.524635,2025-03-03 19:30:08.851659,0 days 00:00:01.327024,gaussian_mixture,presence,10.0,2,COMPLETE
942,0.4970753466490504,2025-03-03 19:30:08.852660,2025-03-03 19:30:09.049125,0 days 00:00:00.196465,gaussian_mixture,abundance,2.3000000000000003,2,COMPLETE
943,0.6407477641854399,2025-03-03 19:30:09.051112,2025-03-03 19:30:09.249087,0 days 00:00:00.197975,gaussian_mixture,abundance,2.25,2,COMPLETE
944,0.38548321509380024,2025-03-03 19:30:09.249893,2025-03-03 19:30:09.438172,0 days 00:00:00.188279,kmeans,abundance,2.4000000000000004,2,COMPLETE
945,0.1991838108279363,2025-03-03 19:30:09.439172,2025-03-03 19:30:09.630572,0 days 00:00:00.191400,gaussian_mixture,abundance,2.25,2,COMPLETE
946,0.5966284709591211,2025-03-03 19:30:09.631880,2025-03-03 19:30:09.827228,0 days 00:00:00.195348,gaussian_mixture,abundance,2.3000000000000003,2,COMPLETE
947,0.5344236806435637,2025-03-03 19:30:09.829229,2025-03-03 19:30:10.023308,0 days 00:00:00.194079,gaussian_mixture,abundance,2.35,2,COMPLETE
948,0.6123890108326364,2025-03-03 19:30:10.024637,2025-03-03 19:30:10.219256,0 days 00:00:00.194619,gaussian_mixture,abundance,2.25,2,COMPLETE
949,0.42950025237701306,2025-03-03 19:30:10.220256,2025-03-03 19:30:10.415648,0 days 00:00:00.195392,gaussian_mixture,abundance,2.2,2,COMPLETE
950,0.21508136014867962,2025-03-03 19:30:10.416648,2025-03-03 19:30:10.611355,0 days 00:00:00.194707,gaussian_mixture,abundance,2.2,2,COMPLETE
951,0.6242783886556298,2025-03-03 19:30:10.612355,2025-03-03 19:30:10.816780,0 days 00:00:00.204425,gaussian_mixture,abundance,2.4000000000000004,2,COMPLETE
952,0.38897762804157854,2025-03-03 19:30:10.818386,2025-03-03 19:30:11.026542,0 days 00:00:00.208156,gaussian_mixture,abundance,2.3000000000000003,2,COMPLETE
953,0.42246951851149694,2025-03-03 19:30:11.028542,2025-03-03 19:30:11.223730,0 days 00:00:00.195188,gaussian_mixture,abundance,2.35,2,COMPLETE
954,0.3606087809038616,2025-03-03 19:30:11.225545,2025-03-03 19:30:11.419480,0 days 00:00:00.193935,gaussian_mixture,abundance,2.25,2,COMPLETE
955,0.5077897427343112,2025-03-03 19:30:11.420480,2025-03-03 19:30:11.618892,0 days 00:00:00.198412,gaussian_mixture,abundance,2.2,2,COMPLETE
956,-0.005985616675425573,2025-03-03 19:30:11.619892,2025-03-03 19:30:12.921554,0 days 00:00:01.301662,gaussian_mixture,presence,10.0,2,COMPLETE
957,0.4056627077344925,2025-03-03 19:30:12.922554,2025-03-03 19:30:13.135908,0 days 00:00:00.213354,gaussian_mixture,abundance,2.4000000000000004,2,COMPLETE
958,0.2958447402777799,2025-03-03 19:30:13.136913,2025-03-03 19:30:13.331049,0 days 00:00:00.194136,gaussian_mixture,abundance,2.5,2,COMPLETE
959,0.42427047048752564,2025-03-03 19:30:13.332049,2025-03-03 19:30:13.523839,0 days 00:00:00.191790,gaussian_mixture,abundance,2.3000000000000003,2,COMPLETE
960,0.6258134337237375,2025-03-03 19:30:13.524834,2025-03-03 19:30:13.722094,0 days 00:00:00.197260,gaussian_mixture,abundance,2.2,2,COMPLETE
961,0.30010860939484474,2025-03-03 19:30:13.723094,2025-03-03 19:30:13.915450,0 days 00:00:00.192356,gaussian_mixture,abundance,2.45,2,COMPLETE
962,0.3157438687612111,2025-03-03 19:30:13.916206,2025-03-03 19:30:14.115046,0 days 00:00:00.198840,kmeans,abundance,2.25,2,COMPLETE
963,0.3187245543374243,2025-03-03 19:30:14.116049,2025-03-03 19:30:14.344873,0 days 00:00:00.228824,gaussian_mixture,abundance,2.35,2,COMPLETE
964,0.5085116724695992,2025-03-03 19:30:14.346872,2025-03-03 19:30:14.548541,0 days 00:00:00.201669,gaussian_mixture,abundance,2.15,2,COMPLETE
965,0.4814270747796983,2025-03-03 19:30:14.549541,2025-03-03 19:30:14.742008,0 days 00:00:00.192467,gaussian_mixture,abundance,2.2,2,COMPLETE
966,0.31065363136534624,2025-03-03 19:30:14.744009,2025-03-03 19:30:14.937431,0 days 00:00:00.193422,gaussian_mixture,abundance,2.45,2,COMPLETE
967,0.4260227023652696,2025-03-03 19:30:14.938434,2025-03-03 19:30:15.164248,0 days 00:00:00.225814,gaussian_mixture,abundance,0.9,2,COMPLETE
968,0.48519989731768787,2025-03-03 19:30:15.165883,2025-03-03 19:30:15.362639,0 days 00:00:00.196756,gaussian_mixture,abundance,2.3000000000000003,2,COMPLETE
969,0.34887786247605285,2025-03-03 19:30:15.363640,2025-03-03 19:30:15.557978,0 days 00:00:00.194338,gaussian_mixture,abundance,2.25,2,COMPLETE
970,0.460160785238363,2025-03-03 19:30:15.558978,2025-03-03 19:30:15.757261,0 days 00:00:00.198283,gaussian_mixture,abundance,2.35,2,COMPLETE
971,0.378969260807376,2025-03-03 19:30:15.758261,2025-03-03 19:30:15.950644,0 days 00:00:00.192383,gaussian_mixture,abundance,2.5500000000000003,2,COMPLETE
972,0.6135019822801845,2025-03-03 19:30:15.951643,2025-03-03 19:30:16.156808,0 days 00:00:00.205165,gaussian_mixture,abundance,2.2,2,COMPLETE
973,0.5730523645410418,2025-03-03 19:30:16.157813,2025-03-03 19:30:16.369901,0 days 00:00:00.212088,gaussian_mixture,abundance,2.15,4,COMPLETE
974,0.21387357056362505,2025-03-03 19:30:16.371901,2025-03-03 19:30:16.559811,0 days 00:00:00.187910,gaussian_mixture,abundance,2.6500000000000004,2,COMPLETE
975,-0.001810254098216705,2025-03-03 19:30:16.560525,2025-03-03 19:30:17.882978,0 days 00:00:01.322453,gaussian_mixture,presence,10.0,2,COMPLETE
976,0.4172538566663234,2025-03-03 19:30:17.884978,2025-03-03 19:30:18.076558,0 days 00:00:00.191580,gaussian_mixture,abundance,2.3000000000000003,2,COMPLETE
977,0.585996034852422,2025-03-03 19:30:18.078560,2025-03-03 19:30:18.279196,0 days 00:00:00.200636,gaussian_mixture,abundance,2.15,2,COMPLETE
978,0.03188715765484415,2025-03-03 19:30:18.281196,2025-03-03 19:30:18.528072,0 days 00:00:00.246876,gaussian_mixture,abundance,0.25,2,COMPLETE
979,0.4301756255935894,2025-03-03 19:30:18.529072,2025-03-03 19:30:18.730324,0 days 00:00:00.201252,gaussian_mixture,abundance,2.4000000000000004,2,COMPLETE
980,0.3070002100932018,2025-03-03 19:30:18.731122,2025-03-03 19:30:18.924256,0 days 00:00:00.193134,gaussian_mixture,abundance,2.5,2,COMPLETE
981,0.21981541065883983,2025-03-03 19:30:18.925255,2025-03-03 19:30:19.116918,0 days 00:00:00.191663,kmeans,abundance,2.25,2,COMPLETE
982,0.27511054931210355,2025-03-03 19:30:19.117918,2025-03-03 19:30:19.314328,0 days 00:00:00.196410,gaussian_mixture,abundance,2.2,2,COMPLETE
983,0.4528170230548675,2025-03-03 19:30:19.316328,2025-03-03 19:30:19.524485,0 days 00:00:00.208157,gaussian_mixture,abundance,2.6,2,COMPLETE
984,0.5691169393529935,2025-03-03 19:30:19.525499,2025-03-03 19:30:19.722616,0 days 00:00:00.197117,gaussian_mixture,abundance,2.3000000000000003,2,COMPLETE
985,0.48133909622163873,2025-03-03 19:30:19.724622,2025-03-03 19:30:19.918727,0 days 00:00:00.194105,gaussian_mixture,abundance,2.4000000000000004,2,COMPLETE
986,0.4838734445715609,2025-03-03 19:30:19.920727,2025-03-03 19:30:20.117852,0 days 00:00:00.197125,gaussian_mixture,abundance,2.15,2,COMPLETE
987,0.45717037381574654,2025-03-03 19:30:20.118853,2025-03-03 19:30:20.314176,0 days 00:00:00.195323,gaussian_mixture,abundance,2.25,2,COMPLETE
988,0.579756162367811,2025-03-03 19:30:20.315983,2025-03-03 19:30:20.511313,0 days 00:00:00.195330,gaussian_mixture,abundance,2.45,2,COMPLETE
989,0.5442672519133345,2025-03-03 19:30:20.513118,2025-03-03 19:30:20.707559,0 days 00:00:00.194441,gaussian_mixture,abundance,2.35,2,COMPLETE
990,0.41202386792503304,2025-03-03 19:30:20.709535,2025-03-03 19:30:20.905439,0 days 00:00:00.195904,gaussian_mixture,abundance,2.15,2,COMPLETE
991,0.2720565099163748,2025-03-03 19:30:20.907247,2025-03-03 19:30:21.096372,0 days 00:00:00.189125,gaussian_mixture,abundance,2.5500000000000003,2,COMPLETE
992,0.6761824746672186,2025-03-03 19:30:21.097372,2025-03-03 19:30:21.295699,0 days 00:00:00.198327,gaussian_mixture,abundance,2.25,2,COMPLETE
993,0.4495268751224522,2025-03-03 19:30:21.296699,2025-03-03 19:30:21.490832,0 days 00:00:00.194133,gaussian_mixture,abundance,2.6500000000000004,2,COMPLETE
994,0.03743018632785288,2025-03-03 19:30:21.492834,2025-03-03 19:30:22.789176,0 days 00:00:01.296342,gaussian_mixture,presence,40.0,2,COMPLETE
995,0.7008573203596798,2025-03-03 19:30:22.791177,2025-03-03 19:30:22.990421,0 days 00:00:00.199244,gaussian_mixture,abundance,2.2,2,COMPLETE
996,0.4123824705731856,2025-03-03 19:30:22.991416,2025-03-03 19:30:23.190682,0 days 00:00:00.199266,gaussian_mixture,abundance,2.2,2,COMPLETE
997,0.48519989731768787,2025-03-03 19:30:23.191677,2025-03-03 19:30:23.387133,0 days 00:00:00.195456,gaussian_mixture,abundance,2.15,2,COMPLETE
998,0.3978262000754249,2025-03-03 19:30:23.388133,2025-03-03 19:30:23.584473,0 days 00:00:00.196340,gaussian_mixture,abundance,2.25,2,COMPLETE
999,0.5329328224405173,2025-03-03 19:30:23.585473,2025-03-03 19:30:23.794725,0 days 00:00:00.209252,gaussian_mixture,abundance,2.2,2,COMPLETE
1000,0.6070671472098831,2025-03-03 19:30:23.795724,2025-03-03 19:30:24.008404,0 days 00:00:00.212680,gaussian_mixture,abundance,2.15,3,COMPLETE
1001,0.4006341767583722,2025-03-03 19:30:24.010400,2025-03-03 19:30:24.218561,0 days 00:00:00.208161,kmeans,abundance,2.3000000000000003,2,COMPLETE
1002,0.5059205182470914,2025-03-03 19:30:24.220561,2025-03-03 19:30:24.419802,0 days 00:00:00.199241,gaussian_mixture,abundance,2.2,2,COMPLETE
1003,0.6182530169166588,2025-03-03 19:30:24.421799,2025-03-03 19:30:24.622219,0 days 00:00:00.200420,gaussian_mixture,abundance,2.25,2,COMPLETE
1004,0.5985513060060107,2025-03-03 19:30:24.623931,2025-03-03 19:30:24.818604,0 days 00:00:00.194673,gaussian_mixture,abundance,2.3000000000000003,2,COMPLETE
1005,0.7008573203596798,2025-03-03 19:30:24.820409,2025-03-03 19:30:25.018803,0 days 00:00:00.198394,gaussian_mixture,abundance,2.15,2,COMPLETE
1006,0.6241485947077868,2025-03-03 19:30:25.019808,2025-03-03 19:30:25.220018,0 days 00:00:00.200210,gaussian_mixture,abundance,2.15,2,COMPLETE
1007,0.31342164122326344,2025-03-03 19:30:25.221018,2025-03-03 19:30:25.418574,0 days 00:00:00.197556,gaussian_mixture,abundance,2.2,2,COMPLETE
1008,0.46025192492130473,2025-03-03 19:30:25.419573,2025-03-03 19:30:25.617740,0 days 00:00:00.198167,gaussian_mixture,abundance,2.15,2,COMPLETE
1009,0.534701634953791,2025-03-03 19:30:25.619506,2025-03-03 19:30:25.831095,0 days 00:00:00.211589,gaussian_mixture,abundance,2.15,2,COMPLETE
1010,0.3652564110527933,2025-03-03 19:30:25.832173,2025-03-03 19:30:26.033146,0 days 00:00:00.200973,gaussian_mixture,abundance,2.1,2,COMPLETE
1011,0.4896949100640466,2025-03-03 19:30:26.034951,2025-03-03 19:30:26.229080,0 days 00:00:00.194129,gaussian_mixture,abundance,2.25,2,COMPLETE
1012,0.2129831184400668,2025-03-03 19:30:26.231080,2025-03-03 19:30:26.424200,0 days 00:00:00.193120,gaussian_mixture,abundance,2.2,2,COMPLETE
1013,0.6656992490383477,2025-03-03 19:30:26.426201,2025-03-03 19:30:26.625862,0 days 00:00:00.199661,gaussian_mixture,abundance,2.1,2,COMPLETE
1014,-0.007711287400585044,2025-03-03 19:30:26.627881,2025-03-03 19:30:27.957400,0 days 00:00:01.329519,gaussian_mixture,presence,10.0,2,COMPLETE
1015,0.6651697564734274,2025-03-03 19:30:27.958996,2025-03-03 19:30:28.162745,0 days 00:00:00.203749,gaussian_mixture,abundance,2.2,2,COMPLETE
1016,0.4446846075417337,2025-03-03 19:30:28.163745,2025-03-03 19:30:28.357191,0 days 00:00:00.193446,gaussian_mixture,abundance,2.3000000000000003,2,COMPLETE
1017,0.31694756735756335,2025-03-03 19:30:28.359196,2025-03-03 19:30:28.558706,0 days 00:00:00.199510,gaussian_mixture,abundance,2.25,2,COMPLETE
1018,0.46025192492130473,2025-03-03 19:30:28.560505,2025-03-03 19:30:28.758116,0 days 00:00:00.197611,gaussian_mixture,abundance,2.15,2,COMPLETE
1019,0.49098767901192364,2025-03-03 19:30:28.760111,2025-03-03 19:30:28.955607,0 days 00:00:00.195496,gaussian_mixture,abundance,2.35,2,COMPLETE
1020,0.500189896019951,2025-03-03 19:30:28.956612,2025-03-03 19:30:29.148291,0 days 00:00:00.191679,kmeans,abundance,2.2,2,COMPLETE
1021,0.557593491400986,2025-03-03 19:30:29.149089,2025-03-03 19:30:29.347744,0 days 00:00:00.198655,gaussian_mixture,abundance,2.1,2,COMPLETE
1022,0.46544181969674436,2025-03-03 19:30:29.348745,2025-03-03 19:30:29.545108,0 days 00:00:00.196363,gaussian_mixture,abundance,2.25,2,COMPLETE
1023,0.5458330354905832,2025-03-03 19:30:29.546130,2025-03-03 19:30:29.741156,0 days 00:00:00.195026,gaussian_mixture,abundance,2.3000000000000003,2,COMPLETE
1024,0.7370462256441576,2025-03-03 19:30:29.743156,2025-03-03 19:30:29.946440,0 days 00:00:00.203284,gaussian_mixture,abundance,2.15,2,COMPLETE
1025,0.17533795046459175,2025-03-03 19:30:29.948200,2025-03-03 19:30:30.151253,0 days 00:00:00.203053,gaussian_mixture,abundance,2.15,2,COMPLETE
1026,0.3705395121178718,2025-03-03 19:30:30.152925,2025-03-03 19:30:30.395657,0 days 00:00:00.242732,gaussian_mixture,abundance,0.4,2,COMPLETE
1027,0.47664196895740735,2025-03-03 19:30:30.397656,2025-03-03 19:30:30.594437,0 days 00:00:00.196781,gaussian_mixture,abundance,2.25,2,COMPLETE
1028,0.5190626022964747,2025-03-03 19:30:30.596437,2025-03-03 19:30:30.798657,0 days 00:00:00.202220,gaussian_mixture,abundance,2.35,2,COMPLETE
1029,0.6154219408143303,2025-03-03 19:30:30.799657,2025-03-03 19:30:31.000821,0 days 00:00:00.201164,gaussian_mixture,abundance,2.1,2,COMPLETE
1030,0.47808694700731336,2025-03-03 19:30:31.002623,2025-03-03 19:30:31.198657,0 days 00:00:00.196034,gaussian_mixture,abundance,2.2,2,COMPLETE
1031,0.6501832307245292,2025-03-03 19:30:31.199657,2025-03-03 19:30:31.397302,0 days 00:00:00.197645,gaussian_mixture,abundance,2.3000000000000003,2,COMPLETE
1032,0.30068360137913014,2025-03-03 19:30:31.399108,2025-03-03 19:30:31.596915,0 days 00:00:00.197807,gaussian_mixture,abundance,2.2,2,COMPLETE
1033,0.060364080645357275,2025-03-03 19:30:31.597910,2025-03-03 19:30:32.949336,0 days 00:00:01.351426,gaussian_mixture,presence,30.0,2,COMPLETE
1034,0.5448990327911045,2025-03-03 19:30:32.950354,2025-03-03 19:30:33.151976,0 days 00:00:00.201622,gaussian_mixture,abundance,2.1,2,COMPLETE
1035,0.466616986428478,2025-03-03 19:30:33.152976,2025-03-03 19:30:33.375666,0 days 00:00:00.222690,gaussian_mixture,abundance,2.25,6,COMPLETE
1036,0.5287101912897034,2025-03-03 19:30:33.376664,2025-03-03 19:30:33.619074,0 days 00:00:00.242410,gaussian_mixture,abundance,2.15,2,COMPLETE
